2006,2006-09-20,Viseu,Castro Daire,São Joaninho,S.JOANINHO (SÃO JOANINHO),40.91729505,-7.859615402566296,NC,751.0,2006-09-20T15:00,24.2,42,10.4,21.8,0.0,0.0,0.0,0.0,0,1010.3,927.4,3,3,1,0,0.45,1.75,19.2,25.8,208,207,44.3,26.2,19.7,19.2,18.8,0.159,0.156,0.192,0.316,1,3600.0,545.7,434.0,111.7,725.3,545.7,811.7,596.0,474.0,122.0,725.3,596.0,886.5,Magnoliopsida; Pinus pinaster Aiton
2006,2006-06-03,Viseu,Tondela,Castelões,Areal,40.5357118,-8.1394572,NC,295.0,2006-06-03T14:00,27.8,21,3.3,26.3,0.0,0.0,0.0,0.0,0,1019.1,985.6,0,0,0,0,0.74,2.97,15.3,19.9,66,68,37.8,30.5,21.6,18.4,13.5,0.1,0.181,0.277,0.346,1,3600.0,941.1,829.5,111.6,925.1,941.1,1192.2,970.0,855.0,115.0,925.1,970.0,1228.8,Eucalyptus L'Hér.; Pinus pinaster Aiton; Magnoliopsida; Acacia Mill.; Tracheophyta
2006,2006-03-14,Viseu,Tondela,Barreiro de Besteiros,B.BESTEIROS (BARREIRO DE BESTEIROS),40.50971075,-8.17818196129445,NC,220.0,2006-03-14T14:00,21.7,45,9.1,21.9,0.0,0.0,0.0,0.0,0,1013.2,987.8,20,0,0,65,0.47,1.44,4.8,5.9,193,191,18.0,19.5,12.3,9.8,9.7,0.344,0.362,0.378,0.304,1,3600.0,712.9,622.2,90.7,905.4,712.9,951.5,739.0,645.0,94.0,905.4,739.0,986.3,Pinus pinaster Aiton; Eucalyptus L'Hér.; Tracheophyta; Magnoliopsida
2006,2006-06-05,Viseu,Nelas,Santar,ZONA INDUSTRIAL DE NELAS (SANTAR),40.5651813,-7.898559741459397,Desconhecida,392.0,2006-06-05T14:00,31.2,15,1.4,31.7,0.0,0.0,0.0,0.0,0,1014.0,970.5,0,0,0,0,0.69,3.86,2.3,3.3,108,103,17.3,34.2,22.5,18.4,13.2,0.099,0.206,0.294,0.366,1,3600.0,937.3,826.7,110.6,921.0,937.3,1192.7,966.0,852.0,114.0,921.0,966.0,1229.3,Olea europaea L.; Pinus pinaster Aiton; Vitis vinifera L.; Tracheophyta; Magnoliopsida
2006,2006-06-03,Viseu,Oliveira de Frades,Destriz,Benfeitas,40.6508584,-8.2820723,NC,226.0,2006-06-03T18:00,29.0,23,5.7,25.9,0.0,0.0,0.0,0.0,0,1018.4,992.8,0,0,0,0,0.38,3.08,13.3,19.4,357,359,32.8,29.8,23.3,18.9,14.1,0.101,0.187,0.284,0.37,1,3600.0,311.4,248.6,62.7,720.8,311.4,458.5,392.0,313.0,79.0,720.8,392.0,577.3,Eucalyptus L'Hér.; Pinus pinaster Aiton; Magnoliopsida; Tracheophyta; Quercus L.; Olea europaea L.
2006,2006-06-06,Viseu,Cinfães,Cinfães,alhoes (CINFÃES),41.0721651,-8.0894728,NC,400.0,2006-06-06T01:00,18.3,50,7.6,16.6,0.0,0.0,0.0,0.0,1,1012.8,966.6,29,0,0,97,0.04,1.06,7.3,12.6,81,93,19.4,18.0,21.4,17.4,12.9,0.131,0.184,0.279,0.381,0,0.0,0.0,0.0,0.0,0.0,0.0,0.0,0.0,0.0,0.0,0.0,0.0,0.0,Eucalyptus L'Hér.; Tracheophyta; Pinus pinaster Aiton; Quercus L.; Magnoliopsida
2006,2006-09-10,Viseu,Armamar,Fontelo,FONTELO,41.12164225,-7.73064463699262,NC,560.0,2006-09-10T18:00,22.9,48,11.4,21.9,0.0,0.0,0.0,0.0,0,1019.3,955.9,0,0,0,0,0.16,1.45,10.4,14.6,284,286,33.5,27.9,25.8,23.4,19.8,0.154,0.152,0.165,0.309,1,3600.0,117.0,85.0,32.0,583.0,117.0,196.8,194.0,141.0,53.0,583.0,194.0,326.3,Magnoliopsida; Olea europaea L.; Vitis vinifera L.
2006,2006-03-26,Viseu,Cinfães,Alhões,SENDIM (ALHÕES),40.9846443,-8.013408,NC,1026.0,2006-03-26T14:00,16.1,57,7.5,12.7,0.0,0.0,0.0,0.0,1,1012.1,897.8,24,25,0,4,0.39,0.79,25.6,36.9,206,206,64.4,14.9,9.5,6.9,5.6,0.393,0.404,0.416,0.379,1,3600.0,729.6,598.3,131.2,817.5,729.6,1006.6,756.0,620.0,136.0,817.5,756.0,1043.1,Tracheophyta; Magnoliopsida; Quercus L.; Pinus pinaster Aiton; 
2006,2006-09-20,Viseu,Cinfães,Alhões,Serra de Montemuro,40.9739439,-7.9877718,NC,1357.0,2006-09-20T23:00,10.8,81,7.6,9.3,0.0,0.0,0.0,0.0,1,1006.5,857.0,29,0,0,98,0.0,0.25,5.9,11.5,169,184,22.3,13.4,16.6,15.8,15.2,0.155,0.15,0.188,0.315,0,0.0,0.0,0.0,0.0,0.0,0.0,0.0,0.0,0.0,0.0,0.0,0.0,0.0,Tracheophyta; Magnoliopsida; Quercus L.; Pinus pinaster Aiton; 
2006,2006-04-30,Viseu,Tondela,Mouraz,Ribeira,40.4770455,-8.0691685,NC,283.0,2006-04-30T12:00,19.4,41,5.9,18.9,0.0,0.0,0.0,0.0,0,1011.2,978.4,0,0,0,0,0.55,1.33,11.4,15.1,77,78,33.8,19.8,14.9,14.4,11.2,0.278,0.323,0.369,0.359,1,3600.0,951.0,841.4,109.5,939.7,951.0,1207.6,929.0,822.0,107.0,939.7,929.0,1179.7,Eucalyptus L'Hér.; Magnoliopsida; Tracheophyta; Pinus pinaster Aiton
