year,date,district,municipality,parish,local,latitude,longitude,cause,elevation,hourly.time,hourly.temperature_2m,hourly.relative_humidity_2m,hourly.dew_point_2m,hourly.apparent_temperature,hourly.precipitation,hourly.rain,hourly.snowfall,hourly.snow_depth,hourly.weather_code,hourly.pressure_msl,hourly.surface_pressure,hourly.cloud_cover,hourly.cloud_cover_low,hourly.cloud_cover_mid,hourly.cloud_cover_high,hourly.et0_fao_evapotranspiration,hourly.vapour_pressure_deficit,hourly.wind_speed_10m,hourly.wind_speed_100m,hourly.wind_direction_10m,hourly.wind_direction_100m,hourly.wind_gusts_10m,hourly.soil_temperature_0_to_7cm,hourly.soil_temperature_7_to_28cm,hourly.soil_temperature_28_to_100cm,hourly.soil_temperature_100_to_255cm,hourly.soil_moisture_0_to_7cm,hourly.soil_moisture_7_to_28cm,hourly.soil_moisture_28_to_100cm,hourly.soil_moisture_100_to_255cm,hourly.is_day,hourly.sunshine_duration,hourly.shortwave_radiation_instant,hourly.direct_radiation_instant,hourly.diffuse_radiation_instant,hourly.direct_normal_irradiance_instant,hourly.global_tilted_irradiance_instant,hourly.terrestrial_radiation_instant,hourly.shortwave_radiation,hourly.direct_radiation,hourly.diffuse_radiation,hourly.direct_normal_irradiance,hourly.global_tilted_irradiance,hourly.terrestrial_radiation,scientificNames
2006,2006-08-09,Viseu,Resende,Miomães,MIOMÃES,41.0920399,-8.0081515,NC,255.0,2006-08-09T16:00,32.2,21,6.8,31.5,0.0,0.0,0.0,0.0,0,1011.7,983.3,0,0,0,0,0.55,3.83,6.3,8.2,66,67,25.6,36.0,26.8,23.2,18.7,0.095,0.144,0.218,0.336,1,3600.0,640.3,554.4,85.9,866.9,640.3,851.0,708.0,613.0,95.0,866.9,708.0,941.0,Tracheophyta; Pinales; Magnoliopsida; Eucalyptus L'Hér.; Pinus pinaster Aiton; Olea europaea L.; ; Quercus L.
2006,2006-05-07,Viseu,Viseu,Ranhados,RANHADOS,40.6404554,-7.9065153,NC,449.0,2006-05-07T21:00,9.5,76,5.6,7.5,0.0,0.0,0.0,0.0,1,1019.6,966.0,33,25,3,30,0.0,0.28,6.1,15.3,270,279,19.1,11.6,13.7,13.4,10.8,0.254,0.302,0.358,0.378,0,0.0,0.0,0.0,0.0,0.0,0.0,0.0,0.0,0.0,0.0,0.0,0.0,0.0,Tracheophyta; Pinus pinaster Aiton; Magnoliopsida; Vitis vinifera L.
2006,2006-09-09,Viseu,Cinfães,Fornelos,Cunha,41.0299683,-8.2041691,NC,455.0,2006-09-09T15:00,28.6,43,14.9,29.1,0.0,0.0,0.0,0.0,0,1017.8,966.9,1,0,0,3,0.5,2.22,11.0,14.0,311,312,31.7,32.5,24.9,22.4,19.6,0.105,0.168,0.198,0.317,1,3600.0,594.3,487.8,106.5,743.4,594.3,885.1,642.0,527.0,115.0,743.4,642.0,956.1,Quercus L.; Eucalyptus L'Hér.; Magnoliopsida; Vitis vinifera L.; Tracheophyta; Pinales; 
2006,2006-05-07,Viseu,Vila Nova de Paiva,Pendilhe,V.N.PAIVA (Vale de Paiva),40.9063698,-7.8366812,NC,746.0,2006-05-07T22:00,7.6,83,4.9,5.2,0.0,0.0,0.0,0.0,1,1019.8,932.0,45,18,6,84,0.0,0.18,7.9,18.1,270,276,20.9,10.1,12.3,12.1,9.2,0.274,0.305,0.357,0.379,0,0.0,0.0,0.0,0.0,0.0,0.0,0.0,0.0,0.0,0.0,0.0,0.0,0.0,Magnoliopsida; Tracheophyta; Pinus pinaster Aiton; 
2006,2006-05-10,Viseu,Viseu,Cota,NO DE TEIVAS (Sanguinhedo),40.8043152,-7.8170878,NC,679.0,2006-05-10T11:00,20.9,41,7.3,21.3,0.0,0.0,0.0,0.0,0,1011.8,935.6,0,0,0,0,0.53,1.45,5.1,6.1,129,130,20.2,20.2,13.9,12.3,9.7,0.226,0.282,0.345,0.362,1,3600.0,895.0,781.4,113.6,901.0,895.0,1163.9,851.0,743.0,108.0,901.0,851.0,1106.7,Pinus pinaster Aiton; Eucalyptus L'Hér.
2006,2006-09-09,Viseu,Castro Daire,Gosende,Cotelo,41.0134883,-7.9309345,NC,1042.0,2006-09-09T15:00,25.1,45,12.2,24.6,0.0,0.0,0.0,0.0,0,1018.1,904.8,20,0,11,44,0.4,1.76,8.0,10.2,280,280,27.0,29.7,22.9,20.2,16.9,0.127,0.153,0.189,0.319,1,3600.0,498.6,354.3,144.3,541.5,498.6,882.3,539.0,383.0,156.0,541.5,539.0,953.8,Magnoliopsida; Tracheophyta
2006,2006-05-13,Viseu,Carregal do Sal,Parada,VALE DO BOI (Quinta dos Vales),40.4053191,-8.0446867,NC,263.0,2006-05-13T09:00,15.0,69,9.3,14.1,0.0,0.0,0.0,0.0,1,1020.3,989.1,28,0,0,94,0.21,0.53,4.3,5.4,360,8,15.8,16.7,15.4,14.4,11.5,0.188,0.259,0.331,0.339,1,3600.0,451.1,234.7,216.5,361.9,451.1,869.2,396.0,206.0,190.0,361.9,396.0,763.0,Olea europaea L.; Magnoliopsida; Vitis vinifera L.; Tracheophyta; Eucalyptus L'Hér.; ; Pinus pinaster Aiton; Pinales
2006,2006-06-02,Viseu,Sátão,Ferreira de Aves,Souto,40.8100575,-7.6644267,Desconhecida,673.0,2006-06-02T06:00,10.9,68,5.1,8.3,0.0,0.0,0.0,0.0,0,1022.7,943.8,0,0,0,0,0.04,0.42,9.7,18.2,51,56,18.4,12.8,17.9,16.5,11.5,0.113,0.196,0.283,0.324,1,1731.67,91.5,49.1,42.4,308.0,56.4,211.9,41.0,22.0,19.0,190.0,41.0,95.0,Pinales; Pinus pinaster Aiton; Magnoliopsida
2006,2006-09-09,Viseu,Vila Nova de Paiva,Touro,Touro,40.9401466,-7.7762141,Desconhecida,825.0,2006-09-09T20:00,21.7,60,13.6,21.8,0.0,0.0,0.0,0.0,0,1018.2,926.2,0,0,0,0,0.03,1.04,6.9,8.9,309,320,12.2,23.9,24.6,21.6,18.3,0.145,0.153,0.193,0.316,0,0.0,0.0,0.0,0.0,0.0,0.0,0.0,0.0,0.0,0.0,0.0,0.0,0.0,Magnoliopsida; Pinus pinaster Aiton; Tracheophyta; Eucalyptus L'Hér.; Quercus L.; 
2006,2006-09-14,Viseu,Mangualde,Espinho,Roda,40.5631724,-7.7933634,Desconhecida,424.0,2006-09-14T13:00,18.7,51,8.5,15.6,0.0,0.0,0.0,0.0,1,1014.4,965.5,49,32,34,0,0.39,1.05,21.0,28.4,308,309,48.2,22.5,20.1,23.3,21.2,0.175,0.155,0.204,0.313,1,3600.0,624.4,460.6,163.8,584.6,624.4,1065.3,629.0,464.0,165.0,584.6,629.0,1073.1,Eucalyptus L'Hér.; Tracheophyta; Olea europaea L.; Magnoliopsida; Pinus pinaster Aiton
2006,2006-06-04,Viseu,Resende,São Romão de Aregos,PAREDELHAS (Paredes),41.0877551,-7.9812636,NC,556.0,2006-06-04T00:00,15.9,37,1.3,12.1,0.0,0.0,0.0,0.0,0,1020.4,955.9,0,0,0,0,0.09,1.13,12.5,23.5,78,79,32.4,16.2,19.8,16.6,12.0,0.116,0.204,0.296,0.377,0,0.0,0.0,0.0,0.0,0.0,0.0,0.0,0.0,0.0,0.0,0.0,0.0,0.0,Pinus pinaster Aiton; Magnoliopsida; Pinales
2006,2006-10-13,Viseu,São João da Pesqueira,Paredes da Beira,Relva,41.0647773,-7.4754716,NC,780.0,2006-10-13T16:00,18.5,49,7.5,17.5,0.0,0.0,0.0,0.0,0,1019.6,931.3,0,0,0,0,0.21,1.09,2.5,3.3,98,103,14.4,18.8,14.8,16.7,19.2,0.321,0.318,0.181,0.268,1,3600.0,315.1,257.4,57.7,786.3,315.1,450.0,388.0,317.0,71.0,786.3,388.0,554.2,Magnoliopsida; Olea europaea L.; Tracheophyta; Castanea sativa Mill.; Pinus pinaster Aiton
2006,2006-08-25,Viseu,Oliveira de Frades,Arcozelo das Maias,Feitalinho,40.7353971,-8.2776103,Desconhecida,366.0,2006-08-25T21:00,18.6,88,16.6,19.5,0.0,0.0,0.0,0.0,1,1020.0,977.4,34,21,0,50,0.0,0.25,9.7,18.9,333,339,36.4,21.6,23.2,21.8,20.0,0.17,0.24,0.192,0.316,0,0.0,0.0,0.0,0.0,0.0,0.0,0.0,0.0,0.0,0.0,0.0,0.0,0.0,Eucalyptus L'Hér.; Pinus pinaster Aiton; Magnoliopsida; Tracheophyta; Quercus L.; Olea europaea L.
2006,2006-09-10,Viseu,São Pedro do Sul,Sul,Fujaco,40.8466783,-8.0795148,Desconhecida,497.0,2006-09-10T12:00,24.6,43,11.1,25.4,0.0,0.0,0.0,0.0,0,1020.2,963.9,16,0,0,54,0.54,1.77,6.8,8.0,267,265,24.5,29.1,23.5,22.7,19.8,0.111,0.16,0.19,0.313,1,3600.0,811.2,665.4,145.8,828.7,811.2,1083.4,790.0,648.0,142.0,828.7,790.0,1055.1,Pinus pinaster Aiton; Eucalyptus L'Hér.; Magnoliopsida; Tracheophyta; Quercus L.; Castanea sativa Mill.; Acacia Mill.; 
2006,2006-09-10,Viseu,Castro Daire,Mões,MOES (MÕES),40.867464,-7.885235,NC,650.0,2006-09-10T17:00,23.6,44,10.5,21.7,0.0,0.0,0.0,0.0,0,1018.9,945.9,4,0,0,12,0.3,1.64,13.6,18.4,282,282,35.6,28.3,24.3,22.4,19.2,0.135,0.155,0.193,0.319,1,3600.0,304.4,240.0,64.4,707.5,304.4,457.9,383.0,302.0,81.0,707.5,383.0,576.0,Pinus pinaster Aiton; Tracheophyta; Magnoliopsida
2006,2006-11-11,Viseu,Castro Daire,Mões,Grijó,40.8642533,-7.8849214,NC,649.0,2006-11-11T20:00,11.0,89,9.3,10.1,0.0,0.0,0.0,0.0,0,1029.6,952.9,20,0,0,66,0.0,0.14,4.5,6.4,61,63,10.4,11.1,13.3,14.9,17.6,0.379,0.388,0.4,0.356,0,0.0,0.0,0.0,0.0,0.0,0.0,0.0,0.0,0.0,0.0,0.0,0.0,0.0,Pinus pinaster Aiton; Tracheophyta; Magnoliopsida; Castanea sativa Mill.
2006,2006-09-14,Viseu,Tondela,Ferreirós do Dão,CARVALHAL (Carvalha),40.4725128,-8.0376419,Desconhecida,143.0,2006-09-14T16:00,19.1,54,9.7,16.3,0.0,0.0,0.0,0.0,1,1015.2,998.4,25,15,19,0,0.31,1.01,19.3,26.4,307,308,47.9,22.8,21.0,23.7,21.5,0.218,0.142,0.163,0.277,1,3600.0,411.4,314.0,97.4,636.7,411.4,666.8,473.0,361.0,112.0,636.7,473.0,766.7,Magnoliopsida; Tracheophyta; Pinus pinaster Aiton; Vitis vinifera L.; Eucalyptus L'Hér.
2006,2006-12-24,Viseu,Castro Daire,São Joaninho,S.JOANINHO (SÃO JOANINHO),40.91729505,-7.859615402566296,NC,751.0,2006-12-24T17:00,5.1,73,0.7,1.6,0.0,0.0,0.0,0.0,0,1031.2,941.1,0,0,0,0,0.03,0.24,10.5,14.3,38,47,16.9,2.5,2.0,6.1,12.9,0.36,0.368,0.386,0.414,1,2136.24,4.4,2.9,1.6,32.8,3.2,8.7,62.0,40.0,22.0,337.7,62.0,122.2,Magnoliopsida; Pinus pinaster Aiton
2006,2006-12-27,Viseu,Santa Comba Dão,Santa Comba Dão,RAMAL DE TREIXEDO (SANTA COMBA DÃO),40.399988750000006,-8.131110454043977,NC,193.0,2006-12-27T14:00,13.3,56,4.6,10.1,0.0,0.0,0.0,0.0,0,1027.0,1003.7,3,0,0,9,0.21,0.68,13.4,18.8,114,116,31.3,9.9,5.6,8.3,15.1,0.35,0.359,0.382,0.374,1,3600.0,388.3,320.7,67.5,814.1,388.3,557.2,414.0,342.0,72.0,814.1,414.0,594.1,Tracheophyta; Magnoliopsida; Quercus suber L.; Pinus pinaster Aiton
2006,2006-09-14,Viseu,Nelas,Carvalhal Redondo,CARVALHAL REDONDO,40.53808225,-7.898036302931594,Desconhecida,410.0,2006-09-14T16:00,17.9,54,8.4,14.8,0.0,0.0,0.0,0.0,1,1014.6,967.1,34,24,20,0,0.28,0.95,18.7,25.9,295,297,44.6,21.9,20.3,23.0,21.0,0.179,0.162,0.208,0.319,1,3600.0,365.7,245.8,119.9,501.6,365.7,662.7,421.0,283.0,138.0,501.6,421.0,762.9,Vitis vinifera L.; Tracheophyta; Pinus pinaster Aiton; Magnoliopsida
2006,2006-06-04,Viseu,Vouzela,Vouzela,Monte Cavalo,40.7222193,-8.123967300656087,NC,314.0,2006-06-04T17:00,29.6,21,4.7,28.2,0.0,0.0,0.0,0.0,0,1016.0,980.7,0,0,0,0,0.39,3.29,2.2,2.5,279,270,15.5,31.9,23.0,18.6,13.8,0.103,0.185,0.281,0.36,1,3600.0,501.6,421.2,80.4,811.9,501.6,689.5,580.0,487.0,93.0,811.9,580.0,797.2,Magnoliopsida; Eucalyptus L'Hér.; Tracheophyta; Pinus pinaster Aiton; Quercus L.
2006,2006-05-13,Viseu,São João da Pesqueira,Riodades,RIODADES,41.0072754,-7.4879489,NC,625.0,2006-05-13T11:00,18.2,56,9.4,19.0,0.0,0.0,0.0,0.0,1,1019.8,948.2,31,8,0,79,0.49,0.91,5.6,6.6,75,77,19.1,21.5,15.4,13.5,9.7,0.179,0.234,0.307,0.296,1,3600.0,877.8,701.4,176.4,802.8,877.8,1170.9,836.0,668.0,168.0,802.8,836.0,1115.2,Magnoliopsida; Castanea sativa Mill.; Tracheophyta; Pinus pinaster Aiton
2006,2006-09-04,Viseu,Cinfães,Oliveira Do Douro,MONTE (Montão),38.713902,-9.358365,NC,82.0,2006-09-04T14:00,29.0,45,16.0,31.7,0.0,0.0,0.0,0.0,0,1018.9,1009.5,0,0,0,0,0.62,2.18,8.0,9.0,342,358,18.4,33.3,24.9,22.6,20.9,0.132,0.164,0.213,0.283,1,3600.0,822.5,722.9,99.5,902.9,822.5,1077.1,851.0,748.0,103.0,902.9,851.0,1114.4,Pinus pinaster Aiton; Magnoliopsida; Quercus L.; Tracheophyta; 
2006,2006-09-04,Viseu,Tarouca,Vila Chã da Beira,Murganheira,41.026814,-7.6824048,Desconhecida,878.0,2006-09-04T21:00,24.9,42,11.2,24.0,0.0,0.0,0.0,0.0,0,1020.6,923.8,0,0,0,0,0.07,1.82,8.8,13.4,9,20,17.3,24.7,24.9,20.7,17.8,0.129,0.15,0.179,0.321,0,0.0,0.0,0.0,0.0,0.0,0.0,0.0,0.0,0.0,0.0,0.0,0.0,0.0,Magnoliopsida; Castanea sativa Mill.; Pinus pinaster Aiton; Tracheophyta; Pinales
2006,2006-09-17,Viseu,Viseu,Cota,CÔTA (Sanguinhedo),40.8043152,-7.8170878,NC,679.0,2006-09-17T15:00,21.4,58,12.8,20.6,0.1,0.1,0.0,0.0,51,1018.2,941.6,80,64,36,3,0.34,1.06,11.4,14.0,298,299,28.1,24.0,18.5,20.3,19.5,0.172,0.148,0.186,0.3,1,3600.0,461.1,337.1,124.0,547.5,461.1,833.8,502.0,367.0,135.0,547.5,502.0,907.8,Pinus pinaster Aiton; Eucalyptus L'Hér.
2006,2006-09-18,Viseu,Cinfães,Oliveira Do Douro,BOUSSAS (Boassas),41.03267975,-8.108007450852401,NC,963.0,2006-09-18T18:00,17.3,63,10.2,16.3,0.0,0.0,0.0,0.0,0,1018.6,910.6,1,0,0,3,0.09,0.73,7.6,13.7,301,305,28.1,20.8,18.6,18.2,17.7,0.168,0.157,0.199,0.315,1,3600.0,78.5,54.1,24.4,517.2,78.5,141.6,151.0,104.0,47.0,517.2,151.0,272.5,Pinus pinaster Aiton; Magnoliopsida; Quercus L.; Tracheophyta; 
2006,2006-04-12,Viseu,Moimenta da Beira,Arcozelos,ARCOSELOS (Arcozelo da Torre),40.964923,-7.588698641701325,NC,579.0,2006-04-12T14:00,16.9,42,4.0,16.6,0.0,0.0,0.0,0.0,0,1018.0,951.3,0,0,0,0,0.5,1.12,6.1,7.6,45,45,21.2,18.1,11.2,10.3,8.2,0.328,0.353,0.364,0.299,1,3600.0,836.2,732.0,104.2,926.3,836.2,1076.3,867.0,759.0,108.0,926.3,867.0,1116.0,Tracheophyta; Pinus pinaster Aiton; Castanea sativa Mill.; Magnoliopsida; Quercus L.; Vitis vinifera L.
2006,2006-04-13,Viseu,Castro Daire,Castro Daire,LAMELAS (Lamelas de Cá),40.91465745,-7.920020147736607,NC,660.0,2006-04-13T17:00,18.7,43,5.7,16.8,0.0,0.0,0.0,0.0,0,1015.5,940.5,0,0,0,0,0.28,1.24,5.9,8.1,101,103,24.1,17.5,12.8,10.4,8.3,0.343,0.367,0.397,0.397,1,3600.0,383.4,320.8,62.5,805.6,383.4,542.1,466.0,390.0,76.0,805.6,466.0,659.0,Pinus pinaster Aiton; Magnoliopsida; Pinales; Eucalyptus L'Hér.; Tracheophyta
2006,2006-06-06,Viseu,Tondela,Lajeosa do Dão,LAGEOSA DO DÃO (LAGEOSA),40.5042963,-7.9872116,NC,281.0,2006-06-06T18:00,31.4,25,9.1,29.4,0.0,0.0,0.0,0.0,1,1013.0,981.7,29,0,9,80,0.34,3.43,12.0,16.4,277,279,21.2,31.3,24.6,18.9,13.6,0.097,0.171,0.267,0.338,1,3600.0,248.5,119.1,129.4,345.8,248.5,457.5,313.0,150.0,163.0,345.8,313.0,576.3,Magnoliopsida; Tracheophyta; Pinus pinaster Aiton; Pinales; Eucalyptus L'Hér.
2006,2006-08-10,Viseu,Castro Daire,Cabril,CABRIL,40.93607895,-8.103220796131419,NC,210.0,2006-08-10T07:00,21.1,52,10.8,19.0,0.0,0.0,0.0,0.0,0,1013.6,989.2,8,0,0,27,0.14,1.2,16.2,29.5,90,91,37.1,22.3,26.6,24.6,20.0,0.099,0.14,0.208,0.329,1,3267.28,171.5,109.5,62.1,446.6,162.1,326.2,105.0,67.0,38.0,421.9,105.0,199.7,Magnoliopsida; Pinus pinaster Aiton; Eucalyptus L'Hér.; Pinales; Tracheophyta
2006,2006-09-20,Viseu,Carregal do Sal,Oliveira do Conde,Azenha,40.4309263,-7.966818079780831,NC,282.0,2006-09-20T13:00,26.7,40,12.1,26.8,0.0,0.0,0.0,0.0,0,1012.0,980.1,0,0,0,0,0.56,2.09,12.6,15.9,211,208,31.7,28.6,21.0,21.2,20.7,0.139,0.142,0.163,0.275,1,3600.0,772.6,672.4,100.2,880.7,772.6,1035.8,779.0,678.0,101.0,880.7,779.0,1044.4,Tracheophyta; Pinus pinaster Aiton; Magnoliopsida; Olea europaea L.; Pinales; Acacia Mill.
2006,2006-09-12,Viseu,Castro Daire,Gosende,CAMPO BEMFEITO,41.0083477,-7.9058671,NC,1004.0,2006-09-12T18:00,17.7,59,9.5,15.9,0.0,0.0,0.0,0.0,0,1013.0,901.5,16,1,25,0,0.12,0.83,11.5,17.0,302,302,28.1,21.7,19.9,20.1,17.3,0.129,0.15,0.189,0.318,1,3600.0,81.9,46.6,35.4,337.3,81.9,186.5,139.0,79.0,60.0,337.3,139.0,316.4,Tracheophyta; Magnoliopsida; Pinales
2006,2006-09-11,Viseu,Castro Daire,Gosende,GOSENDE,41.009402,-7.904899345978395,NC,1002.0,2006-09-11T21:00,14.2,85,11.7,13.9,0.0,0.0,0.0,0.0,0,1017.6,904.5,7,0,1,20,0.0,0.25,6.3,9.4,283,293,13.7,17.0,19.8,20.3,17.3,0.129,0.151,0.189,0.318,0,0.0,0.0,0.0,0.0,0.0,0.0,0.0,0.0,0.0,0.0,0.0,0.0,0.0,Tracheophyta; Magnoliopsida; Pinales
2006,2006-08-28,Viseu,Castro Daire,Cabril,Serra de Montemuro,40.95211,-8.1028,NC,504.0,2006-08-28T19:00,23.1,67,16.7,24.5,0.0,0.0,0.0,0.0,0,1018.8,961.6,0,0,0,0,0.06,0.92,6.1,11.5,298,309,22.7,25.3,23.3,20.6,18.9,0.147,0.222,0.206,0.324,1,2702.4,15.5,9.6,6.0,109.7,13.0,32.5,78.0,48.0,30.0,329.3,78.0,162.9,Magnoliopsida; Eucalyptus L'Hér.; Olea europaea L.; Pinales; Pinus pinaster Aiton
2006,2006-06-07,Viseu,São Pedro do Sul,Várzea,Drizes,40.74920385,-8.081602319173324,NC,165.0,2006-06-07T12:00,29.5,34,12.1,30.2,0.0,0.0,0.0,0.0,0,1015.3,996.6,0,0,0,0,0.72,2.71,13.8,17.4,174,173,38.5,32.0,24.2,20.3,15.0,0.101,0.177,0.274,0.357,1,3600.0,956.4,838.9,117.5,887.9,956.4,1254.8,936.0,821.0,115.0,887.9,936.0,1228.0,Magnoliopsida; Eucalyptus L'Hér.; Tracheophyta; Castanea sativa Mill.; Pinus pinaster Aiton; Acacia Mill.; Pinales; Olea europaea L.; Vitis vinifera L.; ; Quercus L.
2006,2006-08-28,Viseu,Resende,Resende,SAO BRAS (Resende),41.105831,-7.9644114,Desconhecida,240.0,2006-08-28T22:00,22.0,76,17.5,24.6,0.0,0.0,0.0,0.0,0,1019.7,991.8,0,0,0,0,0.0,0.65,1.3,5.4,56,8,9.4,22.1,24.3,21.7,19.8,0.129,0.203,0.209,0.326,0,0.0,0.0,0.0,0.0,0.0,0.0,0.0,0.0,0.0,0.0,0.0,0.0,0.0,Tracheophyta; Magnoliopsida; Pinales; Eucalyptus L'Hér.; Vitis vinifera L.
2006,2006-05-14,Viseu,São João da Pesqueira,Riodades,RIODADES,41.0072754,-7.4879489,NC,625.0,2006-05-14T12:00,22.9,35,6.4,20.7,0.0,0.0,0.0,0.0,1,1016.7,946.4,30,0,0,100,0.51,1.82,14.3,18.9,221,220,35.6,23.5,16.6,13.7,9.8,0.167,0.23,0.304,0.296,1,3600.0,717.4,298.0,419.4,323.8,717.4,1232.8,703.0,292.0,411.0,323.8,703.0,1208.1,Magnoliopsida; Castanea sativa Mill.; Tracheophyta; Pinus pinaster Aiton
2006,2006-08-10,Viseu,Resende,Ovadas,OVADAS,41.0475572,-7.967098419025573,NC,753.0,2006-08-10T15:00,30.7,18,4.0,29.7,0.0,0.0,0.0,0.0,0,1012.9,931.3,0,0,0,0,0.65,3.6,8.9,11.4,69,72,28.4,34.9,24.8,21.7,17.2,0.096,0.143,0.217,0.334,1,3600.0,785.9,691.0,95.0,903.8,785.9,1017.8,836.0,735.0,101.0,903.8,836.0,1082.6,Pinales; Magnoliopsida; Tracheophyta; Quercus L.; 
2006,2006-05-01,Viseu,Moimenta da Beira,Passó,Sanfins,40.6151464,-8.1826476,NC,622.0,2006-05-01T17:00,17.9,59,9.8,16.0,0.0,0.0,0.0,0.0,0,1008.9,938.3,4,0,0,13,0.28,0.84,12.8,16.5,280,281,29.5,19.7,15.5,12.8,9.8,0.258,0.314,0.367,0.368,1,3600.0,393.7,296.1,97.6,658.0,393.7,606.5,468.0,352.0,116.0,658.0,468.0,721.1,Eucalyptus L'Hér.; Magnoliopsida; Tracheophyta; Pinus pinaster Aiton
2006,2006-05-14,Viseu,Tarouca,Ucanha,Penedo de Santo António,41.0457659,-7.7444528,NC,504.0,2006-05-14T13:00,23.1,40,8.7,21.9,0.0,0.0,0.0,0.0,1,1017.2,960.1,30,0,0,99,0.53,1.7,13.3,17.3,237,234,33.8,23.4,17.2,14.1,10.4,0.204,0.238,0.315,0.328,1,3600.0,743.6,341.0,402.6,371.7,743.6,1228.8,748.0,343.0,405.0,371.7,748.0,1236.1,Tracheophyta; Magnoliopsida; Castanea sativa Mill.; Olea europaea L.; Quercus L.; Pinus pinaster Aiton; Vitis vinifera L.; Pinales
2006,2006-08-29,Viseu,Tarouca,Salzedas,SALZEDAS,41.0545541,-7.7252889,Desconhecida,513.0,2006-08-29T01:00,20.1,74,15.3,21.0,0.0,0.0,0.0,0.0,0,1019.4,960.6,0,0,0,0,0.01,0.62,6.0,10.7,25,20,14.4,20.0,24.9,21.9,19.5,0.146,0.165,0.17,0.314,0,0.0,0.0,0.0,0.0,0.0,0.0,0.0,0.0,0.0,0.0,0.0,0.0,0.0,Tracheophyta; Magnoliopsida; Pinus pinaster Aiton; Pinales; Castanea sativa Mill.; Olea europaea L.
2006,2006-09-30,Viseu,Sernancelhe,Lamosa,LAMOSA,40.8866865,-7.6216616,NC,795.0,2006-09-30T17:00,16.7,71,11.3,14.5,0.0,0.0,0.0,0.0,1,1013.8,923.9,39,23,20,22,0.14,0.56,17.6,25.3,242,242,39.2,18.6,17.5,18.3,19.2,0.345,0.271,0.16,0.274,1,3600.0,152.9,91.2,61.7,401.5,152.9,309.8,213.0,127.0,86.0,401.5,213.0,431.6,Pinus pinaster Aiton; Magnoliopsida; Tracheophyta; Castanea sativa Mill.; Quercus L.; Pinales; 
2006,2006-05-20,Viseu,Cinfães,Fornelos,FORNELOS,41.030305,-8.1805981,NC,710.0,2006-05-20T03:00,8.1,95,7.3,6.7,0.0,0.0,0.0,0.0,2,1021.3,937.6,63,38,0,95,0.0,0.06,5.1,11.1,225,241,24.5,10.8,15.2,14.0,10.2,0.177,0.253,0.33,0.393,0,0.0,0.0,0.0,0.0,0.0,0.0,0.0,0.0,0.0,0.0,0.0,0.0,0.0,Quercus L.; Eucalyptus L'Hér.; Magnoliopsida; Vitis vinifera L.; Tracheophyta; Pinales; 
2006,2006-05-22,Viseu,Carregal do Sal,Beijós,Areal,40.5069662,-7.9597071,NC,244.0,2006-05-22T17:00,15.3,50,5.0,11.4,0.0,0.0,0.0,0.0,1,1018.3,989.4,23,26,0,0,0.29,0.86,18.5,24.9,307,309,43.2,19.6,16.9,16.0,12.5,0.169,0.226,0.312,0.347,1,3600.0,446.2,332.3,113.9,671.9,446.2,660.2,521.0,388.0,133.0,671.9,521.0,770.9,Pinus pinaster Aiton; Tracheophyta; Olea europaea L.; Magnoliopsida; Acacia Mill.; Vitis vinifera L.
2006,2006-09-05,Viseu,Cinfães,Santiago de Piães,Ventoselas,41.0701644,-8.1554173,NC,342.0,2006-09-05T22:00,25.6,59,17.0,27.8,0.0,0.0,0.0,0.0,1,1017.0,978.1,20,0,0,67,0.0,1.35,1.9,1.8,112,349,11.9,23.4,25.8,21.7,19.4,0.105,0.176,0.2,0.321,0,0.0,0.0,0.0,0.0,0.0,0.0,0.0,0.0,0.0,0.0,0.0,0.0,0.0,Magnoliopsida; Pinus pinaster Aiton; Quercus L.; Tracheophyta; Eucalyptus L'Hér.; Castanea sativa Mill.; 
2006,2006-05-01,Viseu,Vila Nova de Paiva,Vila Nova de Paiva,VILA NOVA DE PAIVA,40.8522085,-7.7289147,NC,794.0,2006-05-01T22:00,10.4,95,9.7,9.3,0.0,0.0,0.0,0.0,0,1010.2,918.8,0,0,0,0,0.0,0.06,6.9,9.4,261,266,13.7,12.9,14.6,11.9,8.6,0.286,0.313,0.354,0.346,0,0.0,0.0,0.0,0.0,0.0,0.0,0.0,0.0,0.0,0.0,0.0,0.0,0.0,Tracheophyta; Magnoliopsida; Pinus pinaster Aiton; Quercus L.
2006,2006-05-05,Viseu,Viseu,Ranhados,RANHADOS,40.6404554,-7.9065153,NC,449.0,2006-05-05T15:00,17.8,47,6.3,15.5,0.0,0.0,0.0,0.0,3,1019.9,967.8,100,58,82,0,0.38,1.08,12.2,15.5,270,270,30.2,19.4,14.5,13.6,10.6,0.266,0.309,0.363,0.378,1,3600.0,586.9,385.7,201.3,509.2,586.9,1018.9,627.0,412.0,215.0,509.2,627.0,1088.5,Tracheophyta; Pinus pinaster Aiton; Magnoliopsida; Vitis vinifera L.
2006,2006-12-26,Viseu,Viseu,Povolide,POVOA (Povoação),40.6590877,-7.799395,NC,416.0,2006-12-26T14:00,10.1,61,2.8,7.5,0.0,0.0,0.0,0.0,1,1028.4,978.3,22,0,6,61,0.16,0.49,6.8,9.0,93,95,19.4,7.2,4.0,7.6,14.9,0.355,0.363,0.385,0.372,1,3600.0,304.0,138.4,165.6,357.6,304.0,547.4,325.0,148.0,177.0,357.6,325.0,585.2,Magnoliopsida; Olea europaea L.; Vitis vinifera L.; Pinus pinaster Aiton; Tracheophyta; Pinales
2006,2006-06-08,Viseu,São Pedro do Sul,Várzea,Boavista,40.74920385,-8.081602319173324,NC,165.0,2006-06-08T15:00,29.2,35,12.1,29.5,0.0,0.0,0.0,0.0,0,1013.8,995.1,0,0,0,0,0.65,2.65,13.3,16.5,237,234,30.6,33.7,24.9,20.5,15.1,0.1,0.174,0.271,0.356,1,3600.0,787.7,659.4,128.3,814.3,787.7,1075.2,835.0,699.0,136.0,814.3,835.0,1139.7,Magnoliopsida; Eucalyptus L'Hér.; Tracheophyta; Castanea sativa Mill.; Pinus pinaster Aiton; Acacia Mill.; Pinales; Olea europaea L.; Vitis vinifera L.; ; Quercus L.
2006,2006-08-10,Viseu,Cinfães,Tendais,TENDAIS,41.0125776,-8.051263077789546,NC,647.0,2006-08-10T16:00,31.9,18,4.3,30.4,0.0,0.0,0.0,0.0,0,1012.2,941.9,0,0,0,0,0.56,3.89,7.6,9.8,71,73,23.4,35.2,25.4,22.0,17.4,0.098,0.142,0.214,0.334,1,3600.0,637.1,552.1,84.9,867.2,637.1,847.5,705.0,611.0,94.0,867.2,705.0,937.9,Tracheophyta; Quercus L.; Magnoliopsida; Pinus pinaster Aiton; 
2006,2006-08-10,Viseu,Viseu,Fail,FAIL,40.60494105,-7.984804209755274,Desconhecida,328.0,2006-08-10T19:00,31.6,21,6.4,29.8,0.0,0.0,0.0,0.0,0,1010.7,974.3,0,0,0,0,0.15,3.67,6.0,10.2,343,350,13.7,34.0,28.9,24.1,19.1,0.096,0.134,0.181,0.302,1,3600.0,73.4,50.4,22.9,507.9,73.4,132.2,144.0,99.0,45.0,507.9,144.0,259.5,Pinus pinaster Aiton; Magnoliopsida; Tracheophyta; Eucalyptus L'Hér.
2006,2006-06-08,Viseu,Viseu,São João de Lourosa,Rebordinho,40.6107847,-7.9359598,NC,417.0,2006-06-08T17:00,27.3,33,9.7,25.2,0.0,0.0,0.0,0.0,0,1013.0,966.3,0,0,0,0,0.46,2.42,14.2,18.2,263,262,32.8,31.1,23.9,19.1,13.4,0.097,0.198,0.288,0.364,1,3600.0,486.6,404.4,82.3,773.8,486.6,693.8,562.0,467.0,95.0,773.8,562.0,801.3,Pinus pinaster Aiton; Tracheophyta; Magnoliopsida
2006,2006-12-27,Viseu,Tondela,Lobão da Beira,CASAL DE SAO JOAO (Casal),40.5222809,-8.0395409,NC,318.0,2006-12-27T09:00,2.4,87,0.4,-1.4,0.0,0.0,0.0,0.0,0,1030.2,990.5,8,9,0,0,0.01,0.1,11.6,18.4,74,84,23.8,2.3,4.3,8.1,14.6,0.352,0.36,0.384,0.381,1,2049.84,108.4,65.8,42.6,410.6,76.6,226.8,56.0,34.0,22.0,290.1,56.0,117.1,Tracheophyta; Eucalyptus L'Hér.; Vitis vinifera L.; Magnoliopsida; Pinus pinaster Aiton
2006,2006-09-06,Viseu,Castro Daire,Mezio,MEZIO (MÉZIO),40.9796891,-7.8866874,NC,898.0,2006-09-06T13:00,31.3,19,5.3,30.7,0.0,0.0,0.0,0.0,1,1013.8,917.5,26,0,0,85,0.64,3.69,7.6,9.7,270,270,23.8,33.5,23.7,20.6,17.7,0.112,0.158,0.191,0.32,1,3600.0,819.8,655.6,164.2,802.4,819.8,1100.2,824.0,659.0,165.0,802.4,824.0,1105.9,Magnoliopsida; Tracheophyta
2006,2006-08-11,Viseu,Cinfães,São Cristovão De Nogueira,S. CRISTOVAO DA NOGUEIRA,41.0744659,-8.098358098465711,NC,408.0,2006-08-11T12:00,30.5,25,8.1,30.3,0.0,0.0,0.0,0.0,0,1013.6,968.3,0,0,0,0,0.7,3.28,11.3,14.5,97,97,35.6,32.7,25.4,23.0,18.4,0.117,0.135,0.188,0.337,1,3600.0,917.3,810.5,106.8,910.7,917.3,1185.1,893.0,789.0,104.0,910.7,893.0,1153.7,Tracheophyta; Quercus L.; Magnoliopsida; Pinus pinaster Aiton
2006,2006-08-29,Viseu,Vila Nova de Paiva,Alhais,Arraiola,40.8488759,-7.731096262979038,Desconhecida,774.0,2006-08-29T10:00,24.0,45,11.2,23.1,0.0,0.0,0.0,0.0,0,1019.2,933.1,0,0,0,0,0.44,1.65,12.2,15.8,43,45,31.3,25.0,21.9,20.6,18.1,0.114,0.157,0.187,0.289,1,3600.0,703.2,603.7,99.5,869.1,703.2,931.7,636.0,546.0,90.0,869.1,636.0,842.6,Magnoliopsida; Eucalyptus L'Hér.; Pinus pinaster Aiton; Tracheophyta; Quercus L.; Acacia Mill.; Olea europaea L.; Quercus suber L.; 
2006,2006-04-28,Viseu,Cinfães,Nespereira,Pindelo,41.008222,-8.1565952,NC,438.0,2006-04-28T13:00,19.9,49,8.8,19.8,0.0,0.0,0.0,0.0,0,1016.0,965.7,0,0,0,0,0.56,1.19,13.3,17.7,71,73,38.9,21.0,16.3,13.4,10.2,0.322,0.353,0.39,0.41,1,3600.0,939.7,829.2,110.5,935.5,939.7,1196.8,944.0,833.0,111.0,935.5,944.0,1202.2,Magnoliopsida; Eucalyptus L'Hér.; Quercus L.
2006,2006-08-12,Viseu,Nelas,Vilar Seco,TEIXUGA (VILAR SECO),40.55024535,-7.840699963814766,Desconhecida,432.0,2006-08-12T00:00,25.2,37,9.6,25.0,0.0,0.0,0.0,0.0,0,1013.3,964.6,0,0,0,0,0.0,2.01,1.1,5.0,198,291,9.4,24.3,28.5,24.4,19.4,0.085,0.147,0.219,0.325,0,0.0,0.0,0.0,0.0,0.0,0.0,0.0,0.0,0.0,0.0,0.0,0.0,0.0,Olea europaea L.; Tracheophyta; Magnoliopsida; Vitis vinifera L.; Pinus pinaster Aiton; Eucalyptus L'Hér.
2006,2006-08-29,Viseu,Viseu,Fragosela,RECTA DO CAÇADOR,40.6268817,-7.8473894,Desconhecida,359.0,2006-08-29T15:00,31.8,25,9.3,30.9,0.0,0.0,0.0,0.0,0,1016.5,976.6,0,0,0,0,0.65,3.53,13.2,17.1,349,352,31.0,36.0,25.8,23.0,20.8,0.092,0.175,0.211,0.319,1,3600.0,719.2,627.9,91.3,891.9,719.2,944.3,772.0,674.0,98.0,891.9,772.0,1013.7,Magnoliopsida; Pinus pinaster Aiton; Tracheophyta; Acacia Mill.
2006,2006-05-11,Viseu,Santa Comba Dão,Ovoa,Chamadouro,40.3489772,-8.171600177500494,NC,149.0,2006-05-11T13:00,23.2,56,14.0,24.7,0.0,0.0,0.0,0.0,0,1011.0,993.8,0,0,0,1,0.6,1.25,14.0,17.6,314,316,31.7,25.1,17.7,15.1,12.6,0.184,0.258,0.329,0.322,1,3600.0,950.4,840.9,109.5,916.0,950.4,1231.5,955.0,845.0,110.0,916.0,955.0,1237.4,Eucalyptus L'Hér.; Pinales; Magnoliopsida; Olea europaea L.
2006,2006-05-28,Viseu,Tondela,Nandufe,NANDUFE,40.546368,-8.076902668581187,NC,312.0,2006-05-28T14:00,32.1,30,12.4,34.5,0.0,0.0,0.0,0.0,1,1018.4,983.6,23,0,37,2,0.65,3.34,3.2,4.3,63,66,19.1,33.2,22.3,16.6,12.8,0.114,0.203,0.295,0.35,1,3600.0,839.5,681.5,158.0,765.2,839.5,1186.4,866.0,703.0,163.0,765.2,866.0,1223.8,Magnoliopsida; Vitis vinifera L.; Eucalyptus L'Hér.; Pinus pinaster Aiton; Tracheophyta; Acacia Mill.
2006,2006-04-14,Viseu,Viseu,Repeses,Paradinha,40.6387176,-7.9337419,NC,475.0,2006-04-14T17:00,14.2,78,10.4,13.3,1.1,1.1,0.0,0.0,55,1008.8,953.7,100,91,100,97,0.07,0.35,7.2,13.5,207,205,37.8,15.1,13.7,11.4,9.4,0.342,0.356,0.39,0.379,1,0.0,71.6,2.5,69.1,6.2,71.6,543.9,87.0,3.0,84.0,6.2,87.0,661.3,Magnoliopsida; Tracheophyta; Pinus pinaster Aiton
