year,date,district,municipality,parish,local,latitude,longitude,cause,elevation,hourly.time,hourly.temperature_2m,hourly.relative_humidity_2m,hourly.dew_point_2m,hourly.apparent_temperature,hourly.precipitation,hourly.rain,hourly.snowfall,hourly.snow_depth,hourly.weather_code,hourly.pressure_msl,hourly.surface_pressure,hourly.cloud_cover,hourly.cloud_cover_low,hourly.cloud_cover_mid,hourly.cloud_cover_high,hourly.et0_fao_evapotranspiration,hourly.vapour_pressure_deficit,hourly.wind_speed_10m,hourly.wind_speed_100m,hourly.wind_direction_10m,hourly.wind_direction_100m,hourly.wind_gusts_10m,hourly.soil_temperature_0_to_7cm,hourly.soil_temperature_7_to_28cm,hourly.soil_temperature_28_to_100cm,hourly.soil_temperature_100_to_255cm,hourly.soil_moisture_0_to_7cm,hourly.soil_moisture_7_to_28cm,hourly.soil_moisture_28_to_100cm,hourly.soil_moisture_100_to_255cm,hourly.is_day,hourly.sunshine_duration,hourly.shortwave_radiation_instant,hourly.direct_radiation_instant,hourly.diffuse_radiation_instant,hourly.direct_normal_irradiance_instant,hourly.global_tilted_irradiance_instant,hourly.terrestrial_radiation_instant,hourly.shortwave_radiation,hourly.direct_radiation,hourly.diffuse_radiation,hourly.direct_normal_irradiance,hourly.global_tilted_irradiance,hourly.terrestrial_radiation,scientificNames
2006,2006-07-14,Porto,Penafiel,Portela,PORTELA MONTE (PORTELA),41.2068873,-8.2538497,NC,413.0,2006-07-14T19:00,29.7,43,15.9,30.9,0.0,0.0,0.0,0.0,1,1014.8,968.8,22,0,0,73,0.14,2.36,5.2,9.0,335,337,14.0,30.9,26.9,20.6,15.3,0.104,0.164,0.247,0.354,1,3600.0,92.9,42.8,50.1,242.5,92.9,233.9,141.0,65.0,76.0,242.5,141.0,354.8,Eucalyptus L'Hér.; Magnoliopsida; Tracheophyta
2006,2006-07-16,Porto,Paredes,Vila Cova de Carros,Peneirada,41.2114189,-8.3640671,NC,253.0,2006-07-16T16:00,34.8,27,12.9,35.3,0.0,0.0,0.0,0.0,0,1015.5,987.5,8,0,14,0,0.59,4.07,8.8,11.1,305,306,20.9,36.9,27.7,21.6,16.4,0.127,0.142,0.213,0.352,1,3600.0,637.0,534.7,102.4,776.2,637.0,911.9,697.0,585.0,112.0,776.2,697.0,997.8,Magnoliopsida; Pinus pinaster Aiton; Eucalyptus L'Hér.; Tracheophyta; Vitis vinifera L.; Quercus L.
2006,2006-07-17,Porto,Gondomar,Rio Tinto,RUA DO ARCO (Rua do Padre Dehon),41.1807166,-8.5575691,NC,71.0,2006-07-17T16:00,30.1,45,16.8,31.4,0.0,0.0,0.0,0.0,0,1014.4,1006.3,13,0,4,36,0.57,2.36,14.5,18.7,256,254,32.0,35.4,28.7,23.0,17.8,0.119,0.147,0.225,0.348,1,3600.0,661.7,547.5,114.2,794.6,661.7,912.2,724.0,599.0,125.0,794.6,724.0,998.1,Tracheophyta; Magnoliopsida
2006,2006-07-14,Porto,Paredes,Gandra,VILARINHO CIMA (Vilarinho de Baixo),41.1963232,-8.4359653,NC,145.0,2006-07-14T21:00,29.6,54,19.2,32.1,0.0,0.0,0.0,0.0,1,1014.8,998.4,24,0,0,79,0.05,1.91,6.9,11.3,9,22,18.4,29.2,28.2,21.7,16.9,0.133,0.145,0.218,0.354,0,0.0,0.0,0.0,0.0,0.0,0.0,0.0,0.0,0.0,0.0,0.0,0.0,0.0,Magnoliopsida; Pinus pinaster Aiton; Eucalyptus L'Hér.; Tracheophyta; Vitis vinifera L.
2006,2006-07-12,Porto,Paredes,Rebordosa,Bairro,41.2202567,-8.4112601,NC,216.0,2006-07-12T12:00,32.6,37,16.2,36.2,0.0,0.0,0.0,0.0,0,1015.9,991.7,1,0,2,0,0.68,3.09,4.8,6.9,77,84,17.6,32.9,24.6,20.4,16.3,0.126,0.149,0.225,0.356,1,3600.0,914.8,783.5,131.3,839.1,914.8,1235.8,892.0,764.0,128.0,839.1,892.0,1205.0,Magnoliopsida; Pinus pinaster Aiton; Eucalyptus L'Hér.; Tracheophyta; Vitis vinifera L.
2006,2006-07-16,Porto,Gondomar,Gondomar (são Cosme),R. FONTELA (GONDOMAR),41.13527305,-8.534103623752394,NC,121.0,2006-07-16T17:00,34.5,33,15.7,34.5,0.0,0.0,0.0,0.0,0,1014.9,1001.4,6,0,10,0,0.53,3.68,13.8,17.4,317,320,25.2,37.2,29.1,22.6,17.5,0.121,0.142,0.215,0.351,1,3600.0,497.3,418.1,79.3,780.5,497.3,709.1,571.0,480.0,91.0,780.5,571.0,814.1,Magnoliopsida; Tracheophyta; Eucalyptus L'Hér.
2006,2006-07-12,Porto,Vila Nova de Gaia,Mafamude,R. CABO (Rua da Escola Cabo Mor),41.11230175,-8.59788539633546,NC,201.0,2006-07-12T22:00,26.4,67,19.9,29.3,0.0,0.0,0.0,0.0,0,1016.0,993.0,11,0,2,32,0.02,1.12,6.3,8.7,59,73,13.0,26.5,26.6,20.7,16.6,0.107,0.153,0.233,0.35,0,0.0,0.0,0.0,0.0,0.0,0.0,0.0,0.0,0.0,0.0,0.0,0.0,0.0,Magnoliopsida; Tracheophyta; Pinus pinaster Aiton; Pinus pinea L.
2006,2006-07-16,Porto,Gondomar,Foz do Sousa,E.N 108 (FOZ DO SOUSA),41.0916552,-8.5093029,NC,21.0,2006-07-16T00:00,25.9,75,21.2,29.1,0.0,0.0,0.0,0.0,0,1015.6,1013.2,0,0,0,0,0.02,0.83,8.4,10.0,10,41,13.7,26.6,29.6,23.1,18.3,0.094,0.125,0.192,0.324,0,0.0,0.0,0.0,0.0,0.0,0.0,0.0,0.0,0.0,0.0,0.0,0.0,0.0,Tracheophyta; Magnoliopsida; Eucalyptus L'Hér.; Pinus pinaster Aiton
2006,2006-07-16,Porto,Marco de Canaveses,Vila Boa de Quires,LAGES (Lage),41.200721,-8.203458,NC,308.0,2006-07-16T01:00,23.6,68,17.3,25.1,0.0,0.0,0.0,0.0,0,1016.4,981.1,0,0,0,0,0.02,0.93,7.2,9.2,87,79,12.6,23.0,26.4,21.3,15.9,0.11,0.169,0.247,0.353,0,0.0,0.0,0.0,0.0,0.0,0.0,0.0,0.0,0.0,0.0,0.0,0.0,0.0,Pinus pinaster Aiton; Tracheophyta; Eucalyptus L'Hér.; Magnoliopsida; Vitis vinifera L.; Quercus L.; Pinales; 
2006,2006-07-15,Porto,Felgueiras,Sernande,LUGAR DE FRONTEIRA (Lugar),41.3410541,-8.2312098,NC,235.0,2006-07-15T16:00,33.2,31,13.8,33.7,0.0,0.0,0.0,0.0,0,1015.5,989.3,14,0,23,0,0.54,3.5,8.3,10.4,288,290,18.7,36.6,27.6,22.0,16.5,0.098,0.163,0.246,0.354,1,3600.0,584.0,463.4,120.6,673.0,584.0,911.5,639.0,507.0,132.0,673.0,639.0,997.2,Eucalyptus L'Hér.; Magnoliopsida; Tracheophyta
2006,2006-07-15,Porto,Baião,Ancede,LUGAR DE TORNES (Fundo do Lugar),41.0941835,-8.0813268,NC,75.0,2006-07-15T23:00,28.9,54,18.7,31.4,0.0,0.0,0.0,0.0,0,1016.8,1008.2,0,0,0,0,0.03,1.83,4.7,6.3,86,77,8.6,26.3,28.3,22.7,17.4,0.11,0.169,0.247,0.353,0,0.0,0.0,0.0,0.0,0.0,0.0,0.0,0.0,0.0,0.0,0.0,0.0,0.0,Magnoliopsida; Pinus pinaster Aiton; Tracheophyta; Vitis vinifera L.; Quercus suber L.; Acacia Mill.; Eucalyptus L'Hér.; Quercus L.; 
2006,2006-07-16,Porto,Santo Tirso,Santo Tirso,L. FONTISCOS (SANTO TIRSO),41.35107,-8.4734104,NC,35.0,2006-07-16T02:00,24.4,76,19.9,27.2,0.0,0.0,0.0,0.0,0,1015.4,1011.3,0,0,0,0,0.01,0.73,6.9,9.4,51,67,12.6,24.2,27.9,22.7,17.7,0.103,0.149,0.233,0.35,0,0.0,0.0,0.0,0.0,0.0,0.0,0.0,0.0,0.0,0.0,0.0,0.0,0.0,Tracheophyta; Vitis vinifera L.; Magnoliopsida
2006,2006-07-17,Porto,Maia,Nogueira,BARROQUEIRO (Barroso),41.2353591,-8.5878135,NC,74.0,2006-07-17T14:00,32.6,40,17.2,34.7,0.0,0.0,0.0,0.0,1,1014.5,1006.2,21,0,1,67,0.72,2.95,14.8,18.0,241,237,29.5,36.2,28.2,22.9,17.7,0.119,0.148,0.225,0.348,1,3600.0,862.5,720.2,142.3,802.3,862.5,1188.4,885.0,739.0,146.0,802.3,885.0,1219.5,Magnoliopsida; Eucalyptus L'Hér.; Tracheophyta; Pinus pinaster Aiton; 
2006,2006-07-17,Porto,Gondomar,São Pedro da Cova,R. DESPORTIVO DE S.P.COVA (SÃO PEDRO DA COVA),41.1346344,-8.5168448,NC,169.0,2006-07-17T16:00,30.8,42,16.5,31.9,0.0,0.0,0.0,0.0,0,1014.4,995.3,13,0,4,36,0.58,2.57,14.5,18.7,256,254,32.0,36.3,28.6,22.6,17.3,0.12,0.141,0.213,0.35,1,3600.0,661.7,547.5,114.2,794.6,661.7,912.2,724.0,599.0,125.0,794.6,724.0,998.1,Pinus pinaster Aiton; Eucalyptus L'Hér.; Vitis vinifera L.; Tracheophyta; Magnoliopsida
2006,2006-07-09,Porto,Amarante,Várzea,S. VICENCIO (VÁRZEA),41.2611357,-8.00160759878186,NC,258.0,2006-07-09T09:00,24.8,57,15.7,26.5,0.0,0.0,0.0,0.0,0,1019.0,989.4,4,0,0,13,0.36,1.34,1.8,2.6,37,56,12.2,25.1,21.9,19.7,15.9,0.111,0.192,0.261,0.358,1,3600.0,630.2,528.0,102.2,805.5,630.2,867.3,555.0,465.0,90.0,805.5,555.0,763.8,Magnoliopsida; Eucalyptus L'Hér.; Tracheophyta; Pinus pinaster Aiton; Vitis vinifera L.; Castanea sativa Mill.; Quercus L.; Olea europaea L.; Acacia Mill.; Pinales; 
2006,2006-07-17,Porto,Lousada,Cernadelo,LG. QUEIJADA (CERNADELO),41.296039050000005,-8.232690658465494,NC,226.0,2006-07-17T20:00,26.9,54,17.0,28.7,0.0,0.0,0.0,0.0,0,1015.4,989.7,0,0,0,0,0.05,1.62,5.1,8.0,262,260,15.8,29.9,28.3,22.2,16.6,0.116,0.153,0.228,0.351,1,2020.13,0.0,0.0,0.0,0.0,0.0,0.0,48.0,26.0,22.0,211.0,48.0,111.2,Pinus pinaster Aiton; Tracheophyta; Eucalyptus L'Hér.; Vitis vinifera L.; Magnoliopsida
2006,2006-07-17,Porto,Lousada,Meinedo,Quinta,41.2517314,-8.2505324,NC,210.0,2006-07-17T23:00,24.7,62,17.0,26.7,0.0,0.0,0.0,0.0,0,1016.2,992.1,0,0,0,0,0.01,1.18,3.3,4.4,186,171,10.4,25.8,28.3,22.8,16.9,0.095,0.155,0.239,0.351,0,0.0,0.0,0.0,0.0,0.0,0.0,0.0,0.0,0.0,0.0,0.0,0.0,0.0,Magnoliopsida; Tracheophyta; Vitis vinifera L.
2006,2006-07-18,Porto,Santo Tirso,Negrelos (são Mamede),PORTAL (Porta),41.3488993,-8.403043,NC,145.0,2006-07-18T00:00,21.9,79,18.0,24.1,0.0,0.0,0.0,0.0,0,1015.9,999.0,0,0,0,0,0.0,0.57,5.4,8.3,233,214,14.0,24.4,27.8,22.6,17.1,0.118,0.145,0.221,0.352,0,0.0,0.0,0.0,0.0,0.0,0.0,0.0,0.0,0.0,0.0,0.0,0.0,0.0,Magnoliopsida; Tracheophyta; Vitis vinifera L.; Quercus suber L.
2006,2006-07-14,Porto,Vila Nova de Gaia,Avintes,RUA STª MARIA (Rua São Pedro de Avintes),41.1131263,-8.5537319,NC,81.0,2006-07-14T14:00,35.1,31,15.4,37.1,0.0,0.0,0.0,0.0,0,1013.8,1004.7,6,0,2,15,0.76,3.89,11.7,11.8,315,320,21.6,37.9,27.6,21.8,17.5,0.117,0.154,0.235,0.355,1,3600.0,869.2,752.3,116.9,835.0,869.2,1192.5,892.0,772.0,120.0,835.0,892.0,1223.7,Magnoliopsida; Tracheophyta; Pinales; Pinus pinea L.
2006,2006-07-16,Porto,Felgueiras,Vila Cova Da Lixa,TRESCOVA (VILA COVA),41.3259334,-8.163629651586184,NC,295.0,2006-07-16T18:00,33.1,30,13.4,32.6,0.0,0.0,0.0,0.0,0,1015.4,982.6,13,0,22,0,0.37,3.53,11.0,16.8,311,313,24.8,35.5,28.1,21.9,16.2,0.094,0.16,0.243,0.353,1,3600.0,310.9,247.6,63.3,693.7,310.9,472.5,388.0,309.0,79.0,693.7,388.0,589.7,Magnoliopsida; Tracheophyta; Vitis vinifera L.; Eucalyptus L'Hér.
2006,2006-07-08,Porto,Paredes,Beire,LUGAR DE CAMPAS (Lugar),41.2451216,-8.3240436,NC,192.0,2006-07-08T15:00,28.5,39,13.1,29.4,0.0,0.0,0.0,0.0,0,1016.8,995.0,0,0,0,0,0.65,2.39,12.7,16.4,299,299,31.7,32.0,23.3,19.5,16.0,0.126,0.176,0.247,0.358,1,3600.0,828.5,723.4,105.1,883.8,828.5,1083.0,875.0,764.0,111.0,883.8,875.0,1143.8,Magnoliopsida; Pinus pinaster Aiton; Eucalyptus L'Hér.; Tracheophyta; Vitis vinifera L.
2006,2006-07-15,Porto,Lousada,Pias,LUGAR DE SOUTELO (Lugar da Estrada),41.2698777,-8.2628118,NC,199.0,2006-07-15T01:00,23.8,72,18.4,25.7,0.0,0.0,0.0,0.0,1,1015.8,992.9,22,0,0,74,0.03,0.83,8.7,14.4,95,90,15.1,24.7,27.5,22.0,16.7,0.105,0.16,0.245,0.354,0,0.0,0.0,0.0,0.0,0.0,0.0,0.0,0.0,0.0,0.0,0.0,0.0,0.0,Eucalyptus L'Hér.; Tracheophyta; Pinus pinaster Aiton; Magnoliopsida
2006,2006-07-16,Porto,Felgueiras,Margaride (santa Eulália),STA.QUITÉRIA (SANTA QUITÉRIA),41.3667229,-8.203496330346734,NC,298.0,2006-07-16T18:00,33.4,29,13.2,32.8,0.0,0.0,0.0,0.0,0,1015.4,982.3,13,0,22,0,0.38,3.64,11.0,16.8,311,313,24.8,35.0,27.9,21.9,16.3,0.103,0.154,0.236,0.35,1,3600.0,311.1,247.7,63.3,693.3,311.1,473.0,388.0,309.0,79.0,693.3,388.0,590.0,Magnoliopsida; Tracheophyta; Eucalyptus L'Hér.
2006,2006-07-16,Porto,Vila Nova de Gaia,Arcozelo,VILA D´ESTE (Vila Chã),41.0465723,-8.6321927,NC,62.0,2006-07-16T21:00,29.2,55,19.1,30.5,0.0,0.0,0.0,0.0,0,1015.1,1008.0,5,0,9,0,0.11,1.84,14.8,26.9,4,12,23.8,31.0,30.2,23.1,18.0,0.091,0.123,0.19,0.323,0,0.0,0.0,0.0,0.0,0.0,0.0,0.0,0.0,0.0,0.0,0.0,0.0,0.0,Tracheophyta; Pinus pinaster Aiton; Eucalyptus L'Hér.; Magnoliopsida
2006,2006-07-16,Porto,Matosinhos,São Mamede de Infesta,TRAV. CENTRAL CORGO (Travessa Central do Seixo),41.1877581,-8.6294361,NC,100.0,2006-07-16T21:00,28.7,58,19.5,30.8,0.0,0.0,0.0,0.0,0,1015.6,1004.2,2,0,3,0,0.07,1.66,10.1,18.0,2,3,16.2,29.9,29.0,22.6,17.5,0.12,0.148,0.226,0.349,0,0.0,0.0,0.0,0.0,0.0,0.0,0.0,0.0,0.0,0.0,0.0,0.0,0.0,Tracheophyta; Magnoliopsida
2006,2006-07-15,Porto,TROFA,Coronado (são Romão),LUGAR DO SEIXINHO (SÃO ROMÃO DO CORONADO),41.2779576,-8.5535939,NC,114.0,2006-07-15T05:00,23.5,83,20.5,26.6,0.0,0.0,0.0,0.0,0,1015.5,1002.3,3,0,0,11,0.01,0.48,7.6,15.0,90,100,12.6,23.1,26.9,21.9,17.2,0.112,0.151,0.234,0.352,0,0.0,0.0,0.0,0.0,0.0,0.0,0.0,0.0,0.0,0.0,0.0,0.0,0.0,Tracheophyta; Pinus pinaster Aiton; Eucalyptus L'Hér.; Magnoliopsida
2006,2006-07-16,Porto,Baião,Campelo,RUA CAMPO POÇO (CAMPELO),41.16153965,-8.032414081010739,NC,567.0,2006-07-16T22:00,27.4,43,13.7,27.9,0.0,0.0,0.0,0.0,0,1016.8,953.7,9,0,15,0,0.04,2.09,5.0,6.2,21,7,12.2,26.2,26.6,20.7,14.9,0.099,0.168,0.247,0.351,0,0.0,0.0,0.0,0.0,0.0,0.0,0.0,0.0,0.0,0.0,0.0,0.0,0.0,Tracheophyta; Pinus pinaster Aiton; Magnoliopsida; Eucalyptus L'Hér.; Pinales; Quercus L.; Vitis vinifera L.; 
2006,2006-07-15,Porto,Santo Tirso,Lamelas,Forjães,41.31869835,-8.509147938338778,NC,231.0,2006-07-15T13:00,33.0,33,14.7,36.2,0.0,0.0,0.0,0.0,0,1015.6,989.8,5,0,8,0,0.68,3.37,3.7,3.7,259,259,11.9,35.7,26.6,21.3,16.5,0.126,0.145,0.222,0.354,1,3600.0,887.0,754.0,133.0,803.7,887.0,1241.9,887.0,754.0,133.0,803.7,887.0,1241.9,Eucalyptus L'Hér.; Pinales; Magnoliopsida; Pinus pinaster Aiton
2006,2006-07-16,Porto,Gondomar,Rio Tinto,R. PADRE JOAQUIM DAS NEVES (Rua do Padre Dehon),41.1807166,-8.5575691,NC,71.0,2006-07-16T05:00,23.3,89,21.4,27.1,0.0,0.0,0.0,0.0,0,1015.8,1007.5,0,0,0,0,0.0,0.31,5.5,10.7,67,70,13.7,23.1,27.1,22.5,17.6,0.123,0.15,0.229,0.349,0,0.0,0.0,0.0,0.0,0.0,0.0,0.0,0.0,0.0,0.0,0.0,0.0,0.0,Tracheophyta; Magnoliopsida
2006,2006-07-16,Porto,Gondomar,Foz do Sousa,RUA RIO FERREIRA (Rio Ferreira),41.0994524,-8.4999065,NC,79.0,2006-07-16T22:00,28.0,60,19.6,29.7,0.0,0.0,0.0,0.0,0,1014.9,1005.9,18,0,30,0,0.08,1.49,13.4,25.6,14,24,21.6,29.2,29.5,23.0,17.8,0.121,0.142,0.214,0.351,0,0.0,0.0,0.0,0.0,0.0,0.0,0.0,0.0,0.0,0.0,0.0,0.0,0.0,Eucalyptus L'Hér.; Tracheophyta; Magnoliopsida; Pinus pinaster Aiton
2006,2006-07-16,Porto,Vila Nova de Gaia,Valadares,R. MIMOSAS (Rua das Mimosas),41.0858384,-8.6263713,NC,66.0,2006-07-16T10:00,33.0,41,17.9,36.0,0.0,0.0,0.0,0.0,0,1015.9,1008.5,0,0,0,0,0.53,2.98,5.0,4.2,339,20,13.3,32.3,27.1,22.7,17.8,0.121,0.152,0.232,0.354,1,3600.0,745.4,637.4,108.0,821.3,745.4,1027.4,683.0,584.0,99.0,821.3,683.0,941.3,Magnoliopsida; Pinus pinaster Aiton; Tracheophyta; Eucalyptus L'Hér.; Vitis vinifera L.; Pinales; Quercus L.; 
2006,2006-07-18,Porto,Vila do Conde,Guilhabreu,STª. EUFÉMIA (Santa Eufémia),41.310582,-8.632246611654004,NC,197.0,2006-07-18T06:00,19.9,89,18.0,22.1,0.0,0.0,0.0,0.0,1,1015.0,992.0,45,0,27,95,0.02,0.27,5.0,9.7,69,88,27.7,21.6,26.0,22.4,17.0,0.106,0.147,0.228,0.35,1,0.0,16.2,0.0,16.2,0.0,8.6,151.3,7.0,0.0,7.0,0.0,7.0,65.3,Pinus pinaster Aiton; Tracheophyta; Magnoliopsida; Eucalyptus L'Hér.
2006,2006-07-15,Porto,Gondomar,Jovim,R.NETOS (Netos),41.1069301,-8.5093383,NC,165.0,2006-07-15T17:00,32.1,40,16.9,33.0,0.0,0.0,0.0,0.0,0,1015.6,997.1,19,0,21,20,0.44,2.87,10.4,13.2,314,315,28.4,35.6,28.4,21.9,17.1,0.125,0.144,0.217,0.352,1,3600.0,438.2,345.0,93.2,642.9,438.2,710.3,503.0,396.0,107.0,642.9,503.0,815.4,Eucalyptus L'Hér.; Vitis vinifera L.; Tracheophyta; Magnoliopsida
2006,2006-07-17,Porto,Matosinhos,São Mamede de Infesta,R. CENTRAL DO SEIXO (Travessa Central do Seixo),41.1877581,-8.6294361,NC,100.0,2006-07-17T17:00,28.7,49,16.8,29.2,0.0,0.0,0.0,0.0,0,1014.4,1003.0,7,0,0,24,0.42,2.01,12.7,17.9,241,240,29.9,33.8,28.7,22.8,17.6,0.119,0.147,0.225,0.348,1,3600.0,464.3,373.7,90.6,697.4,464.3,709.4,533.0,429.0,104.0,697.4,533.0,814.4,Tracheophyta; Magnoliopsida
2006,2006-07-16,Porto,Póvoa de Varzim,Póvoa de Varzim,R. SANTO ANDRE (Rua Santos Minho),41.3778761,-8.758443632782878,NC,8.0,2006-07-16T17:00,33.8,39,17.8,34.6,0.0,0.0,0.0,0.0,0,1015.1,1014.2,0,0,0,0,0.53,3.22,14.4,18.5,328,331,27.7,37.7,29.4,23.1,18.0,0.092,0.154,0.241,0.349,1,3600.0,506.6,425.5,81.1,791.6,506.6,711.6,581.0,488.0,93.0,791.6,581.0,816.1,Tracheophyta; Magnoliopsida
2006,2006-07-16,Porto,Penafiel,Rans,Pena,41.176344,-8.3153721,NC,188.0,2006-07-16T20:00,30.8,44,17.1,32.2,0.0,0.0,0.0,0.0,0,1015.8,994.6,13,0,22,0,0.1,2.48,7.6,9.4,335,342,15.8,31.5,28.5,22.2,16.7,0.116,0.154,0.23,0.352,1,2060.08,0.0,0.0,0.0,0.0,0.0,0.0,46.0,26.0,20.0,209.3,46.0,113.9,Tracheophyta; Magnoliopsida; Eucalyptus L'Hér.
2006,2006-07-17,Porto,Penafiel,Rio de Moinhos,LAMELA (Lamelas),41.1113744,-8.2649364,NC,231.0,2006-07-17T18:00,29.7,47,17.3,30.7,0.0,0.0,0.0,0.0,0,1015.3,989.3,0,0,0,1,0.33,2.2,11.2,14.4,268,267,30.2,33.6,28.4,22.4,16.8,0.106,0.161,0.242,0.351,1,3600.0,307.3,243.3,64.0,683.4,307.3,471.4,384.0,304.0,80.0,683.4,384.0,589.0,Eucalyptus L'Hér.; Tracheophyta; Magnoliopsida; Vitis vinifera L.
2006,2006-07-17,Porto,Gondomar,Rio Tinto,RUA DE PEVIDAL (Rua de João de Deus),41.1807166,-8.5575691,NC,71.0,2006-07-17T03:00,23.7,81,20.2,26.3,0.0,0.0,0.0,0.0,1,1014.5,1006.3,21,0,35,0,0.02,0.56,9.2,18.9,69,76,13.7,24.4,28.1,22.8,17.7,0.12,0.148,0.227,0.349,0,0.0,0.0,0.0,0.0,0.0,0.0,0.0,0.0,0.0,0.0,0.0,0.0,0.0,Tracheophyta; Magnoliopsida
2006,2006-07-17,Porto,Santo Tirso,Monte Córdova,LG. STª LUZIA (MONTE CORDOVA),41.3152366,-8.441914383653845,NC,372.0,2006-07-17T03:00,20.7,71,15.2,21.0,0.0,0.0,0.0,0.0,0,1015.5,972.7,13,0,22,0,0.03,0.71,9.6,18.4,70,84,16.9,22.2,26.4,21.5,15.8,0.095,0.157,0.241,0.352,0,0.0,0.0,0.0,0.0,0.0,0.0,0.0,0.0,0.0,0.0,0.0,0.0,0.0,Pinus pinaster Aiton; Tracheophyta; Vitis vinifera L.; Eucalyptus L'Hér.; Magnoliopsida
2006,2006-07-16,Porto,Baião,Santa Cruz do Douro,BALÃO (SANTA CRUZ DO DOURO),41.1160786,-8.0061179,NC,267.0,2006-07-16T17:00,34.5,27,13.1,33.9,0.0,0.0,0.0,0.0,0,1015.2,985.6,14,0,23,0,0.51,3.97,11.1,14.6,306,308,23.8,37.0,28.1,22.1,16.5,0.099,0.167,0.247,0.352,1,3600.0,486.9,406.9,80.0,766.1,486.9,703.2,560.0,468.0,92.0,766.1,560.0,808.8,Magnoliopsida; Pinus pinaster Aiton; Vitis vinifera L.; Quercus L.; Tracheophyta; Eucalyptus L'Hér.; Olea europaea L.; 
2006,2006-07-17,Porto,Paços de Ferreira,Modelos,AV SANTIAGO (MODELOS),41.25637305,-8.383682658611988,NC,288.0,2006-07-17T02:00,22.4,70,16.7,23.7,0.0,0.0,0.0,0.0,0,1015.5,982.4,11,0,18,0,0.02,0.81,7.6,15.1,90,78,13.0,23.4,27.2,22.0,16.3,0.096,0.155,0.24,0.352,0,0.0,0.0,0.0,0.0,0.0,0.0,0.0,0.0,0.0,0.0,0.0,0.0,0.0,Eucalyptus L'Hér.; Tracheophyta; Magnoliopsida; Vitis vinifera L.; Pinus pinaster Aiton
2006,2006-07-16,Porto,Penafiel,Recezinhos (são Mamede),Aldeia Nova,41.2726266,-8.2833754,NC,290.0,2006-07-16T22:00,29.0,45,15.8,29.9,0.0,0.0,0.0,0.0,0,1016.1,983.4,10,0,17,0,0.06,2.2,7.0,9.4,55,40,11.5,27.4,28.0,22.0,16.3,0.095,0.157,0.241,0.352,0,0.0,0.0,0.0,0.0,0.0,0.0,0.0,0.0,0.0,0.0,0.0,0.0,0.0,Eucalyptus L'Hér.; Tracheophyta
2006,2006-07-15,Porto,Vila Nova de Gaia,Valadares,R. MIMOSAS (Rua das Mimosas),41.0858384,-8.6263713,NC,66.0,2006-07-15T15:00,34.3,34,16.4,35.3,0.0,0.0,0.0,0.0,0,1015.4,1008.0,0,0,0,0,0.7,3.55,16.8,19.4,305,305,29.2,37.6,28.4,22.3,17.7,0.122,0.152,0.233,0.354,1,3600.0,745.3,631.6,113.6,774.2,745.3,1079.9,787.0,667.0,120.0,774.2,787.0,1140.4,Magnoliopsida; Pinus pinaster Aiton; Tracheophyta; Eucalyptus L'Hér.; Vitis vinifera L.; Pinales; Quercus L.; 
2006,2006-07-16,Porto,Paços de Ferreira,Penamaior,GAVETO URRÔ (PENAMAIOR),41.28425415,-8.41167479537962,NC,370.0,2006-07-16T19:00,30.7,38,14.9,31.6,0.0,0.0,0.0,0.0,0,1015.8,974.6,15,0,25,0,0.17,2.73,5.2,11.5,304,311,21.6,32.8,27.7,21.4,15.7,0.095,0.156,0.241,0.352,1,3600.0,128.3,88.8,39.5,505.1,128.3,232.8,195.0,135.0,60.0,505.1,195.0,353.9,Magnoliopsida; Eucalyptus L'Hér.; Tracheophyta; Vitis vinifera L.; 
2006,2006-07-16,Porto,Amarante,Freixo de Baixo,Faia,41.2978828,-8.1112885,NC,271.0,2006-07-16T20:00,30.3,45,17.1,31.7,0.0,0.0,0.0,0.0,0,1015.8,985.4,13,0,22,0,0.09,2.36,7.6,9.4,335,342,15.8,31.1,28.0,21.7,16.2,0.107,0.166,0.245,0.352,1,2024.62,0.0,0.0,0.0,0.0,0.0,0.0,46.0,26.0,20.0,211.0,46.0,111.5,Pinus pinaster Aiton; Tracheophyta; Eucalyptus L'Hér.; Magnoliopsida; Vitis vinifera L.
2006,2006-07-18,Porto,Vila do Conde,Labruge,LUGAR DE REGADAS (Lugar da Granja),41.2779415,-8.7151992,NC,31.0,2006-07-18T09:00,24.8,73,19.6,27.2,0.0,0.0,0.0,0.0,2,1015.6,1012.0,58,19,19,100,0.24,0.85,8.7,10.6,197,190,16.9,27.1,26.6,23.5,18.0,0.091,0.153,0.24,0.348,1,3600.0,383.9,148.5,235.4,233.2,383.9,843.3,336.0,130.0,206.0,233.2,336.0,738.0,Tracheophyta; Magnoliopsida; Eucalyptus L'Hér.
2006,2006-07-17,Porto,Felgueiras,Santão,CARVALHINHOS (Carvalhinho),41.3095202,-8.1770057,NC,375.0,2006-07-17T17:00,30.0,43,16.2,30.6,0.0,0.0,0.0,0.0,0,1014.5,972.7,9,0,0,31,0.32,2.4,10.6,13.5,280,279,24.5,34.7,27.6,21.7,15.8,0.095,0.158,0.242,0.352,1,3600.0,283.5,205.2,78.3,386.9,283.5,702.2,326.0,236.0,90.0,386.9,326.0,807.5,Magnoliopsida; Tracheophyta; Vitis vinifera L.
2006,2006-07-18,Porto,Amarante,Fregim,Covelas,41.2671355,-8.1013692,NC,247.0,2006-07-18T12:00,28.7,42,14.6,28.2,0.0,0.0,0.0,0.0,3,1016.3,988.4,88,0,97,100,0.33,2.27,13.8,19.4,160,162,20.9,28.6,25.6,22.3,16.5,0.108,0.164,0.243,0.351,1,0.0,305.7,2.1,303.7,2.2,305.7,1228.2,298.0,2.0,296.0,2.2,298.0,1197.2,Tracheophyta; Magnoliopsida; Pinus pinaster Aiton; Vitis vinifera L.; Quercus L.; Eucalyptus L'Hér.; 
2006,2006-07-17,Porto,Lousada,Cernadelo,Regadas,41.2986424,-8.2310751,NC,239.0,2006-07-17T20:00,27.4,53,17.1,29.2,0.0,0.0,0.0,0.0,0,1015.4,988.3,0,0,0,0,0.06,1.7,5.1,8.0,262,260,15.8,30.6,28.7,22.6,16.7,0.095,0.158,0.241,0.352,1,2020.13,0.0,0.0,0.0,0.0,0.0,0.0,48.0,26.0,22.0,211.0,48.0,111.2,Eucalyptus L'Hér.; Pinus pinaster Aiton; Tracheophyta; Vitis vinifera L.; Magnoliopsida
2006,2006-07-17,Porto,Santo Tirso,Areias,FREITAS (Freixieiro),41.3620465,-8.4756024,NC,118.0,2006-07-17T21:00,25.5,62,17.6,27.4,0.0,0.0,0.0,0.0,0,1015.6,1002.0,0,0,0,0,0.03,1.24,5.8,8.6,210,195,10.8,28.3,28.6,22.7,17.2,0.118,0.145,0.221,0.353,0,0.0,0.0,0.0,0.0,0.0,0.0,0.0,0.0,0.0,0.0,0.0,0.0,0.0,Pinus pinaster Aiton; Vitis vinifera L.; Tracheophyta; Eucalyptus L'Hér.
2006,2006-07-16,Porto,Gondomar,Baguim Do Monte (rio Tinto),RUA CABADA (Rio Tinto),41.1856584,-8.5478074,NC,89.0,2006-07-16T06:00,21.9,90,20.2,24.7,0.0,0.0,0.0,0.0,0,1016.1,1005.7,0,0,0,0,0.02,0.26,7.6,12.3,71,75,14.8,22.7,27.0,22.7,17.6,0.11,0.149,0.226,0.348,1,261.38,46.2,20.8,25.4,175.8,24.8,156.4,20.0,9.0,11.0,94.4,20.0,67.8,Tracheophyta; Magnoliopsida
2006,2006-07-17,Porto,Amarante,Freixo de Baixo,Faia,41.2978828,-8.1112885,Desconhecida,271.0,2006-07-17T14:00,34.9,33,16.1,37.5,0.2,0.2,0.0,0.0,51,1014.5,984.6,30,0,10,80,0.73,3.77,9.8,12.1,246,243,28.8,37.3,27.1,21.9,16.2,0.108,0.164,0.244,0.351,1,3600.0,844.2,699.1,145.1,781.0,844.2,1185.1,867.0,718.0,149.0,781.0,867.0,1217.2,Pinus pinaster Aiton; Tracheophyta; Eucalyptus L'Hér.; Magnoliopsida; Vitis vinifera L.
2006,2006-07-16,Porto,Lousada,Lustosa,AGRELO (Agrela),41.3321025,-8.3085374,NC,411.0,2006-07-16T11:00,31.8,34,14.2,34.4,0.0,0.0,0.0,0.0,0,1017.4,971.8,0,0,0,0,0.62,3.08,3.6,4.0,84,85,17.3,32.5,25.0,21.1,15.5,0.107,0.156,0.237,0.35,1,3600.0,870.9,757.1,113.9,864.0,870.9,1160.0,826.0,718.0,108.0,864.0,826.0,1100.1,Vitis vinifera L.; Eucalyptus L'Hér.; Tracheophyta; Magnoliopsida
2006,2006-07-15,Porto,Gondomar,São Pedro da Cova,L.ERVEDOSA (Ervedosa),41.1705593,-8.5087936,NC,165.0,2006-07-15T07:00,24.7,76,20.2,27.4,0.0,0.0,0.0,0.0,0,1016.1,997.1,1,0,0,3,0.1,0.74,8.7,15.4,97,106,19.1,24.2,26.4,21.9,17.0,0.114,0.15,0.228,0.348,1,3600.0,190.6,110.3,80.2,364.2,190.6,401.0,133.0,77.0,56.0,364.2,133.0,279.8,Magnoliopsida; Tracheophyta; Eucalyptus L'Hér.; Pinus pinaster Aiton
2006,2006-07-09,Porto,Paredes,Beire,LUGAR DE REDONDO (Lugar),41.2451216,-8.3240436,NC,192.0,2006-07-09T03:00,17.0,89,15.2,18.0,0.0,0.0,0.0,0.0,1,1018.3,995.6,30,0,0,99,0.0,0.21,4.7,3.1,122,144,6.5,17.4,22.6,19.7,16.1,0.125,0.175,0.247,0.358,0,0.0,0.0,0.0,0.0,0.0,0.0,0.0,0.0,0.0,0.0,0.0,0.0,0.0,Magnoliopsida; Pinus pinaster Aiton; Eucalyptus L'Hér.; Tracheophyta; Vitis vinifera L.
2006,2006-07-17,Porto,Gondomar,Rio Tinto,RUA DA FONTELA (Rua do Padre Dehon),41.1807166,-8.5575691,NC,71.0,2006-07-17T22:00,24.4,69,18.3,26.6,0.0,0.0,0.0,0.0,0,1015.8,1007.6,0,0,0,0,0.02,0.95,5.8,9.2,180,169,12.2,26.9,28.6,23.1,17.8,0.119,0.147,0.225,0.348,0,0.0,0.0,0.0,0.0,0.0,0.0,0.0,0.0,0.0,0.0,0.0,0.0,0.0,Tracheophyta; Magnoliopsida
2006,2006-07-17,Porto,Maia,Maia,QUINTA MOSTEIRO (Quinta da Boa Vista),41.2329846,-8.6222375,NC,100.0,2006-07-17T14:00,32.4,40,17.0,34.5,0.0,0.0,0.0,0.0,1,1014.5,1003.2,21,0,1,67,0.72,2.93,14.8,18.0,241,237,29.5,36.1,28.1,22.8,17.6,0.119,0.148,0.225,0.348,1,3600.0,862.5,720.2,142.3,802.3,862.5,1188.4,885.0,739.0,146.0,802.3,885.0,1219.5,Tracheophyta; Eucalyptus L'Hér.; Magnoliopsida
2006,2006-07-18,Porto,Penafiel,Cabeça Santa,Fontão de Cima,41.1341641,-8.2831721,NC,275.0,2006-07-18T16:00,28.7,36,12.3,27.6,0.0,0.0,0.0,0.0,0,1015.1,984.1,8,0,0,25,0.4,2.51,12.4,16.5,98,101,32.4,29.8,25.8,22.3,16.6,0.106,0.161,0.241,0.35,1,3600.0,390.8,148.8,242.0,217.2,390.8,907.6,428.0,163.0,265.0,217.2,428.0,993.9,Eucalyptus L'Hér.; Magnoliopsida; Tracheophyta; Vitis vinifera L.
2006,2006-07-20,Porto,Felgueiras,Margaride (santa Eulália),SÃO DOMINGOS,41.3667229,-8.203496330346734,NC,298.0,2006-07-20T16:00,26.1,54,16.2,27.6,0.0,0.0,0.0,0.0,0,1018.9,984.9,0,0,0,1,0.5,1.54,11.4,13.9,281,280,31.7,32.3,25.1,22.3,16.7,0.113,0.15,0.231,0.347,1,3600.0,654.4,533.9,120.5,783.4,654.4,902.7,717.0,585.0,132.0,783.4,717.0,989.1,Magnoliopsida; Tracheophyta; Eucalyptus L'Hér.
2006,2006-07-15,Porto,Paredes,Beire,LUGAR DE TOURIL (Lugar),41.2451216,-8.3240436,NC,192.0,2006-07-15T18:00,31.9,39,16.3,32.8,0.0,0.0,0.0,0.0,0,1015.4,993.8,9,0,7,15,0.3,2.88,8.7,11.8,300,301,24.5,33.7,28.0,21.8,16.6,0.119,0.157,0.233,0.353,1,3600.0,252.2,172.7,79.5,478.4,252.2,477.9,314.0,215.0,99.0,478.4,314.0,594.9,Magnoliopsida; Pinus pinaster Aiton; Eucalyptus L'Hér.; Tracheophyta; Vitis vinifera L.
2006,2006-07-17,Porto,Vila Nova de Gaia,Grijó,BR. SOCIAL (Rua do Centro Social São Salvador),41.0249875,-8.5816354,NC,115.0,2006-07-17T11:00,33.5,34,15.7,35.3,0.0,0.0,0.0,0.0,0,1015.4,1002.5,9,0,0,29,0.65,3.39,10.3,12.7,192,187,25.9,35.5,28.1,22.9,17.8,0.091,0.123,0.189,0.323,1,3600.0,830.9,710.5,120.4,812.9,830.9,1157.2,787.0,673.0,114.0,812.9,787.0,1096.1,Eucalyptus L'Hér.; Tracheophyta; Magnoliopsida
2006,2006-07-15,Porto,Vila Nova de Gaia,Vila Nova De Gaia (santa Marinha),Rua da Barroca,41.0345229,-8.4876292,NC,92.0,2006-07-15T20:00,29.4,55,19.3,31.6,0.0,0.0,0.0,0.0,0,1015.8,1005.3,0,0,0,0,0.09,1.85,8.7,13.4,343,355,19.1,31.5,29.4,22.5,17.8,0.117,0.122,0.181,0.324,1,2097.77,0.0,0.0,0.0,0.0,0.0,0.0,49.0,27.0,22.0,215.6,49.0,116.4,Tracheophyta; Quercus L.; Pinus pinea L.; Pinales; Magnoliopsida; Eucalyptus L'Hér.
