2006,2006-05-09,Viseu,São João da Pesqueira,Trevões,TREVÕES,41.1460224,-7.4005111,NC,620.0,2006-05-09T16:00,20.4,35,4.2,19.6,0.0,0.0,0.0,0.0,1,1015.2,945.0,23,0,13,51,0.42,1.57,2.7,3.7,247,241,14.4,23.3,15.4,12.6,9.5,0.178,0.246,0.314,0.296,1,3600.0,621.9,520.3,101.6,834.0,621.9,837.6,692.0,579.0,113.0,834.0,692.0,932.1,Olea europaea L.; Vitis vinifera L.; Magnoliopsida; Tracheophyta; Pinus pinaster Aiton
2006,2006-05-29,Viseu,Sátão,Forles,FRAGA (FORLES),40.8545608,-7.676406776854621,Desconhecida,785.0,2006-05-29T12:00,28.3,36,11.6,29.7,0.0,0.0,0.0,0.0,0,1014.2,928.6,14,0,19,8,0.68,2.48,8.6,10.4,345,346,24.5,28.3,20.1,14.8,10.6,0.155,0.205,0.288,0.341,1,3600.0,934.0,796.2,137.8,848.1,934.0,1250.3,915.0,780.0,135.0,848.1,915.0,1224.8,Magnoliopsida; Tracheophyta; Pinus pinaster Aiton
2006,2006-05-16,Viseu,Tondela,Dardavaz,ALTO DO PENDÃO (Alto da Visquela),40.4769231,-8.1134275,NC,226.0,2006-05-16T13:00,25.9,49,14.3,28.4,0.0,0.0,0.0,0.0,1,1016.4,990.6,30,0,0,100,0.59,1.71,5.1,6.6,231,225,16.2,27.2,18.3,15.4,12.2,0.154,0.241,0.322,0.34,1,3600.0,840.9,535.4,305.5,578.8,840.9,1238.0,845.0,538.0,307.0,578.8,845.0,1244.1,Pinus pinaster Aiton; Eucalyptus L'Hér.; Tracheophyta; Magnoliopsida
2006,2006-05-18,Viseu,Tabuaço,Granja do Tedo,GRANJA DO TEDO,41.0642514,-7.61462848213135,NC,343.0,2006-05-18T16:00,19.6,45,7.5,17.4,0.0,0.0,0.0,0.0,0,1023.0,983.0,0,0,0,0,0.44,1.25,16.6,22.7,288,288,44.3,24.6,20.0,15.8,11.4,0.187,0.231,0.309,0.335,1,3600.0,644.8,545.4,99.3,845.7,644.8,862.5,714.0,604.0,110.0,845.7,714.0,955.1,Olea europaea L.; Magnoliopsida; Pinus pinaster Aiton
2006,2006-09-02,Viseu,São João da Pesqueira,Paredes da Beira,PAREDES (PAREDES DA BEIRA),41.064976,-7.4765,NC,767.0,2006-09-02T20:00,23.5,48,12.0,23.1,0.0,0.0,0.0,0.0,0,1018.0,932.6,0,0,0,0,0.05,1.49,7.1,11.5,311,319,13.7,26.4,26.0,22.2,18.9,0.133,0.145,0.16,0.274,0,0.0,0.0,0.0,0.0,0.0,0.0,0.0,0.0,0.0,0.0,0.0,0.0,0.0,Magnoliopsida; Olea europaea L.; Tracheophyta; Castanea sativa Mill.; Pinus pinaster Aiton
2006,2006-05-20,Viseu,Nelas,Moreira,NÓ DE FAGILDE (Moreira),40.51924,-7.859607564669652,Desconhecida,422.0,2006-05-20T15:00,19.7,52,9.5,17.9,0.0,0.0,0.0,0.0,3,1017.8,969.1,86,72,0,71,0.41,1.11,15.7,20.4,302,302,38.2,21.8,16.9,15.4,11.7,0.162,0.252,0.328,0.374,1,3600.0,614.1,453.5,160.6,578.1,614.1,1048.3,654.0,483.0,171.0,578.1,654.0,1116.4,Pinus pinaster Aiton; Magnoliopsida; Vitis vinifera L.; Tracheophyta
2006,2006-11-02,Viseu,Cinfães,Souselo,Chousas,41.0633131,-8.217454,NC,298.0,2006-11-02T13:00,18.8,66,12.3,17.4,0.0,0.0,0.0,0.0,1,1015.4,980.7,43,9,10,96,0.28,0.74,14.5,20.4,97,98,35.3,18.4,15.9,17.1,18.9,0.37,0.38,0.395,0.341,1,3600.0,478.5,346.8,131.7,633.4,478.5,760.9,487.0,353.0,134.0,633.4,487.0,774.5,Tracheophyta; Eucalyptus L'Hér.; Acacia Mill.; Pinus pinaster Aiton
2006,2006-02-03,Viseu,Castro Daire,Parada de Ester,PARADA (PARADA DE ESTER),40.930764100000005,-8.053841572509667,NC,441.0,2006-02-03T18:00,11.2,79,7.6,9.4,0.0,0.0,0.0,0.0,0,1013.1,961.1,2,2,0,0,0.02,0.29,7.9,11.8,309,320,19.8,9.5,7.6,6.1,10.2,0.367,0.357,0.37,0.349,0,1393.41,0.0,0.0,0.0,0.0,0.0,0.0,35.0,20.0,15.0,187.8,35.0,89.7,Magnoliopsida; Pinus pinaster Aiton; Pinales; Tracheophyta; Eucalyptus L'Hér.
2006,2006-06-02,Viseu,Viseu,Ribafeita,Lustosa,40.7371304,-7.939349050731874,NC,590.0,2006-06-02T02:00,15.0,70,9.6,14.2,0.0,0.0,0.0,0.0,0,1021.8,953.2,1,0,2,0,0.0,0.5,4.8,5.5,42,32,7.9,15.1,19.4,16.9,12.0,0.112,0.201,0.291,0.353,0,0.0,0.0,0.0,0.0,0.0,0.0,0.0,0.0,0.0,0.0,0.0,0.0,0.0,Magnoliopsida; Pinus pinaster Aiton
2006,2006-02-05,Viseu,Cinfães,Alhões,BIGORNE (ALHÕES),40.9846443,-8.013408,NC,1026.0,2006-02-05T19:00,2.9,72,-1.6,-0.8,0.0,0.0,0.0,0.0,0,1023.9,903.2,0,0,0,0,0.01,0.21,9.2,16.1,69,70,25.9,2.4,2.3,3.1,6.9,0.346,0.354,0.366,0.342,0,0.0,0.0,0.0,0.0,0.0,0.0,0.0,0.0,0.0,0.0,0.0,0.0,0.0,Tracheophyta; Magnoliopsida; Quercus L.; Pinus pinaster Aiton; 
2006,2006-08-14,Viseu,Viseu,Viseu (santa Maria De Viseu),R.BARREIRO (Rua Gaspar Barreiros),40.659794950000006,-7.910799534735117,Desconhecida,487.0,2006-08-14T01:00,21.9,49,10.6,21.8,0.0,0.0,0.0,0.0,1,1010.6,955.5,29,0,0,98,0.0,1.35,1.3,4.7,236,247,5.8,22.2,27.6,24.4,19.3,0.083,0.145,0.216,0.328,0,0.0,0.0,0.0,0.0,0.0,0.0,0.0,0.0,0.0,0.0,0.0,0.0,0.0,Magnoliopsida; Tracheophyta; Pinus pinaster Aiton
2006,2006-05-29,Viseu,Tarouca,Ucanha,UCANHA,41.048621350000005,-7.734668200971046,NC,586.0,2006-05-29T14:00,29.9,33,11.8,30.2,0.0,0.0,0.0,0.0,0,1012.8,948.4,16,0,26,0,0.61,2.83,10.4,13.5,304,304,24.1,29.8,21.2,15.4,11.2,0.166,0.21,0.293,0.364,1,3600.0,743.2,615.3,127.9,693.5,743.2,1181.5,767.0,635.0,132.0,693.5,767.0,1219.4,Tracheophyta; Magnoliopsida; Castanea sativa Mill.; Olea europaea L.; Quercus L.; Pinus pinaster Aiton; Vitis vinifera L.; Pinales
2006,2006-02-06,Viseu,Cinfães,Alhões,POV.PENELA (ALHÕES),40.9846443,-8.013408,NC,1026.0,2006-02-06T18:00,4.9,64,-1.4,1.2,0.0,0.0,0.0,0.0,0,1025.8,905.7,0,0,0,0,0.03,0.32,9.7,13.9,63,69,18.4,3.3,1.8,3.0,6.9,0.342,0.351,0.365,0.342,0,1566.41,0.0,0.0,0.0,0.0,0.0,0.0,42.0,26.0,16.0,234.2,42.0,96.0,Tracheophyta; Magnoliopsida; Quercus L.; Pinus pinaster Aiton; 
2006,2006-05-23,Viseu,Viseu,Cepões,VILA CHA DE SÁ,40.7496141,-7.8025574,NC,527.0,2006-05-23T00:00,7.8,86,5.6,5.8,0.0,0.0,0.0,0.0,0,1021.6,958.5,19,1,0,59,0.0,0.15,5.9,7.9,281,294,10.8,10.7,15.4,15.4,11.6,0.166,0.237,0.319,0.359,0,0.0,0.0,0.0,0.0,0.0,0.0,0.0,0.0,0.0,0.0,0.0,0.0,0.0,Magnoliopsida; Tracheophyta; Pinales; Eucalyptus L'Hér.; Pinus pinaster Aiton; ; Olea europaea L.
2006,2006-02-07,Viseu,Cinfães,Santiago de Piães,Cruz,41.0701644,-8.1554173,NC,342.0,2006-02-07T12:00,10.2,55,1.6,7.0,0.0,0.0,0.0,0.0,0,1024.9,983.7,0,0,0,0,0.24,0.56,9.8,13.1,98,99,28.8,5.6,3.0,5.8,9.5,0.347,0.357,0.373,0.364,1,3600.0,576.3,492.0,84.3,912.8,576.3,758.0,547.0,467.0,80.0,912.8,547.0,719.5,Magnoliopsida; Pinus pinaster Aiton; Quercus L.; Tracheophyta; Eucalyptus L'Hér.; Castanea sativa Mill.; 
2006,2006-06-03,Viseu,Armamar,Santa Cruz,Campo,41.0669624,-7.6868505,NC,730.0,2006-06-03T15:00,25.4,19,0.0,22.3,0.0,0.0,0.0,0.0,0,1020.0,938.9,0,0,0,0,0.67,2.63,18.3,23.8,58,58,41.8,27.7,19.4,16.4,11.4,0.133,0.173,0.262,0.316,1,3600.0,836.8,734.1,102.7,915.3,836.8,1066.2,888.0,779.0,109.0,915.3,888.0,1131.5,Magnoliopsida; Pinus pinaster Aiton; Quercus L.; Vitis vinifera L.; Eucalyptus L'Hér.; Acacia Mill.; Tracheophyta; Castanea sativa Mill.; Quercus suber L.; 
2006,2006-09-11,Viseu,Tarouca,Granja Nova,Formilo,41.0309426,-7.7248238,NC,737.0,2006-09-11T16:00,19.8,56,10.8,18.3,0.0,0.0,0.0,0.0,2,1016.7,933.6,62,8,64,54,0.19,1.02,12.0,15.2,279,277,23.4,23.8,22.3,22.6,19.1,0.144,0.137,0.164,0.305,1,338.1,182.4,35.8,146.6,71.3,182.4,677.8,209.0,41.0,168.0,71.3,209.0,776.6,Magnoliopsida; Castanea sativa Mill.; Pinus pinaster Aiton; Tracheophyta; Pinales
2006,2006-09-03,Viseu,Sátão,Ferreira de Aves,Outeiro de Cima,40.8100575,-7.6644267,Desconhecida,673.0,2006-09-03T14:00,31.6,23,8.0,32.2,0.0,0.0,0.0,0.0,0,1019.9,946.3,0,0,0,0,0.64,3.58,5.2,6.0,344,343,19.8,35.1,24.1,21.9,19.0,0.102,0.149,0.183,0.287,1,3600.0,816.1,719.7,96.4,924.8,816.1,1046.4,847.0,747.0,100.0,924.8,847.0,1086.0,Pinales; Pinus pinaster Aiton; Magnoliopsida
2006,2006-06-04,Viseu,Mortágua,Mortágua,Vale de Açores,40.3908854,-8.24109454072914,NC,93.0,2006-06-04T13:00,31.1,19,4.9,32.0,0.0,0.0,0.0,0.0,0,1017.8,1007.2,0,0,0,0,0.74,3.66,4.7,6.1,157,152,24.1,35.2,23.3,19.8,14.8,0.07,0.113,0.194,0.265,1,3600.0,991.1,875.6,115.5,925.9,991.1,1256.9,995.0,879.0,116.0,925.9,995.0,1261.9,Tracheophyta; Eucalyptus L'Hér.; Pinus pinaster Aiton
2006,2006-08-14,Viseu,Sernancelhe,Fonte Arcada,FONTE ARCADA,40.9661842,-7.5221083,NC,625.0,2006-08-14T01:00,19.7,46,7.8,18.5,0.0,0.0,0.0,0.0,1,1010.6,940.0,29,0,0,98,0.02,1.23,4.3,4.7,294,328,11.9,21.2,26.8,23.9,18.7,0.11,0.151,0.175,0.276,0,0.0,0.0,0.0,0.0,0.0,0.0,0.0,0.0,0.0,0.0,0.0,0.0,0.0,Magnoliopsida; Pinus pinaster Aiton; Tracheophyta; Pinales; Castanea sativa Mill.; Olea europaea L.; Quercus L.; Vitis vinifera L.; 
2006,2006-09-04,Viseu,Carregal do Sal,Oliveira do Conde,Oliveirinha,40.4436102,-7.979785,NC,306.0,2006-09-04T16:00,36.3,20,9.7,35.2,0.0,0.0,0.0,0.0,0,1019.2,985.4,0,0,0,0,0.53,4.83,8.9,11.0,333,337,22.7,38.7,27.3,23.5,20.6,0.096,0.144,0.163,0.273,1,3600.0,534.0,456.3,77.7,839.6,534.0,731.1,605.0,517.0,88.0,839.6,605.0,828.4,Tracheophyta; Vitis vinifera L.; Pinus pinaster Aiton; Magnoliopsida
2006,2006-05-29,Viseu,Armamar,Vila Seca,Qª SOL FONTELO,41.1231925,-7.6625396,NC,522.0,2006-05-29T15:00,30.8,31,11.6,30.9,0.0,0.0,0.0,0.0,0,1012.1,954.7,12,0,18,4,0.64,3.08,12.4,16.3,300,301,27.4,31.4,22.3,15.9,11.5,0.152,0.194,0.282,0.354,1,3600.0,740.6,623.9,116.7,784.9,740.6,1058.6,787.0,663.0,124.0,784.9,787.0,1124.9,Magnoliopsida; Vitis vinifera L.; Olea europaea L.
2006,2006-04-20,Viseu,Sernancelhe,Granjal,GRANJAL,40.8880426,-7.5303027,NC,686.0,2006-04-20T15:00,14.8,62,7.6,12.2,0.0,0.0,0.0,0.0,3,1015.4,936.6,100,98,66,96,0.19,0.64,13.3,18.6,237,238,31.0,15.2,12.0,10.6,8.7,0.305,0.319,0.33,0.272,1,0.0,259.2,18.6,240.6,26.0,259.2,974.2,278.0,20.0,258.0,26.0,278.0,1044.9,Magnoliopsida; Quercus L.; Castanea sativa Mill.; Pinus pinaster Aiton; Tracheophyta; 
2006,2006-10-11,Viseu,Lamego,Lamego (almacave),URTIGOSA (ALMACAVE),41.09660495,-7.806508113627049,NC,490.0,2006-10-11T16:00,15.7,59,7.7,13.2,0.0,0.0,0.0,0.0,1,1018.8,961.7,42,35,0,34,0.18,0.73,13.2,18.9,299,301,37.1,18.1,17.1,17.6,19.3,0.388,0.378,0.239,0.314,1,3600.0,233.3,127.7,105.6,374.9,233.3,467.6,285.0,156.0,129.0,374.9,285.0,571.3,Magnoliopsida; Olea europaea L.; Tracheophyta; Pinales
2006,2006-08-14,Viseu,Cinfães,Fornelos,Sarabagos,41.029825,-8.1811825,NC,702.0,2006-08-14T14:00,27.7,30,8.7,28.2,0.0,0.0,0.0,0.0,0,1010.1,933.3,7,0,0,22,0.64,2.58,8.0,9.6,260,257,24.5,34.3,24.6,22.0,17.4,0.098,0.14,0.209,0.33,1,3600.0,854.8,706.3,148.4,835.2,854.8,1127.4,881.0,728.0,153.0,835.2,881.0,1161.9,Quercus L.; Eucalyptus L'Hér.; Magnoliopsida; Vitis vinifera L.; Tracheophyta; Pinales; 
2006,2006-08-14,Viseu,Cinfães,Nespereira,SANTA MARINHA,41.0028683,-8.1605957,NC,326.0,2006-08-14T14:00,29.1,34,11.6,30.0,0.0,0.0,0.0,0.0,0,1010.2,973.8,4,0,0,13,0.67,2.67,10.6,13.1,260,261,28.8,35.5,26.1,23.6,19.0,0.099,0.138,0.205,0.329,1,3600.0,858.9,710.4,148.5,839.4,858.9,1128.1,885.0,732.0,153.0,839.4,885.0,1162.4,Magnoliopsida; Tracheophyta; Quercus L.; Eucalyptus L'Hér.
2006,2006-05-20,Viseu,Lamego,Cambres,QTA. STO. ANTÓNIO,41.1586361,-7.795992957846988,NC,62.0,2006-05-20T16:00,20.0,67,13.8,19.1,0.0,0.0,0.0,0.0,3,1017.7,1010.4,97,76,5,86,0.26,0.77,14.8,20.5,269,269,39.6,22.2,18.8,17.6,13.4,0.185,0.229,0.309,0.361,1,3600.0,361.7,194.4,167.3,299.1,361.7,868.4,400.0,215.0,185.0,299.1,400.0,960.3,Vitis vinifera L.; Tracheophyta
2006,2006-05-29,Viseu,Cinfães,São Cristovão De Nogueira,PAUVES,41.0744659,-8.098358098465711,NC,408.0,2006-05-29T15:00,30.7,36,13.8,31.4,0.0,0.0,0.0,0.0,1,1011.9,966.7,23,0,38,0,0.66,2.85,13.5,17.6,312,314,30.2,30.0,22.0,16.1,12.2,0.18,0.222,0.303,0.387,1,3600.0,770.4,665.9,104.5,834.6,770.4,1062.4,818.0,707.0,111.0,834.6,818.0,1128.0,Tracheophyta; Quercus L.; Magnoliopsida; Pinus pinaster Aiton
2006,2006-05-29,Viseu,Armamar,Santa Cruz,Campo,41.0669624,-7.6868505,NC,730.0,2006-05-29T18:00,28.3,31,9.8,26.1,0.0,0.0,0.0,0.0,0,1010.6,930.9,8,0,5,16,0.32,2.63,14.5,20.0,300,300,29.2,28.4,22.5,15.6,11.0,0.144,0.189,0.276,0.318,1,3600.0,230.6,155.8,74.8,471.6,230.6,439.9,293.0,198.0,95.0,471.6,293.0,559.0,Magnoliopsida; Pinus pinaster Aiton; Quercus L.; Vitis vinifera L.; Eucalyptus L'Hér.; Acacia Mill.; Tracheophyta; Castanea sativa Mill.; Quercus suber L.; 
2006,2006-05-31,Viseu,Vila Nova de Paiva,Vila Cova à Coelheira,Ponte do Rio Covo,40.9401466,-7.7762141,NC,825.0,2006-05-31T16:00,21.5,23,-0.6,17.8,0.0,0.0,0.0,0.0,0,1013.2,921.6,0,0,0,0,0.53,1.98,17.1,21.9,65,67,43.9,24.2,18.7,15.2,10.4,0.138,0.213,0.299,0.368,1,3600.0,685.5,593.8,91.7,887.8,685.5,890.1,755.0,654.0,101.0,887.8,755.0,980.3,Tracheophyta; Magnoliopsida
2006,2006-02-07,Viseu,Cinfães,Alhões,VALDIGEM (ALHÕES),40.9846443,-8.013408,NC,1026.0,2006-02-07T19:00,4.6,69,-0.7,1.5,0.0,0.0,0.0,0.0,0,1021.9,902.1,0,0,0,0,0.01,0.27,6.0,8.6,57,75,15.5,1.7,1.7,2.9,6.8,0.339,0.349,0.364,0.342,0,0.0,0.0,0.0,0.0,0.0,0.0,0.0,0.0,0.0,0.0,0.0,0.0,0.0,Tracheophyta; Magnoliopsida; Quercus L.; Pinus pinaster Aiton; 
2006,2006-05-23,Viseu,Lamego,Ferreirim,Barroncal,41.0458264,-7.7811537,NC,492.0,2006-05-23T18:00,15.8,47,4.5,12.6,0.0,0.0,0.0,0.0,0,1024.4,966.8,0,0,0,0,0.22,0.96,13.4,18.9,306,309,33.5,18.4,15.6,14.6,11.2,0.202,0.219,0.302,0.356,1,3600.0,270.8,194.5,76.2,614.9,270.8,422.2,348.0,250.0,98.0,614.9,348.0,542.6,Magnoliopsida; Pinales; Vitis vinifera L.; Castanea sativa Mill.; Tracheophyta; Quercus L.; Pinus pinaster Aiton; Olea europaea L.; 
2006,2006-02-10,Viseu,Vila Nova de Paiva,Touro,VALE DA CERVA (Vale da Lapa),40.9401466,-7.7762141,NC,825.0,2006-02-10T19:00,9.0,73,4.4,6.9,0.0,0.0,0.0,0.0,2,1016.3,920.5,53,1,82,10,0.0,0.31,5.4,6.1,48,50,9.4,6.0,4.9,4.1,7.7,0.339,0.342,0.359,0.336,0,0.0,0.0,0.0,0.0,0.0,0.0,0.0,0.0,0.0,0.0,0.0,0.0,0.0,Magnoliopsida; Pinus pinaster Aiton; Tracheophyta; Eucalyptus L'Hér.; Quercus L.; 
2006,2006-06-04,Viseu,Nelas,Moreira,CUNHA BAIXA (Moreira),40.5682474,-7.7583668,Desconhecida,438.0,2006-06-04T16:00,29.3,16,0.8,28.6,0.0,0.0,0.0,0.0,0,1017.1,968.2,0,0,0,0,0.5,3.42,0.7,1.1,180,162,15.5,33.6,22.5,18.1,12.8,0.091,0.205,0.294,0.355,1,3600.0,682.4,588.8,93.6,873.3,682.4,896.2,751.0,648.0,103.0,873.3,751.0,986.3,Magnoliopsida; Olea europaea L.; Pinus pinaster Aiton; Vitis vinifera L.
2006,2006-05-24,Viseu,São João da Pesqueira,São João da Pesqueira,SRA DO VISO,41.14216785,-7.413788551003492,NC,649.0,2006-05-24T21:00,14.7,59,6.8,12.6,0.0,0.0,0.0,0.0,0,1026.0,950.5,0,0,0,0,0.03,0.68,8.8,11.2,289,303,16.6,16.6,17.1,14.4,10.6,0.138,0.202,0.283,0.295,0,0.0,0.0,0.0,0.0,0.0,0.0,0.0,0.0,0.0,0.0,0.0,0.0,0.0,Magnoliopsida; Vitis vinifera L.; Olea europaea L.; Tracheophyta
2006,2006-05-31,Viseu,Tarouca,Vila Chã da Beira,VILA CHA DA BEIRA,40.99439925,-7.746044561251945,NC,546.0,2006-05-31T22:00,16.8,25,-3.2,11.8,0.0,0.0,0.0,0.0,0,1016.3,953.4,0,0,0,0,0.15,1.43,17.2,32.4,70,73,43.6,18.0,20.0,16.5,11.6,0.145,0.186,0.274,0.353,0,0.0,0.0,0.0,0.0,0.0,0.0,0.0,0.0,0.0,0.0,0.0,0.0,0.0,Magnoliopsida; Castanea sativa Mill.; Pinus pinaster Aiton; Tracheophyta; Pinales; Vitis vinifera L.
2006,2006-06-01,Viseu,Sátão,Ferreira de Aves,Soito,40.8100575,-7.6644267,Desconhecida,673.0,2006-06-01T08:00,11.8,49,1.5,7.6,0.0,0.0,0.0,0.0,0,1019.7,941.2,9,7,4,0,0.2,0.71,15.9,21.3,77,79,40.3,15.0,17.8,16.5,11.4,0.114,0.198,0.285,0.324,1,3600.0,449.7,347.5,102.2,670.7,449.7,689.4,374.0,289.0,85.0,670.7,374.0,573.3,Pinales; Pinus pinaster Aiton; Magnoliopsida
2006,2006-02-11,Viseu,Vila Nova de Paiva,Touro,Adomingueiros,40.9136411,-7.7663801,NC,832.0,2006-02-11T17:00,11.6,63,4.9,9.2,0.0,0.0,0.0,0.0,2,1017.9,922.1,53,36,35,0,0.09,0.5,7.7,15.0,298,300,25.2,10.1,6.0,4.3,7.6,0.334,0.34,0.358,0.336,1,3600.0,113.8,72.7,41.1,431.0,113.8,236.9,169.0,108.0,61.0,431.0,169.0,351.9,Magnoliopsida; Pinus pinaster Aiton; Tracheophyta; Eucalyptus L'Hér.; Quercus L.; 
2006,2006-05-26,Viseu,Armamar,Santa Cruz,SANTA CRUZ,41.0529135,-7.669638611200908,NC,751.0,2006-05-26T22:00,20.0,49,8.9,18.3,0.0,0.0,0.0,0.0,0,1023.0,937.9,0,0,0,1,0.06,1.19,9.5,16.4,143,147,17.6,18.4,18.8,13.9,10.6,0.174,0.215,0.296,0.348,0,0.0,0.0,0.0,0.0,0.0,0.0,0.0,0.0,0.0,0.0,0.0,0.0,0.0,Magnoliopsida; Pinus pinaster Aiton; Quercus L.; Vitis vinifera L.; Eucalyptus L'Hér.; Acacia Mill.; Tracheophyta; Castanea sativa Mill.; Quercus suber L.; 
2006,2006-09-11,Viseu,Viseu,Cavernães,Carragosela,40.7023553,-7.8298267,NC,497.0,2006-09-11T17:00,20.4,58,11.8,19.2,0.0,0.0,0.0,0.0,2,1016.8,960.0,60,12,55,54,0.15,1.01,11.9,15.9,284,283,23.0,24.7,23.9,24.3,21.0,0.091,0.152,0.198,0.307,1,1408.01,112.3,35.6,76.7,106.9,112.3,449.2,142.0,45.0,97.0,106.9,142.0,568.1,Tracheophyta; Pinus pinaster Aiton; Vitis vinifera L.; Magnoliopsida
2006,2006-09-05,Viseu,Castro Daire,Castro Daire,PARQUE EOLICO DE MONTEMURO (Parque de Merendas),40.91465745,-7.920020147736607,NC,660.0,2006-09-05T21:00,24.0,63,16.4,25.7,0.0,0.0,0.0,0.0,0,1017.2,943.4,8,0,0,26,0.01,1.12,3.7,6.4,299,313,16.9,25.9,26.1,21.6,18.9,0.107,0.165,0.196,0.321,0,0.0,0.0,0.0,0.0,0.0,0.0,0.0,0.0,0.0,0.0,0.0,0.0,0.0,Pinus pinaster Aiton; Magnoliopsida; Pinales; Eucalyptus L'Hér.; Tracheophyta
2006,2006-05-23,Viseu,Lamego,Ferreirim,Barroncal,41.0458264,-7.7811537,NC,492.0,2006-05-23T16:00,16.9,40,3.2,13.1,0.0,0.0,0.0,0.0,0,1023.9,966.6,4,1,6,0,0.34,1.16,15.1,20.5,303,304,32.4,20.0,15.2,14.6,11.2,0.203,0.219,0.303,0.356,1,3600.0,479.7,274.3,205.5,418.5,479.7,874.5,530.0,303.0,227.0,418.5,530.0,966.1,Magnoliopsida; Pinales; Vitis vinifera L.; Castanea sativa Mill.; Tracheophyta; Quercus L.; Pinus pinaster Aiton; Olea europaea L.; 
2006,2006-05-26,Viseu,Tondela,Castelões,Areal,40.5357118,-8.1394572,NC,295.0,2006-05-26T14:00,28.5,36,11.8,29.3,0.0,0.0,0.0,0.0,0,1021.0,987.6,1,0,1,0,0.69,2.5,12.6,16.2,53,53,27.0,29.3,19.7,15.8,12.8,0.132,0.213,0.302,0.351,1,3600.0,899.4,787.0,112.4,885.9,899.4,1184.3,928.0,812.0,116.0,885.9,928.0,1221.9,Eucalyptus L'Hér.; Pinus pinaster Aiton; Magnoliopsida; Acacia Mill.; Tracheophyta
2006,2006-05-28,Viseu,Lamego,Sande,SANDE,41.1231254,-7.77958,NC,278.0,2006-05-28T15:00,32.4,32,13.5,33.7,0.0,0.0,0.0,0.0,0,1019.0,987.9,17,0,29,0,0.57,3.32,5.9,7.3,317,327,19.1,31.8,22.5,16.6,12.6,0.166,0.203,0.288,0.359,1,3600.0,665.2,510.0,155.2,642.6,665.2,1057.2,707.0,542.0,165.0,642.6,707.0,1123.6,Vitis vinifera L.; Tracheophyta; Magnoliopsida; ; Eucalyptus L'Hér.
2006,2006-08-14,Viseu,Santa Comba Dão,Vimieiro,VIMIEIRO,40.38806335,-8.119280051003901,Desconhecida,189.0,2006-08-14T15:00,29.3,28,8.8,28.4,0.0,0.0,0.0,0.0,0,1010.1,988.8,2,0,0,8,0.65,2.93,14.0,17.3,271,271,31.3,36.3,27.7,24.8,19.7,0.098,0.134,0.178,0.295,1,3600.0,773.8,652.6,121.1,859.8,773.8,1011.9,824.0,695.0,129.0,859.8,824.0,1077.5,Olea europaea L.; Tracheophyta; Pinus pinaster Aiton; Magnoliopsida; Acacia Mill.
2006,2006-02-12,Viseu,Castro Daire,Cabril,Tulha Nova,40.9632262,-8.083475,NC,578.0,2006-02-12T13:00,12.8,56,4.4,10.3,0.0,0.0,0.0,0.0,0,1024.2,956.3,14,0,0,45,0.3,0.65,10.9,14.4,84,86,32.4,11.1,6.0,6.0,8.9,0.333,0.344,0.366,0.362,1,3600.0,613.1,528.7,84.4,913.7,613.1,812.3,610.0,526.0,84.0,913.7,610.0,808.2,Tracheophyta; Magnoliopsida
2006,2006-06-03,Viseu,Cinfães,Nespereira,Ervilhais,41.0279844,-8.1346609,NC,756.0,2006-06-03T19:00,23.8,25,2.4,20.9,0.0,0.0,0.0,0.0,0,1019.1,934.9,0,0,0,0,0.18,2.23,8.4,15.8,70,73,30.2,24.1,19.9,15.9,11.3,0.111,0.205,0.298,0.381,1,3600.0,125.8,90.2,35.6,568.7,125.8,210.9,198.0,142.0,56.0,568.7,198.0,331.9,Magnoliopsida; Tracheophyta; Quercus L.
2006,2006-06-05,Viseu,Viseu,Cavernães,Silvares,40.7087815,-7.8277373,NC,545.0,2006-06-05T07:00,18.3,38,3.6,15.2,0.0,0.0,0.0,0.0,0,1017.5,954.9,7,0,0,24,0.16,1.31,10.9,19.0,56,61,22.3,17.0,20.5,18.0,12.6,0.087,0.196,0.289,0.353,1,3600.0,271.3,192.3,79.1,561.1,271.3,455.3,199.0,141.0,58.0,561.1,199.0,333.9,Tracheophyta; Pinus pinaster Aiton; Magnoliopsida
2006,2006-08-15,Viseu,Cinfães,Santiago de Piães,Cristelo,41.0377709,-8.1597427,NC,710.0,2006-08-15T00:00,15.5,81,12.2,15.3,0.0,0.0,0.0,0.0,1,1011.5,930.6,25,0,0,83,0.0,0.33,6.4,10.7,218,220,15.1,19.8,24.8,22.0,17.4,0.098,0.14,0.208,0.33,0,0.0,0.0,0.0,0.0,0.0,0.0,0.0,0.0,0.0,0.0,0.0,0.0,0.0,Magnoliopsida; Pinus pinaster Aiton; Quercus L.; Tracheophyta; Eucalyptus L'Hér.; Castanea sativa Mill.; 
2006,2006-05-29,Viseu,Tondela,Castelões,Areal,40.5357118,-8.1394572,NC,295.0,2006-05-29T17:00,30.6,34,13.0,29.5,0.0,0.0,0.0,0.0,1,1010.8,977.9,22,0,35,4,0.43,2.9,14.0,18.5,305,307,28.8,31.6,24.2,17.3,13.0,0.111,0.198,0.291,0.349,1,3600.0,388.4,269.6,118.8,530.0,388.4,677.2,451.0,313.0,138.0,530.0,451.0,786.4,Eucalyptus L'Hér.; Pinus pinaster Aiton; Magnoliopsida; Acacia Mill.; Tracheophyta
2006,2006-04-27,Viseu,Cinfães,Tarouquela,VILA FELINA (Vila Alegre),41.070446,-8.1883932,NC,378.0,2006-04-27T15:00,23.7,51,13.0,24.9,0.0,0.0,0.0,0.0,0,1016.3,973.2,1,1,0,0,0.53,1.44,9.2,11.4,321,325,24.8,23.6,17.2,12.8,9.8,0.333,0.36,0.393,0.407,1,3600.0,760.2,663.9,96.3,898.8,760.2,997.7,813.0,710.0,103.0,898.8,813.0,1067.0,Magnoliopsida; Pinus pinaster Aiton; Quercus L.; Vitis vinifera L.; Tracheophyta; Eucalyptus L'Hér.; 
2006,2006-05-30,Viseu,Moimenta da Beira,Moimenta da Beira,MOIMENTA,40.98986275,-7.600615035359942,NC,606.0,2006-05-30T10:00,19.5,38,4.7,16.5,0.0,0.0,0.0,0.0,0,1013.0,944.3,0,0,0,0,0.47,1.42,18.5,24.5,69,70,44.6,23.4,20.8,16.5,11.2,0.125,0.179,0.263,0.299,1,3600.0,811.8,699.3,112.6,870.3,811.8,1069.6,750.0,646.0,104.0,870.3,750.0,988.1,Magnoliopsida; Tracheophyta; Castanea sativa Mill.; Pinus pinaster Aiton
2006,2006-04-28,Viseu,Resende,Resende,Cudiceira,41.105831,-7.9644114,NC,240.0,2006-04-28T18:00,21.3,45,8.8,20.7,0.0,0.0,0.0,0.0,0,1013.9,986.1,0,0,0,0,0.18,1.4,2.2,3.4,9,32,14.8,20.5,17.7,13.8,10.5,0.312,0.349,0.389,0.403,1,3600.0,225.3,172.5,52.8,670.9,225.3,347.0,307.0,235.0,72.0,670.9,307.0,472.8,Tracheophyta; Magnoliopsida; Pinales; Eucalyptus L'Hér.; Vitis vinifera L.
2006,2006-12-16,Viseu,Resende,Miomães,MIOMAES (MIOMÃES),41.0920399,-8.0081515,NC,255.0,2006-12-16T18:00,7.9,78,4.4,5.9,0.0,0.0,0.0,0.0,1,1029.3,998.0,43,0,21,100,0.0,0.23,4.7,5.4,94,98,6.8,6.5,7.1,10.2,15.9,0.378,0.386,0.405,0.416,0,0.0,0.0,0.0,0.0,0.0,0.0,0.0,0.0,0.0,0.0,0.0,0.0,0.0,Tracheophyta; Pinales; Magnoliopsida; Eucalyptus L'Hér.; Pinus pinaster Aiton; Olea europaea L.; ; Quercus L.
2006,2006-06-05,Viseu,Tondela,Ferreirós do Dão,FERREIRÓS DO DÃO,40.4726184,-8.0345479,NC,175.0,2006-06-05T18:00,31.9,20,5.9,29.1,0.0,0.0,0.0,0.0,0,1012.0,992.4,12,0,0,41,0.39,3.79,12.3,16.6,320,321,24.8,33.0,24.8,19.2,13.9,0.098,0.171,0.266,0.329,1,3600.0,305.2,243.3,61.8,710.6,305.2,455.0,385.0,307.0,78.0,710.6,385.0,574.0,Magnoliopsida; Tracheophyta; Pinus pinaster Aiton; Vitis vinifera L.; Pinales
2006,2006-05-31,Viseu,Cinfães,Oliveira Do Douro,MONTINHO,41.03267975,-8.108007450852401,NC,963.0,2006-05-31T13:00,19.0,27,-0.4,16.3,0.0,0.0,0.0,0.0,0,1014.5,907.5,0,0,0,0,0.62,1.61,19.6,26.6,76,77,55.4,22.6,17.1,14.3,9.7,0.128,0.22,0.307,0.384,1,3600.0,1005.5,889.0,116.5,947.0,1005.5,1249.4,1010.0,893.0,117.0,947.0,1010.0,1255.0,Pinus pinaster Aiton; Magnoliopsida; Quercus L.; Tracheophyta; 
2006,2006-05-28,Viseu,Viseu,Lordosa,Galifonge,40.7442752,-7.9057424,NC,544.0,2006-05-28T02:00,18.0,59,9.9,17.0,0.0,0.0,0.0,0.0,0,1020.0,957.3,0,0,0,0,0.03,0.85,7.2,10.7,53,57,16.2,18.0,20.6,15.5,11.7,0.114,0.226,0.312,0.373,0,0.0,0.0,0.0,0.0,0.0,0.0,0.0,0.0,0.0,0.0,0.0,0.0,0.0,Pinus pinaster Aiton; Magnoliopsida; Tracheophyta
2006,2006-02-12,Viseu,Vila Nova de Paiva,Vila Cova à Coelheira,RIBEIRA LAPA (Ribeira),40.9401466,-7.7762141,NC,825.0,2006-02-12T15:00,11.5,53,2.3,8.5,0.0,0.0,0.0,0.0,0,1023.1,927.5,10,0,0,34,0.25,0.64,8.7,10.8,60,64,25.9,10.3,5.2,4.5,7.6,0.329,0.339,0.357,0.337,1,3600.0,476.1,404.4,71.8,884.3,476.1,642.0,524.0,445.0,79.0,884.3,524.0,706.5,Tracheophyta; Magnoliopsida
2006,2006-06-02,Viseu,Viseu,Povolide,POVOA DE CALDE (Povoação),40.6590877,-7.799395,NC,416.0,2006-06-02T16:00,28.1,12,-4.5,25.0,0.0,0.0,0.0,0.0,0,1019.9,973.1,0,0,0,0,0.58,3.35,10.2,13.1,18,21,24.8,33.1,22.4,18.5,13.0,0.084,0.204,0.293,0.34,1,3600.0,689.3,595.8,93.5,887.1,689.3,893.2,759.0,656.0,103.0,887.1,759.0,983.5,Magnoliopsida; Olea europaea L.; Vitis vinifera L.; Pinus pinaster Aiton; Tracheophyta; Pinales
2006,2006-04-12,Viseu,Viseu,Ranhados,RANHADOS,40.6404554,-7.9065153,NC,449.0,2006-04-12T17:00,18.5,42,5.5,16.8,0.0,0.0,0.0,0.0,0,1016.5,964.7,0,0,0,0,0.26,1.23,4.0,5.1,360,8,15.8,18.6,13.9,11.3,9.5,0.343,0.368,0.395,0.379,1,3600.0,371.5,302.6,68.9,768.4,371.5,536.4,453.0,369.0,84.0,768.4,453.0,654.0,Tracheophyta; Pinus pinaster Aiton; Magnoliopsida; Vitis vinifera L.
2006,2006-05-27,Viseu,Viseu,São Pedro de France,Bassim,40.7112706,-7.7900159,NC,483.0,2006-05-27T20:00,28.5,33,10.5,27.9,0.0,0.0,0.0,0.0,0,1019.3,965.3,10,0,17,0,0.07,2.63,5.5,8.3,58,90,11.2,25.9,22.3,16.1,12.2,0.104,0.221,0.308,0.357,0,802.24,0.0,0.0,0.0,0.0,0.0,0.0,29.0,14.0,15.0,131.5,29.0,82.9,Magnoliopsida; Pinus pinaster Aiton; Tracheophyta; Vitis vinifera L.
2006,2006-08-15,Viseu,Mangualde,Mangualde,Pinheiro de Baixo,40.5913063,-7.7984891,Desconhecida,443.0,2006-08-15T18:00,19.5,56,10.4,16.9,0.0,0.0,0.0,0.0,0,1012.8,962.0,18,20,0,0,0.22,1.01,18.7,25.5,298,299,45.7,27.4,26.1,24.5,19.6,0.085,0.145,0.216,0.323,1,3600.0,211.8,143.4,68.4,530.4,211.8,360.6,285.0,193.0,92.0,530.4,285.0,485.3,Tracheophyta; Pinus pinaster Aiton; Olea europaea L.; Magnoliopsida; Vitis vinifera L.
2006,2006-05-28,Viseu,Tarouca,Várzea da Serra,VARZEA DA SERRA,40.997211,-7.82774,NC,899.0,2006-05-28T11:00,25.9,42,12.0,27.2,0.0,0.0,0.0,0.0,0,1021.4,922.6,0,0,0,0,0.6,1.94,7.3,9.1,81,81,25.9,24.5,17.7,13.5,9.9,0.184,0.223,0.302,0.371,1,3600.0,894.0,777.5,116.5,873.0,894.0,1186.5,852.0,741.0,111.0,873.0,852.0,1130.7,Magnoliopsida; Eucalyptus L'Hér.; Tracheophyta; Castanea sativa Mill.; Pinus pinaster Aiton; Pinales
2006,2006-02-13,Viseu,Cinfães,Souselo,Louredo,41.0697904,-8.231169,NC,187.0,2006-02-13T14:00,14.4,64,7.7,12.0,0.0,0.0,0.0,0.0,1,1022.7,1000.3,33,9,0,83,0.27,0.59,12.7,16.1,262,260,25.2,13.5,7.8,7.7,10.2,0.326,0.34,0.366,0.361,1,3600.0,520.1,398.0,122.1,729.1,520.1,766.1,541.0,414.0,127.0,729.1,541.0,796.9,Tracheophyta; Vitis vinifera L.; Magnoliopsida; Eucalyptus L'Hér.; Pinus pinaster Aiton
2006,2006-03-13,Viseu,Cinfães,Tarouquela,QUINTAS (Quinta),41.091352,-8.167931,NC,179.0,2006-03-13T15:00,20.3,51,9.9,20.0,0.0,0.0,0.0,0.0,1,1015.1,994.2,30,0,0,100,0.39,1.17,6.4,7.9,297,300,13.7,18.6,11.8,9.3,9.3,0.376,0.39,0.402,0.385,1,3600.0,594.3,478.7,115.5,813.3,594.3,815.5,643.0,518.0,125.0,813.3,643.0,882.3,Magnoliopsida; Pinus pinaster Aiton; Quercus L.; Vitis vinifera L.; Tracheophyta; Eucalyptus L'Hér.; 
