2006,2006-12-22,Viseu,Viseu,São Salvador,Paradinha,40.6387176,-7.9337419,NC,475.0,2006-12-22T15:00,8.3,61,1.1,5.0,0.0,0.0,0.0,0.0,0,1029.6,972.2,2,2,0,0,0.14,0.43,9.4,13.0,50,51,26.6,7.7,5.2,8.5,14.7,0.361,0.372,0.394,0.403,1,3600.0,276.1,218.6,57.4,745.1,276.1,414.8,322.0,255.0,67.0,745.1,322.0,483.8,Magnoliopsida; Tracheophyta; Pinus pinaster Aiton
2006,2006-05-28,Viseu,Viseu,Cepões,VILA CHA SÁ,40.7496141,-7.8025574,NC,527.0,2006-05-28T15:00,31.6,27,10.3,32.0,0.0,0.0,0.0,0.0,0,1018.5,960.4,19,0,32,0,0.55,3.4,4.8,6.1,42,45,17.3,34.2,22.5,16.2,12.0,0.099,0.218,0.306,0.357,1,3600.0,660.5,496.8,163.7,624.5,660.5,1059.6,702.0,528.0,174.0,624.5,702.0,1126.3,Magnoliopsida; Tracheophyta; Pinales; Eucalyptus L'Hér.; Pinus pinaster Aiton; ; Olea europaea L.
2006,2006-05-13,Viseu,Tabuaço,Sendim,SENDIM,41.0569305,-7.5112472,NC,519.0,2006-05-13T21:00,18.8,50,8.1,17.5,0.0,0.0,0.0,0.0,1,1017.4,957.8,29,0,0,98,0.03,1.1,5.6,7.8,345,22,11.2,17.5,18.4,14.2,10.4,0.175,0.227,0.306,0.301,0,0.0,0.0,0.0,0.0,0.0,0.0,0.0,0.0,0.0,0.0,0.0,0.0,0.0,Pinus pinaster Aiton; Magnoliopsida; Olea europaea L.; Tracheophyta
2006,2006-09-12,Viseu,Moimenta da Beira,Cabaços,CABAÇOS,41.0261919,-7.5737411,NC,935.0,2006-09-12T23:00,13.7,84,11.1,13.2,0.0,0.0,0.0,0.0,0,1013.9,908.1,3,0,5,0,0.0,0.25,5.4,11.5,262,272,10.8,17.1,20.6,21.3,18.1,0.147,0.135,0.157,0.276,0,0.0,0.0,0.0,0.0,0.0,0.0,0.0,0.0,0.0,0.0,0.0,0.0,0.0,Tracheophyta; Magnoliopsida; Pinus pinaster Aiton
2006,2006-06-11,Viseu,Moimenta da Beira,Sarzedo,SARZEDO,41.0135043,-7.6502683,NC,699.0,2006-06-11T16:00,26.7,40,11.9,25.7,0.0,0.0,0.0,0.0,1,1015.0,937.9,48,0,48,64,0.5,2.11,14.4,18.7,270,270,39.2,28.9,21.0,17.5,12.3,0.154,0.16,0.25,0.342,1,3600.0,586.6,444.5,142.1,652.5,586.6,903.8,644.0,488.0,156.0,652.5,644.0,992.3,Magnoliopsida; Pinus pinaster Aiton; Quercus L.; Castanea sativa Mill.; Tracheophyta
2006,2006-09-06,Viseu,Tabuaço,Tabuaço,TABUAÇO,41.11512999999999,-7.571356753671615,NC,542.0,2006-09-06T19:00,27.9,38,12.4,27.4,0.0,0.0,0.0,0.0,1,1012.5,952.4,28,0,0,93,0.11,2.31,8.9,19.8,284,289,26.6,30.9,28.7,23.5,20.0,0.134,0.152,0.162,0.291,0,1416.15,0.0,0.0,0.0,0.0,0.0,0.0,39.0,19.0,20.0,159.5,39.0,101.6,Magnoliopsida; Olea europaea L.; Tracheophyta; Vitis vinifera L.; Acacia Mill.
2006,2006-08-12,Viseu,Castro Daire,Pinheiro,PORTAS MONTEMURO (Póvoa de Montemuro),40.9204667,-7.9780049,NC,314.0,2006-08-12T07:00,23.4,52,13.0,23.5,0.0,0.0,0.0,0.0,0,1011.8,976.0,0,0,0,0,0.08,1.39,5.6,6.2,117,144,15.1,21.2,26.3,24.2,19.5,0.099,0.139,0.205,0.327,1,3186.85,168.6,109.1,59.5,452.0,156.9,321.5,102.0,66.0,36.0,420.5,102.0,194.5,Eucalyptus L'Hér.; Tracheophyta; Quercus L.; Magnoliopsida; Pinus pinaster Aiton; Pinales
2006,2006-08-12,Viseu,Viseu,Mundão,CASAL MUNDÃO,40.7102087,-7.8757823,Desconhecida,573.0,2006-08-12T15:00,32.2,20,6.7,31.2,0.0,0.0,0.0,0.0,0,1010.5,948.1,0,0,0,0,0.69,3.81,11.9,15.0,284,287,29.2,40.1,28.0,24.0,19.0,0.081,0.144,0.212,0.319,1,3600.0,781.4,687.5,93.9,904.2,781.4,1012.8,832.0,732.0,100.0,904.2,832.0,1078.4,Tracheophyta; Magnoliopsida; Pinus pinaster Aiton
2006,2006-08-12,Viseu,Tondela,Mouraz,Ribeira,40.4770455,-8.0691685,NC,283.0,2006-08-12T15:00,32.2,22,7.7,31.2,0.0,0.0,0.0,0.0,0,1010.4,979.0,0,0,0,0,0.7,3.77,13.7,17.6,284,285,32.4,38.2,28.5,24.6,19.5,0.096,0.134,0.179,0.3,1,3600.0,785.7,690.8,94.9,903.7,785.7,1018.2,836.0,735.0,101.0,903.7,836.0,1083.4,Eucalyptus L'Hér.; Magnoliopsida; Tracheophyta; Pinus pinaster Aiton
2006,2006-04-12,Viseu,Resende,São Martinho de Mouros,S.Martinho de Mouros (SÃO MARTINHO DE MOUROS),41.103744500000005,-7.895491868910255,NC,417.0,2006-04-12T14:00,18.1,43,5.4,18.7,0.0,0.0,0.0,0.0,0,1017.8,969.4,3,3,0,0,0.51,1.18,2.5,2.6,315,326,17.6,18.7,12.0,11.0,8.8,0.358,0.378,0.401,0.399,1,3600.0,836.7,738.3,98.4,934.0,836.7,1076.6,867.0,765.0,102.0,934.0,867.0,1115.5,Olea europaea L.; Tracheophyta; Magnoliopsida; Eucalyptus L'Hér.; Pinus pinaster Aiton; Pinales
2006,2006-04-17,Viseu,Santa Comba Dão,Treixedo,TREIXEDO,40.43897785,-8.10220135326528,NC,279.0,2006-04-17T23:00,9.4,94,8.5,8.8,0.0,0.0,0.0,0.0,0,1019.9,986.2,3,3,0,0,0.0,0.07,1.1,2.6,108,326,11.2,9.8,12.7,12.2,10.1,0.374,0.385,0.379,0.347,0,0.0,0.0,0.0,0.0,0.0,0.0,0.0,0.0,0.0,0.0,0.0,0.0,0.0,Tracheophyta; Eucalyptus L'Hér.; Pinus pinaster Aiton; Magnoliopsida
2006,2006-05-15,Viseu,Tondela,São Miguel do Outeiro,Lageosa do Dão,40.5042963,-7.9872116,NC,281.0,2006-05-15T04:00,9.8,89,8.1,8.6,0.0,0.0,0.0,0.0,1,1016.7,982.9,30,0,0,100,0.0,0.13,4.2,6.3,70,59,7.6,12.0,16.3,14.9,11.8,0.17,0.252,0.33,0.35,0,0.0,0.0,0.0,0.0,0.0,0.0,0.0,0.0,0.0,0.0,0.0,0.0,0.0,Magnoliopsida; Tracheophyta; Pinus pinaster Aiton; Pinales; Eucalyptus L'Hér.
2006,2006-08-12,Viseu,Tondela,Dardavaz,Alvarim,40.4630596,-8.1277353,NC,299.0,2006-08-12T22:00,22.4,55,13.0,22.7,0.0,0.0,0.0,0.0,0,1010.9,976.7,0,0,0,0,0.02,1.22,4.5,5.9,194,218,10.8,26.2,28.8,24.6,19.4,0.096,0.134,0.178,0.3,0,0.0,0.0,0.0,0.0,0.0,0.0,0.0,0.0,0.0,0.0,0.0,0.0,0.0,Magnoliopsida; Tracheophyta; Pinus pinaster Aiton; Eucalyptus L'Hér.
2006,2006-04-23,Viseu,Mangualde,São João da Fresta,POVOA DE Sº AMARO (SÃO JOÃO DA FRESTA),40.6403953,-7.5835932,NC,574.0,2006-04-23T14:00,20.1,51,9.6,19.0,0.0,0.0,0.0,0.0,2,1010.6,945.6,50,35,29,4,0.46,1.16,13.8,17.8,43,43,33.5,19.7,12.9,11.2,9.2,0.353,0.369,0.361,0.327,1,3600.0,709.4,481.6,227.8,584.5,709.4,1115.5,735.0,499.0,236.0,584.5,735.0,1155.7,Magnoliopsida; Pinus pinaster Aiton; Tracheophyta
2006,2006-08-12,Viseu,Tondela,Campo de Besteiros,Redonho,40.5678067,-8.1302047,NC,295.0,2006-08-12T22:00,23.2,49,12.0,23.1,0.0,0.0,0.0,0.0,0,1010.9,977.2,0,0,0,0,0.02,1.44,4.5,5.9,194,218,10.8,26.2,28.7,24.4,19.2,0.095,0.134,0.18,0.299,0,0.0,0.0,0.0,0.0,0.0,0.0,0.0,0.0,0.0,0.0,0.0,0.0,0.0,Tracheophyta; Magnoliopsida; Eucalyptus L'Hér.
2006,2006-05-15,Viseu,Cinfães,Cinfães,ALHOES (CINFÃES),41.0721651,-8.0894728,NC,400.0,2006-05-15T16:00,22.3,54,12.4,21.7,0.0,0.0,0.0,0.0,1,1016.0,970.3,30,0,0,99,0.36,1.25,9.4,11.9,268,267,24.1,23.4,17.7,14.5,11.3,0.223,0.267,0.336,0.397,1,3600.0,477.8,213.2,264.7,330.9,477.8,862.6,529.0,236.0,293.0,330.9,529.0,955.0,Eucalyptus L'Hér.; Tracheophyta; Pinus pinaster Aiton; Quercus L.; Magnoliopsida
2006,2006-04-25,Viseu,Castro Daire,Parada de Ester,PARADA (PARADA DE ESTER),40.930764100000005,-8.053841572509667,NC,441.0,2006-04-25T20:00,19.2,89,17.3,21.2,0.0,0.0,0.0,0.0,0,1016.7,965.9,19,2,24,8,0.02,0.25,4.1,5.9,285,313,12.2,18.4,17.2,12.3,10.0,0.356,0.375,0.398,0.399,0,0.0,0.0,0.0,0.0,0.0,0.0,0.0,3.0,1.0,2.0,15.3,3.0,29.1,Magnoliopsida; Pinus pinaster Aiton; Pinales; Tracheophyta; Eucalyptus L'Hér.
2006,2006-05-06,Viseu,Resende,São Martinho de Mouros,Vista Alegre,41.1025369,-7.8977383,NC,375.0,2006-05-06T23:00,8.8,94,7.9,7.2,0.0,0.0,0.0,0.0,0,1021.2,976.0,3,3,0,0,0.0,0.07,7.1,10.2,311,321,16.9,11.4,14.8,13.5,10.5,0.265,0.309,0.365,0.396,0,0.0,0.0,0.0,0.0,0.0,0.0,0.0,0.0,0.0,0.0,0.0,0.0,0.0,Olea europaea L.; Tracheophyta; Magnoliopsida; Eucalyptus L'Hér.; Pinus pinaster Aiton; Pinales
2006,2006-06-14,Viseu,Nelas,Nelas,VALE MADEIROS (Alto do Vale das Longras),40.51924,-7.859607564669652,NC,422.0,2006-06-14T19:00,20.1,78,16.2,21.9,0.0,0.0,0.0,0.0,1,1010.7,962.4,38,2,13,96,0.05,0.52,2.3,5.4,51,48,12.6,22.1,21.2,19.1,14.0,0.222,0.194,0.281,0.361,1,0.0,42.9,3.3,39.7,19.2,42.9,225.1,66.0,5.0,61.0,19.2,66.0,345.9,Pinus pinaster Aiton; Magnoliopsida; Vitis vinifera L.; Tracheophyta
2006,2006-04-26,Viseu,Cinfães,Souselo,Chousas,41.0633131,-8.217454,NC,298.0,2006-04-26T10:00,21.7,59,13.3,22.1,0.0,0.0,0.0,0.0,0,1019.4,984.9,0,0,0,0,0.41,1.07,9.0,11.6,95,95,25.2,19.5,15.5,12.8,10.2,0.359,0.373,0.398,0.408,1,3600.0,726.3,618.8,107.5,843.4,726.3,991.5,662.0,564.0,98.0,843.4,662.0,903.8,Tracheophyta; Eucalyptus L'Hér.; Acacia Mill.; Pinus pinaster Aiton
2006,2006-06-26,Viseu,Carregal do Sal,Cabanas de Viriato,CABANAS,40.4713884,-7.9733827,NC,277.0,2006-06-26T17:00,21.1,53,11.1,19.3,0.1,0.1,0.0,0.0,51,1015.6,983.6,38,0,13,100,0.27,1.18,14.5,19.9,314,316,33.1,24.0,20.3,19.3,15.4,0.136,0.185,0.243,0.33,1,2859.69,295.1,83.6,211.5,155.3,295.1,712.1,339.0,96.0,243.0,155.3,339.0,818.1,Magnoliopsida; Olea europaea L.; Tracheophyta; Pinus pinaster Aiton
2006,2006-07-02,Viseu,Viseu,Abraveses,Pascoal,40.6897934,-7.923189781293511,NC,505.0,2006-07-02T15:00,21.5,54,11.8,20.7,0.0,0.0,0.0,0.0,3,1016.5,959.0,88,96,0,4,0.44,1.18,13.8,17.7,264,265,36.4,27.4,21.9,19.3,15.2,0.102,0.202,0.264,0.354,1,3600.0,632.6,382.0,250.6,466.5,632.6,1083.7,669.0,404.0,265.0,466.5,669.0,1146.0,Pinus pinaster Aiton; Magnoliopsida; Tracheophyta
2006,2006-05-01,Viseu,Tondela,Nandufe,NANDUFE,40.546368,-8.076902668581187,NC,312.0,2006-05-01T18:00,18.5,65,11.7,17.2,0.0,0.0,0.0,0.0,0,1008.9,972.8,2,0,0,7,0.18,0.75,12.0,16.6,291,292,27.4,20.3,17.2,14.3,11.1,0.255,0.311,0.364,0.358,1,3600.0,221.3,162.3,59.0,616.2,221.3,355.0,300.0,220.0,80.0,616.2,300.0,481.2,Magnoliopsida; Vitis vinifera L.; Eucalyptus L'Hér.; Pinus pinaster Aiton; Tracheophyta; Acacia Mill.
2006,2006-05-06,Viseu,Resende,Barrô,SAVINHAS (BARRÔ),41.1291961,-7.8823471,NC,255.0,2006-05-06T17:00,16.7,61,9.3,14.4,0.0,0.0,0.0,0.0,0,1020.4,990.3,4,5,0,0,0.26,0.74,14.8,20.1,304,306,34.6,19.6,16.1,14.2,11.2,0.263,0.309,0.365,0.396,1,3600.0,390.2,292.3,98.0,639.2,390.2,614.7,462.0,346.0,116.0,639.2,462.0,727.7,Magnoliopsida; Pinus pinaster Aiton; Pinales; Vitis vinifera L.; Tracheophyta; Eucalyptus L'Hér.; Olea europaea L.; 
2006,2006-05-07,Viseu,Lamego,Penude,Quintela,41.090431,-7.821420418351966,NC,601.0,2006-05-07T22:00,8.4,84,5.8,6.3,0.0,0.0,0.0,0.0,2,1019.8,948.5,67,36,19,76,0.0,0.18,7.2,15.6,270,277,22.0,10.7,12.8,12.5,9.6,0.267,0.294,0.351,0.37,0,0.0,0.0,0.0,0.0,0.0,0.0,0.0,0.0,0.0,0.0,0.0,0.0,0.0,Vitis vinifera L.; Magnoliopsida; Tracheophyta; Pinales; ; Pinus pinaster Aiton; Castanea sativa Mill.
2006,2006-05-10,Viseu,Penalva do Castelo,Esmolfe,ESMOLFE,40.6795232,-7.6836313,Desconhecida,555.0,2006-05-10T16:00,22.3,43,9.0,20.5,0.1,0.1,0.0,0.0,51,1009.4,947.0,47,0,29,98,0.35,1.54,10.1,12.3,266,267,23.8,24.3,17.3,13.4,10.4,0.186,0.274,0.341,0.351,1,3600.0,432.7,259.1,173.6,410.9,432.7,846.0,481.0,288.0,193.0,410.9,481.0,940.5,Magnoliopsida; Tracheophyta; Pinus pinaster Aiton; Olea europaea L.; Quercus L.; Acacia Mill.
2006,2006-05-29,Viseu,Tondela,Nandufe,NANDUFE,40.546368,-8.076902668581187,NC,312.0,2006-05-29T14:00,31.9,32,13.0,32.9,0.0,0.0,0.0,0.0,1,1012.2,977.6,22,0,36,1,0.68,3.24,10.7,13.2,312,315,23.4,33.4,23.2,17.1,12.9,0.112,0.199,0.292,0.349,1,3600.0,807.6,683.5,124.1,766.6,807.6,1187.5,833.0,705.0,128.0,766.6,833.0,1224.7,Magnoliopsida; Vitis vinifera L.; Eucalyptus L'Hér.; Pinus pinaster Aiton; Tracheophyta; Acacia Mill.
2006,2006-08-13,Viseu,Cinfães,Tarouquela,SALGUEIRAL (Salgueirinho),41.070446,-8.1883932,NC,378.0,2006-08-13T00:00,20.9,45,8.4,19.1,0.0,0.0,0.0,0.0,0,1011.1,967.8,0,0,0,0,0.07,1.37,9.4,13.7,94,85,20.2,22.5,26.8,22.8,18.2,0.098,0.14,0.209,0.333,0,0.0,0.0,0.0,0.0,0.0,0.0,0.0,0.0,0.0,0.0,0.0,0.0,0.0,Magnoliopsida; Pinus pinaster Aiton; Quercus L.; Vitis vinifera L.; Tracheophyta; Eucalyptus L'Hér.; 
2006,2006-05-29,Viseu,Sátão,Sátão,Contige,40.7318113,-7.7518209,Desconhecida,558.0,2006-05-29T17:00,30.4,28,9.9,28.4,0.0,0.0,0.0,0.0,0,1011.0,949.8,18,0,28,5,0.41,3.11,13.3,17.8,289,291,27.0,32.6,23.9,16.6,11.9,0.094,0.214,0.303,0.356,1,3600.0,352.9,247.9,105.0,489.7,352.9,674.1,410.0,288.0,122.0,489.7,410.0,783.1,Magnoliopsida; Tracheophyta; Pinus pinaster Aiton; Eucalyptus L'Hér.; Pinales
2006,2006-05-30,Viseu,Lamego,Bigorne,BIGORNE,41.00695425,-7.874142328049125,NC,951.0,2006-05-30T14:00,23.8,30,5.4,23.6,0.0,0.0,0.0,0.0,0,1010.3,906.6,0,0,0,0,0.66,2.06,10.2,12.1,51,53,32.8,25.8,18.6,14.1,9.7,0.15,0.219,0.303,0.377,1,3600.0,930.7,821.2,109.6,923.2,930.7,1184.2,960.0,847.0,113.0,923.2,960.0,1221.4,Tracheophyta; Magnoliopsida; Pinus pinaster Aiton; Pinales; Castanea sativa Mill.; 
2006,2006-05-13,Viseu,São Pedro do Sul,Sul,SUL,40.7613249,-8.057453059592005,NC,174.0,2006-05-13T23:00,17.5,81,14.2,18.5,0.0,0.0,0.0,0.0,1,1018.0,997.4,29,0,0,98,0.0,0.38,2.7,2.9,67,60,6.1,17.2,19.4,16.0,13.0,0.19,0.265,0.338,0.372,0,0.0,0.0,0.0,0.0,0.0,0.0,0.0,0.0,0.0,0.0,0.0,0.0,0.0,Pinus pinaster Aiton; Eucalyptus L'Hér.; Magnoliopsida; Tracheophyta; Quercus L.; Castanea sativa Mill.; Acacia Mill.; ; Olea europaea L.; Vitis vinifera L.
2006,2006-05-15,Viseu,Tarouca,Várzea da Serra,VARZEA DA SERRA,40.997211,-7.82774,NC,899.0,2006-05-15T15:00,21.4,45,9.1,19.7,0.0,0.0,0.0,0.0,1,1015.3,915.7,47,0,29,100,0.39,1.39,10.1,12.4,235,234,25.6,21.9,15.5,12.4,8.9,0.231,0.268,0.333,0.376,1,3600.0,518.0,211.1,306.8,272.5,518.0,1037.3,552.0,225.0,327.0,272.5,552.0,1105.4,Magnoliopsida; Eucalyptus L'Hér.; Tracheophyta; Castanea sativa Mill.; Pinus pinaster Aiton; Pinales
2006,2006-09-07,Viseu,Vila Nova de Paiva,Touro,Touro,40.9401466,-7.7762141,Desconhecida,825.0,2006-09-07T09:00,23.4,30,4.8,21.5,0.0,0.0,0.0,0.0,0,1014.0,922.8,11,0,3,29,0.27,2.01,4.4,5.9,279,281,14.8,23.3,22.8,21.3,18.1,0.112,0.157,0.195,0.317,1,3600.0,481.3,381.7,99.6,722.9,481.3,711.3,406.0,322.0,84.0,722.9,406.0,600.0,Magnoliopsida; Pinus pinaster Aiton; Tracheophyta; Eucalyptus L'Hér.; Quercus L.; 
2006,2006-08-29,Viseu,São João da Pesqueira,Paredes da Beira,PAREDES DA BEIRA,41.064976,-7.4765,NC,767.0,2006-08-29T21:00,21.5,43,8.4,19.8,0.0,0.0,0.0,0.0,0,1017.9,932.0,0,0,0,0,0.07,1.47,9.0,21.8,5,8,22.3,24.3,25.5,21.7,18.7,0.139,0.147,0.162,0.275,0,0.0,0.0,0.0,0.0,0.0,0.0,0.0,0.0,0.0,0.0,0.0,0.0,0.0,Magnoliopsida; Olea europaea L.; Tracheophyta; Castanea sativa Mill.; Pinus pinaster Aiton
2006,2006-08-30,Viseu,Sátão,São Miguel de Vila Boa,S.MIGUEL VILA BOA,40.7028908,-7.7602223,Desconhecida,395.0,2006-08-30T21:00,25.4,40,10.9,25.0,0.0,0.0,0.0,0.0,0,1015.9,971.2,0,0,0,0,0.03,1.94,4.3,8.8,5,12,12.2,26.0,26.1,22.6,20.4,0.1,0.186,0.214,0.324,0,0.0,0.0,0.0,0.0,0.0,0.0,0.0,0.0,0.0,0.0,0.0,0.0,0.0,Acacia Mill.; Pinus pinaster Aiton; Vitis vinifera L.; Pinales; Magnoliopsida; Tracheophyta
2006,2006-09-07,Viseu,Nelas,Carvalhal Redondo,CARVALHAL REDONDO,40.53808225,-7.898036302931594,Desconhecida,410.0,2006-09-07T16:00,33.0,24,9.9,31.1,0.0,0.0,0.0,0.0,0,1012.7,967.6,17,0,2,53,0.52,3.8,12.9,16.6,306,309,28.4,36.2,27.1,23.8,20.6,0.093,0.168,0.209,0.321,1,3600.0,490.7,390.6,100.1,743.8,490.7,707.6,559.0,445.0,114.0,743.8,559.0,806.1,Vitis vinifera L.; Tracheophyta; Pinus pinaster Aiton; Magnoliopsida
2006,2006-05-14,Viseu,Tarouca,Ucanha,Penedo de Santo António,41.0457659,-7.7444528,NC,504.0,2006-05-14T08:00,17.9,60,10.0,17.7,0.0,0.0,0.0,0.0,1,1017.4,959.3,30,0,0,99,0.17,0.82,1.8,2.7,217,203,11.9,18.0,15.8,14.1,10.4,0.209,0.241,0.317,0.328,1,3600.0,365.8,184.1,181.7,373.7,365.8,660.1,300.0,151.0,149.0,373.7,300.0,541.3,Tracheophyta; Magnoliopsida; Castanea sativa Mill.; Olea europaea L.; Quercus L.; Pinus pinaster Aiton; Vitis vinifera L.; Pinales
2006,2006-05-14,Viseu,Castro Daire,Gosende,Custilhão,41.0083477,-7.9058671,NC,1004.0,2006-05-14T17:00,16.6,49,5.8,14.3,0.0,0.0,0.0,0.0,3,1016.5,904.2,86,0,95,98,0.19,0.97,9.1,12.3,252,249,30.2,18.1,15.2,11.5,8.2,0.225,0.276,0.341,0.385,1,0.0,214.7,25.6,189.1,53.4,214.7,641.3,252.0,30.0,222.0,53.4,252.0,752.7,Tracheophyta; Magnoliopsida; Pinales
2006,2006-05-30,Viseu,Viseu,Cavernães,SOUTO CHAO (Quinta do Souto),40.7087815,-7.8277373,NC,545.0,2006-05-30T22:00,20.7,23,-1.1,16.4,0.0,0.0,0.0,0.0,0,1011.1,949.4,0,0,0,0,0.15,1.88,14.2,28.4,69,75,33.5,22.0,23.2,17.3,12.1,0.092,0.21,0.301,0.355,0,0.0,0.0,0.0,0.0,0.0,0.0,0.0,0.0,0.0,0.0,0.0,0.0,0.0,Tracheophyta; Pinus pinaster Aiton; Magnoliopsida
2006,2006-04-14,Viseu,Oliveira de Frades,Pinheiro,PINHEIRO DE LAFOES (PINHEIRO),40.725973,-8.214473727122396,NC,394.0,2006-04-14T17:00,14.3,83,11.4,13.5,0.5,0.5,0.0,0.0,53,1008.8,962.8,100,82,99,94,0.07,0.28,8.4,14.2,205,207,43.2,15.7,14.6,12.5,10.4,0.355,0.359,0.396,0.405,1,0.0,79.9,2.5,77.4,6.2,79.9,546.0,97.0,3.0,94.0,6.2,97.0,663.1,Eucalyptus L'Hér.; Pinus pinaster Aiton; Magnoliopsida; Tracheophyta; Quercus L.; Olea europaea L.
2006,2006-08-31,Viseu,Vila Nova de Paiva,Alhais,ALHAIS,40.8488759,-7.731096262979038,Desconhecida,774.0,2006-08-31T13:00,31.2,23,7.5,30.9,0.0,0.0,0.0,0.0,0,1017.6,933.6,0,0,0,0,0.71,3.51,10.9,13.8,224,223,31.0,33.5,23.3,20.9,18.2,0.106,0.154,0.185,0.288,1,3600.0,886.0,784.4,101.5,934.8,886.0,1126.6,890.0,788.0,102.0,934.8,890.0,1131.7,Magnoliopsida; Eucalyptus L'Hér.; Pinus pinaster Aiton; Tracheophyta; Quercus L.; Acacia Mill.; Olea europaea L.; Quercus suber L.; 
2006,2006-05-20,Viseu,Resende,Cárquere,Corvo,41.099227,-7.9659462,NC,263.0,2006-05-20T15:00,18.3,70,12.6,16.9,0.3,0.3,0.0,0.0,51,1018.4,987.6,100,87,9,92,0.31,0.64,15.5,20.9,267,267,34.9,20.3,16.7,15.5,11.8,0.185,0.255,0.331,0.391,1,3600.0,506.7,233.1,273.6,297.0,506.7,1048.8,539.0,248.0,291.0,297.0,539.0,1115.7,Pinus pinaster Aiton; Tracheophyta; Magnoliopsida; Pinales; Eucalyptus L'Hér.; ; Vitis vinifera L.
2006,2006-05-20,Viseu,Cinfães,Fornelos,Barra,41.0299683,-8.2041691,NC,455.0,2006-05-20T11:00,16.6,71,11.4,15.2,0.2,0.2,0.0,0.0,51,1019.4,966.4,100,91,95,95,0.26,0.54,12.2,16.4,246,244,39.6,18.3,15.8,15.2,11.5,0.179,0.251,0.329,0.395,1,3600.0,479.2,189.1,290.0,214.9,479.2,1176.1,456.0,180.0,276.0,214.9,456.0,1119.3,Quercus L.; Eucalyptus L'Hér.; Magnoliopsida; Vitis vinifera L.; Tracheophyta; Pinales; 
2006,2006-05-31,Viseu,Lamego,Ferreiros de Avões,FOZ DE FERREIROS (Foz de Baixo),41.1172987,-7.8174242,NC,566.0,2006-05-31T09:00,13.9,40,0.4,8.8,0.0,0.0,0.0,0.0,0,1016.1,950.3,0,0,0,0,0.33,0.96,22.1,31.0,74,75,55.8,17.6,18.5,16.2,11.5,0.155,0.203,0.288,0.363,1,3600.0,666.8,561.9,104.9,832.9,666.8,897.8,591.0,498.0,93.0,832.9,591.0,795.7,Vitis vinifera L.; Magnoliopsida; Tracheophyta; Eucalyptus L'Hér.; Pinales; 
2006,2006-01-27,Viseu,Sátão,Romãs,SILVA CIMA (Silva de Baixo),40.7243966,-7.6680102,NC,500.0,2006-01-27T18:00,3.4,48,-6.5,-2.1,0.0,0.0,0.0,0.0,0,1010.6,950.4,0,0,0,0,0.06,0.4,17.6,32.8,55,57,40.0,3.9,4.4,6.7,10.9,0.339,0.355,0.365,0.314,0,518.35,0.0,0.0,0.0,0.0,0.0,0.0,22.0,13.0,9.0,143.8,22.0,66.9,Olea europaea L.; Vitis vinifera L.; Castanea sativa Mill.; Magnoliopsida
2006,2006-06-01,Viseu,Cinfães,Cinfães,PENSAIS,41.0719264,-8.2267912,NC,182.0,2006-06-01T08:00,15.1,46,3.5,9.7,0.0,0.0,0.0,0.0,0,1017.4,995.7,0,0,0,0,0.25,0.93,26.3,37.1,92,92,53.6,17.1,19.1,17.7,13.3,0.136,0.222,0.306,0.384,1,3600.0,453.1,359.1,94.0,701.2,453.1,681.3,376.0,298.0,78.0,701.2,376.0,565.4,Eucalyptus L'Hér.; Magnoliopsida; Vitis vinifera L.; Pinus pinaster Aiton
2006,2006-09-01,Viseu,Cinfães,Oliveira Do Douro,ARIEIRO (Amieiro),40.4851746,-8.1315668,NC,172.0,2006-09-01T02:00,18.9,79,15.3,20.1,0.0,0.0,0.0,0.0,2,1018.6,998.3,58,64,0,0,0.0,0.45,3.9,5.7,304,325,9.4,19.4,25.9,23.3,20.7,0.099,0.156,0.169,0.283,0,0.0,0.0,0.0,0.0,0.0,0.0,0.0,0.0,0.0,0.0,0.0,0.0,0.0,Pinus pinaster Aiton; Magnoliopsida; Quercus L.; Tracheophyta; ; Eucalyptus L'Hér.
2006,2006-01-30,Viseu,Carregal do Sal,Papízios,P.ARENOSA (Póvoa da Arenosa),40.43322495,-8.007506106349345,NC,304.0,2006-01-30T14:00,8.2,49,-2.0,4.4,0.0,0.0,0.0,0.0,0,1020.0,983.2,0,0,0,0,0.23,0.56,8.9,11.8,50,52,26.6,6.5,3.2,6.8,11.2,0.342,0.349,0.364,0.298,1,3600.0,521.2,446.6,74.6,910.1,521.2,691.7,545.0,467.0,78.0,910.1,545.0,723.3,Tracheophyta; Olea europaea L.; Magnoliopsida; Pinales
2006,2006-05-25,Viseu,Tondela,Castelões,Areal,40.5357118,-8.1394572,NC,295.0,2006-05-25T12:00,24.5,33,7.2,24.4,0.0,0.0,0.0,0.0,0,1025.8,991.8,0,0,0,0,0.64,2.05,10.9,13.8,56,57,27.0,24.5,16.6,15.6,12.7,0.145,0.219,0.306,0.352,1,3600.0,957.1,839.6,117.5,896.3,957.1,1249.2,937.0,822.0,115.0,896.3,937.0,1223.0,Eucalyptus L'Hér.; Pinus pinaster Aiton; Magnoliopsida; Acacia Mill.; Tracheophyta
2006,2006-01-31,Viseu,Castro Daire,Castro Daire,STA.MARGARIDA (Santa Margarida),40.91465745,-7.920020147736607,NC,660.0,2006-01-31T16:00,10.5,59,2.8,8.1,0.0,0.0,0.0,0.0,0,1022.0,944.5,0,0,0,1,0.15,0.53,5.5,7.4,67,67,15.5,5.2,2.1,4.8,9.3,0.346,0.355,0.373,0.35,1,3600.0,268.3,213.0,55.3,754.8,268.3,397.7,330.0,262.0,68.0,754.8,330.0,489.2,Pinus pinaster Aiton; Magnoliopsida; Pinales; Eucalyptus L'Hér.; Tracheophyta
2006,2006-09-18,Viseu,Tondela,Barreiro de Besteiros,POVOA DE ALAGOA,40.5853329,-8.083731138140791,Desconhecida,357.0,2006-09-18T13:00,23.0,44,10.0,23.9,0.0,0.0,0.0,0.0,0,1019.0,978.0,0,0,0,0,0.53,1.58,5.6,7.0,320,325,20.5,26.9,20.1,21.5,20.8,0.161,0.144,0.166,0.284,1,3600.0,810.2,714.9,95.3,926.7,810.2,1045.4,816.0,720.0,96.0,926.7,816.0,1052.9,Eucalyptus L'Hér.; Tracheophyta; Magnoliopsida; Pinus pinaster Aiton
2006,2006-05-20,Viseu,Vouzela,Cambra,Campo,40.6818035,-8.162732,NC,463.0,2006-05-20T18:00,17.9,66,11.4,16.9,0.0,0.0,0.0,0.0,1,1017.1,963.6,30,1,0,98,0.18,0.7,9.8,12.7,278,278,29.2,20.6,17.7,15.6,12.0,0.155,0.239,0.324,0.39,1,3600.0,223.3,153.5,69.8,488.8,223.3,419.7,288.0,198.0,90.0,488.8,288.0,541.2,Eucalyptus L'Hér.; Magnoliopsida; Tracheophyta; Pinus pinaster Aiton; Quercus L.; Olea europaea L.; 
2006,2006-09-15,Viseu,Castro Daire,Almofala,Alto da Mata,40.9541684,-7.7933527,NC,863.0,2006-09-15T16:00,15.1,48,4.2,11.1,0.0,0.0,0.0,0.0,3,1016.3,918.4,100,75,88,0,0.23,0.9,18.2,24.9,321,321,40.7,19.0,17.5,20.1,18.4,0.21,0.144,0.176,0.317,1,3534.8,264.6,85.9,178.7,177.8,264.6,653.5,305.0,99.0,206.0,177.8,305.0,753.2,Tracheophyta; Castanea sativa Mill.; Magnoliopsida; Pinus pinaster Aiton
2006,2006-05-26,Viseu,Viseu,Mundão,MUNDÃO,40.6999607,-7.871362,NC,541.0,2006-05-26T12:00,25.6,40,11.0,25.7,0.0,0.0,0.0,0.0,0,1023.5,962.4,0,0,0,0,0.65,1.97,15.6,20.6,56,57,34.9,26.5,18.0,14.8,11.6,0.133,0.233,0.317,0.374,1,3600.0,955.9,837.4,118.5,893.6,955.9,1249.2,936.0,820.0,116.0,893.6,936.0,1223.2,Tracheophyta; Pinus pinaster Aiton; Magnoliopsida
2006,2006-09-08,Viseu,Castro Daire,Gosende,Cotelo,41.0134883,-7.9309345,NC,1042.0,2006-09-08T13:00,27.9,33,10.1,29.0,0.0,0.0,0.0,0.0,1,1016.4,904.2,50,0,43,80,0.55,2.52,2.9,3.6,270,270,16.9,31.8,22.6,20.0,16.9,0.111,0.154,0.19,0.319,1,3600.0,762.8,577.8,185.0,714.5,762.8,1090.0,767.0,581.0,186.0,714.5,767.0,1096.0,Magnoliopsida; Tracheophyta
2006,2006-09-20,Viseu,Resende,Paus,Fazamões,41.0714486,-7.8998059,NC,565.0,2006-09-20T20:00,19.2,62,11.7,19.0,0.0,0.0,0.0,0.0,0,1008.6,944.6,6,0,0,20,0.01,0.85,5.1,6.8,184,198,21.2,20.5,20.7,19.5,19.0,0.15,0.146,0.189,0.318,0,0.0,0.0,0.0,0.0,0.0,0.0,0.0,0.0,0.0,0.0,0.0,0.0,0.0,Magnoliopsida; Pinales; Tracheophyta; Eucalyptus L'Hér.; Pinus pinaster Aiton; Olea europaea L.; 
2006,2006-06-02,Viseu,São Pedro do Sul,São Martinho das Moitas,FABARRELINHO,40.8834837,-8.0312983,Desconhecida,663.0,2006-06-02T00:00,14.1,75,9.7,13.9,0.0,0.0,0.0,0.0,0,1021.8,944.9,10,0,16,0,0.0,0.41,1.3,0.4,214,180,13.3,16.0,19.1,16.2,11.5,0.117,0.209,0.3,0.379,0,0.0,0.0,0.0,0.0,0.0,0.0,0.0,0.0,0.0,0.0,0.0,0.0,0.0,Magnoliopsida; Vitis vinifera L.; Pinus pinaster Aiton; Eucalyptus L'Hér.; Tracheophyta; Pinales; 
2006,2006-05-17,Viseu,Castro Daire,Almofala,Monteiras,40.9541684,-7.7933527,NC,863.0,2006-05-17T13:00,22.5,54,12.7,21.8,0.0,0.0,0.0,0.0,1,1017.4,921.7,42,0,21,99,0.49,1.26,17.2,22.0,250,249,40.0,23.5,17.1,13.1,9.3,0.218,0.259,0.328,0.375,1,3600.0,729.1,431.7,297.4,467.8,729.1,1234.6,733.0,434.0,299.0,467.8,733.0,1241.3,Tracheophyta; Castanea sativa Mill.; Magnoliopsida; Pinus pinaster Aiton
2006,2006-04-30,Viseu,Nelas,Lapa do Lobo,OUTEIRO DE ESPINHO (Outeiro do Raque),40.4746034,-7.9162792,NC,334.0,2006-04-30T13:00,20.0,37,5.1,19.9,0.0,0.0,0.0,0.0,0,1010.6,972.2,0,0,0,0,0.59,1.46,9.2,11.8,69,70,29.2,21.0,14.8,13.8,10.5,0.278,0.329,0.374,0.375,1,3600.0,959.9,852.5,107.4,952.7,959.9,1206.9,965.0,857.0,108.0,952.7,965.0,1213.2,Pinus pinaster Aiton; Olea europaea L.; Magnoliopsida; Vitis vinifera L.; Tracheophyta
2006,2006-02-02,Viseu,Castro Daire,Almofala,FATAUNCOS (ALMOFALA),40.95422045,-7.795488588674065,NC,860.0,2006-02-02T12:00,9.0,61,2.0,6.2,0.0,0.0,0.0,0.0,1,1016.3,916.7,32,0,7,94,0.21,0.45,7.2,9.4,143,148,20.9,3.5,1.6,3.7,8.3,0.348,0.353,0.366,0.331,1,3600.0,506.7,371.9,134.8,715.1,506.7,732.5,481.0,353.0,128.0,715.1,481.0,695.3,Tracheophyta; Castanea sativa Mill.; Magnoliopsida; Pinus pinaster Aiton
2006,2006-10-08,Viseu,Mangualde,Fornos de Maceira Dão,Pedreles,40.598611,-7.8114541,NC,509.0,2006-10-08T00:00,13.8,100,13.7,14.2,0.0,0.0,0.0,0.0,2,1018.1,958.6,58,61,0,10,0.0,0.01,5.2,6.2,65,80,10.8,15.4,18.0,18.4,20.8,0.346,0.343,0.238,0.302,0,0.0,0.0,0.0,0.0,0.0,0.0,0.0,0.0,0.0,0.0,0.0,0.0,0.0,Olea europaea L.; Magnoliopsida; Tracheophyta; Pinus pinaster Aiton; Vitis vinifera L.
2006,2006-05-28,Viseu,Viseu,Mundão,MUNDAO,40.6999607,-7.871362,NC,541.0,2006-05-28T00:00,19.5,58,11.1,19.1,0.0,0.0,0.0,0.0,0,1020.9,958.8,0,0,0,0,0.02,0.95,4.8,5.2,48,74,11.2,19.4,21.1,15.5,11.7,0.113,0.226,0.312,0.373,0,0.0,0.0,0.0,0.0,0.0,0.0,0.0,0.0,0.0,0.0,0.0,0.0,0.0,Tracheophyta; Pinus pinaster Aiton; Magnoliopsida
2006,2006-05-20,Viseu,São João da Pesqueira,São João da Pesqueira,CRUZAMENTO DA RICA,41.14216785,-7.413788551003492,NC,649.0,2006-05-20T11:00,17.3,54,7.9,14.5,0.0,0.0,0.0,0.0,3,1018.4,944.1,100,86,38,75,0.31,0.91,15.5,21.1,257,256,44.3,19.0,15.8,14.9,10.2,0.135,0.211,0.291,0.295,1,3600.0,516.1,251.7,264.3,284.9,516.1,1180.5,492.0,240.0,252.0,284.9,492.0,1125.5,Magnoliopsida; Vitis vinifera L.; Olea europaea L.; Tracheophyta
2006,2006-05-28,Viseu,Viseu,Lordosa,Galifonge,40.7442752,-7.9057424,NC,544.0,2006-05-28T03:00,17.8,58,9.3,16.5,0.0,0.0,0.0,0.0,0,1020.1,957.4,2,0,3,0,0.04,0.87,8.1,13.1,58,69,18.0,17.5,20.4,15.5,11.7,0.114,0.226,0.312,0.373,0,0.0,0.0,0.0,0.0,0.0,0.0,0.0,0.0,0.0,0.0,0.0,0.0,0.0,Pinus pinaster Aiton; Magnoliopsida; Tracheophyta
2006,2006-05-24,Viseu,Penedono,Ourozinho,Ourozinho,40.97306,-7.39215,NC,945.0,2006-05-24T15:00,19.0,30,0.9,18.3,0.0,0.0,0.0,0.0,0,1024.7,918.6,0,0,0,0,0.53,1.55,5.0,5.7,291,288,19.8,23.0,14.3,13.0,9.4,0.159,0.195,0.272,0.281,1,3600.0,819.4,717.0,102.4,910.4,819.4,1050.7,872.0,763.0,109.0,910.4,872.0,1118.1,Magnoliopsida; Pinus pinaster Aiton
