year,date,district,municipality,parish,local,latitude,longitude,cause,elevation,hourly.time,hourly.temperature_2m,hourly.relative_humidity_2m,hourly.dew_point_2m,hourly.apparent_temperature,hourly.precipitation,hourly.rain,hourly.snowfall,hourly.snow_depth,hourly.weather_code,hourly.pressure_msl,hourly.surface_pressure,hourly.cloud_cover,hourly.cloud_cover_low,hourly.cloud_cover_mid,hourly.cloud_cover_high,hourly.et0_fao_evapotranspiration,hourly.vapour_pressure_deficit,hourly.wind_speed_10m,hourly.wind_speed_100m,hourly.wind_direction_10m,hourly.wind_direction_100m,hourly.wind_gusts_10m,hourly.soil_temperature_0_to_7cm,hourly.soil_temperature_7_to_28cm,hourly.soil_temperature_28_to_100cm,hourly.soil_temperature_100_to_255cm,hourly.soil_moisture_0_to_7cm,hourly.soil_moisture_7_to_28cm,hourly.soil_moisture_28_to_100cm,hourly.soil_moisture_100_to_255cm,hourly.is_day,hourly.sunshine_duration,hourly.shortwave_radiation_instant,hourly.direct_radiation_instant,hourly.diffuse_radiation_instant,hourly.direct_normal_irradiance_instant,hourly.global_tilted_irradiance_instant,hourly.terrestrial_radiation_instant,hourly.shortwave_radiation,hourly.direct_radiation,hourly.diffuse_radiation,hourly.direct_normal_irradiance,hourly.global_tilted_irradiance,hourly.terrestrial_radiation,scientificNames
2008,2008-06-23,Setúbal,Moita,Alhos Vedros,QUINTA FONTE DA PRATA (Quinta da Fonte da Prata),38.6547625,-9.0089043,NC,7.0,2008-06-23T02:00,18.0,88,16.0,17.7,0.0,0.0,0.0,0.0,1,1014.9,1014.1,31,34,0,0,0.01,0.25,16.0,26.1,352,354,28.1,21.4,24.0,22.0,19.7,0.184,0.197,0.229,0.243,0,0.0,0.0,0.0,0.0,0.0,0.0,0.0,0.0,0.0,0.0,0.0,0.0,0.0,Tracheophyta; Magnoliopsida
2008,2008-06-03,Setúbal,Setúbal,Setúbal (santa Maria Da Graça),QTA VARZEA (Santa Maria da Graça),38.53293925,-8.886376306692195,NC,6.0,2008-06-03T13:00,23.3,45,10.6,23.5,0.0,0.0,0.0,0.0,1,1020.0,1019.3,29,0,0,96,0.6,1.58,13.5,16.6,314,319,25.6,26.9,18.9,17.5,16.2,0.116,0.1,0.134,0.151,1,3600.0,921.6,668.3,253.3,699.1,921.6,1270.7,924.0,670.0,254.0,699.1,924.0,1274.0,Tracheophyta; Magnoliopsida
2008,2008-06-23,Setúbal,Sesimbra,Sesimbra (castelo),PARQUE CAMPISMO  CAMPIBECO (Parque de Campismo),38.49240215,-9.11796389134298,NC,63.0,2008-06-23T22:00,18.2,81,14.8,17.2,0.0,0.0,0.0,0.0,0,1019.0,1011.5,4,5,0,0,0.03,0.41,18.0,26.8,334,336,37.1,20.3,23.9,21.2,17.5,0.047,0.117,0.174,0.191,0,0.0,0.0,0.0,0.0,0.0,0.0,0.0,0.0,0.0,0.0,0.0,0.0,0.0,Magnoliopsida; Quercus rotundifolia Lam.; Pinus pinaster Aiton; Tracheophyta
2008,2008-11-26,Setúbal,Sesimbra,Sesimbra (castelo),Fornos,38.49240215,-9.11796389134298,NC,63.0,2008-11-26T18:00,11.1,36,-3.6,5.2,0.0,0.0,0.0,0.0,0,1020.2,1012.5,0,0,0,0,0.14,0.85,22.5,32.7,49,50,36.7,12.2,13.5,16.4,19.6,0.055,0.088,0.109,0.174,0,0.0,0.0,0.0,0.0,0.0,0.0,0.0,2.0,0.0,2.0,0.0,2.0,16.7,Magnoliopsida; Quercus rotundifolia Lam.; Pinus pinaster Aiton; Tracheophyta
2008,2008-06-28,Setúbal,Seixal,Fernão Ferro,Foros da Catrapona,38.59528785,-9.071498732158208,NC,23.0,2008-06-28T17:00,27.8,52,17.0,27.9,0.0,0.0,0.0,0.0,0,1015.1,1012.5,0,0,0,0,0.46,1.79,18.0,22.7,269,280,32.8,34.3,26.1,21.5,17.7,0.054,0.096,0.153,0.182,1,3600.0,519.0,435.4,83.6,794.0,519.0,725.7,596.0,500.0,96.0,794.0,596.0,833.3,Tracheophyta; Magnoliopsida; Quercus rotundifolia Lam.; Pinus pinaster Aiton; Pinus pinea L.
2008,2008-02-07,Setúbal,Almada,Caparica,AZ DA ROSA (Alto do Vale de Rosal),38.6220343,-9.1905996,NC,61.0,2008-02-07T17:00,17.6,57,8.9,16.8,0.0,0.0,0.0,0.0,0,1025.6,1018.3,0,0,0,0,0.12,0.88,3.9,8.1,158,135,14.4,17.0,13.8,13.3,15.2,0.164,0.175,0.162,0.191,1,3600.0,162.3,123.7,38.7,668.3,162.3,260.3,235.0,179.0,56.0,668.3,235.0,376.7,Tracheophyta; Magnoliopsida; Pinus pinaster Aiton; Pinales; Eucalyptus L'Hér.
2008,2008-04-05,Setúbal,Sesimbra,Sesimbra (castelo),TRAZEIRAS ESTALAGEM DOS ZIMBROS (Castelo),38.4749148,-9.1111472,NC,105.0,2008-04-05T19:00,17.9,69,12.0,17.6,0.0,0.0,0.0,0.0,2,1008.8,996.5,57,0,46,97,0.05,0.64,6.1,10.0,50,75,8.6,19.7,18.5,15.7,14.6,0.064,0.154,0.197,0.19,1,0.0,0.0,0.0,0.0,0.0,0.0,0.0,41.0,6.0,35.0,43.6,41.0,137.7,Pinus pinea L.; Magnoliopsida; Tracheophyta; Vitis vinifera L.; Pinus pinaster Aiton
2008,2008-04-12,Setúbal,Setúbal,São Lourenço,R DA PADERIA (SÃO LOURENÇO),38.5375781,-9.0176938,NC,75.0,2008-04-12T23:00,12.8,66,6.5,10.6,0.0,0.0,0.0,0.0,1,1023.9,1014.8,35,20,29,0,0.02,0.51,8.4,15.8,263,271,14.4,12.4,14.9,15.5,15.0,0.228,0.252,0.202,0.183,0,0.0,0.0,0.0,0.0,0.0,0.0,0.0,0.0,0.0,0.0,0.0,0.0,0.0,Tracheophyta; Magnoliopsida
2008,2008-07-01,Setúbal,Seixal,Arrentela,CASAL DO MARCO- JT ASSICOMATE (Casal de Santa Rita),38.6266637,-9.1036412,NC,6.0,2008-07-01T14:00,26.1,43,12.7,26.5,0.0,0.0,0.0,0.0,1,1016.9,1016.2,27,0,0,90,0.67,1.92,18.0,23.4,323,326,36.7,33.3,24.5,22.0,18.0,0.053,0.092,0.149,0.182,1,3600.0,947.0,829.1,117.9,901.2,947.0,1217.4,972.0,851.0,121.0,901.2,972.0,1249.5,Tracheophyta; Pinus pinea L.
2008,2008-11-27,Setúbal,Palmela,Pinhal Novo,Vale da Vila,38.630096,-8.9128319,NC,39.0,2008-11-27T15:00,14.7,31,-2.1,10.4,0.0,0.0,0.0,0.0,0,1018.2,1013.5,0,0,0,0,0.24,1.15,12.6,16.6,3,5,28.1,16.0,11.7,15.7,19.6,0.079,0.092,0.063,0.133,1,3600.0,333.5,272.1,61.3,804.0,333.5,475.6,386.0,315.0,71.0,804.0,386.0,550.6,Vitis vinifera L.; Magnoliopsida; Olea europaea L.; Tracheophyta
2008,2008-07-08,Setúbal,Sesimbra,Sesimbra (castelo),Apostiça,38.49240215,-9.11796389134298,NC,63.0,2008-07-08T13:00,24.0,52,13.7,24.4,0.0,0.0,0.0,0.0,0,1018.6,1011.3,0,0,0,0,0.61,1.42,19.6,24.7,334,339,33.8,33.7,22.9,21.9,18.6,0.046,0.1,0.16,0.189,1,3600.0,972.7,853.7,119.1,890.6,972.7,1268.2,972.0,853.0,119.0,890.6,972.0,1267.2,Magnoliopsida; Quercus rotundifolia Lam.; Pinus pinaster Aiton; Tracheophyta
2008,2008-07-09,Setúbal,Seixal,Fernão Ferro,JT A2 KM 18 N/S (Fernão Ferro),38.5640057,-9.094534,NC,69.0,2008-07-09T06:00,16.3,91,14.7,16.3,0.0,0.0,0.0,0.0,0,1019.2,1010.9,5,6,0,0,0.02,0.18,10.6,20.4,342,346,22.3,17.1,22.0,21.4,18.2,0.053,0.086,0.141,0.181,1,0.0,32.8,11.7,21.1,110.1,16.6,140.7,14.0,5.0,9.0,55.9,14.0,60.1,Tracheophyta; Pinus pinaster Aiton; Magnoliopsida
2008,2008-06-22,Setúbal,Moita,Alhos Vedros,JT ESTAÇAO TRATAMENTOS DE AGUA QTA FTE PRATA (ALHOS VEDROS),38.65183395,-9.026693444556935,NC,8.0,2008-06-22T11:00,26.8,50,15.6,28.8,0.0,0.0,0.0,0.0,0,1015.9,1015.0,0,0,0,0,0.6,1.74,11.4,14.1,342,345,30.2,28.1,24.1,22.5,20.3,0.184,0.198,0.229,0.243,1,3600.0,906.6,788.5,118.1,876.1,906.6,1191.8,860.0,748.0,112.0,876.1,860.0,1130.5,Tracheophyta; Quercus suber L.
2008,2008-06-22,Setúbal,Moita,Alhos Vedros,PINHAL FORNO (Pinhal do Forno),38.62511185,-8.998479129248048,NC,21.0,2008-06-22T13:00,29.0,39,13.7,30.7,0.0,0.0,0.0,0.0,0,1015.0,1012.6,0,0,0,0,0.73,2.43,13.1,16.1,323,326,31.0,34.5,23.9,20.7,17.1,0.054,0.083,0.13,0.155,1,3600.0,983.1,866.2,116.9,900.7,983.1,1273.4,984.0,867.0,117.0,900.7,984.0,1274.5,Olea europaea L.; Tracheophyta; Magnoliopsida; Pinus pinaster Aiton
2008,2008-03-06,Setúbal,Setúbal,São Simão,BRR DO XOILO (SÃO SIMÃO),38.5498,-9.0160028,NC,53.0,2008-03-06T16:00,14.5,40,1.1,11.1,0.0,0.0,0.0,0.0,0,1023.7,1017.3,0,0,0,0,0.3,0.99,10.2,11.5,352,356,20.9,18.6,13.9,14.6,15.1,0.145,0.2,0.203,0.183,1,3600.0,477.0,405.8,71.2,879.8,477.0,641.0,549.0,467.0,82.0,879.8,549.0,737.8,Tracheophyta; Magnoliopsida; Pinus pinaster Aiton; Olea europaea L.
2008,2008-04-06,Setúbal,Santiago do Cacém,São Bartolomeu da Serra,PORTO DOS ARNEIROS (Porto Beja),38.0169644,-8.616184,NC,177.0,2008-04-06T12:00,21.6,47,9.7,21.7,0.0,0.0,0.0,0.0,1,1006.8,986.4,30,0,0,100,0.51,1.37,9.5,12.1,209,207,26.3,24.6,16.9,15.3,14.4,0.122,0.214,0.23,0.2,1,3600.0,843.0,643.1,199.9,761.5,843.0,1153.9,818.0,624.0,194.0,761.5,818.0,1119.7,Olea europaea L.; Quercus suber L.; Tracheophyta; Magnoliopsida
2008,2008-06-12,Setúbal,Seixal,Fernão Ferro,TRASEIRAS C.SOLIDARIEDADE PINHAL FRADES (Fernão Ferro),38.5640057,-9.094534,NC,69.0,2008-06-12T16:00,28.2,34,11.0,27.5,0.0,0.0,0.0,0.0,0,1015.9,1008.0,0,0,0,0,0.58,2.51,14.0,18.4,359,2,33.5,33.0,23.9,19.2,16.3,0.065,0.131,0.174,0.184,1,3600.0,687.5,588.1,99.4,842.4,687.5,925.9,754.0,645.0,109.0,842.4,754.0,1015.5,Tracheophyta; Pinus pinaster Aiton; Magnoliopsida
2008,2008-06-13,Setúbal,Alcochete,Alcochete,FORNO DA CAL (Rua do Forno),38.74885805,-8.972979556538611,NC,0.0,2008-06-13T19:00,25.4,47,13.3,24.0,0.0,0.0,0.0,0.0,0,1016.1,1016.1,0,0,0,0,0.23,1.71,16.8,25.8,329,333,35.6,27.3,25.3,21.9,19.9,0.186,0.209,0.236,0.244,1,3600.0,133.8,95.0,38.8,555.8,133.8,226.6,207.0,147.0,60.0,555.8,207.0,350.7,Tracheophyta
2008,2008-06-30,Setúbal,Santiago do Cacém,São Domingos,BACIAS (Bacias de Baixo),37.9298853,-8.5397261,NC,81.0,2008-06-30T16:00,34.0,23,9.7,32.7,0.0,0.0,0.0,0.0,0,1015.5,1006.4,0,0,0,0,0.7,4.12,16.7,21.8,307,309,35.3,41.2,27.8,22.8,17.4,0.05,0.071,0.105,0.116,1,3600.0,702.4,603.9,98.5,859.3,702.4,929.9,770.0,662.0,108.0,859.3,770.0,1019.4,Quercus suber L.; Eucalyptus L'Hér.; Magnoliopsida; Oryza sativa L.; Tracheophyta; Olea europaea L.; Quercus rotundifolia Lam.; Pinus pinea L.; Pinus pinaster Aiton; 
2008,2008-06-24,Setúbal,Palmela,Marateca,EN 10 N/S  KM 33  DEPOIS DAS BOMBAS DA TOTAL (MARATECA),38.574292,-8.7102944,NC,2.0,2008-06-24T02:00,16.5,90,14.8,16.1,0.0,0.0,0.0,0.0,1,1017.9,1017.7,23,26,0,0,0.0,0.19,14.2,22.9,336,338,20.2,18.4,24.7,21.6,17.3,0.053,0.073,0.116,0.15,0,0.0,0.0,0.0,0.0,0.0,0.0,0.0,0.0,0.0,0.0,0.0,0.0,0.0,Vitis vinifera L.; Pinus pinea L.; Oryza sativa L.; Quercus rotundifolia Lam.; Tracheophyta
2008,2008-07-06,Setúbal,Palmela,Poceirão,JT CAMPO DA BOLA - LAGAMEÇAS (Poceirão),38.63449955,-8.743403599128786,NC,40.0,2008-07-06T01:00,16.7,69,10.9,14.8,0.0,0.0,0.0,0.0,0,1018.8,1014.0,6,7,0,0,0.05,0.6,14.9,24.3,345,345,31.3,19.4,24.9,22.5,17.9,0.053,0.065,0.101,0.148,0,0.0,0.0,0.0,0.0,0.0,0.0,0.0,0.0,0.0,0.0,0.0,0.0,0.0,Vitis vinifera L.; Quercus suber L.; Magnoliopsida; Tracheophyta
2008,2008-10-10,Setúbal,Setúbal,Gâmbia-pontes-alto Da Guerra,EN10 JT BOMBAS DA GALP DAS PONTES. (EL CARMEN),38.550456,-8.794479917557004,NC,5.0,2008-10-10T16:00,29.2,33,11.2,25.6,0.0,0.0,0.0,0.0,1,1014.0,1013.4,35,0,12,94,0.44,2.72,27.1,38.8,73,75,47.9,28.3,20.5,20.9,21.4,0.097,0.062,0.063,0.134,1,3600.0,285.4,216.6,68.9,576.5,285.4,515.6,344.0,261.0,83.0,576.5,344.0,621.4,Quercus suber L.; Tracheophyta; Pinus pinea L.
2008,2008-06-24,Setúbal,Palmela,Marateca,EN 5 - KM 33- JT CRZ PINHEIRO (MARATECA),38.574292,-8.7102944,NC,2.0,2008-06-24T11:00,23.9,49,12.6,24.3,0.0,0.0,0.0,0.0,0,1018.2,1018.0,6,7,0,0,0.55,1.51,13.6,16.5,320,324,23.4,29.4,23.7,21.6,17.3,0.053,0.072,0.116,0.15,1,3600.0,885.1,739.7,145.4,820.4,885.1,1193.5,840.0,702.0,138.0,820.4,840.0,1132.8,Vitis vinifera L.; Pinus pinea L.; Oryza sativa L.; Quercus rotundifolia Lam.; Tracheophyta
2008,2008-06-25,Setúbal,Moita,Moita,ESTRADA DOS ESPANHOIS JT A ROTUNDA TOURO (MOITA),38.6402642,-8.972055868357723,NC,22.0,2008-06-25T04:00,16.5,81,13.3,15.2,0.0,0.0,0.0,0.0,0,1016.5,1013.9,0,0,0,0,0.03,0.35,16.6,30.2,358,360,31.0,17.5,22.6,21.0,17.3,0.053,0.08,0.127,0.155,0,0.0,0.0,0.0,0.0,0.0,0.0,0.0,0.0,0.0,0.0,0.0,0.0,0.0,Eucalyptus L'Hér.; Tracheophyta
2008,2008-06-23,Setúbal,Seixal,Corroios,R. AZINHEIRAS - ALTO MOINHO (CORROIOS),38.6364997,-9.1517196,NC,18.0,2008-06-23T14:00,23.0,61,15.1,22.8,0.0,0.0,0.0,0.0,0,1016.6,1014.5,0,0,0,0,0.55,1.09,26.1,33.3,330,332,46.4,29.9,23.0,20.7,17.2,0.055,0.116,0.172,0.193,1,3600.0,927.2,792.8,134.4,861.1,927.2,1219.0,952.0,814.0,138.0,861.1,952.0,1251.6,Tracheophyta; Pinus pinea L.
2008,2008-10-13,Setúbal,Almada,Charneca De Caparica,QUINTA DE CIMA (Quinta da Aldeia),38.6285507,-9.1974387,NC,86.0,2008-10-13T14:00,19.9,67,13.7,20.4,0.0,0.0,0.0,0.0,1,1021.4,1011.2,30,25,12,0,0.33,0.76,4.7,5.0,212,210,11.9,23.6,18.6,19.9,20.7,0.183,0.081,0.103,0.179,1,3600.0,529.4,413.6,115.7,669.7,529.4,849.2,558.0,436.0,122.0,669.7,558.0,895.1,Tracheophyta; Pinus pinaster Aiton; Magnoliopsida; Pinales
2008,2008-06-27,Setúbal,Sesimbra,Sesimbra (castelo),R. Nº Sº CARMO- PEDREIRAS (Ribeira das Carvalheiras),38.49240215,-9.11796389134298,NC,63.0,2008-06-27T13:00,26.1,58,17.3,27.9,0.0,0.0,0.0,0.0,0,1019.0,1011.7,0,0,0,0,0.64,1.41,20.3,26.0,335,341,34.9,35.9,24.1,21.5,17.8,0.046,0.112,0.171,0.19,1,3600.0,991.9,871.9,120.0,906.1,991.9,1273.5,992.0,872.0,120.0,906.1,992.0,1273.6,Magnoliopsida; Quercus rotundifolia Lam.; Pinus pinaster Aiton; Tracheophyta
2008,2008-01-27,Setúbal,Santiago do Cacém,Santo André,JT URB MONTE DO CABEÇO - MARIA DA MOITA (SANTO ANDRÉ),38.0554645,-8.8008697,NC,35.0,2008-01-27T15:00,16.9,55,7.8,15.0,0.0,0.0,0.0,,1,1032.0,1027.8,27,0,0,89,0.26,0.87,9.2,10.7,45,50,18.7,16.1,12.6,13.3,14.5,0.133,0.153,0.152,0.137,1,3600.0,413.7,321.6,92.1,748.6,413.7,606.1,458.0,356.0,102.0,748.6,458.0,670.9,Pinus pinea L.; Pinus pinaster Aiton; Magnoliopsida; Quercus suber L.; Tracheophyta; Oryza sativa L.; Eucalyptus L'Hér.; Vitis vinifera L.; 
2008,2008-10-14,Setúbal,Sines,Porto Covo,PRAIA GRANDE (Praia da Foz),37.956549,-8.8689639,Desconhecida,43.0,2008-10-14T20:00,18.8,83,15.8,18.4,0.0,0.0,0.0,,0,1021.7,1016.6,19,0,0,63,0.02,0.37,15.8,27.4,336,341,24.5,19.2,19.6,19.5,20.8,0.098,0.088,0.086,0.126,0,0.0,0.0,0.0,0.0,0.0,0.0,0.0,0.0,0.0,0.0,0.0,0.0,0.0,Tracheophyta; Pinus pinea L.; Magnoliopsida; Quercus suber L.; Eucalyptus L'Hér.; Pinus pinaster Aiton; Vitis vinifera L.; Olea europaea L.; Quercus rotundifolia Lam.; 
2008,2008-05-07,Setúbal,Alcochete,Alcochete,MONTE DA CILHA QUEIMADA (Monte do Casal),38.74885805,-8.972979556538611,NC,0.0,2008-05-07T17:00,22.1,53,12.2,21.1,0.0,0.0,0.0,0.0,0,1009.7,1009.7,1,0,1,0,0.34,1.24,11.5,14.5,290,293,30.2,23.6,20.7,19.1,17.9,0.212,0.239,0.259,0.245,1,3600.0,430.9,347.1,83.8,731.3,430.9,637.7,509.0,410.0,99.0,731.3,509.0,753.2,Tracheophyta
2008,2008-06-07,Setúbal,Palmela,Marateca,EN 10 JT INTERSET (MARATECA),38.574292,-8.7102944,NC,2.0,2008-06-07T13:00,28.8,31,10.1,29.7,0.0,0.0,0.0,0.0,0,1016.5,1016.3,0,0,0,0,0.73,2.73,11.0,13.2,322,334,22.0,32.4,21.5,18.1,16.3,0.076,0.107,0.141,0.152,1,3600.0,983.3,861.6,121.7,899.7,983.3,1271.8,986.0,864.0,122.0,899.7,986.0,1275.2,Vitis vinifera L.; Pinus pinea L.; Oryza sativa L.; Quercus rotundifolia Lam.; Tracheophyta
2008,2008-01-26,Setúbal,Sesimbra,Sesimbra (castelo),ALFARIM ALDEIA MECO (Alfarim),38.49240215,-9.11796389134298,NC,63.0,2008-01-26T18:00,15.1,71,9.8,14.1,0.0,0.0,0.0,0.0,0,1031.8,1024.1,2,2,0,0,0.03,0.5,6.6,8.0,347,5,9.7,14.9,14.3,14.0,16.1,0.17,0.196,0.17,0.189,0,1350.1,0.0,0.0,0.0,0.0,0.0,0.0,33.0,19.0,14.0,178.5,33.0,89.9,Magnoliopsida; Quercus rotundifolia Lam.; Pinus pinaster Aiton; Tracheophyta
2008,2008-06-11,Setúbal,Almada,Caparica,R ANTONIO GIAO JT IPQ (CAPARICA),38.6763403,-9.211800839693492,NC,3.0,2008-06-11T13:00,26.2,49,14.5,28.7,0.0,0.0,0.0,0.0,0,1018.2,1017.9,0,0,0,0,0.66,1.75,10.0,11.5,330,340,19.8,28.4,21.5,18.8,16.4,0.22,0.266,0.296,0.291,1,3600.0,966.5,844.7,121.8,880.4,966.5,1272.9,968.0,846.0,122.0,880.4,968.0,1274.8,Magnoliopsida; Tracheophyta; Pinus pinaster Aiton
2008,2008-06-24,Setúbal,Seixal,Fernão Ferro,Pinhal do General,38.5571543,-9.0585912,NC,50.0,2008-06-24T20:00,19.5,64,12.5,16.9,0.0,0.0,0.0,0.0,0,1016.3,1010.4,0,0,0,0,0.11,0.82,23.1,34.0,337,342,34.2,23.1,23.5,20.9,17.3,0.055,0.103,0.158,0.183,1,2108.82,0.0,0.0,0.0,0.0,0.0,0.0,47.0,26.0,21.0,205.3,47.0,117.5,Tracheophyta; Pinus pinaster Aiton; Magnoliopsida
2008,2008-06-22,Setúbal,Moita,Baixa da Banheira,JT PALACETE- QUINTA FONTE DA PRATA (BAIXA DA BANHEIRA),38.6595256,-9.044184976470596,NC,11.0,2008-06-22T03:00,17.9,87,15.8,18.2,0.0,0.0,0.0,0.0,0,1015.7,1014.4,6,7,0,0,0.01,0.26,11.8,22.9,348,353,20.5,21.2,24.1,22.0,19.8,0.184,0.198,0.229,0.243,0,0.0,0.0,0.0,0.0,0.0,0.0,0.0,0.0,0.0,0.0,0.0,0.0,0.0,Tracheophyta; Magnoliopsida
2008,2008-11-23,Setúbal,Almada,Charneca De Caparica,QTA VALE ROSAL (Quinta do Vale Mourelas),38.6285507,-9.1974387,NC,86.0,2008-11-23T13:00,16.8,53,7.1,14.2,0.0,0.0,0.0,0.0,0,1018.9,1008.6,0,0,0,0,0.29,0.9,12.3,14.5,5,7,22.0,18.5,14.2,15.7,19.1,0.081,0.108,0.099,0.177,1,3600.0,502.1,424.1,77.9,841.5,502.1,707.2,509.0,430.0,79.0,841.5,509.0,716.9,Tracheophyta; Pinus pinaster Aiton; Magnoliopsida; Pinales
2008,2008-06-20,Setúbal,Almada,Caparica,JR ESCOLA Nº2 MONTE CAPARICA (CAPARICA),38.6763403,-9.211800839693492,NC,3.0,2008-06-20T11:00,25.3,61,17.2,27.2,0.0,0.0,0.0,0.0,0,1019.9,1019.5,0,0,0,0,0.55,1.26,15.6,20.0,345,353,31.3,26.1,21.1,19.9,16.9,0.182,0.231,0.283,0.29,1,3600.0,895.0,773.8,121.2,860.1,895.0,1191.6,849.0,734.0,115.0,860.1,849.0,1130.3,Magnoliopsida; Tracheophyta; Pinus pinaster Aiton
2008,2008-05-08,Setúbal,Setúbal,Setúbal (são Sebastião),ENTRONCAMENTO R. SOBREIROS (Rua dos Sobreiros),38.5226401,-8.8603354,NC,41.0,2008-05-08T18:00,16.8,61,9.3,12.9,0.0,0.0,0.0,0.0,0,1012.1,1007.2,4,4,0,0,0.21,0.74,25.5,33.4,317,319,46.1,20.6,19.4,17.4,15.4,0.09,0.131,0.157,0.152,1,3600.0,236.0,171.2,64.9,587.2,236.0,391.5,313.0,227.0,86.0,587.2,313.0,519.1,Tracheophyta; Magnoliopsida
2008,2008-06-22,Setúbal,Moita,Alhos Vedros,ARROTEAS TRASEIRAS DA ESCOLA PRIMARIA (Arroteias),38.6439907,-9.0118952,NC,15.0,2008-06-22T12:00,28.1,43,14.3,30.2,0.0,0.0,0.0,0.0,0,1015.3,1013.6,0,0,0,0,0.68,2.18,11.3,14.0,333,337,30.2,32.9,23.7,20.8,17.2,0.054,0.083,0.13,0.155,1,3600.0,973.0,854.1,118.9,894.3,973.0,1264.5,949.0,833.0,116.0,894.3,949.0,1233.3,Tracheophyta; Magnoliopsida; Quercus suber L.; Eucalyptus L'Hér.
2008,2008-05-12,Setúbal,Setúbal,Setúbal (são Julião),VARIANTE DA VARZEA JT RADIO AZUL (São Julião),38.5279518,-8.894774306731911,NC,6.0,2008-05-12T22:00,15.6,82,12.6,14.6,0.0,0.0,0.0,0.0,3,1017.3,1016.6,100,77,73,91,0.01,0.31,12.1,18.9,203,211,18.0,16.8,18.4,17.3,15.6,0.085,0.117,0.151,0.152,0,0.0,0.0,0.0,0.0,0.0,0.0,0.0,0.0,0.0,0.0,0.0,0.0,0.0,Tracheophyta; Magnoliopsida
2008,2008-06-23,Setúbal,Seixal,Seixal,JT ATERRO SANITÁRIO SEIXAL - QT QUEIMADA (SEIXAL),38.6460299,-9.089757660657,NC,0.0,2008-06-23T15:00,23.8,57,14.8,23.7,0.0,0.0,0.0,0.0,0,1016.0,1016.0,1,1,0,0,0.55,1.27,22.9,30.3,323,325,48.6,30.9,23.9,21.1,17.5,0.056,0.105,0.16,0.183,1,3600.0,836.5,722.0,114.5,867.0,836.5,1102.5,884.0,763.0,121.0,867.0,884.0,1165.2,Tracheophyta; ; Magnoliopsida
2008,2008-06-23,Setúbal,Seixal,Fernão Ferro,PAVIL - JT DEPOSITO DE AGUA (Fernão Ferro),38.5640057,-9.094534,NC,69.0,2008-06-23T15:00,23.4,57,14.4,23.1,0.0,0.0,0.0,0.0,0,1016.0,1008.0,1,1,0,0,0.54,1.24,22.9,30.3,323,325,48.6,30.5,23.5,20.7,17.1,0.056,0.105,0.16,0.183,1,3600.0,836.4,721.9,114.5,866.8,836.4,1102.6,884.0,763.0,121.0,866.8,884.0,1165.4,Tracheophyta; Pinus pinaster Aiton; Magnoliopsida
2008,2008-06-26,Setúbal,Almada,Pragal,JT CRECHE DO PRAGAL (Pragal),38.6662386,-9.1799968,NC,61.0,2008-06-26T14:00,26.4,55,16.5,27.0,0.0,0.0,0.0,0.0,0,1018.2,1011.1,0,0,0,0,0.63,1.57,24.4,31.4,338,342,40.0,29.2,22.6,20.2,17.0,0.16,0.213,0.274,0.289,1,3600.0,928.4,797.9,130.5,866.6,928.4,1218.6,953.0,819.0,134.0,866.6,953.0,1250.8,Tracheophyta; Magnoliopsida
2008,2008-01-27,Setúbal,Seixal,Aldeia de Paio Pires,JT PARQUE INDUSTRIAL - FOROS CATRAPONA (ALDEIA DE PAIO PIRES),38.6460299,-9.089757660657,NC,0.0,2008-01-27T07:00,9.3,87,7.3,7.3,0.0,0.0,0.0,0.0,0,1033.6,1033.6,5,0,0,17,0.0,0.15,8.5,18.6,62,75,17.3,10.3,12.7,14.1,16.3,0.179,0.193,0.152,0.183,0,0.0,0.0,0.0,0.0,0.0,0.0,0.0,0.0,0.0,0.0,0.0,0.0,0.0,Tracheophyta; Magnoliopsida
2008,2008-05-16,Setúbal,Alcácer do Sal,Torrão,EN 52. JT MONTE S. DOMINGUINHOS (TORRÃO),38.3020606,-8.2305314,NC,92.0,2008-05-16T20:00,16.7,64,10.0,14.8,0.0,0.0,0.0,0.0,0,1010.1,999.2,20,12,15,0,0.07,0.68,12.8,22.9,302,307,26.6,18.0,17.8,16.8,15.4,0.337,0.284,0.316,0.286,0,0.0,0.0,0.0,0.0,0.0,0.0,0.0,13.0,5.0,8.0,55.8,13.0,61.1,Tracheophyta; Quercus suber L.; Pinus pinea L.; Quercus rotundifolia Lam.; Magnoliopsida; Eucalyptus L'Hér.; Oryza sativa L.; Olea europaea L.; Pinus pinaster Aiton; Vitis vinifera L.; Quercus L.; 
2008,2008-06-28,Setúbal,Palmela,Quinta do Anjo,PINHAL FORMAS (Casal do Pinhal Basto),38.5674568,-8.9418673,NC,95.0,2008-06-28T13:00,31.6,41,16.6,35.1,0.0,0.0,0.0,0.0,0,1016.2,1005.4,0,0,0,0,0.75,2.75,9.1,10.7,304,310,27.0,38.3,25.3,21.1,17.0,0.056,0.063,0.099,0.147,1,3600.0,984.6,864.6,119.9,899.3,984.6,1272.4,985.0,865.0,120.0,899.3,985.0,1272.9,Vitis vinifera L.; Tracheophyta; Olea europaea L.; Quercus suber L.
2008,2008-02-07,Setúbal,Seixal,Amora,EN 10 FRENTE MOVIFLOR (AMORA),38.629209,-9.1171074,NC,19.0,2008-02-07T17:00,18.3,54,8.9,17.3,0.0,0.0,0.0,0.0,0,1025.5,1023.2,0,0,0,0,0.13,0.96,4.3,8.5,138,126,16.6,17.7,14.3,13.7,15.7,0.165,0.172,0.151,0.183,1,3600.0,161.2,121.9,39.3,664.1,161.2,258.2,234.0,177.0,57.0,664.1,234.0,374.9,Tracheophyta; Pinus pinea L.; Magnoliopsida
2008,2008-06-24,Setúbal,Seixal,Fernão Ferro,AV VASCO DA GAMA (Fernão Ferro),38.5640057,-9.094534,NC,69.0,2008-06-24T15:00,23.4,52,13.0,23.0,0.0,0.0,0.0,0.0,0,1017.5,1009.5,0,0,0,0,0.56,1.39,20.9,27.2,333,336,40.7,30.7,23.0,20.7,17.1,0.055,0.103,0.159,0.183,1,3600.0,838.4,726.7,111.7,872.3,838.4,1102.8,886.0,768.0,118.0,872.3,886.0,1165.5,Tracheophyta; Pinus pinaster Aiton; Magnoliopsida
2008,2008-06-10,Setúbal,Sesimbra,Sesimbra (castelo),CAIXAS - ALFARIM (Caixas),38.4698414,-9.1489127,NC,94.0,2008-06-10T16:00,22.9,49,11.5,21.4,0.0,0.0,0.0,0.0,1,1015.3,1004.4,31,0,48,7,0.36,1.44,13.2,17.3,17,21,32.8,30.3,22.6,19.0,16.4,0.052,0.141,0.189,0.192,1,3600.0,431.2,166.8,264.4,239.2,431.2,925.4,473.0,183.0,290.0,239.2,473.0,1015.1,Tracheophyta; Magnoliopsida; Pinus pinea L.; Pinus pinaster Aiton; Quercus suber L.
2008,2008-07-08,Setúbal,Seixal,Aldeia de Paio Pires,Foros da Catrapona,38.589562,-9.0784934,NC,36.0,2008-07-08T07:00,17.4,77,13.4,16.5,0.0,0.0,0.0,0.0,0,1018.8,1014.5,10,0,0,35,0.09,0.45,13.7,22.3,360,360,25.9,18.2,21.7,21.7,18.3,0.053,0.086,0.142,0.181,1,3600.0,202.5,108.6,93.9,366.1,202.5,392.4,138.0,74.0,64.0,366.1,138.0,267.4,Tracheophyta; Magnoliopsida; Pinus pinaster Aiton; Pinus pinea L.; Eucalyptus L'Hér.
2008,2008-06-26,Setúbal,Santiago do Cacém,Santo André,JT PRAIA DA VACARIA - RESERVA NATURAL DA SANCHA (SANTO ANDRÉ),38.0554645,-8.8008697,NC,35.0,2008-06-26T18:00,25.9,59,17.3,25.3,0.0,0.0,0.0,,0,1016.7,1012.6,0,0,0,0,0.32,1.37,21.4,29.4,319,324,38.9,29.7,24.6,21.0,18.1,0.035,0.079,0.124,0.137,1,3600.0,317.1,251.6,65.5,693.3,317.1,480.3,397.0,315.0,82.0,693.3,397.0,601.4,Pinus pinea L.; Pinus pinaster Aiton; Magnoliopsida; Quercus suber L.; Tracheophyta; Oryza sativa L.; Eucalyptus L'Hér.; Vitis vinifera L.; 
2008,2008-06-24,Setúbal,Seixal,Fernão Ferro,PAVIL (Fernão Ferro),38.5640057,-9.094534,NC,69.0,2008-06-24T16:00,23.1,53,12.9,21.8,0.0,0.0,0.0,0.0,0,1017.4,1009.3,0,0,0,0,0.49,1.33,21.9,29.3,337,339,42.8,29.9,23.2,20.7,17.1,0.055,0.103,0.158,0.183,1,3600.0,694.4,593.9,100.5,841.5,694.4,934.3,760.0,650.0,110.0,841.5,760.0,1022.5,Tracheophyta; Pinus pinaster Aiton; Magnoliopsida
2008,2008-06-27,Setúbal,Seixal,Corroios,JT A URBANIZAÇAO PARQUE LUSO (CORROIOS),38.6364997,-9.1517196,NC,18.0,2008-06-27T16:00,27.1,58,18.1,27.5,0.0,0.0,0.0,0.0,0,1018.4,1016.3,0,0,0,0,0.54,1.51,24.3,32.7,336,341,41.0,33.2,24.4,21.0,17.5,0.053,0.109,0.167,0.193,1,3600.0,708.6,610.7,97.8,863.0,708.6,936.6,775.0,668.0,107.0,863.0,775.0,1024.4,Tracheophyta; Pinus pinea L.
2008,2008-01-30,Setúbal,Alcácer do Sal,Alcácer Do Sal (santa Maria Do Castelo),EN125 CASEBRES (PALMA),38.3729735,-8.5122705,NC,50.0,2008-01-30T22:00,9.8,90,8.2,7.9,0.0,0.0,0.0,0.0,0,1030.6,1024.4,0,0,0,0,0.0,0.12,10.0,21.5,347,351,21.6,10.5,12.4,13.4,16.0,0.172,0.201,0.158,0.191,0,0.0,0.0,0.0,0.0,0.0,0.0,0.0,0.0,0.0,0.0,0.0,0.0,0.0,Olea europaea L.; Oryza sativa L.; Tracheophyta
2008,2008-07-08,Setúbal,Sesimbra,Quinta do Conde,RUA DE MOCAMBIQUE (Quinta do Conde),38.5724611,-9.0370259,NC,21.0,2008-07-08T14:00,26.8,41,12.5,27.8,0.0,0.0,0.0,0.0,0,1017.0,1014.6,0,0,0,0,0.68,2.08,14.3,17.6,309,317,27.7,33.7,23.0,21.7,18.2,0.053,0.07,0.112,0.153,1,3600.0,939.5,824.5,115.0,898.0,939.5,1214.9,964.0,846.0,118.0,898.0,964.0,1246.6,Tracheophyta; Magnoliopsida
2008,2008-06-14,Setúbal,Seixal,Seixal,PRQ INDUSTRIAL SEIXAL (SEIXAL),38.6460299,-9.089757660657,NC,0.0,2008-06-14T04:00,17.4,78,13.5,17.0,0.0,0.0,0.0,0.0,0,1017.0,1017.0,9,0,0,30,0.02,0.43,10.5,22.7,356,360,19.4,18.4,23.2,20.3,16.8,0.062,0.127,0.172,0.184,0,0.0,0.0,0.0,0.0,0.0,0.0,0.0,0.0,0.0,0.0,0.0,0.0,0.0,Tracheophyta; ; Magnoliopsida
2008,2008-03-30,Setúbal,Montijo,Pegões,PEGÕES,38.68008015,-8.591171494214755,NC,114.0,2008-03-30T18:00,14.4,47,3.2,9.8,0.0,0.0,0.0,0.0,1,1023.3,1009.6,39,18,0,76,0.18,0.88,21.4,31.3,315,315,45.7,17.2,15.2,13.5,14.0,0.087,0.138,0.129,0.156,1,3600.0,136.5,91.6,44.9,522.1,136.5,240.7,213.0,143.0,70.0,522.1,213.0,375.7,Pinus pinaster Aiton; Vitis vinifera L.; Pinus pinea L.; Tracheophyta; Quercus suber L.; Eucalyptus L'Hér.; Magnoliopsida; Olea europaea L.; Pinales; 
2008,2008-07-08,Setúbal,Sesimbra,Sesimbra (castelo),Apostiça,38.49240215,-9.11796389134298,NC,63.0,2008-07-08T16:00,23.3,58,14.6,22.1,0.0,0.0,0.0,0.0,0,1018.3,1010.9,0,0,0,0,0.47,1.21,24.9,32.6,329,331,43.9,32.4,23.9,21.9,18.7,0.046,0.1,0.16,0.189,1,3600.0,692.0,593.3,98.7,839.8,692.0,934.7,757.0,649.0,108.0,839.8,757.0,1022.5,Magnoliopsida; Quercus rotundifolia Lam.; Pinus pinaster Aiton; Tracheophyta
2008,2008-06-27,Setúbal,Setúbal,São Simão,HERD DOS ARNEIROS - ARRÁBIDA (Herdade da Mourisca),38.5264679,-8.985538480683791,NC,163.0,2008-06-27T16:00,26.7,52,16.0,27.2,0.0,0.0,0.0,0.0,0,1017.7,999.0,0,0,0,0,0.55,1.69,18.5,24.5,327,330,39.2,36.0,25.1,21.2,17.2,0.045,0.098,0.157,0.182,1,3600.0,706.4,607.7,98.7,860.3,706.4,935.0,773.0,665.0,108.0,860.3,773.0,1023.0,Olea europaea L.; Tracheophyta; Quercus suber L.; Magnoliopsida; Pinus pinea L.; Pinus pinaster Aiton; Vitis vinifera L.
2008,2008-06-17,Setúbal,Seixal,Aldeia de Paio Pires,Foros da Catrapona,38.589562,-9.0784934,NC,36.0,2008-06-17T14:00,23.1,49,11.9,24.7,0.0,0.0,0.0,0.0,0,1014.8,1010.6,2,2,0,0,0.6,1.44,9.2,11.3,318,323,29.2,29.5,21.7,20.3,16.8,0.067,0.118,0.168,0.184,1,3600.0,918.6,776.6,142.1,845.1,918.6,1217.6,944.0,798.0,146.0,845.1,944.0,1251.2,Tracheophyta; Magnoliopsida; Pinus pinaster Aiton; Pinus pinea L.; Eucalyptus L'Hér.
