year,date,district,municipality,parish,local,latitude,longitude,cause,elevation,hourly.time,hourly.temperature_2m,hourly.relative_humidity_2m,hourly.dew_point_2m,hourly.apparent_temperature,hourly.precipitation,hourly.rain,hourly.snowfall,hourly.snow_depth,hourly.weather_code,hourly.pressure_msl,hourly.surface_pressure,hourly.cloud_cover,hourly.cloud_cover_low,hourly.cloud_cover_mid,hourly.cloud_cover_high,hourly.et0_fao_evapotranspiration,hourly.vapour_pressure_deficit,hourly.wind_speed_10m,hourly.wind_speed_100m,hourly.wind_direction_10m,hourly.wind_direction_100m,hourly.wind_gusts_10m,hourly.soil_temperature_0_to_7cm,hourly.soil_temperature_7_to_28cm,hourly.soil_temperature_28_to_100cm,hourly.soil_temperature_100_to_255cm,hourly.soil_moisture_0_to_7cm,hourly.soil_moisture_7_to_28cm,hourly.soil_moisture_28_to_100cm,hourly.soil_moisture_100_to_255cm,hourly.is_day,hourly.sunshine_duration,hourly.shortwave_radiation_instant,hourly.direct_radiation_instant,hourly.diffuse_radiation_instant,hourly.direct_normal_irradiance_instant,hourly.global_tilted_irradiance_instant,hourly.terrestrial_radiation_instant,hourly.shortwave_radiation,hourly.direct_radiation,hourly.diffuse_radiation,hourly.direct_normal_irradiance,hourly.global_tilted_irradiance,hourly.terrestrial_radiation,scientificNames
2009,2009-06-14,Lisboa,Mafra,Santo Estêvão Das Galés,CRUZAMENTO SANTA EULALIA (Casal de Santa Ana),38.8772945,-9.2440132,NC,170.0,2009-06-14T16:00,27.2,46,14.7,27.0,0.0,0.0,0.0,0.0,1,1016.1,996.7,38,0,16,96,0.51,1.94,16.5,21.0,349,355,24.8,31.1,22.5,19.1,15.8,0.11,0.187,0.243,0.259,1,3600.0,615.4,461.1,154.3,657.5,615.4,929.8,674.0,505.0,169.0,657.5,674.0,1018.4,Magnoliopsida; Tracheophyta; Quercus suber L.; Pinus pinaster Aiton; Eucalyptus L'Hér.
2009,2009-07-13,Lisboa,Loures,Sacavém,VALE FIGUEIRA - QTA JUNTO DO RIO TRANCAO (Quinta do Vale Flores),38.7943867,-9.108563857720288,NC,33.0,2009-07-13T14:00,23.8,51,12.9,23.6,0.0,0.0,0.0,0.0,0,1015.8,1012.0,0,0,0,0,0.6,1.45,20.5,26.7,322,325,43.6,27.6,24.2,23.0,21.4,0.239,0.279,0.312,0.329,1,3600.0,916.5,786.8,129.7,859.6,916.5,1211.4,940.0,807.0,133.0,859.6,940.0,1242.5,Tracheophyta; Olea europaea L.; 
2009,2009-05-28,Lisboa,Azambuja,Alcoentre,TAGARRO,39.2298864,-8.9848935,NC,101.0,2009-05-28T19:00,29.8,24,7.1,27.5,0.0,0.0,0.0,0.0,0,1014.1,1002.6,0,0,0,0,0.23,3.18,10.2,21.9,51,63,24.8,28.6,23.1,18.0,15.3,0.113,0.184,0.239,0.236,1,3600.0,115.7,81.4,34.3,548.9,115.7,197.5,189.0,133.0,56.0,548.9,189.0,322.7,Eucalyptus L'Hér.; Magnoliopsida; Pinus pinea L.; Quercus suber L.
2009,2009-05-29,Lisboa,Azambuja,Alcoentre,FERREIRIA - CASAL DAS BOIÇAS (ALCOENTRE),39.1996519,-8.953651111785318,NC,87.0,2009-05-29T23:00,21.7,46,9.4,19.3,0.0,0.0,0.0,0.0,0,1012.2,1002.1,7,0,0,24,0.11,1.41,15.6,31.1,8,16,30.6,22.7,24.5,18.5,15.4,0.094,0.182,0.237,0.236,0,0.0,0.0,0.0,0.0,0.0,0.0,0.0,0.0,0.0,0.0,0.0,0.0,0.0,Tracheophyta; Pinus pinea L.; Eucalyptus L'Hér.; Pinales
2009,2009-07-08,Lisboa,Mafra,Milharado,Casais da Serra,38.9127427,-9.1807023,NC,198.0,2009-07-08T16:00,24.4,49,13.0,23.1,0.0,0.0,0.0,0.0,0,1015.1,992.3,0,0,0,0,0.52,1.55,21.9,28.7,330,333,44.3,31.2,23.2,21.1,17.5,0.097,0.169,0.223,0.256,1,3600.0,689.7,590.9,98.8,836.1,689.7,935.2,754.0,646.0,108.0,836.1,754.0,1022.3,Tracheophyta; Magnoliopsida; Pinus pinaster Aiton; Eucalyptus L'Hér.
2009,2009-07-08,Lisboa,Vila Franca de Xira,Póvoa de Santa Iria,BRAGADAS (Bairro das Bragadas),38.8562721,-9.069732030166948,NC,17.0,2009-07-08T22:00,18.9,74,14.1,17.6,0.0,0.0,0.0,0.0,0,1017.2,1015.2,0,0,0,0,0.05,0.57,17.7,30.7,340,344,34.9,22.3,23.7,21.7,18.1,0.275,0.288,0.325,0.373,0,0.0,0.0,0.0,0.0,0.0,0.0,0.0,0.0,0.0,0.0,0.0,0.0,0.0,Tracheophyta; Magnoliopsida; Oryza sativa L.; 
2009,2009-07-09,Lisboa,Sintra,Algueirão-Mem Martins,TAPADA MERCES - TRASEIRAS EDIFICIO DAS FINANÇAS (Casal da Tapada),38.7999099,-9.3397834,NC,166.0,2009-07-09T12:00,22.5,60,14.5,22.8,0.0,0.0,0.0,0.0,0,1018.7,999.4,0,0,0,0,0.55,1.08,21.0,26.1,329,332,37.1,25.5,20.9,20.1,17.2,0.148,0.186,0.228,0.263,1,3600.0,968.0,847.8,120.2,895.6,968.0,1252.5,942.0,825.0,117.0,895.6,942.0,1218.9,Tracheophyta; Magnoliopsida; Pinales; 
2009,2009-04-29,Lisboa,Mafra,Ericeira,STO ISIDORO (JT CENTRO RECREATIVO) (SANTO ISIDORO)-Carrasqueira,38.9653447,-9.4136809,Desconhecida,70.0,2009-04-29T20:00,13.9,83,11.0,12.9,0.0,0.0,0.0,0.0,1,1021.7,1013.2,38,30,0,36,0.03,0.27,8.4,14.8,250,257,20.2,15.7,16.6,14.9,14.2,0.259,0.294,0.307,0.314,0,0.0,0.0,0.0,0.0,0.0,0.0,0.0,6.0,2.0,4.0,26.7,6.0,41.9,Magnoliopsida; Tracheophyta
2009,2009-07-04,Lisboa,Arruda dos Vinhos,Arranhó,LOURICEIRA (Louriceira de Baixo),38.95337155,-9.134980363016528,NC,239.0,2009-07-04T12:00,24.4,50,13.3,25.3,0.0,0.0,0.0,0.0,1,1017.3,989.8,24,6,0,62,0.58,1.54,13.2,16.3,331,332,30.2,30.7,23.4,21.5,17.1,0.107,0.164,0.217,0.244,1,3600.0,892.1,653.9,238.2,689.0,892.1,1255.8,869.0,637.0,232.0,689.0,869.0,1223.2,Tracheophyta; Magnoliopsida
2009,2009-06-16,Lisboa,Sintra,Almargem do Bispo,VALE DE LOBOS - QUINTA DA CERCA - RUA FRANSCISCO BERTAN (Azenha do Rio do Vale),38.8491202,-9.264334778649603,NC,283.0,2009-06-16T00:00,19.1,73,14.2,18.7,0.0,0.0,0.0,0.0,2,1015.9,982.9,69,0,70,91,0.03,0.59,11.9,21.3,358,4,29.9,20.3,22.1,18.7,15.2,0.139,0.186,0.242,0.259,0,0.0,0.0,0.0,0.0,0.0,0.0,0.0,0.0,0.0,0.0,0.0,0.0,0.0,Tracheophyta; Magnoliopsida; Pinus pinaster Aiton; Eucalyptus L'Hér.; Vitis vinifera L.; 
2009,2009-07-05,Lisboa,Sintra,Mira-sintra,Mira Sintra,38.78413805,-9.301270661479826,NC,170.0,2009-07-05T14:00,21.2,66,14.5,20.9,0.0,0.0,0.0,0.0,1,1017.6,997.8,32,1,2,99,0.42,0.87,16.9,21.4,310,311,40.7,25.3,21.8,20.3,16.9,0.179,0.19,0.231,0.263,1,3600.0,670.8,246.7,424.1,268.2,670.8,1217.0,688.0,253.0,435.0,268.2,688.0,1248.1,Tracheophyta; Magnoliopsida; Pinales
2009,2009-07-11,Lisboa,Torres Vedras,Torres Vedras (são Pedro E São Tiago),Paul,39.09299855,-9.25866085,NC,33.0,2009-07-11T18:00,20.4,67,14.0,18.5,0.0,0.0,0.0,0.0,0,1018.8,1014.9,0,0,0,0,0.25,0.8,21.9,28.2,333,333,41.0,27.8,23.9,21.6,18.4,0.09,0.168,0.227,0.271,1,3600.0,323.7,257.9,65.9,697.8,323.7,489.0,403.0,321.0,82.0,697.8,403.0,608.7,Tracheophyta; Magnoliopsida
2009,2009-07-12,Lisboa,Torres Vedras,Ramalhal,AMEAL,39.1447908,-9.23308489562511,NC,49.0,2009-07-12T15:00,25.6,57,16.5,27.1,0.0,0.0,0.0,0.0,0,1016.1,1010.4,0,0,0,0,0.56,1.41,16.6,20.4,319,324,32.4,36.1,25.0,22.4,18.8,0.083,0.16,0.214,0.25,1,3600.0,803.4,686.9,116.5,827.7,803.4,1098.2,848.0,725.0,123.0,827.7,848.0,1159.2,Eucalyptus L'Hér.; Pinus pinaster Aiton; Magnoliopsida; Tracheophyta; Vitis vinifera L.; Pinales; Quercus suber L.; 
2009,2009-06-09,Lisboa,ODIVELAS,Ramada,IC-22 JNT DEPOSITOS DE AGUA (Ramada),38.80800875,-9.196381569305192,NC,233.0,2009-06-09T16:00,18.8,63,11.5,16.3,0.0,0.0,0.0,0.0,3,1018.9,991.6,100,69,74,9,0.29,0.81,20.1,27.0,227,227,40.3,22.4,18.8,18.0,15.1,0.194,0.194,0.247,0.26,1,3600.0,427.7,132.2,295.4,189.8,427.7,924.5,469.0,145.0,324.0,189.8,469.0,1013.9,Eucalyptus L'Hér.; Tracheophyta; Magnoliopsida; Olea europaea L.; Pinus pinea L.; 
2009,2009-07-09,Lisboa,Loures,São João da Talha,R PRAZERES (SÃO JOÃO DA TALHA),38.8260487,-9.09807838407007,NC,77.0,2009-07-09T18:00,23.3,55,13.7,21.2,0.0,0.0,0.0,0.0,0,1017.2,1008.2,0,0,0,0,0.31,1.29,22.2,30.8,331,333,43.2,26.7,24.5,23.0,21.3,0.241,0.281,0.314,0.329,1,3600.0,329.7,263.9,65.8,717.0,329.7,487.0,411.0,329.0,82.0,717.0,411.0,607.2,Tracheophyta; Magnoliopsida; Olea europaea L.; 
2009,2009-03-14,Lisboa,Cadaval,Cercal,MALHADA DOS TOUROS (Malhada),39.2395742,-9.06220649671875,NC,116.0,2009-03-14T14:00,20.3,47,8.7,18.6,0.0,0.0,0.0,0.0,0,1021.0,1007.3,14,0,0,48,0.46,1.26,16.7,21.3,353,354,31.7,21.4,14.9,13.4,12.9,0.219,0.288,0.32,0.244,1,3600.0,733.3,589.1,144.1,833.2,733.3,978.8,758.0,609.0,149.0,833.2,758.0,1011.9,Eucalyptus L'Hér.; Magnoliopsida; Tracheophyta; Pinales; Vitis vinifera L.; Olea europaea L.; Pinus pinaster Aiton; Castanea sativa Mill.; 
2009,2009-07-19,Lisboa,Cascais,São Domingos de Rana,TRAJOUCE (JUNTO FERRO VELHO) (TRAJOUCE),38.7015666,-9.3417434,NC,71.0,2009-07-19T00:00,18.8,80,15.4,16.8,0.0,0.0,0.0,0.0,0,1019.8,1011.4,0,0,0,0,0.05,0.43,26.6,41.9,2,4,43.2,20.3,22.2,20.7,18.3,0.142,0.184,0.226,0.27,0,0.0,0.0,0.0,0.0,0.0,0.0,0.0,0.0,0.0,0.0,0.0,0.0,0.0,Tracheophyta; Magnoliopsida
2009,2009-06-17,Lisboa,Oeiras,Carnaxide,SERRA DE CARNAXIDE (Quinta da Serra),38.7255312,-9.2463156,NC,73.0,2009-06-17T18:00,26.6,56,17.2,25.9,0.0,0.0,0.0,0.0,0,1016.7,1008.3,6,0,0,19,0.33,1.53,22.8,33.4,348,353,38.2,29.1,25.0,20.1,16.4,0.181,0.201,0.242,0.273,1,3600.0,299.0,216.4,82.6,591.4,299.0,484.9,373.0,270.0,103.0,591.4,373.0,604.9,Tracheophyta; Magnoliopsida; Pinus pinea L.; Vitis vinifera L.; Eucalyptus L'Hér.; Olea europaea L.; Pinus pinaster Aiton
2009,2009-07-03,Lisboa,Oeiras,Cruz Quebrada-Dafundo,JUNTO ESTADIO NACIONAL (Cruz Quebrada-Dafundo),38.7078885,-9.256338784303695,NC,5.0,2009-07-03T13:00,23.0,70,17.3,25.7,0.0,0.0,0.0,0.0,0,1018.9,1018.3,2,2,0,2,0.56,0.84,13.8,16.0,277,278,27.0,27.6,22.8,21.2,17.9,0.218,0.2,0.235,0.271,1,3600.0,939.4,796.4,143.1,829.7,939.4,1269.9,939.0,796.0,143.0,829.7,939.0,1269.4,Tracheophyta; Pinus pinaster Aiton; Pinales; Magnoliopsida; Pinus pinea L.; Vitis vinifera L.; Eucalyptus L'Hér.; Olea europaea L.
2009,2009-06-21,Lisboa,Cascais,Alcabideche,Carrascal de Alvide,38.7244789,-9.4244829,NC,92.0,2009-06-21T04:00,19.9,78,16.0,20.7,0.0,0.0,0.0,0.0,0,1016.2,1005.4,0,0,0,0,0.01,0.5,8.0,17.7,10,17,12.2,20.8,23.3,20.5,16.5,0.155,0.2,0.244,0.273,0,0.0,0.0,0.0,0.0,0.0,0.0,0.0,0.0,0.0,0.0,0.0,0.0,0.0,Tracheophyta; Eucalyptus L'Hér.; Magnoliopsida; Pinus pinea L.; Pinus pinaster Aiton; Pinales; Vitis vinifera L.; 
2009,2009-07-20,Lisboa,Loures,Camarate,R CIDADE DE VISEU -FETAIS (Rua Cidade São Salvador),38.7904638,-9.1441212,NC,139.0,2009-07-20T23:00,21.9,64,14.9,21.2,0.0,0.0,0.0,0.0,0,1014.7,998.5,0,0,0,0,0.07,0.94,16.3,23.7,342,347,24.5,25.7,27.0,24.4,22.6,0.237,0.276,0.31,0.328,0,0.0,0.0,0.0,0.0,0.0,0.0,0.0,0.0,0.0,0.0,0.0,0.0,0.0,Tracheophyta; Olea europaea L.; Magnoliopsida; 
2009,2009-07-08,Lisboa,Oeiras,Barcarena,R ELIAS GARCIA - BARCARENA (BARCARENA),38.7319947,-9.2789232,NC,55.0,2009-07-08T00:00,17.9,82,14.7,16.0,0.0,0.0,0.0,0.0,0,1017.3,1010.8,2,1,0,2,0.04,0.38,23.3,33.8,340,341,40.7,19.3,21.4,20.8,17.8,0.176,0.196,0.233,0.271,0,0.0,0.0,0.0,0.0,0.0,0.0,0.0,0.0,0.0,0.0,0.0,0.0,0.0,Tracheophyta; Magnoliopsida; Pinus pinea L.; Vitis vinifera L.; Eucalyptus L'Hér.; Olea europaea L.; Pinus pinaster Aiton
2009,2009-10-12,Lisboa,Cadaval,Vilar,Avenal,39.1768319,-9.0994967,NC,165.0,2009-10-12T21:00,21.3,74,16.5,21.9,0.0,0.0,0.0,0.0,0,1016.7,997.5,0,0,0,0,0.03,0.65,10.8,24.5,21,30,18.4,20.9,22.7,21.8,21.9,0.181,0.189,0.172,0.225,0,0.0,0.0,0.0,0.0,0.0,0.0,0.0,0.0,0.0,0.0,0.0,0.0,0.0,Magnoliopsida; Eucalyptus L'Hér.; Vitis vinifera L.; Tracheophyta; Olea europaea L.; 
2009,2009-06-22,Lisboa,Cascais,Alcabideche,BICESSE JUNTO IGREJA DAS NEVES (Alto de Bicesse),38.739751850000005,-9.40823198439682,NC,97.0,2009-06-22T16:00,20.7,71,15.1,20.9,0.0,0.0,0.0,0.0,0,1019.1,1007.7,14,16,0,0,0.41,0.72,16.6,19.8,294,295,33.8,29.6,23.8,20.6,16.8,0.081,0.148,0.202,0.241,1,3600.0,663.1,538.7,124.4,760.4,663.1,938.0,725.0,589.0,136.0,760.4,725.0,1025.6,Tracheophyta; Eucalyptus L'Hér.; Magnoliopsida; Pinus pinea L.; Pinus pinaster Aiton; Pinales; Vitis vinifera L.; 
2009,2009-03-15,Lisboa,Alenquer,Abrigada,Bairro,39.1137545,-9.0199062,NC,148.0,2009-03-15T14:00,23.6,36,7.5,23.5,0.0,0.0,0.0,0.0,0,1019.0,1001.8,0,0,0,0,0.52,1.88,6.1,7.9,40,47,17.6,23.7,15.0,13.3,12.6,0.203,0.28,0.315,0.24,1,3600.0,757.4,661.6,95.8,928.3,757.4,986.1,783.0,684.0,99.0,928.3,783.0,1019.4,Vitis vinifera L.; Olea europaea L.; Tracheophyta; Magnoliopsida; Pinus pinaster Aiton
2009,2009-10-13,Lisboa,Alenquer,Vila Verde dos Francos,CASAIS DA ALMONIA / PORTELA DO SOL (Casais),39.1566625,-9.1177912,Desconhecida,183.0,2009-10-13T23:00,18.4,47,7.0,16.0,0.0,0.0,0.0,0.0,0,1016.0,994.5,12,0,0,39,0.07,1.12,11.2,26.4,92,95,22.0,17.6,21.8,21.7,21.7,0.155,0.188,0.172,0.225,0,0.0,0.0,0.0,0.0,0.0,0.0,0.0,0.0,0.0,0.0,0.0,0.0,0.0,Tracheophyta; Magnoliopsida; Vitis vinifera L.; Eucalyptus L'Hér.; Olea europaea L.
2009,2009-06-16,Lisboa,Arruda dos Vinhos,Arruda dos Vinhos,LAMEIRO DA ANTAS (Casais do Lameiro das Antas),38.99119885,-9.062929029605822,NC,72.0,2009-06-16T13:00,29.5,45,16.1,30.8,0.0,0.0,0.0,0.0,0,1016.1,1007.9,1,0,0,2,0.67,2.29,16.9,22.0,38,40,39.6,31.2,23.6,20.1,16.1,0.203,0.265,0.317,0.33,1,3600.0,876.8,712.0,164.8,742.1,876.8,1271.6,878.0,713.0,165.0,742.1,878.0,1273.3,Vitis vinifera L.; Tracheophyta
2009,2009-06-23,Lisboa,Amadora,Falagueira,Falagueira,38.757228,-9.2066219,NC,105.0,2009-06-23T01:00,17.3,84,14.5,16.4,0.0,0.0,0.0,0.0,3,1019.3,1006.8,96,85,0,64,0.02,0.32,16.3,21.4,332,333,27.4,19.8,23.7,21.4,16.6,0.126,0.188,0.236,0.261,0,0.0,0.0,0.0,0.0,0.0,0.0,0.0,0.0,0.0,0.0,0.0,0.0,0.0,Tracheophyta; 
2009,2009-07-19,Lisboa,Amadora,Falagueira,QUINTA DA LAGE (Quinta da Vinha),38.7613137,-9.2259842,NC,127.0,2009-07-19T01:00,18.3,82,15.2,16.3,0.0,0.0,0.0,0.0,0,1019.6,1004.6,0,0,0,0,0.04,0.38,25.9,40.8,2,5,41.8,20.0,22.7,21.0,18.1,0.12,0.172,0.219,0.258,0,0.0,0.0,0.0,0.0,0.0,0.0,0.0,0.0,0.0,0.0,0.0,0.0,0.0,Tracheophyta; 
2009,2009-07-08,Lisboa,Lourinhã,Marteleira,MARTELEIRA,39.2102087,-9.271864289252752,Desconhecida,45.0,2009-07-08T19:00,19.8,71,14.4,17.4,0.0,0.0,0.0,0.0,0,1016.5,1011.2,0,0,0,0,0.16,0.67,26.6,36.6,347,350,45.4,25.1,23.4,21.3,17.9,0.093,0.156,0.213,0.254,1,3600.0,143.5,103.0,40.5,555.6,143.5,245.3,216.0,155.0,61.0,555.6,216.0,369.2,Tracheophyta; Eucalyptus L'Hér.; Pinus pinea L.; Magnoliopsida; Vitis vinifera L.; 
2009,2009-07-08,Lisboa,Sintra,Belas,QTA DO WIMER (BELAS),38.7756179,-9.2638001,NC,142.0,2009-07-08T20:00,19.1,76,14.7,16.8,0.0,0.0,0.0,0.0,0,1016.2,999.5,0,0,0,0,0.08,0.54,26.4,39.0,343,346,42.8,21.8,22.0,20.3,17.3,0.15,0.187,0.229,0.263,1,2110.78,0.0,0.0,0.0,0.0,0.0,0.0,52.0,30.0,22.0,236.1,52.0,117.7,Pinus pinaster Aiton; Tracheophyta; Pinales; Eucalyptus L'Hér.; Magnoliopsida; 
2009,2009-06-22,Lisboa,Mafra,Igreja Nova,SÃO JOÃO DAS COVAS (SÃO JULIÃO),38.9527351,-9.292900922890908,Desconhecida,157.0,2009-06-22T13:00,22.0,62,14.3,23.6,0.0,0.0,0.0,0.0,1,1019.3,1001.0,24,27,0,0,0.57,1.02,13.9,15.7,287,286,29.2,32.5,24.3,21.0,16.4,0.087,0.179,0.244,0.279,1,3600.0,950.6,782.7,167.9,814.9,950.6,1271.7,951.0,783.0,168.0,814.9,951.0,1272.3,Magnoliopsida; Eucalyptus L'Hér.; Tracheophyta; Pinales; Pinus pinaster Aiton
2009,2009-10-18,Lisboa,Alenquer,Ribafria,Ribafria,39.06415665,-9.08696556489279,NC,138.0,2009-10-18T18:00,19.4,54,9.9,17.6,0.0,0.0,0.0,0.0,0,1013.1,996.9,5,0,0,17,0.08,1.03,12.0,20.6,309,313,25.2,23.0,21.3,21.8,22.5,0.091,0.174,0.171,0.227,0,1624.16,0.0,0.0,0.0,0.0,0.0,0.0,43.0,26.0,17.0,223.9,43.0,100.7,Vitis vinifera L.; Tracheophyta; Pinales; Eucalyptus L'Hér.; Magnoliopsida
2009,2009-06-22,Lisboa,Loures,Lousa,Freixeira,38.8898108,-9.2059575,NC,167.0,2009-06-22T22:00,17.6,80,14.2,16.8,0.0,0.0,0.0,0.0,2,1020.1,1000.3,52,58,0,0,0.02,0.39,15.0,19.9,325,325,28.1,21.7,25.5,21.6,16.5,0.09,0.175,0.234,0.258,0,0.0,0.0,0.0,0.0,0.0,0.0,0.0,0.0,0.0,0.0,0.0,0.0,0.0,Tracheophyta; Magnoliopsida; Pinus pinaster Aiton; Eucalyptus L'Hér.; Pinales; 
2009,2009-07-11,Lisboa,Cascais,Cascais,Encosta da Carreira,38.716873,-9.431847899404216,NC,53.0,2009-07-11T14:00,22.4,59,14.1,22.6,0.0,0.0,0.0,0.0,0,1018.3,1012.1,0,0,0,0,0.56,1.1,20.9,25.1,318,321,37.4,26.8,21.6,20.7,18.1,0.159,0.192,0.231,0.271,1,3600.0,935.2,816.2,119.0,889.8,935.2,1214.0,959.0,837.0,122.0,889.8,959.0,1244.9,Tracheophyta; Pinus pinaster Aiton; Magnoliopsida
2009,2009-07-18,Lisboa,Torres Vedras,Maceira,MACEIRA - PITAGUDO (Maceira),39.1809806,-9.340490816591055,NC,84.0,2009-07-18T11:00,22.6,46,10.5,20.5,0.0,0.0,0.0,0.0,0,1023.5,1013.6,0,0,0,0,0.54,1.47,24.7,30.6,13,15,45.7,26.5,21.5,21.2,18.2,0.088,0.151,0.207,0.253,1,3600.0,885.9,769.5,116.4,877.0,885.9,1161.9,837.0,727.0,110.0,877.0,837.0,1097.7,Eucalyptus L'Hér.; Tracheophyta; Vitis vinifera L.; Magnoliopsida; Pinus pinea L.; 
2009,2009-10-18,Lisboa,Vila Franca de Xira,São João dos Montes,RUA DAMAO - TRANCOSO (SÃO JOÃO DOS MONTES),38.9395248,-9.0279965,NC,48.0,2009-10-18T21:00,16.5,76,12.3,16.1,0.0,0.0,0.0,0.0,0,1013.8,1008.1,0,0,0,0,0.01,0.45,7.7,17.3,319,324,15.5,19.1,21.1,21.8,21.7,0.285,0.298,0.286,0.361,0,0.0,0.0,0.0,0.0,0.0,0.0,0.0,0.0,0.0,0.0,0.0,0.0,0.0,Magnoliopsida; Tracheophyta; Pinus pinaster Aiton; Vitis vinifera L.; Olea europaea L.; Eucalyptus L'Hér.; Pinales; 
2009,2009-06-24,Lisboa,Lisboa,Beato,Beato,38.7352423,-9.1039589,NC,9.0,2009-06-24T16:00,23.9,50,12.9,23.2,0.0,0.0,0.0,0.0,1,1014.5,1013.5,23,26,0,0,0.49,1.47,16.9,21.6,269,271,36.4,29.5,25.4,23.8,20.8,0.184,0.189,0.208,0.23,1,3600.0,659.2,517.4,141.7,732.1,659.2,935.7,721.0,566.0,155.0,732.1,721.0,1023.5,Tracheophyta
2009,2009-06-21,Lisboa,Sintra,Colares,"Miradouro-Talhão nº 5, Serra de Sintra",38.7795709,-9.4760411,Desconhecida,237.0,2009-06-21T16:00,21.6,71,16.1,22.0,0.0,0.0,0.0,0.0,0,1015.8,988.3,13,1,0,39,0.42,0.74,18.1,23.1,287,291,35.6,31.3,23.7,19.5,15.8,0.082,0.149,0.202,0.241,1,3600.0,677.4,556.7,120.7,787.7,677.4,936.0,741.0,609.0,132.0,787.7,741.0,1023.9,Tracheophyta; Magnoliopsida; Pinus pinaster Aiton; Pinales; Pinus pinea L.; Eucalyptus L'Hér.; Vitis vinifera L.; Acacia Mill.; 
2009,2009-07-20,Lisboa,Alenquer,Carregado,RUA DINIS DIAS JUNTO PORTAGENS DO CARREGADO (Carregado),39.0148764,-8.96080135,NC,7.0,2009-07-20T08:00,21.3,72,16.0,21.8,0.0,0.0,0.0,0.0,0,1017.0,1016.2,11,0,5,27,0.17,0.72,10.8,15.1,358,359,27.0,23.0,24.9,22.9,19.0,0.158,0.25,0.292,0.326,1,3600.0,312.0,181.0,131.0,390.6,312.0,613.7,250.0,145.0,105.0,390.6,250.0,491.7,Tracheophyta; Magnoliopsida
2009,2009-10-19,Lisboa,Sintra,São João das Lampas,CASAL PIANOS (Casal Alentejano),38.8815463,-9.405697273499548,NC,122.0,2009-10-19T18:00,17.5,73,12.6,16.4,0.0,0.0,0.0,0.0,3,1010.6,996.2,100,74,63,95,0.06,0.55,13.3,17.6,268,269,27.7,20.6,20.0,21.0,21.7,0.083,0.176,0.205,0.282,0,0.0,0.0,0.0,0.0,0.0,0.0,0.0,20.0,0.0,20.0,0.0,20.0,100.1,Tracheophyta; Magnoliopsida; Pinus pinaster Aiton; Pinus pinea L.; Vitis vinifera L.; Pinales; Olea europaea L.; 
2009,2009-06-27,Lisboa,Sintra,Algueirão-Mem Martins,JNT MODELO ALGUEIRÃO MEM MARTINS (Algueirão-Mem Martins),38.7977037,-9.341033451942735,NC,169.0,2009-06-27T17:00,21.4,69,15.6,19.8,0.0,0.0,0.0,0.0,1,1014.2,994.6,30,15,7,40,0.32,0.78,23.7,32.0,206,206,48.6,24.6,21.3,20.1,16.4,0.13,0.184,0.235,0.264,1,3600.0,468.3,346.2,122.1,627.8,468.3,729.7,537.0,397.0,140.0,627.8,537.0,836.9,Tracheophyta; Magnoliopsida; Pinales; 
2009,2009-10-19,Lisboa,Sintra,Agualva,Lopas,38.7740235,-9.2935542,NC,156.0,2009-10-19T19:00,17.7,71,12.3,16.6,0.0,0.0,0.0,0.0,3,1010.6,992.3,100,57,54,97,0.04,0.59,12.3,15.5,267,267,23.4,19.0,19.7,20.7,20.6,0.148,0.183,0.188,0.251,0,0.0,0.0,0.0,0.0,0.0,0.0,0.0,0.0,0.0,0.0,0.0,0.0,0.0,Tracheophyta; Magnoliopsida; 
2009,2009-07-09,Lisboa,Azambuja,Alcoentre,Ameixoeira,39.2078257,-8.9572359,NC,81.0,2009-07-09T14:00,27.1,41,12.6,26.8,0.0,0.0,0.0,0.0,0,1018.1,1008.8,0,0,0,0,0.7,2.13,21.6,27.2,330,332,42.8,36.5,24.9,22.7,18.7,0.083,0.156,0.203,0.231,1,3600.0,942.4,825.4,116.9,902.6,942.4,1210.1,967.0,847.0,120.0,902.6,967.0,1241.8,Tracheophyta; Magnoliopsida; Pinales; Olea europaea L.
2009,2009-07-20,Lisboa,Cascais,São Domingos de Rana,Talaide,38.7015666,-9.3417434,NC,71.0,2009-07-20T13:00,26.8,45,13.9,29.8,0.0,0.0,0.0,0.0,0,1016.5,1008.3,0,0,0,0,0.67,1.94,6.1,4.7,310,328,17.6,31.2,23.3,20.9,18.3,0.139,0.182,0.225,0.269,1,3600.0,965.5,852.3,113.2,898.7,965.5,1256.3,964.0,851.0,113.0,898.7,964.0,1254.3,Tracheophyta; Magnoliopsida
2009,2009-03-14,Lisboa,Loures,Bucelas,Quinta da Chamorra,38.9016248,-9.118728,NC,89.0,2009-03-14T16:00,21.4,44,8.7,18.6,0.0,0.0,0.0,0.0,0,1020.1,1009.6,3,0,0,10,0.38,1.42,17.1,22.9,345,347,31.7,21.4,15.9,13.6,12.9,0.236,0.303,0.336,0.275,1,3600.0,494.2,412.8,81.3,844.6,494.2,676.7,565.0,472.0,93.0,844.6,565.0,773.6,Magnoliopsida; Tracheophyta; Olea europaea L.; Pinus pinea L.; Pinus pinaster Aiton; Eucalyptus L'Hér.; Vitis vinifera L.; 
2009,2009-03-11,Lisboa,Sintra,Agualva,IMPASSE OCA (Juvandes),38.7740235,-9.2935542,NC,156.0,2009-03-11T16:00,19.3,56,10.2,17.9,0.0,0.0,0.0,0.0,1,1019.0,1000.6,23,0,0,78,0.32,1.0,10.1,13.0,356,6,17.6,20.0,15.4,13.3,13.2,0.289,0.318,0.333,0.27,1,3600.0,475.2,389.6,85.6,810.3,475.2,666.7,544.0,446.0,98.0,810.3,544.0,763.2,Tracheophyta; Magnoliopsida; 
2009,2009-10-19,Lisboa,Mafra,Milharado,Jeromelo,38.9352275,-9.2012529,NC,170.0,2009-10-19T20:00,17.3,73,12.5,16.5,0.0,0.0,0.0,0.0,3,1009.9,989.9,83,58,2,98,0.03,0.53,11.1,16.9,257,258,19.4,18.7,20.0,21.2,21.8,0.101,0.172,0.181,0.243,0,0.0,0.0,0.0,0.0,0.0,0.0,0.0,0.0,0.0,0.0,0.0,0.0,0.0,Tracheophyta
2009,2009-10-19,Lisboa,Sintra,Algueirão-Mem Martins,MEM MARTINS (Algueirão-Mem Martins),38.7977037,-9.341033451942735,NC,169.0,2009-10-19T21:00,17.4,74,12.7,17.1,0.0,0.0,0.0,0.0,3,1010.0,990.2,89,61,10,95,0.02,0.52,8.0,15.4,243,249,15.8,18.2,19.6,20.6,20.5,0.148,0.183,0.188,0.251,0,0.0,0.0,0.0,0.0,0.0,0.0,0.0,0.0,0.0,0.0,0.0,0.0,0.0,Tracheophyta; Magnoliopsida; Pinales; 
2009,2009-07-18,Lisboa,Amadora,São Brás,R DO ALGARVE - A-DA-BEJA (Rua do Algarve),38.768975,-9.2286535,NC,180.0,2009-07-18T21:00,19.5,65,12.7,17.3,0.0,0.0,0.0,0.0,0,1020.3,999.1,0,0,0,0,0.08,0.8,20.5,35.1,350,354,40.0,22.1,22.9,20.6,17.7,0.12,0.172,0.219,0.258,0,0.0,0.0,0.0,0.0,0.0,0.0,0.0,0.0,0.0,0.0,0.0,0.0,0.0,Tracheophyta
2009,2009-06-26,Lisboa,ODIVELAS,Odivelas,PATAMEIRAS (ODIVELAS),38.7932694,-9.172982,NC,33.0,2009-06-26T16:00,22.7,52,12.4,22.3,0.0,0.0,0.0,0.0,0,1016.6,1012.7,0,0,0,1,0.47,1.32,14.6,17.1,261,262,26.3,28.3,23.2,21.7,17.3,0.125,0.184,0.233,0.26,1,3600.0,661.1,509.3,151.8,719.9,661.1,936.4,723.0,557.0,166.0,719.9,723.0,1024.0,Tracheophyta; Magnoliopsida
2009,2009-06-23,Lisboa,Sintra,Montelavar,CASAL SEQUEIRO (Casal Alentejano),38.8571312,-9.3250289,NC,150.0,2009-06-23T20:00,19.3,83,16.3,18.9,0.0,0.0,0.0,0.0,0,1016.7,999.1,4,4,0,0,0.05,0.39,17.8,25.0,312,314,31.7,24.8,25.0,21.4,16.7,0.085,0.179,0.244,0.277,1,2209.89,2.0,1.1,0.9,12.1,1.4,4.8,51.0,27.0,24.0,209.4,51.0,124.2,Tracheophyta; Magnoliopsida; Pinus pinaster Aiton; Eucalyptus L'Hér.; Vitis vinifera L.; 
2009,2009-06-24,Lisboa,Oeiras,Porto Salvo,RIBEIRA DA LAGE RUA JOAQUIM MATIAS (Ribeira-a-Baixa),38.7162932,-9.3086601,NC,83.0,2009-06-24T16:00,21.4,64,14.2,21.0,0.0,0.0,0.0,0.0,1,1015.0,1005.3,26,29,0,0,0.42,0.93,17.5,21.2,278,280,31.0,26.7,22.7,20.8,16.9,0.146,0.194,0.241,0.272,1,3600.0,642.8,492.9,150.0,696.2,642.8,937.2,703.0,539.0,164.0,696.2,703.0,1024.9,Tracheophyta; Magnoliopsida; Pinus pinea L.; Vitis vinifera L.; Eucalyptus L'Hér.; Olea europaea L.; Pinus pinaster Aiton
2009,2009-07-11,Lisboa,Lourinhã,Miragaia,LG DA SERRA DE MIRAGAIA (MIRAGAIA),39.2235048,-9.254066885707614,NC,48.0,2009-07-11T16:00,21.3,60,13.1,20.1,0.0,0.0,0.0,0.0,0,1018.8,1013.1,0,0,0,0,0.44,1.03,21.9,26.3,330,331,40.0,30.1,23.1,21.2,18.0,0.089,0.154,0.211,0.254,1,3600.0,690.7,591.0,99.7,838.1,690.7,933.2,755.0,646.0,109.0,838.1,755.0,1020.0,Tracheophyta; Eucalyptus L'Hér.; Pinus pinea L.; Magnoliopsida; Vitis vinifera L.; 
2009,2009-07-23,Lisboa,Torres Vedras,A dos Cunhados,Casal da Carrasquinha,39.0930856,-9.260741,NC,37.0,2009-07-23T13:00,22.3,64,15.1,23.6,0.0,0.0,0.0,0.0,1,1018.0,1013.7,22,24,0,0,0.5,0.98,12.9,15.1,288,288,25.6,30.4,23.5,22.2,19.0,0.12,0.163,0.22,0.269,1,3600.0,813.3,499.8,313.5,530.1,813.3,1249.3,812.0,499.0,313.0,530.1,812.0,1247.4,Eucalyptus L'Hér.; Tracheophyta; Vitis vinifera L.; Magnoliopsida; Pinus pinea L.; 
2009,2009-07-22,Lisboa,Azambuja,Vila Nova de São Pedro,Torre Penalva,39.2129579,-8.8452108,NC,97.0,2009-07-22T17:00,24.3,68,18.0,22.8,0.5,0.5,0.0,0.0,53,1010.7,999.5,100,98,62,0,0.27,0.97,30.0,43.2,215,214,58.7,27.7,24.7,22.7,18.8,0.115,0.155,0.191,0.224,1,3600.0,291.0,167.1,123.8,315.5,291.0,701.8,336.0,193.0,143.0,315.5,336.0,810.5,Tracheophyta; Magnoliopsida
2009,2009-10-14,Lisboa,Torres Vedras,Turcifal,Melroeira,39.0307529,-9.2569706,NC,90.0,2009-10-14T19:00,21.0,68,14.9,20.9,0.0,0.0,0.0,0.0,0,1014.9,1004.4,0,0,0,0,0.04,0.79,11.6,22.3,353,1,17.6,22.0,22.4,21.8,21.9,0.148,0.184,0.192,0.262,0,0.0,0.0,0.0,0.0,0.0,0.0,0.0,0.0,0.0,0.0,0.0,0.0,0.0,Tracheophyta; Castanea sativa Mill.; Vitis vinifera L.; Magnoliopsida; Pinales; Eucalyptus L'Hér.; 
2009,2009-06-26,Lisboa,ODIVELAS,Pontinha,ENCOSTA LUZ (Bairro Encosta do Mourigo),38.7670657,-9.1996189,NC,96.0,2009-06-26T15:00,22.3,52,12.1,22.2,0.0,0.0,0.0,0.0,1,1017.0,1005.8,26,17,1,34,0.49,1.29,13.1,15.3,261,261,25.6,27.9,22.6,21.3,16.9,0.125,0.184,0.233,0.26,1,3600.0,717.7,496.1,221.5,594.9,717.7,1103.7,758.0,524.0,234.0,594.9,758.0,1165.8,Pinus pinea L.; Olea europaea L.; Tracheophyta; Magnoliopsida; 
2009,2009-06-27,Lisboa,Oeiras,Oeiras E São Julião Da Barra,ALTO PUXA FEIXE (Alto da Lagôa),38.69325455,-9.314443310006252,NC,9.0,2009-06-27T14:00,22.0,71,16.5,20.6,0.2,0.2,0.0,0.0,51,1015.4,1014.3,69,41,38,31,0.36,0.77,26.5,35.0,202,204,42.8,25.3,21.8,21.1,17.5,0.146,0.191,0.239,0.272,1,3600.0,578.8,270.9,307.9,294.1,578.8,1219.2,594.0,278.0,316.0,294.1,594.0,1251.1,Pinus pinea L.; Magnoliopsida; Tracheophyta; Vitis vinifera L.; Eucalyptus L'Hér.; Olea europaea L.; Pinus pinaster Aiton
2009,2009-07-04,Lisboa,Sintra,Casal de Cambra,JUNTO Á RUA DE EVORA CASAL DE CAMBRA (Casal de Cambra),38.79718845,-9.228319927517482,NC,230.0,2009-07-04T16:00,22.7,56,13.6,22.1,0.0,0.0,0.0,0.0,0,1016.6,990.0,10,0,0,35,0.47,1.2,18.7,23.9,322,323,41.0,27.4,22.9,20.3,16.6,0.172,0.185,0.228,0.259,1,3600.0,684.4,571.0,113.5,805.2,684.4,938.2,748.0,624.0,124.0,805.2,748.0,1025.3,Tracheophyta; Magnoliopsida; ; Eucalyptus L'Hér.
2009,2009-07-05,Lisboa,Oeiras,Carnaxide,TRASEIRAS DAS BOMBAS DE GASOLINA DO JUMBO (CARNAXIDE),38.7275721,-9.238170738165364,NC,108.0,2009-07-05T15:00,21.9,59,13.6,20.4,0.0,0.0,0.0,0.0,1,1018.1,1005.5,32,0,3,99,0.41,1.07,21.3,25.7,323,323,39.2,26.2,22.7,21.0,17.5,0.189,0.186,0.226,0.271,1,3600.0,612.8,259.5,353.3,311.3,612.8,1103.2,647.0,274.0,373.0,311.3,647.0,1164.7,Tracheophyta; Magnoliopsida; Pinus pinea L.; Vitis vinifera L.; Eucalyptus L'Hér.; Olea europaea L.; Pinus pinaster Aiton
