2009,2009-07-31,Lisboa,Cascais,Alcabideche,ALCOITAO - ESTRADA DO VASSOREIRO (ALCOITÃO),38.7385929,-9.39839871613692,NC,139.0,2009-07-31T00:00,17.6,82,14.5,16.4,0.0,0.0,0.0,0.0,0,1023.6,1007.0,0,0,0,0,0.03,0.37,18.6,28.6,345,345,32.4,18.9,22.7,21.2,18.8,0.079,0.131,0.18,0.235,0,0.0,0.0,0.0,0.0,0.0,0.0,0.0,0.0,0.0,0.0,0.0,0.0,0.0,Tracheophyta; Eucalyptus L'Hér.; Magnoliopsida; Pinus pinea L.; Pinus pinaster Aiton; Pinales; Vitis vinifera L.; 
2009,2009-08-03,Lisboa,Cascais,São Domingos de Rana,PARQUE INDUSTRIAL COTAI - MATO CHEIRINHOS (Parque da Gandarinha),38.7015666,-9.3417434,NC,71.0,2009-08-03T15:00,23.1,55,13.7,21.9,0.0,0.0,0.0,0.0,1,1016.6,1008.3,27,0,0,89,0.52,1.26,25.7,32.8,338,341,43.2,26.8,21.7,21.1,19.0,0.145,0.173,0.217,0.268,1,3600.0,797.9,691.2,106.7,860.7,797.9,1066.9,845.0,732.0,113.0,860.7,845.0,1129.9,Tracheophyta; Magnoliopsida
2009,2009-05-31,Lisboa,Loures,Fanhões,CABEÇO MONTACHIQUE (Cabeço da Aguieira),38.8805246,-9.1541923,NC,176.0,2009-05-31T23:00,17.6,86,15.2,18.7,0.0,0.0,0.0,0.0,1,1015.4,994.7,34,38,0,0,0.0,0.29,4.4,6.9,235,276,7.9,19.9,23.4,18.4,14.9,0.1,0.202,0.254,0.261,0,0.0,0.0,0.0,0.0,0.0,0.0,0.0,0.0,0.0,0.0,0.0,0.0,0.0,Magnoliopsida; Tracheophyta; Eucalyptus L'Hér.; 
2009,2009-03-18,Lisboa,Mafra,Carvoeira,Urzal,38.9392419,-9.3837512,NC,81.0,2009-03-18T14:00,20.1,42,6.9,19.1,0.0,0.0,0.0,0.0,0,1016.2,1006.7,0,0,0,0,0.49,1.36,11.8,17.4,128,124,33.5,22.2,15.9,14.6,13.5,0.18,0.282,0.343,0.307,1,3600.0,785.2,689.3,95.8,945.7,785.2,1006.9,811.0,712.0,99.0,945.7,811.0,1040.0,Vitis vinifera L.; Magnoliopsida; Eucalyptus L'Hér.; Tracheophyta; Pinus pinea L.; ; Pinus pinaster Aiton
2009,2009-07-29,Lisboa,Torres Vedras,Freiria,EST TORRES-PALHAGUEIRAS (ESTEVEIRAS),39.0246473,-9.3198387,NC,62.0,2009-07-29T14:00,23.1,53,12.9,23.2,0.0,0.0,0.0,0.0,0,1023.7,1016.4,0,0,0,0,0.58,1.34,19.5,24.3,332,336,36.7,33.0,23.7,22.4,19.5,0.087,0.161,0.219,0.273,1,3600.0,917.0,791.3,125.7,882.6,917.0,1189.5,941.0,812.0,129.0,882.6,941.0,1220.6,Vitis vinifera L.; Magnoliopsida; Tracheophyta; Eucalyptus L'Hér.; 
2009,2009-07-25,Lisboa,Sintra,São João das Lampas,"Banagas, Rua das Banagas junto ao nº 72",38.8815463,-9.405697273499548,Desconhecida,122.0,2009-07-25T07:00,17.3,83,14.4,16.0,0.0,0.0,0.0,0.0,0,1023.0,1008.4,0,0,0,0,0.07,0.34,19.4,28.1,360,1,31.3,18.3,22.3,22.1,18.9,0.085,0.168,0.236,0.295,1,3567.02,184.4,116.6,67.8,445.3,183.5,347.2,117.0,74.0,43.0,443.0,117.0,220.3,Tracheophyta; Magnoliopsida; Pinus pinaster Aiton; Pinus pinea L.; Vitis vinifera L.; Pinales; Olea europaea L.; 
2009,2009-06-02,Lisboa,ODIVELAS,Famões,FAMOES (Famões),38.79343465,-9.209065683730335,NC,157.0,2009-06-02T20:00,17.8,80,14.3,17.0,0.0,0.0,0.0,0.0,2,1016.7,998.2,52,40,0,52,0.05,0.41,15.5,19.9,316,316,27.7,21.3,21.8,18.5,14.9,0.143,0.213,0.253,0.263,0,848.08,0.0,0.0,0.0,0.0,0.0,0.0,32.0,14.0,18.0,121.3,32.0,94.5,Pinus pinea L.; Olea europaea L.; Tracheophyta; Magnoliopsida; 
2009,2009-07-29,Lisboa,Sintra,Rio de Mouro,VARES DE MONDAR (Varge Mondar),38.7580496,-9.3398953,NC,135.0,2009-07-29T08:00,18.1,74,13.4,16.5,0.0,0.0,0.0,0.0,0,1022.1,1006.1,4,4,0,0,0.16,0.54,18.9,23.7,347,347,32.0,19.5,21.0,21.0,18.4,0.127,0.17,0.216,0.26,1,3600.0,357.9,265.2,92.6,600.5,357.9,585.9,282.0,209.0,73.0,600.5,282.0,461.7,Tracheophyta; Magnoliopsida; Pinales; 
2009,2009-08-02,Lisboa,Sintra,Rio de Mouro,MONCORVO (Moncorvo de Baixo),38.7723602,-9.3256835,NC,116.0,2009-08-02T03:00,17.0,80,13.4,14.8,0.0,0.0,0.0,0.0,2,1018.6,1004.8,51,53,0,10,0.04,0.4,22.8,30.7,355,356,34.2,18.5,21.4,21.1,18.6,0.139,0.168,0.214,0.26,0,0.0,0.0,0.0,0.0,0.0,0.0,0.0,0.0,0.0,0.0,0.0,0.0,0.0,Tracheophyta; Magnoliopsida; Pinales; 
2009,2009-06-09,Lisboa,Alenquer,Abrigada,ABRIGADA - BAIRRO (ABRIGADA),39.1137545,-9.0199062,NC,148.0,2009-06-09T23:00,15.6,86,13.4,15.3,0.0,0.0,0.0,0.0,1,1020.0,1002.3,25,11,0,49,0.0,0.24,9.8,19.3,208,217,17.6,17.0,19.8,19.2,15.8,0.146,0.173,0.23,0.236,0,0.0,0.0,0.0,0.0,0.0,0.0,0.0,0.0,0.0,0.0,0.0,0.0,0.0,Vitis vinifera L.; Olea europaea L.; Tracheophyta; Magnoliopsida; Pinus pinaster Aiton
2009,2009-07-29,Lisboa,Sintra,Rio de Mouro,Varge Mondar,38.7580496,-9.3398953,NC,135.0,2009-07-29T16:00,22.5,58,13.8,20.9,0.0,0.0,0.0,0.0,0,1023.6,1007.8,0,0,0,0,0.46,1.15,25.5,33.2,331,334,42.8,27.4,22.4,21.0,18.4,0.126,0.169,0.215,0.26,1,3600.0,676.6,581.9,94.7,850.7,676.6,907.6,743.0,639.0,104.0,850.7,743.0,996.7,Tracheophyta; Magnoliopsida; Pinales; 
2009,2009-06-10,Lisboa,Alenquer,Olhalvo,Pocariça,39.0959418,-9.0683323,NC,72.0,2009-06-10T15:00,23.7,57,14.7,24.8,0.0,0.0,0.0,0.0,0,1021.4,1013.0,2,0,3,0,0.54,1.25,13.7,16.9,273,272,31.7,30.8,21.5,19.7,16.4,0.128,0.176,0.235,0.244,1,3600.0,798.3,677.4,120.9,822.2,798.3,1093.2,845.0,717.0,128.0,822.2,845.0,1157.2,Tracheophyta; Vitis vinifera L.; Magnoliopsida
2009,2009-05-06,Lisboa,Loures,Santo António Dos Cavaleiros,SAC - R JOSE AFONSO (Santo António dos Cavaleiros),38.8110049,-9.168907984969817,NC,115.0,2009-05-06T16:00,21.5,55,12.0,20.9,0.0,0.0,0.0,0.0,0,1020.7,1007.2,0,0,0,0,0.44,1.16,14.3,18.0,295,296,27.4,25.3,20.2,16.2,14.1,0.191,0.258,0.276,0.265,1,3600.0,648.6,554.0,94.6,861.1,648.6,864.9,720.0,615.0,105.0,861.1,720.0,960.2,Tracheophyta; Olea europaea L.; Magnoliopsida; 
2009,2009-07-30,Lisboa,Lourinhã,Moledo,MOLEDO,39.29675495,-9.25366163639725,NC,146.0,2009-07-30T21:00,17.5,77,13.4,15.8,0.0,0.0,0.0,0.0,0,1023.7,1006.3,0,0,0,0,0.04,0.46,19.3,26.9,351,352,32.0,21.4,24.0,21.7,18.8,0.081,0.144,0.191,0.235,0,0.0,0.0,0.0,0.0,0.0,0.0,0.0,0.0,0.0,0.0,0.0,0.0,0.0,Magnoliopsida; Eucalyptus L'Hér.; Tracheophyta; Vitis vinifera L.; Pinales; 
2009,2009-07-27,Lisboa,Loures,Santo Antão do Tojal,TRASEIRAS DA CASA GAIATO (SANTO ANTÃO DO TOJAL),38.8590093,-9.1617468,NC,68.0,2009-07-27T11:00,23.7,57,14.6,23.0,0.0,0.0,0.0,0.0,0,1020.6,1012.6,1,1,0,0,0.51,1.26,23.3,30.4,343,346,40.0,25.6,23.4,23.1,21.4,0.239,0.275,0.308,0.328,1,3600.0,848.0,722.9,125.1,832.5,848.0,1151.6,800.0,682.0,118.0,832.5,800.0,1086.5,Magnoliopsida; Tracheophyta
2009,2009-07-26,Lisboa,Torres Vedras,Torres Vedras (são Pedro E São Tiago),TORRES VEDRAS,39.09299855,-9.25866085,NC,33.0,2009-07-26T20:00,18.7,76,14.3,16.9,0.0,0.0,0.0,0.0,0,1018.7,1014.8,0,0,0,0,0.07,0.53,22.0,31.4,342,342,38.5,23.7,24.5,22.3,19.3,0.094,0.162,0.218,0.268,0,1511.99,0.0,0.0,0.0,0.0,0.0,0.0,37.0,20.0,17.0,175.3,37.0,92.8,Tracheophyta; Magnoliopsida
2009,2009-07-23,Lisboa,Torres Vedras,Ventosa,R DRA MARGARIDA FELICIANO - COSTA D´AGUA (VENTOSA),39.0557661,-9.322560226043292,NC,55.0,2009-07-23T14:00,22.2,64,15.0,22.8,0.0,0.0,0.0,0.0,1,1018.1,1011.6,21,23,0,0,0.45,0.98,14.6,17.4,290,292,27.0,30.5,23.7,22.1,18.9,0.119,0.163,0.22,0.269,1,3600.0,715.8,442.7,273.0,489.1,715.8,1199.6,734.0,454.0,280.0,489.1,734.0,1230.2,Vitis vinifera L.; Eucalyptus L'Hér.; Tracheophyta; Magnoliopsida; 
2009,2009-08-02,Lisboa,Sintra,Rio de Mouro,Varge Mondar,38.7580496,-9.3398953,NC,135.0,2009-08-02T14:00,21.4,54,11.6,19.5,0.0,0.0,0.0,0.0,1,1019.0,1003.2,30,0,0,100,0.53,1.18,27.8,35.7,339,341,45.7,26.0,21.4,21.0,18.5,0.137,0.168,0.214,0.26,1,3600.0,900.1,786.1,114.0,881.5,900.1,1184.4,924.0,807.0,117.0,881.5,924.0,1215.9,Tracheophyta; Magnoliopsida; Pinales; 
2009,2009-08-02,Lisboa,Loures,Unhos,Bº NOVO (QTA DO BELO) (Bairro do Estacal Novo),38.8306985,-9.1260338,NC,101.0,2009-08-02T13:00,22.4,44,9.4,20.4,0.0,0.0,0.0,0.0,1,1019.1,1007.3,20,0,0,67,0.59,1.53,25.5,31.9,337,340,42.1,25.7,22.5,22.6,21.1,0.244,0.273,0.306,0.328,1,3600.0,941.1,809.0,132.2,869.6,941.1,1235.5,940.0,808.0,132.0,869.6,940.0,1234.0,Tracheophyta; Olea europaea L.; Magnoliopsida; 
2009,2009-08-03,Lisboa,Sintra,Sintra (santa Maria E São Miguel),Prolongamento da Estrada de Boialvo (Lourel),38.8103492,-9.377955008632217,Desconhecida,174.0,2009-08-03T18:00,20.1,70,14.5,18.1,0.0,0.0,0.0,0.0,1,1016.4,996.0,27,0,0,91,0.22,0.7,23.7,32.1,350,351,43.2,25.3,22.2,20.8,18.7,0.086,0.129,0.178,0.235,1,3600.0,276.9,214.7,62.2,656.2,276.9,434.7,356.0,276.0,80.0,656.2,356.0,558.8,Tracheophyta; Magnoliopsida
2009,2009-02-13,Lisboa,ODIVELAS,Caneças,QUINTA DO BRETÃO (Quinta da Azenha Velha),38.8165498,-9.221342021551935,NC,230.0,2009-02-13T17:00,15.7,57,7.1,14.1,0.0,0.0,0.0,0.0,0,1017.6,990.4,0,0,0,0,0.14,0.77,5.3,10.0,62,69,17.6,14.6,11.5,11.1,13.0,0.349,0.367,0.354,0.261,1,3600.0,188.5,145.5,43.0,690.3,188.5,295.7,263.0,203.0,60.0,690.3,263.0,412.7,Eucalyptus L'Hér.; Tracheophyta; Magnoliopsida; Olea europaea L.; Pinus pinea L.; 
2009,2009-08-04,Lisboa,Cascais,Alcabideche,Amoreira,38.7220702,-9.4122271,NC,81.0,2009-08-04T21:00,19.9,91,18.4,20.6,0.0,0.0,0.0,0.0,1,1016.7,1007.2,37,41,0,0,0.01,0.2,16.2,27.7,348,351,28.8,22.1,22.9,21.0,19.0,0.143,0.173,0.217,0.268,0,0.0,0.0,0.0,0.0,0.0,0.0,0.0,0.0,0.0,0.0,0.0,0.0,0.0,Tracheophyta; Eucalyptus L'Hér.; Magnoliopsida; Pinus pinea L.; Pinus pinaster Aiton; Pinales; Vitis vinifera L.; 
2009,2009-08-06,Lisboa,ODIVELAS,Pontinha,Bairro de Santa Maria,38.7670657,-9.1996189,NC,96.0,2009-08-06T10:00,21.5,64,14.4,20.1,0.0,0.0,0.0,0.0,0,1020.3,1009.0,4,1,0,10,0.37,0.93,22.2,27.5,347,349,40.0,24.0,22.5,21.7,19.2,0.124,0.163,0.209,0.255,1,3600.0,683.0,550.6,132.4,738.4,683.0,991.4,619.0,499.0,120.0,738.4,619.0,898.5,Pinus pinea L.; Olea europaea L.; Tracheophyta; Magnoliopsida; 
2009,2009-03-18,Lisboa,ODIVELAS,Famões,Bº TRIGACHE (Bairro Casal do Trigache),38.7912413,-9.2108576,NC,134.0,2009-03-18T13:00,20.0,39,5.6,17.8,0.0,0.0,0.0,0.0,0,1016.9,1001.2,0,0,0,0,0.51,1.42,17.6,23.7,118,116,38.2,19.8,15.7,14.5,13.2,0.23,0.285,0.322,0.267,1,3600.0,831.3,732.1,99.3,951.5,831.3,1062.8,829.0,730.0,99.0,951.5,829.0,1059.8,Pinus pinea L.; Olea europaea L.; Tracheophyta; Magnoliopsida; 
2009,2009-08-01,Lisboa,Sintra,Sintra (santa Maria E São Miguel),LOUREL - TRASEIRAS MODELO (Lourel),38.8103492,-9.377955008632217,Desconhecida,174.0,2009-08-01T01:00,18.0,93,16.9,19.4,0.0,0.0,0.0,0.0,0,1019.8,999.2,4,4,0,0,0.0,0.14,7.6,15.9,301,309,13.3,18.8,22.5,21.0,18.6,0.078,0.131,0.179,0.235,0,0.0,0.0,0.0,0.0,0.0,0.0,0.0,0.0,0.0,0.0,0.0,0.0,0.0,Tracheophyta; Magnoliopsida
2009,2009-06-13,Lisboa,Sintra,Montelavar,Pero Pinheiro,38.87001885,-9.31361893705293,NC,150.0,2009-06-13T13:00,25.3,53,15.1,25.8,0.0,0.0,0.0,0.0,1,1015.8,998.5,30,1,36,25,0.6,1.51,20.7,26.8,343,349,33.8,30.4,21.9,19.0,16.0,0.112,0.192,0.254,0.279,1,3600.0,908.0,730.2,177.8,760.9,908.0,1272.6,909.0,731.0,178.0,760.9,909.0,1274.0,Tracheophyta; Magnoliopsida; Pinus pinaster Aiton; Eucalyptus L'Hér.; Vitis vinifera L.; 
2009,2009-07-30,Lisboa,Cascais,Cascais,TRAVESSA REPUBLICA (CASCAIS),38.71502635,-9.456762952650216,NC,68.0,2009-07-30T16:00,21.8,67,15.5,21.1,0.0,0.0,0.0,0.0,0,1022.8,1014.8,0,0,0,0,0.42,0.86,23.9,31.4,339,342,42.1,29.8,23.5,21.6,19.2,0.079,0.131,0.18,0.235,1,3600.0,672.6,579.8,92.8,849.9,672.6,905.4,739.0,637.0,102.0,849.9,739.0,994.7,Pinus pinea L.; Tracheophyta; Magnoliopsida; Pinus pinaster Aiton
2009,2009-08-07,Lisboa,Vila Franca de Xira,Alhandra,QTA DO ALFERES-SUB SERRA (Quinta da Serrana),38.9233146,-9.011625222778765,NC,4.0,2009-08-07T04:00,16.6,89,14.8,15.5,0.0,0.0,0.0,0.0,0,1019.9,1019.4,5,6,0,0,0.01,0.21,18.1,31.1,339,342,34.9,19.3,23.2,22.5,19.6,0.254,0.271,0.306,0.369,0,0.0,0.0,0.0,0.0,0.0,0.0,0.0,0.0,0.0,0.0,0.0,0.0,0.0,Magnoliopsida; Tracheophyta; Pinus pinaster Aiton; Vitis vinifera L.; Olea europaea L.; Eucalyptus L'Hér.; Pinales; 
2009,2009-03-17,Lisboa,Mafra,Carvoeira,Ursal,38.942756,-9.3965784,NC,66.0,2009-03-17T16:00,21.9,34,5.4,17.5,0.0,0.0,0.0,0.0,0,1016.5,1008.8,4,0,0,14,0.44,1.72,23.2,34.1,106,106,41.4,21.9,16.8,14.6,13.6,0.193,0.286,0.345,0.307,1,3600.0,512.5,437.1,75.5,869.9,512.5,694.4,584.0,498.0,86.0,869.9,584.0,791.2,Vitis vinifera L.; Magnoliopsida; Eucalyptus L'Hér.; Tracheophyta; Pinus pinea L.; 
2009,2009-07-28,Lisboa,Loures,Loures,ESTRADA SEC. DE CORREIO MOR (Estrada do Forte),38.914803,-9.2128319,NC,260.0,2009-07-28T22:00,17.0,70,11.6,15.7,0.0,0.0,0.0,0.0,0,1020.3,989.6,0,0,0,0,0.04,0.58,12.7,22.0,335,339,27.7,20.4,23.8,21.6,18.3,0.091,0.158,0.209,0.253,0,0.0,0.0,0.0,0.0,0.0,0.0,0.0,0.0,0.0,0.0,0.0,0.0,0.0,Tracheophyta; Magnoliopsida; Pinus pinaster Aiton; Pinus pinea L.; Eucalyptus L'Hér.
2009,2009-06-15,Lisboa,Oeiras,Barcarena,R 7 DE JUNHO - BARCARENA (BARCARENA),38.7319947,-9.2789232,NC,55.0,2009-06-15T14:00,24.3,65,17.2,25.9,0.6,0.6,0.0,0.0,53,1016.5,1010.1,76,0,77,100,0.37,1.08,6.7,6.5,344,6,26.3,27.2,22.2,19.3,16.4,0.189,0.21,0.249,0.273,1,3600.0,517.9,247.2,270.6,269.1,517.9,1217.8,532.0,254.0,278.0,269.1,532.0,1251.0,Tracheophyta; Magnoliopsida; Pinus pinea L.; Vitis vinifera L.; Eucalyptus L'Hér.; Olea europaea L.; Pinus pinaster Aiton
2009,2009-06-16,Lisboa,Sintra,Almargem do Bispo,QTA DA CERCA VALE DE LOBOS - BELAS (ALMARGEM DO BISPO),38.8640076,-9.3371894,NC,136.0,2009-06-16T16:00,24.4,59,16.0,24.7,0.0,0.0,0.0,0.0,0,1015.6,999.9,1,0,0,2,0.47,1.24,17.8,23.4,353,1,37.4,30.6,23.3,19.7,16.3,0.111,0.189,0.252,0.278,1,3600.0,656.0,539.9,116.0,767.0,656.0,933.0,718.0,591.0,127.0,767.0,718.0,1021.2,Tracheophyta; Magnoliopsida; Pinus pinaster Aiton; Eucalyptus L'Hér.; Vitis vinifera L.; 
2009,2009-08-02,Lisboa,Vila Franca de Xira,Alverca do Ribatejo,ENCOSTA DO CASAL MOINHO DE VENTO (ALVERCA DO RIBATEJO),38.8904104,-9.0344661,NC,3.0,2009-08-02T16:00,23.1,42,9.6,20.1,0.0,0.0,0.0,0.0,0,1017.9,1017.5,17,0,0,56,0.49,1.62,24.0,32.1,341,342,51.1,27.3,23.0,22.4,19.4,0.263,0.272,0.309,0.37,1,3600.0,624.9,439.6,185.3,654.0,624.9,892.8,688.0,484.0,204.0,654.0,688.0,982.9,Magnoliopsida; Tracheophyta; Pinales; Olea europaea L.; Pinus pinaster Aiton; Eucalyptus L'Hér.; Oryza sativa L.; Pinus pinea L.; Vitis vinifera L.; 
2009,2009-07-28,Lisboa,Sintra,Queluz,TRASEIRAS ESCOLA PADRE ALBERTO- QUINTA ESTRADAS DE PORTUGAL (QUELUZ),38.75481445,-9.25728260154883,NC,123.0,2009-07-28T23:00,17.7,76,13.3,16.3,0.0,0.0,0.0,0.0,0,1020.2,1005.6,0,0,0,0,0.04,0.49,16.2,24.6,347,349,29.9,19.8,22.5,21.1,18.4,0.127,0.17,0.216,0.26,0,0.0,0.0,0.0,0.0,0.0,0.0,0.0,0.0,0.0,0.0,0.0,0.0,0.0,Pinus pinaster Aiton; Tracheophyta; Pinales; Eucalyptus L'Hér.; Magnoliopsida; 
2009,2009-06-19,Lisboa,Cadaval,Alguber,ALGUBER,39.28111,-9.02056575,NC,103.0,2009-06-19T19:00,25.9,51,15.0,25.5,0.0,0.0,0.0,0.0,0,1017.4,1005.5,0,0,0,0,0.21,1.64,14.2,19.3,336,339,31.0,31.5,27.6,21.0,16.5,0.09,0.17,0.226,0.247,1,3600.0,135.9,94.1,41.8,515.9,135.9,241.7,205.0,142.0,63.0,515.9,205.0,364.6,Magnoliopsida; Eucalyptus L'Hér.; Tracheophyta; 
2009,2009-08-09,Lisboa,Cadaval,Alguber,ALGUBER,39.28111,-9.02056575,NC,103.0,2009-08-09T04:00,16.9,87,14.7,15.8,0.0,0.0,0.0,0.0,1,1014.0,1001.8,28,4,0,81,0.02,0.25,18.4,31.2,337,341,39.2,18.6,22.7,22.3,19.8,0.09,0.152,0.193,0.24,0,0.0,0.0,0.0,0.0,0.0,0.0,0.0,0.0,0.0,0.0,0.0,0.0,0.0,Magnoliopsida; Eucalyptus L'Hér.; Tracheophyta; 
2009,2009-05-20,Lisboa,Torres Vedras,São Pedro da Cadeira,Escravelheira,39.0701787,-9.3716166,NC,50.0,2009-05-20T21:00,15.5,75,11.1,13.2,0.0,0.0,0.0,,1,1013.6,1007.6,28,1,0,90,0.04,0.44,18.4,28.4,357,359,33.1,17.0,17.8,15.9,14.7,0.111,0.164,0.183,0.189,0,0.0,0.0,0.0,0.0,0.0,0.0,0.0,0.0,0.0,0.0,0.0,0.0,0.0,Magnoliopsida; Tracheophyta; Vitis vinifera L.; Eucalyptus L'Hér.; 
2009,2009-08-09,Lisboa,ODIVELAS,Caneças,CANEÇAS,38.812117,-9.198767,NC,305.0,2009-08-09T12:00,23.7,55,14.0,24.6,0.0,0.0,0.0,0.0,0,1013.8,978.9,1,0,0,3,0.56,1.33,15.3,19.7,336,339,39.6,28.6,21.7,21.3,18.6,0.09,0.155,0.203,0.252,1,3600.0,913.5,794.0,119.5,875.5,913.5,1207.0,887.0,771.0,116.0,875.5,887.0,1172.0,Eucalyptus L'Hér.; Tracheophyta; Magnoliopsida; Olea europaea L.; Pinus pinea L.; 
2009,2009-07-26,Lisboa,ODIVELAS,Famões,TRIGACHE - ODIVELAS (Bairro Casal do Trigache),38.7912413,-9.2108576,NC,134.0,2009-07-26T14:00,26.6,39,11.7,26.0,0.0,0.0,0.0,0.0,0,1018.4,1003.0,0,0,0,0,0.69,2.12,21.3,26.1,326,330,33.1,30.9,23.0,21.5,18.5,0.128,0.168,0.214,0.257,1,3600.0,936.6,825.5,111.1,915.0,936.6,1196.2,961.0,847.0,114.0,915.0,961.0,1227.4,Pinus pinea L.; Olea europaea L.; Tracheophyta; Magnoliopsida; 
2009,2009-08-02,Lisboa,Sintra,Terrugem,TERRUGEM - ALCOLOMBAL (TERRUGEM),38.8470295,-9.3781946,NC,178.0,2009-08-02T20:00,17.4,74,12.7,14.6,0.0,0.0,0.0,0.0,1,1018.2,997.2,30,0,0,100,0.08,0.52,25.0,35.1,353,354,45.0,20.5,22.0,20.9,18.7,0.09,0.13,0.178,0.235,0,258.96,0.0,0.0,0.0,0.0,0.0,0.0,25.0,9.0,16.0,86.2,25.0,80.2,Tracheophyta; Magnoliopsida; Pinus pinaster Aiton; Pinus pinea L.; Vitis vinifera L.; Pinales; Olea europaea L.; 
2009,2009-07-31,Lisboa,Sintra,Rio de Mouro,ASFAMIL - SERRA DAS LIGEIRAS (Asfamil),38.7723602,-9.3256835,NC,116.0,2009-07-31T03:00,17.4,82,14.3,16.1,0.0,0.0,0.0,0.0,0,1022.2,1008.4,0,0,0,0,0.03,0.36,18.4,28.8,349,351,28.1,18.9,22.1,21.1,18.5,0.125,0.169,0.215,0.26,0,0.0,0.0,0.0,0.0,0.0,0.0,0.0,0.0,0.0,0.0,0.0,0.0,0.0,Tracheophyta; Magnoliopsida; Pinales; 
2009,2009-03-18,Lisboa,Cadaval,Pêro Moniz,VEDRO - PERO MONIZ (Quinta do Vedro),39.242859,-9.1026628,NC,104.0,2009-03-18T17:00,22.8,29,3.7,19.6,0.0,0.0,0.0,0.0,0,1015.2,1003.1,0,0,0,0,0.31,1.98,11.8,16.8,121,121,33.8,22.0,16.8,14.3,13.1,0.159,0.265,0.315,0.245,1,3600.0,320.4,260.9,59.5,785.7,320.4,458.7,404.0,329.0,75.0,785.7,404.0,578.4,Magnoliopsida; Eucalyptus L'Hér.; Tracheophyta; Pinales
2009,2009-03-18,Lisboa,Torres Vedras,Dois Portos,Ribaldeira,39.0425197,-9.1948702,NC,105.0,2009-03-18T14:00,21.8,34,5.2,20.4,0.0,0.0,0.0,0.0,0,1016.2,1003.9,0,0,0,0,0.53,1.72,11.8,17.4,128,124,33.5,22.1,15.9,14.5,13.3,0.186,0.275,0.325,0.26,1,3600.0,784.8,689.0,95.8,948.4,784.8,1003.5,811.0,712.0,99.0,948.4,811.0,1037.0,Vitis vinifera L.; Eucalyptus L'Hér.; Magnoliopsida; Tracheophyta; 
2009,2009-08-06,Lisboa,Torres Vedras,Ponte do Rol,Casas Novas,39.0986708,-9.3155463,NC,63.0,2009-08-06T16:00,21.3,62,13.7,19.2,0.0,0.0,0.0,0.0,0,1020.4,1013.0,5,1,0,13,0.4,0.96,26.8,34.8,345,346,46.8,29.5,24.0,22.0,19.6,0.094,0.159,0.212,0.267,1,3600.0,620.7,498.2,122.5,749.3,620.7,884.0,684.0,549.0,135.0,749.3,684.0,974.2,Eucalyptus L'Hér.; Magnoliopsida; Vitis vinifera L.; Tracheophyta; 
2009,2009-06-19,Lisboa,Loures,Apelação,AV DO BRASIL ATRÁS DA CASA DA CULTURA (Apelação),38.815391000000005,-9.133030263713584,NC,100.0,2009-06-19T22:00,23.1,62,15.3,22.6,0.0,0.0,0.0,0.0,0,1018.2,1006.5,0,0,0,0,0.08,1.08,15.5,24.6,347,354,25.2,26.6,27.4,24.2,21.8,0.241,0.288,0.321,0.331,0,0.0,0.0,0.0,0.0,0.0,0.0,0.0,0.0,0.0,0.0,0.0,0.0,0.0,Tracheophyta; Olea europaea L.; Magnoliopsida; 
2009,2009-08-02,Lisboa,Torres Vedras,Ramalhal,Casal vale cruzes- Outeiro da Cabeça,39.1263894,-9.23288403371647,NC,71.0,2009-08-02T14:00,22.0,49,10.7,19.8,0.0,0.0,0.0,0.0,1,1019.6,1011.3,30,0,0,99,0.55,1.35,27.4,34.0,346,347,46.8,30.2,23.2,22.9,20.0,0.111,0.154,0.201,0.247,1,3600.0,881.6,735.5,146.1,826.8,881.6,1181.4,905.0,755.0,150.0,826.8,905.0,1212.8,Eucalyptus L'Hér.; Pinus pinaster Aiton; Magnoliopsida; Tracheophyta; Vitis vinifera L.; Pinales; Quercus suber L.; 
2009,2009-06-17,Lisboa,Vila Franca de Xira,Forte da Casa,TERRA DA PASTORINHA (Terra das Pintas),38.8727839,-9.0593162,NC,32.0,2009-06-17T15:00,32.1,42,17.7,34.5,0.0,0.0,0.0,0.0,0,1016.6,1013.0,17,0,0,56,0.69,2.77,14.2,18.0,353,357,31.0,32.9,25.0,20.5,16.6,0.313,0.311,0.343,0.376,1,3600.0,811.4,682.8,128.6,822.8,811.4,1099.7,858.0,722.0,136.0,822.8,858.0,1162.8,Tracheophyta; Magnoliopsida; Oryza sativa L.; 
2009,2009-03-17,Lisboa,Mafra,Santo Estêvão Das Galés,SANTA EULALIA (Casal de Santa Ana),38.8772945,-9.2440132,NC,170.0,2009-03-17T11:00,18.6,43,5.9,14.4,0.0,0.0,0.0,0.0,0,1019.5,999.4,0,0,0,0,0.4,1.22,24.9,34.7,95,96,47.5,17.9,14.9,14.0,12.9,0.209,0.281,0.326,0.264,1,3600.0,705.5,606.9,98.6,887.3,705.5,945.4,651.0,560.0,91.0,887.3,651.0,872.4,Magnoliopsida; Tracheophyta; Quercus suber L.; Pinus pinaster Aiton; Eucalyptus L'Hér.
2009,2009-06-22,Lisboa,Vila Franca de Xira,Póvoa de Santa Iria,AV PROF EGAS MONIZ (PÓVOA DE SANTA IRIA),38.8562721,-9.069732030166948,NC,17.0,2009-06-22T14:00,27.1,44,13.7,28.6,0.0,0.0,0.0,0.0,0,1018.8,1016.8,0,0,0,0,0.68,2.02,13.8,16.8,277,279,32.8,31.6,26.0,22.3,17.0,0.268,0.299,0.337,0.375,1,3600.0,942.6,831.6,111.0,904.6,942.6,1217.2,968.0,854.0,114.0,904.6,968.0,1250.0,Tracheophyta; Magnoliopsida; Oryza sativa L.; 
2009,2009-05-05,Lisboa,Vila Franca de Xira,Vialonga,EST DA ALFARROBEIRA (VIALONGA),38.8773451,-9.0685711,NC,55.0,2009-05-05T14:00,27.3,40,12.7,29.7,0.0,0.0,0.0,0.0,0,1020.3,1013.9,0,0,0,0,0.65,2.15,5.4,6.4,318,322,24.1,30.4,20.5,16.1,14.2,0.145,0.253,0.285,0.274,1,3600.0,902.7,793.2,109.4,911.5,902.7,1170.5,932.0,819.0,113.0,911.5,932.0,1208.6,Tracheophyta; Magnoliopsida; Pinus pinea L.; Olea europaea L.; Pinus pinaster Aiton; Pinales; 
2009,2009-05-28,Lisboa,Amadora,Mina,Bº STA FILOMENA (Mina),38.7634268,-9.2372148,NC,160.0,2009-05-28T00:00,18.2,61,10.5,15.5,0.0,0.0,0.0,0.0,0,1018.7,999.8,0,0,0,1,0.08,0.81,19.5,34.5,16,23,30.2,18.2,19.6,16.5,14.6,0.213,0.233,0.26,0.264,0,0.0,0.0,0.0,0.0,0.0,0.0,0.0,0.0,0.0,0.0,0.0,0.0,0.0,Tracheophyta; Magnoliopsida; Eucalyptus L'Hér.; 
2009,2009-08-02,Lisboa,Sintra,Casal de Cambra,CASAL SILVEIRA (Casal Alentejano),38.8005207,-9.2307698,NC,232.0,2009-08-02T11:00,20.3,50,9.4,18.9,0.0,0.0,0.0,0.0,0,1018.7,991.6,1,1,0,1,0.49,1.2,17.8,22.5,346,347,42.1,23.4,20.5,20.8,18.2,0.133,0.165,0.21,0.256,1,3600.0,868.4,745.3,123.1,868.2,868.4,1140.0,818.0,702.0,116.0,868.2,818.0,1073.8,Tracheophyta; Magnoliopsida; ; Eucalyptus L'Hér.
2009,2009-08-01,Lisboa,Sintra,Montelavar,Farelo,38.880677,-9.2996612,NC,105.0,2009-08-01T20:00,19.2,82,16.0,18.0,0.0,0.0,0.0,0.0,0,1018.5,1006.1,19,18,0,8,0.05,0.4,21.9,31.3,351,351,40.0,23.1,24.0,22.5,19.6,0.104,0.161,0.218,0.271,0,357.64,0.0,0.0,0.0,0.0,0.0,0.0,24.0,10.0,14.0,94.2,24.0,82.5,Tracheophyta; Magnoliopsida; Pinus pinaster Aiton; Eucalyptus L'Hér.; Vitis vinifera L.; 
2009,2009-03-18,Lisboa,Cadaval,Painho,CASAL CAVACO (Casal Cavaco e Casarão),39.2810866,-9.050226431576736,NC,112.0,2009-03-18T08:00,12.7,54,3.6,7.5,0.0,0.0,0.0,0.0,1,1018.6,1005.1,24,0,0,79,0.12,0.68,25.5,40.9,103,104,45.0,13.1,15.1,14.2,12.8,0.173,0.242,0.282,0.222,1,3078.98,170.2,96.0,74.1,397.6,154.6,333.7,101.0,57.0,44.0,361.2,101.0,198.1,Magnoliopsida; Tracheophyta; Vitis vinifera L.; Eucalyptus L'Hér.; 
2009,2009-03-18,Lisboa,Cadaval,Vermelha,VERMELHA,39.2702428,-9.106262,NC,73.0,2009-03-18T19:00,18.8,61,11.1,18.3,0.0,0.0,0.0,0.0,0,1015.2,1006.6,0,0,0,0,0.04,0.85,5.9,13.6,79,107,13.0,18.5,17.2,14.5,13.1,0.161,0.238,0.28,0.222,0,1011.34,0.0,0.0,0.0,0.0,0.0,0.0,31.0,17.0,14.0,159.2,31.0,87.5,Magnoliopsida; Eucalyptus L'Hér.; Vitis vinifera L.; Pinus pinaster Aiton; Tracheophyta; 
2009,2009-08-02,Lisboa,Alenquer,Abrigada,Estribeiro,39.1284666,-9.0359268,NC,86.0,2009-08-02T19:00,19.1,57,10.4,15.6,0.0,0.0,0.0,0.0,1,1018.2,1008.0,30,0,0,100,0.18,0.95,25.3,35.6,345,346,48.6,24.9,24.3,23.3,20.1,0.101,0.151,0.19,0.229,1,3600.0,95.8,58.6,37.1,438.6,95.8,177.5,165.0,101.0,64.0,438.6,165.0,305.8,Vitis vinifera L.; Tracheophyta; Magnoliopsida; Eucalyptus L'Hér.
2009,2009-08-08,Lisboa,Azambuja,Alcoentre,Espinheira,39.2078257,-8.9572359,NC,81.0,2009-08-08T02:00,17.1,89,15.3,15.3,0.0,0.0,0.0,0.0,3,1017.9,1008.3,100,92,0,82,0.02,0.21,24.8,38.0,334,335,40.0,18.9,23.9,23.3,20.5,0.083,0.151,0.186,0.227,0,0.0,0.0,0.0,0.0,0.0,0.0,0.0,0.0,0.0,0.0,0.0,0.0,0.0,Tracheophyta; Magnoliopsida; Pinales; Olea europaea L.
2009,2009-08-08,Lisboa,ODIVELAS,Odivelas,Bº DO GIRASSOL (ODIVELAS),38.7932694,-9.172982,NC,33.0,2009-08-08T13:00,23.2,55,13.8,22.3,0.0,0.0,0.0,0.0,0,1016.7,1012.8,9,8,0,5,0.57,1.27,26.7,34.2,328,330,44.6,27.4,22.4,22.1,19.7,0.121,0.162,0.208,0.255,1,3600.0,937.0,805.9,131.1,876.1,937.0,1223.8,936.0,805.0,131.0,876.1,936.0,1222.5,Tracheophyta; Magnoliopsida
2009,2009-08-02,Lisboa,Sintra,Rio de Mouro,Varge Mondar,38.7580496,-9.3398953,NC,135.0,2009-08-02T10:00,19.4,59,11.2,17.3,0.0,0.0,0.0,0.0,0,1019.3,1003.4,5,6,0,0,0.36,0.93,19.4,24.0,350,352,37.1,21.9,20.7,21.0,18.5,0.138,0.168,0.214,0.26,1,3600.0,681.1,550.0,131.2,731.6,681.1,998.3,618.0,499.0,119.0,731.6,618.0,905.8,Tracheophyta; Magnoliopsida; Pinales; 
2009,2009-08-11,Lisboa,Cadaval,Cadaval,PEGOS (CADAVAL),39.242859,-9.1026628,NC,104.0,2009-08-11T10:00,30.0,38,14.1,30.1,0.0,0.0,0.0,0.0,0,1016.2,1004.4,0,0,0,0,0.51,2.63,11.4,14.6,72,74,28.8,31.3,24.6,22.8,20.2,0.082,0.151,0.19,0.233,1,3600.0,706.8,598.5,108.2,814.2,706.8,979.0,640.0,542.0,98.0,814.2,640.0,886.5,Magnoliopsida; Eucalyptus L'Hér.; Tracheophyta; Pinales
2009,2009-05-30,Lisboa,Cadaval,Alguber,Corrieira,39.2767815,-9.0216348,NC,106.0,2009-05-30T20:00,24.7,45,11.9,23.9,0.0,0.0,0.0,0.0,0,1010.9,998.7,0,0,0,0,0.1,1.71,9.7,18.3,297,313,24.8,27.1,25.3,18.4,15.1,0.097,0.191,0.244,0.25,0,1420.12,0.0,0.0,0.0,0.0,0.0,0.0,36.0,19.0,17.0,167.9,36.0,91.7,Magnoliopsida; Eucalyptus L'Hér.; Tracheophyta; 
2009,2009-08-03,Lisboa,Azambuja,Aveiras de Baixo,MATA NACIONAL DAS VIRTUDES (MATA DAS VIRTUDES),39.1107569,-8.8686417,NC,34.0,2009-08-03T03:00,15.8,76,11.5,13.8,0.0,0.0,0.0,0.0,0,1017.3,1013.2,2,0,0,7,0.04,0.44,17.4,30.9,342,345,31.0,17.9,22.8,23.2,20.1,0.131,0.187,0.221,0.256,0,0.0,0.0,0.0,0.0,0.0,0.0,0.0,0.0,0.0,0.0,0.0,0.0,0.0,Tracheophyta; Magnoliopsida; Pinus pinea L.; Pinus pinaster Aiton; Quercus suber L.; Olea europaea L.
2009,2009-07-31,Lisboa,Sintra,Pêro Pinheiro,CSL DOS GOSMOS (Casal dos Gosmos),38.83977325,-9.319917216660787,NC,145.0,2009-07-31T00:00,17.7,80,14.1,16.0,0.0,0.0,0.0,0.0,0,1023.4,1006.1,0,0,0,0,0.04,0.41,20.6,31.3,344,345,34.2,19.5,22.4,21.0,18.4,0.125,0.169,0.215,0.26,0,0.0,0.0,0.0,0.0,0.0,0.0,0.0,0.0,0.0,0.0,0.0,0.0,0.0,Tracheophyta; Magnoliopsida; Pinus pinaster Aiton; Eucalyptus L'Hér.; Vitis vinifera L.; 
2009,2009-06-30,Lisboa,Loures,Apelação,APELAÇÃO,38.815391000000005,-9.133030263713584,NC,100.0,2009-06-30T18:00,23.6,74,18.7,24.6,0.0,0.0,0.0,0.0,0,1020.1,1008.4,3,3,0,0,0.24,0.75,15.1,20.5,270,270,24.8,26.9,25.4,24.1,22.0,0.293,0.284,0.317,0.33,1,3600.0,298.3,220.3,78.0,593.9,298.3,490.9,371.0,274.0,97.0,593.9,371.0,610.5,Tracheophyta; Olea europaea L.; Magnoliopsida; 
