2009,2009-03-12,Lisboa,Alenquer,Aldeia Galega da Merceana,Paiol,39.0949154,-9.1349408,NC,135.0,2009-03-12T17:00,22.9,37,7.3,21.4,0.0,0.0,0.0,0.0,0,1019.1,1003.4,0,0,0,0,0.25,1.77,5.9,6.1,313,315,13.0,21.6,15.7,13.0,12.8,0.241,0.302,0.327,0.248,1,3600.0,298.6,242.2,56.4,774.8,298.6,433.2,381.0,309.0,72.0,774.8,381.0,552.7,Vitis vinifera L.; Magnoliopsida; Tracheophyta
2009,2009-07-05,Lisboa,Alenquer,Alenquer (santo Estêvão),ESTRADA DA CABREIRA PARA REFUGIDOS (Estrada dos Praganceiros),39.0490112,-9.0145622,NC,160.0,2009-07-05T15:00,22.9,52,12.4,21.5,0.0,0.0,0.0,0.0,1,1017.7,999.1,32,0,4,100,0.45,1.35,18.1,22.9,316,316,40.0,28.6,23.5,21.6,17.1,0.185,0.254,0.301,0.328,1,3600.0,617.4,250.0,367.4,300.7,617.4,1100.0,652.0,264.0,388.0,300.7,652.0,1161.6,Tracheophyta; Magnoliopsida; Olea europaea L.; Vitis vinifera L.
2009,2009-10-16,Lisboa,Cascais,Cascais,R SAO LUIS - CASCAIS (CASCAIS),38.71502635,-9.456762952650216,NC,68.0,2009-10-16T04:00,18.1,72,12.9,17.7,0.0,0.0,0.0,0.0,0,1014.5,1006.4,0,0,0,0,0.02,0.58,9.1,18.0,56,70,15.5,16.6,20.9,21.5,21.3,0.115,0.148,0.156,0.226,0,0.0,0.0,0.0,0.0,0.0,0.0,0.0,0.0,0.0,0.0,0.0,0.0,0.0,Pinus pinea L.; Tracheophyta; Magnoliopsida; Pinus pinaster Aiton
2009,2009-10-16,Lisboa,Mafra,Milharado,Casal da Mioleira,38.9352275,-9.2012529,NC,170.0,2009-10-16T20:00,20.8,40,6.8,18.5,0.0,0.0,0.0,0.0,0,1016.7,996.8,6,0,0,21,0.08,1.47,10.1,20.7,35,50,15.1,20.6,22.0,21.6,21.8,0.117,0.174,0.181,0.243,0,0.0,0.0,0.0,0.0,0.0,0.0,0.0,0.0,0.0,0.0,0.0,0.0,0.0,Tracheophyta
2009,2009-07-05,Lisboa,ODIVELAS,Odivelas,JARDIM DA MUSICA (ODIVELAS),38.7932694,-9.172982,NC,33.0,2009-07-05T16:00,22.2,59,13.9,20.2,0.0,0.0,0.0,0.0,1,1017.8,1013.9,34,6,0,94,0.36,1.1,22.3,27.7,322,322,39.2,26.3,23.4,21.6,18.0,0.164,0.184,0.228,0.259,1,3600.0,483.0,204.0,279.0,288.2,483.0,936.4,528.0,223.0,305.0,288.2,528.0,1023.7,Tracheophyta; Magnoliopsida
2009,2009-07-02,Lisboa,Sintra,Agualva,ALTO COLARIDE / JT ESTAÇÃO CACEM (Alto),38.7740235,-9.2935542,Desconhecida,156.0,2009-07-02T21:00,19.2,78,15.4,18.6,0.0,0.0,0.0,0.0,0,1020.1,1001.7,0,0,0,0,0.04,0.48,16.9,24.2,333,335,28.4,21.3,22.6,20.2,16.8,0.209,0.192,0.233,0.263,0,0.0,0.0,0.0,0.0,0.0,0.0,0.0,0.0,0.0,0.0,0.0,0.0,0.0,Tracheophyta; Magnoliopsida; 
2009,2009-07-13,Lisboa,Lisboa,Alcântara,TRASEIRAS DO CAMPO ATLETICO (Parque de estacionamento Reitoria (Traseiras)),38.71105735,-9.1828759210045,NC,79.0,2009-07-13T15:00,22.7,56,13.5,21.5,0.0,0.0,0.0,0.0,0,1016.6,1007.4,3,3,0,0,0.52,1.21,25.6,33.0,322,324,43.6,28.0,23.0,21.0,18.1,0.15,0.176,0.22,0.27,1,3600.0,824.8,712.1,112.7,858.0,824.8,1098.5,871.0,752.0,119.0,858.0,871.0,1160.0,Tracheophyta; Magnoliopsida; Quercus L.; Pinales; Eucalyptus L'Hér.
2009,2009-07-09,Lisboa,Oeiras,Barcarena,QUINTA DA NOSSA SENHORA DA CONCEICAO (Quinta da Fonte),38.7328998,-9.2807052,NC,44.0,2009-07-09T17:00,22.2,63,14.9,20.0,0.0,0.0,0.0,0.0,0,1018.0,1012.8,0,0,0,0,0.37,0.98,27.4,36.0,335,337,45.4,25.8,22.5,20.8,18.0,0.166,0.194,0.232,0.271,1,3600.0,527.1,443.5,83.6,807.0,527.1,727.1,605.0,509.0,96.0,807.0,605.0,834.6,Tracheophyta; Magnoliopsida; Pinus pinea L.; Vitis vinifera L.; Eucalyptus L'Hér.; Olea europaea L.; Pinus pinaster Aiton
2009,2009-07-07,Lisboa,Alenquer,Ventosa,Vila Chã,39.105019,-9.0715327,NC,74.0,2009-07-07T14:00,23.3,47,11.4,21.8,0.0,0.0,0.0,0.0,0,1016.2,1007.6,0,0,0,0,0.61,1.51,26.0,34.2,336,338,52.6,32.7,23.9,22.8,18.6,0.083,0.159,0.211,0.24,1,3600.0,937.6,819.7,117.9,894.6,937.6,1212.3,962.0,841.0,121.0,894.6,962.0,1243.8,Vitis vinifera L.; Eucalyptus L'Hér.; Tracheophyta; Magnoliopsida; 
2009,2009-03-13,Lisboa,Azambuja,Maçussa,Maçussa,39.19444745,-8.868368062682613,NC,55.0,2009-03-13T17:00,22.8,43,9.5,21.6,0.0,0.0,0.0,0.0,0,1019.4,1013.0,0,0,0,0,0.26,1.59,7.6,9.7,335,338,15.1,22.1,16.3,13.5,13.1,0.218,0.287,0.314,0.235,1,3600.0,293.0,235.8,57.2,753.6,293.0,433.5,374.0,301.0,73.0,753.6,374.0,553.2,Magnoliopsida; Tracheophyta; Vitis vinifera L.; Pinus pinea L.; Eucalyptus L'Hér.
2009,2009-07-08,Lisboa,Loures,Bucelas,SERRA DE ALROTA (Bairro Novo do Casal da Serra),38.9016248,-9.118728,NC,89.0,2009-07-08T12:00,25.9,46,13.4,27.2,0.0,0.0,0.0,0.0,0,1015.9,1005.6,0,0,0,0,0.64,1.8,12.6,16.2,340,343,34.9,30.1,22.3,21.6,18.0,0.107,0.18,0.234,0.268,1,3600.0,957.2,834.0,123.2,880.6,957.2,1253.1,932.0,812.0,120.0,880.6,932.0,1220.1,Magnoliopsida; Tracheophyta; Olea europaea L.; Pinus pinea L.; Pinus pinaster Aiton; Eucalyptus L'Hér.; Vitis vinifera L.; 
2009,2009-07-11,Lisboa,Torres Vedras,Ramalhal,ALTO AMEAL (Alto da Espinheira),39.1263894,-9.23288403371647,NC,71.0,2009-07-11T18:00,21.1,62,13.5,19.0,0.0,0.0,0.0,0.0,0,1019.1,1010.7,0,0,0,0,0.27,0.96,21.9,27.4,335,335,40.3,29.5,25.0,22.3,18.6,0.083,0.16,0.214,0.25,1,3600.0,322.9,255.4,67.5,691.3,322.9,489.0,402.0,318.0,84.0,691.3,402.0,608.7,Eucalyptus L'Hér.; Pinus pinaster Aiton; Magnoliopsida; Tracheophyta; Vitis vinifera L.; Pinales; Quercus suber L.; 
2009,2009-05-03,Lisboa,Oeiras,Barcarena,ESTRADA DE LECEIA (BARCARENA),38.7319947,-9.2789232,NC,55.0,2009-05-03T12:00,23.3,35,6.9,22.1,0.0,0.0,0.0,0.0,1,1019.1,1012.7,22,0,0,73,0.63,1.87,16.9,24.0,61,66,31.0,23.0,17.8,15.5,14.6,0.267,0.291,0.284,0.277,1,3600.0,966.3,840.1,126.2,920.3,966.3,1229.2,942.0,819.0,123.0,920.3,942.0,1198.2,Tracheophyta; Magnoliopsida; Pinus pinea L.; Vitis vinifera L.; Eucalyptus L'Hér.; Olea europaea L.; Pinus pinaster Aiton
2009,2009-03-14,Lisboa,Sintra,Almargem do Bispo,ALMARGEM DO BISPO,38.8640076,-9.3371894,NC,136.0,2009-03-14T13:00,18.7,57,10.0,17.2,0.0,0.0,0.0,0.0,0,1021.5,1005.4,13,0,0,42,0.44,0.92,18.5,24.5,352,357,28.1,20.4,14.9,13.9,13.3,0.238,0.299,0.34,0.283,1,3600.0,802.1,700.7,101.4,933.0,802.1,1039.8,799.0,698.0,101.0,933.0,799.0,1035.7,Tracheophyta; Magnoliopsida; Pinus pinaster Aiton; Eucalyptus L'Hér.; Vitis vinifera L.; 
2009,2009-07-18,Lisboa,Loures,Lousa,PONTE LOUSA - CASAL DAS OLIVEIRAS (Casalinho da Ponte),38.8898108,-9.2059575,NC,167.0,2009-07-18T11:00,25.1,33,7.8,22.6,0.0,0.0,0.0,0.0,0,1023.0,1003.7,0,0,0,0,0.62,2.14,22.9,28.9,16,19,42.8,28.1,22.0,21.7,18.3,0.09,0.163,0.216,0.255,1,3600.0,888.1,772.7,115.4,879.1,888.1,1163.9,839.0,730.0,109.0,879.1,839.0,1099.6,Tracheophyta; Magnoliopsida; Pinus pinaster Aiton; Eucalyptus L'Hér.; Pinales; 
2009,2009-10-17,Lisboa,Sintra,Sintra (santa Maria E São Miguel),LOUREL - JNT MODELO (Lourel),38.8103492,-9.377955008632217,NC,174.0,2009-10-17T16:00,20.4,52,10.1,19.0,0.0,0.0,0.0,0.0,0,1015.7,995.4,16,0,0,53,0.26,1.16,10.0,11.7,308,313,20.9,26.1,21.1,20.7,20.6,0.098,0.146,0.156,0.225,1,3600.0,328.5,266.2,62.3,772.1,328.5,475.1,401.0,325.0,76.0,772.1,401.0,580.0,Tracheophyta; Magnoliopsida
2009,2009-07-14,Lisboa,Loures,São João da Talha,RUA ALMADA NEGREIROS - SAO JOAO DA TALHA (SÃO JOÃO DA TALHA),38.8260487,-9.09807838407007,NC,77.0,2009-07-14T19:00,20.6,58,12.0,18.4,0.0,0.0,0.0,0.0,0,1018.1,1009.0,0,0,0,0,0.18,1.02,18.8,25.7,317,318,38.2,24.9,24.1,22.9,21.2,0.238,0.279,0.312,0.329,1,3600.0,131.6,92.7,38.9,531.2,131.6,231.1,203.0,143.0,60.0,531.2,203.0,356.3,Tracheophyta; Magnoliopsida; Olea europaea L.; 
2009,2009-11-05,Lisboa,Sintra,Terrugem,Armes,38.849444,-9.3494961,NC,114.0,2009-11-05T13:00,16.6,57,7.9,11.6,0.0,0.0,0.0,0.0,3,1020.4,1006.8,100,61,77,99,0.23,0.82,30.1,39.1,326,326,49.7,17.8,17.6,19.5,20.6,0.205,0.221,0.189,0.25,1,2004.35,278.0,72.0,206.1,126.8,278.0,789.9,282.0,73.0,209.0,126.8,282.0,801.2,Tracheophyta; Magnoliopsida; Pinus pinaster Aiton; Pinus pinea L.; Vitis vinifera L.; Pinales; Olea europaea L.; 
2009,2009-07-16,Lisboa,Loures,Sacavém,PARQUE TEJO (Moscavide - Parque das Naçães),38.7943867,-9.108563857720288,NC,33.0,2009-07-16T11:00,24.2,55,14.6,25.4,0.0,0.0,0.0,0.0,0,1022.0,1018.1,0,0,0,0,0.54,1.36,12.5,15.5,314,318,30.2,27.4,24.4,23.8,22.2,0.238,0.278,0.311,0.329,1,3600.0,870.9,749.2,121.7,849.5,870.9,1167.6,823.0,708.0,115.0,849.5,823.0,1103.4,Tracheophyta; Olea europaea L.; 
2009,2009-05-03,Lisboa,Sintra,Queluz,QUELUZ,38.75481445,-9.25728260154883,NC,123.0,2009-05-03T18:00,22.5,44,9.7,20.0,0.0,0.0,0.0,0.0,1,1017.4,1003.1,26,0,0,88,0.27,1.52,16.3,25.7,355,6,22.0,22.4,18.9,15.1,14.1,0.237,0.28,0.282,0.269,1,3600.0,240.5,174.8,65.7,621.6,240.5,378.5,322.0,234.0,88.0,621.6,322.0,506.8,Pinus pinaster Aiton; Tracheophyta; Pinales; Eucalyptus L'Hér.; Magnoliopsida; 
2009,2009-07-15,Lisboa,Vila Franca de Xira,Póvoa de Santa Iria,A-1 N/S KM 10 (A1-N-S Km 10),38.8562721,-9.069732030166948,NC,17.0,2009-07-15T22:00,19.0,71,13.7,18.1,0.0,0.0,0.0,0.0,0,1019.9,1017.9,0,0,0,0,0.04,0.63,13.8,24.0,332,334,31.0,22.6,24.1,21.8,18.5,0.255,0.281,0.32,0.372,0,0.0,0.0,0.0,0.0,0.0,0.0,0.0,0.0,0.0,0.0,0.0,0.0,0.0,Tracheophyta; Magnoliopsida; Oryza sativa L.; 
2009,2009-07-13,Lisboa,Amadora,Brandoa,JNT QTA DA LOJA (BRANDOA),38.7646287,-9.215759,NC,103.0,2009-07-13T22:00,18.5,74,13.7,17.1,0.0,0.0,0.0,0.0,0,1018.6,1006.4,1,1,0,0,0.05,0.56,17.9,26.9,330,330,31.3,20.8,23.1,21.0,18.0,0.126,0.177,0.222,0.258,0,0.0,0.0,0.0,0.0,0.0,0.0,0.0,0.0,0.0,0.0,0.0,0.0,0.0,Tracheophyta
2009,2009-07-18,Lisboa,Vila Franca de Xira,Vialonga,QTA DA FLAMENGA (Quinta da Flamenga),38.8726445,-9.0865479,NC,61.0,2009-07-18T23:00,19.1,76,14.8,17.7,0.0,0.0,0.0,0.0,0,1020.0,1012.8,0,0,0,0,0.05,0.53,20.2,35.3,358,1,38.2,21.6,24.7,22.3,18.8,0.099,0.173,0.226,0.266,0,0.0,0.0,0.0,0.0,0.0,0.0,0.0,0.0,0.0,0.0,0.0,0.0,0.0,Tracheophyta; Magnoliopsida; Pinus pinea L.; Olea europaea L.; Pinus pinaster Aiton; Pinales; 
2009,2009-03-14,Lisboa,Sintra,Terrugem,BOMBACEAS (TERRUGEM),38.8470295,-9.3781946,NC,178.0,2009-03-14T15:00,16.8,65,10.1,14.8,0.0,0.0,0.0,0.0,0,1020.8,999.7,5,0,0,17,0.35,0.67,19.2,25.2,355,358,31.3,20.0,15.4,13.7,13.1,0.19,0.244,0.282,0.249,1,3600.0,648.8,545.8,103.0,873.9,648.8,864.5,699.0,588.0,111.0,873.9,699.0,931.4,Tracheophyta; Magnoliopsida; Pinus pinaster Aiton; Pinus pinea L.; Vitis vinifera L.; Pinales; Olea europaea L.; 
2009,2009-10-17,Lisboa,Arruda dos Vinhos,Arruda dos Vinhos,Lapão,39.024983000000006,-9.09001266333455,NC,222.0,2009-10-17T17:00,23.2,27,3.2,20.3,0.0,0.0,0.0,0.0,0,1015.3,989.7,13,0,0,44,0.19,2.08,8.9,13.0,339,341,18.7,26.2,21.1,21.4,21.9,0.097,0.172,0.173,0.23,1,3600.0,137.3,99.9,37.4,609.6,137.3,225.9,213.0,155.0,58.0,609.6,213.0,350.4,Vitis vinifera L.; Tracheophyta; Magnoliopsida
2009,2009-05-04,Lisboa,Vila Franca de Xira,Vila Franca de Xira,R DA REPUBLICA - VILA FRANCA DE XIRA (VILA FRANCA DE XIRA),38.9561945,-8.98572979001366,NC,5.0,2009-05-04T16:00,27.6,33,9.8,26.6,0.0,0.0,0.0,0.0,0,1018.1,1017.5,0,0,0,0,0.54,2.49,12.4,15.7,324,328,35.6,29.9,20.8,16.0,14.5,0.204,0.315,0.353,0.334,1,3600.0,633.2,542.4,90.8,852.1,633.2,856.6,704.0,603.0,101.0,852.1,704.0,952.3,Tracheophyta; ; Magnoliopsida; Olea europaea L.
2009,2009-07-16,Lisboa,Torres Vedras,Torres Vedras (são Pedro E São Tiago),Catefica,39.09299855,-9.25866085,NC,33.0,2009-07-16T23:00,17.9,84,15.2,16.1,0.0,0.0,0.0,0.0,1,1025.6,1021.6,38,42,0,0,0.03,0.32,24.3,33.4,353,353,40.7,21.0,24.6,22.0,18.7,0.089,0.165,0.224,0.27,0,0.0,0.0,0.0,0.0,0.0,0.0,0.0,0.0,0.0,0.0,0.0,0.0,0.0,Tracheophyta; Magnoliopsida
2009,2009-10-17,Lisboa,Alenquer,Vila Verde dos Francos,VILA VERDE DOS FRANCOS,39.15514575,-9.115868171322164,NC,179.0,2009-10-17T17:00,23.2,30,4.8,20.2,0.0,0.0,0.0,0.0,0,1015.6,994.9,14,0,0,48,0.21,1.98,11.6,15.6,334,337,23.8,26.0,21.2,21.3,21.8,0.099,0.181,0.172,0.225,1,3600.0,137.9,98.6,39.3,602.6,137.9,225.5,214.0,153.0,61.0,602.6,214.0,349.9,Tracheophyta; Magnoliopsida; Vitis vinifera L.; Olea europaea L.
2009,2009-10-19,Lisboa,Loures,Sacavém,SACAVEM-R.SALVADOR ALLENDE JTO TUNEL A-1 (SACAVÉM),38.7943867,-9.108563857720288,NC,33.0,2009-10-19T18:00,18.2,70,12.6,17.1,0.0,0.0,0.0,0.0,3,1010.8,1006.9,100,89,29,93,0.06,0.63,13.0,18.4,268,269,28.4,21.1,20.9,21.6,22.0,0.245,0.28,0.293,0.323,0,0.0,0.0,0.0,0.0,0.0,0.0,0.0,22.0,2.0,20.0,17.4,22.0,99.4,Tracheophyta; Olea europaea L.; 
2009,2009-07-19,Lisboa,Cascais,Parede,TRAJOUCE JT EMPRESA DE CONTRUÇAO CIVIL (TRAJOUCE),38.69741555,-9.331115878034677,NC,31.0,2009-07-19T01:00,19.0,82,15.9,17.2,0.0,0.0,0.0,0.0,0,1019.6,1015.9,0,0,0,0,0.04,0.4,25.9,40.8,2,5,41.8,20.4,22.4,21.0,18.6,0.142,0.184,0.226,0.27,0,0.0,0.0,0.0,0.0,0.0,0.0,0.0,0.0,0.0,0.0,0.0,0.0,0.0,Magnoliopsida; Tracheophyta; Pinus pinea L.; Pinus pinaster Aiton; 
2009,2009-03-14,Lisboa,Arruda dos Vinhos,Santiago dos Velhos,CONTRADINHA (Casal das Contradinhas),38.9337586,-9.1148476,NC,195.0,2009-03-14T17:00,19.0,52,8.9,16.3,0.0,0.0,0.0,0.0,0,1020.0,997.1,1,0,0,2,0.26,1.06,16.6,24.2,342,345,31.7,19.6,15.4,12.9,12.2,0.235,0.303,0.336,0.275,1,3600.0,305.4,245.6,59.8,766.2,305.4,443.6,388.0,312.0,76.0,766.2,388.0,563.7,Tracheophyta; Magnoliopsida; Vitis vinifera L.
2009,2009-07-18,Lisboa,Cascais,São Domingos de Rana,CARRASCAL DE MANIQUE - CASAL DOS CLERIGOS (Carrascal do Alvide),38.7015666,-9.3417434,NC,71.0,2009-07-18T19:00,21.7,55,12.1,18.1,0.0,0.0,0.0,0.0,0,1019.7,1011.4,0,0,0,0,0.23,1.18,29.3,44.0,355,358,49.7,24.3,22.6,20.7,18.3,0.142,0.184,0.226,0.27,1,3600.0,131.5,95.0,36.6,556.9,131.5,225.8,205.0,148.0,57.0,556.9,205.0,351.9,Tracheophyta; Magnoliopsida
2009,2009-07-25,Lisboa,Vila Franca de Xira,Castanheira do Ribatejo,QUINTAS (Quinta Açoreana),38.9889021,-8.9653311,NC,7.0,2009-07-25T02:00,17.1,84,14.4,16.2,0.0,0.0,0.0,0.0,0,1023.3,1022.5,0,0,0,0,0.02,0.32,16.5,29.3,350,354,28.8,19.8,24.6,23.3,19.3,0.174,0.249,0.289,0.325,0,0.0,0.0,0.0,0.0,0.0,0.0,0.0,0.0,0.0,0.0,0.0,0.0,0.0,Pinus pinea L.; Magnoliopsida; Tracheophyta; Vitis vinifera L.; Eucalyptus L'Hér.; Olea europaea L.; Pinus pinaster Aiton; 
2009,2009-03-15,Lisboa,ODIVELAS,Caneças,Pinhal Verde,38.8165498,-9.221342021551935,NC,230.0,2009-03-15T11:00,17.7,65,11.1,17.4,0.0,0.0,0.0,0.0,0,1020.5,993.4,0,0,0,0,0.35,0.71,7.9,10.1,24,27,20.5,17.1,13.7,13.3,12.5,0.262,0.301,0.326,0.267,1,3600.0,693.5,594.8,98.8,881.1,693.5,934.0,639.0,548.0,91.0,881.1,639.0,860.6,Eucalyptus L'Hér.; Tracheophyta; Magnoliopsida; Olea europaea L.; Pinus pinea L.; 
2009,2009-07-24,Lisboa,Cascais,Estoril,TRASEIRAS PISCINAS ALAPRAIA (ESTORIL),38.7080747,-9.3985422,NC,32.0,2009-07-24T18:00,22.4,66,15.7,21.0,0.0,0.0,0.0,0.0,0,1023.3,1019.5,0,0,0,0,0.26,0.93,23.2,30.6,334,336,39.2,26.0,23.6,21.5,18.8,0.15,0.179,0.222,0.269,1,3600.0,301.6,237.4,64.1,677.7,301.6,464.4,381.0,300.0,81.0,677.7,381.0,586.7,Magnoliopsida; Tracheophyta; Pinus pinaster Aiton
2009,2009-07-23,Lisboa,Mafra,Malveira,CSL DA RIBEIRA - CACHOEIRA (Casais das Ribeiradas),38.9315563,-9.2523258,NC,239.0,2009-07-23T16:00,21.1,63,13.8,21.1,0.0,0.0,0.0,0.0,0,1017.6,989.8,9,10,0,0,0.43,0.92,14.8,18.5,293,294,32.4,29.9,23.6,21.5,18.2,0.111,0.165,0.224,0.273,1,3600.0,657.8,533.7,124.1,770.5,657.8,918.0,721.0,585.0,136.0,770.5,721.0,1006.2,Tracheophyta; Eucalyptus L'Hér.; Pinus pinaster Aiton; Magnoliopsida
2009,2009-07-20,Lisboa,Lourinhã,Reguengo Grande,REGUENGO GRANDE,39.2837447,-9.2101967,NC,173.0,2009-07-20T22:00,18.7,78,14.7,18.3,0.0,0.0,0.0,0.0,0,1015.5,995.2,1,1,0,0,0.03,0.48,13.9,22.5,350,354,20.9,21.1,23.5,20.2,17.5,0.047,0.07,0.116,0.17,0,0.0,0.0,0.0,0.0,0.0,0.0,0.0,0.0,0.0,0.0,0.0,0.0,0.0,Vitis vinifera L.; Tracheophyta; Magnoliopsida; Eucalyptus L'Hér.; Quercus L.; 
2009,2009-07-25,Lisboa,Azambuja,Manique do Intendente,POVOA DE MANIQUE (Póvoa do Manique),39.2206149,-8.8945881,NC,53.0,2009-07-25T18:00,24.3,45,11.6,21.3,0.0,0.0,0.0,0.0,0,1021.2,1015.0,0,0,0,0,0.35,1.67,24.1,32.6,340,342,44.6,30.9,26.0,23.4,19.7,0.097,0.152,0.19,0.225,1,3600.0,311.0,247.8,63.1,719.3,311.0,456.8,394.0,314.0,80.0,719.3,394.0,578.7,Magnoliopsida; Olea europaea L.; Tracheophyta; Vitis vinifera L.; Pinus pinea L.; Eucalyptus L'Hér.
2009,2009-07-19,Lisboa,Oeiras,Barcarena,EN-250 BARCARENA (BARCARENA),38.7319947,-9.2789232,NC,55.0,2009-07-19T12:00,26.8,46,14.2,28.8,0.0,0.0,0.0,0.0,0,1017.9,1011.5,1,0,0,4,0.64,1.91,10.4,13.3,360,13,23.4,28.7,22.2,20.8,18.4,0.141,0.184,0.226,0.27,1,3600.0,945.3,810.5,134.7,863.9,945.3,1242.6,919.0,788.0,131.0,863.9,919.0,1208.0,Tracheophyta; Magnoliopsida; Pinus pinea L.; Vitis vinifera L.; Eucalyptus L'Hér.; Olea europaea L.; Pinus pinaster Aiton
2009,2009-07-26,Lisboa,Torres Vedras,Torres Vedras (são Pedro E São Tiago),Ordasqueira,39.09299855,-9.25866085,NC,33.0,2009-07-26T19:00,19.7,68,13.6,17.7,0.0,0.0,0.0,0.0,0,1018.5,1014.6,0,0,0,0,0.15,0.74,22.2,29.7,340,341,38.5,26.2,24.6,22.3,19.3,0.094,0.162,0.218,0.268,1,3600.0,121.4,86.1,35.3,552.7,121.4,206.6,196.0,139.0,57.0,552.7,196.0,333.5,Tracheophyta; Magnoliopsida
2009,2009-07-25,Lisboa,Loures,Bucelas,BOIÇAO DE CIMA (BUCELAS),38.9049103,-9.090637350000003,NC,135.0,2009-07-25T17:00,26.0,39,10.9,23.3,0.0,0.0,0.0,0.0,0,1020.8,1005.2,0,0,0,0,0.48,2.07,22.1,29.9,336,338,43.9,31.7,24.8,22.3,18.8,0.107,0.17,0.222,0.265,1,3600.0,506.1,423.9,82.2,802.5,506.1,700.3,585.0,490.0,95.0,802.5,585.0,809.5,Magnoliopsida; Tracheophyta; Olea europaea L.; Pinus pinea L.; Pinus pinaster Aiton; Eucalyptus L'Hér.; Vitis vinifera L.; 
2009,2009-07-25,Lisboa,Cascais,Alcabideche,Bº ALGORDO - BICESSE (BICESSE),38.729252,-9.3840971,NC,109.0,2009-07-25T19:00,19.9,72,14.6,17.7,0.0,0.0,0.0,0.0,0,1021.2,1008.3,0,0,0,0,0.15,0.66,25.6,35.4,350,351,44.3,24.4,23.4,21.4,18.7,0.087,0.134,0.182,0.236,1,3600.0,123.3,88.0,35.3,562.0,123.3,207.6,199.0,142.0,57.0,562.0,199.0,335.0,Tracheophyta; Eucalyptus L'Hér.; Magnoliopsida; Pinus pinea L.; Pinus pinaster Aiton; Pinales; Vitis vinifera L.; 
2009,2009-05-20,Lisboa,Loures,Santa Iria de Azoia,STª IRIA AZOIA (Santa Iria),38.8269655,-9.0943984,NC,63.0,2009-05-20T16:00,23.1,50,12.2,22.4,0.0,0.0,0.0,0.0,0,1012.5,1005.2,20,0,0,65,0.47,1.41,15.6,20.3,326,330,31.0,24.0,20.5,19.4,18.5,0.267,0.311,0.333,0.332,1,3600.0,648.4,526.2,122.3,787.4,648.4,892.8,716.0,581.0,135.0,787.4,716.0,985.8,Tracheophyta; Magnoliopsida; Olea europaea L.; 
2009,2009-05-20,Lisboa,Torres Vedras,Torres Vedras (são Pedro E São Tiago),FORTE S. VICENTE (Forte de São Vicente),39.09299855,-9.25866085,NC,33.0,2009-05-20T18:00,18.3,68,12.2,15.5,0.0,0.0,0.0,0.0,1,1013.4,1009.5,24,0,0,79,0.21,0.68,23.7,32.0,347,348,38.9,22.5,19.1,17.0,15.1,0.13,0.219,0.271,0.278,1,3600.0,267.5,191.3,76.2,591.1,267.5,432.3,344.0,246.0,98.0,591.1,344.0,556.0,Tracheophyta; Magnoliopsida
2009,2009-07-26,Lisboa,Sintra,Algueirão-Mem Martins,CAVALEIRA (Casal da Cavaleira),38.8027696,-9.3451488,NC,178.0,2009-07-26T13:00,24.1,49,12.8,25.6,0.0,0.0,0.0,0.0,0,1017.8,997.2,0,0,0,0,0.64,1.52,12.2,14.9,326,328,30.2,28.0,21.8,20.7,17.9,0.133,0.171,0.217,0.26,1,3600.0,977.7,858.5,119.2,912.2,977.7,1247.8,976.0,857.0,119.0,912.2,976.0,1245.7,Tracheophyta; Magnoliopsida; Pinales; 
2009,2009-03-14,Lisboa,Torres Vedras,Maxial,MAXIAL,39.14306075,-9.170464410219726,NC,78.0,2009-03-14T17:00,17.5,60,9.7,14.3,0.0,0.0,0.0,0.0,0,1020.9,1011.6,1,0,0,3,0.23,0.79,21.3,28.5,355,358,33.5,19.8,16.1,13.9,13.3,0.227,0.295,0.33,0.258,1,3600.0,302.3,237.0,65.3,741.0,302.3,442.7,384.0,301.0,83.0,741.0,384.0,562.3,Eucalyptus L'Hér.; Tracheophyta; Magnoliopsida; Vitis vinifera L.; Pinales; Pinus pinaster Aiton; 
2009,2009-07-22,Lisboa,Vila Franca de Xira,Vila Franca de Xira,PORTO ALTO - RECTA CABO (VILA FRANCA DE XIRA),38.9561945,-8.98572979001366,NC,5.0,2009-07-22T19:00,22.2,83,19.3,22.4,0.2,0.2,0.0,0.0,51,1011.1,1010.5,100,99,33,0,0.07,0.45,22.7,38.3,213,214,52.6,25.7,25.5,23.3,19.1,0.181,0.249,0.29,0.325,1,0.0,21.3,0.6,20.7,3.9,21.3,212.7,34.0,1.0,33.0,3.9,34.0,339.1,Tracheophyta; ; Magnoliopsida; Olea europaea L.
2009,2009-03-14,Lisboa,ODIVELAS,Caneças,Bº DOS PEDROGÃOS (CANEÇAS),38.812117,-9.198767,NC,305.0,2009-03-14T17:00,17.2,57,8.6,14.4,0.0,0.0,0.0,0.0,0,1020.0,984.2,1,0,0,2,0.23,0.84,16.6,24.2,342,345,31.7,18.7,14.9,12.6,12.0,0.228,0.294,0.329,0.264,1,3600.0,305.7,245.9,59.9,763.0,305.7,446.0,388.0,312.0,76.0,763.0,388.0,566.0,Eucalyptus L'Hér.; Tracheophyta; Magnoliopsida; Olea europaea L.; Pinus pinea L.; 
2009,2009-07-23,Lisboa,Torres Vedras,Torres Vedras (são Pedro E São Tiago),VALE DA AZENHA (Cabeço do Vale dos Barreiros),39.09299855,-9.25866085,NC,33.0,2009-07-23T19:00,20.6,71,15.3,20.1,0.0,0.0,0.0,0.0,0,1018.6,1014.7,0,0,0,0,0.14,0.69,15.8,21.4,317,318,28.8,26.3,24.7,22.2,19.1,0.114,0.163,0.219,0.269,1,3600.0,122.3,85.1,37.2,523.4,122.3,215.6,194.0,135.0,59.0,523.4,194.0,341.8,Tracheophyta; Magnoliopsida
2009,2009-03-16,Lisboa,Azambuja,Vila Nova da Rainha,VILA NOVA DA RAINHA JT JERONIMO MARTINS (VILA NOVA DA RAINHA),39.0364653,-8.928033,NC,8.0,2009-03-16T14:00,26.4,35,9.7,25.7,0.0,0.0,0.0,0.0,0,1017.2,1016.3,0,0,0,0,0.55,2.24,11.6,15.0,112,111,28.1,24.0,16.4,14.2,13.7,0.291,0.382,0.413,0.351,1,3600.0,722.4,616.0,106.4,859.0,722.4,991.6,747.0,637.0,110.0,859.0,747.0,1025.4,Oryza sativa L.; Tracheophyta; Magnoliopsida
2009,2009-07-30,Lisboa,Oeiras,Barcarena,Tercena,38.7440842,-9.2755341,NC,125.0,2009-07-30T12:00,23.2,61,15.3,24.0,0.0,0.0,0.0,0.0,0,1023.8,1009.2,0,0,0,0,0.54,1.11,18.9,24.0,339,343,34.2,26.5,21.6,20.8,18.5,0.139,0.175,0.219,0.268,1,3600.0,919.4,802.0,117.4,867.9,919.4,1226.3,893.0,779.0,114.0,867.9,893.0,1191.1,Tracheophyta; Magnoliopsida; Pinus pinea L.; Vitis vinifera L.; Eucalyptus L'Hér.; Olea europaea L.; Pinus pinaster Aiton
2009,2009-07-23,Lisboa,Oeiras,Porto Salvo,TAGUS PARK (Porto Salvo),38.7162932,-9.3086601,NC,83.0,2009-07-23T12:00,21.8,68,15.6,23.0,0.0,0.0,0.0,0.0,0,1017.7,1008.0,18,20,0,0,0.44,0.84,11.0,13.0,281,284,21.6,26.3,22.1,21.1,18.4,0.156,0.18,0.223,0.269,1,3600.0,744.0,477.5,266.5,511.3,744.0,1237.4,723.0,464.0,259.0,511.3,723.0,1202.5,Tracheophyta; Magnoliopsida; Pinus pinea L.; Vitis vinifera L.; Eucalyptus L'Hér.; Olea europaea L.; Pinus pinaster Aiton
2009,2009-07-30,Lisboa,Cadaval,Cadaval,EN-1 ENTRE ESPINHEIRA E ESPINHAÇOS DE CÃO (CADAVAL),39.242859,-9.1026628,NC,104.0,2009-07-30T14:00,25.2,49,13.6,25.3,0.0,0.0,0.0,0.0,0,1023.6,1011.5,1,1,0,0,0.61,1.64,19.3,24.5,331,332,41.0,34.6,24.5,22.8,19.6,0.082,0.152,0.195,0.234,1,3600.0,893.2,749.0,144.2,838.9,893.2,1185.0,917.0,769.0,148.0,838.9,917.0,1216.5,Magnoliopsida; Eucalyptus L'Hér.; Tracheophyta; Pinales
2009,2009-11-03,Lisboa,Torres Vedras,Silveira,SILVEIRA,39.09988255,-9.353263490245048,NC,15.0,2009-11-03T11:00,18.9,70,13.4,17.6,0.0,0.0,0.0,,3,1020.7,1018.9,86,66,1,88,0.22,0.65,16.8,20.5,329,329,29.9,18.6,17.5,19.6,20.8,0.142,0.154,0.125,0.174,1,3600.0,396.7,245.0,151.7,455.7,396.7,747.3,366.0,226.0,140.0,455.7,366.0,689.5,Tracheophyta; Magnoliopsida; Vitis vinifera L.; Eucalyptus L'Hér.; 
2009,2009-07-31,Lisboa,Cascais,Alcabideche,R DO GIRASSOL - AMOREIRA (Ribeira das Parreiras),38.739751850000005,-9.40823198439682,NC,97.0,2009-07-31T22:00,19.1,90,17.4,20.1,0.0,0.0,0.0,0.0,0,1021.0,1009.5,0,0,0,0,0.0,0.23,11.4,20.2,325,325,23.4,20.9,23.4,21.5,19.1,0.078,0.131,0.179,0.235,0,0.0,0.0,0.0,0.0,0.0,0.0,0.0,0.0,0.0,0.0,0.0,0.0,0.0,Tracheophyta; Eucalyptus L'Hér.; Magnoliopsida; Pinus pinea L.; Pinus pinaster Aiton; Pinales; Vitis vinifera L.; 
2009,2009-05-21,Lisboa,Torres Vedras,Campelos,CAMPELOS,39.1919559,-9.23317479665106,NC,97.0,2009-05-21T21:00,15.0,87,12.8,14.6,0.0,0.0,0.0,0.0,0,1013.9,1002.3,1,1,0,0,0.0,0.22,8.7,14.5,222,226,15.8,18.1,20.0,16.8,14.7,0.102,0.19,0.244,0.244,0,0.0,0.0,0.0,0.0,0.0,0.0,0.0,0.0,0.0,0.0,0.0,0.0,0.0,Eucalyptus L'Hér.; Tracheophyta; Magnoliopsida; Vitis vinifera L.; Olea europaea L.; Pinus pinaster Aiton; Pinus pinea L.; 
2009,2009-08-02,Lisboa,Sintra,Agualva,ALTO COLARIDE (Alto),38.7740235,-9.2935542,NC,156.0,2009-08-02T13:00,21.2,53,11.2,19.7,0.0,0.0,0.0,0.0,1,1019.1,1000.8,20,0,0,67,0.54,1.19,25.5,31.9,337,340,42.1,25.5,21.1,20.8,18.4,0.137,0.168,0.214,0.26,1,3600.0,941.5,809.3,132.2,869.4,941.5,1236.4,940.0,808.0,132.0,869.4,940.0,1234.4,Tracheophyta; Magnoliopsida; 
2009,2009-08-02,Lisboa,Loures,Camarate,Bº DA TORRE (CAMARATE),38.8072917,-9.1455319,NC,102.0,2009-08-02T17:00,20.8,52,10.6,16.8,0.0,0.0,0.0,0.0,0,1017.8,1005.8,12,0,0,39,0.37,1.18,28.8,37.5,344,346,50.4,24.7,22.7,22.2,20.8,0.243,0.273,0.306,0.328,1,3600.0,466.8,358.5,108.3,701.3,466.8,678.9,543.0,417.0,126.0,701.3,543.0,789.7,Tracheophyta; Olea europaea L.; Magnoliopsida; 
2009,2009-02-15,Lisboa,Sintra,Almargem do Bispo,CASAL FALCAO (Casal Alentejano),38.8491202,-9.264334778649603,NC,283.0,2009-02-15T19:00,12.3,74,7.9,10.8,0.0,0.0,0.0,0.0,0,1017.8,984.0,0,0,0,0,0.03,0.37,6.9,8.2,9,52,9.4,11.5,11.5,10.6,12.6,0.331,0.356,0.358,0.258,0,0.0,0.0,0.0,0.0,0.0,0.0,0.0,1.0,0.0,1.0,0.0,1.0,12.9,Tracheophyta; Magnoliopsida; Pinus pinaster Aiton; Eucalyptus L'Hér.; Vitis vinifera L.; 
2009,2009-05-28,Lisboa,Mafra,Sobral da Abelheira,ESTRADA SOBRAL ABELHEIRA P/CUDEÇAL (Casal da Estrada),38.9960641,-9.3334902,NC,95.0,2009-05-28T15:00,26.1,36,9.8,25.9,0.0,0.0,0.0,0.0,0,1015.3,1004.4,0,0,0,0,0.63,2.18,13.7,20.1,55,61,28.1,31.3,21.2,17.4,15.2,0.138,0.214,0.268,0.282,1,3600.0,835.6,731.9,103.7,899.3,835.6,1084.0,886.0,776.0,110.0,899.3,886.0,1149.3,Eucalyptus L'Hér.; Magnoliopsida; Pinus pinaster Aiton; Vitis vinifera L.; Tracheophyta
2009,2009-07-26,Lisboa,Arruda dos Vinhos,Arruda dos Vinhos,CURREDORAS (ARRUDA DOS VINHOS),38.99119885,-9.062929029605822,NC,72.0,2009-07-26T22:00,17.6,75,13.2,15.8,0.0,0.0,0.0,0.0,0,1019.6,1011.0,0,0,0,0,0.05,0.5,19.5,31.6,337,339,37.4,22.2,25.4,22.8,19.0,0.163,0.249,0.288,0.325,0,0.0,0.0,0.0,0.0,0.0,0.0,0.0,0.0,0.0,0.0,0.0,0.0,0.0,Vitis vinifera L.; Tracheophyta
2009,2009-05-31,Lisboa,Alenquer,Abrigada,BARRO - ABRIGADA (Albarrois),39.1450732,-9.0206761,NC,68.0,2009-05-31T00:00,19.6,67,13.2,19.7,0.0,0.0,0.0,0.0,0,1012.2,1004.2,0,0,0,0,0.02,0.76,6.4,10.6,286,336,11.9,21.4,25.4,19.2,15.6,0.085,0.182,0.238,0.237,0,0.0,0.0,0.0,0.0,0.0,0.0,0.0,0.0,0.0,0.0,0.0,0.0,0.0,Magnoliopsida; Tracheophyta
2009,2009-05-06,Lisboa,Sintra,Queluz,IC-19 (JUNTO PALACIO QUELUZ) (QUELUZ),38.7604252,-9.2559895,NC,133.0,2009-05-06T11:00,20.8,57,11.9,22.6,0.0,0.0,0.0,0.0,0,1021.8,1006.2,0,0,0,0,0.52,1.07,5.2,4.5,258,256,12.6,23.5,18.1,15.9,14.1,0.211,0.266,0.28,0.269,1,3600.0,898.1,786.1,112.0,908.6,898.1,1163.2,850.0,744.0,106.0,908.6,850.0,1100.9,Pinus pinaster Aiton; Tracheophyta; Pinales; Eucalyptus L'Hér.; Magnoliopsida; 
