2009,2009-08-10,Lisboa,ODIVELAS,Famões,RUA LUISA NETO JORGE - FAMOES (Famões),38.79343465,-9.209065683730335,NC,157.0,2009-08-10T09:00,21.6,64,14.6,21.5,0.0,0.0,0.0,0.0,0,1015.0,996.7,0,0,0,0,0.28,0.92,11.3,14.8,7,13,22.7,22.5,21.3,21.2,19.0,0.12,0.162,0.207,0.255,1,3600.0,530.6,430.1,100.5,726.2,530.6,788.4,454.0,368.0,86.0,726.2,454.0,674.6,Pinus pinea L.; Olea europaea L.; Tracheophyta; Magnoliopsida; 
2009,2009-08-03,Lisboa,Mafra,Milharado,Brejos da Roussada,38.9352275,-9.2012529,NC,170.0,2009-08-03T03:00,16.3,79,12.7,14.1,0.0,0.0,0.0,0.0,0,1017.8,997.6,0,0,0,0,0.04,0.38,20.9,32.8,357,357,36.0,17.7,22.1,22.2,19.2,0.101,0.157,0.206,0.252,0,0.0,0.0,0.0,0.0,0.0,0.0,0.0,0.0,0.0,0.0,0.0,0.0,0.0,Tracheophyta
2009,2009-08-07,Lisboa,Vila Franca de Xira,Vialonga,EST DE S.JULIAO DO TOJAL P/ VIALONGA (VIALONGA),38.8773451,-9.0685711,NC,55.0,2009-08-07T15:00,24.2,43,10.9,22.4,0.0,0.0,0.0,0.0,1,1019.4,1013.0,22,0,0,72,0.57,1.72,23.5,30.9,328,328,50.0,30.9,24.2,22.9,20.0,0.1,0.166,0.215,0.264,1,3600.0,787.0,636.2,150.8,804.4,787.0,1051.9,835.0,675.0,160.0,804.4,835.0,1116.0,Tracheophyta; Magnoliopsida; Pinus pinea L.; Olea europaea L.; Pinus pinaster Aiton; Pinales; 
2009,2009-05-28,Lisboa,Torres Vedras,Ramalhal,Vila Facaia,39.1263894,-9.23288403371647,NC,71.0,2009-05-28T14:00,29.6,25,7.5,29.0,0.0,0.0,0.0,0.0,0,1016.5,1008.4,0,0,0,0,0.76,3.11,14.9,20.8,58,67,29.9,31.8,21.1,17.7,15.4,0.136,0.199,0.253,0.256,1,3600.0,939.3,827.6,111.7,915.9,939.3,1203.6,967.0,852.0,115.0,915.9,967.0,1239.0,Eucalyptus L'Hér.; Pinus pinaster Aiton; Magnoliopsida; Tracheophyta; Vitis vinifera L.; Pinales; Quercus suber L.; 
2009,2009-08-04,Lisboa,Sintra,Montelavar,Outeiro,38.8571312,-9.3250289,NC,150.0,2009-08-04T02:00,18.0,83,15.1,16.8,0.0,0.0,0.0,0.0,0,1016.3,998.6,14,0,0,46,0.03,0.35,20.3,32.1,353,356,32.0,19.4,22.9,22.1,19.4,0.091,0.161,0.217,0.271,0,0.0,0.0,0.0,0.0,0.0,0.0,0.0,0.0,0.0,0.0,0.0,0.0,0.0,Tracheophyta; Magnoliopsida; Pinus pinaster Aiton; Eucalyptus L'Hér.; Vitis vinifera L.; 
2009,2009-08-04,Lisboa,Torres Vedras,Silveira,Casas Novas,39.110203850000005,-9.364428227008002,NC,38.0,2009-08-04T11:00,24.3,66,17.6,25.7,0.0,0.0,0.0,,1,1017.0,1012.6,25,17,0,33,0.47,1.03,16.4,21.3,351,356,33.1,24.2,20.8,20.6,19.4,0.079,0.115,0.15,0.182,1,3600.0,795.2,632.8,162.4,741.4,795.2,1134.1,749.0,596.0,153.0,741.4,749.0,1068.2,Tracheophyta; Magnoliopsida; Vitis vinifera L.; Eucalyptus L'Hér.; 
2009,2009-08-04,Lisboa,Torres Vedras,Silveira,CHARNECA (CHARNAIS),39.110203850000005,-9.364428227008002,NC,38.0,2009-08-04T16:00,25.1,67,18.5,25.8,0.0,0.0,0.0,,0,1016.0,1011.6,13,14,0,0,0.45,1.05,21.3,28.5,330,332,39.2,27.3,22.3,20.7,19.4,0.078,0.115,0.15,0.182,1,3600.0,634.0,529.6,104.5,790.6,634.0,890.1,698.0,583.0,115.0,790.6,698.0,979.9,Tracheophyta; Magnoliopsida; Vitis vinifera L.; Eucalyptus L'Hér.; 
2009,2009-07-13,Lisboa,Azambuja,Alcoentre,QTA DA AMEIXOEIRA (Quinta da Ameixoeira),39.17682855,-8.946289009686822,NC,87.0,2009-07-13T14:00,24.5,44,11.5,23.6,0.0,0.0,0.0,0.0,0,1016.1,1006.0,8,9,0,0,0.62,1.72,22.1,27.7,326,328,46.4,33.6,25.2,22.6,18.7,0.086,0.155,0.198,0.227,1,3600.0,910.3,771.9,138.4,846.2,910.3,1207.2,934.0,792.0,142.0,846.2,934.0,1238.7,Quercus suber L.; Tracheophyta; Pinus pinaster Aiton; Eucalyptus L'Hér.; Pinus pinea L.
2009,2009-08-03,Lisboa,Vila Franca de Xira,Póvoa de Santa Iria,POVOA STA IRIA (PÓVOA DE SANTA IRIA),38.8562721,-9.069732030166948,NC,17.0,2009-08-03T17:00,25.8,43,12.3,23.3,0.0,0.0,0.0,0.0,1,1015.4,1013.4,26,0,0,87,0.45,1.9,22.5,30.2,340,343,44.6,28.5,23.4,22.2,19.4,0.26,0.272,0.308,0.37,1,3600.0,473.2,391.6,81.6,770.0,473.2,675.7,551.0,456.0,95.0,770.0,551.0,786.7,Tracheophyta; Magnoliopsida; Oryza sativa L.; 
2009,2009-08-02,Lisboa,ODIVELAS,Famões,FAMOES JNT INTERMACHE/PINGO DOCE (Famões),38.79343465,-9.209065683730335,NC,157.0,2009-08-02T17:00,20.5,54,10.8,16.5,0.0,0.0,0.0,0.0,0,1017.8,999.4,12,0,0,39,0.36,1.11,28.8,37.5,344,346,50.4,25.2,22.2,21.3,18.7,0.131,0.164,0.21,0.256,1,3600.0,467.0,358.6,108.4,699.8,467.0,680.6,543.0,417.0,126.0,699.8,543.0,791.4,Pinus pinea L.; Olea europaea L.; Tracheophyta; Magnoliopsida; 
2009,2009-08-09,Lisboa,Alenquer,Abrigada,ABRIGADA,39.1528371,-9.0219562158227,NC,81.0,2009-08-09T18:00,22.8,58,14.0,20.4,0.0,0.0,0.0,0.0,0,1013.1,1003.7,5,0,0,17,0.27,1.17,25.6,35.8,343,345,53.6,29.8,25.6,23.2,20.5,0.082,0.15,0.186,0.227,1,3600.0,246.0,184.1,61.9,604.2,246.0,405.7,322.0,241.0,81.0,604.2,322.0,530.9,Magnoliopsida; Eucalyptus L'Hér.; Tracheophyta; Vitis vinifera L.
2009,2009-07-09,Lisboa,Oeiras,Caxias,RUA CALVET MAGALHAES - LAVEIRAS (Meã),38.7035247,-9.3018847,NC,82.0,2009-07-09T18:00,21.1,67,14.7,18.6,0.0,0.0,0.0,0.0,0,1017.9,1008.3,0,0,0,0,0.26,0.83,27.9,37.0,336,339,45.0,24.5,22.3,20.6,17.8,0.166,0.194,0.232,0.271,1,3600.0,332.4,266.6,65.8,719.9,332.4,490.0,414.0,332.0,82.0,719.9,414.0,610.3,Pinus pinea L.; Magnoliopsida; Tracheophyta; Vitis vinifera L.; Eucalyptus L'Hér.; Olea europaea L.; Pinus pinaster Aiton
2009,2009-07-14,Lisboa,Sintra,Algueirão-Mem Martins,BºCABEÇO DA FONTE JUNTO CEMITÉRIO (Algueirão-Mem Martins),38.7977037,-9.341033451942735,NC,169.0,2009-07-14T11:00,20.4,64,13.3,19.8,0.0,0.0,0.0,0.0,2,1018.1,998.3,51,57,0,0,0.4,0.86,15.6,19.9,310,312,38.2,23.8,21.0,20.2,17.4,0.133,0.181,0.225,0.262,1,3600.0,720.5,461.3,259.2,522.2,720.5,1169.2,681.0,436.0,245.0,522.2,681.0,1105.1,Tracheophyta; Magnoliopsida; Pinales; 
2009,2009-07-16,Lisboa,Arruda dos Vinhos,Arruda dos Vinhos,ARRUDA,38.99119885,-9.062929029605822,NC,72.0,2009-07-16T17:00,25.1,54,15.3,24.0,0.0,0.0,0.0,0.0,0,1022.5,1014.1,2,2,0,0,0.41,1.46,20.9,27.2,315,316,42.5,31.9,25.3,22.2,18.3,0.158,0.251,0.294,0.326,1,3600.0,490.0,391.8,98.2,725.5,490.0,715.1,564.0,451.0,113.0,725.5,564.0,823.0,Vitis vinifera L.; Tracheophyta
