year,date,district,municipality,parish,local,latitude,longitude,cause,elevation,hourly.time,hourly.temperature_2m,hourly.relative_humidity_2m,hourly.dew_point_2m,hourly.apparent_temperature,hourly.precipitation,hourly.rain,hourly.snowfall,hourly.snow_depth,hourly.weather_code,hourly.pressure_msl,hourly.surface_pressure,hourly.cloud_cover,hourly.cloud_cover_low,hourly.cloud_cover_mid,hourly.cloud_cover_high,hourly.et0_fao_evapotranspiration,hourly.vapour_pressure_deficit,hourly.wind_speed_10m,hourly.wind_speed_100m,hourly.wind_direction_10m,hourly.wind_direction_100m,hourly.wind_gusts_10m,hourly.soil_temperature_0_to_7cm,hourly.soil_temperature_7_to_28cm,hourly.soil_temperature_28_to_100cm,hourly.soil_temperature_100_to_255cm,hourly.soil_moisture_0_to_7cm,hourly.soil_moisture_7_to_28cm,hourly.soil_moisture_28_to_100cm,hourly.soil_moisture_100_to_255cm,hourly.is_day,hourly.sunshine_duration,hourly.shortwave_radiation_instant,hourly.direct_radiation_instant,hourly.diffuse_radiation_instant,hourly.direct_normal_irradiance_instant,hourly.global_tilted_irradiance_instant,hourly.terrestrial_radiation_instant,hourly.shortwave_radiation,hourly.direct_radiation,hourly.diffuse_radiation,hourly.direct_normal_irradiance,hourly.global_tilted_irradiance,hourly.terrestrial_radiation,scientificNames
2017,2017-10-02,Braga,Barcelos,Vila Cova,Banho,41.5382739999559,-8.7131669998169,Desconhecida,79.0,2017-10-02T15:00,26.7,61,18.6,27.8,0.0,0.0,0.0,0.0,0,1021.6,1012.5,0,0,0,0,0.4,1.35,15.0,19.6,305,311,31.3,27.0,21.0,19.5,20.2,0.14,0.173,0.245,0.312,1,3600.0,507.4,418.5,89.0,779.5,507.4,733.4,559.0,461.0,98.0,779.5,559.0,807.9,Eucalyptus L'Hér.; Pinus pinaster Aiton; Tracheophyta
2017,2017-10-02,Braga,Vila Nova de Famalicão,Ribeirão,Cerca (Trás da Cerca),41.3590950001611,-8.58047700034247,Desconhecida,59.0,2017-10-02T15:00,30.7,43,16.6,31.5,0.0,0.0,0.0,0.0,0,1021.4,1014.7,0,0,0,0,0.46,2.54,11.3,15.1,301,308,25.9,29.1,22.2,20.6,21.3,0.15,0.153,0.208,0.304,1,3600.0,508.9,420.9,88.0,784.0,508.9,733.5,561.0,464.0,97.0,784.0,561.0,808.5,Eucalyptus L'Hér.; Tracheophyta; Magnoliopsida
2017,2017-10-02,Braga,Vila Nova de Famalicão,Lousado,Pé de Prata (Rio Pelhe),41.3570729997423,-8.5179779999786,Desconhecida,49.0,2017-10-02T17:00,26.8,63,19.0,28.5,0.0,0.0,0.0,0.0,0,1021.6,1015.9,0,0,0,0,0.2,1.32,11.3,17.9,297,308,27.7,28.1,23.1,20.7,21.4,0.149,0.152,0.208,0.304,1,3600.0,179.8,131.1,48.7,589.6,179.8,303.7,251.0,183.0,68.0,589.6,251.0,424.0,Eucalyptus L'Hér.; Vitis vinifera L.; Magnoliopsida; Tracheophyta; Pinus pinaster Aiton
2017,2017-10-02,Braga,Fafe,Silvares (São Martinho),Travessa da varzea (Várzea),41.4050869999991,-8.16184700012207,NC,453.0,2017-10-02T17:00,28.0,42,13.8,27.7,0.0,0.0,0.0,0.0,0,1021.5,970.6,0,0,0,0,0.23,2.21,10.1,15.6,305,308,21.2,27.9,21.8,19.3,19.9,0.108,0.152,0.202,0.298,1,3600.0,178.5,130.9,47.7,601.5,178.5,297.2,251.0,184.0,67.0,601.5,251.0,417.9,Tracheophyta; Magnoliopsida; Pinales; Eucalyptus L'Hér.; Pinus pinaster Aiton
2017,2017-10-02,Braga,Celorico de Basto,Arnoia,Carvalhais (EM1748-1. 4890. Portugal),41.3583333333333,-8.02833333333333,Desconhecida,586.0,2017-10-02T20:00,23.2,57,14.3,24.3,0.0,0.0,0.0,0.0,0,1023.1,956.7,0,0,0,0,0.0,1.21,1.8,4.8,79,318,13.7,23.1,22.3,19.3,19.7,0.131,0.147,0.195,0.319,0,0.0,0.0,0.0,0.0,0.0,0.0,0.0,0.0,0.0,0.0,0.0,0.0,0.0,Eucalyptus L'Hér.; Tracheophyta; Magnoliopsida
2017,2017-10-03,Braga,Vila Verde,Barros,Sisão (Monte da Cruz),41.7326920000712,-8.40457499980926,Desconhecida,434.0,2017-10-03T13:00,26.9,40,12.2,27.5,0.0,0.0,0.0,0.0,0,1020.2,971.2,0,0,0,0,0.5,2.12,6.8,8.3,273,275,21.6,25.0,19.4,18.4,18.9,0.121,0.169,0.227,0.316,1,3600.0,700.3,602.4,97.9,877.9,700.3,937.9,708.0,609.0,99.0,877.9,708.0,948.1,Magnoliopsida; Quercus L.; Eucalyptus L'Hér.; Pinus pinaster Aiton; Tracheophyta
2017,2017-03-14,Braga,Vieira do Minho,Rossas,Calvos (Lodeiro),41.5869480000602,-8.07384499973721,Desconhecida,465.0,2017-03-14T23:00,13.9,54,4.6,9.6,0.0,0.0,0.0,0.0,0,1026.1,971.1,0,0,0,1,0.09,0.74,20.4,40.2,82,80,50.8,12.0,12.3,10.8,10.1,0.343,0.365,0.394,0.415,0,0.0,0.0,0.0,0.0,0.0,0.0,0.0,0.0,0.0,0.0,0.0,0.0,0.0,Quercus L.; Pinus pinaster Aiton; Magnoliopsida; Tracheophyta
2017,2017-10-04,Braga,Vizela,Infias,QUINTA DAS MANAS (Castelo),41.4047849999534,-8.30400299999449,NC,303.0,2017-10-04T02:00,14.6,93,13.6,15.2,0.0,0.0,0.0,0.0,0,1020.2,984.3,0,0,0,0,0.0,0.11,4.3,8.4,114,133,10.4,18.1,21.6,20.2,20.4,0.11,0.159,0.219,0.296,0,0.0,0.0,0.0,0.0,0.0,0.0,0.0,0.0,0.0,0.0,0.0,0.0,0.0,Eucalyptus L'Hér.; Magnoliopsida; Tracheophyta; Vitis vinifera L.
2017,2017-10-04,Braga,Fafe,Arões (São Romão),r. pinheiro manso (Sub Nogueiras),41.4664019997915,-8.21469200028313,NC,451.0,2017-10-04T04:00,13.8,92,12.4,13.8,0.0,0.0,0.0,0.0,0,1019.5,966.5,8,0,0,28,0.0,0.13,4.9,7.9,73,93,10.4,16.7,20.5,19.5,19.7,0.106,0.153,0.207,0.302,0,0.0,0.0,0.0,0.0,0.0,0.0,0.0,0.0,0.0,0.0,0.0,0.0,0.0,Pinus pinaster Aiton; Eucalyptus L'Hér.; Pinales; Tracheophyta; Magnoliopsida
2017,2017-03-14,Braga,Vila Nova de Famalicão,Lousado,Rua julio brandao (Gandara),41.3563250001272,-8.52976700041029,Desconhecida,75.0,2017-03-14T22:00,16.6,52,6.6,13.1,0.0,0.0,0.0,0.0,0,1025.0,1016.0,0,0,0,0,0.1,0.91,18.2,36.8,82,82,34.9,14.8,14.7,13.1,12.3,0.332,0.347,0.38,0.369,0,0.0,0.0,0.0,0.0,0.0,0.0,0.0,0.0,0.0,0.0,0.0,0.0,0.0,Eucalyptus L'Hér.; Tracheophyta; Pinus pinaster Aiton; Vitis vinifera L.; Magnoliopsida
2017,2017-10-04,Braga,Guimarães,Costa,Matama (ED101-2 (ED101-2) Km 5),41.4344579999977,-8.27653500027127,Desconhecida,408.0,2017-10-04T17:00,23.3,62,15.7,23.9,0.0,0.0,0.0,0.0,0,1020.1,973.5,0,0,0,0,0.17,1.08,9.2,12.1,281,282,25.9,26.3,21.7,19.9,20.0,0.107,0.154,0.208,0.301,1,3600.0,170.9,126.1,44.8,611.3,170.9,282.0,244.0,180.0,64.0,611.3,244.0,402.7,Pinales; Eucalyptus L'Hér.; Tracheophyta; Magnoliopsida
2017,2017-10-04,Braga,Guimarães,Costa,Rua do Escrivão (Vilar),41.4371719998784,-8.27408199999068,NC,363.0,2017-10-04T17:00,21.7,67,15.3,22.2,0.0,0.0,0.0,0.0,0,1020.2,978.3,0,0,0,0,0.16,0.86,8.7,10.5,275,276,23.8,25.6,21.5,19.8,20.0,0.107,0.163,0.217,0.299,1,3600.0,175.5,131.3,44.2,631.9,175.5,284.2,250.0,187.0,63.0,631.9,250.0,404.8,Pinales; Eucalyptus L'Hér.; Tracheophyta; Magnoliopsida
2017,2017-10-04,Braga,Fafe,Regadas,R. 13 Maio (Cortinhas),41.3968720001645,-8.1468199994829,Desconhecida,501.0,2017-10-04T21:00,16.8,89,15.1,18.1,0.0,0.0,0.0,0.0,0,1021.9,963.6,0,0,0,0,0.0,0.2,2.9,0.4,210,270,10.4,20.6,21.9,19.7,19.6,0.101,0.155,0.214,0.307,0,0.0,0.0,0.0,0.0,0.0,0.0,0.0,0.0,0.0,0.0,0.0,0.0,0.0,Pinales; Tracheophyta; Magnoliopsida
2017,2017-10-05,Braga,Vila Nova de Famalicão,Portela,Alminhas (Av. do Calvário 260. 4770 Portela. Portugal),41.4641666666667,-8.44055555555556,Desconhecida,275.0,2017-10-05T23:00,13.9,98,13.6,14.6,0.0,0.0,0.0,0.0,0,1020.9,988.1,0,0,0,0,0.0,0.03,3.2,1.8,117,90,5.4,17.5,20.1,19.8,19.9,0.119,0.169,0.234,0.306,0,0.0,0.0,0.0,0.0,0.0,0.0,0.0,0.0,0.0,0.0,0.0,0.0,0.0,Pinus pinaster Aiton; Tracheophyta; Eucalyptus L'Hér.; Magnoliopsida; 
2017,2017-10-05,Braga,Vieira do Minho,Anjos,Casa do Guarda Florestal (R. de Santa Luzia. 4850. Portugal),41.5994444444444,-8.06333333333333,Desconhecida,646.0,2017-10-05T23:00,15.2,68,9.3,14.5,0.0,0.0,0.0,0.0,0,1021.1,946.4,0,0,0,0,0.0,0.55,3.4,3.1,32,126,8.6,17.3,20.1,18.8,18.7,0.104,0.164,0.228,0.32,0,0.0,0.0,0.0,0.0,0.0,0.0,0.0,0.0,0.0,0.0,0.0,0.0,0.0,Pinus pinaster Aiton; Magnoliopsida; Tracheophyta; Acacia Mill.; Quercus L.; Eucalyptus L'Hér.
2017,2017-10-06,Braga,Celorico de Basto,Basto (Santa Tecla),Rossinho (N618 27. 4890. Portugal),41.3891666666667,-8.04777777777778,Desconhecida,359.0,2017-10-06T05:00,15.8,54,6.5,13.6,0.0,0.0,0.0,0.0,0,1020.4,978.2,0,0,0,0,0.04,0.83,8.5,19.8,78,91,18.0,16.4,20.4,20.6,20.4,0.099,0.149,0.201,0.297,0,0.0,0.0,0.0,0.0,0.0,0.0,0.0,0.0,0.0,0.0,0.0,0.0,0.0,Magnoliopsida; Olea europaea L.; Tracheophyta; Pinus pinaster Aiton; Vitis vinifera L.
2017,2017-10-06,Braga,Guimarães,Costa,Rua escrivão (ED101-2 (ED101-2) Km 5),41.4357220000691,-8.27559800042046,NC,416.0,2017-10-06T07:00,15.1,68,9.2,13.0,0.0,0.0,0.0,0.0,0,1020.9,972.0,0,0,0,0,0.06,0.55,12.7,25.9,75,76,25.9,16.1,19.4,20.0,19.9,0.1,0.153,0.207,0.301,1,0.0,15.3,5.1,10.2,58.4,5.8,91.7,6.0,2.0,4.0,28.6,6.0,36.0,Pinales; Eucalyptus L'Hér.; Tracheophyta; Magnoliopsida
2017,2017-03-14,Braga,Braga,Esporões,SANTA MARTA (Tomada),41.5107239998711,-8.41272100024753,Desconhecida,253.0,2017-03-14T21:00,14.8,55,5.7,11.8,0.0,0.0,0.0,0.0,0,1024.9,994.7,0,0,0,0,0.06,0.76,12.9,31.1,77,80,27.7,13.3,13.3,11.6,10.8,0.326,0.352,0.385,0.373,0,0.0,0.0,0.0,0.0,0.0,0.0,0.0,0.0,0.0,0.0,0.0,0.0,0.0,Eucalyptus L'Hér.; Magnoliopsida; Pinus pinaster Aiton; Tracheophyta
2017,2017-10-06,Braga,Terras de Bouro,Moimenta,SAIM (Fonte do Toro),41.7177890000078,-8.29981099976434,Reacendimento,203.0,2017-10-06T10:00,25.7,44,12.5,26.3,0.0,0.0,0.0,0.0,0,1020.9,997.5,0,0,0,0,0.29,1.86,1.1,1.1,288,342,11.9,20.9,19.3,20.3,20.4,0.108,0.168,0.227,0.315,1,3600.0,529.0,440.9,88.2,808.9,529.0,746.2,468.0,390.0,78.0,808.9,468.0,660.1,Tracheophyta; Magnoliopsida; Pinus pinaster Aiton; Quercus L.
2017,2017-10-06,Braga,Vila Verde,Cabanelas,ER205 (ER205) Km 36 (Tv. à Rua do Monte 11. 4730-086. Portugal),41.5825,-8.50138888888889,Desconhecida,48.0,2017-10-06T12:00,29.4,30,10.1,29.2,0.0,0.0,0.0,0.0,0,1020.4,1014.9,0,0,0,0,0.5,2.86,6.8,9.1,108,108,21.2,23.8,20.2,21.3,21.4,0.118,0.17,0.235,0.3,1,3600.0,694.0,598.5,95.5,880.1,694.0,931.2,676.0,583.0,93.0,880.1,676.0,907.0,Tracheophyta; Pinus pinaster Aiton; Eucalyptus L'Hér.; Vitis vinifera L.
2017,2017-10-06,Braga,Vila Nova de Famalicão,Portela,Carvalhais (Av. do Paço 383. 4770. Portugal),41.4583333333333,-8.44166666666667,NC,228.0,2017-10-06T15:00,29.9,25,7.6,28.9,0.0,0.0,0.0,0.0,0,1018.6,992.8,0,0,0,0,0.39,3.17,2.8,2.9,230,210,15.8,26.8,20.3,20.1,20.3,0.12,0.171,0.236,0.306,1,3600.0,506.4,427.0,79.4,831.4,506.4,703.2,561.0,473.0,88.0,831.4,561.0,779.0,Pinus pinaster Aiton; Tracheophyta; Eucalyptus L'Hér.; Magnoliopsida; 
2017,2017-10-06,Braga,Vieira do Minho,Anjos,Sernados (R. das Covas. 4850. Portugal),41.5986111111111,-8.065,Reacendimento,672.0,2017-10-06T15:00,26.7,24,4.6,24.5,0.0,0.0,0.0,0.0,0,1019.8,945.2,0,0,0,0,0.41,2.66,7.3,9.4,101,94,24.8,25.9,19.5,18.6,18.5,0.103,0.163,0.228,0.32,1,3600.0,506.5,426.3,80.2,837.4,506.5,697.1,562.0,473.0,89.0,837.4,562.0,773.4,Pinus pinaster Aiton; Magnoliopsida; Tracheophyta; Olea europaea L.; Quercus L.; Eucalyptus L'Hér.
2017,2017-03-14,Braga,Vizela,Vizela (Santo Adrião),RUA DO POÇO QUENTE (Aldeia),41.3658740001255,-8.28687700006697,NC,136.0,2017-03-14T20:00,16.4,55,7.4,13.9,0.0,0.0,0.0,0.0,0,1024.5,1008.2,0,0,0,0,0.06,0.84,12.4,29.6,68,69,29.5,15.2,14.4,12.8,12.0,0.333,0.356,0.388,0.381,0,0.0,0.0,0.0,0.0,0.0,0.0,0.0,0.0,0.0,0.0,0.0,0.0,0.0,Tracheophyta; Magnoliopsida; Vitis vinifera L.; Eucalyptus L'Hér.
2017,2017-10-06,Braga,Vila Verde,Dossãos,Santa Iria (N308 70. 4730. Portugal),41.6705555555556,-8.46111111111111,Desconhecida,199.0,2017-10-06T17:00,27.3,43,13.7,27.5,0.0,0.0,0.0,0.0,0,1018.4,995.7,0,0,0,0,0.19,2.05,6.4,14.8,344,357,15.5,26.4,21.2,20.2,20.4,0.115,0.165,0.224,0.302,1,3600.0,164.1,120.5,43.6,609.7,164.1,270.6,237.0,174.0,63.0,609.7,237.0,390.8,Magnoliopsida; Eucalyptus L'Hér.; Vitis vinifera L.; Tracheophyta; Pinus pinaster Aiton
2017,2017-10-06,Braga,Celorico de Basto,Agilde,Vales (N101-4. 4615. Portugal),41.3680555555556,-8.12472222222222,Desconhecida,547.0,2017-10-06T20:00,19.5,41,6.1,17.9,0.0,0.0,0.0,0.0,0,1019.6,956.9,0,0,0,0,0.03,1.33,4.4,2.9,99,97,9.7,21.3,21.3,19.6,19.3,0.097,0.152,0.215,0.306,0,0.0,0.0,0.0,0.0,0.0,0.0,0.0,0.0,0.0,0.0,0.0,0.0,0.0,Pinus pinaster Aiton; Eucalyptus L'Hér.; Vitis vinifera L.; Pinales; Magnoliopsida
2017,2017-10-07,Braga,Vila Nova de Famalicão,Portela,Carvalhais (Av. do Paço 383. 4770. Portugal),41.4580555555556,-8.44166666666667,Reacendimento,236.0,2017-10-07T00:00,17.9,49,7.1,15.7,0.0,0.0,0.0,0.0,0,1019.6,991.8,0,0,0,0,0.06,1.05,10.5,21.3,98,92,23.0,18.1,21.1,20.1,20.2,0.12,0.169,0.235,0.306,0,0.0,0.0,0.0,0.0,0.0,0.0,0.0,0.0,0.0,0.0,0.0,0.0,0.0,Pinus pinaster Aiton; Tracheophyta; Eucalyptus L'Hér.; Magnoliopsida; 
2017,2017-03-14,Braga,Braga,Tebosa,Feixe (Av. da Agra 546. 4770. Portugal),41.475,-8.47944444444444,Desconhecida,144.0,2017-03-14T20:00,15.9,56,7.2,13.5,0.0,0.0,0.0,0.0,0,1024.6,1007.3,0,0,0,0,0.05,0.79,11.6,28.1,74,74,24.5,15.0,14.2,12.5,11.8,0.334,0.356,0.387,0.379,0,0.0,0.0,0.0,0.0,0.0,0.0,0.0,0.0,0.0,0.0,0.0,0.0,0.0,Pinus pinaster Aiton; Tracheophyta; Eucalyptus L'Hér.
2017,2017-10-07,Braga,Fafe,Regadas,SAIBRO (REGADAS),41.3973679998186,-8.14770499971178,NC,490.0,2017-10-07T02:00,16.4,51,6.2,14.3,0.0,0.0,0.0,0.0,0,1021.3,964.2,0,0,0,0,0.04,0.92,8.1,22.7,77,89,25.9,17.7,20.9,20.1,19.7,0.096,0.15,0.213,0.306,0,0.0,0.0,0.0,0.0,0.0,0.0,0.0,0.0,0.0,0.0,0.0,0.0,0.0,Pinales; Tracheophyta; Magnoliopsida
2017,2017-10-07,Braga,Braga,Morreira,Portela (Alto da Moreira),41.5028129998843,-8.39276700019837,Desconhecida,315.0,2017-10-07T05:00,17.8,43,5.0,13.5,0.0,0.0,0.0,0.0,0,1020.2,983.3,0,0,0,0,0.13,1.16,20.7,39.3,98,93,45.4,18.4,20.6,20.2,20.2,0.102,0.164,0.228,0.307,0,0.0,0.0,0.0,0.0,0.0,0.0,0.0,0.0,0.0,0.0,0.0,0.0,0.0,Eucalyptus L'Hér.; Pinus pinaster Aiton; Tracheophyta; Magnoliopsida; Pinus pinea L.
2017,2017-10-07,Braga,Guimarães,Costa,Rua da Ponte (Mato de Cima),41.4378319999907,-8.28176799986097,NC,259.0,2017-10-07T06:00,16.7,46,5.0,12.6,0.0,0.0,0.0,0.0,0,1020.6,990.0,0,0,0,0,0.12,1.03,19.9,37.1,95,91,40.3,18.2,20.8,20.7,20.6,0.102,0.16,0.216,0.299,0,0.0,0.0,0.0,0.0,0.0,0.0,0.0,0.0,0.0,0.0,0.0,0.0,0.0,Tracheophyta; Eucalyptus L'Hér.; Pinales; Magnoliopsida
2017,2017-10-07,Braga,Vieira do Minho,Anjos,Sernados (EM526. 4850. Portugal),41.5961111111111,-8.06666666666667,Reacendimento,687.0,2017-10-07T08:00,15.5,41,2.3,11.1,0.0,0.0,0.0,0.0,0,1022.1,942.9,0,0,0,0,0.15,1.05,18.7,34.2,71,70,43.9,16.1,18.6,18.6,18.4,0.102,0.162,0.225,0.32,1,3441.04,186.2,119.9,66.3,480.6,181.4,341.8,118.0,76.0,42.0,468.3,118.0,216.6,Pinus pinaster Aiton; Magnoliopsida; Quercus L.; Tracheophyta; Olea europaea L.
2017,2017-10-07,Braga,Vila Nova de Famalicão,Joane,Celorico,41.4458129999373,-8.41942999998729,Reacendimento,250.0,2017-10-07T08:00,18.3,36,2.9,13.3,0.0,0.0,0.0,0.0,0,1020.4,991.0,0,0,0,0,0.19,1.34,22.5,39.1,103,100,45.7,18.3,19.9,20.1,20.1,0.119,0.169,0.235,0.306,1,3362.35,177.1,111.7,65.4,453.7,170.2,337.1,111.0,70.0,41.0,436.2,111.0,211.3,Eucalyptus L'Hér.; Vitis vinifera L.; Tracheophyta; Magnoliopsida; Pinus pinaster Aiton
2017,2017-10-07,Braga,Fafe,Ardegão,r. 25 abril (Calzinha),41.3934299998813,-8.1242070002026,Reacendimento,606.0,2017-10-07T08:00,15.2,37,0.7,11.4,0.0,0.0,0.0,0.0,0,1021.6,951.3,0,0,0,0,0.12,1.08,12.0,23.4,81,92,33.1,15.4,18.8,19.3,19.0,0.096,0.15,0.213,0.306,1,3462.84,187.4,121.2,66.1,482.6,183.2,344.1,119.0,77.0,42.0,471.9,119.0,218.6,Pinales; Tracheophyta; Magnoliopsida; Pinus pinaster Aiton
2017,2017-10-07,Braga,Celorico de Basto,Agilde,penouta (Lares),41.3756040000916,-8.1223429997762,Reacendimento,647.0,2017-10-07T10:00,20.0,20,-3.8,14.9,0.0,0.0,0.0,0.0,0,1021.0,947.4,0,0,0,0,0.37,1.87,17.0,24.2,94,95,42.8,18.3,18.3,19.0,18.7,0.096,0.15,0.213,0.306,1,3600.0,539.9,446.1,93.7,815.7,539.9,749.2,478.0,395.0,83.0,815.7,478.0,663.3,Pinus pinaster Aiton; Pinales; Eucalyptus L'Hér.; Magnoliopsida; Tracheophyta; Vitis vinifera L.
2017,2017-10-07,Braga,Fafe,Regadas,RUA 13 Maio (Lugar Novo),41.3980830001831,-8.14803799947103,Reacendimento,491.0,2017-10-07T13:00,26.1,13,-4.8,22.7,0.0,0.0,0.0,0.0,0,1019.6,964.3,0,0,0,0,0.53,2.96,10.5,14.1,96,94,33.5,25.0,19.9,20.0,19.7,0.098,0.151,0.214,0.306,1,3600.0,702.0,605.2,96.8,903.9,702.0,917.3,711.0,613.0,98.0,903.9,711.0,929.1,Pinales; Tracheophyta; Magnoliopsida
2017,2017-10-07,Braga,Guimarães,Briteiros (Santa Leocádia),CASQUEIRA (Sesude),41.5269080003103,-8.33252900017632,Desconhecida,175.0,2017-10-07T13:00,28.1,17,0.9,25.2,0.0,0.0,0.0,0.0,0,1019.1,999.1,0,0,0,0,0.56,3.16,12.6,17.3,88,88,33.8,25.7,20.9,20.7,20.8,0.113,0.168,0.224,0.294,1,3600.0,695.8,598.0,97.8,894.2,695.8,916.2,704.0,605.0,99.0,894.2,704.0,926.9,Pinales; Quercus L.; Magnoliopsida; Tracheophyta; Olea europaea L.; Pinus pinaster Aiton
2017,2017-10-07,Braga,Vila Nova de Famalicão,Ribeirão,Av. Portas do Minho (Corga),41.3538250001272,-8.553136999872,NC,47.0,2017-10-07T14:00,30.2,13,-1.0,27.0,0.0,0.0,0.0,0.0,0,1018.3,1012.9,0,0,0,0,0.55,3.72,11.2,14.4,88,86,29.5,26.8,21.5,21.1,21.4,0.147,0.156,0.213,0.303,1,3600.0,639.0,546.0,93.1,890.0,639.0,840.4,673.0,575.0,98.0,890.0,673.0,885.1,Tracheophyta; Vitis vinifera L.
2017,2017-10-07,Braga,Guimarães,Gondomar,LG. DO CANIÇO (Mareira),41.5246700000763,-8.27423200024499,Desconhecida,204.0,2017-10-07T14:00,28.8,15,-0.5,25.7,0.0,0.0,0.0,0.0,0,1018.6,995.4,0,0,0,0,0.53,3.38,10.9,14.9,81,82,32.0,27.1,21.6,20.9,20.9,0.103,0.164,0.228,0.307,1,3600.0,630.0,538.9,91.1,882.7,630.0,836.4,664.0,568.0,96.0,882.7,664.0,881.5,Magnoliopsida; Eucalyptus L'Hér.; Pinales; Tracheophyta
2017,2017-10-07,Braga,Vila Nova de Famalicão,Lousado,LOTEAMENETO PÉ DE PRATA (Rio Pelhe),41.356863000128,-8.51842499997881,NC,40.0,2017-10-07T15:00,30.8,13,-0.7,27.9,0.0,0.0,0.0,0.0,0,1017.7,1013.1,0,0,0,0,0.43,3.87,5.8,7.2,94,84,24.8,27.4,21.9,21.2,21.4,0.146,0.155,0.212,0.303,1,3600.0,516.9,433.9,83.0,851.1,516.9,698.5,573.0,481.0,92.0,851.1,573.0,774.2,Eucalyptus L'Hér.; Vitis vinifera L.; Magnoliopsida; Tracheophyta; Pinus pinaster Aiton
2017,2017-10-07,Braga,Póvoa de Lanhoso,São João de Rei,L. CANCELOS (Dornas),41.6235349999534,-8.28605500009325,Desconhecida,180.0,2017-10-07T16:00,28.7,24,6.3,26.8,0.0,0.0,0.0,0.0,0,1017.7,997.2,0,0,0,0,0.32,2.97,6.6,8.9,315,313,16.2,28.1,22.2,20.7,20.8,0.111,0.162,0.226,0.309,1,3600.0,344.5,279.0,65.6,769.6,344.5,496.6,415.0,336.0,79.0,769.6,415.0,598.2,Eucalyptus L'Hér.; Tracheophyta; Pinus pinaster Aiton; Magnoliopsida; Quercus L.
2017,2017-10-07,Braga,Fafe,Vinhós,Rua Ribeiro Lobo (Ribeiro Lobo),41.4793120002747,-8.18516499996185,NC,283.0,2017-10-07T16:00,28.5,17,0.8,25.7,0.0,0.0,0.0,0.0,0,1017.6,985.6,0,0,0,0,0.31,3.25,5.4,7.8,53,56,19.8,27.2,21.7,20.4,20.4,0.102,0.164,0.228,0.307,1,3600.0,347.8,281.4,66.4,774.6,347.8,497.8,419.0,339.0,80.0,774.6,419.0,599.6,Tracheophyta; Magnoliopsida; Eucalyptus L'Hér.; Pinales; Pinus pinea L.
2017,2017-10-07,Braga,Vila Nova de Famalicão,Vale (São Cosme),L. PEDREIRA (Matagal),41.4515000000265,-8.46082200050354,Reacendimento,165.0,2017-10-07T17:00,27.0,40,12.2,27.3,0.0,0.0,0.0,0.0,0,1017.6,998.7,0,0,0,0,0.16,2.15,2.9,4.3,300,318,9.0,26.5,22.2,20.6,20.7,0.118,0.169,0.235,0.305,1,3600.0,165.4,122.2,43.2,633.8,165.4,264.1,241.0,178.0,63.0,633.8,241.0,384.8,Tracheophyta; Eucalyptus L'Hér.
2017,2017-03-14,Braga,Guimarães,Serzedo,Cimo do Eiriz (R. do Souto. 4810. Portugal),41.4005555555556,-8.23722222222222,Desconhecida,299.0,2017-03-14T19:00,15.4,58,7.2,13.2,0.0,0.0,0.0,0.0,0,1024.1,988.6,0,0,0,0,0.06,0.74,10.4,26.2,70,72,24.1,14.8,13.1,11.6,10.8,0.334,0.359,0.392,0.386,0,226.45,0.0,0.0,0.0,0.0,0.0,0.0,18.0,9.0,9.0,97.8,18.0,67.3,Magnoliopsida; Tracheophyta; Eucalyptus L'Hér.; Pinus pinaster Aiton; Vitis vinifera L.
2017,2017-10-07,Braga,Terras de Bouro,Moimenta,Saim (MOIMENTA),41.7159509997898,-8.30095499998993,Reacendimento,258.0,2017-10-07T19:00,21.7,53,11.6,21.1,0.0,0.0,0.0,0.0,0,1018.2,988.3,0,0,0,0,0.04,1.23,7.0,9.4,35,2,15.1,22.9,21.9,20.0,20.0,0.105,0.162,0.222,0.314,0,0.0,0.0,0.0,0.0,0.0,0.0,0.0,0.0,0.0,0.0,0.0,0.0,0.0,Tracheophyta; Magnoliopsida; Pinus pinaster Aiton; Quercus L.
2017,2017-10-07,Braga,Fafe,Estorãos,São Paio (Amarelha),41.496501999961,-8.11771299997966,Desconhecida,614.0,2017-10-07T20:00,17.8,29,-0.5,14.4,0.0,0.0,0.0,0.0,0,1018.8,948.4,0,0,0,0,0.07,1.45,8.1,11.3,45,81,16.2,19.7,20.5,19.2,18.9,0.09,0.144,0.212,0.308,0,0.0,0.0,0.0,0.0,0.0,0.0,0.0,0.0,0.0,0.0,0.0,0.0,0.0,Tracheophyta; Pinales; Eucalyptus L'Hér.; Magnoliopsida
2017,2017-10-07,Braga,Vila Verde,Cervães,São Bento (R. Ermida Souto Novo 6. 4730 Cervães. Portugal),41.6113888888889,-8.52194444444445,Desconhecida,134.0,2017-10-07T21:00,18.0,74,13.3,18.0,0.0,0.0,0.0,0.0,0,1018.2,1002.3,0,0,0,0,0.01,0.54,7.1,16.9,30,29,13.3,20.9,22.2,20.7,20.8,0.109,0.161,0.233,0.304,0,0.0,0.0,0.0,0.0,0.0,0.0,0.0,0.0,0.0,0.0,0.0,0.0,0.0,Pinus pinaster Aiton; Eucalyptus L'Hér.; Tracheophyta; Olea europaea L.
2017,2017-10-07,Braga,Fafe,Ardegão,Igreja (Aldeia de Baixo),41.3967230002085,-8.1306800005171,NC,563.0,2017-10-07T22:00,15.3,27,-3.5,11.8,0.0,0.0,0.0,0.0,0,1018.9,953.6,0,0,0,0,0.05,1.27,5.8,8.3,86,90,15.1,17.9,20.7,19.6,19.2,0.098,0.15,0.213,0.306,0,0.0,0.0,0.0,0.0,0.0,0.0,0.0,0.0,0.0,0.0,0.0,0.0,0.0,Pinales; Magnoliopsida; Pinus pinaster Aiton
2017,2017-10-08,Braga,Fafe,São Gens,Povoação (Ribeiro da Lameirinha),41.4475949997372,-8.11140199979146,Reacendimento,480.0,2017-10-08T04:00,12.8,28,-5.4,9.0,0.0,0.0,0.0,0.0,0,1018.9,962.4,0,0,0,0,0.06,1.07,7.3,13.6,70,73,21.6,14.6,19.7,20.1,19.8,0.083,0.142,0.205,0.304,0,0.0,0.0,0.0,0.0,0.0,0.0,0.0,0.0,0.0,0.0,0.0,0.0,0.0,Magnoliopsida; Tracheophyta; Pinales; Castanea sativa Mill.; Eucalyptus L'Hér.
2017,2017-10-08,Braga,Vila Nova de Famalicão,Portela,Carvalhais (Av. do Paço 78. 4770 Portela. Portugal),41.4586111111111,-8.44166666666667,Reacendimento,228.0,2017-10-08T07:00,16.3,24,-4.4,11.7,0.0,0.0,0.0,0.0,0,1018.5,991.5,0,0,0,0,0.14,1.41,13.2,26.9,112,110,25.9,16.8,19.8,20.3,20.3,0.112,0.163,0.23,0.305,1,0.0,10.7,2.7,8.1,30.8,3.5,77.5,4.0,1.0,3.0,15.5,4.0,28.9,Pinus pinaster Aiton; Tracheophyta; Eucalyptus L'Hér.; Magnoliopsida; 
2017,2017-10-08,Braga,Fafe,Moreira do Rei,L. Povoação (Moiro),41.4660670004951,-8.08340799999734,Reacendimento,702.0,2017-10-08T08:00,16.4,30,-1.3,13.2,0.0,0.0,0.0,0.0,0,1020.5,940.0,0,0,0,0,0.09,1.31,5.9,11.3,101,99,18.7,13.4,17.1,18.8,18.5,0.1,0.15,0.213,0.312,1,3419.54,186.7,121.8,64.9,490.4,181.3,340.5,118.0,77.0,41.0,476.1,118.0,215.2,Tracheophyta; Magnoliopsida
2017,2017-10-08,Braga,Vizela,Santa Eulália,R. carreira chã (Casal),41.3502649999989,-8.30992499987284,NC,307.0,2017-10-08T12:00,28.1,15,-0.7,25.5,0.0,0.0,0.0,0.0,0,1019.9,985.1,0,0,0,0,0.51,3.23,8.0,10.1,126,125,24.5,24.1,20.0,20.5,20.4,0.1,0.155,0.217,0.294,1,3600.0,699.8,600.3,99.5,891.5,699.8,922.9,682.0,585.0,97.0,891.5,682.0,899.4,Magnoliopsida; Tracheophyta; Eucalyptus L'Hér.
2017,2017-10-08,Braga,Celorico de Basto,Gagos,S. Caetano (São Caetano),41.4328950002458,-8.01789499998093,Reacendimento,391.0,2017-10-08T13:00,28.5,15,-0.6,26.7,0.0,0.0,0.0,0.0,0,1019.4,975.4,0,0,0,0,0.49,3.3,4.0,5.1,185,176,16.2,26.6,20.0,20.7,20.4,0.085,0.143,0.205,0.304,1,3600.0,695.9,600.2,95.7,904.3,695.9,909.7,705.0,608.0,97.0,904.3,705.0,921.6,Magnoliopsida; Pinus pinaster Aiton; Tracheophyta
2017,2017-10-08,Braga,Vila Verde,Cabanelas,ER205 (ER205) Km 36 (Tv. à Rua do Monte 11. 4730-086. Portugal),41.5827777777778,-8.50222222222222,Reacendimento,47.0,2017-10-08T14:00,30.2,18,3.1,27.8,0.0,0.0,0.0,0.0,0,1018.5,1013.1,0,0,0,0,0.52,3.53,9.5,11.3,261,261,21.6,27.6,21.1,21.3,21.4,0.103,0.163,0.229,0.299,1,3600.0,623.3,532.2,91.1,879.4,623.3,829.6,657.0,561.0,96.0,879.4,657.0,874.5,Tracheophyta; Pinus pinaster Aiton; Eucalyptus L'Hér.; Vitis vinifera L.
2017,2017-10-08,Braga,Fafe,Ribeiros,r. da ponte (Paço),41.4830699994829,-8.12425199985504,NC,473.0,2017-10-08T16:00,26.7,20,1.8,23.0,0.0,0.0,0.0,0.0,0,1018.8,965.6,0,0,0,0,0.36,2.8,12.4,16.3,287,288,26.6,27.0,20.9,19.8,19.6,0.099,0.153,0.213,0.307,1,3600.0,340.8,275.4,65.3,772.7,340.8,488.7,412.0,333.0,79.0,772.7,412.0,590.8,Tracheophyta; Eucalyptus L'Hér.; Magnoliopsida
2017,2017-10-08,Braga,Braga,Morreira,Av. Portela (Alto da Moreira),41.5046729999118,-8.39026300006443,Reacendimento,373.0,2017-10-08T16:00,26.2,21,2.4,22.7,0.0,0.0,0.0,0.0,0,1018.7,976.4,0,0,0,0,0.36,2.67,12.1,16.3,287,288,27.4,26.5,20.8,19.9,19.8,0.103,0.162,0.227,0.307,1,3600.0,341.1,275.7,65.4,770.5,341.1,490.6,412.0,333.0,79.0,770.5,412.0,592.5,Eucalyptus L'Hér.; Pinus pinaster Aiton; Tracheophyta; Magnoliopsida; Pinus pinea L.
2017,2017-10-08,Braga,Vila Nova de Famalicão,Arnoso (Santa Maria),Vale (Laje),41.468885000017,-8.49772999975416,Desconhecida,145.0,2017-10-08T17:00,23.9,29,5.0,22.0,0.0,0.0,0.0,0.0,0,1018.9,1002.1,0,0,0,0,0.16,2.1,4.9,10.0,287,296,18.7,25.6,21.5,20.4,20.6,0.111,0.16,0.229,0.296,1,3600.0,161.7,119.4,42.3,632.2,161.7,258.9,237.0,175.0,62.0,632.2,237.0,379.5,Eucalyptus L'Hér.; Tracheophyta; Vitis vinifera L.
2017,2017-03-14,Braga,Vila Nova de Famalicão,Vale (São Cosme),R. BOCA (Matagal),41.4515000000265,-8.46082200050354,Desconhecida,165.0,2017-03-14T16:00,21.3,44,8.6,18.4,0.0,0.0,0.0,0.0,0,1023.9,1004.5,0,0,0,0,0.35,1.41,17.3,26.8,73,75,42.1,17.8,13.4,12.4,11.6,0.334,0.357,0.388,0.379,1,3600.0,436.4,350.2,86.2,758.1,436.4,639.5,501.0,402.0,99.0,758.1,501.0,734.1,Tracheophyta; Eucalyptus L'Hér.
2017,2017-10-08,Braga,Fafe,Vinhós,Rua do Carvalho (VINHÓS),41.4828200001187,-8.1762309996287,NC,398.0,2017-10-08T19:00,20.4,37,5.1,18.2,0.0,0.0,0.0,0.0,0,1019.5,973.5,0,0,0,0,0.05,1.51,6.6,9.5,347,335,16.2,22.6,21.9,20.3,20.1,0.099,0.153,0.213,0.307,0,0.0,0.0,0.0,0.0,0.0,0.0,0.0,0.0,0.0,0.0,0.0,0.0,0.0,Eucalyptus L'Hér.; Magnoliopsida; Pinales; Pinus pinaster Aiton; Vitis vinifera L.; Pinus pinea L.; Tracheophyta
2017,2017-10-09,Braga,Fafe,Ribeiros,Portela (Campo do Monte),41.4900700002246,-8.12033799992667,NC,532.0,2017-10-09T01:00,12.8,55,3.9,10.3,0.0,0.0,0.0,0.0,0,1019.9,957.5,0,0,0,0,0.03,0.67,7.4,7.6,43,65,13.3,15.4,20.2,19.8,19.4,0.092,0.141,0.204,0.307,0,0.0,0.0,0.0,0.0,0.0,0.0,0.0,0.0,0.0,0.0,0.0,0.0,0.0,Pinales; Tracheophyta; Eucalyptus L'Hér.; Magnoliopsida
2017,2017-10-09,Braga,Celorico de Basto,Canedo de Basto,Padredo,41.4327119996813,-7.96798999998305,Reacendimento,250.0,2017-10-09T04:00,13.8,52,4.2,11.4,0.0,0.0,0.0,0.0,0,1019.0,989.2,0,0,0,0,0.03,0.75,7.0,10.1,69,73,13.7,16.0,20.8,21.2,21.0,0.099,0.148,0.205,0.3,0,0.0,0.0,0.0,0.0,0.0,0.0,0.0,0.0,0.0,0.0,0.0,0.0,0.0,Eucalyptus L'Hér.; Olea europaea L.; Vitis vinifera L.; Magnoliopsida; Pinus pinaster Aiton; Tracheophyta
