year,date,district,municipality,parish,local,latitude,longitude,cause,elevation,hourly.time,hourly.temperature_2m,hourly.relative_humidity_2m,hourly.dew_point_2m,hourly.apparent_temperature,hourly.precipitation,hourly.rain,hourly.snowfall,hourly.snow_depth,hourly.weather_code,hourly.pressure_msl,hourly.surface_pressure,hourly.cloud_cover,hourly.cloud_cover_low,hourly.cloud_cover_mid,hourly.cloud_cover_high,hourly.et0_fao_evapotranspiration,hourly.vapour_pressure_deficit,hourly.wind_speed_10m,hourly.wind_speed_100m,hourly.wind_direction_10m,hourly.wind_direction_100m,hourly.wind_gusts_10m,hourly.soil_temperature_0_to_7cm,hourly.soil_temperature_7_to_28cm,hourly.soil_temperature_28_to_100cm,hourly.soil_temperature_100_to_255cm,hourly.soil_moisture_0_to_7cm,hourly.soil_moisture_7_to_28cm,hourly.soil_moisture_28_to_100cm,hourly.soil_moisture_100_to_255cm,hourly.is_day,hourly.sunshine_duration,hourly.shortwave_radiation_instant,hourly.direct_radiation_instant,hourly.diffuse_radiation_instant,hourly.direct_normal_irradiance_instant,hourly.global_tilted_irradiance_instant,hourly.terrestrial_radiation_instant,hourly.shortwave_radiation,hourly.direct_radiation,hourly.diffuse_radiation,hourly.direct_normal_irradiance,hourly.global_tilted_irradiance,hourly.terrestrial_radiation,scientificNames
2018,2018-10-27,Lisboa,Torres Vedras,Ramalhal,RAMALHAL,39.1398659997516,-9.22032899989022,NC,48.0,2018-10-27T23:00,11.1,66,4.9,5.6,0.0,0.0,0.0,0.0,2,1010.2,1004.4,76,24,74,35,0.07,0.45,29.2,44.0,344,345,52.9,13.6,17.6,20.0,21.3,0.142,0.177,0.232,0.302,0,0.0,0.0,0.0,0.0,0.0,0.0,0.0,0.0,0.0,0.0,0.0,0.0,0.0,Eucalyptus L'Hér.; Pinus pinaster Aiton; Magnoliopsida; Tracheophyta; Vitis vinifera L.; Pinales; Quercus suber L.; 
2018,2018-10-29,Lisboa,Vila Franca de Xira,Vialonga,Casal dos Estanques (Quinta da Flamenga),38.8780169995626,-9.08726199997796,NC,109.0,2018-10-29T14:00,14.3,49,3.8,9.4,0.0,0.0,0.0,0.0,3,1011.5,998.5,89,33,52,93,0.21,0.83,23.6,32.3,304,305,50.0,16.1,14.9,19.5,21.4,0.126,0.162,0.216,0.047,1,1974.47,247.5,67.8,179.7,125.8,247.5,746.8,263.0,72.0,191.0,125.8,263.0,793.6,Tracheophyta; Magnoliopsida; Pinus pinea L.; Olea europaea L.; Pinus pinaster Aiton; Pinales; 
2018,2018-02-25,Lisboa,Alenquer,Ota,ota (Porto dos Toiros),39.1334519999971,-8.94392699983385,NC,35.0,2018-02-25T15:00,19.4,32,2.4,15.9,0.0,0.0,0.0,0.0,1,1009.4,1005.3,35,3,7,95,0.39,1.52,14.6,18.1,160,159,30.6,19.4,12.0,12.4,13.6,0.094,0.2,0.189,0.229,1,3600.0,557.2,460.5,96.7,844.0,557.2,761.9,605.0,500.0,105.0,844.0,605.0,827.2,Quercus suber L.; Magnoliopsida; Vitis vinifera L.; Pinus pinea L.; Tracheophyta
2018,2018-02-25,Lisboa,Sintra,São João das Lampas,Praia da Vigia (Assafora),38.9056139998966,-9.40464200019836,NC,121.0,2018-02-25T22:00,11.0,88,9.1,8.9,0.0,0.0,0.0,0.0,0,1009.1,994.5,5,1,1,12,0.0,0.16,13.0,27.9,146,156,21.6,11.0,12.1,11.6,13.1,0.182,0.266,0.311,0.306,0,0.0,0.0,0.0,0.0,0.0,0.0,0.0,0.0,0.0,0.0,0.0,0.0,0.0,Tracheophyta; Magnoliopsida; Pinus pinaster Aiton; Pinus pinea L.; Vitis vinifera L.; Pinales; Olea europaea L.; 
2018,2018-02-25,Lisboa,Azambuja,Azambuja,Vale Bom (Cais da Azambuja),39.0678850000434,-8.86450599988302,NC,4.0,2018-02-25T19:00,13.3,71,8.1,11.7,0.0,0.0,0.0,0.0,1,1009.6,1009.1,24,1,2,72,0.04,0.45,7.7,18.1,229,215,27.7,15.3,13.0,12.7,14.5,0.217,0.335,0.32,0.344,0,0.0,0.0,0.0,0.0,0.0,0.0,0.0,4.0,0.0,4.0,0.0,4.0,34.5,Tracheophyta
2018,2018-11-13,Lisboa,Vila Franca de Xira,Cachoeiras,A10 KM. 11.7 (Quinta da Granja),38.9975110001034,-9.01152999983893,NC,33.0,2018-11-13T19:00,13.6,87,11.5,12.5,0.0,0.0,0.0,0.0,0,1021.8,1017.8,0,0,0,0,0.0,0.2,10.6,18.1,332,13,20.2,14.7,15.0,17.2,21.4,0.464,0.474,0.378,0.315,0,0.0,0.0,0.0,0.0,0.0,0.0,0.0,0.0,0.0,0.0,0.0,0.0,0.0,Pinus pinea L.; Magnoliopsida; Tracheophyta; Vitis vinifera L.; Eucalyptus L'Hér.; Olea europaea L.; Pinus pinaster Aiton; 
2018,2018-11-16,Lisboa,Sintra,Monte Abraão,Rua D.Dinis (Massamá),38.7554099999534,-9.27044999996821,NC,141.0,2018-11-16T00:00,13.8,92,12.5,13.2,0.0,0.0,0.0,0.0,1,1016.1,999.2,25,0,0,84,0.0,0.12,9.1,19.9,97,125,18.7,14.5,15.7,16.1,19.6,0.367,0.373,0.333,0.322,0,0.0,0.0,0.0,0.0,0.0,0.0,0.0,0.0,0.0,0.0,0.0,0.0,0.0,Tracheophyta; Magnoliopsida; 
2018,2018-11-16,Lisboa,Sintra,São João das Lampas,Santa Susana,38.9112659994761,-9.38168599976434,NC,150.0,2018-11-16T14:00,18.8,72,13.6,17.1,0.0,0.0,0.0,0.0,0,1013.7,996.1,1,1,0,0,0.26,0.61,19.2,25.1,142,142,34.9,18.7,15.4,16.2,19.9,0.345,0.364,0.323,0.331,1,3600.0,454.9,372.5,82.4,796.1,454.9,654.5,486.0,398.0,88.0,796.1,486.0,699.3,Tracheophyta; Magnoliopsida; Pinus pinaster Aiton; Pinus pinea L.; Vitis vinifera L.; Pinales; Olea europaea L.; 
2018,2018-11-16,Lisboa,Loures,Bucelas,Serra de Alrrota (Vila Nova),38.9207620000839,-9.14548599984911,NC,161.0,2018-11-16T15:00,18.3,74,13.5,17.7,0.0,0.0,0.0,0.0,0,1013.8,994.9,3,3,0,0,0.2,0.56,11.8,15.8,153,153,24.8,18.0,14.7,15.5,20.3,0.336,0.351,0.258,0.048,1,3600.0,315.5,239.0,76.5,656.7,315.5,509.2,363.0,275.0,88.0,656.7,363.0,585.8,Magnoliopsida; Tracheophyta; Olea europaea L.; Pinus pinea L.; Pinus pinaster Aiton; Eucalyptus L'Hér.; Vitis vinifera L.; 
2018,2018-11-16,Lisboa,Vila Franca de Xira,Vialonga,R FONTE SANTA 553 POVOA_STA_IRIA VIALONGA LSB#VILA_FRANCA_XIRA 2625: ESTE (Quinta da Flamenga),38.8780169995626,-9.08726199997796,NC,109.0,2018-11-16T15:00,18.6,74,13.8,18.2,0.0,0.0,0.0,0.0,0,1013.8,1001.0,3,3,0,0,0.2,0.57,11.8,15.8,153,153,24.8,18.4,15.1,15.9,20.6,0.336,0.351,0.258,0.048,1,3600.0,315.5,239.0,76.5,656.7,315.5,509.2,363.0,275.0,88.0,656.7,363.0,585.8,Tracheophyta; Magnoliopsida; Pinus pinea L.; Olea europaea L.; Pinus pinaster Aiton; Pinales; 
2018,2018-11-17,Lisboa,Alenquer,Vila Verde Dos Francos,Rodeio,39.1740610000822,-9.12501600000593,NC,123.0,2018-11-17T20:00,15.4,86,13.1,12.3,0.1,0.1,0.0,0.0,51,1003.8,989.3,99,15,93,98,0.03,0.24,27.7,44.7,128,131,47.2,15.0,15.3,16.2,19.9,0.347,0.355,0.315,0.31,0,0.0,0.0,0.0,0.0,0.0,0.0,0.0,0.0,0.0,0.0,0.0,0.0,0.0,Eucalyptus L'Hér.; Magnoliopsida; Vitis vinifera L.; Tracheophyta
2018,2018-11-22,Lisboa,Torres Vedras,Torres Vedras (São Pedro e São Tiago),Olheiros (Torres Vedras),39.0918290000492,-9.25195200006167,NC,32.0,2018-11-22T19:00,11.5,88,9.5,10.3,0.1,0.1,0.0,0.0,51,1013.7,1009.8,61,22,25,86,0.0,0.17,6.6,15.2,221,234,17.6,12.8,14.0,16.2,19.8,0.395,0.381,0.314,0.301,0,0.0,0.0,0.0,0.0,0.0,0.0,0.0,0.0,0.0,0.0,0.0,0.0,0.0,Tracheophyta; Magnoliopsida; Olea europaea L.; Vitis vinifera L.
2018,2018-11-22,Lisboa,Odivelas,Caneças,Rua da Fonte Santa (CANEÇAS),38.8110579999288,-9.22451699998644,NC,223.0,2018-11-22T19:00,9.9,94,9.0,9.0,0.0,0.0,0.0,0.0,2,1013.9,987.0,54,17,15,100,0.0,0.07,4.8,11.8,193,220,13.0,11.9,13.0,15.3,19.2,0.404,0.392,0.318,0.284,0,0.0,0.0,0.0,0.0,0.0,0.0,0.0,0.0,0.0,0.0,0.0,0.0,0.0,Eucalyptus L'Hér.; Tracheophyta; Magnoliopsida; Olea europaea L.; Pinus pinea L.; 
2018,2018-02-25,Lisboa,Oeiras,Carnaxide,Rua Dr Vitor Sá Machado (Hospital de Santa Cruz),38.7272009997898,-9.23358700000577,NC,121.0,2018-02-25T18:00,13.4,79,9.9,12.6,0.0,0.0,0.0,0.0,0,1009.4,995.0,12,2,2,29,0.05,0.32,5.8,14.3,202,192,21.6,14.3,12.0,11.9,13.2,0.208,0.237,0.257,0.29,1,3537.08,44.0,21.8,22.2,249.8,43.5,96.6,105.0,52.0,53.0,311.4,105.0,230.8,Tracheophyta; Magnoliopsida; Pinus pinea L.; Vitis vinifera L.; Eucalyptus L'Hér.; Olea europaea L.; Pinus pinaster Aiton
2018,2018-02-25,Lisboa,Sintra,São João das Lampas,Catrivana / PNSC (Catribana),38.8937800004747,-9.4159560002221,Desconhecida,90.0,2018-02-25T17:00,15.2,63,8.2,12.4,0.0,0.0,0.0,0.0,1,1009.5,998.8,41,13,13,72,0.16,0.64,16.2,22.3,181,179,29.5,15.9,12.1,11.7,13.3,0.181,0.266,0.311,0.306,1,3600.0,205.7,128.1,77.6,495.2,205.7,361.2,273.0,170.0,103.0,495.2,273.0,479.4,Tracheophyta; Magnoliopsida; Pinus pinaster Aiton; Pinus pinea L.; Vitis vinifera L.; Pinales; Olea europaea L.; 
2018,2018-12-09,Lisboa,Azambuja,Vila Nova da Rainha,VILA NOVA DA RAINHA (Casal do Ouro),39.0358410000801,-8.94271000014411,NC,2.0,2018-12-09T21:00,12.3,96,11.7,11.5,0.0,0.0,0.0,0.0,1,1029.7,1029.5,29,0,0,97,0.0,0.06,9.5,15.5,335,356,18.4,12.6,13.4,14.9,19.7,0.429,0.445,0.425,0.334,0,0.0,0.0,0.0,0.0,0.0,0.0,0.0,0.0,0.0,0.0,0.0,0.0,0.0,Tracheophyta; Oryza sativa L.
2018,2018-12-10,Lisboa,Azambuja,Vila Nova da Rainha,A1 PK35 LISBOA PORTO (Casal do Ouro),39.0358410000801,-8.94271000014411,NC,2.0,2018-12-10T04:00,9.4,93,8.4,7.7,0.0,0.0,0.0,0.0,1,1028.2,1028.0,27,3,0,82,0.0,0.08,8.9,19.4,21,47,15.8,10.8,12.9,14.9,19.7,0.43,0.444,0.425,0.334,0,0.0,0.0,0.0,0.0,0.0,0.0,0.0,0.0,0.0,0.0,0.0,0.0,0.0,Tracheophyta; Oryza sativa L.
2018,2018-12-10,Lisboa,Loures,Loures,R AMOREIRAS (Sete Casas),38.8411799997754,-9.17024900012546,NC,34.0,2018-12-10T14:00,17.7,72,12.6,17.2,0.0,0.0,0.0,0.0,1,1024.4,1020.3,29,0,0,96,0.22,0.56,9.1,12.4,56,64,23.0,16.7,13.7,14.8,19.8,0.316,0.332,0.302,0.086,1,3600.0,381.0,275.2,105.8,659.4,381.0,588.7,407.0,294.0,113.0,659.4,407.0,628.9,Tracheophyta
2018,2018-12-10,Lisboa,Sintra,São Marcos,Venda Seca (Alto da Boavista),38.7618819999695,-9.30415500005086,NC,187.0,2018-12-10T15:00,18.0,63,10.9,16.6,0.0,0.0,0.0,0.0,1,1023.5,1001.3,28,0,0,94,0.19,0.75,10.9,18.2,98,98,27.0,16.3,13.7,14.1,17.4,0.343,0.358,0.379,0.331,1,3600.0,279.8,186.2,93.5,571.5,279.8,459.6,323.0,215.0,108.0,571.5,323.0,530.6,Tracheophyta; Magnoliopsida; 
2018,2018-12-11,Lisboa,Sintra,Almargem do Bispo,Dona Maria (TAPADA),38.8188350000646,-9.2591770002577,NC,275.0,2018-12-11T07:00,9.6,94,8.7,8.8,0.0,0.0,0.0,0.0,1,1022.4,989.1,38,8,2,97,0.0,0.07,3.4,5.2,108,205,5.8,9.8,12.2,13.6,17.2,0.337,0.351,0.357,0.289,0,0.0,0.0,0.0,0.0,0.0,0.0,0.0,0.0,0.0,0.0,0.0,0.0,0.0,Tracheophyta; Magnoliopsida; Pinus pinaster Aiton; Eucalyptus L'Hér.; Vitis vinifera L.; 
2018,2018-12-11,Lisboa,Sintra,Almargem do Bispo,OLELAS,38.8402139997482,-9.28370000001457,NC,267.0,2018-12-11T20:00,10.9,100,10.9,10.2,0.0,0.0,0.0,0.0,3,1024.5,992.2,89,99,0,0,0.0,0.0,7.2,16.9,354,348,14.8,12.1,12.9,13.6,16.6,0.34,0.353,0.378,0.336,0,0.0,0.0,0.0,0.0,0.0,0.0,0.0,0.0,0.0,0.0,0.0,0.0,0.0,Tracheophyta; Magnoliopsida; Pinus pinaster Aiton; Eucalyptus L'Hér.; Vitis vinifera L.; 
2018,2018-12-11,Lisboa,Sintra,Almargem do Bispo,Dona Maria (TAPADA),38.8188350000646,-9.2591770002577,NC,275.0,2018-12-11T08:00,9.2,97,8.7,8.3,0.0,0.0,0.0,0.0,1,1022.7,989.3,34,5,0,98,0.01,0.04,4.1,5.8,105,180,6.8,9.7,12.1,13.6,17.2,0.337,0.35,0.357,0.289,1,0.0,3.9,0.0,3.9,0.0,0.6,41.5,1.0,0.0,1.0,0.0,1.0,10.6,Tracheophyta; Magnoliopsida; Pinus pinaster Aiton; Eucalyptus L'Hér.; Vitis vinifera L.; 
2018,2018-12-12,Lisboa,Sintra,Almargem do Bispo,OLELAS,38.8348399999407,-9.28987199995253,NC,210.0,2018-12-12T19:00,13.9,97,13.4,12.6,0.8,0.8,0.0,0.0,53,1019.6,994.5,100,28,100,100,0.0,0.05,16.0,27.3,234,239,36.7,13.6,13.4,14.0,17.0,0.36,0.35,0.376,0.336,0,0.0,0.0,0.0,0.0,0.0,0.0,0.0,0.0,0.0,0.0,0.0,0.0,0.0,Tracheophyta; Magnoliopsida; Pinus pinaster Aiton; Eucalyptus L'Hér.; Vitis vinifera L.; 
2018,2018-02-26,Lisboa,Lourinhã,Lourinhã,Casal da Murta,39.2766779994965,-9.32210199991862,Desconhecida,62.0,2018-02-26T10:00,13.0,54,3.9,6.9,0.0,0.0,0.0,0.0,1,1003.9,996.5,49,7,23,96,0.2,0.69,32.1,46.1,108,109,53.3,11.5,11.0,11.7,12.7,0.093,0.162,0.192,0.2,1,3600.0,364.3,195.8,168.5,417.3,364.3,654.8,307.0,165.0,142.0,417.3,307.0,551.9,Tracheophyta; Magnoliopsida; Acacia Mill.
2018,2018-12-15,Lisboa,Amadora,Mina,TV AMIGOS CARENQUE 40 AMADORA MINA_AGUA LSB#AMADORA 2700-053: ESTE (Praceta da Quinta do Pomar de Cima),38.7705439999368,-9.2530650001102,NC,144.0,2018-12-15T14:00,15.7,73,10.9,12.6,0.0,0.0,0.0,0.0,3,1026.3,1009.0,90,100,0,0,0.17,0.48,23.3,34.0,219,219,51.1,14.8,13.1,14.3,17.8,0.361,0.371,0.362,0.285,1,3600.0,282.4,178.3,104.2,427.8,282.4,588.3,301.0,190.0,111.0,427.8,301.0,627.0,Tracheophyta; Magnoliopsida; Eucalyptus L'Hér.; 
2018,2018-12-16,Lisboa,Arruda Dos Vinhos,Arruda Dos Vinhos,Parque das Rotas (ARRUDA),38.9834970000055,-9.07598299980164,NC,96.0,2018-12-16T11:00,14.4,73,9.6,10.9,0.0,0.0,0.0,0.0,1,1025.9,1014.3,42,15,3,89,0.15,0.45,23.5,33.2,293,294,51.1,14.3,14.1,14.7,18.6,0.394,0.349,0.315,0.231,1,3600.0,314.8,194.9,119.9,477.4,314.8,576.6,281.0,174.0,107.0,477.4,281.0,514.7,Tracheophyta; Vitis vinifera L.
2018,2018-12-16,Lisboa,Amadora,Venteira,IC-19 Sintra - Lisboa (Praceta Dona Filipa de Lencastre),38.7550770001941,-9.24096500025855,NC,142.0,2018-12-16T17:00,13.0,80,9.6,11.7,0.0,0.0,0.0,0.0,0,1026.8,1009.6,4,4,0,0,0.04,0.31,8.1,17.2,302,307,24.5,14.8,14.6,14.4,17.7,0.392,0.387,0.362,0.285,1,2767.05,22.1,12.7,9.5,145.2,19.0,47.0,77.0,44.0,33.0,326.6,77.0,163.6,Tracheophyta; Magnoliopsida; 
2018,2018-02-26,Lisboa,Torres Vedras,São Pedro da Cadeira,Escravelheira (Casal da Azenha de Baixo),39.07,-9.39056000020769,NC,24.0,2018-02-26T11:00,15.2,53,5.7,9.1,0.0,0.0,0.0,,1,1002.5,999.7,46,0,30,95,0.25,0.81,34.4,46.9,108,109,58.0,13.0,11.6,12.2,13.6,0.222,0.279,0.311,0.312,1,3600.0,416.4,186.2,230.2,317.8,416.4,817.8,378.0,169.0,209.0,317.8,378.0,742.4,Magnoliopsida; Tracheophyta; Vitis vinifera L.; Eucalyptus L'Hér.; 
2018,2018-12-23,Lisboa,Sintra,Colares,R CAMPO BOLA (Moinhos da Azoia),38.7723839998245,-9.47972800042894,NC,228.0,2018-12-23T15:00,14.5,73,9.7,12.8,0.0,0.0,0.0,0.0,1,1027.8,1000.4,31,1,0,100,0.16,0.44,11.5,16.4,141,142,28.1,13.0,11.3,13.0,16.2,0.368,0.382,0.383,0.336,1,3600.0,271.6,147.6,124.0,446.1,271.6,467.8,311.0,169.0,142.0,446.1,311.0,535.6,Tracheophyta; Magnoliopsida; Pinus pinaster Aiton; Pinales; Pinus pinea L.; Eucalyptus L'Hér.; Vitis vinifera L.; Acacia Mill.; 
2018,2018-12-30,Lisboa,Sintra,Sintra (Santa Maria e São Miguel),Monte de Manique (ER247 (ER247) Km 72),38.802870999972,-9.38185800022549,NC,203.0,2018-12-30T09:00,8.9,69,3.6,4.5,0.0,0.0,0.0,0.0,0,1028.0,1003.1,0,0,0,0,0.05,0.35,19.3,35.3,69,72,39.6,9.1,10.9,13.0,16.0,0.347,0.359,0.379,0.339,1,2076.49,109.7,64.6,45.0,390.3,77.4,234.2,56.0,33.0,23.0,275.4,56.0,119.6,Tracheophyta; Magnoliopsida
2018,2018-12-30,Lisboa,Mafra,Santo Estêvão das Galés,Choutaria (Casal do Moinho),38.8766889995999,-9.25063100000223,NC,184.0,2018-12-30T13:00,13.6,63,6.8,9.9,0.0,0.0,0.0,0.0,0,1026.5,1004.3,0,0,0,0,0.23,0.57,19.7,27.3,82,81,38.5,12.1,10.6,13.2,16.6,0.338,0.356,0.373,0.317,1,3600.0,464.8,381.8,83.0,819.8,464.8,658.7,465.0,382.0,83.0,819.8,465.0,659.1,Tracheophyta; Magnoliopsida; Eucalyptus L'Hér.; Quercus suber L.; Pinus pinaster Aiton
2018,2018-12-31,Lisboa,Torres Vedras,Monte Redondo,MONTE REDONDO,39.1157530000475,-9.19798999998305,NC,115.0,2018-12-31T23:00,7.3,87,5.3,5.0,0.0,0.0,0.0,0.0,1,1030.9,1016.6,27,0,0,90,0.0,0.13,7.9,13.0,90,96,13.3,7.6,10.6,13.1,16.9,0.325,0.346,0.356,0.298,0,0.0,0.0,0.0,0.0,0.0,0.0,0.0,0.0,0.0,0.0,0.0,0.0,0.0,Eucalyptus L'Hér.; Tracheophyta; Magnoliopsida; Vitis vinifera L.; Pinales; Pinus pinaster Aiton; 
2018,2018-03-27,Lisboa,Torres Vedras,Maxial,Casais da Valentina (Vale Murteira),39.1646259996626,-9.17211700015598,Desconhecida,85.0,2018-03-27T15:00,17.0,62,9.7,15.4,0.0,0.0,0.0,0.0,0,1028.2,1018.0,0,0,0,0,0.38,0.74,17.6,23.0,349,351,36.0,18.5,13.6,12.1,12.6,0.342,0.375,0.375,0.279,1,3600.0,690.5,580.7,109.8,869.2,690.5,918.3,742.0,624.0,118.0,869.2,742.0,986.7,Eucalyptus L'Hér.; Tracheophyta; Magnoliopsida; Vitis vinifera L.; Pinales; Pinus pinaster Aiton; 
2018,2018-03-27,Lisboa,Azambuja,Aveiras de Baixo,EN3 Casais da Amendoeira (Quinta da Guarita),39.0910050000085,-8.85335500001907,Desconhecida,14.0,2018-03-27T15:00,20.2,56,11.2,18.7,0.0,0.0,0.0,0.0,0,1027.4,1025.7,0,0,0,0,0.43,1.04,19.2,24.7,337,339,37.4,19.7,14.2,12.6,13.3,0.284,0.319,0.258,0.229,1,3600.0,686.3,576.5,109.7,864.8,686.3,916.3,738.0,620.0,118.0,864.8,738.0,985.4,Quercus suber L.; Magnoliopsida; Pinus pinea L.; Tracheophyta
2018,2018-03-27,Lisboa,Torres Vedras,Torres Vedras (Santa Maria do Castelo e São Miguel),Casais dos Amiais,39.1098510000441,-9.25108200000392,NC,40.0,2018-03-27T16:00,15.6,70,10.1,13.3,0.0,0.0,0.0,0.0,0,1028.0,1023.1,0,0,0,0,0.29,0.54,18.6,23.9,350,354,36.4,18.2,14.3,12.6,13.0,0.345,0.379,0.386,0.287,1,3600.0,535.1,438.0,97.1,819.3,535.1,734.8,606.0,496.0,110.0,819.3,606.0,832.1,Tracheophyta; Eucalyptus L'Hér.; Magnoliopsida
2018,2018-03-27,Lisboa,Azambuja,Alcoentre,Vale das Éguas (Águas do Frade),39.2261099995507,-8.96694000000755,Desconhecida,95.0,2018-03-27T18:00,14.4,73,9.7,11.9,0.0,0.0,0.0,0.0,0,1026.5,1015.0,0,0,0,0,0.12,0.44,17.2,26.7,327,333,33.8,17.1,14.6,12.2,12.7,0.281,0.318,0.265,0.239,1,3600.0,137.4,94.9,42.4,564.2,137.4,231.3,217.0,150.0,67.0,564.2,217.0,365.4,Pinus pinaster Aiton; Eucalyptus L'Hér.; Tracheophyta; Pinales; Pinus pinea L.; Vitis vinifera L.
2018,2018-03-31,Lisboa,Torres Vedras,Maxial,Ermegeira (EN 115),39.1324200005001,-9.19475399971008,Desconhecida,68.0,2018-03-31T16:00,14.4,59,6.5,11.6,0.0,0.0,0.0,0.0,1,1018.4,1010.2,35,3,6,96,0.29,0.67,13.8,16.5,255,254,27.0,17.4,13.1,12.6,12.9,0.33,0.345,0.352,0.266,1,3600.0,509.6,374.2,135.4,684.8,509.6,749.4,576.0,423.0,153.0,684.8,576.0,847.1,Eucalyptus L'Hér.; Tracheophyta; Magnoliopsida; Vitis vinifera L.; Pinales; Pinus pinaster Aiton; 
2018,2018-03-31,Lisboa,Torres Vedras,Maxial,Folgarosa (Folgorosa),39.1297910001543,-9.15596399996016,NC,257.0,2018-03-31T17:00,12.5,60,4.9,9.0,0.0,0.0,0.0,0.0,1,1018.3,987.6,32,3,3,92,0.2,0.58,15.5,19.6,257,256,28.8,15.4,12.2,11.4,11.7,0.328,0.345,0.352,0.266,1,3600.0,313.3,189.1,124.2,502.1,313.3,516.5,386.0,233.0,153.0,502.1,386.0,636.3,Eucalyptus L'Hér.; Tracheophyta; Magnoliopsida; Vitis vinifera L.; Pinales; Pinus pinaster Aiton; 
2018,2018-04-03,Lisboa,Vila Franca de Xira,Castanheira do Ribatejo,Rua da Estação (Casal dos Pardieiros),39.0122689999474,-8.96437699953715,Desconhecida,5.0,2018-04-03T16:00,15.2,68,9.3,10.9,0.1,0.1,0.0,0.0,51,1008.5,1007.9,49,30,37,0,0.2,0.56,28.5,41.3,245,246,64.1,16.9,14.8,13.6,14.0,0.392,0.404,0.374,0.319,1,3600.0,283.4,172.7,110.7,311.0,283.4,760.2,320.0,195.0,125.0,311.0,320.0,858.4,Pinus pinea L.; Magnoliopsida; Tracheophyta; Vitis vinifera L.; Eucalyptus L'Hér.; Olea europaea L.; Pinus pinaster Aiton; 
2018,2018-04-09,Lisboa,Sintra,São João das Lampas,Magoito,38.869740000036,-9.43069199985928,Desconhecida,123.0,2018-04-09T20:00,10.8,87,8.7,7.9,0.0,0.0,0.0,0.0,3,1015.1,1000.2,100,89,40,98,0.01,0.17,17.6,29.6,319,320,32.0,12.1,12.2,12.3,12.5,0.398,0.415,0.404,0.355,0,0.0,0.0,0.0,0.0,0.0,0.0,0.0,0.0,0.0,0.0,0.0,0.0,0.0,Tracheophyta; Magnoliopsida; Pinus pinaster Aiton; Pinus pinea L.; Vitis vinifera L.; Pinales; Olea europaea L.; 
2018,2018-04-14,Lisboa,Cascais,São Domingos de Rana,Rua dos Mandarins (Bairro Cabeço do Cação),38.7404830000136,-9.34765099949307,Desconhecida,118.0,2018-04-14T18:00,13.1,71,7.9,11.0,0.0,0.0,0.0,0.0,2,1019.9,1005.7,59,43,34,0,0.12,0.44,10.8,15.3,240,240,28.1,15.4,13.8,12.4,12.7,0.38,0.399,0.4,0.338,1,3600.0,170.0,98.3,71.6,428.3,170.0,312.3,242.0,140.0,102.0,428.3,242.0,444.6,Tracheophyta; Magnoliopsida
2018,2018-01-23,Lisboa,Torres Vedras,Torres Vedras (São Pedro e São Tiago),VARATOJO,39.0871009998851,-9.27499200026194,Desconhecida,160.0,2018-01-23T13:00,12.9,85,10.4,10.7,0.0,0.0,0.0,0.0,3,1030.0,1010.5,94,78,0,79,0.14,0.23,16.3,21.0,5,6,30.2,12.2,11.4,12.2,14.2,0.331,0.339,0.296,0.272,1,2775.18,324.3,79.6,244.7,152.5,324.3,736.7,322.0,79.0,243.0,152.5,322.0,731.4,Vitis vinifera L.; Tracheophyta; Magnoliopsida
2018,2018-01-23,Lisboa,Torres Vedras,Runa,Quinta do Cascavelo (Runa),39.0732980002297,-9.21121699968974,NC,51.0,2018-01-23T17:00,13.0,88,11.1,11.4,0.0,0.0,0.0,0.0,0,1029.1,1022.9,3,1,0,6,0.06,0.18,13.1,19.8,352,359,29.2,13.8,12.7,13.0,15.1,0.317,0.329,0.274,0.266,1,3600.0,98.8,61.0,37.8,481.4,98.8,178.9,162.0,100.0,62.0,481.4,162.0,293.3,Vitis vinifera L.; Eucalyptus L'Hér.; Magnoliopsida; Tracheophyta; 
2018,2018-04-17,Lisboa,Sintra,Almargem do Bispo,Covas de Ferro (Corgas),38.8629660002391,-9.25987300025092,Desconhecida,251.0,2018-04-17T16:00,19.6,43,6.7,18.3,0.0,0.0,0.0,0.0,1,1022.1,992.7,27,0,0,91,0.41,1.3,7.9,9.8,137,144,23.4,18.5,13.6,11.8,11.9,0.346,0.372,0.377,0.275,1,3600.0,600.9,498.2,102.7,832.6,600.9,812.6,673.0,558.0,115.0,832.6,673.0,910.2,Tracheophyta; Magnoliopsida; Pinus pinaster Aiton; Eucalyptus L'Hér.; Vitis vinifera L.; 
2018,2018-01-23,Lisboa,Torres Vedras,Torres Vedras (Santa Maria do Castelo e São Miguel),Sarge,39.1046569999059,-9.22903500027127,NC,90.0,2018-01-23T18:00,10.6,95,9.9,9.2,0.0,0.0,0.0,0.0,0,1029.2,1018.1,7,1,0,21,0.01,0.06,9.4,19.5,353,2,20.9,12.6,12.4,12.6,14.7,0.328,0.338,0.296,0.272,0,652.99,0.0,0.0,0.0,0.0,0.0,0.0,27.0,13.0,14.0,130.4,27.0,80.3,Vitis vinifera L.; Eucalyptus L'Hér.; Magnoliopsida; Tracheophyta
2018,2018-04-18,Lisboa,Alenquer,Abrigada,ATOUGUIA (Atouguia das Cabras),39.125,-9.01,Desconhecida,58.0,2018-04-18T14:00,23.4,49,12.0,24.4,0.0,0.0,0.0,0.0,0,1019.8,1013.0,0,0,0,0,0.58,1.48,11.2,13.7,178,177,24.8,22.4,15.5,13.3,13.0,0.312,0.353,0.332,0.245,1,3600.0,863.2,738.4,124.8,889.6,863.2,1126.7,892.0,763.0,129.0,889.6,892.0,1164.3,Magnoliopsida; Vitis vinifera L.; Pinus pinaster Aiton; Eucalyptus L'Hér.; Olea europaea L.; Tracheophyta
2018,2018-04-18,Lisboa,Alenquer,Alenquer (Triana),Casal do Pancas (Triana),39.05424200005,-9.00791800022125,Desconhecida,27.0,2018-04-18T20:00,15.3,80,11.9,13.8,0.0,0.0,0.0,0.0,0,1019.9,1016.6,0,0,0,0,0.04,0.35,14.1,26.6,302,308,25.2,17.9,17.5,13.6,13.2,0.29,0.338,0.299,0.241,0,0.0,0.0,0.0,0.0,0.0,0.0,0.0,2.0,0.0,2.0,0.0,2.0,16.2,Magnoliopsida; Tracheophyta
2018,2018-04-19,Lisboa,Oeiras,Oeiras e São Julião da Barra,AV DOM JOAO I 10 (Santo Amaro),38.6867999998728,-9.3122649998135,Desconhecida,28.0,2018-04-19T13:00,22.3,61,14.4,24.9,0.0,0.0,0.0,0.0,1,1016.9,1013.6,29,0,0,98,0.49,1.05,1.9,2.3,202,141,15.5,21.3,16.0,14.1,13.7,0.337,0.36,0.38,0.293,1,3600.0,756.7,411.3,345.4,465.6,756.7,1198.5,758.0,412.0,346.0,465.6,758.0,1200.6,Pinus pinea L.; Magnoliopsida; Tracheophyta; Vitis vinifera L.; Eucalyptus L'Hér.; Olea europaea L.; Pinus pinaster Aiton
2018,2018-04-19,Lisboa,Torres Vedras,Maxial,Ereira,39.1160959996118,-9.15984100023906,NC,273.0,2018-04-19T15:00,18.8,72,13.7,17.4,0.0,0.0,0.0,0.0,2,1016.6,984.7,53,9,25,100,0.29,0.6,17.5,22.1,351,354,31.7,20.4,15.2,12.4,11.6,0.308,0.352,0.386,0.278,1,3600.0,472.2,205.7,266.5,278.6,472.2,1001.8,505.0,220.0,285.0,278.6,505.0,1071.4,Eucalyptus L'Hér.; Tracheophyta; Magnoliopsida; Vitis vinifera L.; Pinales; Pinus pinaster Aiton; 
2018,2018-04-25,Lisboa,Alenquer,Alenquer (Triana),A10  S/N (Triana),39.05424200005,-9.00791800022125,NC,27.0,2018-04-25T15:00,19.8,67,13.4,17.5,0.0,0.0,0.0,0.0,0,1016.7,1013.5,0,0,0,1,0.41,0.77,30.4,40.9,334,335,54.7,22.5,18.3,15.8,13.4,0.258,0.306,0.297,0.241,1,3600.0,752.4,628.9,123.5,835.7,752.4,1017.5,804.0,672.0,132.0,835.7,804.0,1087.3,Magnoliopsida; Tracheophyta
2018,2018-04-26,Lisboa,Sobral de Monte Agraço,Sapataria,Ferreira (SAPATARIA),38.9662319999271,-9.19805299970839,NC,175.0,2018-04-26T21:00,10.9,92,9.6,7.3,0.0,0.0,0.0,0.0,0,1019.4,998.2,4,3,0,6,0.01,0.1,23.8,39.1,335,340,46.1,14.5,16.2,14.6,12.5,0.3,0.342,0.373,0.291,0,0.0,0.0,0.0,0.0,0.0,0.0,0.0,0.0,0.0,0.0,0.0,0.0,0.0,Tracheophyta; Olea europaea L.; Magnoliopsida
2018,2018-01-01,Lisboa,Azambuja,Alcoentre,Espinheira,39.2056910000907,-8.99675500022041,Desconhecida,104.0,2018-01-01T18:00,11.7,91,10.2,10.6,0.0,0.0,0.0,0.0,1,1034.4,1021.6,45,28,0,66,0.02,0.13,7.6,18.8,267,274,28.1,12.1,11.9,13.3,16.1,0.301,0.286,0.208,0.25,0,0.0,0.0,0.0,0.0,0.0,0.0,0.0,4.0,1.0,3.0,15.7,4.0,28.9,Magnoliopsida; Tracheophyta; Eucalyptus L'Hér.; Vitis vinifera L.
2018,2018-04-30,Lisboa,Torres Vedras,Silveira,Casal das Figueiras Velhas (Portelinhas),39.1104490004645,-9.37016800006231,NC,53.0,2018-04-30T12:00,13.5,71,8.3,11.5,0.0,0.0,0.0,,2,1017.7,1011.3,60,35,45,6,0.32,0.45,15.3,18.9,255,257,34.2,15.9,13.1,14.5,13.4,0.354,0.339,0.372,0.32,1,3600.0,706.0,449.4,256.5,497.6,706.0,1218.2,688.0,438.0,250.0,497.6,688.0,1187.2,Tracheophyta; Magnoliopsida; Vitis vinifera L.; Eucalyptus L'Hér.; 
2018,2018-05-01,Lisboa,Torres Vedras,A Dos Cunhados,Casais das Figueiras Velhas (Casal das Figueiras Velhas),39.1279819997152,-9.33000199953715,NC,89.0,2018-05-01T14:00,14.5,57,6.1,11.9,0.0,0.0,0.0,0.0,1,1019.2,1008.5,34,17,0,64,0.42,0.71,22.9,28.7,323,325,43.2,17.6,13.8,14.0,13.1,0.319,0.337,0.37,0.32,1,3600.0,885.5,729.5,156.0,846.3,885.5,1162.0,914.0,753.0,161.0,846.3,914.0,1199.4,Eucalyptus L'Hér.; Tracheophyta; Vitis vinifera L.; Magnoliopsida; Pinus pinea L.; 
2018,2018-05-01,Lisboa,Sintra,São João das Lampas,Rua do Rodelo (FONTANELAS),38.8448429997762,-9.44271800041199,Desconhecida,123.0,2018-05-01T21:00,10.2,76,6.2,7.9,0.0,0.0,0.0,0.0,2,1019.2,1004.2,54,36,0,72,0.01,0.3,9.4,19.9,317,318,20.9,12.5,14.0,13.7,12.9,0.338,0.358,0.384,0.374,0,0.0,0.0,0.0,0.0,0.0,0.0,0.0,0.0,0.0,0.0,0.0,0.0,0.0,Tracheophyta; Magnoliopsida; Pinus pinaster Aiton; Pinus pinea L.; Vitis vinifera L.; Pinales; Olea europaea L.; 
2018,2018-05-03,Lisboa,Alenquer,Carnota,Santana da Carnota (CARNOTA),39.0369400000572,-9.06777999997139,Desconhecida,173.0,2018-05-03T00:00,11.1,86,8.9,9.0,0.0,0.0,0.0,0.0,0,1019.6,998.7,14,9,9,0,0.01,0.18,12.5,25.1,321,333,21.2,12.8,14.0,13.8,12.8,0.231,0.274,0.292,0.241,0,0.0,0.0,0.0,0.0,0.0,0.0,0.0,0.0,0.0,0.0,0.0,0.0,0.0,Tracheophyta; Vitis vinifera L.; Eucalyptus L'Hér.; Magnoliopsida; Olea europaea L.
2018,2018-05-03,Lisboa,Alenquer,Alenquer (Triana),Cheganças,39.082345000373,-8.98946899996863,Desconhecida,40.0,2018-05-03T01:00,11.8,87,9.6,9.7,0.0,0.0,0.0,0.0,0,1019.6,1014.7,1,0,1,0,0.01,0.18,13.8,27.5,340,346,24.5,13.2,14.7,14.7,13.7,0.231,0.274,0.292,0.241,0,0.0,0.0,0.0,0.0,0.0,0.0,0.0,0.0,0.0,0.0,0.0,0.0,0.0,Tracheophyta; Olea europaea L.; Eucalyptus L'Hér.; Vitis vinifera L.; Magnoliopsida; Pinus pinea L.
2018,2018-05-04,Lisboa,Torres Vedras,A Dos Cunhados,Casal das Paradas,39.1514320000013,-9.3269300005171,NC,44.0,2018-05-04T14:00,19.4,56,10.4,18.6,0.0,0.0,0.0,0.0,0,1014.2,1009.0,0,0,0,0,0.51,0.99,19.1,23.8,357,1,36.7,20.8,15.4,14.2,13.5,0.271,0.321,0.365,0.321,1,3600.0,905.1,771.4,133.7,888.7,905.1,1168.2,934.0,796.0,138.0,888.7,934.0,1205.5,Eucalyptus L'Hér.; Tracheophyta; Vitis vinifera L.; Magnoliopsida; Pinus pinea L.; 
