2018,2018-08-02,Setúbal,Moita,Moita,Jt Ferrotubal (Vala do Penteado),38.6320479996999,-8.95790299998389,Desconhecida,36.0,2018-08-02T12:00,36.6,26,14.1,39.4,0.0,0.0,0.0,0.0,0,1012.9,1008.9,1,0,1,0,0.7,4.52,3.9,4.1,326,322,23.0,34.3,25.3,22.2,18.7,0.065,0.082,0.122,0.134,1,3600.0,908.6,766.6,142.0,831.9,908.6,1223.8,883.0,745.0,138.0,831.9,883.0,1189.3,Tracheophyta; Pinus pinea L.; Quercus suber L.; Magnoliopsida
2018,2018-08-02,Setúbal,Moita,Alhos Vedros,Junto Estação Alhos Vedros (Bairro João da Silva),38.6499429999457,-9.02919299973382,Desconhecida,3.0,2018-08-02T15:00,39.2,26,16.3,42.0,0.0,0.0,0.0,0.0,0,1011.8,1011.5,14,0,5,37,0.7,5.22,6.8,7.3,25,20,19.8,38.9,26.5,22.4,19.3,0.065,0.084,0.139,0.168,1,3600.0,765.5,626.8,138.8,779.9,765.5,1067.4,811.0,664.0,147.0,779.9,811.0,1130.7,Tracheophyta; Magnoliopsida; Quercus suber L.
2018,2018-08-03,Setúbal,Barreiro,Santo António da Charneca,Vale Trabuco (Cidade Sol),38.6382449997796,-9.03566500001483,Desconhecida,28.0,2018-08-03T17:00,36.5,20,9.9,34.4,0.0,0.0,0.0,0.0,0,1014.9,1011.8,0,0,0,0,0.55,4.88,13.8,20.5,261,268,30.2,39.3,29.0,22.7,19.2,0.061,0.082,0.138,0.168,1,3600.0,460.1,368.3,91.9,724.2,460.1,675.5,536.0,429.0,107.0,724.2,536.0,786.9,Magnoliopsida; Tracheophyta; Quercus suber L.; Pinus pinaster Aiton; Pinus pinea L.; 
2018,2018-08-03,Setúbal,Almada,Costa da Caparica,traseiras da Rua do Juncal (Boca do Grilo),38.6441069995032,-9.22912800047133,NC,4.0,2018-08-03T22:00,31.0,25,8.7,30.2,0.0,0.0,0.0,0.0,0,1016.0,1015.5,8,0,13,0,0.04,3.37,3.1,7.7,249,349,7.6,29.4,29.2,22.7,19.3,0.057,0.095,0.148,0.205,0,0.0,0.0,0.0,0.0,0.0,0.0,0.0,0.0,0.0,0.0,0.0,0.0,0.0,Tracheophyta; Pinus pinea L.; Pinales; Magnoliopsida
2018,2018-08-06,Setúbal,Seixal,Arrentela,Estrada Baia do Seixal (Vinha da Ribeira),38.6217330000136,-9.10422800011105,NC,5.0,2018-08-06T00:00,25.9,59,17.1,27.4,0.0,0.0,0.0,0.0,0,1015.0,1014.4,0,0,0,0,0.04,1.38,6.6,17.0,13,4,12.2,30.6,30.8,23.9,19.5,0.043,0.069,0.126,0.167,0,0.0,0.0,0.0,0.0,0.0,0.0,0.0,0.0,0.0,0.0,0.0,0.0,0.0,Tracheophyta
2018,2018-08-06,Setúbal,Seixal,Amora,Rua da Liberdade (Quinta do Sol Posto),38.6082730001873,-9.11179599973891,NC,32.0,2018-08-06T00:00,25.7,58,17.0,27.2,0.0,0.0,0.0,0.0,0,1015.0,1011.3,0,0,0,0,0.04,1.37,6.6,17.0,13,4,12.2,30.4,30.7,23.8,19.3,0.043,0.069,0.126,0.167,0,0.0,0.0,0.0,0.0,0.0,0.0,0.0,0.0,0.0,0.0,0.0,0.0,0.0,Tracheophyta; Pinus pinea L.; Pinus pinaster Aiton; Magnoliopsida
2018,2018-08-06,Setúbal,Seixal,Fernão Ferro,R RIO SOURE (Redondos),38.5698360000716,-9.0708289999432,NC,50.0,2018-08-06T00:00,27.1,50,15.7,27.3,0.0,0.0,0.0,0.0,0,1014.9,1009.1,1,0,1,0,0.1,1.81,12.0,23.8,353,357,23.8,31.6,32.0,24.2,19.5,0.039,0.081,0.136,0.178,0,0.0,0.0,0.0,0.0,0.0,0.0,0.0,0.0,0.0,0.0,0.0,0.0,0.0,Tracheophyta; Magnoliopsida; Pinus pinaster Aiton
2018,2018-08-06,Setúbal,Seixal,Aldeia de Paio Pires,Quinta da Cussena (Quinta da Axorda),38.6154009999169,-9.08178799947103,NC,23.0,2018-08-06T01:00,25.7,59,17.1,26.9,0.0,0.0,0.0,0.0,0,1014.8,1012.1,0,0,0,0,0.05,1.35,8.6,18.7,2,359,16.9,29.0,30.6,23.8,19.4,0.043,0.069,0.126,0.167,0,0.0,0.0,0.0,0.0,0.0,0.0,0.0,0.0,0.0,0.0,0.0,0.0,0.0,Tracheophyta; Magnoliopsida
2018,2018-08-06,Setúbal,Seixal,Amora,Campo de treinos Contestável (Foros de Amora),38.6138799995846,-9.12886299981011,NC,33.0,2018-08-06T03:00,22.8,65,15.8,23.7,0.0,0.0,0.0,0.0,0,1014.1,1010.2,0,0,0,0,0.03,0.98,7.2,18.6,27,10,13.0,25.4,30.1,23.7,19.2,0.041,0.083,0.139,0.204,0,0.0,0.0,0.0,0.0,0.0,0.0,0.0,0.0,0.0,0.0,0.0,0.0,0.0,Tracheophyta; Magnoliopsida; Eucalyptus L'Hér.
2018,2018-08-06,Setúbal,Seixal,Amora,Campo Treino da GNR (Quinta do João Padeiro),38.6110420004527,-9.11561800003052,NC,36.0,2018-08-06T07:00,23.4,68,17.1,24.9,0.0,0.0,0.0,0.0,0,1015.3,1011.1,2,1,1,0,0.07,0.93,6.8,9.4,32,23,14.0,24.4,29.4,23.8,19.3,0.043,0.069,0.126,0.167,1,3035.41,142.8,74.8,68.0,315.1,128.7,315.6,84.0,44.0,40.0,284.0,84.0,185.7,Tracheophyta; Pinus pinea L.; Pinus pinaster Aiton; Magnoliopsida
2018,2018-08-06,Setúbal,Setúbal,Setúbal (São Sebastião),Rua do Chaparral. Poçoilos. 2910 Setúbal,38.5571499999364,-8.86112300025092,Desconhecida,36.0,2018-08-06T13:00,34.0,32,15.2,35.3,0.0,0.0,0.0,0.0,0,1014.0,1010.0,1,0,2,0,0.78,3.6,16.4,21.7,320,328,35.3,37.9,29.7,24.1,19.2,0.036,0.067,0.111,0.142,1,3600.0,917.5,773.4,144.1,836.1,917.5,1229.7,917.0,773.0,144.0,836.1,917.0,1229.1,Tracheophyta; Pinus pinea L.; Magnoliopsida; Olea europaea L.; Quercus rotundifolia Lam.
2018,2018-08-06,Setúbal,Seixal,Amora,Flor da Mata. campo de treinos da GNR (Quinta do João Padeiro),38.6107479996151,-9.11592199961344,NC,42.0,2018-08-06T17:00,27.4,47,15.1,26.3,0.0,0.0,0.0,0.0,0,1014.4,1009.6,0,0,0,0,0.43,1.94,19.1,25.1,340,339,40.0,35.9,29.5,23.9,19.3,0.044,0.072,0.126,0.167,1,3600.0,453.6,361.2,92.4,721.6,453.6,665.5,530.0,422.0,108.0,721.6,530.0,777.6,Tracheophyta; Pinus pinea L.; Pinus pinaster Aiton; Magnoliopsida
2018,2018-08-06,Setúbal,Almada,Charneca de Caparica,ESTR FLORESTAL FONTE TELHA MONTE_CAPARICA CHARNECA_CAPARICA_SOBREDA STB#ALMADA 2820 (Mata Nacional dos Medos),38.5983220005035,-9.19254300011529,NC,76.0,2018-08-06T20:00,20.6,72,15.4,20.2,0.0,0.0,0.0,0.0,0,1015.2,1006.3,0,0,0,0,0.07,0.68,15.8,23.8,360,359,32.0,28.7,29.0,23.6,19.0,0.033,0.08,0.14,0.204,0,15.54,0.0,0.0,0.0,0.0,0.0,0.0,18.0,6.0,12.0,62.1,18.0,70.1,Pinus pinea L.; Tracheophyta; Magnoliopsida; Pinus pinaster Aiton
2018,2018-08-08,Setúbal,Almada,Caparica,R MOINHO 33 (Bairro do Fundo do Fomento),38.6698290001021,-9.19002900017632,NC,112.0,2018-08-08T16:00,23.8,59,15.2,22.8,0.0,0.0,0.0,0.0,0,1015.1,1002.1,5,6,0,0,0.45,1.22,23.3,32.2,325,326,49.3,29.4,25.1,23.9,19.0,0.139,0.18,0.246,0.302,1,3600.0,620.6,508.2,112.3,769.4,620.6,878.8,685.0,561.0,124.0,769.4,685.0,970.1,Tracheophyta; Magnoliopsida
2018,2018-08-08,Setúbal,Palmela,Quinta do Anjo,jt Restaurante Quintinha (Moinhos da Sapec),38.5569049999449,-8.93786499977112,NC,156.0,2018-08-08T18:00,23.4,58,14.6,21.4,0.0,0.0,0.0,0.0,0,1014.7,996.7,4,5,0,0,0.27,1.22,24.3,33.6,325,325,48.2,29.7,25.6,23.5,18.7,0.04,0.068,0.107,0.149,1,3600.0,249.0,179.5,69.5,585.9,249.0,407.6,326.0,235.0,91.0,585.9,326.0,533.6,Vitis vinifera L.; Olea europaea L.; Tracheophyta; Quercus suber L.; Pinus pinea L.; Magnoliopsida
2018,2018-08-09,Setúbal,Sesimbra,Quinta do Conde,Junto Mediconde (EN10 (EN10) Km 20),38.5671999999881,-9.03722299999661,Desconhecida,25.0,2018-08-09T10:00,22.9,52,12.7,20.2,0.0,0.0,0.0,0.0,0,1019.7,1016.8,13,14,0,0,0.42,1.33,26.3,35.4,357,356,53.6,24.0,24.8,24.8,20.0,0.04,0.083,0.136,0.177,1,3600.0,676.8,499.1,177.8,672.2,676.8,988.0,613.0,452.0,161.0,672.2,613.0,894.8,Tracheophyta; Magnoliopsida
2018,2018-08-09,Setúbal,Sesimbra,Quinta do Conde,Rua Sebastião da Gama. Traseiras do n.º 48,38.5711111111111,-9.04888888888889,Desconhecida,32.0,2018-08-09T15:00,26.5,39,11.4,24.2,0.0,0.0,0.0,0.0,0,1019.3,1015.6,0,0,0,0,0.63,2.11,27.0,36.0,358,358,55.4,31.5,25.3,24.7,20.0,0.042,0.084,0.135,0.177,1,3600.0,788.5,659.4,129.1,836.1,788.5,1049.6,837.0,700.0,137.0,836.1,837.0,1114.2,Tracheophyta; Magnoliopsida; Pinus pinaster Aiton
2018,2018-08-09,Setúbal,Almada,Charneca de Caparica,Rua Rui Coelho (Quintinhas),38.60388299995,-9.18409999999735,NC,70.0,2018-08-09T17:00,23.0,49,11.7,19.5,0.0,0.0,0.0,0.0,0,1019.3,1011.1,0,0,0,0,0.4,1.43,27.5,38.4,354,354,54.0,29.7,24.7,23.6,19.3,0.039,0.083,0.14,0.204,1,3600.0,457.5,362.8,94.8,735.3,457.5,656.6,536.0,425.0,111.0,735.3,536.0,769.2,Pinus pinea L.; Tracheophyta; Magnoliopsida; Pinus pinaster Aiton
2018,2018-08-12,Setúbal,Alcácer do Sal,Santa Susana,EN253 - Vale Roque (EN253 (EN253) Km 45),38.482029999627,-8.36390000025431,Desconhecida,68.0,2018-08-12T01:00,22.0,53,12.0,20.5,0.0,0.0,0.0,0.0,0,1017.1,1009.1,0,0,0,0,0.09,1.24,14.8,28.5,359,3,27.7,25.5,27.6,25.1,20.2,0.134,0.199,0.263,0.322,0,0.0,0.0,0.0,0.0,0.0,0.0,0.0,0.0,0.0,0.0,0.0,0.0,0.0,Eucalyptus L'Hér.; Magnoliopsida; Quercus rotundifolia Lam.; Tracheophyta; Quercus suber L.; Pinus pinaster Aiton
2018,2018-08-12,Setúbal,Alcácer do Sal,São Martinho,EM 539 (Ribeira do Alberginho),38.4462720002068,-8.5115630001492,Desconhecida,19.0,2018-08-12T02:00,19.2,67,12.9,18.6,0.0,0.0,0.0,0.0,0,1016.9,1014.6,1,0,0,4,0.04,0.74,10.3,20.1,331,350,22.0,22.5,26.8,24.9,20.4,0.054,0.086,0.134,0.18,0,0.0,0.0,0.0,0.0,0.0,0.0,0.0,0.0,0.0,0.0,0.0,0.0,0.0,Tracheophyta; Pinus pinea L.; Pinus pinaster Aiton; Eucalyptus L'Hér.; Quercus suber L.; Magnoliopsida; Oryza sativa L.; Quercus rotundifolia Lam.; 
2018,2018-08-12,Setúbal,Alcácer do Sal,Alcácer do Sal (Santa Maria do Castelo),EN 253 Algarvios (ER253 (ER253) Km 25),38.3613900004493,-8.5391699997584,Desconhecida,36.0,2018-08-12T02:00,18.8,68,12.7,18.4,0.0,0.0,0.0,0.0,0,1017.0,1012.7,4,0,0,12,0.02,0.7,7.9,18.2,317,342,15.5,22.7,27.4,24.9,20.1,0.03,0.064,0.097,0.132,0,0.0,0.0,0.0,0.0,0.0,0.0,0.0,0.0,0.0,0.0,0.0,0.0,0.0,Oryza sativa L.; Pinus pinea L.; Tracheophyta; Eucalyptus L'Hér.; Pinus pinaster Aiton
2018,2018-08-18,Setúbal,Palmela,Poceirão,Rua Joaquim Agostinho - Lagameças,38.6109299998813,-8.79176999992795,Desconhecida,28.0,2018-08-18T06:00,15.4,94,14.4,15.8,0.0,0.0,0.0,0.0,0,1015.0,1011.6,0,0,0,0,0.0,0.11,7.1,10.7,24,50,9.4,18.7,24.9,23.8,19.9,0.066,0.08,0.112,0.124,1,0.0,0.0,0.0,0.0,0.0,0.0,16.3,0.0,0.0,0.0,0.0,0.0,0.0,Vitis vinifera L.; Tracheophyta; Magnoliopsida
2018,2018-08-18,Setúbal,Grândola,Grândola,A2 Km 108 N/S (A2-N-S Km 105),38.2179210000568,-8.51750800000297,Desconhecida,62.0,2018-08-18T16:00,33.2,31,14.0,32.2,0.0,0.0,0.0,0.0,0,1013.6,1006.6,0,0,0,0,0.61,3.47,19.0,25.0,297,300,41.8,37.1,26.5,24.4,20.7,0.058,0.089,0.139,0.132,1,3600.0,581.6,472.1,109.5,754.8,581.6,835.0,648.0,526.0,122.0,754.8,648.0,930.3,Pinus pinea L.; Quercus suber L.; Tracheophyta
2018,2018-08-19,Setúbal,Montijo,Pegões,R. 5 de Outubro (EN4 (EN4) Km 44),38.6870379998949,-8.61692500000199,Desconhecida,88.0,2018-08-19T14:00,37.9,18,9.8,39.0,0.0,0.0,0.0,0.0,0,1014.4,1004.7,0,0,0,0,0.71,5.37,5.7,6.6,305,311,19.8,41.4,27.6,24.5,20.6,0.048,0.081,0.132,0.138,1,3600.0,837.8,706.9,130.9,831.3,837.8,1135.6,864.0,729.0,135.0,831.3,864.0,1171.1,Pinus pinaster Aiton; Vitis vinifera L.; Pinus pinea L.; Tracheophyta; Quercus suber L.; Eucalyptus L'Hér.; Magnoliopsida; Olea europaea L.; Pinales; 
