2018,2018-05-04,Lisboa,Torres Vedras,Ramalhal,CAMPELOS (Vale Gamelas),39.1316850005256,-9.22829799969991,NC,65.0,2018-05-04T18:00,16.1,68,10.1,13.0,0.0,0.0,0.0,0.0,0,1014.3,1006.5,0,0,0,0,0.18,0.59,21.6,30.4,2,5,42.8,18.8,16.4,14.1,13.3,0.263,0.32,0.364,0.321,1,3600.0,244.6,177.8,66.8,624.8,244.6,383.0,326.0,237.0,89.0,624.8,326.0,510.5,Eucalyptus L'Hér.; Pinus pinaster Aiton; Magnoliopsida; Tracheophyta; Vitis vinifera L.; Pinales; Quercus suber L.; 
2018,2018-05-04,Lisboa,Lourinhã,Reguengo Grande,Cesaredas,39.3000480000012,-9.23555700010724,NC,153.0,2018-05-04T20:00,12.9,76,8.8,10.3,0.0,0.0,0.0,0.0,0,1015.1,996.8,0,0,0,0,0.05,0.36,16.0,30.7,14,18,33.8,15.1,15.6,13.2,12.4,0.174,0.214,0.251,0.247,0,0.0,0.0,0.0,0.0,0.0,0.0,0.0,10.0,3.0,7.0,36.8,10.0,50.6,Vitis vinifera L.; Tracheophyta; Magnoliopsida; Eucalyptus L'Hér.; Quercus L.; 
2018,2018-05-05,Lisboa,Azambuja,Aveiras de Cima,Casais do Vale do Cepo (Casais Vale do Cepo),39.1412910000483,-8.9335089999934,Desconhecida,71.0,2018-05-05T11:00,21.5,47,9.8,22.6,0.0,0.0,0.0,0.0,0,1015.8,1007.5,0,0,0,0,0.51,1.35,4.6,5.4,108,110,18.7,20.4,15.3,14.6,13.4,0.176,0.257,0.278,0.229,1,3600.0,872.3,734.0,138.3,851.4,872.3,1159.8,826.0,695.0,131.0,851.4,826.0,1098.2,Tracheophyta; Vitis vinifera L.
2018,2018-05-05,Lisboa,Torres Vedras,Ramalhal,R FLORES (Vila Facaia),39.1634210003747,-9.25124300003052,NC,46.0,2018-05-05T11:00,22.3,44,9.5,23.3,0.0,0.0,0.0,0.0,0,1015.7,1010.3,0,0,0,0,0.52,1.51,4.8,6.6,132,131,24.5,19.4,14.8,14.3,13.4,0.262,0.315,0.364,0.334,1,3600.0,873.0,735.6,137.4,855.6,873.0,1156.6,826.0,696.0,130.0,855.6,826.0,1094.3,Eucalyptus L'Hér.; Pinus pinaster Aiton; Magnoliopsida; Tracheophyta; Vitis vinifera L.; Pinales; Quercus suber L.; 
2018,2018-01-28,Lisboa,Vila Franca de Xira,Calhandriz,Cabeço da Rosa (Casal de Vale Freiras),38.9244399997923,-9.07917000028822,NC,323.0,2018-01-28T15:00,14.2,47,2.9,8.7,0.0,0.0,0.0,0.0,0,1028.1,989.5,0,0,0,0,0.27,0.86,26.6,38.0,50,49,49.3,12.4,9.2,10.9,13.4,0.279,0.301,0.244,0.271,1,3600.0,422.9,344.1,78.8,803.5,422.9,604.0,467.0,380.0,87.0,803.5,467.0,667.0,Magnoliopsida; Tracheophyta; Pinus pinaster Aiton; Vitis vinifera L.; Olea europaea L.; Eucalyptus L'Hér.; Pinales; 
2018,2018-05-06,Lisboa,Sintra,Algueirão-mem Martins,Rua das Buganvílias (Fonte do Pinhal do Escôlo),38.7996199999915,-9.32331999990675,Desconhecida,200.0,2018-05-06T10:00,23.4,41,9.5,23.5,0.0,0.0,0.0,0.0,0,1015.1,992.0,1,0,2,0,0.44,1.69,4.0,5.5,360,23,14.0,18.6,15.2,13.7,12.6,0.3,0.33,0.369,0.348,1,3600.0,739.0,604.2,134.9,791.3,739.0,1026.6,674.0,551.0,123.0,791.3,674.0,936.3,Tracheophyta; Magnoliopsida; Pinales; 
2018,2018-05-06,Lisboa,Sintra,Colares,Azoia - PNSC (Espragal),38.7785910002391,-9.48638099988302,Desconhecida,170.0,2018-05-06T12:00,18.6,74,13.8,19.0,0.0,0.0,0.0,0.0,0,1015.1,995.1,16,0,27,0,0.45,0.56,17.2,20.6,344,356,36.7,22.0,15.9,14.3,13.1,0.145,0.207,0.259,0.274,1,3600.0,915.9,762.1,153.9,830.5,915.9,1233.8,893.0,743.0,150.0,830.5,893.0,1202.9,Tracheophyta; Magnoliopsida; Pinus pinaster Aiton; Pinales; Pinus pinea L.; Eucalyptus L'Hér.; Vitis vinifera L.; Acacia Mill.; 
2018,2018-05-06,Lisboa,Torres Vedras,Matacães,Torres vedras (Cucos),39.0962900002797,-9.23993699974484,NC,86.0,2018-05-06T21:00,14.5,78,10.8,13.3,0.0,0.0,0.0,0.0,0,1015.5,1005.2,11,0,18,0,0.01,0.36,9.7,21.4,22,20,18.0,16.9,17.7,14.6,13.2,0.225,0.302,0.36,0.321,0,0.0,0.0,0.0,0.0,0.0,0.0,0.0,0.0,0.0,0.0,0.0,0.0,0.0,Tracheophyta; Vitis vinifera L.; Eucalyptus L'Hér.; Magnoliopsida; Pinus pinaster Aiton; Olea europaea L.; 
2018,2018-05-08,Lisboa,Torres Vedras,Silveira,Av Alto da Vela (Praia Azul),39.1130660004086,-9.39349399990506,NC,0.0,2018-05-08T20:00,14.9,90,13.2,12.2,0.0,0.0,0.0,,3,1016.2,1016.2,90,100,0,0,0.03,0.18,25.3,38.6,345,348,47.2,17.8,18.2,15.7,13.9,0.211,0.293,0.357,0.321,0,0.0,0.0,0.0,0.0,0.0,0.0,0.0,8.0,1.0,7.0,11.5,8.0,58.1,Tracheophyta; Magnoliopsida; Vitis vinifera L.; Eucalyptus L'Hér.; 
2018,2018-05-10,Lisboa,Alenquer,Meca,Bugarreos (Casal da Preza),39.0965219995711,-9.02085000011656,Desconhecida,194.0,2018-05-10T11:00,17.1,62,9.8,14.9,0.0,0.0,0.0,0.0,0,1016.8,993.9,10,1,0,30,0.4,0.74,23.4,29.1,337,338,46.8,18.8,15.2,15.3,13.0,0.14,0.245,0.307,0.247,1,3600.0,850.5,667.9,182.5,766.6,850.5,1169.2,806.0,633.0,173.0,766.6,806.0,1108.1,Tracheophyta; Magnoliopsida; Pinus pinaster Aiton; Pinus pinea L.
2018,2018-01-29,Lisboa,Azambuja,Manique do Intendente,Manique do intendente (Casais dos Tacais),39.2216829999288,-8.89968299971686,Desconhecida,54.0,2018-01-29T15:00,17.9,50,7.3,13.6,0.0,0.0,0.0,0.0,0,1027.4,1020.9,0,0,0,0,0.3,1.03,24.8,33.7,54,56,42.5,15.7,11.6,12.2,14.8,0.234,0.271,0.203,0.241,1,3600.0,422.4,346.5,76.0,812.5,422.4,601.3,467.0,383.0,84.0,812.5,467.0,664.7,Magnoliopsida; Eucalyptus L'Hér.; Olea europaea L.; Tracheophyta
2018,2018-05-10,Lisboa,Sintra,Sintra (São Martinho),Nafarros (Zibreira),38.8161919996474,-9.42722599983215,Desconhecida,101.0,2018-05-10T17:00,15.3,79,11.6,13.1,0.0,0.0,0.0,0.0,0,1016.4,1004.3,5,6,0,0,0.24,0.37,18.0,24.0,331,332,39.2,18.9,16.2,15.0,13.3,0.251,0.305,0.369,0.373,1,3600.0,461.2,363.3,97.8,747.3,461.2,652.4,542.0,427.0,115.0,747.3,542.0,766.8,Vitis vinifera L.; Tracheophyta; Magnoliopsida; Pinus pinea L.
2018,2018-05-11,Lisboa,Torres Vedras,Monte Redondo,Rua Conde Tarouca (Lapas Grandes),39.1111099995507,-9.20082999997669,NC,112.0,2018-05-11T20:00,13.7,89,12.0,12.2,0.0,0.0,0.0,0.0,3,1020.2,1006.7,98,100,0,28,0.02,0.17,15.3,23.7,285,287,31.3,17.9,18.1,15.6,13.5,0.162,0.264,0.339,0.286,0,0.0,0.0,0.0,0.0,0.0,0.0,0.0,13.0,3.0,10.0,33.2,13.0,62.4,Eucalyptus L'Hér.; Tracheophyta; Magnoliopsida; Vitis vinifera L.; Pinales; Pinus pinaster Aiton; 
2018,2018-05-11,Lisboa,Sintra,Terrugem,TV CURRAIS OUREM 28 TERRUGEM (ER247 (ER247) Km 67),38.8495280000899,-9.38251699977451,Desconhecida,186.0,2018-05-11T21:00,13.4,98,13.1,11.9,0.0,0.0,0.0,0.0,3,1020.9,998.6,100,100,0,50,0.0,0.03,17.1,26.5,309,312,31.3,15.4,16.0,14.4,12.8,0.244,0.3,0.366,0.373,0,0.0,0.0,0.0,0.0,0.0,0.0,0.0,0.0,0.0,0.0,0.0,0.0,0.0,Tracheophyta; Magnoliopsida; Pinus pinaster Aiton; Pinus pinea L.; Vitis vinifera L.; Pinales; Olea europaea L.; 
2018,2018-05-12,Lisboa,Torres Vedras,Campelos,Campelos,39.196734000312,-9.2342519999875,NC,111.0,2018-05-12T17:00,13.9,54,4.8,8.5,0.0,0.0,0.0,0.0,3,1024.0,1010.6,80,89,0,0,0.26,0.73,28.5,38.0,342,343,52.2,18.4,16.4,15.0,13.3,0.193,0.278,0.35,0.334,1,3600.0,425.5,302.7,122.8,618.0,425.5,656.7,499.0,355.0,144.0,618.0,499.0,770.2,Eucalyptus L'Hér.; Tracheophyta; Magnoliopsida; Vitis vinifera L.; Olea europaea L.; Pinus pinaster Aiton; Pinus pinea L.; 
2018,2018-01-29,Lisboa,Lisboa,Marvila,Junto a CP (Marvila),38.7391040001975,-9.11070999993218,NC,39.0,2018-01-29T23:00,12.8,63,6.0,9.0,0.0,0.0,0.0,0.0,0,1028.2,1023.4,9,0,14,1,0.06,0.55,19.6,35.9,43,54,38.2,12.7,13.2,13.0,15.2,0.284,0.303,0.263,0.276,0,0.0,0.0,0.0,0.0,0.0,0.0,0.0,0.0,0.0,0.0,0.0,0.0,0.0,Tracheophyta; Magnoliopsida
2018,2018-05-15,Lisboa,Torres Vedras,Torres Vedras (São Pedro e São Tiago),Quinta do Paul (Casal Vale Lino),39.1050329997804,-9.28337400000128,NC,60.0,2018-05-15T14:00,21.5,41,7.8,19.1,0.0,0.0,0.0,0.0,0,1017.8,1010.7,0,0,0,0,0.58,1.51,24.9,31.7,356,359,46.4,23.3,17.2,15.3,13.8,0.165,0.265,0.342,0.321,1,3600.0,912.8,775.0,137.7,873.8,912.8,1187.5,941.0,799.0,142.0,873.8,941.0,1224.3,Tracheophyta; Eucalyptus L'Hér.; Magnoliopsida
2018,2018-05-15,Lisboa,Amadora,Falagueira,FALAGUEIRA (Rua da Quinta da Bolacha),38.7629389995999,-9.22542800002628,Desconhecida,125.0,2018-05-15T14:00,24.5,37,9.0,24.1,0.0,0.0,0.0,0.0,0,1016.7,1002.2,0,0,0,0,0.64,1.92,15.2,20.6,5,5,35.3,23.5,17.2,15.3,13.7,0.2,0.26,0.319,0.285,1,3600.0,910.6,771.0,139.6,867.8,910.6,1189.6,939.0,795.0,144.0,867.8,939.0,1226.7,Tracheophyta; 
2018,2018-05-15,Lisboa,Azambuja,Manique do Intendente,Quebradas (CAMARNEIRA),39.2358970001009,-8.91016199959649,Desconhecida,89.0,2018-05-15T15:00,23.6,39,8.7,21.1,0.0,0.0,0.0,0.0,0,1016.8,1006.4,0,0,0,0,0.58,1.79,24.5,30.9,343,345,43.6,27.0,18.6,15.9,13.8,0.109,0.228,0.294,0.245,1,3600.0,799.7,672.9,126.9,851.2,799.7,1058.5,851.0,716.0,135.0,851.2,851.0,1126.3,Tracheophyta; Magnoliopsida; Eucalyptus L'Hér.
2018,2018-05-15,Lisboa,Cadaval,Cadaval,Rua da Murteira (CADAVAL),39.2444970003764,-9.10148100005256,Desconhecida,100.0,2018-05-15T17:00,18.9,52,8.8,15.4,0.0,0.0,0.0,0.0,0,1016.6,1004.8,0,0,0,0,0.34,1.06,22.2,30.8,340,344,44.6,22.2,18.0,15.0,13.3,0.169,0.264,0.335,0.289,1,3600.0,466.3,371.5,94.8,752.7,466.3,660.8,546.0,435.0,111.0,752.7,546.0,773.7,Magnoliopsida; Tracheophyta; Pinales
2018,2018-05-15,Lisboa,Alenquer,Ventosa,Penedos (Penedos de Alenquer),39.1358299999767,-9.08555999994278,Desconhecida,111.0,2018-05-15T18:00,18.7,50,7.9,14.5,0.0,0.0,0.0,0.0,0,1016.1,1003.0,0,0,0,0,0.26,1.09,25.1,33.9,339,341,45.4,23.8,19.5,15.9,13.8,0.105,0.227,0.298,0.247,1,3600.0,265.7,195.0,70.6,631.5,265.7,413.5,346.0,254.0,92.0,631.5,346.0,538.5,Vitis vinifera L.; Eucalyptus L'Hér.; Tracheophyta; Magnoliopsida; ; Olea europaea L.
2018,2018-05-15,Lisboa,Sintra,Colares,R PIROLITA 37  COLARES (Espragal),38.7785910002391,-9.48638099988302,Desconhecida,170.0,2018-05-15T21:00,13.6,83,10.8,9.9,0.0,0.0,0.0,0.0,0,1016.4,996.1,0,0,0,0,0.03,0.26,27.2,43.1,7,10,55.8,16.5,18.3,15.3,13.5,0.079,0.174,0.235,0.272,0,0.0,0.0,0.0,0.0,0.0,0.0,0.0,0.0,0.0,0.0,0.0,0.0,0.0,Tracheophyta; Magnoliopsida; Pinus pinaster Aiton; Pinales; Pinus pinea L.; Eucalyptus L'Hér.; Vitis vinifera L.; Acacia Mill.; 
2018,2018-05-16,Lisboa,Alenquer,Aldeia Galega da Merceana,EN-115 Merceana (Quinta do Anjo),39.0929999997881,-9.12251899984148,Desconhecida,144.0,2018-05-16T17:00,23.3,43,10.1,19.8,0.0,0.0,0.0,0.0,0,1011.6,995.0,12,0,20,0,0.39,1.62,24.2,33.1,357,359,47.2,25.8,19.6,15.6,13.5,0.117,0.245,0.327,0.286,1,3600.0,396.7,275.3,121.4,554.2,396.7,664.8,464.0,322.0,142.0,554.2,464.0,777.6,Vitis vinifera L.; Tracheophyta; Magnoliopsida
2018,2018-05-17,Lisboa,Torres Vedras,São Pedro da Cadeira,Gentias,39.0974930000305,-9.40230600012673,NC,58.0,2018-05-17T15:00,22.4,55,12.9,22.1,0.0,0.0,0.0,,0,1012.8,1006.0,4,0,7,0,0.49,1.22,16.8,20.7,313,319,34.2,26.0,19.5,15.9,13.9,0.135,0.255,0.338,0.321,1,3600.0,731.0,573.0,158.1,718.9,731.0,1066.2,777.0,609.0,168.0,718.9,777.0,1133.2,Magnoliopsida; Tracheophyta; Vitis vinifera L.; Eucalyptus L'Hér.; 
2018,2018-01-30,Lisboa,Azambuja,Azambuja,quinta das melanias (Cais da Azambuja),39.0678850000434,-8.86450599988302,Desconhecida,4.0,2018-01-30T11:00,13.5,59,5.7,10.1,0.0,0.0,0.0,0.0,0,1026.7,1026.2,0,0,0,0,0.21,0.63,16.4,22.0,50,52,32.0,11.5,11.4,12.8,15.8,0.349,0.391,0.323,0.345,1,3600.0,455.1,365.2,89.9,780.8,455.1,659.4,405.0,325.0,80.0,780.8,405.0,586.8,Tracheophyta
2018,2018-05-17,Lisboa,Torres Vedras,Torres Vedras (São Pedro e São Tiago),Rua do Chafariz (Casal Vale Lino),39.1016700000233,-9.28721999989616,NC,28.0,2018-05-17T16:00,21.6,59,13.3,21.0,0.0,0.0,0.0,0.0,0,1012.6,1009.3,4,0,6,0,0.41,1.06,15.0,18.6,318,324,34.2,25.9,20.1,16.2,14.1,0.134,0.254,0.337,0.321,1,3600.0,591.2,462.6,128.6,696.6,591.2,888.4,653.0,511.0,142.0,696.6,653.0,981.3,Tracheophyta; Eucalyptus L'Hér.; Magnoliopsida
2018,2018-05-17,Lisboa,Vila Franca de Xira,São João Dos Montes,SÃO JOÃO DOS MONTES,38.9424300003052,-9.02930299970839,Desconhecida,82.0,2018-05-17T20:00,20.0,58,11.4,18.4,0.0,0.0,0.0,0.0,0,1012.5,1002.9,5,0,8,0,0.09,0.99,13.5,24.3,326,328,25.6,22.8,21.3,16.5,14.2,0.296,0.351,0.391,0.294,0,15.1,0.0,0.0,0.0,0.0,0.0,0.0,17.0,6.0,11.0,62.0,17.0,70.6,Magnoliopsida; Tracheophyta; Pinus pinaster Aiton; Vitis vinifera L.; Olea europaea L.; Eucalyptus L'Hér.; Pinales; 
2018,2018-05-18,Lisboa,Cascais,São Domingos de Rana,SÃO DOMINGOS DE RANA,38.7027289999856,-9.34011499987708,Desconhecida,73.0,2018-05-18T20:00,15.9,88,13.9,16.0,0.0,0.0,0.0,0.0,0,1013.9,1005.2,13,1,18,3,0.02,0.22,8.2,14.3,311,335,14.4,19.9,19.9,16.9,14.4,0.201,0.264,0.329,0.3,0,2.27,0.0,0.0,0.0,0.0,0.0,0.0,18.0,6.0,12.0,60.3,18.0,74.2,Tracheophyta; Magnoliopsida
2018,2018-05-19,Lisboa,Torres Vedras,A Dos Cunhados,Tv das Ortinhas (Praia da Vigia),39.1473709996541,-9.37081500000424,NC,35.0,2018-05-19T14:00,21.3,68,15.2,21.4,0.0,0.0,0.0,,1,1016.7,1012.6,44,6,44,41,0.4,0.8,15.9,19.6,321,324,33.5,25.1,19.5,16.7,14.2,0.13,0.247,0.333,0.321,1,3600.0,654.0,417.3,236.8,467.4,654.0,1193.2,674.0,430.0,244.0,467.4,674.0,1229.6,Eucalyptus L'Hér.; Tracheophyta; Vitis vinifera L.; Magnoliopsida; Pinus pinea L.; 
2018,2018-05-19,Lisboa,Sintra,Algueirão-mem Martins,Estrada de Algueirão (São Carlos),38.7869979998801,-9.34579499986437,Desconhecida,175.0,2018-05-19T15:00,20.9,65,14.0,20.2,0.0,0.0,0.0,0.0,1,1016.0,995.6,26,5,35,1,0.38,0.87,16.3,22.1,335,338,38.2,22.4,18.3,15.8,13.3,0.208,0.269,0.341,0.347,1,3600.0,576.9,373.6,203.3,466.0,576.9,1071.7,613.0,397.0,216.0,466.0,613.0,1138.7,Tracheophyta; Magnoliopsida; Pinales; 
2018,2018-05-20,Lisboa,Sintra,Algueirão-mem Martins,AV EMBAIXADOR ARISTIDES SOUSA MENDES (Tapada das Mercês),38.7963320000966,-9.33082699987623,Desconhecida,181.0,2018-05-20T08:00,17.2,78,13.3,17.3,0.0,0.0,0.0,0.0,0,1015.0,993.7,0,0,0,0,0.17,0.43,6.9,10.1,351,360,23.0,16.6,16.9,15.9,13.3,0.212,0.267,0.34,0.347,1,3600.0,386.4,264.2,122.2,546.9,386.4,645.5,313.0,214.0,99.0,546.9,313.0,522.9,Tracheophyta; Magnoliopsida; Pinales; 
2018,2018-05-20,Lisboa,Amadora,Brandoa,Estrada da brandoa (Rua Machado de Castro),38.7723740000195,-9.21932399988174,Desconhecida,121.0,2018-05-20T14:00,23.8,54,13.9,24.7,0.0,0.0,0.0,0.0,0,1012.7,998.7,19,1,21,17,0.52,1.35,11.5,14.5,316,318,34.2,25.4,19.6,17.0,14.0,0.167,0.238,0.306,0.284,1,3600.0,757.8,520.1,237.7,580.8,757.8,1196.4,781.0,536.0,245.0,580.8,781.0,1233.0,Tracheophyta; Magnoliopsida
2018,2018-05-20,Lisboa,Torres Vedras,Turcifal,CARVALHAL (EN8 (EN8) Km 38),39.04971400049,-9.26924200005002,NC,40.0,2018-05-20T20:00,14.9,92,13.6,14.2,0.0,0.0,0.0,0.0,2,1013.4,1008.6,66,73,0,0,0.02,0.14,12.6,15.5,294,295,24.1,20.5,20.6,17.3,14.3,0.118,0.236,0.321,0.298,0,0.0,0.0,0.0,0.0,0.0,0.0,0.0,14.0,3.0,11.0,29.2,14.0,78.2,Tracheophyta; Castanea sativa Mill.; Vitis vinifera L.; Magnoliopsida; Pinales; Eucalyptus L'Hér.; 
2018,2018-05-21,Lisboa,Sintra,Almargem do Bispo,Olival do Santissimo (Casal do Bretão),38.8136099995507,-9.24277999983894,Desconhecida,262.0,2018-05-21T20:00,13.5,86,11.2,12.6,0.0,0.0,0.0,0.0,1,1013.0,982.0,23,24,0,5,0.02,0.22,8.7,12.6,300,297,26.6,18.6,19.0,16.2,13.1,0.172,0.242,0.316,0.282,0,0.0,0.0,0.0,0.0,0.0,0.0,0.0,19.0,5.0,14.0,48.6,19.0,78.6,Tracheophyta; Magnoliopsida; Pinus pinaster Aiton; Eucalyptus L'Hér.; Vitis vinifera L.; 
2018,2018-05-22,Lisboa,Loures,Santa Iria de Azoia,IC-2 jt estação mercadorias (Santa Iria),38.8361100000805,-9.08027999983893,NC,6.0,2018-05-22T03:00,15.6,79,12.0,15.0,0.0,0.0,0.0,0.0,3,1012.9,1012.2,98,100,14,0,0.01,0.37,8.6,11.9,178,177,17.6,18.7,21.8,19.8,15.5,0.108,0.206,0.25,0.061,0,0.0,0.0,0.0,0.0,0.0,0.0,0.0,0.0,0.0,0.0,0.0,0.0,0.0,Tracheophyta; Magnoliopsida; Olea europaea L.; 
2018,2018-05-22,Lisboa,Sintra,Colares,Quinta Do Murraçal (Ribeira de Nafarros),38.8047200001611,-9.44639000044929,Desconhecida,21.0,2018-05-22T13:00,16.8,74,12.1,13.8,0.0,0.0,0.0,0.0,3,1015.0,1012.5,100,93,50,0,0.24,0.5,24.7,32.3,161,161,55.8,22.5,19.3,18.1,15.0,0.072,0.159,0.221,0.27,1,1146.02,427.0,92.8,334.2,98.2,427.0,1261.3,428.0,93.0,335.0,98.2,428.0,1264.4,Tracheophyta; Magnoliopsida; Pinus pinaster Aiton; Pinales; Pinus pinea L.; Eucalyptus L'Hér.; Vitis vinifera L.; Acacia Mill.; 
2018,2018-05-22,Lisboa,Alenquer,Alenquer (Triana),Alenquer (Triana),39.05424200005,-9.00791800022125,Desconhecida,27.0,2018-05-22T16:00,21.9,51,11.4,20.8,0.0,0.0,0.0,0.0,0,1013.5,1010.3,14,0,5,35,0.44,1.28,15.9,19.6,193,194,36.7,27.5,21.5,18.9,14.9,0.099,0.2,0.27,0.24,1,3600.0,627.1,492.1,135.0,734.4,627.1,894.5,692.0,543.0,149.0,734.4,692.0,987.1,Magnoliopsida; Tracheophyta
2018,2018-05-22,Lisboa,Oeiras,Carnaxide,ESTR SAO MARCAL (Hospital de Santa Cruz),38.7272009997898,-9.23358700000577,NC,121.0,2018-05-22T17:00,17.4,71,12.1,16.0,0.0,0.0,0.0,0.0,1,1013.9,999.6,21,0,17,36,0.26,0.58,14.1,18.4,218,215,31.7,21.3,18.8,17.1,14.2,0.197,0.25,0.32,0.308,1,3600.0,407.6,282.3,125.3,555.0,407.6,679.1,475.0,329.0,146.0,555.0,475.0,791.3,Tracheophyta; Magnoliopsida; Pinus pinea L.; Vitis vinifera L.; Eucalyptus L'Hér.; Olea europaea L.; Pinus pinaster Aiton
2018,2018-01-30,Lisboa,Arruda Dos Vinhos,Arranhó,Louriceira de Baixo (Casal do Retiro),38.9823580000136,-9.12157299995422,Desconhecida,260.0,2018-01-30T19:00,11.4,61,4.3,7.8,0.0,0.0,0.0,0.0,0,1024.0,992.6,0,0,0,0,0.05,0.52,15.3,33.2,45,49,30.2,11.7,11.7,11.3,13.8,0.231,0.276,0.217,0.22,0,0.0,0.0,0.0,0.0,0.0,0.0,0.0,0.0,0.0,0.0,0.0,0.0,0.0,Vitis vinifera L.; Magnoliopsida; Tracheophyta; Olea europaea L.
2018,2018-05-23,Lisboa,Sobral de Monte Agraço,Sobral de Monte Agraço,SOBRAL DE MONTE AGRAÇO (IC11 (EN248) Km 10),39.0198210000992,-9.14805400000678,NC,263.0,2018-05-23T16:00,18.3,75,13.8,17.0,0.0,0.0,0.0,0.0,1,1014.7,984.0,29,8,5,62,0.3,0.53,18.4,22.4,298,298,36.0,25.4,19.7,16.8,13.3,0.113,0.227,0.309,0.266,1,3600.0,515.1,348.3,166.9,517.6,515.1,897.9,568.0,384.0,184.0,517.6,568.0,990.1,Tracheophyta; Eucalyptus L'Hér.; Magnoliopsida; Vitis vinifera L.
2018,2018-05-25,Lisboa,Torres Vedras,Maxial,Póvoa (Vala da Aberta),39.1393049997754,-9.18331000010173,NC,61.0,2018-05-25T16:00,19.7,63,12.3,19.0,0.0,0.0,0.0,0.0,2,1012.1,1004.9,55,29,29,39,0.33,0.86,9.9,12.2,316,317,21.2,22.6,19.0,18.0,14.7,0.372,0.272,0.312,0.286,1,3600.0,477.4,262.3,215.1,388.1,477.4,901.3,526.0,289.0,237.0,388.1,526.0,993.0,Eucalyptus L'Hér.; Tracheophyta; Magnoliopsida; Vitis vinifera L.; Pinales; Pinus pinaster Aiton; 
2018,2018-05-26,Lisboa,Torres Vedras,Freiria,Paul (Paúl),39.0310259999169,-9.29833900027805,NC,56.0,2018-05-26T21:00,15.5,97,15.0,16.1,0.0,0.0,0.0,0.0,0,1014.1,1007.4,11,0,18,0,0.0,0.06,7.4,13.2,331,349,12.6,18.1,19.1,17.4,14.6,0.287,0.285,0.314,0.298,0,0.0,0.0,0.0,0.0,0.0,0.0,0.0,0.0,0.0,0.0,0.0,0.0,0.0,Vitis vinifera L.; Magnoliopsida; Tracheophyta; Eucalyptus L'Hér.; 
2018,2018-05-27,Lisboa,Lourinhã,Reguengo Grande,REGUENGO_GRANDE (REGUENGO GRANDE),39.2840659999847,-9.21096799956428,NC,169.0,2018-05-27T11:00,18.2,74,13.4,17.2,0.1,0.1,0.0,0.0,51,1016.6,996.7,77,80,8,0,0.32,0.55,15.7,20.2,344,344,34.2,19.0,16.5,16.1,13.7,0.209,0.22,0.207,0.237,1,3600.0,610.8,285.4,325.4,320.0,610.8,1188.4,580.0,271.0,309.0,320.0,580.0,1128.5,Vitis vinifera L.; Tracheophyta; Magnoliopsida; Eucalyptus L'Hér.; Quercus L.; 
2018,2018-05-27,Lisboa,Sintra,Rio de Mouro,Serra das Ligeiras (Bairro das Ligeiras),38.7542760001289,-9.32027800003688,Desconhecida,160.0,2018-05-27T15:00,18.0,74,13.2,15.9,0.0,0.0,0.0,0.0,0,1016.7,997.8,2,2,0,0,0.34,0.54,26.0,36.1,341,341,56.5,20.7,17.8,16.1,13.9,0.281,0.281,0.333,0.346,1,3600.0,649.5,370.5,279.0,455.9,649.5,1082.8,689.0,393.0,296.0,455.9,689.0,1148.6,Tracheophyta; Magnoliopsida; Pinales; 
2018,2018-05-27,Lisboa,Sintra,Rio de Mouro,ESTR LIGEIRAS (Bairro das Ligeiras),38.7571080001195,-9.32181799994575,Desconhecida,121.0,2018-05-27T15:00,18.2,74,13.5,16.2,0.0,0.0,0.0,0.0,0,1016.7,1002.4,2,2,0,0,0.34,0.55,26.0,36.1,341,341,56.5,21.0,18.0,16.4,14.2,0.281,0.281,0.333,0.346,1,3600.0,649.5,370.5,279.0,455.9,649.5,1082.8,689.0,393.0,296.0,455.9,689.0,1148.6,Tracheophyta; Magnoliopsida; Pinales; 
2018,2018-01-31,Lisboa,Loures,Fanhões,FANHÕES (Casal da Boca),38.8783820003933,-9.15064500000742,NC,147.0,2018-01-31T10:00,10.4,64,3.9,7.0,0.0,0.0,0.0,0.0,0,1024.3,1006.3,11,0,0,36,0.12,0.45,13.5,20.9,46,46,28.1,9.7,10.6,12.1,16.2,0.191,0.248,0.174,0.026,1,3600.0,315.5,229.5,86.0,636.0,315.5,508.5,253.0,184.0,69.0,636.0,253.0,407.8,Magnoliopsida; Tracheophyta; Eucalyptus L'Hér.; 
2018,2018-05-27,Lisboa,Arruda Dos Vinhos,Santiago Dos Velhos,estrada da contradinha (Carrasqueiro),38.939011999766,-9.11806600001123,Desconhecida,196.0,2018-05-27T19:00,15.1,76,11.0,11.3,0.0,0.0,0.0,0.0,1,1017.2,993.9,44,49,0,0,0.1,0.4,27.6,40.4,338,338,54.7,19.4,19.5,18.2,14.5,0.243,0.233,0.235,0.032,1,3600.0,97.6,55.2,42.4,378.7,97.6,194.0,161.0,91.0,70.0,378.7,161.0,320.2,Magnoliopsida; Tracheophyta; Vitis vinifera L.
2018,2018-05-28,Lisboa,Torres Vedras,Carmões,Traseira da Quinta do Alto dos Ais (EN115 (EN115) Km 50),39.0649629995558,-9.135992000103,NC,148.0,2018-05-28T17:00,16.1,77,12.1,12.9,0.0,0.0,0.0,0.0,1,1016.6,999.0,42,33,20,0,0.2,0.41,26.7,35.3,323,324,46.8,20.0,18.3,17.3,14.4,0.246,0.271,0.305,0.266,1,3600.0,338.8,215.5,123.3,415.5,338.8,690.9,393.0,250.0,143.0,415.5,393.0,801.4,Vitis vinifera L.; Magnoliopsida; Eucalyptus L'Hér.; Tracheophyta; Pinus pinea L.; 
2018,2018-01-31,Lisboa,Odivelas,Caneças,Rua do Mortorio (CANEÇAS),38.8110579999288,-9.22451699998644,NC,223.0,2018-01-31T12:00,14.4,53,5.0,10.9,0.0,0.0,0.0,0.0,0,1023.6,996.9,0,0,0,0,0.27,0.77,15.6,21.5,40,40,31.7,12.4,10.8,11.8,14.0,0.255,0.285,0.232,0.262,1,3600.0,542.5,447.3,95.2,829.8,542.5,759.7,513.0,423.0,90.0,829.8,513.0,718.4,Eucalyptus L'Hér.; Tracheophyta; Magnoliopsida; Olea europaea L.; Pinus pinea L.; 
2018,2018-05-29,Lisboa,Torres Vedras,Ramalhal,AMEAL (Alto da Sardinha),39.1564589998457,-9.22753399954902,NC,67.0,2018-05-29T09:00,15.6,80,12.1,13.7,0.1,0.1,0.0,0.0,51,1016.7,1008.7,100,100,34,1,0.15,0.36,17.3,22.4,313,315,32.4,16.5,16.6,17.0,14.5,0.284,0.298,0.323,0.333,1,2132.88,298.3,86.5,211.8,131.1,298.3,879.1,262.0,76.0,186.0,131.1,262.0,772.1,Eucalyptus L'Hér.; Pinus pinaster Aiton; Magnoliopsida; Tracheophyta; Vitis vinifera L.; Pinales; Quercus suber L.; 
2018,2018-05-29,Lisboa,Cadaval,Cercal,EN-366 (Cercal) (CERCAL),39.224613000022,-8.99582999971178,Desconhecida,150.0,2018-05-29T22:00,14.1,92,12.8,13.4,0.0,0.0,0.0,0.0,3,1016.9,999.0,96,94,0,38,0.0,0.13,11.0,17.6,319,325,27.0,16.4,17.6,17.2,14.5,0.252,0.268,0.297,0.258,0,0.0,0.0,0.0,0.0,0.0,0.0,0.0,0.0,0.0,0.0,0.0,0.0,0.0,Eucalyptus L'Hér.; Magnoliopsida; Tracheophyta; Pinales; Vitis vinifera L.; Olea europaea L.; Pinus pinaster Aiton; Castanea sativa Mill.; 
2018,2018-05-30,Lisboa,Lourinhã,Miragaia,Papagovas de Cima (Papagovas de Baixo),39.2359200000763,-9.25423999998305,NC,78.0,2018-05-30T15:00,17.3,77,13.2,16.8,0.0,0.0,0.0,0.0,2,1018.3,1009.0,51,50,8,4,0.36,0.46,17.2,21.1,303,303,34.6,22.0,18.3,17.1,15.0,0.196,0.207,0.209,0.252,1,3600.0,693.4,475.5,217.9,583.9,693.4,1084.1,735.0,504.0,231.0,583.9,735.0,1149.1,Tracheophyta; Eucalyptus L'Hér.; Pinus pinea L.; Magnoliopsida; Vitis vinifera L.; 
2018,2018-05-30,Lisboa,Torres Vedras,Carvoeira,Aldeia Nossa Senhora da Glória (Casal do Gama),39.0790380001068,-9.17432600021362,NC,139.0,2018-05-30T18:00,15.8,81,12.6,13.7,0.0,0.0,0.0,0.0,1,1018.4,1001.8,39,43,0,0,0.14,0.34,19.8,25.3,299,300,36.7,19.8,18.2,17.1,14.7,0.233,0.268,0.304,0.266,1,3600.0,220.7,126.9,93.8,372.0,220.7,454.1,280.0,161.0,119.0,372.0,280.0,576.0,Vitis vinifera L.; Magnoliopsida; Eucalyptus L'Hér.; Tracheophyta; Pinus pinea L.; 
2018,2018-05-31,Lisboa,Sintra,Belas,Pendão (Quinta do Bonjardim),38.786880999936,-9.27166699992286,Desconhecida,186.0,2018-05-31T17:00,16.7,69,11.0,14.5,0.0,0.0,0.0,0.0,0,1021.0,998.9,11,12,0,0,0.29,0.59,17.6,23.8,332,333,40.7,19.8,17.4,15.9,14.0,0.267,0.276,0.329,0.346,1,3600.0,495.0,391.3,103.7,744.6,495.0,699.4,573.0,453.0,120.0,744.6,573.0,809.6,Pinus pinaster Aiton; Tracheophyta; Pinales; Eucalyptus L'Hér.; Magnoliopsida; 
2018,2018-02-01,Lisboa,Odivelas,Caneças,Vale de Nogueira (Campos),38.8128329997593,-9.21099500020345,NC,194.0,2018-02-01T11:00,11.4,61,4.2,5.3,0.0,0.0,0.0,0.0,2,1019.3,995.9,78,87,0,0,0.16,0.52,32.4,48.7,351,352,67.3,11.5,11.3,12.1,14.1,0.252,0.281,0.231,0.261,1,3600.0,270.8,88.8,182.0,186.4,270.8,670.8,241.0,79.0,162.0,186.4,241.0,597.0,Eucalyptus L'Hér.; Tracheophyta; Magnoliopsida; Olea europaea L.; Pinus pinea L.; 
2018,2018-06-01,Lisboa,Sintra,Agualva,AV CIDADE LONDRES (Abelheira),38.7735870001051,-9.30257300006019,Desconhecida,128.0,2018-06-01T14:00,16.8,63,9.7,13.6,0.0,0.0,0.0,0.0,1,1021.8,1006.5,44,24,37,0,0.33,0.71,22.5,31.6,338,339,50.0,18.3,16.3,16.2,14.4,0.262,0.275,0.326,0.345,1,3600.0,576.3,296.4,279.9,326.1,576.3,1209.3,593.0,305.0,288.0,326.1,593.0,1244.3,Tracheophyta; Magnoliopsida; 
2018,2018-05-11,Setúbal,Almada,Sobreda,jt Junta de Freguesia da Sobreda (SAMPAIO),38.6459670003255,-9.18869799984826,NC,77.0,2018-05-11T20:00,14.0,86,11.7,13.2,0.0,0.0,0.0,0.0,1,1020.2,1010.9,21,13,11,10,0.02,0.22,9.2,18.7,291,300,23.4,17.2,17.8,15.8,13.7,0.124,0.175,0.227,0.224,0,0.0,0.0,0.0,0.0,0.0,0.0,0.0,13.0,3.0,10.0,33.6,13.0,61.0,Tracheophyta; Magnoliopsida
2018,2018-05-12,Setúbal,Setúbal,São Simão,AZEITAO (Vendas de Azeitão),38.5333909999993,-8.99104399998983,Desconhecida,101.0,2018-05-12T11:00,16.5,44,4.1,11.7,0.0,0.0,0.0,0.0,2,1023.1,1011.0,79,88,0,0,0.34,1.06,22.9,31.0,341,340,49.7,18.0,16.4,16.3,13.8,0.074,0.155,0.205,0.164,1,3600.0,550.7,208.9,341.8,238.0,550.7,1176.7,522.0,198.0,324.0,238.0,522.0,1115.3,Tracheophyta; Quercus suber L.; Olea europaea L.; Magnoliopsida; Pinus pinea L.; Vitis vinifera L.
2018,2018-05-12,Setúbal,Seixal,Amora,Belverde. jt bomba gasolina (Estevalinho),38.596162999471,-9.13995800018311,NC,53.0,2018-05-12T18:00,14.1,52,4.5,9.2,0.0,0.0,0.0,0.0,0,1023.5,1017.1,9,10,0,0,0.21,0.77,24.2,34.4,342,342,48.2,18.2,17.3,15.9,13.9,0.117,0.172,0.225,0.224,1,3600.0,254.6,176.8,77.7,584.9,254.6,405.3,334.0,232.0,102.0,584.9,334.0,531.8,Tracheophyta; Pinus pinaster Aiton; Magnoliopsida
2018,2018-05-12,Setúbal,Palmela,Marateca,Fonte Barreira de Cima (CM1034. 2965. Portugal),38.6469444444444,-8.68888888888889,Desconhecida,53.0,2018-05-12T19:00,13.6,50,3.5,8.9,0.0,0.0,0.0,0.0,0,1022.9,1016.5,1,1,0,0,0.14,0.77,21.9,33.6,337,339,48.6,17.5,17.6,16.3,14.0,0.129,0.133,0.159,0.126,1,3600.0,68.9,36.0,32.9,351.2,68.9,137.4,134.0,70.0,64.0,351.2,134.0,267.2,Vitis vinifera L.; Tracheophyta; Quercus suber L.; Pinus pinea L.
