2006,2006-02-12,Lisboa,Torres Vedras,Dois Portos,BOLIGUEIRA (Bulegueira),39.03838195,-9.18432958743044,NC,82.0,2006-02-12T17:00,15.0,80,11.6,13.8,0.0,0.0,0.0,0.0,0,1021.8,1011.9,0,0,0,0,0.12,0.34,11.4,15.0,336,339,19.4,15.9,12.9,11.3,13.5,0.337,0.347,0.344,0.285,1,3600.0,179.8,138.1,41.8,685.0,179.8,282.9,254.0,195.0,59.0,685.0,254.0,399.6,Vitis vinifera L.; Eucalyptus L'Hér.; Magnoliopsida; Tracheophyta; 
2006,2006-07-07,Lisboa,Cascais,Alcabideche,Fontainhas,38.7121479,-9.4239023,NC,68.0,2006-07-07T15:00,24.0,60,15.7,23.6,0.0,0.0,0.0,0.0,0,1018.2,1010.3,0,0,0,0,0.54,1.2,26.3,34.9,341,344,45.7,27.0,21.9,20.0,18.0,0.162,0.207,0.251,0.292,1,3600.0,833.7,726.7,107.1,871.2,833.7,1103.7,880.0,767.0,113.0,871.2,880.0,1164.9,Tracheophyta; Eucalyptus L'Hér.; Magnoliopsida; Pinus pinea L.; Pinus pinaster Aiton; Pinales; Vitis vinifera L.; 
2006,2006-07-05,Lisboa,Loures,Camarate,LOURES - JTO ARQUIVO (Bairro Mira Loures),38.804567,-9.1383542,NC,150.0,2006-07-05T00:00,17.3,87,15.1,15.8,0.0,0.0,0.0,0.0,1,1020.0,1002.2,32,35,0,0,0.02,0.26,21.7,29.7,339,339,34.2,21.0,22.4,21.6,20.4,0.26,0.301,0.325,0.338,0,0.0,0.0,0.0,0.0,0.0,0.0,0.0,0.0,0.0,0.0,0.0,0.0,0.0,Tracheophyta; Olea europaea L.; Magnoliopsida; 
2006,2006-06-29,Lisboa,Oeiras,Queijas,R RAMALHO URTIGAO (Queijas),38.7186455,-9.2643214,NC,86.0,2006-06-29T04:00,16.2,87,14.0,14.9,0.0,0.0,0.0,0.0,2,1020.2,1009.9,53,59,0,0,0.01,0.24,17.6,25.4,345,344,28.1,17.3,19.6,19.5,17.5,0.184,0.222,0.257,0.293,0,0.0,0.0,0.0,0.0,0.0,0.0,0.0,0.0,0.0,0.0,0.0,0.0,0.0,Tracheophyta; Magnoliopsida; Pinus pinea L.; Vitis vinifera L.; Eucalyptus L'Hér.; Olea europaea L.; Pinus pinaster Aiton
2006,2006-06-30,Lisboa,Sintra,São João das Lampas,TAPADA DAS MERCES JNT MODELO (Casal da Tapada),38.8424154,-9.3951609,NC,199.0,2006-06-30T00:00,16.7,91,15.1,15.8,0.0,0.0,0.0,0.0,1,1019.6,996.0,23,26,0,0,0.01,0.18,17.8,27.8,346,347,29.5,17.7,20.7,19.2,17.1,0.095,0.163,0.209,0.262,0,0.0,0.0,0.0,0.0,0.0,0.0,0.0,0.0,0.0,0.0,0.0,0.0,0.0,Tracheophyta; Magnoliopsida; Pinus pinaster Aiton; Pinus pinea L.; Vitis vinifera L.; Pinales; Olea europaea L.; 
2006,2006-06-21,Lisboa,Azambuja,Alcoentre,Quebradas,39.2078257,-8.9572359,NC,81.0,2006-06-21T21:00,17.7,82,14.6,16.3,0.0,0.0,0.0,0.0,0,1016.7,1007.1,0,0,0,0,0.03,0.36,19.8,33.0,344,349,37.4,20.8,23.0,21.2,17.8,0.148,0.199,0.245,0.263,0,0.0,0.0,0.0,0.0,0.0,0.0,0.0,0.0,0.0,0.0,0.0,0.0,0.0,Tracheophyta; Magnoliopsida; Pinales; Olea europaea L.
2006,2006-06-29,Lisboa,Sintra,Sintra (são Pedro De Penaferrim),Cabeço de Manique,38.7992243,-9.3853801,NC,187.0,2006-06-29T23:00,16.9,90,15.2,15.9,0.0,0.0,0.0,0.0,1,1019.9,997.7,25,28,0,0,0.01,0.19,18.3,28.4,344,345,31.0,18.2,21.0,19.3,17.2,0.095,0.163,0.209,0.262,0,0.0,0.0,0.0,0.0,0.0,0.0,0.0,0.0,0.0,0.0,0.0,0.0,0.0,Tracheophyta; Magnoliopsida
2006,2006-07-08,Lisboa,Loures,Loures,Tojalinho,38.8414646,-9.2049739,NC,66.0,2006-07-08T15:00,25.7,52,15.0,24.6,0.0,0.0,0.0,0.0,0,1016.9,1009.3,0,0,0,0,0.59,1.59,28.8,38.6,340,342,49.0,29.1,23.0,20.5,18.1,0.141,0.206,0.245,0.279,1,3600.0,835.3,716.9,118.4,861.9,835.3,1100.5,882.0,757.0,125.0,861.9,882.0,1162.1,Tracheophyta; Quercus suber L.
2006,2006-06-30,Lisboa,Sintra,São João das Lampas,PINHAL DO ESCOTO (Casal do Pinhal),38.8815463,-9.405697273499548,NC,122.0,2006-06-30T12:00,21.2,71,15.8,23.3,0.0,0.0,0.0,0.0,0,1019.8,1005.5,14,16,0,0,0.52,0.73,12.9,15.3,300,304,26.3,30.1,21.5,20.1,17.8,0.082,0.204,0.271,0.324,1,3600.0,930.1,778.1,151.9,818.3,930.1,1258.4,906.0,758.0,148.0,818.3,906.0,1225.8,Tracheophyta; Magnoliopsida; Pinus pinaster Aiton; Pinus pinea L.; Vitis vinifera L.; Pinales; Olea europaea L.; 
2006,2006-06-28,Lisboa,Sintra,Pêro Pinheiro,Fação,38.83977325,-9.319917216660787,NC,145.0,2006-06-28T00:00,16.4,84,13.8,14.3,0.0,0.0,0.0,0.0,1,1019.7,1002.4,22,24,0,0,0.03,0.29,23.0,34.1,333,334,40.3,17.8,19.7,19.2,17.0,0.174,0.222,0.256,0.287,0,0.0,0.0,0.0,0.0,0.0,0.0,0.0,0.0,0.0,0.0,0.0,0.0,0.0,Tracheophyta; Magnoliopsida; Pinus pinaster Aiton; Eucalyptus L'Hér.; Vitis vinifera L.; 
2006,2006-07-06,Lisboa,ODIVELAS,Ramada,PEDERNAIS BAIRRO TRIGACHE (Pedernais),38.7996,-9.19977,NC,155.0,2006-07-06T16:00,23.3,47,11.4,20.5,0.0,0.0,0.0,0.0,0,1020.9,1002.9,0,0,0,0,0.51,1.5,28.6,37.9,341,343,47.5,26.5,21.4,19.7,17.5,0.151,0.21,0.247,0.279,1,3600.0,701.6,604.6,97.0,854.5,701.6,936.1,767.0,661.0,106.0,854.5,767.0,1023.5,Eucalyptus L'Hér.; Tracheophyta; Magnoliopsida; Olea europaea L.; Pinus pinea L.; 
2006,2006-07-01,Lisboa,ODIVELAS,Odivelas,ODIVELAS,38.7932694,-9.172982,NC,33.0,2006-07-01T15:00,22.9,60,14.9,22.9,0.0,0.0,0.0,0.0,2,1018.8,1014.9,52,26,0,96,0.45,1.11,16.8,20.2,301,301,25.2,27.5,22.4,20.3,18.0,0.152,0.222,0.25,0.28,1,3600.0,664.9,352.3,312.5,422.3,664.9,1104.0,702.0,372.0,330.0,422.3,702.0,1165.7,Tracheophyta; Magnoliopsida
2006,2006-06-24,Lisboa,ODIVELAS,Odivelas,COLINAS DO CRUZEIRO (ODIVELAS),38.7932694,-9.172982,NC,33.0,2006-06-24T07:00,18.3,82,15.1,16.8,0.0,0.0,0.0,0.0,3,1015.7,1011.8,86,96,0,0,0.08,0.38,22.3,29.5,339,340,36.0,19.6,21.2,20.5,17.7,0.197,0.244,0.256,0.28,1,0.0,94.0,7.1,86.9,22.7,94.0,415.4,66.0,5.0,61.0,22.7,66.0,291.6,Tracheophyta; Magnoliopsida
