year,date,district,municipality,parish,local,latitude,longitude,cause,elevation,hourly.time,hourly.temperature_2m,hourly.relative_humidity_2m,hourly.dew_point_2m,hourly.apparent_temperature,hourly.precipitation,hourly.rain,hourly.snowfall,hourly.snow_depth,hourly.weather_code,hourly.pressure_msl,hourly.surface_pressure,hourly.cloud_cover,hourly.cloud_cover_low,hourly.cloud_cover_mid,hourly.cloud_cover_high,hourly.et0_fao_evapotranspiration,hourly.vapour_pressure_deficit,hourly.wind_speed_10m,hourly.wind_speed_100m,hourly.wind_direction_10m,hourly.wind_direction_100m,hourly.wind_gusts_10m,hourly.soil_temperature_0_to_7cm,hourly.soil_temperature_7_to_28cm,hourly.soil_temperature_28_to_100cm,hourly.soil_temperature_100_to_255cm,hourly.soil_moisture_0_to_7cm,hourly.soil_moisture_7_to_28cm,hourly.soil_moisture_28_to_100cm,hourly.soil_moisture_100_to_255cm,hourly.is_day,hourly.sunshine_duration,hourly.shortwave_radiation_instant,hourly.direct_radiation_instant,hourly.diffuse_radiation_instant,hourly.direct_normal_irradiance_instant,hourly.global_tilted_irradiance_instant,hourly.terrestrial_radiation_instant,hourly.shortwave_radiation,hourly.direct_radiation,hourly.diffuse_radiation,hourly.direct_normal_irradiance,hourly.global_tilted_irradiance,hourly.terrestrial_radiation,scientificNames
2006,2006-07-14,Santarém,Ourém,Fátima,Amoreira,39.60322805,-8.663198476923824,NC,353.0,2006-07-14T13:00,34.7,27,12.8,36.7,0.0,0.0,0.0,0.0,0,1014.0,975.2,14,0,1,45,0.76,4.04,7.8,9.6,77,77,24.5,37.8,27.0,21.7,17.2,0.108,0.148,0.209,0.267,1,3600.0,942.1,826.1,116.0,870.9,942.1,1255.5,942.0,826.0,116.0,870.9,942.0,1255.4,Olea europaea L.; Magnoliopsida; Tracheophyta; Eucalyptus L'Hér.
2006,2006-05-31,Santarém,Benavente,Samora Correia,SAMORA CORREIA,38.93424185,-8.868042906346707,NC,11.0,2006-05-31T21:00,19.4,71,14.0,19.1,0.0,0.0,0.0,0.0,0,1012.8,1011.5,1,1,0,0,0.03,0.66,10.9,19.2,279,287,24.8,23.3,24.5,21.6,17.1,0.248,0.312,0.371,0.358,0,0.0,0.0,0.0,0.0,0.0,0.0,0.0,0.0,0.0,0.0,0.0,0.0,0.0,Quercus suber L.; Oryza sativa L.; Tracheophyta; Pinus pinaster Aiton; Quercus rotundifolia Lam.; Eucalyptus L'Hér.; Magnoliopsida; Pinus pinea L.; Olea europaea L.; Vitis vinifera L.; 
2006,2006-07-14,Santarém,Abrantes,Alferrarede,Casal das Mansas,39.4917498,-8.161656135868824,NC,87.0,2006-07-14T17:00,37.3,22,12.0,37.2,0.0,0.0,0.0,0.0,1,1011.8,1002.2,21,0,19,33,0.44,4.99,5.2,5.5,326,328,18.4,42.2,30.8,24.3,19.3,0.061,0.068,0.108,0.174,1,3600.0,445.9,347.9,98.0,651.8,445.9,706.6,514.0,401.0,113.0,651.8,514.0,814.4,Olea europaea L.; Tracheophyta; Eucalyptus L'Hér.; Magnoliopsida; Pinus pinea L.
2006,2006-07-15,Santarém,Salvaterra de Magos,Muge,Ribeira de Muge,39.1044624,-8.7130345,NC,12.0,2006-07-15T00:00,26.7,57,17.5,28.4,0.0,0.0,0.0,0.0,0,1014.8,1013.4,13,0,0,42,0.04,1.5,6.5,8.7,71,95,9.7,27.5,30.3,23.3,18.4,0.15,0.139,0.159,0.218,0,0.0,0.0,0.0,0.0,0.0,0.0,0.0,0.0,0.0,0.0,0.0,0.0,0.0,Tracheophyta; Vitis vinifera L.; Pinus pinaster Aiton; Magnoliopsida
2006,2006-07-14,Santarém,Chamusca,Carregueira,Vale Pequeno,39.3842927,-8.3065615,NC,125.0,2006-07-14T18:00,35.9,24,12.3,34.8,0.0,0.0,0.0,0.0,2,1012.7,998.8,52,0,56,62,0.35,4.48,12.6,17.1,329,330,24.8,40.9,31.3,24.9,19.7,0.046,0.071,0.117,0.176,1,3600.0,184.9,106.0,78.9,297.7,184.9,471.1,232.0,133.0,99.0,297.7,232.0,591.2,Tracheophyta; Quercus L.; Eucalyptus L'Hér.; Quercus suber L.; Olea europaea L.
2006,2006-07-15,Santarém,Torres Novas,Torres Novas (salvador),CASAL JOAO DIAS / VALE DA SERRA (Casal Adriano),39.4740441,-8.533946263218528,NC,45.0,2006-07-15T13:00,37.0,23,12.5,39.3,0.0,0.0,0.0,0.0,0,1014.4,1009.4,10,0,17,0,0.66,4.81,2.6,3.1,124,111,20.2,40.6,29.3,24.0,19.0,0.092,0.131,0.187,0.251,1,3600.0,838.1,681.1,157.0,718.1,838.1,1255.5,838.0,681.0,157.0,718.1,838.0,1255.4,Tracheophyta; Quercus L.
2006,2006-06-07,Santarém,Abrantes,Abrantes (são Vicente),ABRANTES,39.4627579,-8.2040378,NC,179.0,2006-06-07T17:00,31.3,22,7.1,28.7,0.0,0.0,0.0,0.0,0,1013.3,993.2,5,0,4,9,0.5,3.57,13.1,16.1,233,230,33.8,36.7,26.6,21.4,15.8,0.047,0.078,0.144,0.183,1,3600.0,469.4,372.5,96.8,711.5,469.4,695.3,543.0,431.0,112.0,711.5,543.0,804.4,Olea europaea L.; Tracheophyta; Pinus pinea L.
2006,2006-07-16,Santarém,Torres Novas,Zibreira,ZIBREIRA,39.47538845,-8.62370702220241,NC,101.0,2006-07-16T12:00,37.6,22,12.4,39.7,0.0,0.0,0.0,0.0,0,1015.0,1003.8,2,0,3,0,0.75,5.06,6.1,7.6,118,115,24.1,38.6,28.7,23.9,18.6,0.107,0.163,0.228,0.293,1,3600.0,930.2,798.8,131.4,850.5,930.2,1243.3,906.0,778.0,128.0,850.5,906.0,1210.9,Tracheophyta; Olea europaea L.; Magnoliopsida; Quercus L.; Vitis vinifera L.; Pinales; 
2006,2006-06-04,Santarém,Ourém,Nossa Senhora das Misericórdias,CASAL TOURO (Casal Branco),39.6222037,-8.6025221,NC,225.0,2006-06-04T15:00,31.1,18,4.0,30.6,0.0,0.0,0.0,0.0,0,1016.1,990.8,0,0,0,0,0.68,3.7,7.4,9.5,119,119,25.2,37.5,24.7,20.8,15.3,0.081,0.187,0.275,0.307,1,3600.0,834.7,727.2,107.5,893.8,834.7,1081.4,885.0,771.0,114.0,893.8,885.0,1146.5,Magnoliopsida; Olea europaea L.; Pinus pinaster Aiton; Tracheophyta; Vitis vinifera L.
2006,2006-06-08,Santarém,Cartaxo,Valada,VALADA,39.0902935,-8.751563014776432,NC,5.0,2006-06-08T13:00,28.1,35,11.1,29.7,0.0,0.0,0.0,0.0,0,1014.9,1014.3,1,1,0,0,0.7,2.49,8.9,10.8,207,206,29.2,33.6,25.1,22.2,16.4,0.137,0.212,0.285,0.289,1,3600.0,971.6,847.9,123.7,887.4,971.6,1268.6,974.0,850.0,124.0,887.4,974.0,1271.7,
2006,2006-06-08,Santarém,Vila Nova da Barquinha,Tancos,TANCOS,39.4768552,-8.390300777007887,NC,74.0,2006-06-08T16:00,30.4,27,9.1,29.4,0.0,0.0,0.0,0.0,0,1013.3,1004.9,0,0,0,0,0.6,3.19,12.4,15.1,240,237,32.0,38.0,26.0,21.9,16.4,0.045,0.086,0.155,0.203,1,3600.0,670.7,572.4,98.3,834.3,670.7,910.9,737.0,629.0,108.0,834.3,737.0,1000.9,Tracheophyta; Eucalyptus L'Hér.; Magnoliopsida; Olea europaea L.; ; Pinus pinaster Aiton
2006,2006-07-12,Santarém,Benavente,Santo Estêvão,SANTO ESTEVAO (Fonte de Santo António),38.863621,-8.7456467,NC,21.0,2006-07-12T15:00,38.0,25,14.6,40.0,0.7,0.7,0.0,0.0,53,1012.3,1010.0,34,0,27,61,0.71,4.96,7.8,9.7,292,297,33.5,43.4,29.3,23.3,19.0,0.057,0.095,0.117,0.143,1,3600.0,778.7,625.4,153.3,756.3,778.7,1094.5,823.0,661.0,162.0,756.3,823.0,1156.7,Oryza sativa L.; Tracheophyta
2006,2006-06-11,Santarém,Abrantes,Mouriscas,Mouriscas,39.47798215,-8.100333941618711,NC,45.0,2006-06-11T16:00,32.7,27,11.4,32.0,0.0,0.0,0.0,0.0,1,1013.2,1008.1,25,0,41,0,0.56,3.6,11.1,13.5,295,295,27.0,43.2,27.0,23.2,17.6,0.042,0.078,0.146,0.182,1,3600.0,574.5,428.8,145.7,623.3,574.5,912.7,631.0,471.0,160.0,623.3,631.0,1002.5,Tracheophyta; Quercus suber L.; Olea europaea L.; Eucalyptus L'Hér.; Pinus pinea L.
2006,2006-07-14,Santarém,Torres Novas,Ribeira Branca,Casal da Pinheira,39.5019639,-8.537673157345516,NC,90.0,2006-07-14T00:00,25.7,69,19.5,28.2,0.0,0.0,0.0,0.0,0,1013.8,1003.4,2,0,1,3,0.03,1.04,8.0,19.0,10,29,10.4,26.4,29.4,23.1,18.5,0.109,0.133,0.189,0.251,0,0.0,0.0,0.0,0.0,0.0,0.0,0.0,0.0,0.0,0.0,0.0,0.0,0.0,Olea europaea L.; Tracheophyta; Magnoliopsida; Vitis vinifera L.; Quercus L.; Pinales; 
2006,2006-07-13,Santarém,Mação,Carvoeiro,Maxieira,39.6446819,-7.9726019,NC,361.0,2006-07-13T17:00,33.4,26,11.0,32.5,0.0,0.0,0.0,0.0,1,1012.4,972.6,42,0,50,40,0.36,3.82,8.0,10.5,95,94,29.5,37.1,30.1,23.7,18.0,0.116,0.152,0.205,0.264,1,3600.0,319.2,165.7,153.5,311.2,319.2,704.4,368.0,191.0,177.0,311.2,368.0,812.2,Eucalyptus L'Hér.; Magnoliopsida; Pinus pinaster Aiton; Olea europaea L.
2006,2006-07-15,Santarém,Tomar,Asseiceira,LINHACEIRA - RODA (Linhaceira),39.5253624,-8.3797074,NC,82.0,2006-07-15T10:00,33.1,33,14.8,34.2,0.0,0.0,0.0,0.0,0,1015.8,1006.6,0,0,0,0,0.57,3.39,9.2,11.6,111,112,20.9,35.7,28.3,23.9,19.1,0.056,0.073,0.121,0.194,1,3600.0,751.3,638.8,112.5,814.4,751.3,1038.3,688.0,585.0,103.0,814.4,688.0,950.8,Tracheophyta; Eucalyptus L'Hér.; Pinus pinaster Aiton; Olea europaea L.; Pinus pinea L.; Magnoliopsida; Vitis vinifera L.; ; Acacia Mill.; Quercus suber L.
2006,2006-10-05,Santarém,Santarém,Vale de Figueira,Vale de Figueira,39.31378105,-8.62982955174531,NC,49.0,2006-10-05T15:00,22.0,50,11.1,20.5,0.0,0.0,0.0,0.0,0,1025.7,1019.9,0,0,0,0,0.39,1.32,14.1,18.4,357,359,32.8,23.0,19.3,21.0,22.2,0.362,0.335,0.243,0.314,1,3600.0,536.2,451.9,84.2,831.3,536.2,743.9,592.0,499.0,93.0,831.3,592.0,821.3,Vitis vinifera L.; Tracheophyta; Olea europaea L.; Magnoliopsida
2006,2006-06-14,Santarém,Mação,Penhascoso,RIBEIRA DE BOAS EIRAS (Ribeira de Boas Eiras ou Coadouro),39.5441262,-8.0399003,NC,252.0,2006-06-14T16:00,22.3,70,16.5,22.8,0.0,0.0,0.0,0.0,1,1009.3,980.4,35,5,15,73,0.32,0.81,11.8,15.1,117,118,37.4,24.1,22.3,22.1,16.4,0.279,0.153,0.217,0.242,1,3600.0,452.5,224.0,228.5,325.5,452.5,912.5,497.0,246.0,251.0,325.5,497.0,1002.2,Magnoliopsida; Olea europaea L.; Pinus pinaster Aiton; Eucalyptus L'Hér.; Tracheophyta
2006,2006-07-15,Santarém,Golegã,Azinhaga,Mato de Miranda,39.364113450000005,-8.589106535350787,NC,37.0,2006-07-15T13:00,37.1,24,13.0,39.6,0.0,0.0,0.0,0.0,0,1014.4,1010.3,10,0,17,0,0.66,4.82,2.6,3.1,124,111,20.2,39.0,29.0,23.9,18.8,0.121,0.166,0.223,0.275,1,3600.0,838.1,681.1,157.0,717.5,838.1,1256.5,838.0,681.0,157.0,717.5,838.0,1256.4,Eucalyptus L'Hér.; Olea europaea L.; Tracheophyta
2006,2006-10-07,Santarém,Santarém,Santarém (marvila),SANTAREM (SANTARÉM),39.23514975,-8.685082742502464,NC,107.0,2006-10-07T02:00,17.8,95,17.0,19.1,0.0,0.0,0.0,0.0,3,1021.3,1008.6,100,94,2,100,0.0,0.09,8.0,15.9,352,355,14.8,18.2,19.5,20.7,22.1,0.326,0.315,0.24,0.302,0,0.0,0.0,0.0,0.0,0.0,0.0,0.0,0.0,0.0,0.0,0.0,0.0,0.0,Tracheophyta; Magnoliopsida
2006,2006-07-14,Santarém,Ourém,Fátima,Maxieira,39.60322805,-8.663198476923824,NC,353.0,2006-07-14T13:00,34.7,27,12.8,36.7,0.0,0.0,0.0,0.0,0,1014.0,975.2,14,0,1,45,0.76,4.04,7.8,9.6,77,77,24.5,37.8,27.0,21.7,17.2,0.108,0.148,0.209,0.267,1,3600.0,942.1,826.1,116.0,870.9,942.1,1255.5,942.0,826.0,116.0,870.9,942.0,1255.4,Olea europaea L.; Magnoliopsida; Tracheophyta; Eucalyptus L'Hér.
2006,2006-06-20,Santarém,Benavente,Samora Correia,SAMORA CORREIA,38.93424185,-8.868042906346707,NC,11.0,2006-06-20T01:00,15.7,89,13.9,14.3,0.0,0.0,0.0,0.0,0,1016.0,1014.7,2,1,0,4,0.01,0.19,17.8,31.4,328,332,27.7,19.0,22.0,21.3,17.9,0.37,0.378,0.355,0.356,0,0.0,0.0,0.0,0.0,0.0,0.0,0.0,0.0,0.0,0.0,0.0,0.0,0.0,Quercus suber L.; Oryza sativa L.; Tracheophyta; Pinus pinaster Aiton; Quercus rotundifolia Lam.; Eucalyptus L'Hér.; Magnoliopsida; Pinus pinea L.; Olea europaea L.; Vitis vinifera L.; 
2006,2006-06-22,Santarém,Abrantes,Alferrarede,Casais de Revelhos,39.4908141,-8.1752191,NC,54.0,2006-06-22T23:00,21.9,71,16.5,22.5,0.0,0.0,0.0,0.0,0,1013.7,1007.4,4,0,0,15,0.04,0.75,11.1,20.6,324,333,22.0,23.6,26.3,21.8,18.0,0.059,0.097,0.131,0.18,0,0.0,0.0,0.0,0.0,0.0,0.0,0.0,0.0,0.0,0.0,0.0,0.0,0.0,Magnoliopsida; Tracheophyta; Eucalyptus L'Hér.; Pinus pinea L.; Pinus pinaster Aiton
2006,2006-07-15,Santarém,Golegã,Azinhaga,Quinta da Melhorada,39.364113450000005,-8.589106535350787,NC,37.0,2006-07-15T14:00,37.7,21,11.9,40.0,0.0,0.0,0.0,0.0,0,1014.2,1010.1,19,0,32,0,0.65,5.13,1.8,2.5,101,98,18.7,40.0,29.4,23.9,18.8,0.119,0.166,0.222,0.275,1,3600.0,821.1,670.1,151.0,737.5,821.1,1202.8,843.0,688.0,155.0,737.5,843.0,1234.9,Eucalyptus L'Hér.; Olea europaea L.; Tracheophyta
2006,2006-07-16,Santarém,Torres Novas,Ribeira Branca,RIBEIRA BRANCA,39.49164055,-8.581943493669895,NC,99.0,2006-07-16T13:00,38.4,19,10.7,39.9,0.0,0.0,0.0,0.0,1,1014.8,1003.9,29,0,49,0,0.7,5.48,4.3,5.2,132,124,22.3,40.1,29.1,23.9,18.6,0.106,0.163,0.228,0.293,1,3600.0,853.1,698.1,155.0,736.7,853.1,1254.5,853.0,698.0,155.0,736.7,853.0,1254.3,Olea europaea L.; Tracheophyta; Magnoliopsida; Vitis vinifera L.; Quercus L.; Pinales; 
2006,2006-07-16,Santarém,Santarém,Alcanede,Pé da Pedreira,39.4511297,-8.8294652,NC,271.0,2006-07-16T14:00,37.0,21,11.1,38.9,0.0,0.0,0.0,0.0,1,1014.7,984.9,25,0,41,0,0.67,4.94,2.8,3.4,320,328,18.0,40.9,28.4,23.1,18.1,0.096,0.156,0.223,0.29,1,3600.0,834.2,696.8,137.4,767.1,834.2,1202.5,856.0,715.0,141.0,767.1,856.0,1234.0,Magnoliopsida; Tracheophyta; Olea europaea L.
2006,2006-06-22,Santarém,Abrantes,Abrantes (são Vicente),ABRANTES,39.4627579,-8.2040378,NC,179.0,2006-06-22T16:00,32.7,30,12.7,32.5,0.0,0.0,0.0,0.0,0,1012.2,992.2,0,0,0,0,0.64,3.47,14.3,17.8,311,312,33.5,37.2,25.2,20.9,17.1,0.061,0.098,0.131,0.18,1,3600.0,675.1,574.7,100.3,826.2,675.1,921.2,740.0,630.0,110.0,826.2,740.0,1009.7,Olea europaea L.; Tracheophyta; Pinus pinea L.
2006,2006-06-24,Santarém,Salvaterra de Magos,Salvaterra de Magos,ESTRADA DA SERRA-MARINHAIS (SALVATERRA DE MAGOS),39.03300225,-8.770602392658907,NC,10.0,2006-06-24T17:00,22.6,56,13.3,20.5,0.0,0.0,0.0,0.0,2,1015.4,1014.2,76,84,0,0,0.35,1.22,21.7,29.0,317,317,44.3,26.0,23.0,21.2,17.4,0.262,0.337,0.341,0.35,1,3600.0,418.6,268.0,150.6,492.5,418.6,720.5,481.0,308.0,173.0,492.5,481.0,827.9,Magnoliopsida; Pinus pinaster Aiton; Tracheophyta
2006,2006-07-17,Santarém,Ourém,Nossa Senhora das Misericórdias,Vilar dos Prazeres,39.6422696,-8.5917408,NC,318.0,2006-07-17T13:00,35.7,22,10.6,36.2,0.0,0.0,0.0,0.0,1,1015.4,980.4,26,0,6,75,0.82,4.57,12.9,16.0,167,166,29.9,41.6,29.5,24.0,18.2,0.075,0.154,0.226,0.296,1,3600.0,949.2,806.2,143.0,852.2,949.2,1252.5,949.0,806.0,143.0,852.2,949.0,1252.2,Eucalyptus L'Hér.; Olea europaea L.; Pinus pinaster Aiton; Tracheophyta
2006,2006-06-27,Santarém,Ourém,Nossa Senhora da Piedade,COVA DE IRIA (Casal da Cova),39.6530504,-8.5793634,NC,140.0,2006-06-27T15:00,23.6,48,12.0,23.4,0.0,0.0,0.0,0.0,0,1016.9,1000.7,5,6,0,0,0.57,1.52,17.4,22.0,308,310,41.0,31.0,21.4,20.2,17.1,0.067,0.096,0.139,0.201,1,3600.0,823.9,709.5,114.5,858.6,823.9,1093.7,871.0,750.0,121.0,858.6,871.0,1156.1,Eucalyptus L'Hér.; Tracheophyta; Olea europaea L.; Magnoliopsida
2006,2006-07-17,Santarém,Ourém,Matas,Outeiro das Gameiras,39.7394723,-8.6707318,NC,180.0,2006-07-17T05:00,22.7,64,15.6,23.3,0.0,0.0,0.0,0.0,0,1014.8,994.0,4,0,4,7,0.04,0.98,8.7,17.3,173,176,9.7,23.0,28.1,22.6,17.9,0.06,0.081,0.122,0.197,0,0.0,0.0,0.0,0.0,0.0,0.0,0.0,0.0,0.0,0.0,0.0,0.0,0.0,Pinus pinaster Aiton; Eucalyptus L'Hér.
2006,2006-06-25,Santarém,Benavente,Samora Correia,PORTO ALTO,38.91171925,-8.893269999795915,NC,9.0,2006-06-25T20:00,19.1,71,13.7,17.8,0.0,0.0,0.0,0.0,1,1017.6,1016.5,36,40,0,0,0.07,0.64,16.6,25.3,326,327,35.3,22.2,22.4,21.4,18.4,0.288,0.356,0.351,0.355,1,1870.32,0.0,0.0,0.0,0.0,0.0,0.0,47.0,21.0,26.0,165.9,47.0,118.2,Quercus suber L.; Oryza sativa L.; Tracheophyta; Pinus pinaster Aiton; Quercus rotundifolia Lam.; Eucalyptus L'Hér.; Magnoliopsida; Pinus pinea L.; Olea europaea L.; Vitis vinifera L.; 
2006,2006-07-17,Santarém,Torres Novas,Chancelaria,Casal da Pena,39.5546367,-8.5550574,NC,71.0,2006-07-17T13:00,37.6,21,11.2,38.2,0.0,0.0,0.0,0.0,1,1015.0,1007.1,23,0,4,68,0.86,5.15,13.7,17.0,175,174,31.7,41.7,30.2,24.5,18.9,0.081,0.129,0.184,0.25,1,3600.0,960.0,827.0,133.0,874.0,960.0,1252.8,960.0,827.0,133.0,874.0,960.0,1252.8,Quercus L.; Olea europaea L.; Quercus suber L.; Tracheophyta; Magnoliopsida; Eucalyptus L'Hér.; Vitis vinifera L.; Pinus pinaster Aiton; 
2006,2006-07-17,Santarém,Coruche,São José Da Lamorosa,SÃO JOSE DA LAMAROSA (São José da Lamarosa),39.0713265,-8.400140924999999,NC,168.0,2006-07-17T14:00,38.4,17,9.4,37.9,0.0,0.0,0.0,0.0,0,1014.4,995.9,7,0,10,4,0.89,5.6,16.4,20.7,218,215,37.1,44.0,30.6,24.2,18.4,0.054,0.073,0.095,0.134,1,3600.0,921.0,801.3,119.8,882.9,921.0,1201.6,946.0,823.0,123.0,882.9,946.0,1234.2,Magnoliopsida; Eucalyptus L'Hér.; Quercus suber L.
2006,2006-07-18,Santarém,Alcanena,Bugalhos,BUGALHOS,39.4444792,-8.644586,NC,86.0,2006-07-18T15:00,33.7,28,12.5,33.9,0.0,0.0,0.0,0.0,1,1013.1,1003.5,22,0,1,70,0.72,3.77,14.0,16.9,154,153,43.2,36.6,28.8,24.7,18.8,0.107,0.163,0.219,0.274,1,3600.0,788.8,631.8,157.0,771.5,788.8,1084.4,834.0,668.0,166.0,771.5,834.0,1146.5,Magnoliopsida; Pinus pinaster Aiton; Quercus L.; Olea europaea L.; Tracheophyta; Vitis vinifera L.; 
2006,2006-07-18,Santarém,Chamusca,Carregueira,Carregueira,39.42025165,-8.41187015422318,NC,48.0,2006-07-18T18:00,30.1,41,15.4,31.3,0.0,0.0,0.0,0.0,1,1013.1,1007.6,30,0,20,61,0.22,2.51,3.9,5.2,214,214,25.6,33.7,30.4,25.5,19.9,0.079,0.07,0.114,0.178,1,3600.0,208.2,112.0,96.1,318.0,208.2,466.5,262.0,141.0,121.0,318.0,262.0,587.1,Tracheophyta; Pinus pinaster Aiton; Magnoliopsida
2006,2006-07-16,Santarém,Tomar,Beselga,Casal da Cerca,39.6094441,-8.4650583,NC,139.0,2006-07-16T15:00,38.3,18,10.1,38.9,0.0,0.0,0.0,0.0,0,1014.2,998.9,19,0,32,0,0.53,5.51,2.2,2.4,171,153,20.2,44.2,30.8,24.7,19.0,0.078,0.153,0.223,0.291,1,3600.0,632.8,495.6,137.2,604.7,632.8,1085.0,669.0,524.0,145.0,604.7,669.0,1147.1,Olea europaea L.; Magnoliopsida; Tracheophyta; Quercus L.; Pinus pinaster Aiton; Eucalyptus L'Hér.
2006,2006-07-17,Santarém,Ourém,Matas,Outeiro das Gameiras,39.7394723,-8.6707318,NC,180.0,2006-07-17T14:00,35.1,29,14.3,36.5,0.0,0.0,0.0,0.0,0,1014.8,994.8,5,0,0,18,0.8,4.02,14.0,17.7,241,237,35.6,42.6,28.8,22.7,17.9,0.059,0.08,0.121,0.197,1,3600.0,909.9,777.4,132.5,858.8,909.9,1198.5,934.0,798.0,136.0,858.8,934.0,1230.3,Pinus pinaster Aiton; Eucalyptus L'Hér.
2006,2006-07-18,Santarém,Ourém,Gondemaria,Poças,39.6882963,-8.6224161,NC,218.0,2006-07-18T12:00,29.6,36,12.8,27.3,0.0,0.0,0.0,0.0,1,1016.2,991.6,45,0,25,100,0.51,2.66,21.4,28.9,139,140,36.0,30.8,27.4,23.0,17.8,0.061,0.078,0.114,0.191,1,2413.47,502.2,131.5,370.7,140.4,502.2,1239.3,489.0,128.0,361.0,140.4,489.0,1206.8,Magnoliopsida; Tracheophyta; Olea europaea L.; Eucalyptus L'Hér.; Vitis vinifera L.; Quercus L.
2006,2006-07-23,Santarém,Ourém,Seiça,FONTAINHAS DA SERRA (Fontainhas),39.6688673,-8.5177306,NC,134.0,2006-07-23T02:00,17.8,96,17.2,18.2,0.0,0.0,0.0,0.0,1,1019.3,1003.4,30,33,0,0,0.0,0.08,14.4,26.2,338,344,28.1,19.4,26.1,24.7,19.9,0.059,0.082,0.132,0.223,0,0.0,0.0,0.0,0.0,0.0,0.0,0.0,0.0,0.0,0.0,0.0,0.0,0.0,Vitis vinifera L.; Magnoliopsida; Tracheophyta; Olea europaea L.; Quercus L.
2006,2006-07-18,Santarém,Ourém,Atouguia,Vale da Perra,39.6279222,-8.6228639,NC,278.0,2006-07-18T17:00,27.3,49,15.7,27.3,1.3,1.3,0.0,0.0,61,1014.1,982.6,52,0,37,98,0.32,1.84,13.5,20.8,214,214,37.8,34.8,29.2,24.6,18.6,0.1,0.153,0.225,0.296,1,3600.0,297.7,110.2,187.5,206.4,297.7,707.0,343.0,127.0,216.0,206.4,343.0,814.6,Magnoliopsida; Olea europaea L.; Pinus pinaster Aiton; Tracheophyta
2006,2006-07-14,Santarém,Tomar,Casais,Assamassa,39.6363956,-8.375989869965814,NC,150.0,2006-07-14T19:00,33.1,35,15.7,34.1,0.0,0.0,0.0,0.0,1,1013.9,997.1,31,0,7,89,0.16,3.27,6.3,10.8,336,345,15.5,35.9,31.3,24.6,19.0,0.102,0.16,0.224,0.289,1,3600.0,71.0,34.2,36.8,200.9,71.0,225.3,110.0,53.0,57.0,200.9,110.0,349.1,Olea europaea L.; Tracheophyta; Pinus pinaster Aiton; Magnoliopsida
2006,2006-07-19,Santarém,Chamusca,Chamusca,CHAMUSCA,39.33365205,-8.49101389250971,NC,14.0,2006-07-19T01:00,21.0,86,18.5,22.6,0.6,0.6,0.0,0.0,53,1014.0,1012.4,28,1,27,35,0.01,0.35,10.7,19.7,318,320,30.2,24.6,29.5,25.8,19.7,0.197,0.178,0.205,0.26,0,0.0,0.0,0.0,0.0,0.0,0.0,0.0,0.0,0.0,0.0,0.0,0.0,0.0,Vitis vinifera L.
2006,2006-07-19,Santarém,Chamusca,Chouto,Pego da Curva,39.1923902,-8.3503476,NC,94.0,2006-07-19T12:00,27.3,51,16.4,28.7,0.0,0.0,0.0,0.0,1,1015.7,1004.9,47,52,0,0,0.55,1.77,13.8,17.4,237,236,33.1,33.0,27.8,25.5,19.6,0.078,0.071,0.103,0.141,1,3600.0,775.1,548.2,226.9,584.3,775.1,1242.6,755.0,534.0,221.0,584.3,755.0,1210.4,Quercus suber L.; Tracheophyta; Pinus pinea L.; Eucalyptus L'Hér.
2006,2006-07-21,Santarém,Ourém,Atouguia,Alvega,39.6219111,-8.6515696,NC,357.0,2006-07-21T22:00,17.1,84,14.3,16.8,0.0,0.0,0.0,0.0,0,1021.5,979.6,0,0,0,0,0.01,0.32,12.4,22.2,324,333,26.6,21.5,25.1,23.1,17.8,0.123,0.143,0.2,0.265,0,0.0,0.0,0.0,0.0,0.0,0.0,0.0,0.0,0.0,0.0,0.0,0.0,0.0,Magnoliopsida; Olea europaea L.; Tracheophyta; Eucalyptus L'Hér.
2006,2006-07-27,Santarém,Santarém,Póvoa da Isenta,POVOA DA ISENTA (PÓVOA DA ISENTA),39.2237747,-8.7379449,Desconhecida,29.0,2006-07-27T14:00,26.9,40,12.3,25.9,0.0,0.0,0.0,0.0,0,1018.7,1015.3,0,0,0,0,0.67,2.1,23.7,30.6,327,328,50.4,31.4,25.2,24.3,19.6,0.206,0.232,0.253,0.311,1,3600.0,900.8,761.6,139.3,848.8,900.8,1189.8,925.0,782.0,143.0,848.8,925.0,1221.8,Tracheophyta; Quercus L.; Olea europaea L.; Vitis vinifera L.; Magnoliopsida
2006,2006-07-16,Santarém,Alcanena,Louriceira,Carvalheiro,39.408433,-8.657624,NC,40.0,2006-07-16T14:00,39.4,18,10.8,38.9,0.0,0.0,0.0,0.0,0,1015.3,1010.9,13,0,22,0,0.88,5.85,17.2,21.5,334,342,27.0,42.7,29.8,24.3,19.1,0.083,0.163,0.232,0.293,1,3600.0,864.1,740.4,123.7,815.4,864.1,1202.2,887.0,760.0,127.0,815.4,887.0,1234.0,Eucalyptus L'Hér.; Magnoliopsida; Olea europaea L.; Quercus suber L.; Pinus pinea L.; Quercus L.; Tracheophyta; Pinus pinaster Aiton; 
2006,2006-07-20,Santarém,Torres Novas,Olaia,PE DE CAO (OLAIA),39.52090425,-8.49928320563717,NC,108.0,2006-07-20T15:00,29.3,44,16.0,31.5,0.0,0.0,0.0,0.0,0,1017.7,1005.4,0,0,0,0,0.64,2.26,11.0,13.1,302,302,28.8,35.1,26.7,24.6,19.1,0.122,0.128,0.182,0.249,1,3600.0,815.0,707.2,107.8,866.9,815.0,1080.5,862.0,748.0,114.0,866.9,862.0,1142.8,Olea europaea L.; Quercus L.; Tracheophyta; Pinus pinaster Aiton; Eucalyptus L'Hér.; Magnoliopsida; Vitis vinifera L.; Quercus rotundifolia Lam.; 
2006,2006-07-18,Santarém,Ourém,Alburitel,Toucinhos,39.6475,-8.521667,NC,249.0,2006-07-18T16:00,31.9,29,11.7,31.1,0.2,0.2,0.0,0.0,51,1013.3,985.5,33,0,7,95,0.57,3.36,12.6,16.4,160,161,41.4,37.2,29.2,24.7,18.5,0.082,0.151,0.221,0.29,1,3600.0,592.1,441.6,150.5,639.1,592.1,914.9,649.0,484.0,165.0,639.1,649.0,1002.8,Tracheophyta; Vitis vinifera L.; Olea europaea L.; Eucalyptus L'Hér.; Pinus pinaster Aiton
2006,2006-01-23,Santarém,Ourém,Alburitel,ALBURITEL,39.63444695,-8.514248631944444,NC,219.0,2006-01-23T16:00,11.9,64,5.4,9.4,0.0,0.0,0.0,0.0,1,1023.8,997.3,50,55,0,0,0.12,0.5,9.7,13.0,117,114,24.8,12.1,9.3,9.7,13.4,0.341,0.354,0.349,0.272,1,3600.0,180.3,96.6,83.7,357.9,180.3,381.0,224.0,120.0,104.0,357.9,224.0,473.4,Olea europaea L.; Magnoliopsida; Pinus pinaster Aiton; Eucalyptus L'Hér.
2006,2006-07-21,Santarém,Ourém,Atouguia,Alvega,39.6219111,-8.6515696,NC,357.0,2006-07-21T23:00,16.5,88,14.5,16.2,0.0,0.0,0.0,0.0,0,1021.8,979.8,0,0,0,1,0.01,0.23,12.4,23.2,324,330,25.9,20.6,24.9,23.1,17.8,0.123,0.143,0.2,0.265,0,0.0,0.0,0.0,0.0,0.0,0.0,0.0,0.0,0.0,0.0,0.0,0.0,0.0,Magnoliopsida; Olea europaea L.; Tracheophyta; Eucalyptus L'Hér.
2006,2006-11-10,Santarém,Cartaxo,Pontével,GAIO DE CIMA (Fábrica Cerâmica Vale do Gaio),39.1490107,-8.8379672,NC,53.0,2006-11-10T00:00,15.5,85,12.9,15.1,0.0,0.0,0.0,0.0,0,1025.9,1019.5,2,0,3,0,0.0,0.27,9.5,21.5,65,80,16.9,15.9,17.9,19.0,21.5,0.394,0.406,0.367,0.272,0,0.0,0.0,0.0,0.0,0.0,0.0,0.0,0.0,0.0,0.0,0.0,0.0,0.0,Vitis vinifera L.; Tracheophyta
2006,2006-07-05,Santarém,Tomar,Beselga,Casal da Cerca,39.6094441,-8.4650583,NC,139.0,2006-07-05T12:00,25.1,42,11.4,24.6,0.0,0.0,0.0,0.0,1,1019.4,1003.3,35,39,0,0,0.61,1.84,18.2,22.9,333,334,42.5,30.3,23.1,21.8,18.1,0.081,0.167,0.238,0.295,1,3600.0,909.5,732.1,177.4,773.0,909.5,1253.1,887.0,714.0,173.0,773.0,887.0,1222.1,Olea europaea L.; Magnoliopsida; Tracheophyta; Quercus L.; Pinus pinaster Aiton; Eucalyptus L'Hér.
2006,2006-01-24,Santarém,Tomar,São Pedro de Tomar,Casal Mouzinho,39.5590549,-8.3611954,NC,81.0,2006-01-24T19:00,11.5,74,7.0,9.0,0.0,0.0,0.0,0.0,3,1019.3,1009.4,100,77,95,100,0.02,0.35,11.7,24.5,101,110,22.7,10.4,10.1,10.4,14.0,0.333,0.35,0.35,0.269,0,0.0,0.0,0.0,0.0,0.0,0.0,0.0,0.0,0.0,0.0,0.0,0.0,0.0,Tracheophyta; Magnoliopsida; Eucalyptus L'Hér.; Olea europaea L.
2006,2006-07-17,Santarém,Ourém,Atouguia,FIGUEIRAIS (Figueiras),39.6317169,-8.639528,Desconhecida,332.0,2006-07-17T13:00,35.6,22,10.5,36.5,0.0,0.0,0.0,0.0,1,1015.1,978.6,21,0,0,70,0.79,4.55,10.5,13.1,196,189,32.0,41.5,29.4,23.9,18.1,0.075,0.154,0.226,0.296,1,3600.0,940.2,788.2,152.0,833.2,940.2,1252.5,940.0,788.0,152.0,833.2,940.0,1252.2,Magnoliopsida; Tracheophyta; Olea europaea L.
2006,2006-07-20,Santarém,Ourém,Nossa Senhora das Misericórdias,MATAS / POÇAS (MATAS),39.6119456,-8.572450810665831,NC,201.0,2006-07-20T16:00,27.2,55,17.3,28.8,0.0,0.0,0.0,0.0,0,1017.8,994.8,0,0,0,0,0.52,1.64,13.8,16.9,309,310,32.0,35.6,27.7,25.1,19.3,0.113,0.152,0.223,0.296,1,3600.0,670.5,571.0,99.4,827.9,670.5,913.6,735.0,626.0,109.0,827.9,735.0,1001.5,Tracheophyta; Magnoliopsida; Olea europaea L.
2006,2006-07-22,Santarém,Tomar,Asseiceira,Roda Pequena,39.5249815,-8.4024886,NC,86.0,2006-07-22T23:00,19.2,83,16.3,18.8,0.0,0.0,0.0,0.0,0,1020.6,1010.4,3,3,0,0,0.03,0.37,17.7,30.2,333,338,37.1,21.4,26.2,24.6,19.9,0.051,0.068,0.114,0.191,0,0.0,0.0,0.0,0.0,0.0,0.0,0.0,0.0,0.0,0.0,0.0,0.0,0.0,Tracheophyta; Eucalyptus L'Hér.; Pinus pinaster Aiton; Olea europaea L.; Pinus pinea L.; Magnoliopsida; Vitis vinifera L.; 
2006,2006-07-06,Santarém,Ourém,Atouguia,Varzea,39.6641918,-8.6373018,NC,221.0,2006-07-06T04:00,13.4,91,12.0,11.7,0.0,0.0,0.0,0.0,0,1021.8,995.3,0,0,0,0,0.0,0.13,15.4,27.9,344,346,31.3,15.1,21.2,20.2,17.0,0.064,0.086,0.131,0.198,0,0.0,0.0,0.0,0.0,0.0,0.0,0.0,0.0,0.0,0.0,0.0,0.0,0.0,Tracheophyta; Magnoliopsida; Eucalyptus L'Hér.
2006,2006-07-24,Santarém,Tomar,Sabacheira,AGROAL (SABACHEIRA),39.6599098,-8.47448997133526,NC,186.0,2006-07-24T12:00,26.4,48,14.6,27.4,0.0,0.0,0.0,0.0,0,1017.9,996.6,9,10,0,0,0.63,1.77,16.1,20.2,318,320,36.0,35.4,25.5,24.3,19.7,0.057,0.082,0.131,0.223,1,3600.0,929.7,792.0,137.7,852.3,929.7,1231.6,905.0,771.0,134.0,852.3,905.0,1198.9,Magnoliopsida; Olea europaea L.; Eucalyptus L'Hér.; Tracheophyta; Pinus pinaster Aiton
2006,2006-07-20,Santarém,Ourém,Matas,Outeiro das Gameiras,39.7394723,-8.6707318,NC,180.0,2006-07-20T17:00,24.9,61,16.9,24.9,0.0,0.0,0.0,0.0,0,1018.8,998.0,0,0,0,0,0.39,1.22,17.2,21.7,323,324,36.7,31.8,26.2,23.0,18.2,0.095,0.079,0.118,0.195,1,3600.0,497.9,411.2,86.7,773.5,497.9,704.1,574.0,474.0,100.0,773.5,574.0,811.7,Pinus pinaster Aiton; Eucalyptus L'Hér.
2006,2006-07-21,Santarém,Coruche,Fajarda,Agolada,38.9662848,-8.597838,NC,45.0,2006-07-21T22:00,19.8,70,14.2,19.4,0.0,0.0,0.0,0.0,0,1021.2,1015.9,0,0,0,0,0.04,0.69,12.4,21.1,330,335,30.6,23.2,27.9,25.1,19.5,0.052,0.072,0.097,0.136,0,0.0,0.0,0.0,0.0,0.0,0.0,0.0,0.0,0.0,0.0,0.0,0.0,0.0,Oryza sativa L.; Tracheophyta; Pinus pinaster Aiton; Quercus suber L.
