2006,2006-07-26,Santarém,Ferreira do Zêzere,Dornes,DORNES,39.7705464,-8.2701688,Desconhecida,117.0,2006-07-26T13:00,27.8,43,13.9,28.4,0.0,0.0,0.0,0.0,0,1015.9,1002.5,1,0,0,3,0.68,2.14,18.1,22.7,313,313,41.8,37.2,26.6,25.4,20.6,0.067,0.132,0.199,0.286,1,3600.0,939.0,794.0,145.0,849.4,939.0,1239.4,939.0,794.0,145.0,849.4,939.0,1239.4,Magnoliopsida; Eucalyptus L'Hér.
2006,2006-07-05,Santarém,Santarém,Santarém (são Salvador),Portela das Padeiras,39.2630223,-8.6954875,NC,67.0,2006-07-05T19:00,19.7,61,12.1,16.6,0.0,0.0,0.0,0.0,0,1020.5,1012.6,0,0,0,0,0.19,0.89,26.1,37.5,334,336,52.6,23.9,22.9,20.7,17.7,0.127,0.177,0.222,0.268,1,3600.0,137.1,94.9,42.2,526.2,137.1,238.7,208.0,144.0,64.0,526.2,208.0,362.1,Tracheophyta; Pinus pinaster Aiton; Olea europaea L.; Magnoliopsida; Quercus suber L.; Pinus pinea L.
2006,2006-04-30,Santarém,Ourém,Olival,Achada,39.7117769,-8.6024919,NC,177.0,2006-04-30T21:00,14.8,71,9.6,13.5,0.0,0.0,0.0,0.0,0,1009.8,988.9,0,0,0,0,0.02,0.49,8.6,20.8,338,346,19.8,17.0,18.9,15.7,12.6,0.125,0.198,0.244,0.218,0,0.0,0.0,0.0,0.0,0.0,0.0,0.0,0.0,0.0,0.0,0.0,0.0,0.0,Tracheophyta; Magnoliopsida; Eucalyptus L'Hér.; Olea europaea L.
2006,2006-07-27,Santarém,Ourém,Nossa Senhora das Misericórdias,CASAL PINHEIRO (Casal Branco),39.6222037,-8.6025221,NC,225.0,2006-07-27T20:00,19.2,75,14.7,17.8,0.0,0.0,0.0,0.0,0,1018.0,991.6,0,0,0,0,0.07,0.55,19.8,31.3,327,330,46.8,25.4,26.2,24.3,19.8,0.075,0.149,0.217,0.294,0,912.48,0.0,0.0,0.0,0.0,0.0,0.0,30.0,15.0,15.0,135.9,30.0,87.9,Magnoliopsida; Olea europaea L.; Pinus pinaster Aiton; Tracheophyta; Vitis vinifera L.
2006,2006-07-24,Santarém,Mação,Cardigos,Carrascal,39.6947669,-8.0207277,NC,430.0,2006-07-24T20:00,21.6,62,14.0,20.6,0.0,0.0,0.0,0.0,0,1017.1,967.9,0,0,0,0,0.09,0.98,16.0,24.5,314,317,37.8,27.1,27.8,24.4,19.1,0.101,0.156,0.204,0.28,0,1136.45,0.0,0.0,0.0,0.0,0.0,0.0,33.0,17.0,16.0,154.2,33.0,87.6,Magnoliopsida; Olea europaea L.; Eucalyptus L'Hér.; Pinus pinaster Aiton; Tracheophyta
2006,2006-07-06,Santarém,Salvaterra de Magos,Granho,Granho,39.0705897,-8.663227192109929,NC,46.0,2006-07-06T17:00,26.9,35,10.3,23.9,0.0,0.0,0.0,0.0,0,1019.5,1014.2,0,0,0,0,0.5,2.29,22.4,30.1,334,335,45.4,31.1,23.5,20.9,17.7,0.129,0.148,0.167,0.219,1,3600.0,517.7,432.4,85.3,795.4,517.7,719.3,595.0,497.0,98.0,795.4,595.0,826.8,Tracheophyta; Quercus rotundifolia Lam.; Eucalyptus L'Hér.; Quercus suber L.
2006,2006-07-28,Santarém,Tomar,Serra,PORTELA LEGUA (Casal da Portela),39.5997966,-8.3005954,NC,318.0,2006-07-28T11:00,26.7,43,13.2,28.4,0.0,0.0,0.0,0.0,0,1015.6,979.6,5,0,0,16,0.57,1.98,6.5,7.9,357,3,24.1,32.2,24.5,24.5,20.0,0.09,0.157,0.216,0.306,1,3600.0,864.2,749.9,114.2,863.7,864.2,1151.7,817.0,709.0,108.0,863.7,817.0,1088.8,Olea europaea L.; Magnoliopsida; Tracheophyta; Quercus L.; Pinus pinaster Aiton; ; Eucalyptus L'Hér.
2006,2006-07-24,Santarém,Salvaterra de Magos,Glória do Ribatejo,RARET (RARET 1º),39.0391579,-8.65704069879346,NC,46.0,2006-07-24T13:00,29.5,35,12.5,30.3,0.0,0.0,0.0,0.0,0,1017.4,1012.1,0,0,0,0,0.73,2.68,14.8,18.6,319,319,34.6,35.4,26.0,24.8,19.6,0.129,0.188,0.222,0.249,1,3600.0,965.5,845.4,120.1,897.7,965.5,1248.1,965.0,845.0,120.0,897.7,965.0,1247.5,Tracheophyta
2006,2006-07-28,Santarém,Ourém,Nossa Senhora das Misericórdias,CASAL PINHEIRO (Casal Branco),39.6222037,-8.6025221,NC,225.0,2006-07-28T11:00,25.6,49,14.2,26.7,0.0,0.0,0.0,0.0,0,1016.0,990.3,2,0,0,5,0.56,1.66,12.1,14.9,343,345,34.6,30.6,24.3,24.2,19.8,0.075,0.149,0.217,0.293,1,3600.0,862.7,741.0,121.7,855.4,862.7,1149.0,815.0,700.0,115.0,855.4,815.0,1085.4,Magnoliopsida; Olea europaea L.; Pinus pinaster Aiton; Tracheophyta; Vitis vinifera L.
2006,2006-07-26,Santarém,Salvaterra de Magos,Glória do Ribatejo,GLORIA DO RIBATEJO (GLÓRIA DO RIBATEJO),39.047444,-8.605036,NC,82.0,2006-07-26T13:00,29.1,33,11.4,29.4,0.0,0.0,0.0,0.0,0,1015.6,1006.2,1,0,0,3,0.73,2.68,15.3,19.4,309,310,37.8,36.6,25.8,24.5,19.7,0.048,0.069,0.095,0.135,1,3600.0,953.5,826.4,127.1,879.9,953.5,1245.3,953.0,826.0,127.0,879.9,953.0,1244.7,Quercus suber L.; Tracheophyta; Pinus pinaster Aiton; Eucalyptus L'Hér.
2006,2006-07-29,Santarém,Cartaxo,Vale da Pinta,VALE DA PINTA,39.1700917,-8.821741016005028,NC,83.0,2006-07-29T10:00,24.9,56,15.5,24.6,0.0,0.0,0.0,0.0,0,1013.6,1004.0,0,0,0,0,0.44,1.38,17.5,23.0,346,346,37.4,27.1,23.9,23.8,19.9,0.1,0.159,0.207,0.254,1,3600.0,705.2,564.6,140.6,741.0,705.2,1010.8,642.0,514.0,128.0,741.0,642.0,920.3,Tracheophyta; Olea europaea L.; Pinus pinea L.; Vitis vinifera L.
2006,2006-07-30,Santarém,Alpiarça,Alpiarça,Patudos,39.24743025,-8.589787271453693,NC,14.0,2006-07-30T15:00,31.5,40,16.1,32.6,0.0,0.0,0.0,0.0,0,1015.4,1013.8,0,0,0,0,0.68,2.8,17.3,21.7,317,318,38.5,36.2,26.5,24.2,19.7,0.173,0.186,0.194,0.259,1,3600.0,791.9,684.3,107.6,852.1,791.9,1065.7,839.0,725.0,114.0,852.1,839.0,1129.1,Tracheophyta; Vitis vinifera L.; Quercus suber L.
2006,2006-07-30,Santarém,Ourém,Nossa Senhora da Piedade,Penigardos,39.6530504,-8.5793634,NC,140.0,2006-07-30T22:00,19.9,88,17.9,20.7,0.0,0.0,0.0,0.0,0,1018.6,1002.1,2,2,0,0,0.01,0.27,14.4,25.0,323,330,29.5,23.2,25.8,23.0,19.3,0.059,0.077,0.106,0.186,0,0.0,0.0,0.0,0.0,0.0,0.0,0.0,0.0,0.0,0.0,0.0,0.0,0.0,Eucalyptus L'Hér.; Tracheophyta; Olea europaea L.; Magnoliopsida
2006,2006-07-29,Santarém,Ourém,Nossa Senhora das Misericórdias,CASAL PINHEIRO (Casal Branco),39.6222037,-8.6025221,NC,225.0,2006-07-29T12:00,27.1,48,15.2,28.3,0.0,0.0,0.0,0.0,0,1013.2,987.7,0,0,0,0,0.64,1.86,16.4,20.5,334,336,41.0,33.3,24.9,24.1,19.9,0.075,0.148,0.216,0.293,1,3600.0,923.0,796.6,126.4,863.4,923.0,1224.1,898.0,775.0,123.0,863.4,898.0,1190.9,Magnoliopsida; Olea europaea L.; Pinus pinaster Aiton; Tracheophyta; Vitis vinifera L.
2006,2006-07-20,Santarém,Rio Maior,Alcobertas,Casais Monizes,39.4457052,-8.8971492,NC,367.0,2006-07-20T12:00,25.8,55,16.1,29.5,0.0,0.0,0.0,0.0,0,1019.1,977.4,0,0,0,0,0.62,1.49,4.8,5.6,297,297,19.1,32.1,24.6,23.2,17.8,0.142,0.154,0.219,0.289,1,3600.0,938.2,812.8,125.4,869.9,938.2,1237.7,913.0,791.0,122.0,869.9,913.0,1204.4,Magnoliopsida; Tracheophyta; Olea europaea L.; Pinus pinea L.
2006,2006-07-28,Santarém,Ourém,Nossa Senhora das Misericórdias,CASAL PINHEIRO (Casal Branco),39.6222037,-8.6025221,NC,225.0,2006-07-28T18:00,24.2,43,10.8,20.7,0.0,0.0,0.0,0.0,0,1013.9,988.1,0,0,0,0,0.35,1.73,25.7,35.3,329,330,51.5,31.9,26.4,24.2,19.9,0.075,0.148,0.216,0.293,1,3600.0,292.1,230.1,62.0,684.8,292.1,445.7,372.0,293.0,79.0,684.8,372.0,567.6,Magnoliopsida; Olea europaea L.; Pinus pinaster Aiton; Tracheophyta; Vitis vinifera L.
2006,2006-07-12,Santarém,Alcanena,Malhou,MALHOU,39.4267917,-8.6853252,NC,110.0,2006-07-12T13:00,36.0,31,16.4,38.7,0.0,0.0,0.0,0.0,0,1014.4,1002.2,0,0,0,0,0.79,4.09,11.4,13.3,325,327,27.0,39.5,27.0,22.2,18.2,0.08,0.168,0.237,0.294,1,3600.0,926.1,795.1,131.0,835.8,926.1,1259.0,926.0,795.0,131.0,835.8,926.0,1258.8,Eucalyptus L'Hér.; Magnoliopsida; Olea europaea L.; Quercus suber L.; Pinus pinea L.; Quercus L.; Tracheophyta; Pinus pinaster Aiton; 
2006,2006-07-28,Santarém,Tomar,Olalhas,Sesmarias,39.6531743,-8.2712539,NC,256.0,2006-07-28T02:00,16.0,92,14.7,15.6,0.0,0.0,0.0,0.0,0,1017.4,987.2,3,3,0,0,0.0,0.14,13.5,25.1,331,336,27.7,19.3,25.6,24.8,20.1,0.081,0.153,0.218,0.307,0,0.0,0.0,0.0,0.0,0.0,0.0,0.0,0.0,0.0,0.0,0.0,0.0,0.0,Eucalyptus L'Hér.; Magnoliopsida; Pinus pinaster Aiton; Tracheophyta; Olea europaea L.
2006,2006-07-27,Santarém,Rio Maior,Malaqueijo,MALAQUEIJO (Malaqueijinho),39.2893867,-8.8130681,NC,107.0,2006-07-27T15:00,25.5,45,12.5,24.2,0.0,0.0,0.0,0.0,0,1018.6,1006.2,0,0,0,0,0.6,1.8,24.0,31.2,327,329,50.4,30.8,24.4,23.3,19.4,0.104,0.162,0.215,0.275,1,3600.0,821.2,703.1,118.1,868.1,821.2,1074.1,869.0,744.0,125.0,868.1,869.0,1136.6,Olea europaea L.; Tracheophyta; Magnoliopsida; Pinus pinaster Aiton; Quercus suber L.; Eucalyptus L'Hér.; Vitis vinifera L.; 
2006,2006-07-07,Santarém,Tomar,Asseiceira,Roda Pequena,39.5249815,-8.4024886,NC,86.0,2006-07-07T00:00,18.5,75,14.1,18.0,0.0,0.0,0.0,0.0,0,1020.3,1010.1,0,0,0,0,0.03,0.53,12.5,24.5,327,336,25.9,20.0,24.2,21.7,18.5,0.045,0.082,0.131,0.197,0,0.0,0.0,0.0,0.0,0.0,0.0,0.0,0.0,0.0,0.0,0.0,0.0,0.0,Tracheophyta; Eucalyptus L'Hér.; Pinus pinaster Aiton; Olea europaea L.; Pinus pinea L.; Magnoliopsida; Vitis vinifera L.; 
2006,2006-07-13,Santarém,Golegã,Azinhaga,MATO MIRANDA (Mato de Miranda),39.364113450000005,-8.589106535350787,NC,37.0,2006-07-13T11:00,35.8,24,12.3,37.5,0.0,0.0,0.0,0.0,0,1014.1,1010.0,0,0,0,0,0.65,4.44,4.7,5.6,113,117,19.8,36.1,27.5,23.0,18.6,0.109,0.168,0.225,0.275,1,3600.0,869.0,752.8,116.1,849.3,869.0,1173.1,823.0,713.0,110.0,849.3,823.0,1111.1,Eucalyptus L'Hér.; Olea europaea L.; Tracheophyta
2006,2006-08-02,Santarém,Torres Novas,Torres Novas (santiago),Meia Via,39.4989978,-8.507991985469888,NC,83.0,2006-08-02T12:00,30.3,45,17.0,32.5,0.0,0.0,0.0,0.0,0,1014.0,1004.6,0,0,0,0,0.66,2.37,13.5,16.5,326,328,33.8,34.1,24.8,23.7,20.2,0.078,0.122,0.172,0.246,1,3600.0,894.3,770.9,123.3,840.1,894.3,1218.6,870.0,750.0,120.0,840.1,870.0,1185.6,Olea europaea L.; Magnoliopsida; Quercus L.; Tracheophyta; Pinales
2006,2006-07-12,Santarém,Torres Novas,Zibreira,Barroca,39.4843721,-8.6110195,NC,110.0,2006-07-12T13:00,36.4,29,15.5,39.7,0.0,0.0,0.0,0.0,0,1013.6,1001.4,1,0,0,2,0.73,4.31,5.2,6.0,335,343,20.5,39.1,27.1,22.2,18.2,0.098,0.168,0.233,0.294,1,3600.0,908.0,768.0,140.0,807.7,908.0,1258.3,908.0,768.0,140.0,807.7,908.0,1258.3,Tracheophyta; Olea europaea L.; Magnoliopsida; Quercus L.; Vitis vinifera L.; Pinales; 
2006,2006-07-28,Santarém,Torres Novas,Olaia,BAIRRO S.DOMINGOS (Casal do Domingos),39.47962,-8.53955,NC,61.0,2006-07-28T10:00,25.0,52,14.6,25.1,0.0,0.0,0.0,0.0,0,1016.4,1009.3,0,0,0,0,0.46,1.51,13.9,17.8,343,346,34.6,27.2,23.7,23.9,20.0,0.08,0.124,0.176,0.247,1,3600.0,731.8,606.7,125.1,794.0,731.8,1013.6,667.0,553.0,114.0,794.0,667.0,923.8,Olea europaea L.; Quercus L.; Tracheophyta; Pinus pinaster Aiton; Eucalyptus L'Hér.; Magnoliopsida; Vitis vinifera L.; Quercus rotundifolia Lam.; 
2006,2006-08-03,Santarém,Rio Maior,Outeiro da Cortiçada,OUTEIRO DA CORTIÇADA,39.3304828,-8.8254879,NC,45.0,2006-08-03T04:00,19.3,92,18.1,18.1,0.0,0.0,0.0,0.0,3,1013.0,1007.7,82,91,0,0,0.01,0.17,28.7,45.4,340,342,51.5,21.3,24.9,23.6,20.2,0.102,0.16,0.211,0.274,0,0.0,0.0,0.0,0.0,0.0,0.0,0.0,0.0,0.0,0.0,0.0,0.0,0.0,Magnoliopsida; Eucalyptus L'Hér.; Vitis vinifera L.; Tracheophyta; Olea europaea L.; Pinus pinaster Aiton; Quercus suber L.; 
2006,2006-07-29,Santarém,Ferreira do Zêzere,Dornes,DORNES,39.7705464,-8.2701688,NC,117.0,2006-07-29T11:00,27.7,45,14.7,28.2,0.0,0.0,0.0,0.0,0,1013.4,1000.0,0,0,0,0,0.59,2.04,16.5,20.5,337,338,38.9,33.3,25.9,25.2,20.9,0.066,0.131,0.196,0.285,1,3600.0,850.8,720.6,130.2,832.9,850.8,1147.9,804.0,681.0,123.0,832.9,804.0,1084.8,Magnoliopsida; Eucalyptus L'Hér.
2006,2006-07-30,Santarém,Alcanena,Bugalhos,BUGALHOS,39.4444792,-8.644586,NC,86.0,2006-07-30T02:00,17.7,91,16.2,18.3,0.0,0.0,0.0,0.0,0,1014.7,1004.5,8,8,0,4,0.0,0.19,10.8,21.5,330,337,24.5,20.3,24.9,23.6,19.8,0.1,0.158,0.21,0.272,0,0.0,0.0,0.0,0.0,0.0,0.0,0.0,0.0,0.0,0.0,0.0,0.0,0.0,Magnoliopsida; Pinus pinaster Aiton; Quercus L.; Olea europaea L.; Tracheophyta; Vitis vinifera L.; 
2006,2006-08-04,Santarém,Santarém,Alcanede,Murteira,39.4147304,-8.8213206,NC,88.0,2006-08-04T10:00,31.2,26,9.6,29.1,0.0,0.0,0.0,0.0,0,1012.9,1003.0,0,0,0,0,0.59,3.35,17.6,22.7,91,91,40.3,31.0,25.3,24.4,20.8,0.073,0.15,0.217,0.291,1,3600.0,724.2,616.3,107.9,821.2,724.2,997.2,658.0,560.0,98.0,821.2,658.0,906.0,Pinus pinea L.; Olea europaea L.; Tracheophyta; Magnoliopsida; Eucalyptus L'Hér.
2006,2006-07-30,Santarém,Santarém,Azoia de Cima,ATALAIA DE ALMOSTER (Atalaia),39.3511314,-8.737515476793373,NC,69.0,2006-07-30T12:00,28.3,49,16.6,30.1,0.0,0.0,0.0,0.0,0,1016.4,1008.5,0,0,0,0,0.64,1.96,15.8,20.0,333,334,37.4,32.4,24.8,23.8,20.1,0.076,0.154,0.221,0.29,1,3600.0,909.9,770.1,139.8,834.6,909.9,1224.5,885.0,749.0,136.0,834.6,885.0,1190.9,Tracheophyta; Olea europaea L.; Pinus pinaster Aiton; Magnoliopsida; Pinus pinea L.
2006,2006-07-31,Santarém,Rio Maior,Arrouquelas,ARROUQUELAS,39.2574609,-8.8981439,NC,50.0,2006-07-31T09:00,22.6,66,15.9,22.6,0.0,0.0,0.0,0.0,1,1019.8,1013.9,50,55,0,0,0.24,0.94,13.8,17.4,340,342,28.4,25.5,25.2,24.4,20.6,0.089,0.158,0.21,0.27,1,3600.0,384.3,199.1,185.2,323.9,384.3,815.8,332.0,172.0,160.0,323.9,332.0,704.8,Eucalyptus L'Hér.; Pinus pinaster Aiton; Tracheophyta; Magnoliopsida; Pinus pinea L.; Olea europaea L.; Vitis vinifera L.; 
2006,2006-07-29,Santarém,Rio Maior,Malaqueijo,MALAQUEIJO (Malaqueijinho),39.2893867,-8.8130681,NC,107.0,2006-07-29T13:00,27.7,48,15.7,29.1,0.0,0.0,0.0,0.0,0,1013.0,1000.8,0,0,0,0,0.67,1.94,17.3,21.7,337,339,42.5,31.8,24.1,23.1,19.5,0.103,0.161,0.214,0.274,1,3600.0,940.7,815.6,125.1,873.2,940.7,1239.2,940.0,815.0,125.0,873.2,940.0,1238.3,Olea europaea L.; Tracheophyta; Magnoliopsida; Pinus pinaster Aiton; Quercus suber L.; Eucalyptus L'Hér.; Vitis vinifera L.; 
2006,2006-07-29,Santarém,Alcanena,Alcanena,CRUZAMENTO DOS BUGALHOS (ALCANENA),39.4585519,-8.6697497,NC,84.0,2006-07-29T23:00,19.1,86,16.7,19.4,0.0,0.0,0.0,0.0,0,1015.2,1005.3,9,10,0,0,0.01,0.3,14.2,24.4,333,338,33.5,22.3,25.8,23.8,19.9,0.076,0.154,0.222,0.29,0,0.0,0.0,0.0,0.0,0.0,0.0,0.0,0.0,0.0,0.0,0.0,0.0,0.0,Tracheophyta; Olea europaea L.
2006,2006-07-16,Santarém,Ourém,Matas,Outeiro das Gameiras,39.7394723,-8.6707318,NC,180.0,2006-07-16T18:00,33.5,35,16.0,33.4,0.0,0.0,0.0,0.0,1,1014.2,994.1,20,0,34,0,0.36,3.35,14.3,23.2,342,347,31.0,37.8,29.3,22.4,17.9,0.06,0.081,0.122,0.197,1,3600.0,246.0,174.9,71.1,488.0,246.0,474.5,308.0,219.0,89.0,488.0,308.0,594.1,Pinus pinaster Aiton; Eucalyptus L'Hér.
2006,2006-08-03,Santarém,Cartaxo,Valada,Porto de Muge,39.1083937,-8.7384011,NC,5.0,2006-08-03T11:00,26.0,59,17.3,25.9,0.0,0.0,0.0,0.0,2,1013.0,1012.4,50,56,0,0,0.46,1.39,21.3,27.9,336,336,47.9,28.5,25.6,24.0,19.9,0.121,0.136,0.149,0.214,1,3600.0,684.9,449.6,235.4,523.7,684.9,1140.3,646.0,424.0,222.0,523.7,646.0,1075.5,
2006,2006-08-01,Santarém,Ourém,Casal dos Bernardos,Salgueira de Baixo,39.7687467,-8.541613329536881,NC,232.0,2006-08-01T11:00,25.4,59,16.8,25.2,0.0,0.0,0.0,0.0,3,1019.5,992.9,88,98,0,0,0.43,1.33,19.6,25.6,340,340,45.7,27.6,23.9,23.0,19.0,0.097,0.134,0.174,0.249,1,3600.0,622.7,371.7,251.0,432.3,622.7,1141.5,588.0,351.0,237.0,432.3,588.0,1077.9,Magnoliopsida; Pinus pinaster Aiton; Eucalyptus L'Hér.; Olea europaea L.; Tracheophyta
2006,2006-08-01,Santarém,Constância,Santa Margarida da Coutada,Lagoa do Porco,39.4455364,-8.3094984,NC,107.0,2006-08-01T15:00,30.8,41,15.9,31.3,0.0,0.0,0.0,0.0,0,1016.8,1004.7,1,1,0,0,0.65,2.65,19.2,24.3,326,328,42.5,42.0,27.8,25.4,21.4,0.037,0.063,0.102,0.171,1,3600.0,750.7,613.9,136.7,770.5,750.7,1058.0,796.0,651.0,145.0,770.5,796.0,1121.9,Eucalyptus L'Hér.; Magnoliopsida; Olea europaea L.; Pinus pinaster Aiton
2006,2006-05-28,Santarém,Santarém,Abrã,AE1 Km 81 N/S (ABRÃ),39.437345,-8.7671161,NC,175.0,2006-05-28T17:00,30.8,37,14.4,29.6,1.3,1.3,0.0,0.0,61,1016.5,996.7,5,0,6,6,0.47,2.8,17.9,23.3,338,340,41.8,37.2,26.6,19.1,14.8,0.084,0.198,0.286,0.306,1,3600.0,416.1,311.9,104.2,605.3,416.1,686.4,483.0,362.0,121.0,605.3,483.0,796.7,Olea europaea L.; Magnoliopsida; Eucalyptus L'Hér.; Tracheophyta; Pinus pinea L.
2006,2006-07-16,Santarém,Cartaxo,Cartaxo,CARTAXO,39.1485725,-8.877689484405941,NC,112.0,2006-07-16T07:00,24.5,64,17.3,25.7,0.0,0.0,0.0,0.0,0,1015.5,1002.5,0,0,0,0,0.12,1.1,10.1,18.7,17,28,19.4,24.7,28.2,24.0,18.6,0.118,0.203,0.254,0.287,1,3600.0,199.4,129.5,69.9,449.8,199.4,381.0,134.0,87.0,47.0,449.8,134.0,256.1,Vitis vinifera L.; Eucalyptus L'Hér.; Tracheophyta
2006,2006-07-29,Santarém,Coruche,Coruche,Foros de Vale Mansos,38.9362945,-8.4873305,NC,37.0,2006-07-29T00:00,19.2,64,12.1,17.6,0.0,0.0,0.0,0.0,0,1014.2,1009.8,4,0,0,12,0.07,0.81,15.6,28.3,334,338,26.6,21.2,26.6,24.9,20.5,0.048,0.072,0.1,0.13,0,0.0,0.0,0.0,0.0,0.0,0.0,0.0,0.0,0.0,0.0,0.0,0.0,0.0,Pinus pinea L.; Tracheophyta; Pinus pinaster Aiton; Quercus suber L.; Olea europaea L.
2006,2006-06-06,Santarém,Rio Maior,Rio Maior,RIO MAIOR,39.3365387,-8.9364098,NC,73.0,2006-06-06T14:00,33.4,17,4.8,30.9,0.0,0.0,0.0,0.0,1,1012.4,1004.2,27,0,0,91,0.69,4.28,15.1,19.5,181,177,37.1,36.7,26.4,21.9,16.3,0.089,0.18,0.263,0.28,1,3600.0,714.3,309.1,405.3,340.0,714.3,1207.3,735.0,318.0,417.0,340.0,735.0,1242.3,Tracheophyta; Magnoliopsida
2006,2006-08-02,Santarém,Santarém,Alcanede,Murteira,39.4147304,-8.8213206,Desconhecida,88.0,2006-08-02T14:00,30.1,42,15.9,30.8,0.0,0.0,0.0,0.0,0,1013.9,1003.9,0,0,0,0,0.7,2.47,20.9,26.6,336,337,46.1,36.8,26.1,24.3,20.6,0.072,0.151,0.218,0.292,1,3600.0,872.1,756.3,115.8,853.2,872.1,1177.2,896.0,777.0,119.0,853.2,896.0,1209.5,Pinus pinea L.; Olea europaea L.; Tracheophyta; Magnoliopsida; Eucalyptus L'Hér.
2006,2006-06-18,Santarém,Tomar,Sabacheira,Monchite,39.6747102,-8.48813247013226,NC,97.0,2006-06-18T17:00,22.6,74,17.8,22.5,0.0,0.0,0.0,0.0,0,1015.5,1004.2,16,2,16,15,0.26,0.7,20.4,25.7,324,326,36.4,27.5,23.9,21.5,17.6,0.171,0.115,0.169,0.238,1,3600.0,339.1,183.4,155.6,340.7,339.1,713.3,390.0,211.0,179.0,340.7,390.0,820.5,Olea europaea L.; Magnoliopsida; Pinus pinaster Aiton; Tracheophyta; Eucalyptus L'Hér.
2006,2006-07-30,Santarém,Ourém,Nossa Senhora das Misericórdias,CASAL PINHEIRO (Casal Branco),39.6222037,-8.6025221,NC,225.0,2006-07-30T10:00,24.5,58,15.8,24.8,0.0,0.0,0.0,0.0,0,1016.2,990.4,4,5,0,0,0.44,1.28,15.9,20.4,332,334,37.8,28.1,24.7,24.1,20.0,0.074,0.148,0.216,0.293,1,3600.0,724.6,604.9,119.7,795.7,724.6,1008.8,660.0,551.0,109.0,795.7,660.0,918.9,Magnoliopsida; Olea europaea L.; Pinus pinaster Aiton; Tracheophyta; Vitis vinifera L.
2006,2006-06-20,Santarém,Rio Maior,Azambujeira,Calhariz,39.267355,-8.7928726,NC,80.0,2006-06-20T11:00,21.6,65,14.7,21.4,0.0,0.0,0.0,0.0,1,1016.5,1007.1,33,4,0,99,0.46,0.9,20.8,27.2,330,332,45.0,23.9,20.5,20.5,17.0,0.214,0.209,0.251,0.282,1,3600.0,850.8,673.9,176.9,748.9,850.8,1191.9,808.0,640.0,168.0,748.9,808.0,1131.9,Olea europaea L.; Tracheophyta; Magnoliopsida; Pinus pinaster Aiton; Quercus suber L.; Eucalyptus L'Hér.; Vitis vinifera L.; 
2006,2006-08-02,Santarém,Cartaxo,Vale da Pinta,VALE DA PINTA,39.1700917,-8.821741016005028,NC,83.0,2006-08-02T10:00,24.8,60,16.5,25.4,0.0,0.0,0.0,0.0,0,1015.3,1005.7,0,0,0,0,0.43,1.25,14.8,18.9,334,336,34.6,27.4,24.1,23.7,20.2,0.099,0.157,0.205,0.254,1,3600.0,706.1,586.3,119.9,776.3,706.1,1002.9,642.0,533.0,109.0,776.3,642.0,911.8,Tracheophyta; Olea europaea L.; Pinus pinea L.; Vitis vinifera L.
2006,2006-07-22,Santarém,Torres Novas,Zibreira,ZIBREIRA,39.47538845,-8.62370702220241,NC,101.0,2006-07-22T11:00,25.0,45,12.3,25.1,0.0,0.0,0.0,0.0,0,1021.1,1009.4,0,0,0,0,0.57,1.73,15.0,18.8,330,331,36.7,27.9,24.1,24.4,19.2,0.125,0.158,0.223,0.292,1,3600.0,885.1,767.8,117.4,877.2,885.1,1159.6,837.0,726.0,111.0,877.2,837.0,1096.6,Tracheophyta; Olea europaea L.; Magnoliopsida; Quercus L.; Vitis vinifera L.; Pinales; 
2006,2006-08-02,Santarém,Alcanena,Louriceira,Pena dos Corvos,39.408433,-8.657624,NC,40.0,2006-08-02T16:00,30.7,40,15.4,28.4,0.0,0.0,0.0,0.0,0,1014.3,1009.8,0,0,0,0,0.64,2.67,32.8,44.2,348,350,52.6,35.9,26.4,24.1,20.5,0.076,0.152,0.219,0.289,1,3600.0,637.4,543.0,94.4,812.2,637.4,887.9,702.0,598.0,104.0,812.2,702.0,977.8,Eucalyptus L'Hér.; Magnoliopsida; Olea europaea L.; Quercus suber L.; Pinus pinea L.; Quercus L.; Tracheophyta; Pinus pinaster Aiton; 
2006,2006-07-25,Santarém,Ferreira do Zêzere,Pias,PIAS,39.7169063,-8.3319658,NC,233.0,2006-07-25T11:00,26.6,43,12.9,27.4,0.0,0.0,0.0,0.0,0,1017.0,990.4,0,0,0,0,0.58,1.99,11.0,13.5,328,331,33.8,32.2,25.5,25.1,20.1,0.082,0.155,0.22,0.308,1,3600.0,870.3,756.1,114.2,867.7,870.3,1155.1,823.0,715.0,108.0,867.7,823.0,1092.4,Eucalyptus L'Hér.; Magnoliopsida; Olea europaea L.; Tracheophyta
2006,2006-07-26,Santarém,Santarém,Santarém (marvila),SANTAREM (SANTARÉM),39.23514975,-8.685082742502464,NC,107.0,2006-07-26T18:00,24.5,45,11.8,21.7,0.0,0.0,0.0,0.0,0,1016.3,1003.9,0,0,0,0,0.34,1.7,23.5,31.7,328,328,46.1,29.2,25.8,23.9,19.0,0.207,0.232,0.254,0.311,1,3600.0,296.8,233.0,63.8,684.4,296.8,451.4,377.0,296.0,81.0,684.4,377.0,573.4,Tracheophyta; Magnoliopsida
2006,2006-08-02,Santarém,Alcanena,Moitas Venda,MOITAS VENDAS (MOITAS VENDA),39.492986,-8.6569517320159,NC,168.0,2006-08-02T18:00,25.6,55,16.0,23.8,0.0,0.0,0.0,0.0,0,1013.1,993.9,0,0,0,0,0.31,1.47,26.3,36.4,337,339,52.6,32.4,26.6,23.8,20.1,0.072,0.151,0.218,0.292,1,3600.0,268.2,206.0,62.2,636.0,268.2,430.3,345.0,265.0,80.0,636.0,345.0,553.4,Olea europaea L.; Pinus pinaster Aiton; Tracheophyta; Quercus L.; Magnoliopsida; 
2006,2006-07-17,Santarém,Abrantes,Alvega,RUA DO MOINHO DE VENTO (Ribeira da Moinhola),39.42896705,-8.082652111219861,NC,170.0,2006-07-17T17:00,38.4,17,9.5,35.6,0.0,0.0,0.0,0.0,0,1013.1,994.4,0,0,0,0,0.65,5.6,19.0,24.6,233,232,40.0,46.2,32.7,25.7,19.9,0.042,0.069,0.111,0.171,1,3600.0,483.2,388.0,95.3,733.4,483.2,700.4,558.0,448.0,110.0,733.4,558.0,808.8,Eucalyptus L'Hér.; Olea europaea L.; Quercus suber L.; Tracheophyta; Pinus pinaster Aiton; Magnoliopsida; 
2006,2006-07-17,Santarém,Chamusca,Carregueira,HERDADE DA BALEIRA (Ribeira Vale da Herdade),39.3560025,-8.4802892,NC,35.0,2006-07-17T17:00,36.9,25,13.6,35.3,0.0,0.0,0.0,0.0,0,1013.6,1009.7,0,0,0,0,0.64,4.69,20.2,26.3,230,229,38.5,41.2,31.4,24.7,19.1,0.076,0.111,0.158,0.218,1,3600.0,498.6,415.4,83.2,779.2,498.6,705.8,575.0,479.0,96.0,779.2,575.0,813.9,Tracheophyta; Olea europaea L.; Magnoliopsida
2006,2006-06-24,Santarém,Alcanena,Alcanena,OLHOS DE AGUA (ALCANENA),39.4585519,-8.6697497,NC,84.0,2006-06-24T00:00,16.3,89,14.4,14.6,0.0,0.0,0.0,0.0,2,1015.2,1005.2,74,82,0,0,0.02,0.21,21.3,33.2,332,334,40.7,19.4,23.3,20.9,17.3,0.11,0.195,0.254,0.297,0,0.0,0.0,0.0,0.0,0.0,0.0,0.0,0.0,0.0,0.0,0.0,0.0,0.0,Tracheophyta; Olea europaea L.
2006,2006-08-02,Santarém,Santarém,Santarém (marvila),SANTAREM (SANTARÉM),39.23514975,-8.685082742502464,NC,107.0,2006-08-02T13:00,30.6,41,16.0,32.3,0.0,0.0,0.0,0.0,0,1013.6,1001.5,0,0,0,0,0.72,2.57,16.1,20.1,331,333,38.2,33.3,25.0,23.6,19.5,0.199,0.231,0.251,0.31,1,3600.0,927.4,807.3,120.1,870.4,927.4,1231.9,927.0,807.0,120.0,870.4,927.0,1231.3,Tracheophyta; Magnoliopsida
2006,2006-06-26,Santarém,Salvaterra de Magos,Marinhais,MARINHAIS,39.03184385,-8.682415411567288,NC,44.0,2006-06-26T16:00,22.6,47,10.8,20.3,0.0,0.0,0.0,0.0,2,1016.1,1011.0,64,44,2,78,0.38,1.44,17.5,23.0,323,325,37.1,27.0,22.1,21.2,17.6,0.153,0.242,0.245,0.253,1,3600.0,470.4,259.4,211.0,369.6,470.4,928.8,515.0,284.0,231.0,369.6,515.0,1017.0,Tracheophyta; Quercus suber L.; Eucalyptus L'Hér.; Pinus pinaster Aiton; Magnoliopsida
2006,2006-07-27,Santarém,Ourém,Nossa Senhora das Misericórdias,CASAL PINHEIRO (Casal Branco),39.6222037,-8.6025221,NC,225.0,2006-07-27T12:00,24.6,47,12.6,23.9,0.0,0.0,0.0,0.0,0,1018.7,992.8,3,3,0,0,0.61,1.64,22.4,28.7,323,325,48.2,31.2,24.8,24.3,19.8,0.075,0.149,0.218,0.294,1,3600.0,939.4,809.9,129.5,875.0,939.4,1227.4,914.0,788.0,126.0,875.0,914.0,1194.2,Magnoliopsida; Olea europaea L.; Pinus pinaster Aiton; Tracheophyta; Vitis vinifera L.
2006,2006-07-28,Santarém,Ourém,Nossa Senhora das Misericórdias,CASAL PINHEIRO (Casal Branco),39.6222037,-8.6025221,NC,225.0,2006-07-28T14:00,28.0,40,13.2,28.3,0.0,0.0,0.0,0.0,0,1014.6,989.1,4,0,0,12,0.69,2.26,18.1,22.4,329,330,41.0,36.1,25.3,24.1,19.8,0.075,0.148,0.217,0.293,1,3600.0,903.4,788.6,114.9,883.4,903.4,1184.1,928.0,810.0,118.0,883.4,928.0,1216.3,Magnoliopsida; Olea europaea L.; Pinus pinaster Aiton; Tracheophyta; Vitis vinifera L.
2006,2006-07-18,Santarém,Santarém,Santarém (marvila),SANTAREM (SANTARÉM),39.23514975,-8.685082742502464,NC,107.0,2006-07-18T19:00,28.6,45,15.5,29.4,0.0,0.0,0.0,0.0,0,1013.3,1001.1,9,0,6,17,0.16,2.15,7.1,10.8,294,296,18.7,30.8,29.3,24.5,18.3,0.242,0.233,0.258,0.312,1,3600.0,96.9,48.4,48.4,291.7,96.9,219.9,152.0,76.0,76.0,291.7,152.0,345.0,Tracheophyta; Magnoliopsida
2006,2006-07-29,Santarém,Tomar,Madalena,MONTES (Monte Agudo),39.5767893,-8.4402995,NC,109.0,2006-07-29T21:00,20.9,74,16.1,20.0,0.0,0.0,0.0,0.0,0,1014.3,1001.6,0,0,0,0,0.06,0.64,20.6,33.4,327,331,38.5,26.0,28.0,25.1,20.8,0.082,0.154,0.21,0.284,0,0.0,0.0,0.0,0.0,0.0,0.0,0.0,0.0,0.0,0.0,0.0,0.0,0.0,Magnoliopsida; Olea europaea L.; Vitis vinifera L.
2006,2006-07-18,Santarém,Mação,Mação,Vale de Abelha,39.4956376,-8.0263601,NC,152.0,2006-07-18T19:00,28.8,43,14.9,29.6,0.0,0.0,0.0,0.0,1,1013.9,996.6,26,0,20,48,0.13,2.26,5.6,9.2,130,135,18.4,31.6,30.7,26.5,20.0,0.111,0.137,0.182,0.235,1,1882.59,63.3,19.4,43.9,122.8,63.3,209.7,101.0,31.0,70.0,122.8,101.0,334.4,Pinus pinaster Aiton; Magnoliopsida; Eucalyptus L'Hér.
2006,2006-02-11,Santarém,Alcanena,Serra de Santo António,COVO DO COELHO (Penedo Covo),39.512984,-8.7297658,NC,360.0,2006-02-11T21:00,7.6,93,6.6,5.6,0.0,0.0,0.0,0.0,0,1020.1,976.6,0,0,0,0,0.0,0.07,7.8,19.2,326,330,15.1,8.8,10.2,8.5,11.4,0.33,0.341,0.34,0.275,0,0.0,0.0,0.0,0.0,0.0,0.0,0.0,0.0,0.0,0.0,0.0,0.0,0.0,Olea europaea L.; Magnoliopsida; Tracheophyta; Quercus L.; Pinus pinaster Aiton; 
2006,2006-08-02,Santarém,Tomar,Beselga,ESTRADA BOCA DA MATA / CASTELO DO BODE (Casal da Estrada),39.6132547,-8.4809149,NC,157.0,2006-08-02T14:00,32.0,39,16.4,33.5,0.0,0.0,0.0,0.0,0,1013.0,995.4,0,0,0,0,0.73,2.89,17.0,21.6,328,330,39.2,38.5,26.3,24.3,20.4,0.077,0.145,0.209,0.286,1,3600.0,867.7,753.9,113.8,853.1,867.7,1173.6,892.0,775.0,117.0,853.1,892.0,1206.5,Olea europaea L.; Magnoliopsida; Vitis vinifera L.; Tracheophyta
2006,2006-08-02,Santarém,Ourém,Caxarias,CAXARIAS,39.71452005,-8.545375200000006,NC,142.0,2006-08-02T21:00,21.8,74,17.0,21.2,0.0,0.0,0.0,0.0,0,1013.7,997.2,0,0,0,0,0.06,0.67,20.9,36.7,331,339,41.4,26.2,27.4,24.2,20.7,0.052,0.079,0.125,0.219,0,0.0,0.0,0.0,0.0,0.0,0.0,0.0,0.0,0.0,0.0,0.0,0.0,0.0,Magnoliopsida; Tracheophyta; Eucalyptus L'Hér.; Olea europaea L.
