2006,2006-07-23,Santarém,Mação,Cardigos,Mesão Frio,39.6947669,-8.0207277,NC,430.0,2006-07-23T13:00,30.8,32,12.1,32.8,0.0,0.0,0.0,0.0,0,1016.5,968.7,0,0,0,0,0.73,3.02,7.4,8.7,284,287,25.6,37.3,26.0,24.4,19.0,0.103,0.157,0.205,0.281,1,3600.0,960.4,847.4,112.9,902.9,960.4,1243.7,961.0,848.0,113.0,902.9,961.0,1244.5,Magnoliopsida; Olea europaea L.; Eucalyptus L'Hér.; Pinus pinaster Aiton; Tracheophyta
2006,2006-07-07,Santarém,Santarém,Póvoa de Santarém,POVOA DE SANTAREM (PÓVOA DE SANTARÉM),39.2987291,-8.687548601049528,NC,70.0,2006-07-07T23:00,18.8,70,13.2,16.8,0.0,0.0,0.0,0.0,0,1018.1,1009.8,0,0,0,0,0.07,0.65,20.4,35.3,334,340,35.3,21.5,24.1,20.8,17.8,0.121,0.174,0.22,0.268,0,0.0,0.0,0.0,0.0,0.0,0.0,0.0,0.0,0.0,0.0,0.0,0.0,0.0,Olea europaea L.; Tracheophyta; Magnoliopsida
2006,2006-07-24,Santarém,Santarém,Achete,Verdelho,39.3156293,-8.6868431,NC,81.0,2006-07-24T17:00,24.7,49,13.2,22.7,0.0,0.0,0.0,0.0,0,1017.1,1007.7,0,0,0,0,0.42,1.59,21.3,27.9,323,324,45.4,29.8,25.4,23.7,19.1,0.126,0.161,0.203,0.264,1,3600.0,495.6,410.9,84.8,781.4,495.6,696.9,573.0,475.0,98.0,781.4,573.0,805.7,Tracheophyta; Olea europaea L.
2006,2006-07-10,Santarém,Mação,Envendos,SAO JOSE DAS MATAS (São José das Matas),39.5719568,-7.8585864,NC,394.0,2006-07-10T14:00,35.4,21,9.8,36.1,0.0,0.0,0.0,0.0,1,1018.5,975.2,26,0,0,87,0.74,4.53,8.7,10.1,287,287,26.3,40.9,28.2,22.6,17.8,0.1,0.163,0.219,0.285,1,3600.0,860.7,636.0,224.7,700.9,860.7,1200.7,885.0,654.0,231.0,700.9,885.0,1234.6,Eucalyptus L'Hér.; Magnoliopsida; Pinus pinaster Aiton
2006,2006-07-25,Santarém,Tomar,Sabacheira,Suimo,39.6774374,-8.4825433,NC,101.0,2006-07-25T05:00,16.4,95,15.7,16.7,0.0,0.0,0.0,0.0,0,1017.9,1005.9,13,14,0,0,0.0,0.09,11.5,19.4,360,1,24.8,17.9,25.6,24.8,20.3,0.056,0.081,0.131,0.222,0,0.0,0.0,0.0,0.0,0.0,0.0,0.0,0.0,0.0,0.0,0.0,0.0,0.0,Olea europaea L.; Eucalyptus L'Hér.; Magnoliopsida; Tracheophyta
2006,2006-07-29,Santarém,Ourém,Alburitel,ALBURITEL,39.63444695,-8.514248631944444,NC,219.0,2006-07-29T22:00,19.0,81,15.7,18.6,0.0,0.0,0.0,0.0,0,1014.9,989.3,1,1,0,1,0.03,0.41,16.1,27.4,331,335,34.6,23.5,26.5,24.0,19.7,0.076,0.146,0.212,0.287,0,0.0,0.0,0.0,0.0,0.0,0.0,0.0,0.0,0.0,0.0,0.0,0.0,0.0,Olea europaea L.; Magnoliopsida; Pinus pinaster Aiton; Eucalyptus L'Hér.
2006,2006-07-13,Santarém,Mação,Envendos,Vale da Mua,39.5890147,-7.9211774,NC,255.0,2006-07-13T16:00,35.5,22,10.3,34.4,0.0,0.0,0.0,0.0,1,1012.5,984.4,31,0,31,40,0.48,4.53,8.4,10.9,50,46,27.4,39.2,30.8,24.5,18.6,0.12,0.163,0.217,0.272,1,3600.0,458.5,314.5,144.0,456.0,458.5,912.7,503.0,345.0,158.0,456.0,503.0,1001.2,Pinus pinaster Aiton; Magnoliopsida; Tracheophyta; Eucalyptus L'Hér.
2006,2006-07-13,Santarém,Ferreira do Zêzere,Dornes,Rio Cimeiro,39.770769,-8.2692354,NC,117.0,2006-07-13T18:00,33.4,34,15.5,33.8,1.6,1.6,0.0,0.0,61,1012.6,999.5,37,0,19,86,0.3,3.39,10.5,17.7,31,38,31.7,39.6,31.5,24.4,19.3,0.091,0.14,0.212,0.291,1,3600.0,200.6,103.9,96.7,289.5,200.6,475.0,251.0,130.0,121.0,289.5,251.0,594.3,Magnoliopsida; Eucalyptus L'Hér.
2006,2006-07-13,Santarém,Ourém,Olival,Soutaria,39.6922555,-8.6018817,NC,224.0,2006-07-13T23:00,24.7,67,18.2,26.8,0.0,0.0,0.0,0.0,0,1014.3,988.6,14,0,2,44,0.02,1.01,6.5,16.6,19,27,10.8,25.9,28.1,21.5,17.4,0.076,0.08,0.12,0.194,0,0.0,0.0,0.0,0.0,0.0,0.0,0.0,0.0,0.0,0.0,0.0,0.0,0.0,Magnoliopsida; Tracheophyta; Olea europaea L.; Vitis vinifera L.; Eucalyptus L'Hér.
2006,2006-07-14,Santarém,Ourém,Fátima,Boleiros,39.60322805,-8.663198476923824,NC,353.0,2006-07-14T13:00,34.7,27,12.8,36.7,0.0,0.0,0.0,0.0,0,1014.0,975.2,14,0,1,45,0.76,4.04,7.8,9.6,77,77,24.5,37.8,27.0,21.7,17.2,0.108,0.148,0.209,0.267,1,3600.0,942.1,826.1,116.0,870.9,942.1,1255.5,942.0,826.0,116.0,870.9,942.0,1255.4,Olea europaea L.; Magnoliopsida; Tracheophyta; Eucalyptus L'Hér.
2006,2006-07-15,Santarém,Ourém,Olival,Soutaria,39.6922555,-8.6018817,NC,224.0,2006-07-15T00:00,24.8,65,17.8,26.8,0.0,0.0,0.0,0.0,1,1015.3,989.6,21,0,0,69,0.02,1.1,6.2,11.2,111,135,8.6,25.1,28.4,21.9,17.5,0.075,0.079,0.119,0.193,0,0.0,0.0,0.0,0.0,0.0,0.0,0.0,0.0,0.0,0.0,0.0,0.0,0.0,Magnoliopsida; Tracheophyta; Olea europaea L.; Vitis vinifera L.; Eucalyptus L'Hér.
2006,2006-07-16,Santarém,Alcanena,Serra de Santo António,ESPINHEIRO (Espinheira),39.512984,-8.7297658,NC,360.0,2006-07-16T19:00,32.4,35,15.1,32.1,0.0,0.0,0.0,0.0,0,1014.2,974.3,18,0,30,0,0.26,3.16,14.0,22.6,342,346,28.8,34.8,29.2,22.6,17.3,0.095,0.156,0.221,0.288,1,3600.0,107.3,71.1,36.2,414.6,107.3,227.0,166.0,110.0,56.0,414.6,166.0,351.3,Olea europaea L.; Magnoliopsida; Tracheophyta; Quercus L.; Pinus pinaster Aiton; 
2006,2006-07-17,Santarém,Tomar,Carregueiros,S. SIMAO (CARREGUEIROS),39.63021925,-8.44670456011102,NC,181.0,2006-07-17T16:00,37.3,22,11.7,36.5,0.0,0.0,0.0,0.0,0,1014.4,994.4,0,0,0,0,0.72,4.99,15.8,20.1,246,243,34.9,44.2,32.1,25.4,19.1,0.081,0.158,0.22,0.288,1,3600.0,675.2,581.3,94.0,840.0,675.2,916.2,740.0,637.0,103.0,840.0,740.0,1004.0,Olea europaea L.; Eucalyptus L'Hér.; Magnoliopsida; Pinus pinaster Aiton; Tracheophyta; Quercus rotundifolia Lam.
2006,2006-07-19,Santarém,Ferreira do Zêzere,Beco,CRUZ DAS CANASTREIRAS (Cruz da Rebalvia),39.7681637,-8.3063085,NC,313.0,2006-07-19T17:00,25.7,55,16.0,25.6,0.0,0.0,0.0,0.0,0,1015.9,980.3,13,14,0,0,0.37,1.48,14.6,18.2,279,279,30.6,31.4,27.3,24.4,18.4,0.145,0.154,0.206,0.293,1,3600.0,426.3,290.3,136.0,549.0,426.3,700.2,492.0,335.0,157.0,549.0,492.0,808.1,Eucalyptus L'Hér.; Vitis vinifera L.
2006,2006-07-22,Santarém,Chamusca,Vale de Cavalos,VALE DE STA MARIA (Casal de Vale de Carros),39.2907933,-8.5194011,NC,31.0,2006-07-22T16:00,29.8,35,12.8,28.8,0.0,0.0,0.0,0.0,0,1019.7,1016.1,0,0,0,0,0.61,2.71,19.4,24.7,317,318,40.3,36.8,27.3,25.5,19.9,0.165,0.177,0.202,0.26,1,3600.0,675.2,580.5,94.8,844.6,675.2,910.6,741.0,637.0,104.0,844.6,741.0,999.3,Tracheophyta; Quercus suber L.; Magnoliopsida
2006,2006-07-24,Santarém,Ferreira do Zêzere,Ferreira do Zêzere,CASAL BATISTA (Casal),39.7094207,-8.2429163,NC,145.0,2006-07-24T17:00,26.8,44,13.6,25.0,0.0,0.0,0.0,0.0,0,1016.7,1000.1,0,0,0,0,0.46,1.97,20.9,27.1,319,320,45.7,35.2,28.1,25.4,20.2,0.091,0.137,0.178,0.245,1,3600.0,490.7,405.2,85.5,778.0,490.7,690.3,568.0,469.0,99.0,778.0,568.0,799.0,Eucalyptus L'Hér.; Magnoliopsida
2006,2006-07-25,Santarém,Ourém,Gondemaria,Poças,39.6882963,-8.6224161,NC,218.0,2006-07-25T12:00,26.3,49,14.6,27.8,0.0,0.0,0.0,0.0,0,1017.0,992.1,0,0,0,0,0.63,1.76,13.9,17.2,329,331,38.5,32.3,23.9,22.8,18.4,0.064,0.077,0.109,0.188,1,3600.0,936.1,815.9,120.2,879.5,936.1,1229.8,911.0,794.0,117.0,879.5,911.0,1196.8,Magnoliopsida; Tracheophyta; Olea europaea L.; Eucalyptus L'Hér.; Vitis vinifera L.; Quercus L.
2006,2006-07-27,Santarém,Ourém,Nossa Senhora das Misericórdias,CASAL PINHEIRO (Casal Branco),39.6222037,-8.6025221,NC,225.0,2006-07-27T14:00,25.4,45,12.4,24.4,0.0,0.0,0.0,0.0,0,1018.3,992.5,0,0,0,0,0.63,1.8,23.8,30.6,322,323,50.4,33.7,25.3,24.3,19.8,0.075,0.149,0.217,0.294,1,3600.0,895.7,764.3,131.4,854.8,895.7,1185.8,920.0,785.0,135.0,854.8,920.0,1217.9,Magnoliopsida; Olea europaea L.; Pinus pinaster Aiton; Tracheophyta; Vitis vinifera L.
2006,2006-08-01,Santarém,Tomar,Serra,Chousa,39.5997966,-8.3005954,NC,318.0,2006-08-01T16:00,29.0,44,15.4,29.1,0.0,0.0,0.0,0.0,0,1016.1,980.3,0,0,0,0,0.56,2.26,17.4,22.5,322,325,40.0,36.0,26.9,24.5,20.4,0.089,0.156,0.212,0.305,1,3600.0,636.1,546.3,89.8,820.6,636.1,883.8,701.0,602.0,99.0,820.6,701.0,974.0,Olea europaea L.; Magnoliopsida; Tracheophyta; Quercus L.; Pinus pinaster Aiton; ; Eucalyptus L'Hér.
2006,2006-08-03,Santarém,Abrantes,Alvega,Tubaral,39.4417319,-8.0389408,NC,125.0,2006-08-03T11:00,28.4,49,16.7,29.6,0.0,0.0,0.0,0.0,0,1011.8,997.6,0,0,0,0,0.53,1.96,13.5,16.5,312,314,33.1,36.4,28.7,26.4,22.1,0.036,0.062,0.1,0.167,1,3600.0,742.0,547.3,194.8,636.2,742.0,1142.7,701.0,517.0,184.0,636.2,701.0,1079.5,Eucalyptus L'Hér.; Olea europaea L.; Quercus suber L.; Tracheophyta; Pinus pinaster Aiton; Magnoliopsida; 
2006,2006-06-22,Lisboa,Amadora,Venteira,JUNTO ESCOLA GONÇALVES CRESPO (P TRÁS FÁBRICA BORTEX) (AMADORA),38.74675855,-9.240497507432714,NC,126.0,2006-06-22T16:00,24.8,61,16.7,24.7,0.0,0.0,0.0,0.0,0,1013.4,998.9,0,0,0,0,0.49,1.23,23.0,30.8,340,344,37.4,27.2,22.0,19.7,17.0,0.228,0.243,0.254,0.29,1,3600.0,688.2,589.5,98.7,835.1,688.2,934.8,753.0,645.0,108.0,835.1,753.0,1022.7,Tracheophyta; Magnoliopsida; 
2006,2006-06-23,Lisboa,Amadora,Venteira,EST MILITAR JT BAIRRO STA FILOMENA (AMADORA),38.7581464,-9.2349627,NC,133.0,2006-06-23T13:00,23.9,63,16.5,24.8,0.0,0.0,0.0,0.0,0,1014.8,999.4,6,7,0,0,0.58,1.09,23.3,28.8,333,336,36.7,26.6,21.4,19.8,17.0,0.203,0.246,0.256,0.28,1,3600.0,965.6,838.6,126.9,872.4,965.6,1272.8,966.0,839.0,127.0,872.4,966.0,1273.4,Tracheophyta; Magnoliopsida; 
2006,2006-06-22,Lisboa,Oeiras,Paço de Arcos,R CALVET MAGALHAES (PAÇO DE ARCOS),38.6884786,-9.3189168,NC,22.0,2006-06-22T16:00,23.5,68,17.2,23.6,0.0,0.0,0.0,0.0,0,1013.4,1010.8,0,0,0,0,0.45,0.92,23.0,30.8,340,344,37.4,26.4,22.1,20.1,17.6,0.221,0.233,0.261,0.294,1,3600.0,688.4,589.6,98.7,834.0,688.4,936.2,753.0,645.0,108.0,834.0,753.0,1024.1,Pinus pinea L.; Magnoliopsida; Tracheophyta; Vitis vinifera L.; Eucalyptus L'Hér.; Olea europaea L.; Pinus pinaster Aiton
2006,2006-06-23,Lisboa,ODIVELAS,Caneças,R MANUEL SIMOES CASTELO - CANEÇAS (Ribeira de Caneças),38.8062756,-9.2009501,NC,163.0,2006-06-23T14:00,23.7,63,16.2,23.9,0.0,0.0,0.0,0.0,0,1014.5,995.7,7,8,0,0,0.56,1.08,25.8,32.2,333,335,40.3,26.8,21.5,19.6,16.8,0.201,0.246,0.256,0.28,1,3600.0,925.3,805.5,119.8,875.7,925.3,1217.9,950.0,827.0,123.0,875.7,950.0,1250.4,Eucalyptus L'Hér.; Tracheophyta; Magnoliopsida; Olea europaea L.; Pinus pinea L.; 
2006,2006-06-25,Lisboa,ODIVELAS,Caneças,JUNTO CAMPO DA BOLA CANEÇAS (CANEÇAS),38.8165498,-9.221342021551935,NC,230.0,2006-06-25T18:00,18.7,70,13.2,17.1,0.0,0.0,0.0,0.0,1,1016.9,990.0,46,51,0,0,0.21,0.64,18.3,24.8,324,324,40.0,21.7,20.3,19.2,16.5,0.186,0.239,0.255,0.28,1,3600.0,283.2,175.4,107.8,472.1,283.2,491.7,352.0,218.0,134.0,472.1,352.0,611.2,Eucalyptus L'Hér.; Tracheophyta; Magnoliopsida; Olea europaea L.; Pinus pinea L.; 
2006,2006-06-28,Lisboa,ODIVELAS,Famões,BAIRRO TRIGACHO SUL (Bairro Casal do Trigache),38.7912413,-9.2108576,NC,134.0,2006-06-28T18:00,19.5,64,12.4,17.1,0.0,0.0,0.0,0.0,0,1019.8,1004.0,0,0,0,0,0.25,0.83,22.2,28.8,331,332,38.2,23.2,20.9,19.5,17.2,0.168,0.23,0.253,0.28,1,3600.0,328.2,259.1,69.2,696.3,328.2,492.3,408.0,322.0,86.0,696.3,408.0,612.0,Pinus pinea L.; Olea europaea L.; Tracheophyta; Magnoliopsida; 
2006,2006-06-28,Lisboa,Sintra,Pêro Pinheiro,CORTEGAÇA,38.8457478,-9.3333622,NC,129.0,2006-06-28T22:00,16.7,83,13.7,15.5,0.0,0.0,0.0,0.0,0,1021.0,1005.6,4,4,0,0,0.02,0.33,16.5,23.9,337,337,32.4,18.6,20.4,19.3,17.2,0.166,0.22,0.255,0.287,0,0.0,0.0,0.0,0.0,0.0,0.0,0.0,0.0,0.0,0.0,0.0,0.0,0.0,Tracheophyta; Magnoliopsida; Pinus pinaster Aiton; Eucalyptus L'Hér.; Vitis vinifera L.; 
2006,2006-07-01,Lisboa,Loures,Frielas,Bº DA BOGALHEIRA (Bairro da Bogalheira),38.8005329,-9.1506538,NC,55.0,2006-07-01T10:00,20.7,69,14.8,21.1,0.0,0.0,0.0,0.0,2,1020.0,1013.5,63,70,0,0,0.33,0.76,8.3,9.9,326,327,16.6,23.7,21.1,20.1,17.9,0.156,0.223,0.251,0.28,1,3600.0,588.3,316.5,271.8,398.8,588.3,1050.1,539.0,290.0,249.0,398.8,539.0,962.2,Tracheophyta; Olea europaea L.; Magnoliopsida; 
2006,2006-06-26,Lisboa,Cascais,Cascais,QUINTA DOS INGLESES (Quinta da Bicuda),38.70692435,-9.45142497859218,NC,58.0,2006-06-26T20:00,17.3,74,12.7,14.7,0.0,0.0,0.0,0.0,1,1017.2,1010.3,21,3,0,60,0.08,0.51,23.6,31.7,344,345,39.6,19.6,20.6,20.1,17.9,0.11,0.167,0.211,0.263,1,322.31,1.3,0.3,1.0,3.7,0.9,4.0,40.0,10.0,30.0,77.6,40.0,123.7,Pinus pinea L.; Tracheophyta; Magnoliopsida
2006,2006-06-27,Lisboa,Loures,Santo Antão do Tojal,PORTELA DA AZOIA - ROTUNDA JT CAMPO FUTEBOL (Casal da Portela),38.8660223,-9.1498309,NC,90.0,2006-06-27T16:00,21.5,52,11.4,19.0,0.0,0.0,0.0,0.0,0,1018.3,1007.7,4,4,0,0,0.46,1.22,25.9,32.8,328,329,46.4,26.5,21.1,20.2,17.7,0.145,0.249,0.264,0.288,1,3600.0,670.2,554.1,116.1,784.1,670.2,935.2,733.0,606.0,127.0,784.1,733.0,1022.9,Tracheophyta; Eucalyptus L'Hér.; Magnoliopsida
2006,2006-07-01,Lisboa,Cascais,São Domingos de Rana,TRAJOUCE,38.7015666,-9.3417434,NC,71.0,2006-07-01T21:00,18.3,79,14.6,17.3,0.0,0.0,0.0,0.0,1,1018.5,1010.1,30,0,0,99,0.03,0.44,17.4,23.5,326,328,29.9,20.5,21.7,19.7,17.7,0.17,0.216,0.255,0.293,0,0.0,0.0,0.0,0.0,0.0,0.0,0.0,0.0,0.0,0.0,0.0,0.0,0.0,Tracheophyta; Magnoliopsida
2006,2006-07-02,Lisboa,Arruda dos Vinhos,Arranhó,A dos Arcos,38.9533255,-9.1349729,NC,239.0,2006-07-02T16:00,22.2,53,12.2,21.4,0.0,0.0,0.0,0.0,0,1017.5,989.8,16,12,0,18,0.47,1.25,16.8,21.6,293,294,37.1,30.9,23.0,20.1,17.3,0.09,0.205,0.244,0.267,1,3600.0,672.3,535.1,137.2,756.7,672.3,935.7,735.0,585.0,150.0,756.7,735.0,1023.0,Tracheophyta; Magnoliopsida
2006,2006-06-29,Lisboa,Cascais,São Domingos de Rana,CABRA FIGA - ESTRADA NAC 249/4 TRASEIRAS POUPANÇA (SÃO DOMINGOS DE RANA),38.72511365,-9.355976966821707,NC,92.0,2006-06-29T17:00,20.8,68,14.6,19.2,0.0,0.0,0.0,0.0,0,1018.9,1008.1,0,0,0,0,0.34,0.79,22.7,29.5,331,333,39.2,24.3,21.0,19.5,17.5,0.179,0.221,0.257,0.293,1,3600.0,515.3,428.1,87.2,776.0,515.3,730.1,591.0,491.0,100.0,776.0,591.0,837.3,Tracheophyta; Magnoliopsida
2006,2006-06-29,Lisboa,Cascais,Parede,QTA STO ANTONIO (PAREDE),38.6932444,-9.355054025521005,NC,55.0,2006-06-29T21:00,17.9,84,15.2,16.5,0.0,0.0,0.0,0.0,0,1019.3,1012.7,3,1,0,7,0.03,0.32,21.9,31.5,340,341,35.3,20.2,21.2,19.7,17.7,0.179,0.22,0.257,0.293,0,0.0,0.0,0.0,0.0,0.0,0.0,0.0,0.0,0.0,0.0,0.0,0.0,0.0,Magnoliopsida; Tracheophyta; Pinus pinea L.; Pinus pinaster Aiton; 
2006,2006-06-30,Lisboa,Torres Vedras,A dos Cunhados,CSL DA BARREIRINHA (Casal da Barreirinha),39.1519962,-9.2979195,NC,27.0,2006-06-30T21:00,18.4,88,16.4,18.3,0.0,0.0,0.0,0.0,1,1019.1,1015.9,24,10,0,50,0.01,0.25,15.5,21.3,329,330,27.4,21.9,23.0,20.2,17.9,0.099,0.183,0.24,0.281,0,0.0,0.0,0.0,0.0,0.0,0.0,0.0,0.0,0.0,0.0,0.0,0.0,0.0,Eucalyptus L'Hér.; Tracheophyta; Vitis vinifera L.; Magnoliopsida; Pinus pinea L.; 
2006,2006-07-02,Lisboa,Torres Vedras,Ventosa,Pedra,39.0594691,-9.3454433,NC,28.0,2006-07-02T19:00,19.6,69,13.8,18.9,0.0,0.0,0.0,0.0,0,1017.6,1014.3,0,0,0,0,0.14,0.7,13.5,17.3,304,306,28.4,25.9,23.8,20.7,18.2,0.096,0.194,0.254,0.298,1,3600.0,138.5,94.4,44.2,499.3,138.5,250.0,207.0,141.0,66.0,499.3,207.0,373.6,Vitis vinifera L.; Eucalyptus L'Hér.; Tracheophyta; Magnoliopsida; 
2006,2006-06-22,Lisboa,Loures,Loures,LOURES,38.8444686,-9.206289225745532,NC,88.0,2006-06-22T01:00,17.0,89,15.2,15.4,0.0,0.0,0.0,0.0,0,1016.0,1005.5,0,0,0,0,0.01,0.2,22.8,34.4,354,355,37.1,18.5,20.9,20.0,17.2,0.224,0.252,0.257,0.281,0,0.0,0.0,0.0,0.0,0.0,0.0,0.0,0.0,0.0,0.0,0.0,0.0,0.0,Tracheophyta; Quercus suber L.; Magnoliopsida
2006,2006-06-26,Lisboa,Azambuja,Alcoentre,CASAIS DOS BRITOS (Casais da Areia),39.2078257,-8.9572359,NC,81.0,2006-06-26T14:00,20.2,56,11.1,18.1,0.0,0.0,0.0,0.0,3,1017.4,1007.9,100,96,22,97,0.39,1.05,18.5,23.5,331,333,38.9,25.9,21.6,21.2,18.1,0.103,0.191,0.241,0.263,1,3600.0,583.3,214.2,369.1,233.5,583.3,1214.3,599.0,220.0,379.0,233.5,599.0,1247.0,Tracheophyta; Magnoliopsida; Pinales; Olea europaea L.
2006,2006-06-28,Lisboa,Loures,Lousa,ENCOSTA QTA DO MOCHO (Encosta da Saúde),38.8898108,-9.2059575,NC,167.0,2006-06-28T08:00,17.1,68,11.2,14.7,0.0,0.0,0.0,0.0,2,1020.2,1000.4,61,68,0,0,0.16,0.61,18.7,23.3,337,338,32.4,18.4,19.4,19.9,17.4,0.129,0.226,0.253,0.278,1,3600.0,297.5,149.4,148.2,303.5,297.5,651.4,243.0,122.0,121.0,303.5,243.0,532.0,Tracheophyta; Magnoliopsida; Pinus pinaster Aiton; Eucalyptus L'Hér.; Pinales; 
2006,2006-06-28,Lisboa,Vila Franca de Xira,Vialonga,Alpriate,38.862856,-9.0920956,NC,32.0,2006-06-28T23:00,15.7,85,13.2,14.9,0.0,0.0,0.0,0.0,0,1020.5,1016.6,7,8,0,0,0.01,0.27,12.4,22.3,334,337,27.0,18.7,21.1,20.2,17.6,0.308,0.354,0.352,0.393,0,0.0,0.0,0.0,0.0,0.0,0.0,0.0,0.0,0.0,0.0,0.0,0.0,0.0,Tracheophyta; Magnoliopsida; Pinus pinea L.; Olea europaea L.; Pinus pinaster Aiton; Pinales; 
2006,2006-06-24,Lisboa,Oeiras,Barcarena,ESTRADA CRUZ CAVALINHOS (BARCARENA),38.7155799,-9.2774701,NC,51.0,2006-06-24T00:00,17.7,87,15.5,15.7,0.0,0.0,0.0,0.0,3,1015.5,1009.4,85,94,0,0,0.03,0.26,26.1,36.9,342,343,40.0,19.5,21.5,20.1,17.5,0.21,0.231,0.261,0.294,0,0.0,0.0,0.0,0.0,0.0,0.0,0.0,0.0,0.0,0.0,0.0,0.0,0.0,Tracheophyta; Magnoliopsida; Pinus pinea L.; Vitis vinifera L.; Eucalyptus L'Hér.; Olea europaea L.; Pinus pinaster Aiton
2006,2006-01-03,Lisboa,Cascais,Cascais,R DO CIBRAO CHARNECA (CASCAIS),38.71502635,-9.456762952650216,NC,68.0,2006-01-03T19:00,12.2,80,8.8,9.4,0.0,0.0,0.0,0.0,0,1026.8,1018.5,0,0,0,0,0.02,0.29,17.4,27.6,7,8,27.4,12.1,13.0,13.7,16.4,0.261,0.28,0.291,0.25,0,0.0,0.0,0.0,0.0,0.0,0.0,0.0,0.0,0.0,0.0,0.0,0.0,0.0,Pinus pinea L.; Tracheophyta; Magnoliopsida; Pinus pinaster Aiton
2006,2006-01-26,Lisboa,Loures,Fanhões,FANHES JTO DESAFIO JOVEM (FANHÕES),38.881,-9.15611,NC,205.0,2006-01-26T13:00,12.1,65,5.6,9.1,0.0,0.0,0.0,0.0,0,1010.1,985.7,0,0,0,0,0.24,0.5,13.1,17.1,82,83,31.0,12.5,9.4,10.8,14.0,0.315,0.338,0.335,0.265,1,3600.0,539.8,455.2,84.6,850.3,539.8,755.4,536.0,452.0,84.0,850.3,536.0,750.1,Magnoliopsida; Tracheophyta; Eucalyptus L'Hér.; 
2006,2006-01-04,Lisboa,Alenquer,Abrigada,CABANAS CHAO (Cabanas de Chão),39.1369686,-9.04592234130841,NC,83.0,2006-01-04T14:00,12.8,61,5.3,11.1,0.0,0.0,0.0,0.0,0,1021.7,1011.6,0,0,0,0,0.22,0.58,3.4,4.0,18,27,12.6,13.7,9.5,12.0,16.2,0.331,0.345,0.333,0.246,1,3600.0,432.1,359.2,73.0,834.5,432.1,608.9,456.0,379.0,77.0,834.5,456.0,642.5,Magnoliopsida; Tracheophyta; Vitis vinifera L.; Pinus pinea L.
2006,2006-02-24,Lisboa,Sintra,Sintra (são Pedro De Penaferrim),ESTRADA PRINCIPAL OLELAS (Quinta da Estrada),38.7992243,-9.3853801,NC,187.0,2006-02-24T21:00,9.1,72,4.3,5.4,0.0,0.0,0.0,0.0,1,1014.9,992.2,21,15,12,0,0.03,0.32,15.8,25.6,294,296,27.0,8.7,9.7,11.0,12.9,0.309,0.319,0.301,0.257,0,0.0,0.0,0.0,0.0,0.0,0.0,0.0,0.0,0.0,0.0,0.0,0.0,0.0,Tracheophyta; Magnoliopsida
2006,2006-07-03,Lisboa,Amadora,Buraca,Bº DO ZAMBUJAL (Bairro do Zambujal),38.7465339,-9.2085881,NC,92.0,2006-07-03T04:00,17.3,83,14.3,18.0,0.0,0.0,0.0,0.0,0,1017.2,1006.3,1,1,0,0,0.0,0.34,4.8,5.1,167,184,6.5,16.1,20.6,20.0,17.7,0.172,0.214,0.246,0.289,0,0.0,0.0,0.0,0.0,0.0,0.0,0.0,0.0,0.0,0.0,0.0,0.0,0.0,Tracheophyta
2006,2006-02-06,Lisboa,Vila Franca de Xira,Castanheira do Ribatejo,CASAIS DE STA CRUZ (Casais do Burro),38.9890131,-8.965304401452288,NC,7.0,2006-02-06T15:00,14.7,49,4.1,11.7,0.0,0.0,0.0,0.0,0,1023.3,1022.5,0,0,0,0,0.28,0.85,10.5,13.8,98,99,23.8,13.6,8.7,10.5,14.6,0.415,0.432,0.416,0.343,1,3600.0,479.3,405.5,73.8,875.2,479.3,651.7,526.0,445.0,81.0,875.2,526.0,715.3,Pinus pinea L.; Magnoliopsida; Tracheophyta; Vitis vinifera L.; Eucalyptus L'Hér.; Olea europaea L.; Pinus pinaster Aiton; 
2006,2006-06-25,Lisboa,Amadora,Buraca,ESTRADA MILITAR AO CIMO BºSTA FILOMENA (Estrada Alfragide),38.7427523,-9.2059461,NC,118.0,2006-06-25T22:00,16.8,84,14.1,16.0,0.0,0.0,0.0,0.0,1,1018.7,1004.7,33,37,0,0,0.02,0.3,14.7,20.5,335,336,31.0,19.0,20.7,19.9,17.2,0.206,0.234,0.252,0.289,0,0.0,0.0,0.0,0.0,0.0,0.0,0.0,0.0,0.0,0.0,0.0,0.0,0.0,Tracheophyta; Magnoliopsida; Eucalyptus L'Hér.
2006,2006-06-27,Lisboa,Sintra,Sintra (são Martinho),Janas,38.8268495,-9.4370316,NC,113.0,2006-06-27T10:00,18.5,69,12.6,16.5,0.0,0.0,0.0,0.0,2,1018.0,1004.6,66,73,0,0,0.33,0.67,21.7,27.1,349,349,46.1,21.5,19.2,19.7,17.6,0.109,0.167,0.211,0.263,1,3600.0,668.7,466.9,201.8,587.0,668.7,1052.7,613.0,428.0,185.0,587.0,613.0,965.0,Tracheophyta; Pinus pinaster Aiton; Pinus pinea L.; Magnoliopsida
2006,2006-01-10,Lisboa,Vila Franca de Xira,Vila Franca de Xira,EN-10 RECTA DO CABO (VILA FRANCA DE XIRA),38.955467,-8.9861266,NC,7.0,2006-01-10T14:00,11.9,63,5.1,9.0,0.0,0.0,0.0,0.0,0,1024.0,1023.1,0,0,0,0,0.22,0.51,11.2,14.6,40,40,27.0,12.1,9.0,11.7,16.6,0.412,0.424,0.416,0.339,1,3600.0,458.4,384.2,74.2,860.7,458.4,631.3,482.0,404.0,78.0,860.7,482.0,663.8,Tracheophyta; ; Magnoliopsida; Olea europaea L.
2006,2006-07-04,Lisboa,Loures,Camarate,RUA ROCHA MARTINS - CAMARATE (CAMARATE),38.7979738,-9.137797597001224,NC,130.0,2006-07-04T20:00,19.0,75,14.5,17.3,0.0,0.0,0.0,0.0,0,1018.3,1003.0,2,2,0,0,0.08,0.55,21.5,30.1,337,339,37.1,23.1,23.1,22.1,20.9,0.259,0.301,0.325,0.338,1,2169.21,0.6,0.3,0.3,3.7,0.4,1.4,51.0,28.0,23.0,218.2,51.0,121.6,Tracheophyta; Olea europaea L.; Magnoliopsida; 
2006,2006-07-05,Lisboa,Lourinhã,São Bartolomeu Dos Galegos,Paço,39.2979745,-9.2848171,NC,61.0,2006-07-05T17:00,19.9,70,14.3,17.0,0.0,0.0,0.0,0.0,0,1021.4,1014.2,0,0,0,0,0.31,0.7,30.9,40.0,348,349,51.8,27.4,22.9,20.7,18.3,0.056,0.116,0.157,0.227,1,3600.0,512.4,419.9,92.5,760.9,512.4,730.1,587.0,481.0,106.0,760.9,587.0,836.4,Magnoliopsida; Eucalyptus L'Hér.; Tracheophyta; Vitis vinifera L.; Pinales; 
2006,2006-07-04,Lisboa,Sintra,Monte Abraão,JNT R ANTONIO SILVA (Monte Abraão),38.75823225,-9.266679900628509,NC,145.0,2006-07-04T11:00,20.7,72,15.5,21.4,0.0,0.0,0.0,0.0,1,1017.7,1000.7,45,28,33,0,0.39,0.67,11.6,13.9,292,295,23.0,23.7,20.2,19.5,17.3,0.158,0.209,0.251,0.286,1,3600.0,693.8,446.7,247.1,500.4,693.8,1181.2,657.0,423.0,234.0,500.4,657.0,1118.5,Tracheophyta; Magnoliopsida; 
2006,2006-07-04,Lisboa,Vila Franca de Xira,Vila Franca de Xira,RUA GENERAL HUMBERTO DELGADO - BOM RETIRO (VILA FRANCA DE XIRA),38.955467,-8.9861266,NC,7.0,2006-07-04T14:00,24.3,54,14.5,24.1,0.0,0.0,0.0,0.0,1,1017.1,1016.3,38,24,28,0,0.47,1.38,15.5,19.9,318,319,34.6,28.5,22.9,21.2,18.2,0.191,0.294,0.327,0.353,1,3600.0,654.8,459.9,194.9,501.1,654.8,1214.5,672.0,472.0,200.0,501.1,672.0,1246.3,Tracheophyta; ; Magnoliopsida; Olea europaea L.
2006,2006-07-04,Lisboa,Loures,Loures,R JOÃO FANDANGO (LOURES),38.8444686,-9.206289225745532,NC,88.0,2006-07-04T22:00,18.1,85,15.4,17.0,0.0,0.0,0.0,0.0,1,1020.1,1009.6,22,24,0,0,0.03,0.32,20.4,28.0,339,340,34.2,20.1,21.9,20.1,17.8,0.16,0.214,0.248,0.279,0,0.0,0.0,0.0,0.0,0.0,0.0,0.0,0.0,0.0,0.0,0.0,0.0,0.0,Tracheophyta; Quercus suber L.; Magnoliopsida
2006,2006-01-20,Lisboa,Alenquer,Aldeia Galega da Merceana,ALDEIA GALEGA,39.0818257,-9.1121121,NC,115.0,2006-01-20T18:00,11.4,90,9.8,10.2,0.0,0.0,0.0,0.0,0,1024.6,1010.6,0,0,0,0,0.01,0.14,7.5,16.3,343,354,11.5,11.6,10.9,10.8,14.7,0.346,0.361,0.338,0.253,0,416.4,0.0,0.0,0.0,0.0,0.0,0.0,22.0,11.0,11.0,117.5,22.0,71.7,Magnoliopsida; Vitis vinifera L.; Tracheophyta
2006,2006-01-22,Lisboa,Loures,São João da Talha,S JOAO TALHA (SÃO JOÃO DA TALHA),38.8260487,-9.09807838407007,NC,77.0,2006-01-22T22:00,8.6,93,7.5,6.9,0.0,0.0,0.0,0.0,1,1024.7,1015.2,23,26,0,0,0.0,0.08,7.1,8.7,41,38,12.6,9.5,10.6,11.0,12.8,0.357,0.367,0.367,0.331,0,0.0,0.0,0.0,0.0,0.0,0.0,0.0,0.0,0.0,0.0,0.0,0.0,0.0,Tracheophyta; Magnoliopsida; Olea europaea L.; 
2006,2006-07-06,Lisboa,Loures,Loures,INFANTADO (EM FRENTE LOURESHOOPUNG) (Quinta do Infantado),38.8444686,-9.206289225745532,NC,88.0,2006-07-06T00:00,16.3,81,13.1,13.9,0.0,0.0,0.0,0.0,0,1022.4,1011.8,0,0,0,0,0.04,0.35,23.4,34.5,346,346,40.3,18.4,21.2,20.1,17.9,0.157,0.212,0.247,0.279,0,0.0,0.0,0.0,0.0,0.0,0.0,0.0,0.0,0.0,0.0,0.0,0.0,0.0,Tracheophyta; Quercus suber L.; Magnoliopsida
2006,2006-01-28,Lisboa,Lourinhã,Lourinhã,Casal da Rola,39.2433932,-9.3119326,NC,10.0,2006-01-28T18:00,8.8,78,5.1,4.2,0.4,0.4,0.0,0.0,51,1013.6,1012.4,59,34,47,0,0.04,0.25,23.2,32.1,316,315,45.7,9.6,9.8,11.7,14.6,0.289,0.319,0.332,0.268,0,1063.86,0.0,0.0,0.0,0.0,0.0,0.0,32.0,16.0,16.0,147.6,32.0,92.7,Tracheophyta; Magnoliopsida
2006,2006-06-23,Lisboa,Sintra,Colares,AZOIA (COLARES),38.8014202,-9.4425612,NC,30.0,2006-06-23T18:00,20.1,79,16.3,18.2,0.0,0.0,0.0,0.0,0,1014.0,1010.5,4,4,0,0,0.22,0.5,28.6,37.1,341,342,45.7,25.1,22.7,20.4,18.0,0.119,0.171,0.213,0.264,1,3600.0,323.7,256.8,66.8,688.4,323.7,494.0,402.0,319.0,83.0,688.4,402.0,613.6,Tracheophyta; Magnoliopsida; Pinus pinaster Aiton; Pinales; Pinus pinea L.; Eucalyptus L'Hér.; Vitis vinifera L.; Acacia Mill.; 
2006,2006-06-29,Lisboa,Sintra,São João das Lampas,TAPADA MERCES (Casal da Tapada),38.8424154,-9.3951609,NC,199.0,2006-06-29T13:00,20.0,71,14.5,20.8,0.0,0.0,0.0,0.0,0,1020.0,996.7,3,3,0,0,0.51,0.68,18.7,23.0,341,343,37.4,27.1,20.2,19.1,17.1,0.097,0.164,0.209,0.262,1,3600.0,960.3,823.3,137.0,857.1,960.3,1271.1,960.0,823.0,137.0,857.1,960.0,1270.6,Tracheophyta; Magnoliopsida; Pinus pinaster Aiton; Pinus pinea L.; Vitis vinifera L.; Pinales; Olea europaea L.; 
2006,2006-07-07,Lisboa,Sintra,Casal de Cambra,R ESTRASBURGO  CSL CAMBRA (Casal de Cambra),38.8029588,-9.22687705308826,NC,255.0,2006-07-07T15:00,25.4,48,13.8,25.2,0.0,0.0,0.0,0.0,0,1017.8,988.6,0,0,0,0,0.6,1.67,20.8,27.1,334,337,45.7,30.9,22.4,19.9,17.3,0.104,0.199,0.245,0.277,1,3600.0,834.7,725.8,109.0,870.2,834.7,1103.5,881.0,766.0,115.0,870.2,881.0,1164.7,Tracheophyta; Magnoliopsida; 
2006,2006-07-07,Lisboa,Mafra,Mafra,Urzal,38.9392419,-9.3837512,NC,81.0,2006-07-07T13:00,22.9,64,15.8,23.5,0.0,0.0,0.0,0.0,0,1019.2,1009.7,0,0,0,0,0.56,1.0,23.1,30.1,346,348,42.8,31.3,22.5,21.0,18.4,0.079,0.194,0.265,0.323,1,3600.0,970.0,847.8,122.1,885.5,970.0,1266.8,969.0,847.0,122.0,885.5,969.0,1265.6,Magnoliopsida; Tracheophyta; Pinus pinaster Aiton
2006,2006-06-23,Lisboa,Sintra,Algueirão-Mem Martins,R FRANCISCO SALGADO ZENHA - TAPADA MERCÊS (Algueirão-Mem Martins),38.800915200000006,-9.361990164260336,NC,196.0,2006-06-23T15:00,20.3,75,15.7,20.5,0.0,0.0,0.0,0.0,0,1014.1,991.3,4,5,0,0,0.45,0.6,22.4,29.3,330,331,43.6,27.0,21.3,19.3,16.9,0.121,0.171,0.213,0.264,1,3600.0,829.3,716.7,112.7,859.3,829.3,1104.3,876.0,757.0,119.0,859.3,876.0,1166.4,Tracheophyta; Magnoliopsida; Pinales; 
2006,2006-07-07,Lisboa,Lisboa,Ameixoeira,QTª DAS LAVADEIRAS (Quinta das Lavadeiras),38.7835424,-9.1648598,NC,64.0,2006-07-07T23:00,18.6,74,13.9,15.6,0.0,0.0,0.0,0.0,0,1018.4,1010.8,2,2,0,0,0.07,0.56,29.4,45.2,353,355,47.5,20.6,22.8,20.4,18.1,0.144,0.208,0.246,0.279,0,0.0,0.0,0.0,0.0,0.0,0.0,0.0,0.0,0.0,0.0,0.0,0.0,0.0,Tracheophyta; Magnoliopsida
