year,date,district,municipality,parish,local,latitude,longitude,cause,elevation,hourly.time,hourly.temperature_2m,hourly.relative_humidity_2m,hourly.dew_point_2m,hourly.apparent_temperature,hourly.precipitation,hourly.rain,hourly.snowfall,hourly.snow_depth,hourly.weather_code,hourly.pressure_msl,hourly.surface_pressure,hourly.cloud_cover,hourly.cloud_cover_low,hourly.cloud_cover_mid,hourly.cloud_cover_high,hourly.et0_fao_evapotranspiration,hourly.vapour_pressure_deficit,hourly.wind_speed_10m,hourly.wind_speed_100m,hourly.wind_direction_10m,hourly.wind_direction_100m,hourly.wind_gusts_10m,hourly.soil_temperature_0_to_7cm,hourly.soil_temperature_7_to_28cm,hourly.soil_temperature_28_to_100cm,hourly.soil_temperature_100_to_255cm,hourly.soil_moisture_0_to_7cm,hourly.soil_moisture_7_to_28cm,hourly.soil_moisture_28_to_100cm,hourly.soil_moisture_100_to_255cm,hourly.is_day,hourly.sunshine_duration,hourly.shortwave_radiation_instant,hourly.direct_radiation_instant,hourly.diffuse_radiation_instant,hourly.direct_normal_irradiance_instant,hourly.global_tilted_irradiance_instant,hourly.terrestrial_radiation_instant,hourly.shortwave_radiation,hourly.direct_radiation,hourly.diffuse_radiation,hourly.direct_normal_irradiance,hourly.global_tilted_irradiance,hourly.terrestrial_radiation,scientificNames
2007,2007-10-16,Viseu,Cinfães,Fornelos,COTEGAÇA (Cortegaça),41.022444,-8.2177165,Desconhecida,397.0,2007-10-16T05:00,11.8,91,10.4,11.3,0.0,0.0,0.0,0.0,0,1017.7,970.6,0,0,0,0,0.0,0.13,4.1,2.2,105,81,7.6,12.7,16.3,17.5,18.8,0.228,0.253,0.23,0.326,0,0.0,0.0,0.0,0.0,0.0,0.0,0.0,0.0,0.0,0.0,0.0,0.0,0.0,Quercus L.; Eucalyptus L'Hér.; Magnoliopsida; Vitis vinifera L.; Tracheophyta; Pinales; 
2007,2007-10-31,Viseu,Lamego,Avões,AVOES (AVÕES),41.1242278,-7.834607,Desconhecida,701.0,2007-10-31T11:00,11.8,54,2.7,7.1,0.0,0.0,0.0,0.0,0,1025.1,943.1,1,1,0,0,0.24,0.64,20.5,29.1,68,68,51.5,12.3,10.3,13.9,16.9,0.172,0.193,0.192,0.317,1,3600.0,542.2,455.9,86.2,855.7,542.2,739.5,503.0,423.0,80.0,855.7,503.0,686.1,Magnoliopsida; Vitis vinifera L.; Tracheophyta; Eucalyptus L'Hér.; Pinales; 
2007,2007-10-11,Viseu,Castro Daire,Castro Daire,LAMELAS (Lamelas de Cá),40.91465745,-7.920020147736607,Desconhecida,660.0,2007-10-11T14:00,17.8,47,6.4,15.0,0.0,0.0,0.0,0.0,0,1018.8,943.4,0,0,0,0,0.38,1.07,16.6,23.2,77,77,49.3,19.1,15.5,16.8,18.1,0.262,0.289,0.224,0.323,1,3600.0,615.2,530.0,85.2,885.8,615.2,821.4,650.0,560.0,90.0,885.8,650.0,867.8,Pinus pinaster Aiton; Magnoliopsida; Pinales; Eucalyptus L'Hér.; Tracheophyta
2007,2007-04-08,Viseu,Castro Daire,Castro Daire,PARADA DE ESTER,40.9325712,-8.0584593,Desconhecida,378.0,2007-04-08T14:00,15.5,54,6.3,14.7,0.0,0.0,0.0,0.0,1,1017.2,972.9,31,12,23,21,0.45,0.8,11.2,14.8,94,94,30.2,16.6,11.0,10.0,10.3,0.349,0.347,0.352,0.4,1,3600.0,823.0,694.5,128.5,890.1,823.0,1065.3,852.0,719.0,133.0,890.1,852.0,1102.9,Magnoliopsida; Pinus pinaster Aiton; Tracheophyta; Pinales; Eucalyptus L'Hér.
2007,2007-11-01,Viseu,Resende,Resende,Arco,41.0921656,-7.9351098,Desconhecida,614.0,2007-11-01T03:00,5.9,65,-0.1,2.0,0.0,0.0,0.0,0.0,0,1026.3,952.5,0,0,0,0,0.03,0.32,12.6,28.1,87,88,45.7,7.0,11.4,14.4,17.4,0.16,0.195,0.208,0.318,0,0.0,0.0,0.0,0.0,0.0,0.0,0.0,0.0,0.0,0.0,0.0,0.0,0.0,Tracheophyta; Olea europaea L.; Magnoliopsida; Pinales
2007,2007-04-06,Viseu,São Pedro do Sul,Sul,ADOBISPO,40.8357637,-8.0423237,Desconhecida,236.0,2007-04-06T13:00,16.6,50,6.1,15.0,0.0,0.0,0.0,0.0,3,1014.6,986.8,100,57,86,0,0.45,0.95,15.1,19.8,62,61,35.3,16.0,10.4,10.8,11.5,0.324,0.34,0.351,0.4,1,3600.0,834.7,690.1,144.6,840.7,834.7,1122.0,837.0,692.0,145.0,840.7,837.0,1125.2,Pinus pinaster Aiton; Eucalyptus L'Hér.; Magnoliopsida; Tracheophyta; Quercus L.; Castanea sativa Mill.; Acacia Mill.; 
2007,2007-10-16,Viseu,Tabuaço,Sendim,GUEDEIROS (Guedieiros),41.0243329,-7.5375373,Desconhecida,594.0,2007-10-16T13:00,20.9,46,9.0,20.2,0.0,0.0,0.0,0.0,1,1018.5,951.0,37,19,31,5,0.37,1.32,4.1,5.6,232,230,16.6,22.8,16.0,16.8,18.8,0.174,0.219,0.182,0.297,1,3600.0,574.7,480.2,94.5,761.4,574.7,868.3,584.0,488.0,96.0,761.4,584.0,882.3,Olea europaea L.; Vitis vinifera L.; Magnoliopsida; Pinus pinaster Aiton
2007,2007-11-01,Viseu,Cinfães,Cinfães,CINFAES (CINFÃES),41.0721651,-8.0894728,Desconhecida,400.0,2007-11-01T11:00,12.3,52,2.7,8.1,0.0,0.0,0.0,0.0,0,1026.8,979.0,0,0,0,0,0.25,0.69,17.3,23.8,88,88,45.0,13.1,11.6,15.4,18.2,0.163,0.188,0.201,0.322,1,3600.0,544.0,458.8,85.3,870.2,544.0,732.1,504.0,425.0,79.0,870.2,504.0,678.2,Eucalyptus L'Hér.; Tracheophyta; Pinus pinaster Aiton; Quercus L.; Magnoliopsida
2007,2007-04-07,Viseu,Vouzela,São Miguel do Mato,IGREJA VELHA,40.72573965,-8.01615325,Desconhecida,416.0,2007-04-07T16:00,15.9,52,6.1,14.2,0.0,0.0,0.0,0.0,3,1015.4,966.9,94,63,58,7,0.31,0.86,5.5,6.3,293,294,23.0,16.1,11.2,9.8,10.3,0.311,0.333,0.35,0.4,1,3600.0,497.3,400.8,96.4,732.6,497.3,747.4,562.0,453.0,109.0,732.6,562.0,844.7,Pinus pinaster Aiton; Tracheophyta; Magnoliopsida; Eucalyptus L'Hér.; Olea europaea L.; Quercus L.; 
2007,2007-10-16,Viseu,Cinfães,Moimenta,ALTO DE MOIMENTA (Alto da Bouça Velha),41.0529498,-8.1993626,Desconhecida,364.0,2007-10-16T17:00,19.3,59,11.2,18.7,0.0,0.0,0.0,0.0,0,1018.6,976.4,2,1,2,0,0.11,0.91,7.0,13.0,325,326,22.7,20.0,17.4,17.0,18.3,0.195,0.23,0.225,0.326,1,3600.0,88.4,57.0,31.3,383.8,88.4,204.6,141.0,91.0,50.0,383.8,141.0,326.4,Magnoliopsida; Eucalyptus L'Hér.; Tracheophyta; Pinus pinaster Aiton; Castanea sativa Mill.; Quercus L.; 
2007,2007-10-17,Viseu,Cinfães,Moimenta,Vila Pouca,41.05379435,-8.195334808553673,Desconhecida,412.0,2007-10-17T08:00,11.8,87,9.8,11.1,0.0,0.0,0.0,0.0,0,1021.5,972.5,0,0,0,0,0.03,0.18,4.8,3.5,103,66,10.8,12.0,15.2,17.4,18.7,0.207,0.222,0.202,0.326,1,2799.84,144.0,88.5,55.5,411.0,123.4,296.5,83.0,51.0,32.0,352.1,83.0,170.9,Magnoliopsida; Eucalyptus L'Hér.; Tracheophyta; Pinus pinaster Aiton; Castanea sativa Mill.; Quercus L.; 
2007,2007-10-22,Viseu,Resende,Resende,LUGAR DA PESQUEIRA (Lugar de Cima),41.105831,-7.9644114,Desconhecida,240.0,2007-10-22T19:00,15.3,76,11.1,14.9,0.0,0.0,0.0,0.0,1,1018.7,990.2,29,0,0,98,0.0,0.41,5.1,6.6,274,299,13.7,16.4,16.2,17.2,19.0,0.136,0.199,0.22,0.321,0,0.0,0.0,0.0,0.0,0.0,0.0,0.0,0.0,0.0,0.0,0.0,0.0,0.0,Tracheophyta; Magnoliopsida; Pinales; Eucalyptus L'Hér.; Vitis vinifera L.
2007,2007-10-31,Viseu,Mortágua,Trezói,Meligioso,40.3951699,-8.3380315,Natural,169.0,2007-10-31T12:00,16.8,42,3.8,12.7,0.0,0.0,0.0,0.0,0,1022.6,1002.5,0,0,0,0,0.35,1.11,19.8,26.3,63,65,42.5,17.6,14.5,17.3,19.8,0.123,0.18,0.185,0.293,1,3600.0,603.2,514.8,88.4,888.5,603.2,804.2,587.0,501.0,86.0,888.5,587.0,782.6,Eucalyptus L'Hér.; Tracheophyta; Pinus pinaster Aiton; Vitis vinifera L.
2007,2007-10-19,Viseu,Santa Comba Dão,Treixedo,TREIXEDO (Treixedinho),40.4319869,-8.121521714312362,Desconhecida,280.0,2007-10-19T07:00,10.2,85,7.7,8.2,0.0,0.0,0.0,0.0,0,1022.4,988.6,0,0,0,0,0.02,0.19,9.1,20.4,72,76,22.0,11.8,16.0,17.7,19.1,0.173,0.228,0.199,0.304,1,0.0,4.4,0.0,4.4,0.0,0.5,36.9,1.0,0.0,1.0,0.0,1.0,8.5,Pinus pinaster Aiton; Tracheophyta; Eucalyptus L'Hér.; Magnoliopsida
2007,2007-11-01,Viseu,Tabuaço,Longra,LONGA,41.0598097,-7.5930811,Desconhecida,600.0,2007-11-01T20:00,8.5,61,1.4,5.3,0.0,0.0,0.0,0.0,0,1027.3,955.7,0,0,0,0,0.02,0.43,8.4,18.2,47,60,18.7,9.7,11.8,14.3,17.8,0.164,0.188,0.179,0.308,0,0.0,0.0,0.0,0.0,0.0,0.0,0.0,0.0,0.0,0.0,0.0,0.0,0.0,Tracheophyta; Magnoliopsida; Olea europaea L.; Pinus pinaster Aiton
2007,2007-04-04,Viseu,Penedono,Castainço,Castainço,40.9953396,-7.448037,Desconhecida,763.0,2007-04-04T16:00,12.4,51,2.6,8.0,0.1,0.1,0.0,0.0,51,1011.9,924.3,100,60,86,0,0.2,0.7,18.2,25.6,308,309,38.2,12.8,9.0,7.9,8.4,0.293,0.284,0.328,0.316,1,3600.0,274.9,113.7,161.2,214.6,274.9,724.9,312.0,129.0,183.0,214.6,312.0,822.8,Magnoliopsida; Tracheophyta
2007,2007-04-05,Viseu,Castro Daire,Pinheiro,SERRA DE MONTEMURO,40.9204667,-7.9780049,Desconhecida,314.0,2007-04-05T16:00,13.6,48,2.7,10.8,0.0,0.0,0.0,0.0,1,1014.7,977.6,36,0,60,0,0.31,0.82,9.0,11.8,37,38,24.5,14.8,10.7,10.3,10.8,0.348,0.357,0.354,0.402,1,3600.0,510.9,397.8,113.1,736.8,510.9,738.4,578.0,450.0,128.0,736.8,578.0,835.3,Eucalyptus L'Hér.; Tracheophyta; Quercus L.; Magnoliopsida; Pinus pinaster Aiton; Pinales
2007,2007-10-21,Viseu,Tarouca,Salzedas,Meixedo,41.0545541,-7.7252889,Desconhecida,513.0,2007-10-21T17:00,19.2,28,0.3,16.5,0.0,0.0,0.0,0.0,0,1020.6,961.5,0,0,0,0,0.11,1.6,4.5,4.7,29,32,10.4,19.0,15.4,16.6,18.7,0.178,0.208,0.181,0.316,1,3600.0,98.5,71.8,26.8,613.2,98.5,161.6,173.0,126.0,47.0,613.2,173.0,283.7,Tracheophyta; Magnoliopsida; Pinus pinaster Aiton; Pinales; Castanea sativa Mill.; Olea europaea L.
2007,2007-11-02,Viseu,Moimenta da Beira,Cabaços,CABAÇOS,41.0261919,-7.5737411,Desconhecida,935.0,2007-11-02T16:00,15.3,41,2.2,11.7,0.0,0.0,0.0,0.0,0,1023.6,917.4,0,0,0,0,0.19,1.02,13.0,17.9,66,68,30.6,15.0,10.8,13.0,16.2,0.17,0.188,0.182,0.297,1,3600.0,217.5,171.1,46.4,723.0,217.5,328.9,286.0,225.0,61.0,723.0,286.0,432.4,Tracheophyta; Magnoliopsida; Pinus pinaster Aiton
2007,2007-11-01,Viseu,Oliveira de Frades,Pinheiro,Quetriz,40.7280899,-8.2051405,Desconhecida,390.0,2007-11-01T16:00,17.3,36,2.1,14.1,0.0,0.0,0.0,0.0,0,1024.7,979.0,0,0,0,0,0.2,1.26,9.7,13.7,86,87,26.6,17.9,14.0,16.1,18.9,0.142,0.2,0.21,0.307,1,3600.0,228.9,180.5,48.4,730.6,228.9,343.2,298.0,235.0,63.0,730.6,298.0,446.7,Eucalyptus L'Hér.; Pinus pinaster Aiton; Magnoliopsida; Tracheophyta; Quercus L.; Olea europaea L.
2007,2007-10-20,Viseu,São Pedro do Sul,Candal,Coelheira,40.8528164,-8.1784313,Desconhecida,729.0,2007-10-20T12:00,19.1,39,4.9,17.1,0.0,0.0,0.0,0.0,0,1022.9,940.0,0,0,0,0,0.39,1.35,9.3,12.1,77,78,24.1,18.4,13.6,15.5,17.1,0.199,0.239,0.227,0.322,1,3600.0,658.8,570.5,88.2,913.4,658.8,861.7,642.0,556.0,86.0,913.4,642.0,839.8,Magnoliopsida; Eucalyptus L'Hér.; Pinus pinaster Aiton; Tracheophyta; Quercus L.; Acacia Mill.; Olea europaea L.; Quercus suber L.; 
2007,2007-10-22,Viseu,Oliveira de Frades,Ribeiradio,Souto de Alves,40.732458,-8.3015913,NC,247.0,2007-10-22T17:00,18.3,55,9.2,16.6,0.0,0.0,0.0,0.0,0,1018.3,989.3,14,0,0,46,0.12,0.94,10.0,15.3,322,326,24.8,20.1,17.2,18.2,19.6,0.138,0.205,0.2,0.306,1,3600.0,98.4,68.1,30.3,553.3,98.4,170.0,169.0,117.0,52.0,553.3,169.0,292.1,Eucalyptus L'Hér.; Pinus pinaster Aiton; Magnoliopsida; Tracheophyta; Quercus L.; Olea europaea L.
2007,2007-10-31,Viseu,Tarouca,Tarouca,TAROUCA,41.006715,-7.784047207595763,Desconhecida,732.0,2007-10-31T13:00,14.0,47,3.0,9.3,0.0,0.0,0.0,0.0,0,1023.5,938.8,0,0,0,0,0.32,0.85,23.0,31.4,61,62,51.1,15.2,11.6,14.4,17.4,0.19,0.206,0.204,0.319,1,3600.0,585.8,501.4,84.4,898.9,585.8,774.3,597.0,511.0,86.0,898.9,597.0,789.0,Tracheophyta; Magnoliopsida; Pinus pinaster Aiton; Pinales; Castanea sativa Mill.; 
2007,2007-11-02,Viseu,Vila Nova de Paiva,Pendilhe,PENDILHE,40.90815665,-7.833581151658001,Desconhecida,770.0,2007-11-02T10:00,11.0,54,2.0,6.9,0.0,0.0,0.0,0.0,0,1027.9,937.8,1,1,0,0,0.19,0.61,15.7,21.2,53,55,34.9,10.4,9.9,13.6,16.8,0.183,0.217,0.221,0.318,1,3600.0,431.2,350.3,80.9,791.3,431.2,615.0,373.0,303.0,70.0,791.3,373.0,532.0,Magnoliopsida; Tracheophyta; Pinus pinaster Aiton; 
2007,2007-10-20,Viseu,Sernancelhe,Chosendo,CHOSENDO,40.9678953,-7.4559824,Desconhecida,779.0,2007-10-20T18:00,16.5,38,2.0,13.1,0.0,0.0,0.0,0.0,0,1021.1,932.2,0,0,0,0,0.08,1.17,10.3,14.7,25,31,16.6,16.7,15.4,16.1,17.9,0.182,0.207,0.177,0.296,0,643.02,0.0,0.0,0.0,0.0,0.0,0.0,25.0,14.0,11.0,145.9,25.0,72.8,Magnoliopsida; Castanea sativa Mill.; Tracheophyta; Pinus pinaster Aiton; Acacia Mill.; Vitis vinifera L.; Quercus L.; 
2007,2007-11-02,Viseu,Tondela,Caparrosa,CAPARROSA,40.62223025,-8.094324212310221,Desconhecida,421.0,2007-11-02T11:00,15.8,41,2.7,11.6,0.0,0.0,0.0,0.0,0,1025.4,975.8,0,0,0,0,0.3,1.06,17.2,23.7,61,62,38.5,15.5,13.2,16.1,18.9,0.133,0.193,0.197,0.298,1,3600.0,538.0,454.8,83.2,860.1,538.0,734.6,498.0,421.0,77.0,860.1,498.0,680.0,Eucalyptus L'Hér.; Pinus pinaster Aiton; Tracheophyta; Magnoliopsida; Acacia Mill.
2007,2007-10-22,Viseu,Sernancelhe,Macieira,MACIEIRA,40.989796,-7.4854129,Desconhecida,796.0,2007-10-22T11:00,17.3,33,0.7,14.5,0.0,0.0,0.0,0.0,1,1019.8,929.4,30,0,0,99,0.3,1.34,5.8,7.2,274,273,15.5,16.5,12.2,15.6,17.7,0.178,0.204,0.177,0.296,1,3600.0,547.8,373.0,174.7,646.9,547.8,796.5,511.0,348.0,163.0,646.9,511.0,743.0,Magnoliopsida; Pinales; Vitis vinifera L.; Castanea sativa Mill.; Tracheophyta; Quercus L.; Pinus pinaster Aiton; Olea europaea L.; 
2007,2007-10-31,Viseu,Santa Comba Dão,São Joaninho,S.JOANINHO (SÃO JOANINHO),40.45075455,-8.130012150133478,Desconhecida,321.0,2007-10-31T13:00,16.4,41,3.1,12.1,0.0,0.0,0.0,0.0,0,1022.4,984.5,0,0,0,0,0.35,1.1,20.1,27.9,66,66,48.6,17.6,13.8,16.3,19.0,0.137,0.194,0.195,0.298,1,3600.0,587.6,505.1,82.5,891.1,587.6,786.7,598.0,514.0,84.0,891.1,598.0,800.6,Vitis vinifera L.; Tracheophyta; Eucalyptus L'Hér.; Pinus pinaster Aiton; Magnoliopsida
2007,2007-11-02,Viseu,Sátão,Rio de Moinhos,RIO DE MOINHOS,40.7144192,-7.6975145,Desconhecida,525.0,2007-11-02T11:00,13.0,48,2.2,8.6,0.0,0.0,0.0,0.0,0,1026.6,964.6,0,0,0,0,0.26,0.78,18.0,24.6,57,58,39.2,13.6,11.5,15.1,18.7,0.128,0.206,0.228,0.318,1,3600.0,536.8,453.8,83.0,857.3,536.8,735.5,498.0,421.0,77.0,857.3,498.0,682.3,Tracheophyta; Pinus pinaster Aiton; Castanea sativa Mill.; Vitis vinifera L.; Magnoliopsida
2007,2007-10-23,Viseu,Lamego,Valdigem,VALDIGEM,41.1386734,-7.757867134086674,Desconhecida,430.0,2007-10-23T16:00,19.6,56,10.5,18.7,0.2,0.2,0.0,0.0,51,1014.7,965.3,73,0,76,92,0.17,1.01,7.1,9.5,294,295,28.8,20.6,15.8,16.4,18.6,0.178,0.202,0.183,0.315,1,3600.0,190.8,119.8,71.0,427.9,190.8,387.1,242.0,152.0,90.0,427.9,242.0,490.9,Olea europaea L.; Magnoliopsida; Vitis vinifera L.; Tracheophyta; Eucalyptus L'Hér.; 
2007,2007-10-22,Viseu,Vila Nova de Paiva,Vila Cova à Coelheira,VILA COVA COELHEIRA (VILA COVA A COELHEIRA),40.9401466,-7.7762141,Desconhecida,825.0,2007-10-22T20:00,11.7,73,7.0,9.9,0.0,0.0,0.0,0.0,1,1018.4,923.3,29,0,0,98,0.01,0.37,7.3,10.9,290,304,13.3,12.9,13.7,14.9,16.9,0.202,0.237,0.221,0.32,0,0.0,0.0,0.0,0.0,0.0,0.0,0.0,0.0,0.0,0.0,0.0,0.0,0.0,Tracheophyta; Magnoliopsida
2007,2007-11-02,Viseu,Tarouca,Salzedas,LUGAR DA POÇA,41.0545541,-7.7252889,Desconhecida,513.0,2007-11-02T18:00,14.3,49,3.7,11.3,0.0,0.0,0.0,0.0,0,1024.0,963.8,0,0,0,0,0.07,0.83,10.0,17.4,75,77,24.8,13.9,12.3,14.5,18.1,0.163,0.188,0.182,0.313,0,0.0,0.0,0.0,0.0,0.0,0.0,0.0,6.0,2.0,4.0,29.1,6.0,35.3,Tracheophyta; Magnoliopsida; Pinus pinaster Aiton; Pinales; Castanea sativa Mill.; Olea europaea L.
2007,2007-11-01,Viseu,Lamego,Penude,SERRA MEADAS (Quinta da Serra),41.0764376,-7.8520499,Desconhecida,763.0,2007-11-01T15:00,14.0,41,0.8,10.2,0.0,0.0,0.0,0.0,0,1025.4,937.2,0,0,0,0,0.25,0.95,12.5,16.3,72,72,29.2,15.2,10.7,13.3,16.4,0.157,0.194,0.208,0.318,1,3600.0,384.7,320.1,64.5,831.3,384.7,534.8,441.0,367.0,74.0,831.3,441.0,613.1,Vitis vinifera L.; Magnoliopsida; Tracheophyta; Pinales; 
2007,2007-11-02,Viseu,Moimenta da Beira,Sever,Arcas,41.0047245,-7.6988022,Desconhecida,814.0,2007-11-02T15:00,16.3,40,2.8,12.6,0.0,0.0,0.0,0.0,0,1023.7,930.7,0,0,0,0,0.27,1.11,14.0,18.4,64,64,32.0,16.2,10.9,13.5,16.7,0.17,0.193,0.194,0.315,1,3600.0,376.9,314.3,62.7,826.2,376.9,528.5,433.0,361.0,72.0,826.2,433.0,607.1,Tracheophyta; Vitis vinifera L.; Magnoliopsida; Castanea sativa Mill.; Pinus pinaster Aiton
2007,2007-11-02,Viseu,Resende,Felgueiras,SAO CRISTOVAO,41.0758008,-7.9399513,Desconhecida,603.0,2007-11-02T17:00,16.3,45,4.4,13.7,0.0,0.0,0.0,0.0,0,1023.6,953.7,0,0,0,0,0.09,1.01,8.3,17.4,85,84,30.2,15.6,12.1,14.2,17.4,0.154,0.192,0.208,0.318,1,3511.78,52.7,36.0,16.7,413.4,52.0,94.8,120.0,82.0,38.0,520.8,120.0,215.8,Magnoliopsida; Pinales; Vitis vinifera L.; Pinus pinaster Aiton; Tracheophyta; ; Eucalyptus L'Hér.
2007,2007-04-14,Viseu,Carregal do Sal,Parada,PARADA,40.4168937,-8.034905,Desconhecida,297.0,2007-04-14T15:00,20.0,46,8.1,19.7,0.0,0.0,0.0,0.0,0,1018.2,983.7,5,6,0,0,0.48,1.26,8.4,10.2,290,293,20.5,20.8,14.4,11.3,10.5,0.342,0.36,0.35,0.386,1,3600.0,740.3,646.3,94.1,915.9,740.3,960.1,795.0,694.0,101.0,915.9,795.0,1031.0,Olea europaea L.; Magnoliopsida; Vitis vinifera L.; Tracheophyta; Eucalyptus L'Hér.; ; Pinus pinaster Aiton
2007,2007-10-26,Viseu,Mangualde,Santiago de Cassurrães,Casa dos Cantoneiros,40.5788253,-7.7039594,Desconhecida,519.0,2007-10-26T17:00,14.6,48,3.8,11.4,0.0,0.0,0.0,0.0,0,1017.2,956.7,4,4,1,0,0.11,0.86,11.8,20.8,50,53,32.4,16.1,14.0,16.4,19.0,0.165,0.219,0.223,0.316,1,3600.0,75.4,52.5,22.9,546.5,75.4,133.0,145.0,101.0,44.0,546.5,145.0,255.9,Magnoliopsida; Olea europaea L.; Eucalyptus L'Hér.; Tracheophyta; Pinus pinaster Aiton
2007,2007-10-31,Viseu,Resende,Resende,MAGARRIM (Magarim),41.105831,-7.9644114,Desconhecida,240.0,2007-10-31T22:00,8.4,67,2.7,5.3,0.0,0.0,0.0,0.0,0,1024.2,994.9,0,0,0,0,0.02,0.36,10.1,16.3,94,96,21.2,9.7,13.6,15.8,18.6,0.13,0.187,0.22,0.319,0,0.0,0.0,0.0,0.0,0.0,0.0,0.0,0.0,0.0,0.0,0.0,0.0,0.0,Tracheophyta; Magnoliopsida; Pinales; Eucalyptus L'Hér.; Vitis vinifera L.
2007,2007-11-01,Viseu,Oliveira de Frades,Pinheiro,QUETRIZ,40.7280899,-8.2051405,Desconhecida,390.0,2007-11-01T09:00,9.4,64,2.8,5.4,0.0,0.0,0.0,0.0,0,1027.0,979.9,0,0,0,0,0.11,0.43,16.4,24.7,81,82,42.5,10.2,12.7,16.1,19.0,0.146,0.202,0.21,0.307,1,3600.0,278.4,207.1,71.2,646.3,278.4,445.0,211.0,157.0,54.0,646.3,211.0,337.3,Eucalyptus L'Hér.; Pinus pinaster Aiton; Magnoliopsida; Tracheophyta; Quercus L.; Olea europaea L.
2007,2007-10-21,Viseu,São Pedro do Sul,Candal,CANDAL,40.8493122,-8.1832026,Desconhecida,857.0,2007-10-21T15:00,19.5,27,0.2,16.9,0.0,0.0,0.0,0.0,0,1020.6,924.3,16,0,0,52,0.3,1.65,3.6,4.7,90,90,18.4,18.6,13.1,14.6,16.3,0.205,0.242,0.227,0.323,1,3600.0,446.8,375.0,71.8,848.3,446.8,610.3,504.0,423.0,81.0,848.3,504.0,688.4,Magnoliopsida; Eucalyptus L'Hér.; Pinus pinaster Aiton; Tracheophyta; Quercus L.; Acacia Mill.; Olea europaea L.; Quercus suber L.; 
2007,2007-11-02,Viseu,Resende,Anreade,FORNELOS (Fornelo),41.10016,-8.001733,Desconhecida,183.0,2007-11-02T11:00,16.6,43,4.1,13.0,0.0,0.0,0.0,0.0,0,1025.6,1003.8,0,0,0,0,0.29,1.07,14.8,21.0,84,85,35.6,15.0,12.1,15.8,18.9,0.128,0.185,0.22,0.318,1,3600.0,526.0,441.7,84.2,845.1,526.0,726.2,487.0,409.0,78.0,845.1,487.0,672.4,Magnoliopsida; Quercus L.; Pinus pinaster Aiton; Tracheophyta; Olea europaea L.; Eucalyptus L'Hér.; Pinales; Vitis vinifera L.; 
2007,2007-09-11,Viseu,Vila Nova de Paiva,Vila Cova à Coelheira,PENEDAIS,40.8777559,-7.802428,Desconhecida,734.0,2007-09-11T01:00,17.3,42,4.2,14.2,0.0,0.0,0.0,0.0,0,1017.4,933.9,1,0,1,0,0.08,1.15,12.3,27.0,50,56,23.4,18.1,21.8,20.1,17.3,0.114,0.148,0.22,0.332,0,0.0,0.0,0.0,0.0,0.0,0.0,0.0,0.0,0.0,0.0,0.0,0.0,0.0,Magnoliopsida; Pinus pinaster Aiton; Tracheophyta
2007,2007-11-02,Viseu,Resende,Cárquere,VALVERDE,41.0861903,-7.9636451,Desconhecida,523.0,2007-11-02T19:00,12.7,59,4.9,9.8,0.0,0.0,0.0,0.0,0,1024.1,962.4,0,0,0,0,0.04,0.61,11.2,17.7,86,86,30.2,12.3,11.9,13.9,17.1,0.159,0.191,0.211,0.32,0,0.0,0.0,0.0,0.0,0.0,0.0,0.0,0.0,0.0,0.0,0.0,0.0,0.0,Pinus pinaster Aiton; Tracheophyta; Magnoliopsida; Pinales; Eucalyptus L'Hér.; 
2007,2007-04-14,Viseu,Cinfães,Nespereira,Vila Viçosa,41.0441012,-8.0770884,Desconhecida,666.0,2007-04-14T18:00,15.7,63,8.6,14.3,0.0,0.0,0.0,0.0,1,1018.5,941.9,27,29,2,0,0.14,0.67,6.9,10.3,317,324,23.0,16.5,13.4,9.9,9.0,0.351,0.37,0.357,0.398,1,3600.0,184.3,140.0,44.3,655.3,184.3,290.5,266.0,202.0,64.0,655.3,266.0,419.4,Magnoliopsida; Tracheophyta
2007,2007-11-01,Viseu,São João da Pesqueira,Riodades,RIODADES,41.0072754,-7.4879489,Desconhecida,625.0,2007-11-01T14:00,14.1,42,1.3,10.3,0.0,0.0,0.0,0.0,0,1026.1,953.1,0,0,0,0,0.29,0.93,12.8,16.4,74,75,32.4,16.4,11.2,14.4,17.9,0.137,0.188,0.182,0.294,1,3600.0,505.4,429.9,75.5,878.9,505.4,679.2,542.0,461.0,81.0,878.9,542.0,728.4,Magnoliopsida; Castanea sativa Mill.; Tracheophyta; Pinus pinaster Aiton
2007,2007-10-21,Viseu,Lamego,Pretarouca,PRETAROUCA,41.02849325,-7.894000321516179,Desconhecida,951.0,2007-10-21T18:00,15.7,41,2.6,13.4,0.0,0.0,0.0,0.0,0,1020.8,913.3,2,0,0,5,0.04,1.05,4.3,4.9,42,36,9.7,14.8,13.5,14.5,16.3,0.197,0.231,0.215,0.321,0,564.3,0.0,0.0,0.0,0.0,0.0,0.0,23.0,13.0,10.0,135.8,23.0,72.6,Tracheophyta; Magnoliopsida; Pinus pinaster Aiton; Pinales; Castanea sativa Mill.; 
2007,2007-10-27,Viseu,São João da Pesqueira,Trevões,TREVOES (TREVÕES),41.081614,-7.435458,Desconhecida,580.0,2007-10-27T15:00,15.3,44,3.0,11.6,0.0,0.0,0.0,0.0,0,1022.9,955.4,0,0,0,0,0.27,0.98,14.2,19.0,63,63,36.4,17.6,12.6,15.7,18.5,0.145,0.195,0.182,0.295,1,3600.0,401.2,334.6,66.6,827.8,401.2,559.9,458.0,382.0,76.0,827.8,458.0,639.2,Olea europaea L.; Castanea sativa Mill.; Vitis vinifera L.; Magnoliopsida; Tracheophyta
2007,2007-11-02,Viseu,Sernancelhe,Macieira,MACIEIRA,40.989796,-7.4854129,Desconhecida,796.0,2007-11-02T11:00,12.0,49,1.6,7.9,0.0,0.0,0.0,0.0,0,1027.1,934.5,0,0,0,0,0.25,0.72,16.0,21.2,54,55,36.4,12.4,9.8,13.8,17.2,0.166,0.188,0.178,0.294,1,3600.0,538.7,456.8,81.9,867.9,538.7,731.3,500.0,424.0,76.0,867.9,500.0,678.8,Magnoliopsida; Pinales; Vitis vinifera L.; Castanea sativa Mill.; Tracheophyta; Quercus L.; Pinus pinaster Aiton; Olea europaea L.; 
2007,2007-10-23,Viseu,Resende,Resende,Arco,41.0921656,-7.9351098,Desconhecida,614.0,2007-10-23T19:00,15.1,80,11.6,14.9,0.0,0.0,0.0,0.0,3,1015.3,944.5,87,1,95,98,0.0,0.35,4.7,8.3,279,288,16.2,15.8,15.4,15.8,17.7,0.17,0.208,0.208,0.32,0,0.0,0.0,0.0,0.0,0.0,0.0,0.0,0.0,0.0,0.0,0.0,0.0,0.0,Tracheophyta; Olea europaea L.; Magnoliopsida; Pinales
2007,2007-10-31,Viseu,Nelas,Santar,CURVA DA FERRADURA,40.5708793,-7.8958696,Desconhecida,402.0,2007-10-31T11:00,13.0,52,3.3,7.9,0.0,0.0,0.0,0.0,0,1023.7,975.9,0,0,0,0,0.26,0.73,24.0,33.5,62,63,51.5,13.9,13.0,15.9,18.8,0.161,0.22,0.23,0.318,1,3600.0,550.7,464.4,86.2,861.1,550.7,748.5,511.0,431.0,80.0,861.1,511.0,694.6,Olea europaea L.; Pinus pinaster Aiton; Vitis vinifera L.; Tracheophyta; Magnoliopsida
2007,2007-11-02,Viseu,Penedono,Penedono,PENEDONO,40.9831056,-7.390532490896566,Desconhecida,960.0,2007-11-02T15:00,15.6,40,1.9,11.7,0.0,0.0,0.0,0.0,0,1023.7,914.9,0,0,0,0,0.27,1.07,14.0,18.4,64,64,32.0,15.7,10.5,13.1,16.3,0.162,0.181,0.169,0.281,1,3600.0,376.7,314.1,62.6,826.4,376.7,528.0,433.0,361.0,72.0,826.4,433.0,607.0,Magnoliopsida; Pinus pinaster Aiton
2007,2007-03-22,Viseu,São Pedro do Sul,Candal,PÓVOA DAS LEIRAS,40.8504859,-8.1641185,Desconhecida,734.0,2007-03-22T00:00,0.3,80,-2.7,-3.2,0.0,0.0,0.0,0.0,0,1023.5,934.6,2,0,0,8,0.0,0.13,7.2,16.2,6,12,32.8,2.8,6.0,8.4,8.7,0.319,0.339,0.376,0.412,0,0.0,0.0,0.0,0.0,0.0,0.0,0.0,0.0,0.0,0.0,0.0,0.0,0.0,Magnoliopsida; Eucalyptus L'Hér.; Pinus pinaster Aiton; Tracheophyta; Quercus L.; Acacia Mill.; Olea europaea L.; Quercus suber L.; 
2007,2007-11-02,Viseu,Resende,Barrô,MOINHOS,40.7695059,-8.0374203,Desconhecida,360.0,2007-11-02T16:00,18.5,38,4.0,15.5,0.0,0.0,0.0,0.0,0,1022.6,980.5,0,0,0,0,0.21,1.32,10.8,15.6,69,71,25.9,18.5,14.2,15.9,19.0,0.144,0.201,0.207,0.304,1,3600.0,224.3,176.8,47.5,727.7,224.3,337.6,293.0,231.0,62.0,727.7,293.0,441.0,Magnoliopsida; Pinus pinaster Aiton; Pinales; Vitis vinifera L.; Tracheophyta; Eucalyptus L'Hér.; Olea europaea L.; 
2007,2007-10-27,Viseu,Penalva do Castelo,Esmolfe,ESMOLFE,40.6795232,-7.6836313,Desconhecida,555.0,2007-10-27T16:00,15.0,44,2.7,11.4,0.0,0.0,0.0,0.0,0,1022.3,957.6,0,0,0,0,0.2,0.96,13.4,18.5,59,61,32.4,16.8,13.3,15.9,18.8,0.153,0.216,0.228,0.319,1,3600.0,245.9,196.1,49.8,740.1,245.9,367.0,316.0,252.0,64.0,740.1,316.0,471.6,Magnoliopsida; Tracheophyta; Pinus pinaster Aiton; Olea europaea L.; Quercus L.; Acacia Mill.
2007,2007-10-27,Viseu,Castro Daire,Reriz,SABARIZ,40.9037667,-7.9927813,Desconhecida,329.0,2007-10-27T18:00,13.8,53,4.5,11.6,0.0,0.0,0.0,0.0,0,1022.9,983.8,0,0,0,0,0.04,0.74,6.1,9.2,50,51,16.2,14.7,14.6,16.6,19.2,0.191,0.226,0.223,0.314,0,85.74,0.0,0.0,0.0,0.0,0.0,0.0,14.0,7.0,7.0,83.5,14.0,56.2,Pinus pinaster Aiton; Quercus L.; Castanea sativa Mill.; Magnoliopsida; Tracheophyta
2007,2007-10-26,Viseu,Tarouca,Salzedas,Meixedo,41.0545541,-7.7252889,Desconhecida,513.0,2007-10-26T11:00,13.1,60,5.4,10.1,0.0,0.0,0.0,0.0,0,1018.3,958.2,12,13,0,0,0.25,0.61,13.1,17.5,74,76,29.9,14.8,12.2,16.0,18.5,0.183,0.2,0.181,0.315,1,3600.0,541.7,453.5,88.1,815.7,541.7,769.7,504.0,422.0,82.0,815.7,504.0,716.1,Tracheophyta; Magnoliopsida; Pinus pinaster Aiton; Pinales; Castanea sativa Mill.; Olea europaea L.
2007,2007-10-25,Viseu,Moimenta da Beira,Vilar,BARRAGEM DE VILAR (Barragem do Vilar),40.9869672,-7.53573801233753,Desconhecida,530.0,2007-10-25T13:00,14.6,52,4.8,11.8,0.0,0.0,0.0,0.0,0,1014.9,953.4,15,16,0,2,0.32,0.81,13.4,17.7,66,66,35.6,18.0,13.8,16.2,18.6,0.181,0.199,0.179,0.31,1,3600.0,602.9,505.7,97.2,863.4,602.9,810.4,614.0,515.0,99.0,863.4,614.0,825.2,Pinus pinaster Aiton; Magnoliopsida; Tracheophyta; Castanea sativa Mill.
2007,2007-09-12,Viseu,Castro Daire,Gosende,CODEÇAL (Codeçais),41.0083477,-7.9058671,NC,1004.0,2007-09-12T21:00,18.9,60,11.0,18.1,0.0,0.0,0.0,0.0,0,1016.6,905.1,8,0,9,8,0.03,0.87,7.4,13.0,231,236,13.7,21.0,21.1,18.5,15.8,0.112,0.144,0.214,0.332,0,0.0,0.0,0.0,0.0,0.0,0.0,0.0,0.0,0.0,0.0,0.0,0.0,0.0,Tracheophyta; Magnoliopsida; Pinales
2007,2007-10-26,Viseu,Oliveira de Frades,Pinheiro,PINHEIRO DE LAFOES (PINHEIRO),40.725973,-8.214473727122396,Desconhecida,394.0,2007-10-26T16:00,17.8,44,5.3,14.6,0.0,0.0,0.0,0.0,0,1016.6,970.8,1,1,0,0,0.22,1.14,14.0,19.5,64,65,29.2,18.9,15.0,17.1,19.2,0.175,0.214,0.211,0.308,1,3600.0,249.4,193.7,55.7,709.4,249.4,378.1,318.0,247.0,71.0,709.4,318.0,482.0,Eucalyptus L'Hér.; Pinus pinaster Aiton; Magnoliopsida; Tracheophyta; Quercus L.; Olea europaea L.
2007,2007-11-01,Viseu,Cinfães,Travanca,S.PEDRO (São Pedro),41.0196452,-8.2322704,Desconhecida,160.0,2007-11-01T15:00,17.3,37,2.4,13.7,0.0,0.0,0.0,0.0,0,1025.1,1006.0,0,0,0,0,0.28,1.24,12.6,16.6,88,89,28.1,18.0,13.5,16.1,18.9,0.137,0.192,0.223,0.321,1,3600.0,388.5,322.8,65.6,827.5,388.5,541.8,444.0,369.0,75.0,827.5,444.0,619.2,Pinus pinaster Aiton; Magnoliopsida; Tracheophyta; Eucalyptus L'Hér.; Vitis vinifera L.; Quercus L.; 
