2007,2007-11-01,Viseu,Resende,Anreade,ANHO BOM BAIXO (Marganhos),41.10016,-8.001733,Desconhecida,183.0,2007-11-01T16:00,16.8,39,2.8,13.7,0.0,0.0,0.0,0.0,0,1025.2,1003.4,0,0,0,0,0.19,1.17,10.1,15.1,86,89,29.2,17.5,13.6,16.0,19.0,0.128,0.186,0.22,0.319,1,3600.0,227.9,179.6,48.3,734.7,227.9,339.4,297.0,234.0,63.0,734.7,297.0,442.3,Magnoliopsida; Quercus L.; Pinus pinaster Aiton; Tracheophyta; Olea europaea L.; Eucalyptus L'Hér.; Pinales; Vitis vinifera L.; 
2007,2007-10-28,Viseu,Castro Daire,Almofala,Savariz,40.9541684,-7.7933527,Desconhecida,863.0,2007-10-28T13:00,14.8,45,3.1,12.6,0.0,0.0,0.0,0.0,0,1024.4,925.6,19,0,0,63,0.31,0.93,5.2,6.2,34,36,19.1,15.7,10.8,14.0,16.6,0.201,0.212,0.204,0.32,1,3600.0,563.7,456.7,107.1,797.0,563.7,794.1,574.0,465.0,109.0,797.0,574.0,808.5,Tracheophyta; Castanea sativa Mill.; Magnoliopsida; Pinus pinaster Aiton
2007,2007-10-28,Viseu,Oliveira de Frades,Pinheiro,PINHEIRO DE LAFOES (PINHEIRO),40.725973,-8.214473727122396,Desconhecida,394.0,2007-10-28T09:00,11.8,67,5.9,9.5,0.0,0.0,0.0,0.0,1,1025.9,978.8,20,0,0,68,0.1,0.46,8.9,15.4,76,74,25.2,11.2,13.0,16.7,19.1,0.166,0.211,0.211,0.308,1,3600.0,278.5,201.7,76.8,598.4,278.5,467.0,214.0,155.0,59.0,598.4,214.0,358.9,Eucalyptus L'Hér.; Pinus pinaster Aiton; Magnoliopsida; Tracheophyta; Quercus L.; Olea europaea L.
2007,2007-10-23,Viseu,Lamego,Avões,AVOES DE LA (AVÕES),41.1242278,-7.834607,Desconhecida,701.0,2007-10-23T22:00,12.6,92,11.3,12.6,0.0,0.0,0.0,0.0,1,1014.2,933.3,37,0,62,0,0.0,0.12,2.3,1.9,231,292,8.6,13.6,14.7,15.2,17.2,0.182,0.204,0.191,0.318,0,0.0,0.0,0.0,0.0,0.0,0.0,0.0,0.0,0.0,0.0,0.0,0.0,0.0,Magnoliopsida; Vitis vinifera L.; Tracheophyta; Eucalyptus L'Hér.; Pinales; 
2007,2007-04-16,Viseu,Cinfães,Tendais,FONTE FRIA,41.0142975,-8.0529355,Desconhecida,613.0,2007-04-16T15:00,20.8,44,8.1,19.3,0.0,0.0,0.0,0.0,0,1017.9,948.4,19,2,28,0,0.39,1.37,8.2,10.9,61,63,27.7,19.5,13.8,10.7,9.4,0.329,0.352,0.355,0.397,1,3600.0,545.5,401.9,143.6,566.9,545.5,963.6,585.0,431.0,154.0,566.9,585.0,1033.3,Tracheophyta; Quercus L.; Magnoliopsida; Pinus pinaster Aiton; 
2007,2007-10-28,Viseu,Castro Daire,Pepim,PEPIM,40.8881483,-7.953458,Desconhecida,550.0,2007-10-28T07:00,4.2,89,2.6,1.3,0.0,0.0,0.0,0.0,0,1025.7,958.9,0,0,0,0,0.0,0.09,8.5,14.6,78,74,23.8,6.5,11.3,15.1,17.8,0.192,0.226,0.221,0.313,1,0.0,0.0,0.0,0.0,0.0,0.0,0.0,0.0,0.0,0.0,0.0,0.0,0.0,Magnoliopsida; Pinus pinaster Aiton; Tracheophyta
2007,2007-10-28,Viseu,Armamar,Vila Seca,VILA SECA,41.1218248,-7.6630277,Desconhecida,520.0,2007-10-28T18:00,14.6,53,5.1,12.6,0.0,0.0,0.0,0.0,1,1022.7,961.8,28,0,0,93,0.04,0.78,5.4,7.9,352,357,15.1,14.4,13.2,15.4,18.3,0.174,0.195,0.181,0.314,0,0.0,0.0,0.0,0.0,0.0,0.0,0.0,10.0,2.0,8.0,25.4,10.0,49.3,Magnoliopsida; Vitis vinifera L.; Olea europaea L.
2007,2007-10-29,Viseu,Nelas,Moreira,MOREIRA (Moreira de Baixo),40.5489747,-7.9213866,Desconhecida,369.0,2007-10-29T14:00,20.0,52,9.9,18.3,0.0,0.0,0.0,0.0,1,1019.9,977.1,29,0,0,96,0.3,1.12,11.5,14.8,328,331,25.2,20.4,14.3,16.2,19.2,0.157,0.218,0.228,0.318,1,3600.0,438.0,263.9,174.1,515.8,438.0,709.4,468.0,282.0,186.0,515.8,468.0,758.1,Magnoliopsida; Vitis vinifera L.; Tracheophyta; Olea europaea L.; Quercus L.; Pinus pinaster Aiton; Pinales
2007,2007-04-14,Viseu,Tondela,Mosteiro de Fráguas,BARREGEM DO PAUL,40.5819766,-8.058429557095069,Desconhecida,385.0,2007-04-14T23:00,10.4,93,9.4,9.8,0.0,0.0,0.0,0.0,0,1020.1,974.1,0,0,0,0,0.0,0.09,2.9,3.6,30,360,7.2,11.3,14.1,11.2,10.3,0.317,0.336,0.342,0.396,0,0.0,0.0,0.0,0.0,0.0,0.0,0.0,0.0,0.0,0.0,0.0,0.0,0.0,Tracheophyta; Eucalyptus L'Hér.; Pinus pinaster Aiton; Vitis vinifera L.; Magnoliopsida
2007,2007-04-16,Viseu,Penedono,Penela da Beira,PENELA DA BEIRA,41.023334250000005,-7.441707628599477,Desconhecida,890.0,2007-04-16T18:00,17.9,45,5.9,15.7,0.0,0.0,0.0,0.0,0,1017.1,917.2,1,0,2,0,0.17,1.12,7.9,15.0,39,42,22.7,16.6,13.0,9.3,8.1,0.31,0.322,0.32,0.316,1,3600.0,174.7,130.5,44.2,616.9,174.7,287.6,253.0,189.0,64.0,616.9,253.0,416.4,Olea europaea L.; Castanea sativa Mill.; Magnoliopsida; Tracheophyta
2007,2007-10-29,Viseu,Lamego,Avões,AVOES (AVÕES),41.1242278,-7.834607,Desconhecida,701.0,2007-10-29T05:00,8.5,74,4.0,6.4,0.0,0.0,0.0,0.0,2,1021.2,938.6,56,0,49,90,0.0,0.29,4.7,7.4,293,321,12.6,7.8,11.1,14.2,17.0,0.178,0.196,0.192,0.317,0,0.0,0.0,0.0,0.0,0.0,0.0,0.0,0.0,0.0,0.0,0.0,0.0,0.0,Magnoliopsida; Vitis vinifera L.; Tracheophyta; Eucalyptus L'Hér.; Pinales; 
2007,2007-10-29,Viseu,Castro Daire,Reriz,PÓVOA DE VEADO,40.9037732,-7.992389600982436,Desconhecida,344.0,2007-10-29T09:00,13.7,68,7.8,12.8,0.0,0.0,0.0,0.0,1,1022.6,981.7,24,10,0,50,0.09,0.5,2.2,5.8,360,353,11.5,12.4,13.0,16.2,19.0,0.186,0.224,0.223,0.314,1,3600.0,244.4,167.3,77.1,505.0,244.4,459.2,187.0,128.0,59.0,505.0,187.0,351.4,Pinus pinaster Aiton; Pinales; Quercus L.; Castanea sativa Mill.; Magnoliopsida; Tracheophyta
2007,2007-10-30,Viseu,Sernancelhe,Chosendo,CHOSENDO,40.9678953,-7.4559824,Desconhecida,779.0,2007-10-30T10:00,10.6,62,3.7,6.1,0.0,0.0,0.0,0.0,0,1024.9,933.9,0,0,0,0,0.18,0.48,20.6,28.2,63,63,45.4,11.7,11.6,14.5,17.5,0.173,0.192,0.178,0.295,1,3600.0,436.8,350.6,86.2,766.2,436.8,634.7,380.0,305.0,75.0,766.2,380.0,552.2,Magnoliopsida; Castanea sativa Mill.; Tracheophyta; Pinus pinaster Aiton; Acacia Mill.; Vitis vinifera L.; Quercus L.; 
2007,2007-11-02,Viseu,Resende,Paus,FAZAMOES,41.0578047,-7.9105359,Desconhecida,731.0,2007-11-02T18:00,13.8,50,3.5,10.8,0.0,0.0,0.0,0.0,0,1024.0,939.3,0,0,0,0,0.07,0.79,10.0,17.4,75,77,24.8,13.2,11.4,13.3,16.5,0.154,0.192,0.208,0.318,0,0.0,0.0,0.0,0.0,0.0,0.0,0.0,6.0,2.0,4.0,28.4,6.0,37.5,Magnoliopsida; Pinales; Tracheophyta; Eucalyptus L'Hér.; Pinus pinaster Aiton; Olea europaea L.; 
2007,2007-10-30,Viseu,Nelas,Santar,CURVA DA FERRADURA (SANTAR),40.5708793,-7.8958696,Desconhecida,402.0,2007-10-30T00:00,10.9,78,7.3,8.8,0.0,0.0,0.0,0.0,0,1021.0,973.0,0,0,0,0,0.01,0.28,10.0,20.4,49,48,19.8,11.5,14.6,16.1,18.9,0.167,0.222,0.23,0.318,0,0.0,0.0,0.0,0.0,0.0,0.0,0.0,0.0,0.0,0.0,0.0,0.0,0.0,Olea europaea L.; Pinus pinaster Aiton; Vitis vinifera L.; Tracheophyta; Magnoliopsida
2007,2007-11-03,Viseu,Castro Daire,PEPIM,Veado,40.892623,-7.9528172,Desconhecida,596.0,2007-11-03T12:00,17.2,48,6.1,15.2,0.0,0.0,0.0,0.0,0,1023.3,954.4,0,0,0,0,0.32,1.02,7.3,9.4,81,83,24.8,16.2,11.3,14.2,17.5,0.163,0.216,0.229,0.317,1,3600.0,572.0,488.8,83.2,874.3,572.0,777.2,557.0,476.0,81.0,874.3,557.0,756.8,Magnoliopsida; Pinus pinaster Aiton; Tracheophyta
2007,2007-04-17,Viseu,Tarouca,Tarouca,SERRA SANTA HELENA,41.0035781,-7.8006106,Desconhecida,1090.0,2007-04-17T09:00,11.9,71,6.8,9.2,0.0,0.0,0.0,0.0,0,1019.6,896.2,0,0,0,0,0.21,0.41,12.8,16.9,50,52,30.2,11.6,9.5,8.2,6.6,0.328,0.343,0.348,0.395,1,3600.0,548.6,452.7,95.9,799.7,548.6,769.0,469.0,387.0,82.0,799.7,469.0,657.5,Tracheophyta; Magnoliopsida; Pinus pinaster Aiton; Pinales; Castanea sativa Mill.; 
2007,2007-10-23,Viseu,Lamego,Lamego (almacave),PRETAROUCA,41.1031703,-7.8108512,Desconhecida,546.0,2007-10-23T15:00,20.0,52,9.9,18.4,0.0,0.0,0.0,0.0,3,1014.8,952.6,98,48,69,43,0.28,1.12,11.0,14.5,293,293,30.6,21.2,15.3,16.2,18.2,0.175,0.204,0.191,0.319,1,3600.0,375.7,285.7,90.0,671.3,375.7,588.3,426.0,324.0,102.0,671.3,426.0,667.1,Magnoliopsida; Tracheophyta; Pinales
2007,2007-01-27,Viseu,Castro Daire,Parada de Ester,PARADA,40.930764100000005,-8.053841572509667,NC,441.0,2007-01-27T13:00,4.5,48,-5.6,-1.5,0.0,0.0,0.0,0.0,0,1027.4,973.4,0,0,0,0,0.2,0.44,21.5,31.4,80,81,57.6,4.5,3.6,7.9,11.6,0.334,0.347,0.358,0.399,1,3600.0,543.4,463.0,80.4,913.1,543.4,715.5,541.0,461.0,80.0,913.1,541.0,712.3,Magnoliopsida; Pinus pinaster Aiton; Pinales; Tracheophyta; Eucalyptus L'Hér.
2007,2007-10-25,Viseu,Tondela,Santiago de Besteiros,Lagedo,40.5829418,-8.1293219,Desconhecida,368.0,2007-10-25T12:00,15.9,47,4.7,13.0,0.0,0.0,0.0,0.0,0,1014.3,971.3,16,0,0,55,0.34,0.96,14.0,18.4,72,73,39.6,17.1,14.4,17.0,18.9,0.167,0.207,0.195,0.3,1,3600.0,633.4,543.1,90.3,898.7,633.4,836.0,617.0,529.0,88.0,898.7,617.0,814.3,Tracheophyta; Pinus pinaster Aiton; Vitis vinifera L.; Magnoliopsida; Eucalyptus L'Hér.
2007,2007-04-17,Viseu,Tondela,Sabugosa,Carregal,40.5693747,-8.028996496638364,Desconhecida,330.0,2007-04-17T13:00,22.3,43,8.9,22.2,0.0,0.0,0.0,0.0,0,1016.0,978.1,11,0,18,1,0.55,1.55,10.4,13.5,56,56,32.0,21.2,14.8,12.1,10.6,0.282,0.318,0.34,0.393,1,3600.0,835.4,717.9,117.5,835.9,835.4,1166.6,839.0,721.0,118.0,835.9,839.0,1171.7,Pinus pinaster Aiton; Magnoliopsida; Eucalyptus L'Hér.; Tracheophyta; Vitis vinifera L.
2007,2007-11-03,Viseu,Oliveira de Frades,Pinheiro,Quetriz,40.7280899,-8.2051405,Desconhecida,390.0,2007-11-03T07:00,8.1,79,4.7,5.3,0.0,0.0,0.0,0.0,0,1023.4,976.3,0,0,0,0,0.01,0.23,10.3,20.3,78,83,26.3,9.0,13.1,15.9,18.9,0.138,0.197,0.21,0.306,0,0.0,0.0,0.0,0.0,0.0,0.0,0.0,0.0,0.0,0.0,0.0,0.0,0.0,Eucalyptus L'Hér.; Pinus pinaster Aiton; Magnoliopsida; Tracheophyta; Quercus L.; Olea europaea L.
2007,2007-10-29,Viseu,Oliveira de Frades,Ribeiradio,Souto de Alves,40.732458,-8.3015913,Desconhecida,247.0,2007-10-29T14:00,19.7,63,12.4,17.6,0.0,0.0,0.0,0.0,2,1020.8,991.9,63,39,0,92,0.27,0.86,19.9,26.2,338,339,41.0,20.7,15.6,17.2,19.4,0.138,0.191,0.199,0.304,1,3600.0,381.7,172.6,209.2,336.6,381.7,710.9,407.0,184.0,223.0,336.6,407.0,757.9,Eucalyptus L'Hér.; Pinus pinaster Aiton; Magnoliopsida; Tracheophyta; Quercus L.; Olea europaea L.
2007,2007-10-29,Viseu,Cinfães,Fornelos,Cortegaça,41.022444,-8.2177165,Desconhecida,397.0,2007-10-29T21:00,11.3,85,9.0,9.8,0.0,0.0,0.0,0.0,0,1021.9,974.5,4,4,0,0,0.0,0.19,8.7,15.7,7,9,21.6,12.8,14.6,15.8,18.4,0.168,0.214,0.228,0.322,0,0.0,0.0,0.0,0.0,0.0,0.0,0.0,0.0,0.0,0.0,0.0,0.0,0.0,Quercus L.; Eucalyptus L'Hér.; Magnoliopsida; Vitis vinifera L.; Tracheophyta; Pinales; 
2007,2007-11-03,Viseu,Castro Daire,Reriz,SABARIZ,40.9037667,-7.9927813,Desconhecida,329.0,2007-11-03T06:00,6.8,88,5.0,4.3,0.0,0.0,0.0,0.0,0,1023.4,983.3,0,0,0,0,0.0,0.12,9.1,19.5,97,95,23.0,8.1,12.5,15.6,18.9,0.161,0.213,0.223,0.313,0,0.0,0.0,0.0,0.0,0.0,0.0,0.0,0.0,0.0,0.0,0.0,0.0,0.0,Pinus pinaster Aiton; Quercus L.; Castanea sativa Mill.; Magnoliopsida; Tracheophyta
2007,2007-10-28,Viseu,Lamego,Avões,AVOES (AVÕES),41.1242278,-7.834607,Desconhecida,701.0,2007-10-28T23:00,10.3,66,4.2,8.2,0.0,0.0,0.0,0.0,1,1022.8,940.6,32,0,4,99,0.0,0.42,4.8,6.8,283,302,12.2,8.9,11.9,14.3,17.0,0.178,0.196,0.192,0.317,0,0.0,0.0,0.0,0.0,0.0,0.0,0.0,0.0,0.0,0.0,0.0,0.0,0.0,Magnoliopsida; Vitis vinifera L.; Tracheophyta; Eucalyptus L'Hér.; Pinales; 
2007,2007-10-27,Viseu,Castro Daire,Pepim,PEPIM,40.8881483,-7.953458,Desconhecida,550.0,2007-10-27T09:00,8.6,72,3.9,5.3,0.0,0.0,0.0,0.0,0,1025.5,959.8,0,0,0,0,0.1,0.31,13.2,20.1,79,81,40.0,9.7,11.6,15.3,17.9,0.199,0.228,0.221,0.313,1,3600.0,297.3,224.6,72.7,661.6,297.3,470.2,229.0,173.0,56.0,661.6,229.0,362.1,Magnoliopsida; Pinus pinaster Aiton; Tracheophyta
2007,2007-10-27,Viseu,Viseu,Bodiosa,Travanca,40.7196451,-7.9643634,NC,454.0,2007-10-27T12:00,14.6,48,3.7,11.0,0.0,0.0,0.0,0.0,0,1024.2,970.7,0,0,0,0,0.32,0.86,16.2,21.8,73,74,43.2,15.8,13.0,16.2,18.7,0.175,0.215,0.207,0.305,1,3600.0,613.4,526.2,87.2,887.0,613.4,821.6,598.0,513.0,85.0,887.0,598.0,801.0,Tracheophyta; Pinus pinaster Aiton; Magnoliopsida
2007,2007-10-28,Viseu,Oliveira de Frades,Pinheiro,PINHEIRO,40.725973,-8.214473727122396,Desconhecida,394.0,2007-10-28T05:00,7.2,82,4.3,4.7,0.0,0.0,0.0,0.0,0,1024.4,976.6,0,0,0,0,0.0,0.19,8.0,18.3,72,80,25.9,9.0,13.5,16.8,19.1,0.166,0.211,0.211,0.308,0,0.0,0.0,0.0,0.0,0.0,0.0,0.0,0.0,0.0,0.0,0.0,0.0,0.0,Eucalyptus L'Hér.; Pinus pinaster Aiton; Magnoliopsida; Tracheophyta; Quercus L.; Olea europaea L.
2007,2007-09-18,Viseu,Resende,São Martinho de Mouros,SADINHAS,41.1025369,-7.8977383,Desconhecida,375.0,2007-09-18T17:00,22.6,43,9.5,20.9,0.0,0.0,0.0,0.0,1,1016.1,973.2,45,11,57,3,0.21,1.55,10.8,16.6,69,68,28.8,23.3,20.5,20.9,18.7,0.21,0.15,0.224,0.329,1,3600.0,168.4,88.5,80.0,300.8,168.4,398.4,219.0,115.0,104.0,300.8,219.0,518.0,Olea europaea L.; Tracheophyta; Magnoliopsida; Eucalyptus L'Hér.; Pinus pinaster Aiton; Pinales
2007,2007-10-28,Viseu,São Pedro do Sul,Manhouce,Gestoso,40.8232938,-8.2129772,Desconhecida,621.0,2007-10-28T19:00,12.5,63,5.8,10.6,0.0,0.0,0.0,0.0,1,1022.9,950.2,28,0,0,93,0.01,0.53,6.0,8.2,327,331,16.6,13.3,13.5,15.0,17.6,0.178,0.221,0.226,0.317,0,0.0,0.0,0.0,0.0,0.0,0.0,0.0,0.0,0.0,0.0,0.0,0.0,0.0,Magnoliopsida; Pinus pinaster Aiton; Quercus L.; Eucalyptus L'Hér.; Tracheophyta; Quercus suber L.; 
2007,2007-10-29,Viseu,Nelas,Santar,CURVA DA FERRADURA (SANTAR),40.5708793,-7.8958696,Desconhecida,402.0,2007-10-29T13:00,19.6,49,8.5,17.9,0.0,0.0,0.0,0.0,1,1020.5,973.9,24,2,1,72,0.35,1.18,9.2,11.6,339,344,22.0,19.6,13.9,16.1,18.9,0.168,0.223,0.23,0.319,1,3600.0,554.0,425.3,128.7,741.6,554.0,795.1,564.0,433.0,131.0,741.6,564.0,809.5,Olea europaea L.; Pinus pinaster Aiton; Vitis vinifera L.; Tracheophyta; Magnoliopsida
2007,2007-11-02,Viseu,Resende,São Cipriano,Covelinhas,41.0542096,-7.9815271,Desconhecida,618.0,2007-11-02T21:00,10.1,66,4.0,7.1,0.0,0.0,0.0,0.0,0,1024.4,951.3,0,0,0,0,0.03,0.42,10.4,18.0,88,90,27.4,9.9,12.1,14.0,17.2,0.141,0.192,0.214,0.317,0,0.0,0.0,0.0,0.0,0.0,0.0,0.0,0.0,0.0,0.0,0.0,0.0,0.0,Pinus pinaster Aiton; Pinales; Magnoliopsida; Olea europaea L.; Tracheophyta; Eucalyptus L'Hér.; 
2007,2007-11-03,Viseu,Viseu,Couto de Cima,COUTO DE CIMA,40.6710607,-8.0023053,Desconhecida,401.0,2007-11-03T09:00,11.8,69,6.2,9.2,0.0,0.0,0.0,0.0,0,1024.1,976.2,0,0,0,0,0.1,0.44,11.0,18.5,79,83,28.1,11.0,12.6,15.6,18.7,0.144,0.201,0.207,0.304,1,3600.0,261.7,192.6,69.1,615.4,261.7,435.0,197.0,145.0,52.0,615.4,197.0,327.5,Pinus pinaster Aiton; Magnoliopsida
2007,2007-10-29,Viseu,Sernancelhe,Macieira,MACIEIRA,40.989796,-7.4854129,Desconhecida,796.0,2007-10-29T16:00,16.7,58,8.5,14.5,0.0,0.0,0.0,0.0,2,1019.2,928.7,52,44,8,24,0.15,0.8,12.7,17.6,345,345,28.4,17.2,12.8,14.4,17.4,0.173,0.192,0.178,0.295,1,3600.0,159.3,60.0,99.3,239.3,159.3,347.8,207.0,78.0,129.0,239.3,207.0,452.0,Magnoliopsida; Pinales; Vitis vinifera L.; Castanea sativa Mill.; Tracheophyta; Quercus L.; Pinus pinaster Aiton; Olea europaea L.; 
2007,2007-11-05,Viseu,Cinfães,Fornelos,Lapa,41.0299252,-8.1962429,Desconhecida,580.0,2007-11-05T08:00,6.7,85,4.4,4.3,0.0,0.0,0.0,0.0,0,1024.0,954.5,0,0,0,0,0.01,0.15,7.2,14.5,87,84,20.5,7.4,11.5,14.3,17.4,0.168,0.202,0.217,0.323,1,1432.48,85.5,50.4,35.1,354.2,51.5,198.0,39.0,23.0,16.0,213.5,39.0,90.4,Quercus L.; Eucalyptus L'Hér.; Magnoliopsida; Vitis vinifera L.; Tracheophyta; Pinales; 
2007,2007-04-17,Viseu,Armamar,Coura,COURA,41.1163567,-7.6514048,Desconhecida,646.0,2007-04-17T15:00,20.8,41,7.1,19.0,0.0,0.0,0.0,0.0,1,1015.3,942.4,46,0,30,94,0.45,1.45,12.2,16.6,47,48,34.6,20.0,13.8,10.4,8.7,0.295,0.314,0.333,0.391,1,3600.0,629.2,407.3,221.8,574.2,629.2,963.7,675.0,437.0,238.0,574.2,675.0,1033.9,Magnoliopsida; Tracheophyta
2007,2007-04-17,Viseu,Armamar,Fontelo,FONTELO,41.12164225,-7.73064463699262,Desconhecida,560.0,2007-04-17T17:00,21.1,40,7.0,19.0,0.0,0.0,0.0,0.0,1,1014.6,951.1,25,0,20,42,0.27,1.5,9.4,13.5,40,42,29.2,19.6,14.8,10.8,8.9,0.269,0.291,0.318,0.386,1,3600.0,309.4,156.0,153.5,385.2,309.4,549.9,375.0,189.0,186.0,385.2,375.0,666.4,Magnoliopsida; Olea europaea L.; Vitis vinifera L.
2007,2007-11-03,Viseu,Sátão,Rio de Moinhos,RIO DE MOINHOS,40.7144192,-7.6975145,Desconhecida,525.0,2007-11-03T10:00,13.1,61,5.6,10.7,0.0,0.0,0.0,0.0,0,1025.1,963.2,0,0,0,0,0.18,0.59,8.9,12.1,58,60,23.8,12.1,11.3,15.0,18.6,0.125,0.205,0.228,0.318,1,3600.0,422.0,343.4,78.6,778.4,422.0,613.2,365.0,297.0,68.0,778.4,365.0,530.3,Tracheophyta; Pinus pinaster Aiton; Castanea sativa Mill.; Vitis vinifera L.; Magnoliopsida
2007,2007-11-03,Viseu,Castro Daire,Castro Daire,MEZIO,40.970313,-7.8889002,Desconhecida,878.0,2007-11-03T17:00,15.4,49,4.6,13.0,0.0,0.0,0.0,0.0,0,1020.9,921.0,0,0,0,0,0.08,0.9,7.5,10.2,55,58,15.5,15.0,11.5,12.9,16.2,0.167,0.205,0.215,0.318,1,3449.36,48.3,32.5,15.8,372.9,47.2,90.5,113.0,76.0,37.0,487.5,113.0,211.7,Magnoliopsida; Tracheophyta
2007,2007-11-03,Viseu,Tarouca,Várzea da Serra,VARZEA DA SERRA,40.997211,-7.82774,Desconhecida,899.0,2007-11-03T17:00,15.0,49,4.3,12.5,0.0,0.0,0.0,0.0,0,1020.8,918.6,0,0,0,0,0.08,0.88,7.9,11.7,43,45,15.5,14.7,11.3,12.8,16.1,0.179,0.2,0.204,0.319,1,3411.26,47.5,32.0,15.6,366.6,46.1,87.9,113.0,76.0,37.0,490.6,113.0,209.0,Magnoliopsida; Eucalyptus L'Hér.; Tracheophyta; Castanea sativa Mill.; Pinus pinaster Aiton; Pinales
2007,2007-11-03,Viseu,São João da Pesqueira,Ervedosa do Douro,Sarzedinho,41.1584373,-7.5228292,Desconhecida,168.0,2007-11-03T11:00,15.7,55,6.6,14.3,0.0,0.0,0.0,0.0,0,1025.3,1005.2,1,1,0,0,0.25,0.8,3.6,4.7,53,58,16.2,15.7,12.2,16.1,19.9,0.162,0.188,0.184,0.31,1,3600.0,518.8,434.7,84.1,837.1,518.8,721.8,481.0,403.0,78.0,837.1,481.0,669.2,Vitis vinifera L.; Pinus pinaster Aiton; Olea europaea L.; Magnoliopsida; Tracheophyta
2007,2007-10-28,Viseu,Resende,Felgueiras,MONTE S. CRISTOVAO (Casa do Monte),41.0758008,-7.9399513,Desconhecida,603.0,2007-10-28T15:00,17.0,41,3.7,14.7,0.0,0.0,0.0,0.0,1,1023.0,953.3,21,0,0,71,0.26,1.14,5.8,7.2,360,360,14.8,18.1,12.4,15.0,17.6,0.169,0.2,0.208,0.319,1,3600.0,388.7,300.1,88.6,742.7,388.7,559.9,443.0,342.0,101.0,742.7,443.0,638.2,Magnoliopsida; Pinales; Vitis vinifera L.; Pinus pinaster Aiton; Tracheophyta; ; Eucalyptus L'Hér.
2007,2007-11-04,Viseu,Vila Nova de Paiva,Pendilhe,PENDILHE,40.90815665,-7.833581151658001,Desconhecida,770.0,2007-11-04T20:00,10.6,70,5.4,8.1,0.0,0.0,0.0,0.0,0,1020.7,931.1,0,0,0,0,0.02,0.38,9.5,13.5,37,46,15.5,11.0,12.2,13.3,16.6,0.172,0.211,0.22,0.317,0,0.0,0.0,0.0,0.0,0.0,0.0,0.0,0.0,0.0,0.0,0.0,0.0,0.0,Magnoliopsida; Tracheophyta; Pinus pinaster Aiton; 
2007,2007-11-04,Viseu,Viseu,Bodiosa,BODIOSA A VELHA (BODIOSA),40.7014099,-7.9652845,Desconhecida,512.0,2007-11-04T06:00,6.4,86,4.2,3.6,0.0,0.0,0.0,0.0,0,1019.4,957.9,0,0,0,0,0.0,0.14,9.8,17.4,66,77,20.2,7.7,12.3,14.8,17.9,0.14,0.199,0.207,0.304,0,0.0,0.0,0.0,0.0,0.0,0.0,0.0,0.0,0.0,0.0,0.0,0.0,0.0,Magnoliopsida; Pinus pinaster Aiton; Eucalyptus L'Hér.
2007,2007-11-04,Viseu,Cinfães,Nespereira,LAMELAS (Lameira),40.9228804,-7.9403164,Desconhecida,713.0,2007-11-04T14:00,18.1,41,4.5,15.7,0.0,0.0,0.0,0.0,0,1019.3,938.2,0,0,0,0,0.31,1.24,7.6,9.7,65,68,22.3,17.6,11.4,13.3,16.7,0.168,0.213,0.224,0.318,1,3600.0,488.3,415.5,72.8,863.9,488.3,669.0,523.0,445.0,78.0,863.9,523.0,716.5,Magnoliopsida; Pinus pinaster Aiton; Tracheophyta; Quercus L.; Olea europaea L.
2007,2007-10-29,Viseu,Castro Daire,Reriz,POVOA DE VEADO,40.9037732,-7.992389600982436,Desconhecida,344.0,2007-10-29T15:00,19.3,62,11.7,18.0,0.0,0.0,0.0,0.0,1,1020.4,980.4,29,28,0,14,0.21,0.86,12.0,15.9,327,332,28.1,19.4,14.7,16.2,19.0,0.181,0.222,0.223,0.314,1,3600.0,258.7,96.5,162.2,239.6,258.7,558.4,295.0,110.0,185.0,239.6,295.0,636.7,Pinus pinaster Aiton; Pinales; Quercus L.; Castanea sativa Mill.; Magnoliopsida; Tracheophyta
2007,2007-11-05,Viseu,Cinfães,Fornelos,Lapa,41.0299252,-8.1962429,Desconhecida,580.0,2007-11-05T01:00,7.1,85,4.7,4.6,0.0,0.0,0.0,0.0,0,1021.8,952.5,0,0,0,0,0.0,0.15,8.3,12.6,88,87,19.8,8.8,12.9,14.3,17.4,0.168,0.202,0.217,0.323,0,0.0,0.0,0.0,0.0,0.0,0.0,0.0,0.0,0.0,0.0,0.0,0.0,0.0,Quercus L.; Eucalyptus L'Hér.; Magnoliopsida; Vitis vinifera L.; Tracheophyta; Pinales; 
2007,2007-09-21,Viseu,Mortágua,Sobral,Calvos,40.4803518,-8.2265245,Natural,368.0,2007-09-21T00:00,16.4,79,12.7,16.2,0.0,0.0,0.0,0.0,1,1017.4,974.3,24,0,0,80,0.0,0.4,6.6,13.0,68,44,13.3,18.5,21.7,21.3,19.3,0.149,0.138,0.191,0.309,0,0.0,0.0,0.0,0.0,0.0,0.0,0.0,0.0,0.0,0.0,0.0,0.0,0.0,Eucalyptus L'Hér.; Magnoliopsida
2007,2007-11-05,Viseu,Penalva do Castelo,Vila Cova Do Covelo,QTª DOS FERREIROS,40.6647585,-7.6050805,Desconhecida,550.0,2007-11-05T23:00,10.4,74,6.0,7.8,0.0,0.0,0.0,0.0,0,1026.3,960.9,0,0,0,0,0.02,0.32,11.0,20.3,58,67,21.2,9.7,13.2,14.6,18.3,0.109,0.192,0.216,0.307,0,0.0,0.0,0.0,0.0,0.0,0.0,0.0,0.0,0.0,0.0,0.0,0.0,0.0,Pinus pinaster Aiton; Magnoliopsida; Vitis vinifera L.; Tracheophyta; Olea europaea L.
2007,2007-04-18,Viseu,Mortágua,Mortágua,Barril,40.3995914,-8.2137609,Desconhecida,121.0,2007-04-18T11:00,21.9,46,9.7,21.7,0.0,0.0,0.0,0.0,0,1014.9,1000.8,0,0,0,0,0.5,1.42,10.0,13.2,69,73,23.8,20.5,15.6,13.5,11.7,0.284,0.319,0.341,0.387,1,3600.0,834.5,728.5,106.0,900.1,834.5,1098.8,787.0,687.0,100.0,900.1,787.0,1036.2,Eucalyptus L'Hér.; Magnoliopsida; Tracheophyta; Pinus pinaster Aiton
2007,2007-11-05,Viseu,Viseu,Couto de Cima,COUTO DE CIMA,40.6710607,-8.0023053,Desconhecida,401.0,2007-11-05T18:00,17.2,53,7.5,15.2,0.0,0.0,0.0,0.0,0,1023.5,976.5,0,0,0,0,0.06,0.92,8.8,12.5,55,57,16.9,16.9,15.0,15.5,18.5,0.134,0.195,0.206,0.303,0,0.0,0.0,0.0,0.0,0.0,0.0,0.0,6.0,2.0,4.0,30.0,6.0,32.3,Pinus pinaster Aiton; Magnoliopsida
2007,2007-11-03,Viseu,Armamar,Cimbres,CIMBRES,41.0500077,-7.700478139493693,Desconhecida,734.0,2007-11-03T17:00,15.5,48,4.4,13.0,0.0,0.0,0.0,0.0,0,1020.8,936.5,0,0,0,0,0.08,0.93,7.9,11.7,43,45,15.5,15.8,12.3,14.0,17.4,0.164,0.187,0.186,0.305,1,3380.44,46.8,31.5,15.3,361.2,45.2,85.7,113.0,76.0,37.0,492.9,113.0,207.0,Magnoliopsida; Vitis vinifera L.
2007,2007-11-05,Viseu,Cinfães,Nespereira,Pindelo,41.0028562,-8.161423008290381,Desconhecida,320.0,2007-11-05T00:00,8.3,86,6.1,6.4,0.0,0.0,0.0,0.0,0,1021.0,982.2,0,0,0,0,0.0,0.15,6.3,11.5,103,90,16.6,10.1,14.1,15.3,18.2,0.138,0.196,0.224,0.32,0,0.0,0.0,0.0,0.0,0.0,0.0,0.0,0.0,0.0,0.0,0.0,0.0,0.0,Magnoliopsida; Tracheophyta; Quercus L.; Eucalyptus L'Hér.
2007,2007-09-25,Viseu,Lamego,Avões,Avões de Lá,41.1242278,-7.834607,NC,701.0,2007-09-25T19:00,18.0,42,4.8,15.6,0.0,0.0,0.0,0.0,0,1018.1,938.3,11,0,0,38,0.08,1.21,7.9,15.5,3,12,20.5,19.9,19.6,18.8,17.6,0.164,0.152,0.187,0.326,0,0.0,0.0,0.0,0.0,0.0,0.0,0.0,5.0,2.0,3.0,29.0,5.0,34.5,Magnoliopsida; Vitis vinifera L.; Tracheophyta; Eucalyptus L'Hér.; Pinales; 
2007,2007-11-05,Viseu,Castro Daire,Castro Daire,Vale Abrigoso,40.9797887,-7.8669474,Desconhecida,992.0,2007-11-05T18:00,13.1,59,5.3,10.4,0.0,0.0,0.0,0.0,0,1024.7,911.5,0,0,0,0,0.06,0.62,10.4,16.1,46,50,15.1,12.9,11.2,12.0,15.3,0.162,0.202,0.215,0.317,0,0.0,0.0,0.0,0.0,0.0,0.0,0.0,4.0,1.0,3.0,15.5,4.0,29.1,Tracheophyta; Quercus L.; Magnoliopsida
2007,2007-04-18,Viseu,Mortágua,Mortágua,Barril,40.3995914,-8.2137609,Desconhecida,121.0,2007-04-18T14:00,23.9,37,8.3,24.4,0.0,0.0,0.0,0.0,0,1013.7,999.7,3,0,3,4,0.57,1.87,6.6,9.1,81,83,23.4,23.1,16.6,13.5,11.7,0.274,0.316,0.341,0.386,1,3600.0,829.1,718.0,111.1,880.2,829.1,1107.4,858.0,743.0,115.0,880.2,858.0,1146.0,Eucalyptus L'Hér.; Magnoliopsida; Tracheophyta; Pinus pinaster Aiton
2007,2007-11-03,Viseu,Viseu,Torredeita,Routar,40.6384356,-8.0242489,Desconhecida,437.0,2007-11-03T20:00,12.6,63,5.8,10.5,0.0,0.0,0.0,0.0,0,1020.4,968.7,0,0,0,0,0.02,0.54,7.6,12.8,65,68,16.2,13.6,14.9,15.6,18.6,0.128,0.194,0.203,0.302,0,0.0,0.0,0.0,0.0,0.0,0.0,0.0,0.0,0.0,0.0,0.0,0.0,0.0,Pinus pinaster Aiton; Tracheophyta; Magnoliopsida; Pinus pinea L.
2007,2007-11-05,Viseu,Vila Nova de Paiva,Pendilhe,PENDILHE,40.90815665,-7.833581151658001,Desconhecida,770.0,2007-11-05T22:00,8.5,82,5.6,5.9,0.0,0.0,0.0,0.0,0,1026.5,935.7,0,0,0,0,0.0,0.2,10.5,19.0,59,65,19.1,9.3,12.0,13.2,16.5,0.17,0.21,0.22,0.317,0,0.0,0.0,0.0,0.0,0.0,0.0,0.0,0.0,0.0,0.0,0.0,0.0,0.0,Magnoliopsida; Tracheophyta; Pinus pinaster Aiton; 
2007,2007-11-04,Viseu,Castro Daire,PEPIM,POVOA DE VEADO,40.892623,-7.9528172,Desconhecida,596.0,2007-11-04T03:00,7.3,81,4.2,4.6,0.0,0.0,0.0,0.0,0,1019.4,948.5,0,0,0,0,0.0,0.2,9.4,13.3,86,88,20.2,7.5,11.9,14.2,17.5,0.161,0.214,0.229,0.317,0,0.0,0.0,0.0,0.0,0.0,0.0,0.0,0.0,0.0,0.0,0.0,0.0,0.0,Magnoliopsida; Pinus pinaster Aiton; Tracheophyta
2007,2007-11-03,Viseu,Viseu,Bodiosa,Silgueiros,40.7133219,-8.0119651,Desconhecida,503.0,2007-11-03T22:00,9.3,78,5.6,7.0,0.0,0.0,0.0,0.0,0,1020.1,960.2,0,0,0,0,0.01,0.26,8.4,13.4,70,82,16.9,10.9,13.9,14.9,18.0,0.14,0.199,0.206,0.304,0,0.0,0.0,0.0,0.0,0.0,0.0,0.0,0.0,0.0,0.0,0.0,0.0,0.0,Eucalyptus L'Hér.; Pinus pinaster Aiton; Magnoliopsida; Tracheophyta; Olea europaea L.
2007,2007-11-04,Viseu,Castro Daire,Almofala,VAL ABRIGOSO,40.9541684,-7.7933527,Desconhecida,863.0,2007-11-04T08:00,4.4,91,3.0,1.7,0.0,0.0,0.0,0.0,0,1021.0,919.1,0,0,0,0,0.01,0.08,7.2,13.3,63,71,14.4,5.5,9.6,13.0,16.3,0.18,0.2,0.204,0.319,1,1584.25,100.2,61.0,39.2,406.8,61.8,208.5,46.0,28.0,18.0,250.9,46.0,95.7,Tracheophyta; Castanea sativa Mill.; Magnoliopsida; Pinus pinaster Aiton
2007,2007-11-06,Viseu,Viseu,Bodiosa,Oliveira de Cima,40.7250638,-7.9729336,Desconhecida,516.0,2007-11-06T13:00,17.7,32,0.6,13.3,0.0,0.0,0.0,0.0,0,1026.7,966.7,0,0,0,0,0.37,1.39,17.1,23.5,68,69,41.8,17.7,13.2,14.7,17.8,0.133,0.194,0.206,0.303,1,3600.0,565.2,485.7,79.5,907.3,565.2,745.3,576.0,495.0,81.0,907.3,576.0,759.5,Tracheophyta; Pinus pinaster Aiton; Olea europaea L.; Magnoliopsida
2007,2007-11-04,Viseu,Castro Daire,PEPIM,POVOA DE VEADO,40.892623,-7.9528172,Desconhecida,596.0,2007-11-04T08:00,5.9,89,4.2,3.3,0.0,0.0,0.0,0.0,0,1020.4,949.1,0,0,0,0,0.01,0.1,8.3,15.5,88,87,20.5,6.8,10.9,14.1,17.5,0.161,0.214,0.229,0.317,1,1566.31,89.3,52.3,37.0,350.6,55.0,207.4,41.0,24.0,17.0,215.8,41.0,95.2,Magnoliopsida; Pinus pinaster Aiton; Tracheophyta
2007,2007-11-05,Viseu,Castro Daire,PEPIM,POVOA DO VEADO,40.892623,-7.9528172,Desconhecida,596.0,2007-11-05T18:00,15.5,59,7.5,13.6,0.0,0.0,0.0,0.0,0,1024.3,955.0,0,0,0,0,0.05,0.73,8.7,11.6,73,74,17.6,15.1,13.4,14.0,17.4,0.154,0.21,0.228,0.316,0,0.0,0.0,0.0,0.0,0.0,0.0,0.0,5.0,2.0,3.0,30.6,5.0,30.4,Magnoliopsida; Pinus pinaster Aiton; Tracheophyta
2007,2007-11-06,Viseu,Castro Daire,Picão,PICAO,40.94945435,-7.9502382410308865,Desconhecida,923.0,2007-11-06T16:00,15.8,34,0.1,11.9,0.0,0.0,0.0,0.0,0,1026.4,921.3,0,0,0,0,0.19,1.18,11.9,18.1,65,67,34.9,15.3,11.0,12.4,15.7,0.159,0.2,0.215,0.317,1,3600.0,207.6,162.4,45.1,725.0,207.6,311.9,276.0,216.0,60.0,725.0,276.0,414.8,Quercus L.; Magnoliopsida; Tracheophyta; Castanea sativa Mill.
2007,2007-11-06,Viseu,Castro Daire,CASTRO DAIRE,Codeçais,40.91465745,-7.920020147736607,Desconhecida,660.0,2007-11-06T21:00,9.9,54,1.0,6.5,0.0,0.0,0.0,0.0,0,1027.7,949.6,0,0,0,0,0.04,0.57,10.1,22.8,88,84,32.4,10.1,12.2,13.5,16.9,0.16,0.208,0.224,0.317,0,0.0,0.0,0.0,0.0,0.0,0.0,0.0,0.0,0.0,0.0,0.0,0.0,0.0,Pinus pinaster Aiton; Magnoliopsida; Pinales; Eucalyptus L'Hér.; Tracheophyta
