2007,2007-11-10,Viseu,Castro Daire,Castro Daire,Mosteiro,40.8927088,-7.9244712,Desconhecida,569.0,2007-11-10T19:00,10.3,49,0.2,7.0,0.0,0.0,0.0,0.0,0,1025.8,958.2,0,0,0,0,0.04,0.64,8.6,15.9,88,85,25.9,11.0,11.9,13.5,17.0,0.142,0.199,0.22,0.31,0,0.0,0.0,0.0,0.0,0.0,0.0,0.0,0.0,0.0,0.0,0.0,0.0,0.0,Magnoliopsida; Pinus pinaster Aiton; Tracheophyta; Castanea sativa Mill.; Quercus L.; Olea europaea L.
2007,2007-11-10,Viseu,Cinfães,Oliveira Do Douro,Montão,41.0810992,-8.0489872,Desconhecida,356.0,2007-11-10T13:00,15.4,36,0.3,11.4,0.0,0.0,0.0,0.0,0,1024.7,982.6,1,0,0,4,0.32,1.13,13.7,18.8,87,87,36.7,16.0,11.9,14.0,17.3,0.115,0.176,0.218,0.316,1,3600.0,539.0,459.5,79.5,894.1,539.0,716.9,549.0,468.0,81.0,894.1,549.0,730.1,Pinus pinaster Aiton; Magnoliopsida; Quercus L.; Tracheophyta; 
2007,2007-11-10,Viseu,Resende,Felgueiras,SÃO CRISTOVÃO (São Cristóvão),41.0758008,-7.9399513,Desconhecida,603.0,2007-11-10T21:00,7.6,63,0.9,4.4,0.0,0.0,0.0,0.0,0,1025.9,953.8,0,0,0,0,0.02,0.39,8.3,16.6,88,86,23.8,8.4,11.7,13.4,16.9,0.139,0.182,0.208,0.316,0,0.0,0.0,0.0,0.0,0.0,0.0,0.0,0.0,0.0,0.0,0.0,0.0,0.0,Magnoliopsida; Pinales; Vitis vinifera L.; Pinus pinaster Aiton; Tracheophyta; ; Eucalyptus L'Hér.
2007,2007-10-17,Viseu,Cinfães,Travanca,TRAVANCA,41.04154195,-8.223751669837242,Desconhecida,210.0,2007-10-17T14:00,22.4,42,8.8,20.9,0.0,0.0,0.0,0.0,0,1020.7,996.3,0,0,0,0,0.41,1.58,11.1,13.5,331,335,27.4,23.0,17.1,17.8,19.1,0.182,0.222,0.225,0.325,1,3600.0,576.7,499.3,77.4,879.3,576.7,782.2,611.0,529.0,82.0,879.3,611.0,828.7,Pinus pinaster Aiton; Magnoliopsida; Tracheophyta; Eucalyptus L'Hér.; Vitis vinifera L.; Quercus L.; 
2007,2007-11-09,Viseu,Lamego,Penude,SERRA DAS MEADAS,41.1031059,-7.843507279056028,Desconhecida,992.0,2007-11-09T18:00,10.6,51,0.7,6.5,0.0,0.0,0.0,0.0,3,1025.7,911.4,86,0,95,97,0.08,0.63,14.2,26.7,60,63,32.4,10.8,10.4,11.7,15.1,0.154,0.196,0.215,0.317,0,0.0,0.0,0.0,0.0,0.0,0.0,0.0,1.0,0.0,1.0,0.0,1.0,20.0,Vitis vinifera L.; Magnoliopsida; Tracheophyta; Pinales; ; Eucalyptus L'Hér.
2007,2007-11-09,Viseu,São João da Pesqueira,São João da Pesqueira,MONTE NEGRO,41.14216785,-7.413788551003492,Desconhecida,649.0,2007-11-09T21:00,9.4,63,2.6,6.4,0.0,0.0,0.0,0.0,1,1027.8,950.8,29,0,1,95,0.03,0.44,9.3,24.1,77,81,31.0,9.6,11.4,13.2,17.2,0.129,0.179,0.182,0.293,0,0.0,0.0,0.0,0.0,0.0,0.0,0.0,0.0,0.0,0.0,0.0,0.0,0.0,Magnoliopsida; Vitis vinifera L.; Olea europaea L.; Tracheophyta
2007,2007-10-18,Viseu,Cinfães,Travanca,GATAO (TRAVANCA),41.04154195,-8.223751669837242,NC,210.0,2007-10-18T14:00,23.6,46,11.4,23.0,0.0,0.0,0.0,0.0,0,1020.6,996.3,11,0,0,36,0.4,1.56,8.7,11.7,97,101,24.8,22.6,16.8,17.7,19.0,0.175,0.219,0.225,0.324,1,3600.0,563.2,481.1,82.1,854.9,563.2,775.6,597.0,510.0,87.0,854.9,597.0,822.1,Pinus pinaster Aiton; Magnoliopsida; Tracheophyta; Eucalyptus L'Hér.; Vitis vinifera L.; Quercus L.; 
2007,2007-11-11,Viseu,Cinfães,Moimenta,Gojo,41.0506317,-8.1944478,Desconhecida,422.0,2007-11-11T03:00,4.0,78,0.4,0.6,0.0,0.0,0.0,0.0,0,1025.1,973.4,15,0,0,51,0.01,0.18,9.1,18.8,99,94,22.7,5.9,11.5,14.2,17.5,0.144,0.175,0.201,0.319,0,0.0,0.0,0.0,0.0,0.0,0.0,0.0,0.0,0.0,0.0,0.0,0.0,0.0,Magnoliopsida; Eucalyptus L'Hér.; Tracheophyta; Pinus pinaster Aiton; Castanea sativa Mill.; Quercus L.; 
2007,2007-11-11,Viseu,Moimenta da Beira,Peva,São Martinho,40.8861707,-7.6948785,Desconhecida,831.0,2007-11-11T09:00,4.9,68,-0.6,1.6,0.0,0.0,0.0,0.0,1,1027.7,928.9,28,0,0,92,0.06,0.28,7.1,12.9,60,63,16.9,5.1,8.4,12.5,16.0,0.161,0.188,0.2,0.312,1,3600.0,217.9,120.6,97.3,429.0,217.9,392.2,159.0,88.0,71.0,429.0,159.0,286.2,Eucalyptus L'Hér.; Pinus pinaster Aiton; Quercus L.; Magnoliopsida; Tracheophyta; Castanea sativa Mill.
