year,date,district,municipality,parish,local,latitude,longitude,cause,elevation,hourly.time,hourly.temperature_2m,hourly.relative_humidity_2m,hourly.dew_point_2m,hourly.apparent_temperature,hourly.precipitation,hourly.rain,hourly.snowfall,hourly.snow_depth,hourly.weather_code,hourly.pressure_msl,hourly.surface_pressure,hourly.cloud_cover,hourly.cloud_cover_low,hourly.cloud_cover_mid,hourly.cloud_cover_high,hourly.et0_fao_evapotranspiration,hourly.vapour_pressure_deficit,hourly.wind_speed_10m,hourly.wind_speed_100m,hourly.wind_direction_10m,hourly.wind_direction_100m,hourly.wind_gusts_10m,hourly.soil_temperature_0_to_7cm,hourly.soil_temperature_7_to_28cm,hourly.soil_temperature_28_to_100cm,hourly.soil_temperature_100_to_255cm,hourly.soil_moisture_0_to_7cm,hourly.soil_moisture_7_to_28cm,hourly.soil_moisture_28_to_100cm,hourly.soil_moisture_100_to_255cm,hourly.is_day,hourly.sunshine_duration,hourly.shortwave_radiation_instant,hourly.direct_radiation_instant,hourly.diffuse_radiation_instant,hourly.direct_normal_irradiance_instant,hourly.global_tilted_irradiance_instant,hourly.terrestrial_radiation_instant,hourly.shortwave_radiation,hourly.direct_radiation,hourly.diffuse_radiation,hourly.direct_normal_irradiance,hourly.global_tilted_irradiance,hourly.terrestrial_radiation,scientificNames
2008,2008-03-24,Setúbal,Seixal,Corroios,R DAS AZINHEIRAS- ALTO MOINHO (CORROIOS),38.6364997,-9.1517196,NC,18.0,2008-03-24T17:00,13.8,61,6.3,9.1,0.0,0.0,0.0,0.0,2,1020.0,1017.8,75,83,0,0,0.17,0.62,26.2,34.2,351,352,44.6,14.7,13.4,13.9,14.7,0.181,0.203,0.205,0.192,1,3600.0,197.6,77.9,119.7,217.7,197.6,492.7,246.0,97.0,149.0,217.7,246.0,613.4,Tracheophyta; Pinus pinea L.
2008,2008-10-28,Setúbal,Sesimbra,Sesimbra (castelo),ESTRADA DAS PEDREIRAS (Castelo),38.4749148,-9.1111472,NC,105.0,2008-10-28T14:00,14.9,46,3.5,7.9,0.0,0.0,0.0,0.0,0,1012.3,999.8,10,8,4,0,0.33,0.91,39.1,55.0,350,351,73.8,19.1,17.7,19.5,20.9,0.072,0.075,0.112,0.176,1,3600.0,560.3,470.9,89.5,860.6,560.3,758.5,595.0,500.0,95.0,860.6,595.0,805.4,Pinus pinea L.; Magnoliopsida; Tracheophyta; Vitis vinifera L.; Pinus pinaster Aiton
2008,2008-10-25,Setúbal,Alcácer do Sal,Torrão,ESTRADA TORRAO/ALCACER (TORRÃO),38.3020606,-8.2305314,NC,92.0,2008-10-25T11:00,20.8,46,8.8,18.2,0.0,0.0,0.0,0.0,0,1025.2,1014.3,0,0,0,0,0.36,1.32,15.4,21.6,53,53,35.6,19.8,17.6,19.7,21.7,0.265,0.248,0.214,0.272,1,3600.0,592.2,499.8,92.4,844.1,592.2,819.4,551.0,465.0,86.0,844.1,551.0,762.4,Tracheophyta; Quercus suber L.; Pinus pinea L.; Quercus rotundifolia Lam.; Magnoliopsida; Eucalyptus L'Hér.; Oryza sativa L.; Olea europaea L.; Pinus pinaster Aiton; Vitis vinifera L.; Quercus L.; 
2008,2008-10-25,Setúbal,Palmela,Pinhal Novo,ESTRADA DOS ESPANHOIS (Estrada dos Espanhóis),38.630096,-8.9128319,NC,39.0,2008-10-25T21:00,18.4,50,7.9,15.9,0.0,0.0,0.0,0.0,0,1025.9,1021.2,0,0,0,0,0.08,1.05,13.3,27.8,13,19,25.2,18.2,19.1,19.9,20.9,0.106,0.073,0.063,0.134,0,0.0,0.0,0.0,0.0,0.0,0.0,0.0,0.0,0.0,0.0,0.0,0.0,0.0,Vitis vinifera L.; Magnoliopsida; Olea europaea L.; Tracheophyta
2008,2008-10-07,Setúbal,Grândola,Carvalhal,JT A ROTUNDA DO CARVALHAL (Carvalhal),38.3057634,-8.780952372059236,NC,0.0,2008-10-07T11:00,19.9,81,16.4,19.1,0.0,0.0,0.0,0.0,2,1021.3,1021.3,76,30,62,41,0.22,0.45,20.4,27.8,229,233,30.2,20.2,19.3,21.1,21.6,0.102,0.068,0.08,0.174,1,3600.0,409.1,266.6,142.4,398.6,409.1,916.5,382.0,249.0,133.0,398.6,382.0,855.9,Tracheophyta; Pinus pinaster Aiton; Magnoliopsida; Oryza sativa L.
2008,2008-09-13,Setúbal,Montijo,Pegões,JT VIVEIROS - Sº ISIDRO (Pegões),38.68008015,-8.591171494214755,NC,114.0,2008-09-13T22:00,18.9,54,9.5,16.8,0.0,0.0,0.0,0.0,0,1018.0,1004.5,0,0,0,0,0.08,1.0,13.8,26.7,354,357,28.1,20.4,22.8,22.4,21.5,0.052,0.061,0.08,0.136,0,0.0,0.0,0.0,0.0,0.0,0.0,0.0,0.0,0.0,0.0,0.0,0.0,0.0,Pinus pinaster Aiton; Vitis vinifera L.; Pinus pinea L.; Tracheophyta; Quercus suber L.; Eucalyptus L'Hér.; Magnoliopsida; Olea europaea L.; Pinales; 
2008,2008-10-27,Setúbal,Santiago do Cacém,Abela,OUTEIRO DO LOBO,38.0088476,-8.5352123,NC,158.0,2008-10-27T10:00,18.7,57,10.1,17.8,0.0,0.0,0.0,0.0,0,1019.6,1000.9,2,0,0,5,0.24,0.92,6.6,8.7,351,353,16.9,19.5,16.9,18.9,21.3,0.101,0.146,0.122,0.164,1,3600.0,470.8,384.7,86.1,778.1,470.8,685.0,410.0,335.0,75.0,778.1,410.0,596.5,Quercus suber L.; Tracheophyta; Eucalyptus L'Hér.; Magnoliopsida; Olea europaea L.; Pinus pinea L.; Quercus rotundifolia Lam.; 
2008,2008-09-28,Setúbal,Alcácer do Sal,Torrão,EN 2 (TORRÃO),38.3020606,-8.2305314,NC,92.0,2008-09-28T19:00,17.0,92,15.7,16.7,0.8,0.8,0.0,0.0,53,1015.9,1005.0,100,68,61,100,0.03,0.16,15.6,28.2,75,80,30.6,18.4,20.2,22.2,22.3,0.358,0.202,0.216,0.274,0,0.0,0.0,0.0,0.0,0.0,0.0,0.0,1.0,0.0,1.0,0.0,1.0,27.0,Tracheophyta; Quercus suber L.; Pinus pinea L.; Quercus rotundifolia Lam.; Magnoliopsida; Eucalyptus L'Hér.; Oryza sativa L.; Olea europaea L.; Pinus pinaster Aiton; Vitis vinifera L.; Quercus L.; 
2008,2008-03-20,Setúbal,Seixal,Corroios,PARQUE INDUSTRIAL DE SANTA MARTA (Parque Verde),38.6489003,-9.141370443233445,NC,6.0,2008-03-20T15:00,17.1,48,6.1,13.3,0.0,0.0,0.0,0.0,2,1012.9,1012.2,62,59,15,0,0.39,1.01,24.0,31.3,50,52,42.1,17.9,14.0,14.5,15.0,0.227,0.203,0.193,0.183,1,3600.0,644.9,553.8,91.1,852.9,644.9,895.9,694.0,596.0,98.0,852.9,694.0,964.1,Tracheophyta; Pinus pinaster Aiton; Magnoliopsida
2008,2008-10-08,Setúbal,Grândola,Grândola,ZONA BRR NOVO CADOÇOS (GRÂNDOLA),38.1817962,-8.5544675,NC,91.0,2008-10-08T21:00,15.9,75,11.5,13.9,0.0,0.0,0.0,0.0,0,1022.1,1011.2,2,0,0,7,0.04,0.45,17.0,29.5,343,344,34.9,16.7,19.0,20.5,21.8,0.104,0.101,0.095,0.148,0,0.0,0.0,0.0,0.0,0.0,0.0,0.0,0.0,0.0,0.0,0.0,0.0,0.0,Quercus suber L.; Tracheophyta; Magnoliopsida; Olea europaea L.
2008,2008-10-11,Setúbal,Setúbal,Setúbal (são Julião),QT QUADRADO- VARZEA (São Julião),38.5279518,-8.894774306731911,NC,6.0,2008-10-11T13:00,24.7,57,15.6,24.0,0.0,0.0,0.0,0.0,2,1013.5,1012.8,53,22,16,79,0.42,1.34,19.1,26.3,89,90,40.0,25.3,21.2,20.9,21.4,0.157,0.062,0.063,0.134,1,3600.0,589.3,448.9,140.4,654.1,589.3,942.4,596.0,454.0,142.0,654.1,596.0,953.1,Tracheophyta; Magnoliopsida
2008,2008-03-15,Setúbal,Montijo,Canha,ALPENDURADAS,38.7268064,-8.620711059891935,NC,76.0,2008-03-15T16:00,17.7,49,6.8,14.6,0.0,0.0,0.0,0.0,0,1019.6,1010.5,14,15,0,0,0.31,1.03,15.9,20.9,298,299,33.8,20.8,16.2,14.1,14.5,0.094,0.152,0.133,0.157,1,3600.0,444.5,336.2,108.3,686.4,444.5,677.5,509.0,385.0,124.0,686.4,509.0,775.9,Quercus suber L.; Eucalyptus L'Hér.; Pinus pinea L.; Tracheophyta; Vitis vinifera L.; Magnoliopsida; Pinus pinaster Aiton; Olea europaea L.; 
2008,2008-10-16,Setúbal,Santiago do Cacém,Alvalade,Atalaia,37.9381865,-8.3926221,NC,68.0,2008-10-16T21:00,17.7,92,16.3,18.2,0.0,0.0,0.0,0.0,0,1021.7,1013.6,1,1,0,0,0.0,0.17,11.5,22.7,314,319,21.2,18.6,20.2,19.9,21.2,0.166,0.159,0.076,0.119,0,0.0,0.0,0.0,0.0,0.0,0.0,0.0,0.0,0.0,0.0,0.0,0.0,0.0,Olea europaea L.; Tracheophyta; Quercus suber L.; Quercus rotundifolia Lam.; Pinus pinea L.; Eucalyptus L'Hér.; Oryza sativa L.; Magnoliopsida; Vitis vinifera L.; 
2008,2008-10-02,Setúbal,Palmela,Pinhal Novo,ACEIRO DO BOCAGE- ARRAIADOS (Aceiro dos Caramelos),38.630096,-8.9128319,NC,39.0,2008-10-02T13:00,22.7,43,9.5,20.4,0.0,0.0,0.0,0.0,0,1017.4,1012.8,0,0,0,0,0.51,1.56,21.7,28.9,345,346,43.9,26.1,20.5,21.6,21.1,0.115,0.063,0.064,0.136,1,3600.0,761.0,661.9,99.1,908.7,761.0,995.2,768.0,668.0,100.0,908.7,768.0,1004.3,Vitis vinifera L.; Magnoliopsida; Olea europaea L.; Tracheophyta
2008,2008-11-30,Setúbal,Seixal,Aldeia de Paio Pires,Foros da Catrapona,38.589562,-9.0784934,NC,36.0,2008-11-30T13:00,11.3,59,3.6,6.9,0.0,0.0,0.0,0.0,1,1010.0,1005.6,47,24,38,8,0.2,0.55,19.8,26.8,303,303,43.6,12.3,11.2,15.1,19.3,0.23,0.132,0.092,0.166,1,3600.0,387.1,279.4,107.6,574.1,387.1,684.6,392.0,283.0,109.0,574.1,392.0,693.4,Tracheophyta; Magnoliopsida; Pinus pinaster Aiton; Pinus pinea L.; Eucalyptus L'Hér.
2008,2008-11-17,Setúbal,Sesimbra,Sesimbra (castelo),JT ESCOLA SAMPAIO (Castelo),38.4749148,-9.1111472,NC,105.0,2008-11-17T09:00,10.9,77,7.1,8.7,0.0,0.0,0.0,0.0,0,1028.8,1015.9,0,0,0,0,0.07,0.3,10.2,18.5,48,57,20.2,10.7,13.2,16.4,19.9,0.082,0.091,0.11,0.174,1,3600.0,217.7,153.7,64.0,574.0,217.7,374.7,153.0,108.0,45.0,574.0,153.0,263.4,Pinus pinea L.; Magnoliopsida; Tracheophyta; Vitis vinifera L.; Pinus pinaster Aiton
2008,2008-09-20,Setúbal,Almada,Sobreda,QT MEDRONHEIROS (Quinta dos Cavalheiros),38.65228755,-9.181922406517888,NC,63.0,2008-09-20T01:00,20.3,84,17.4,22.4,0.0,0.0,0.0,0.0,0,1018.0,1010.6,12,0,11,17,0.0,0.39,3.8,5.4,17,4,10.1,20.7,22.3,21.1,20.8,0.158,0.162,0.202,0.278,0,0.0,0.0,0.0,0.0,0.0,0.0,0.0,0.0,0.0,0.0,0.0,0.0,0.0,Tracheophyta; Magnoliopsida
2008,2008-10-02,Setúbal,Barreiro,Coina,ESTRADA JT TIBA (COINA),38.5846313,-9.0515846,NC,25.0,2008-10-02T18:00,17.6,62,10.2,14.2,0.0,0.0,0.0,0.0,0,1017.0,1014.0,1,0,0,4,0.12,0.76,23.4,33.7,337,340,43.2,20.7,21.1,21.6,21.5,0.112,0.07,0.096,0.17,1,3078.07,30.5,20.0,10.6,228.9,27.7,59.2,101.0,66.0,35.0,418.5,101.0,195.7,Magnoliopsida; Eucalyptus L'Hér.; Pinus pinaster Aiton; Pinus pinea L.; Tracheophyta; Quercus suber L.; Pinales; 
2008,2008-11-17,Setúbal,Palmela,Palmela,S. PAULO- JT CONVENTO (PALMELA),38.5760455,-8.865312259667704,NC,43.0,2008-11-17T17:00,18.5,47,6.9,16.4,0.0,0.0,0.0,0.0,0,1025.4,1020.3,0,0,0,0,0.1,1.14,9.0,17.1,2,15,18.7,17.8,14.5,16.2,20.1,0.11,0.102,0.063,0.134,1,3125.38,36.6,24.0,12.6,275.7,33.7,68.4,102.0,67.0,35.0,453.5,102.0,190.8,Vitis vinifera L.; ; Magnoliopsida; Quercus suber L.; Tracheophyta; Pinus pinea L.; Quercus rotundifolia Lam.
2008,2008-09-19,Setúbal,Montijo,Montijo,R POCINHO DAS NASCENTES (Rua do Pocinho das Nascentes),38.7060845,-8.9746372,NC,6.0,2008-09-19T14:00,27.4,47,15.1,29.4,0.0,0.0,0.0,0.0,1,1018.0,1017.3,37,0,25,73,0.53,1.94,6.6,8.4,158,149,16.6,29.9,23.3,23.3,22.8,0.188,0.189,0.197,0.236,1,3600.0,712.0,587.3,124.7,800.9,712.0,994.4,742.0,612.0,130.0,800.9,742.0,1036.3,Tracheophyta
2008,2008-09-25,Setúbal,Montijo,Santo Isidro de Pegões,FOROS DO TRAPO,38.6854393,-8.6649901,NC,58.0,2008-09-25T00:00,16.6,87,14.4,17.1,0.0,0.0,0.0,0.0,0,1017.8,1010.9,6,1,9,0,0.0,0.25,6.4,15.6,317,331,11.2,17.5,21.6,22.0,21.0,0.085,0.06,0.062,0.124,0,0.0,0.0,0.0,0.0,0.0,0.0,0.0,0.0,0.0,0.0,0.0,0.0,0.0,Tracheophyta; Olea europaea L.; Quercus suber L.; Eucalyptus L'Hér.; Magnoliopsida
2008,2008-10-26,Setúbal,Grândola,Grândola,PONTES (Ponto Carro),38.1817962,-8.5544675,NC,91.0,2008-10-26T10:00,20.2,51,9.9,18.1,0.0,0.0,0.0,0.0,0,1024.5,1013.7,0,0,0,0,0.27,1.15,14.3,20.4,45,49,29.9,19.9,17.6,19.6,21.4,0.1,0.096,0.093,0.147,1,3600.0,468.0,380.8,87.2,766.5,468.0,688.0,408.0,332.0,76.0,766.5,408.0,599.8,Quercus suber L.; Tracheophyta; Magnoliopsida; Olea europaea L.
2008,2008-09-30,Setúbal,Palmela,Quinta do Anjo,JT CEMITERIO QT ANJO (QUINTA DO ANJO),38.5803261,-8.980884492896589,NC,46.0,2008-09-30T22:00,18.6,72,13.5,17.7,0.0,0.0,0.0,0.0,0,1017.8,1012.3,0,0,0,0,0.04,0.59,13.8,24.6,351,355,21.2,19.7,22.4,21.5,21.0,0.128,0.064,0.078,0.143,0,0.0,0.0,0.0,0.0,0.0,0.0,0.0,0.0,0.0,0.0,0.0,0.0,0.0,Vitis vinifera L.; Tracheophyta; Eucalyptus L'Hér.; Magnoliopsida; Pinus pinaster Aiton; Quercus suber L.
2008,2008-11-15,Setúbal,Sesimbra,Sesimbra (castelo),CASAL DAS FIGUEIRAS JT FABRICA TIJOLO (Casal),38.4738169,-9.1110771,NC,109.0,2008-11-15T15:00,16.9,39,2.9,13.3,0.0,0.0,0.0,0.0,0,1023.5,1010.5,0,0,0,0,0.27,1.17,13.0,17.4,62,63,28.1,19.2,14.3,16.6,20.0,0.092,0.091,0.11,0.175,1,3600.0,368.4,303.1,65.3,815.4,368.4,519.8,423.0,348.0,75.0,815.4,423.0,596.9,Pinus pinea L.; Magnoliopsida; Tracheophyta; Vitis vinifera L.; Pinus pinaster Aiton
2008,2008-10-28,Setúbal,Setúbal,Setúbal (são Sebastião),RUA DO PINTACILGOS (Rua do Pote D´Água),38.5275114,-8.8686103,NC,41.0,2008-10-28T11:00,14.7,50,4.3,7.8,0.0,0.0,0.0,0.0,0,1012.6,1007.7,7,8,0,0,0.29,0.84,37.9,50.4,346,346,65.2,17.2,17.7,19.8,20.9,0.106,0.071,0.063,0.134,1,3600.0,545.9,425.1,120.8,742.9,545.9,793.2,506.0,394.0,112.0,742.9,506.0,735.2,Tracheophyta; Magnoliopsida
2008,2008-05-07,Setúbal,Barreiro,Verderena,JUNTO ESCOLA QT NOVA DA TELHA (VERDERENA),38.6522841,-9.0776394,NC,3.0,2008-05-07T12:00,21.5,54,11.8,20.3,0.0,0.0,0.0,0.0,1,1010.8,1010.4,36,0,53,13,0.35,1.19,12.5,16.4,342,345,21.2,22.0,19.8,19.0,17.9,0.214,0.24,0.26,0.245,1,3600.0,506.2,250.0,256.2,271.2,506.2,1238.8,494.0,244.0,250.0,271.2,494.0,1208.8,Tracheophyta; 
2008,2008-04-06,Setúbal,Sesimbra,Sesimbra (castelo),ZAMBUJAL JT RIBEIRO (Cooperativa Zambujalense),38.49240215,-9.11796389134298,NC,63.0,2008-04-06T19:00,15.9,91,14.3,15.5,0.0,0.0,0.0,0.0,1,1005.7,998.2,44,21,0,84,0.03,0.17,12.0,18.7,237,240,21.6,19.6,18.8,16.2,14.9,0.062,0.151,0.196,0.19,1,2352.4,1.4,0.7,0.7,7.9,1.0,3.1,64.0,32.0,32.0,230.2,64.0,141.8,Magnoliopsida; Quercus rotundifolia Lam.; Pinus pinaster Aiton; Tracheophyta
2008,2008-10-02,Setúbal,Seixal,Fernão Ferro,FERNAO FERRO (Fernão Ferro),38.5640057,-9.094534,NC,69.0,2008-10-02T23:00,15.4,70,9.8,11.8,0.0,0.0,0.0,0.0,0,1019.2,1010.9,0,0,0,0,0.07,0.53,24.2,40.0,357,357,46.4,16.6,20.2,21.3,21.2,0.112,0.07,0.096,0.17,0,0.0,0.0,0.0,0.0,0.0,0.0,0.0,0.0,0.0,0.0,0.0,0.0,0.0,Tracheophyta; Pinus pinaster Aiton; Magnoliopsida
2008,2008-10-04,Setúbal,Palmela,Quinta do Anjo,Areias,38.5674568,-8.9418673,NC,95.0,2008-10-04T22:00,16.5,51,6.4,13.8,0.0,0.0,0.0,0.0,0,1020.7,1009.3,15,0,0,51,0.07,0.92,12.6,25.2,357,3,23.0,17.2,19.8,20.9,20.7,0.091,0.063,0.064,0.135,0,0.0,0.0,0.0,0.0,0.0,0.0,0.0,0.0,0.0,0.0,0.0,0.0,0.0,Vitis vinifera L.; Tracheophyta; Olea europaea L.; Quercus suber L.
2008,2008-10-08,Setúbal,Almada,Sobreda,CASAL DE Sº ANTº JT PISTA - VALE FIGUEIRA (Casal),38.63788675,-9.198846076961642,NC,79.0,2008-10-08T18:00,17.5,72,12.4,15.3,0.0,0.0,0.0,0.0,0,1022.4,1013.0,9,3,10,0,0.08,0.56,20.3,29.0,335,337,37.1,19.4,19.0,20.2,20.8,0.126,0.069,0.103,0.18,1,2550.48,9.1,5.5,3.6,63.7,7.3,19.2,74.0,45.0,29.0,315.8,74.0,155.8,Magnoliopsida; Tracheophyta; Pinus pinaster Aiton
2008,2008-10-29,Setúbal,Almada,Laranjeiro,JT ESCOLA ANTº JUDIÃO (LARANJEIRO),38.6599617,-9.149709242126466,NC,49.0,2008-10-29T14:00,15.5,49,4.9,9.9,0.0,0.0,0.0,0.0,1,1018.3,1012.4,28,10,32,0,0.31,0.9,30.1,38.5,345,346,51.5,17.0,15.6,17.1,18.1,0.262,0.284,0.301,0.329,1,3600.0,520.5,425.5,95.1,786.6,520.5,750.3,553.0,452.0,101.0,786.6,553.0,797.1,Magnoliopsida; Pinus pinea L.; Tracheophyta; Pinus pinaster Aiton
2008,2008-10-09,Setúbal,Sines,Sines,QT DOS PEGOS (SINES),37.9574843,-8.812298931051298,NC,40.0,2008-10-09T22:00,18.3,48,7.0,14.4,0.0,0.0,0.0,0.0,0,1020.1,1015.3,0,0,0,0,0.13,1.1,21.7,36.4,27,30,32.4,17.7,19.6,20.2,21.5,0.108,0.137,0.111,0.174,0,0.0,0.0,0.0,0.0,0.0,0.0,0.0,0.0,0.0,0.0,0.0,0.0,0.0,Tracheophyta; Pinus pinea L.; Pinus pinaster Aiton; Magnoliopsida
2008,2008-10-29,Setúbal,Santiago do Cacém,Santo André,LAGOA STºANDRE (Alagoa),38.065594950000005,-8.778572225777431,NC,27.0,2008-10-29T20:00,12.4,64,5.8,7.6,0.0,0.0,0.0,,0,1019.1,1015.8,2,2,0,0,0.07,0.52,25.3,36.5,345,345,43.6,13.8,16.0,18.1,19.9,0.067,0.079,0.083,0.126,0,0.0,0.0,0.0,0.0,0.0,0.0,0.0,0.0,0.0,0.0,0.0,0.0,0.0,Pinus pinea L.; Pinus pinaster Aiton; Magnoliopsida; Quercus suber L.; Tracheophyta; Oryza sativa L.; Eucalyptus L'Hér.; Vitis vinifera L.; 
2008,2008-03-05,Setúbal,Almada,Charneca De Caparica,HERDADE DA AROEIRA (CHARNECA DA CAPARICA),38.6240928,-9.195750238809074,NC,76.0,2008-03-05T00:00,11.0,38,-2.7,4.8,0.0,0.0,0.0,0.0,0,1027.1,1017.8,0,0,0,0,0.13,0.81,25.6,42.2,52,53,48.6,11.7,14.3,14.4,14.5,0.194,0.221,0.218,0.191,0,0.0,0.0,0.0,0.0,0.0,0.0,0.0,0.0,0.0,0.0,0.0,0.0,0.0,Tracheophyta; Pinus pinaster Aiton; Magnoliopsida; Pinales
2008,2008-03-17,Setúbal,Alcácer do Sal,Alcácer Do Sal (santa Maria Do Castelo),BRR QUINTINHA (Bairro da Quintinha),38.37278980000001,-8.52507867010475,NC,11.0,2008-03-17T15:00,16.9,58,8.7,13.8,0.0,0.0,0.0,0.0,3,1015.4,1014.1,100,100,90,0,0.26,0.81,19.1,26.3,250,251,41.4,19.2,15.3,15.1,15.2,0.128,0.177,0.177,0.189,1,3317.01,371.6,108.4,263.2,170.6,371.6,878.4,401.0,117.0,284.0,170.6,401.0,947.9,Tracheophyta; Oryza sativa L.; Olea europaea L.
2008,2008-10-03,Setúbal,Sesimbra,Sesimbra (castelo),MESQUITA,38.49240215,-9.11796389134298,NC,63.0,2008-10-03T10:00,16.1,47,4.8,9.9,0.0,0.0,0.0,0.0,0,1022.7,1015.1,0,0,0,0,0.31,0.96,33.4,43.3,8,9,59.0,18.3,18.9,21.5,21.7,0.088,0.073,0.116,0.178,1,3600.0,575.6,477.2,98.4,818.4,575.6,797.0,509.0,422.0,87.0,818.4,509.0,704.8,Magnoliopsida; Quercus rotundifolia Lam.; Pinus pinaster Aiton; Tracheophyta
2008,2008-11-15,Setúbal,Almada,Pragal,FRT HOSPITAL GARCIA ORTA (Pragal),38.6662386,-9.1799968,NC,61.0,2008-11-15T14:00,17.1,41,3.7,13.7,0.0,0.0,0.0,0.0,0,1024.1,1016.8,0,0,0,0,0.31,1.15,12.9,16.4,63,64,24.8,17.3,13.9,16.2,19.6,0.236,0.232,0.195,0.273,1,3600.0,484.7,409.8,74.9,868.0,484.7,660.3,518.0,438.0,80.0,868.0,518.0,705.7,Tracheophyta; Magnoliopsida
2008,2008-10-14,Setúbal,Santiago do Cacém,São Francisco da Serra,Roncão,38.0721028,-8.6482067,NC,269.0,2008-10-14T16:00,20.8,64,13.8,20.5,0.0,0.0,0.0,0.0,2,1020.3,989.0,74,38,38,55,0.21,0.88,10.6,14.0,332,334,25.2,23.5,19.5,19.8,21.6,0.198,0.18,0.169,0.202,1,3600.0,248.7,156.0,92.8,437.2,248.7,490.7,303.0,190.0,113.0,437.2,303.0,597.9,Quercus suber L.; Pinus pinea L.; Tracheophyta; Eucalyptus L'Hér.; Magnoliopsida; Pinus pinaster Aiton; Olea europaea L.; Vitis vinifera L.; 
2008,2008-05-17,Setúbal,Santiago do Cacém,Santiago do Cacém,CHAPARRALINHO - CRAVADINHA (Chaparralinho),37.9200773,-8.646574,NC,123.0,2008-05-17T19:00,16.2,71,11.0,12.9,0.0,0.0,0.0,0.0,0,1013.7,999.1,0,0,0,0,0.12,0.53,25.2,34.9,317,317,43.2,18.3,18.0,16.9,15.4,0.145,0.139,0.188,0.147,1,3600.0,79.4,52.0,27.4,463.2,79.4,150.3,148.0,97.0,51.0,463.2,148.0,280.1,Quercus suber L.; Magnoliopsida; Eucalyptus L'Hér.; Tracheophyta
2008,2008-06-06,Setúbal,Seixal,Amora,TRASEIRAS BRR 25 ABRIL- QT PRINCESA (AMORA),38.629209,-9.1171074,NC,19.0,2008-06-06T17:00,22.8,64,15.8,21.9,0.0,0.0,0.0,0.0,0,1016.4,1014.2,2,0,3,0,0.36,0.99,20.1,27.5,336,338,40.0,26.1,21.0,17.9,16.4,0.114,0.156,0.183,0.185,1,3600.0,490.8,399.9,90.9,752.5,490.8,705.9,567.0,462.0,105.0,752.5,567.0,815.5,Tracheophyta; Pinus pinea L.; Magnoliopsida
2008,2008-06-06,Setúbal,Seixal,Amora,QUINTA DA PRINCESA TRASEIRAS DO PALACIO (Pátio da Quinta Grande),38.6414112,-9.1151548,NC,0.0,2008-06-06T17:00,22.9,64,15.9,22.1,0.0,0.0,0.0,0.0,0,1016.4,1016.4,2,0,3,0,0.36,0.99,20.1,27.5,336,338,40.0,26.2,21.1,18.0,16.5,0.114,0.156,0.183,0.185,1,3600.0,490.8,399.9,90.9,752.5,490.8,705.9,567.0,462.0,105.0,752.5,567.0,815.5,Tracheophyta; Pinus pinea L.
2008,2008-11-23,Setúbal,Almada,Feijó,R. JOAO VILARETT (Feijó),38.66001545,-9.17518149201292,NC,49.0,2008-11-23T15:00,17.0,56,8.3,13.6,0.0,0.0,0.0,0.0,0,1018.5,1012.6,0,0,0,0,0.24,0.85,20.6,26.0,348,350,33.8,17.9,14.8,15.8,19.2,0.201,0.221,0.195,0.272,1,3600.0,330.2,269.5,60.7,772.8,330.2,489.3,381.0,311.0,70.0,772.8,381.0,564.6,Tracheophyta; Pinus pinea L.; Magnoliopsida
2008,2008-10-17,Setúbal,Setúbal,Setúbal (são Sebastião),PARQUE VERDE DA BELAVISTA (Parque de Campismo),38.52734715,-8.85704211645389,NC,26.0,2008-10-17T14:00,22.1,60,13.9,21.6,0.0,0.0,0.0,0.0,2,1017.7,1014.6,74,42,34,53,0.33,1.07,11.9,14.2,272,279,21.2,25.4,20.4,20.5,21.2,0.123,0.075,0.063,0.134,1,3600.0,475.7,299.8,175.9,502.7,475.7,821.7,503.0,317.0,186.0,502.7,503.0,868.9,Tracheophyta; Pinus pinaster Aiton; Olea europaea L.; Magnoliopsida
2008,2008-11-14,Setúbal,Sesimbra,Quinta do Conde,R VASCO DA GAMA (Quinta do Conde),38.5724611,-9.0370259,NC,21.0,2008-11-14T09:00,9.8,73,5.2,7.2,0.0,0.0,0.0,0.0,0,1026.6,1024.0,0,0,0,0,0.07,0.32,9.7,14.8,45,51,19.8,10.6,13.1,16.8,20.3,0.13,0.105,0.075,0.141,1,3600.0,233.6,166.4,67.1,596.1,233.6,390.3,167.0,119.0,48.0,596.1,167.0,279.0,Tracheophyta; Magnoliopsida
2008,2008-11-14,Setúbal,Palmela,Pinhal Novo,ESTRADA RIO FRIO JT ETAR (Estrada dos Espanhóis),38.630096,-8.9128319,NC,39.0,2008-11-14T17:00,16.7,43,4.2,14.2,0.0,0.0,0.0,0.0,0,1024.1,1019.4,0,0,0,0,0.08,1.07,7.2,15.0,18,27,13.7,16.7,14.5,16.6,20.3,0.129,0.106,0.063,0.134,1,3287.92,42.5,27.9,14.6,320.6,40.4,79.6,108.0,71.0,37.0,466.5,108.0,202.2,Vitis vinifera L.; Magnoliopsida; Olea europaea L.; Tracheophyta
2008,2008-09-29,Setúbal,Almada,Costa da Caparica,TRS CEMITERIO COSTA CAPARICA (COSTA DA CAPARICA),38.640162450000005,-9.233180343115055,NC,3.0,2008-09-29T14:00,24.8,50,13.7,24.1,0.0,0.0,0.0,0.0,1,1017.0,1016.7,22,3,32,0,0.4,1.57,13.2,18.1,26,31,26.6,26.6,21.4,21.6,21.3,0.16,0.068,0.105,0.181,1,3600.0,509.3,380.3,129.0,553.4,509.3,937.3,533.0,398.0,135.0,553.4,533.0,980.9,Tracheophyta; Pinus pinea L.; Magnoliopsida
2008,2008-06-05,Setúbal,Sesimbra,Quinta do Conde,AV DA LIBERDADE FRT HÁ FARMÁCIA (Quinta do Conde),38.5724611,-9.0370259,NC,21.0,2008-06-05T17:00,20.4,62,12.9,18.0,0.0,0.0,0.0,0.0,0,1017.6,1015.1,0,0,0,0,0.32,0.91,23.0,30.6,319,323,39.2,24.0,19.9,17.7,16.2,0.099,0.123,0.153,0.157,1,3600.0,444.6,325.2,119.4,613.7,444.6,704.1,514.0,376.0,138.0,613.7,514.0,814.0,Tracheophyta; Magnoliopsida
2008,2008-10-09,Setúbal,Seixal,Fernão Ferro,EN 378 FT QUINTAO (Fernão Ferro),38.5640057,-9.094534,NC,69.0,2008-10-09T16:00,22.5,33,5.4,18.5,0.0,0.0,0.0,0.0,0,1019.9,1011.8,0,0,0,0,0.36,1.83,19.3,26.7,24,26,37.4,24.3,19.2,20.4,21.1,0.114,0.069,0.095,0.169,1,3600.0,367.4,302.4,65.0,788.6,367.4,526.1,441.0,363.0,78.0,788.6,441.0,631.5,Tracheophyta; Pinus pinaster Aiton; Magnoliopsida
2008,2008-06-16,Setúbal,Sesimbra,Quinta do Conde,JT PARQUE VERDE (Quinta do Conde),38.5724611,-9.0370259,NC,21.0,2008-06-16T21:00,17.8,82,14.7,17.3,0.0,0.0,0.0,0.0,0,1012.4,1009.9,4,4,1,0,0.02,0.37,14.5,22.2,305,310,25.2,20.2,22.4,20.4,16.8,0.063,0.092,0.138,0.156,0,0.0,0.0,0.0,0.0,0.0,0.0,0.0,0.0,0.0,0.0,0.0,0.0,0.0,Tracheophyta; Magnoliopsida
2008,2008-03-26,Setúbal,Montijo,Santo Isidro de Pegões,FAIAS- R DA ESCOLA (FAIAS),38.6854393,-8.6649901,NC,58.0,2008-03-26T03:00,9.1,83,6.4,6.4,0.0,0.0,0.0,0.0,1,1021.3,1014.2,20,21,2,0,0.01,0.2,12.7,24.9,335,338,21.2,9.9,12.4,13.4,14.6,0.143,0.138,0.11,0.143,0,0.0,0.0,0.0,0.0,0.0,0.0,0.0,0.0,0.0,0.0,0.0,0.0,0.0,Tracheophyta; Olea europaea L.; Quercus suber L.; Eucalyptus L'Hér.; Magnoliopsida
2008,2008-11-27,Setúbal,Alcácer do Sal,Alcácer Do Sal (santa Maria Do Castelo),Montevil,38.3988792,-8.5752344,NC,14.0,2008-11-27T14:00,14.6,35,-0.6,10.8,0.0,0.0,0.0,0.0,0,1017.5,1015.8,0,0,0,0,0.27,1.08,11.2,14.5,21,23,29.2,16.9,12.1,16.1,19.9,0.066,0.088,0.074,0.15,1,3600.0,444.7,372.9,71.8,849.5,444.7,616.9,477.0,400.0,77.0,849.5,477.0,661.7,Pinus pinea L.; Oryza sativa L.
2008,2008-10-10,Setúbal,Setúbal,Setúbal (são Sebastião),R. LUIS DE SÁ (QUINTA DO ANJO),38.5205563,-8.8523814,NC,14.0,2008-10-10T13:00,27.6,38,12.1,24.5,0.0,0.0,0.0,0.0,1,1015.8,1014.2,32,0,9,88,0.56,2.28,28.7,39.9,66,68,47.5,27.2,19.4,20.9,21.4,0.101,0.062,0.063,0.134,1,3600.0,640.4,478.4,162.1,691.9,640.4,949.0,648.0,484.0,164.0,691.9,648.0,960.1,Tracheophyta; Magnoliopsida
2008,2008-10-09,Setúbal,Setúbal,Setúbal (são Julião),QT DA VARZEA (São Julião),38.5279518,-8.894774306731911,NC,6.0,2008-10-09T17:00,23.3,27,3.4,18.9,0.0,0.0,0.0,0.0,0,1019.5,1018.8,0,0,0,0,0.3,2.08,19.8,28.5,29,32,35.3,24.0,19.5,21.0,21.5,0.109,0.062,0.063,0.134,1,3600.0,175.2,133.1,42.1,654.9,175.2,278.8,254.0,193.0,61.0,654.9,254.0,404.3,Tracheophyta; Magnoliopsida
2008,2008-03-09,Setúbal,Seixal,Corroios,JT SALÃO CORDEIRO- VALE MILHAÇOS (CORROIOS),38.6364997,-9.1517196,NC,18.0,2008-03-09T19:00,12.4,64,5.7,8.5,0.0,0.0,0.0,0.0,2,1019.7,1017.5,65,39,0,100,0.08,0.52,19.5,27.6,337,338,33.8,13.5,14.4,14.2,14.9,0.165,0.197,0.215,0.191,0,26.19,0.0,0.0,0.0,0.0,0.0,0.0,16.0,6.0,10.0,64.2,16.0,69.4,Tracheophyta; Pinus pinea L.
2008,2008-10-13,Setúbal,Sesimbra,Sesimbra (castelo),Carrasqueira,38.48576415,-9.102601462884303,NC,102.0,2008-10-13T16:00,19.0,74,14.2,19.6,0.0,0.0,0.0,0.0,0,1021.0,1008.9,15,7,15,0,0.19,0.58,5.5,6.4,293,297,18.4,23.5,19.5,20.3,21.3,0.159,0.076,0.114,0.177,1,3600.0,276.7,196.6,80.1,539.3,276.7,501.2,335.0,238.0,97.0,539.3,335.0,606.8,Pinus pinaster Aiton; Tracheophyta; Magnoliopsida; Pinus pinea L.
2008,2008-06-07,Setúbal,Santiago do Cacém,São Bartolomeu da Serra,MULINHETA - VALINHOS DE CIMA (Maroteiras de Cima),38.0169644,-8.616184,NC,177.0,2008-06-07T15:00,28.4,31,9.5,28.0,0.0,0.0,0.0,0.0,0,1015.1,995.0,0,0,0,0,0.67,2.69,14.4,18.3,338,340,31.3,32.0,22.0,17.6,15.7,0.122,0.212,0.236,0.199,1,3600.0,832.5,722.2,110.3,879.3,832.5,1090.6,883.0,766.0,117.0,879.3,883.0,1156.7,Olea europaea L.; Quercus suber L.; Tracheophyta; Magnoliopsida
2008,2008-10-27,Setúbal,Palmela,Marateca,EN 5- AGUALVA DE CIMA (MARATECA),38.574292,-8.7102944,NC,2.0,2008-10-27T18:00,19.2,69,13.5,17.4,0.0,0.0,0.0,0.0,1,1014.9,1014.7,20,17,8,0,0.08,0.68,20.3,30.2,323,327,34.6,21.1,20.0,20.0,21.4,0.085,0.073,0.068,0.134,0,168.87,0.0,0.0,0.0,0.0,0.0,0.0,18.0,8.0,10.0,85.2,18.0,70.4,Vitis vinifera L.; Pinus pinea L.; Oryza sativa L.; Quercus rotundifolia Lam.; Tracheophyta
2008,2008-04-02,Setúbal,Santiago do Cacém,Abela,AREALAO (Areal),38.0007417,-8.5586294,NC,95.0,2008-04-02T20:00,19.3,64,12.3,19.0,0.0,0.0,0.0,0.0,0,1020.9,1009.6,0,0,0,0,0.02,0.81,6.8,12.6,162,153,11.5,18.9,18.4,14.8,14.9,0.15,0.229,0.233,0.2,0,0.0,0.0,0.0,0.0,0.0,0.0,0.0,0.0,0.0,0.0,0.0,0.0,0.0,Quercus suber L.; Tracheophyta; Eucalyptus L'Hér.; Magnoliopsida; Olea europaea L.; Pinus pinea L.; Quercus rotundifolia Lam.; 
2008,2008-10-28,Setúbal,Barreiro,Coina,JT PORTAO DA NATO- COINA (COINA),38.5846313,-9.0515846,NC,25.0,2008-10-28T18:00,13.6,56,5.0,7.7,0.0,0.0,0.0,0.0,0,1013.5,1010.5,0,0,0,0,0.13,0.69,32.1,45.3,344,346,59.0,15.9,17.9,19.8,21.1,0.096,0.081,0.093,0.168,0,314.4,0.0,0.0,0.0,0.0,0.0,0.0,20.0,10.0,10.0,106.2,20.0,70.7,Magnoliopsida; Eucalyptus L'Hér.; Pinus pinaster Aiton; Pinus pinea L.; Tracheophyta; Quercus suber L.; Pinales; 
2008,2008-11-22,Setúbal,Sines,Sines,ROTUNDA DA BARBUDA (SINES),37.9574843,-8.812298931051298,NC,40.0,2008-11-22T19:00,15.9,73,11.2,13.5,0.0,0.0,0.0,0.0,0,1017.8,1013.0,0,0,0,0,0.05,0.48,19.0,32.0,345,348,30.2,15.7,15.5,16.2,19.7,0.074,0.125,0.107,0.171,0,0.0,0.0,0.0,0.0,0.0,0.0,0.0,0.0,0.0,0.0,0.0,0.0,0.0,Tracheophyta; Pinus pinea L.; Pinus pinaster Aiton; Magnoliopsida
