2008,2008-06-22,Setúbal,Seixal,Fernão Ferro,JT PAVIL (Fernão Ferro),38.5640057,-9.094534,NC,69.0,2008-06-22T14:00,27.5,47,15.2,29.0,0.0,0.0,0.0,0.0,0,1014.6,1006.7,0,0,0,0,0.68,1.94,16.4,20.6,320,324,34.6,33.8,23.7,20.5,17.0,0.056,0.107,0.161,0.183,1,3600.0,936.6,822.7,113.9,894.0,936.6,1218.5,962.0,845.0,117.0,894.0,962.0,1251.5,Tracheophyta; Pinus pinaster Aiton; Magnoliopsida
2008,2008-11-11,Setúbal,Moita,Gaio-Rosário,JT FREIRAS BAR (GAIO-ROSÁRIO),38.67494195,-9.007814860787253,NC,11.0,2008-11-11T17:00,15.8,79,12.3,14.5,0.4,0.4,0.0,0.0,51,1022.0,1020.7,82,54,55,0,0.06,0.37,14.2,21.9,333,335,27.7,16.7,15.8,16.6,18.8,0.244,0.225,0.195,0.234,1,3436.47,36.3,17.3,19.0,198.6,35.4,89.9,86.0,41.0,45.0,262.1,86.0,212.8,Tracheophyta; Magnoliopsida
2008,2008-11-22,Setúbal,Alcochete,Alcochete,TRASEIRAS DA BALUARTE (ALCOCHETE),38.74885805,-8.972979556538611,NC,0.0,2008-11-22T16:00,17.8,61,10.2,14.9,0.0,0.0,0.0,0.0,0,1018.7,1018.7,0,0,0,0,0.17,0.8,20.3,30.1,347,349,35.6,17.0,14.5,15.2,17.5,0.208,0.216,0.195,0.234,1,3600.0,181.2,137.6,43.6,665.8,181.2,289.8,245.0,186.0,59.0,665.8,245.0,391.8,Tracheophyta
2008,2008-11-23,Setúbal,Seixal,Corroios,JT CAMPO BOLA VALE MILHAÇOS (CORROIOS),38.6364997,-9.1517196,NC,18.0,2008-11-23T13:00,17.2,53,7.5,14.8,0.0,0.0,0.0,0.0,0,1018.9,1016.7,0,0,0,0,0.29,0.93,12.3,14.5,5,7,22.0,18.9,14.6,16.2,19.6,0.081,0.108,0.099,0.177,1,3600.0,502.1,424.1,77.9,841.5,502.1,707.2,509.0,430.0,79.0,841.5,509.0,716.9,Tracheophyta; Pinus pinea L.
2008,2008-06-08,Setúbal,Almada,Charneca De Caparica,PRAIA 19 (Nova Praia),38.6285507,-9.1974387,NC,86.0,2008-06-08T13:00,24.6,43,11.4,23.5,0.0,0.0,0.0,0.0,0,1014.2,1004.3,0,0,0,0,0.65,1.75,24.2,31.9,349,354,40.7,27.8,20.5,17.7,15.8,0.099,0.161,0.192,0.195,1,3600.0,977.3,858.5,118.8,895.6,977.3,1272.5,979.0,860.0,119.0,895.6,979.0,1274.8,Tracheophyta; Pinus pinaster Aiton; Magnoliopsida; Pinales
2008,2008-06-22,Setúbal,Seixal,Fernão Ferro,JT REI COBRE FOROS CATRAPONA (Fernão Ferro),38.5640057,-9.094534,NC,69.0,2008-06-22T17:00,25.0,57,15.8,23.9,0.0,0.0,0.0,0.0,0,1014.2,1006.2,0,0,0,0,0.41,1.37,22.4,30.3,332,335,48.2,30.9,24.5,20.5,17.0,0.056,0.106,0.161,0.183,1,3600.0,509.9,424.6,85.3,777.2,509.9,723.4,586.0,488.0,98.0,777.2,586.0,831.4,Tracheophyta; Pinus pinaster Aiton; Magnoliopsida
2008,2008-06-18,Setúbal,Montijo,Montijo,JT ETAR SEIXALINHO (MONTIJO),38.7060845,-8.9746372,NC,6.0,2008-06-18T20:00,18.9,59,10.8,16.3,0.0,0.0,0.0,0.0,0,1018.4,1017.7,0,0,0,0,0.11,0.89,19.5,30.2,341,343,37.1,23.6,23.5,22.0,19.9,0.187,0.202,0.232,0.243,1,2038.24,0.0,0.0,0.0,0.0,0.0,0.0,52.0,29.0,23.0,232.6,52.0,112.8,Tracheophyta
2008,2008-06-20,Setúbal,Setúbal,Sado,ESTRADA REGIONAL 10.4 (ED10-4 (ED10-4) Km 12),38.5181894,-8.830048,NC,15.0,2008-06-20T11:00,27.9,41,13.6,30.0,0.0,0.0,0.0,0.0,0,1019.2,1017.5,0,0,0,0,0.6,2.21,6.4,6.6,308,331,19.8,35.0,23.9,21.7,17.5,0.044,0.106,0.166,0.177,1,3600.0,894.2,773.0,121.1,856.0,894.2,1196.2,849.0,734.0,115.0,856.0,849.0,1135.8,Quercus suber L.; Tracheophyta; Eucalyptus L'Hér.; Pinus pinea L.; Olea europaea L.; Magnoliopsida; Quercus rotundifolia Lam.; 
2008,2008-06-09,Setúbal,Almada,Pragal,AV TORRADO DA SILVA- FRT HGO (Pragal),38.6662386,-9.1799968,NC,61.0,2008-06-09T11:00,21.7,46,9.5,21.5,0.0,0.0,0.0,0.0,0,1016.3,1009.1,0,0,0,0,0.54,1.41,12.9,17.2,30,37,24.1,23.3,19.8,18.0,15.9,0.239,0.278,0.299,0.291,1,3600.0,913.2,793.1,120.1,880.8,913.2,1195.1,867.0,753.0,114.0,880.8,867.0,1134.6,Tracheophyta; Magnoliopsida
2008,2008-06-21,Setúbal,Seixal,Fernão Ferro,JUNTO REI DO COBRE - FOROS DA CATRAPONA (Fernão Ferro),38.5640057,-9.094534,NC,69.0,2008-06-21T16:00,25.6,59,17.1,26.8,0.0,0.0,0.0,0.0,0,1015.5,1007.5,1,1,0,0,0.49,1.34,15.6,19.9,310,314,36.7,32.8,24.4,20.3,16.9,0.057,0.108,0.162,0.183,1,3600.0,664.0,545.3,118.7,773.9,664.0,933.0,727.0,597.0,130.0,773.9,727.0,1021.5,Tracheophyta; Pinus pinaster Aiton; Magnoliopsida
2008,2008-06-06,Setúbal,Almada,Feijó,VALE MOURELOS- POR BAIXO ALMADA FORUM (Alto do Vale de Rosal),38.66001545,-9.17518149201292,NC,49.0,2008-06-06T15:00,23.0,65,16.1,23.2,0.0,0.0,0.0,0.0,0,1017.5,1011.8,1,0,1,0,0.49,0.98,22.6,29.3,338,341,37.8,25.0,19.5,17.3,15.9,0.267,0.294,0.302,0.291,1,3600.0,790.3,658.1,132.2,799.5,790.3,1093.3,837.0,697.0,140.0,799.5,837.0,1158.0,Tracheophyta; Pinus pinea L.; Magnoliopsida
2008,2008-06-22,Setúbal,Seixal,Aldeia de Paio Pires,EN10 JT ANTIGA INDELMA (EN10 (EN10) Km 13),38.6119995,-9.07313725926883,NC,5.0,2008-06-22T13:00,27.8,46,15.2,30.0,0.0,0.0,0.0,0.0,0,1014.5,1013.9,0,0,0,0,0.7,2.02,13.4,15.6,294,304,24.8,33.5,23.8,20.9,17.4,0.056,0.107,0.161,0.183,1,3600.0,984.3,871.4,112.9,906.0,984.3,1273.6,985.0,872.0,113.0,906.0,985.0,1274.4,Tracheophyta; Magnoliopsida; Pinus pinaster Aiton
2008,2008-11-16,Setúbal,Palmela,Poceirão,CRUZ LAGAMEÇAS (Casal da Cruz),38.633037,-8.7423662,NC,40.0,2008-11-16T18:00,15.9,41,2.8,13.1,0.0,0.0,0.0,0.0,0,1025.6,1020.8,0,0,0,0,0.08,1.06,7.9,18.6,30,44,13.3,15.0,13.8,16.1,20.3,0.106,0.101,0.068,0.134,0,0.0,0.0,0.0,0.0,0.0,0.0,0.0,3.0,1.0,2.0,16.4,3.0,24.4,Vitis vinifera L.; Quercus suber L.; Magnoliopsida; Tracheophyta
2008,2008-12-25,Setúbal,Barreiro,Palhais,JT A2- QUINTA DO TORRAO (PALHAIS),38.6249118,-9.0363097,NC,42.0,2008-12-25T18:00,12.1,73,7.5,10.3,0.0,0.0,0.0,0.0,0,1019.3,1014.2,0,0,0,0,0.03,0.38,7.7,10.2,323,337,10.8,11.5,11.2,13.1,17.7,0.139,0.153,0.077,0.139,0,0.0,0.0,0.0,0.0,0.0,0.0,0.0,3.0,1.0,2.0,16.9,3.0,22.3,Magnoliopsida; Eucalyptus L'Hér.; Pinus pinaster Aiton; Pinus pinea L.; Tracheophyta; Quercus suber L.; Pinales; 
2008,2008-06-24,Setúbal,Sesimbra,Sesimbra (castelo),PEDRAS NEGRAS- APOSTIÇA (PEDRA NEGRA),38.49240215,-9.11796389134298,NC,63.0,2008-06-24T14:00,22.7,56,13.4,22.0,0.0,0.0,0.0,0.0,0,1018.3,1010.9,0,0,0,0,0.57,1.22,25.3,31.6,334,336,42.1,32.5,23.3,21.2,17.6,0.047,0.116,0.174,0.191,1,3600.0,934.0,814.2,119.8,883.8,934.0,1219.6,959.0,836.0,123.0,883.8,959.0,1252.2,Magnoliopsida; Quercus rotundifolia Lam.; Pinus pinaster Aiton; Tracheophyta
2008,2008-06-15,Setúbal,Palmela,Pinhal Novo,E.M 533.1 JT A CURVA DA MORTE (Pinhal Novo),38.630096,-8.9128319,NC,39.0,2008-06-15T18:00,21.4,73,16.4,20.9,0.0,0.0,0.0,0.0,3,1014.0,1009.4,93,99,7,0,0.16,0.69,18.5,25.6,278,280,37.8,26.2,23.6,20.1,16.5,0.057,0.074,0.116,0.149,1,1787.48,151.8,43.1,108.6,119.6,151.8,478.1,190.0,54.0,136.0,119.6,190.0,598.6,Vitis vinifera L.; Magnoliopsida; Olea europaea L.; Tracheophyta
2008,2008-06-09,Setúbal,Almada,Costa da Caparica,JT A PRAIA 19 - FONTE DA TELHA (COSTA DA CAPARICA),38.640162450000005,-9.233180343115055,NC,3.0,2008-06-09T19:00,22.1,56,13.0,20.1,0.0,0.0,0.0,0.0,0,1015.6,1015.2,1,0,1,0,0.19,1.16,20.2,30.0,359,6,34.2,24.1,22.2,18.6,16.4,0.084,0.155,0.19,0.195,1,3600.0,123.4,82.9,40.5,490.7,123.4,224.3,192.0,129.0,63.0,490.7,192.0,348.9,Tracheophyta; Pinus pinea L.; Magnoliopsida
2008,2008-06-14,Setúbal,Almada,Caparica,R. MOINHO (CAPARICA),38.6763403,-9.211800839693492,NC,3.0,2008-06-14T19:00,21.9,59,13.6,20.8,0.0,0.0,0.0,0.0,0,1017.3,1016.9,7,0,0,22,0.17,1.08,15.9,23.5,322,328,27.7,24.9,23.5,19.8,16.6,0.191,0.248,0.29,0.29,1,3600.0,126.6,75.7,50.9,430.1,126.6,233.4,194.0,116.0,78.0,430.1,194.0,357.6,Magnoliopsida; Tracheophyta; Pinus pinaster Aiton
2008,2008-06-14,Setúbal,Almada,Charneca De Caparica,Fonte da Telha,38.6285507,-9.1974387,NC,86.0,2008-06-14T19:00,21.3,60,13.3,20.0,0.0,0.0,0.0,0.0,0,1017.3,1007.2,7,0,0,22,0.17,1.0,15.9,23.5,322,328,27.7,25.4,23.6,19.6,16.2,0.059,0.136,0.183,0.194,1,3600.0,126.5,75.6,50.8,430.9,126.5,232.6,194.0,116.0,78.0,430.9,194.0,356.9,Tracheophyta; Pinus pinaster Aiton; Magnoliopsida; Pinales
2008,2008-11-16,Setúbal,Sesimbra,Sesimbra (castelo),TRS ESCOLA SEC SAMPAIO (Castelo),38.4749148,-9.1111472,NC,105.0,2008-11-16T19:00,15.1,58,6.8,13.0,0.0,0.0,0.0,0.0,0,1026.1,1013.4,0,0,0,0,0.04,0.72,8.9,21.6,32,44,15.8,13.9,14.6,16.4,19.9,0.083,0.091,0.11,0.174,0,0.0,0.0,0.0,0.0,0.0,0.0,0.0,0.0,0.0,0.0,0.0,0.0,0.0,Pinus pinea L.; Magnoliopsida; Tracheophyta; Vitis vinifera L.; Pinus pinaster Aiton
2008,2008-06-22,Setúbal,Moita,Alhos Vedros,BAIRRO FRANCISCO PIRES JUNTO PISCINAS (Bairro da Bela Vista),38.6561131,-9.0246288,NC,9.0,2008-06-22T16:00,28.2,46,15.5,27.9,0.0,0.0,0.0,0.0,0,1014.5,1013.5,0,0,0,0,0.57,2.06,21.2,27.7,328,330,43.6,30.7,25.1,22.6,20.4,0.184,0.197,0.229,0.243,1,3600.0,682.5,577.4,105.1,818.9,682.5,933.6,747.0,632.0,115.0,818.9,747.0,1021.9,Tracheophyta
2008,2008-04-06,Setúbal,Santiago do Cacém,Santo André,LAGOA DE SANTO ANDRE (Lagoa de Santo André),38.0944988,-8.788605295394115,NC,0.0,2008-04-06T12:00,21.3,55,11.9,21.4,0.0,0.0,0.0,,1,1007.1,1007.1,30,0,0,100,0.49,1.14,13.5,16.4,224,220,25.9,22.6,16.7,15.8,14.4,0.036,0.109,0.145,0.14,1,3600.0,840.1,645.3,194.8,765.0,840.1,1152.6,815.0,626.0,189.0,765.0,815.0,1118.1,Pinus pinea L.; Pinus pinaster Aiton; Magnoliopsida; Quercus suber L.; Tracheophyta; Oryza sativa L.; Eucalyptus L'Hér.; Vitis vinifera L.; 
2008,2008-06-23,Setúbal,Seixal,Aldeia de Paio Pires,Foros da Catrapona,38.589562,-9.0784934,NC,36.0,2008-06-23T13:00,23.9,57,14.8,25.2,0.0,0.0,0.0,0.0,0,1015.3,1011.1,0,0,0,0,0.61,1.28,17.1,21.9,318,319,40.7,30.4,23.2,20.9,17.3,0.056,0.105,0.16,0.183,1,3600.0,971.4,842.5,128.9,875.6,971.4,1273.8,972.0,843.0,129.0,875.6,972.0,1274.6,Tracheophyta; Magnoliopsida; Pinus pinaster Aiton; Pinus pinea L.; Eucalyptus L'Hér.
2008,2008-01-30,Setúbal,Alcácer do Sal,Comporta,MT MURTA (Monte de Murta),38.408331,-8.7064661,NC,-1.0,2008-01-30T15:00,15.7,65,9.2,13.7,0.0,0.0,0.0,0.0,0,1030.0,1030.1,0,0,0,0,0.25,0.62,12.0,15.2,344,346,23.8,16.8,13.0,14.0,16.2,0.174,0.187,0.163,0.187,1,3600.0,437.1,368.3,68.8,843.4,437.1,615.7,483.0,407.0,76.0,843.4,483.0,680.4,Pinus pinaster Aiton; Pinus pinea L.; Eucalyptus L'Hér.; Magnoliopsida; Oryza sativa L.; Tracheophyta; Pinales; 
2008,2008-04-10,Setúbal,Barreiro,Barreiro,TRAS PALACIO COIMBRA (BARREIRO),38.6529007,-9.079272,NC,3.0,2008-04-10T19:00,11.6,75,7.3,6.9,0.0,0.0,0.0,0.0,3,1003.9,1003.5,86,35,50,83,0.07,0.34,27.7,41.5,316,317,50.0,15.1,15.9,15.9,15.4,0.319,0.324,0.245,0.246,1,0.0,4.1,0.9,3.3,9.8,3.3,19.0,34.0,7.0,27.0,48.5,34.0,156.7,Tracheophyta
2008,2008-06-27,Setúbal,Santiago do Cacém,Santo André,PRAIA DA VACARIA- RESERVA NATURAL (Praia da Fonte Cortiço),38.065594950000005,-8.778572225777431,Desconhecida,27.0,2008-06-27T14:00,28.7,49,17.0,30.8,0.0,0.0,0.0,,0,1018.2,1015.1,0,0,0,0,0.7,2.0,17.7,21.6,308,314,34.9,32.6,23.7,21.3,18.3,0.036,0.079,0.124,0.137,1,3600.0,948.0,830.2,117.8,901.3,948.0,1219.1,974.0,853.0,121.0,901.3,974.0,1252.5,Pinus pinea L.; Pinus pinaster Aiton; Magnoliopsida; Quercus suber L.; Tracheophyta; Oryza sativa L.; Eucalyptus L'Hér.; Vitis vinifera L.; 
2008,2008-07-01,Setúbal,Montijo,Montijo,JT PINGO DOCE (MONTIJO),38.7060845,-8.9746372,NC,6.0,2008-07-01T01:00,17.6,84,14.9,16.9,0.0,0.0,0.0,0.0,2,1018.1,1017.4,51,57,0,0,0.02,0.32,16.3,27.0,342,344,25.6,22.1,25.5,23.3,20.7,0.183,0.192,0.221,0.242,0,0.0,0.0,0.0,0.0,0.0,0.0,0.0,0.0,0.0,0.0,0.0,0.0,0.0,Tracheophyta
2008,2008-04-11,Setúbal,Setúbal,São Simão,QUINTA DO PICAO- JT A QUINTA DO PERU (Central Elevatória Quinta do Perú),38.5264679,-8.985538480683791,NC,163.0,2008-04-11T21:00,11.2,68,5.6,8.1,0.0,0.0,0.0,0.0,1,1019.9,1000.2,20,13,14,0,0.03,0.42,13.4,23.9,336,339,27.0,11.9,14.2,15.1,14.4,0.25,0.268,0.2,0.183,0,0.0,0.0,0.0,0.0,0.0,0.0,0.0,0.0,0.0,0.0,0.0,0.0,0.0,Olea europaea L.; Tracheophyta; Quercus suber L.; Magnoliopsida; Pinus pinea L.; Pinus pinaster Aiton; Vitis vinifera L.
2008,2008-11-18,Setúbal,Sesimbra,Sesimbra (castelo),ENCOSTA NORTE- JT PRAIA MECO (Castelo),38.4749148,-9.1111472,NC,105.0,2008-11-18T14:00,16.2,64,9.4,12.7,0.0,0.0,0.0,0.0,1,1019.0,1006.5,30,1,0,98,0.25,0.66,23.2,32.2,348,350,44.3,19.2,14.4,16.3,19.8,0.074,0.09,0.11,0.174,1,3600.0,443.3,331.1,112.2,711.6,443.3,651.5,474.0,354.0,120.0,711.6,474.0,696.7,Pinus pinea L.; Magnoliopsida; Tracheophyta; Vitis vinifera L.; Pinus pinaster Aiton
2008,2008-10-29,Setúbal,Almada,Trafaria,EN 377-1 JT PERA (ER377-1 (IC32) Km 2),38.66186915,-9.226016510778402,NC,48.0,2008-10-29T00:00,12.2,69,6.7,6.9,0.0,0.0,0.0,0.0,0,1017.1,1011.3,13,0,0,43,0.07,0.44,30.6,44.7,358,359,51.1,13.8,16.8,19.2,20.6,0.2,0.191,0.195,0.274,0,0.0,0.0,0.0,0.0,0.0,0.0,0.0,0.0,0.0,0.0,0.0,0.0,0.0,Magnoliopsida; Tracheophyta
2008,2008-11-15,Setúbal,Palmela,Quinta do Anjo,AREIAS- JT CEMETRIO (Areias),38.5674568,-8.9418673,NC,95.0,2008-11-15T00:00,9.9,72,5.1,7.3,0.0,0.0,0.0,0.0,0,1025.3,1013.6,0,0,0,0,0.02,0.34,9.6,22.6,56,65,16.9,10.2,13.5,16.3,19.9,0.129,0.106,0.063,0.134,0,0.0,0.0,0.0,0.0,0.0,0.0,0.0,0.0,0.0,0.0,0.0,0.0,0.0,Vitis vinifera L.; Tracheophyta; Olea europaea L.; Quercus suber L.
2008,2008-05-05,Setúbal,Almada,Caparica,RUA CARVALHO ARAUJO- PORTO BRANDAO (Rua Capitão Leitão),38.65374105,-9.208963679535769,NC,74.0,2008-05-05T17:00,18.7,65,12.0,16.6,0.0,0.0,0.0,0.0,1,1018.2,1009.4,30,0,0,100,0.24,0.75,18.6,23.7,328,332,34.6,21.1,18.7,16.4,14.9,0.269,0.298,0.332,0.291,1,3600.0,325.0,112.6,212.4,237.4,325.0,637.7,384.0,133.0,251.0,237.4,384.0,753.5,Tracheophyta; Pinales; Magnoliopsida
2008,2008-06-22,Setúbal,Seixal,Fernão Ferro,JT PAVIL (Fernão Ferro),38.5640057,-9.094534,NC,69.0,2008-06-22T19:00,22.0,66,15.4,20.7,0.0,0.0,0.0,0.0,0,1013.9,1005.8,0,0,0,0,0.18,0.89,21.5,31.1,337,340,43.2,26.7,24.6,20.6,17.0,0.056,0.106,0.161,0.183,1,3600.0,138.1,98.0,40.1,543.9,138.1,238.6,210.0,149.0,61.0,543.9,210.0,362.7,Tracheophyta; Pinus pinaster Aiton; Magnoliopsida
2008,2008-05-10,Setúbal,Alcochete,Alcochete,JT A PRECOR (ALCOCHETE),38.74885805,-8.972979556538611,NC,0.0,2008-05-10T18:00,16.9,60,9.2,12.3,0.0,0.0,0.0,0.0,1,1015.0,1015.0,38,42,1,0,0.2,0.76,29.8,43.0,335,336,58.7,18.6,17.8,17.5,16.4,0.217,0.234,0.257,0.245,1,3600.0,194.6,116.6,78.0,395.7,194.6,395.3,257.0,154.0,103.0,395.7,257.0,522.1,Tracheophyta
2008,2008-07-02,Setúbal,Sesimbra,Sesimbra (castelo),JT AO SUPER MERCADO SUPER SOL (Castelo),38.4749148,-9.1111472,NC,105.0,2008-07-02T14:00,21.8,53,11.7,20.9,0.0,0.0,0.0,0.0,1,1017.0,1004.7,29,2,0,92,0.54,1.23,21.4,27.8,318,320,45.4,31.2,23.6,21.8,17.9,0.047,0.106,0.165,0.189,1,3600.0,877.1,677.3,199.8,735.5,877.1,1218.4,900.0,695.0,205.0,735.5,900.0,1250.3,Pinus pinea L.; Magnoliopsida; Tracheophyta; Vitis vinifera L.; Pinus pinaster Aiton
2008,2008-10-02,Setúbal,Seixal,Fernão Ferro,JT SUBESTAÇÃO EDP - VALENCIANA (Fernão Ferro),38.5640057,-9.094534,NC,69.0,2008-10-02T13:00,21.3,50,10.6,19.4,0.0,0.0,0.0,0.0,0,1017.4,1009.3,0,0,0,0,0.47,1.26,21.7,28.9,345,346,43.9,24.9,20.2,21.3,21.2,0.117,0.07,0.096,0.17,1,3600.0,761.2,662.1,99.1,907.6,761.2,996.6,768.0,668.0,100.0,907.6,768.0,1005.5,Tracheophyta; Pinus pinaster Aiton; Magnoliopsida
2008,2008-03-06,Setúbal,Alcácer do Sal,Comporta,CRUZ COMPORTA/ CARVALHAL (Comporta),38.4397907,-8.8172644,NC,0.0,2008-03-06T17:00,15.3,38,1.0,11.9,0.0,0.0,0.0,0.0,0,1023.4,1023.4,0,0,0,0,0.21,1.08,9.4,11.5,358,2,21.6,17.9,14.2,14.7,15.1,0.124,0.191,0.178,0.18,1,3600.0,279.2,225.3,53.8,778.0,279.2,402.6,363.0,293.0,70.0,778.0,363.0,523.4,Pinus pinaster Aiton; Pinus pinea L.; Eucalyptus L'Hér.; Magnoliopsida; Oryza sativa L.; Tracheophyta; Pinales; 
2008,2008-06-25,Setúbal,Barreiro,Barreiro,JT CBV 1504 (BARREIRO),38.6529007,-9.079272,NC,3.0,2008-06-25T16:00,29.0,46,16.2,29.4,0.0,0.0,0.0,0.0,0,1014.3,1014.0,0,0,0,0,0.59,2.18,19.3,25.3,339,343,42.1,31.0,24.6,22.9,20.6,0.183,0.195,0.226,0.243,1,3600.0,691.8,593.1,98.7,840.0,691.8,934.6,757.0,649.0,108.0,840.0,757.0,1022.7,Tracheophyta
2008,2008-05-22,Setúbal,Palmela,Pinhal Novo,JT A PALEXPO - PALHOTA (Pinhal Novo),38.630096,-8.9128319,NC,39.0,2008-05-22T12:00,19.1,78,15.2,18.0,0.0,0.0,0.0,0.0,3,1016.3,1011.7,100,88,41,25,0.28,0.48,19.4,27.0,222,222,42.5,21.1,18.0,17.1,15.8,0.147,0.109,0.146,0.151,1,3600.0,511.8,209.8,301.9,222.5,511.8,1258.8,500.0,205.0,295.0,222.5,500.0,1229.9,Vitis vinifera L.; Magnoliopsida; Olea europaea L.; Tracheophyta
2008,2008-11-20,Setúbal,Palmela,Pinhal Novo,ESTRADA DA SALGUEIRINHA (Estrada dos Espanhóis),38.630096,-8.9128319,NC,39.0,2008-11-20T16:00,18.2,36,3.0,14.8,0.0,0.0,0.0,0.0,0,1021.1,1016.4,0,0,0,0,0.2,1.33,12.7,18.5,35,37,28.1,18.6,14.7,16.1,20.0,0.097,0.099,0.063,0.133,1,3600.0,189.2,144.5,44.7,677.1,189.2,299.1,254.0,194.0,60.0,677.1,254.0,401.6,Vitis vinifera L.; Magnoliopsida; Olea europaea L.; Tracheophyta
2008,2008-07-08,Setúbal,Sesimbra,Sesimbra (castelo),JUNTO CENTRO HIPICO - CARRASQUEIRA (Castelo),38.4749148,-9.1111472,NC,105.0,2008-07-08T14:00,23.9,53,13.7,25.0,0.0,0.0,0.0,0.0,0,1017.6,1005.4,0,0,0,0,0.61,1.39,15.5,19.8,329,333,34.2,34.0,23.0,21.6,18.4,0.046,0.1,0.16,0.189,1,3600.0,935.8,817.8,117.9,890.0,935.8,1216.0,960.0,839.0,121.0,890.0,960.0,1247.4,Pinus pinea L.; Magnoliopsida; Tracheophyta; Vitis vinifera L.; Pinus pinaster Aiton
2008,2008-11-21,Setúbal,Palmela,Quinta do Anjo,VILA AMELIA JT COCA COLA (Vila Amélia),38.5736272,-9.0142073,NC,44.0,2008-11-21T20:00,13.6,65,7.1,10.8,0.0,0.0,0.0,0.0,0,1024.6,1019.2,0,0,0,0,0.05,0.55,14.8,26.0,13,17,21.6,13.7,14.9,16.1,19.8,0.084,0.097,0.074,0.14,0,0.0,0.0,0.0,0.0,0.0,0.0,0.0,0.0,0.0,0.0,0.0,0.0,0.0,Vitis vinifera L.; Pinus pinaster Aiton; Magnoliopsida; Tracheophyta
2008,2008-11-11,Setúbal,Sesimbra,Quinta do Conde,EN 10 - JT PINGO DOCE (Quinta do Conde),38.5724611,-9.0370259,NC,21.0,2008-11-11T19:00,14.0,78,10.2,11.3,0.0,0.0,0.0,0.0,3,1022.7,1020.1,98,65,65,0,0.03,0.35,19.0,27.8,341,343,30.2,15.0,15.8,17.0,20.4,0.15,0.107,0.075,0.141,0,0.0,0.0,0.0,0.0,0.0,0.0,0.0,0.0,0.0,0.0,0.0,0.0,0.0,Tracheophyta; Magnoliopsida
2008,2008-11-27,Setúbal,Santiago do Cacém,Santo André,Bº DOS PICAPAUS (SANTO ANDRÉ),38.0554645,-8.8008697,NC,35.0,2008-11-27T14:00,14.3,41,1.4,10.5,0.0,0.0,0.0,,0,1017.5,1013.3,0,0,0,0,0.27,0.96,13.4,15.7,14,16,28.1,16.1,12.1,14.9,17.6,0.031,0.068,0.078,0.125,1,3600.0,452.7,379.9,72.8,853.8,452.7,625.3,485.0,407.0,78.0,853.8,485.0,669.8,Pinus pinea L.; Pinus pinaster Aiton; Magnoliopsida; Quercus suber L.; Tracheophyta; Oryza sativa L.; Eucalyptus L'Hér.; Vitis vinifera L.; 
2008,2008-06-20,Setúbal,Seixal,Aldeia de Paio Pires,FOROS DA CATRAPONA JT SOCATEIRO (Foros da Catrapona),38.589562,-9.0784934,NC,36.0,2008-06-20T19:00,23.9,65,16.8,23.4,0.0,0.0,0.0,0.0,0,1016.9,1012.7,0,0,0,0,0.18,1.05,19.8,29.2,335,338,42.1,27.6,24.1,20.4,17.1,0.058,0.11,0.163,0.183,1,3600.0,131.9,91.2,40.7,509.7,131.9,237.0,201.0,139.0,62.0,509.7,201.0,361.2,Tracheophyta; Magnoliopsida; Pinus pinaster Aiton; Pinus pinea L.; Eucalyptus L'Hér.
2008,2008-06-26,Setúbal,Setúbal,São Lourenço,JT FABRICA DOS CARTUCHOS (SÃO LOURENÇO),38.5375781,-9.0176938,NC,75.0,2008-06-26T14:00,26.8,51,15.7,28.5,0.0,0.0,0.0,0.0,0,1017.5,1008.9,0,0,0,0,0.66,1.74,16.7,21.1,327,330,34.9,37.3,24.7,21.6,17.7,0.046,0.1,0.159,0.182,1,3600.0,940.8,827.8,113.0,899.2,940.8,1218.5,966.0,850.0,116.0,899.2,966.0,1251.1,Tracheophyta; Magnoliopsida
2008,2008-06-22,Setúbal,Seixal,Fernão Ferro,FOROS CATRAPONA JT REI COBRE (Foros da Catrapona),38.59528785,-9.071498732158208,NC,23.0,2008-06-22T12:00,26.9,49,15.4,29.4,0.0,0.0,0.0,0.0,0,1014.9,1012.2,0,0,0,0,0.66,1.8,11.2,12.7,303,315,23.0,31.9,23.3,20.8,17.3,0.056,0.107,0.161,0.183,1,3600.0,975.1,858.2,116.9,898.6,975.1,1264.5,951.0,837.0,114.0,898.6,951.0,1233.3,Tracheophyta; Magnoliopsida; Quercus rotundifolia Lam.; Pinus pinaster Aiton; Pinus pinea L.
2008,2008-07-08,Setúbal,Palmela,Quinta do Anjo,MONTE DAS PRETAS - OLHOS D´AGUA (Herdade do Monte Novo),38.5674568,-8.9418673,NC,95.0,2008-07-08T14:00,27.2,37,11.4,27.5,0.0,0.0,0.0,0.0,0,1017.6,1006.7,0,0,0,0,0.69,2.25,15.5,19.8,329,333,34.2,34.2,22.9,21.4,17.6,0.056,0.06,0.09,0.146,1,3600.0,935.4,817.5,117.9,890.8,935.4,1214.3,960.0,839.0,121.0,890.8,960.0,1246.2,Vitis vinifera L.; Tracheophyta; Olea europaea L.; Quercus suber L.
2008,2008-06-14,Setúbal,Almada,Charneca De Caparica,AROEIRA- JT AO DEPOSITO DA AGUA (Aroeira),38.6027834,-9.1863216,NC,71.0,2008-06-14T17:00,23.7,50,12.7,22.2,0.0,0.0,0.0,0.0,0,1016.8,1008.5,17,0,0,58,0.41,1.47,17.6,23.5,316,319,36.7,29.2,23.6,19.6,16.2,0.059,0.136,0.183,0.194,1,3600.0,510.9,406.6,104.3,750.4,510.9,718.5,588.0,468.0,120.0,750.4,588.0,826.9,Pinus pinea L.; Tracheophyta; Magnoliopsida; Pinus pinaster Aiton
2008,2008-06-14,Setúbal,Barreiro,Santo André,ESCOLA SEC 2+3 QT LOMBA (SANTO ANDRÉ),38.6399355,-9.059782286288504,NC,25.0,2008-06-14T16:00,26.0,41,11.8,25.0,0.0,0.0,0.0,0.0,0,1017.1,1014.2,17,0,0,57,0.54,1.97,17.4,22.4,310,314,35.6,31.8,24.3,20.2,16.7,0.06,0.124,0.171,0.184,1,3600.0,675.1,520.0,155.1,743.0,675.1,927.9,740.0,570.0,170.0,743.0,740.0,1017.1,Pinus pinea L.; Pinus pinaster Aiton; Magnoliopsida; Quercus suber L.; Tracheophyta; Oryza sativa L.; Eucalyptus L'Hér.; Vitis vinifera L.; 
2008,2008-07-08,Setúbal,Palmela,Quinta do Anjo,JT CEMITERIO QUINTA DO ANJO (QUINTA DO ANJO),38.5803261,-8.980884492896589,NC,46.0,2008-07-08T15:00,26.4,44,13.0,25.7,0.0,0.0,0.0,0.0,0,1017.1,1011.8,0,0,0,0,0.63,1.95,22.7,29.3,299,307,36.0,33.4,23.2,21.6,18.1,0.053,0.07,0.112,0.153,1,3600.0,839.6,733.6,106.0,882.6,839.6,1099.7,887.0,775.0,112.0,882.6,887.0,1161.8,Vitis vinifera L.; Tracheophyta; Eucalyptus L'Hér.; Magnoliopsida; Pinus pinaster Aiton; Quercus suber L.
2008,2008-01-28,Setúbal,Seixal,Arrentela,JT ANTIGO ARMZ SAGRES - PINHAL FRADES (ARRENTELA),38.6366418,-9.1003848,NC,33.0,2008-01-28T17:00,16.2,56,7.4,14.8,0.0,0.0,0.0,0.0,1,1028.2,1024.2,34,0,42,31,0.1,0.81,4.8,9.0,347,5,12.6,16.1,13.5,13.8,16.0,0.169,0.188,0.152,0.183,1,3600.0,118.8,81.7,37.0,564.4,118.8,204.3,186.0,128.0,58.0,564.4,186.0,319.9,Tracheophyta; Pinus pinea L.; Magnoliopsida
2008,2008-12-11,Setúbal,Almada,Pragal,TRASEIRAS ESTAÇAO METRO (Pragal),38.6662386,-9.1799968,NC,61.0,2008-12-11T15:00,13.5,66,7.3,10.3,0.0,0.0,0.0,0.0,3,1021.8,1014.4,100,81,56,0,0.14,0.52,17.2,23.1,303,304,31.3,13.4,12.0,14.3,17.9,0.295,0.286,0.199,0.271,1,3600.0,208.7,128.2,80.6,393.8,208.7,459.3,241.0,148.0,93.0,393.8,241.0,530.3,Tracheophyta; Magnoliopsida
2008,2008-07-02,Setúbal,Seixal,Fernão Ferro,JT URBANIZAÇAO VILLA ALEGRE (Fernão Ferro),38.5640057,-9.094534,NC,69.0,2008-07-02T13:00,22.8,49,11.5,22.2,0.0,0.0,0.0,0.0,1,1017.0,1008.9,31,4,0,92,0.57,1.42,19.6,25.5,317,318,42.5,29.7,23.3,21.7,17.7,0.054,0.091,0.148,0.181,1,3600.0,910.1,663.1,247.0,690.3,910.1,1271.0,910.0,663.0,247.0,690.3,910.0,1270.8,Tracheophyta; Pinus pinaster Aiton; Magnoliopsida
2008,2008-06-29,Setúbal,Alcácer do Sal,Comporta,JT CAMPO FUT COMPORTA (Comporta),38.4397907,-8.8172644,NC,0.0,2008-06-29T01:00,21.3,63,14.1,21.1,0.0,0.0,0.0,0.0,0,1016.4,1016.4,0,0,0,0,0.05,0.93,10.8,20.5,330,342,18.7,22.5,28.1,23.5,18.4,0.043,0.092,0.155,0.175,0,0.0,0.0,0.0,0.0,0.0,0.0,0.0,0.0,0.0,0.0,0.0,0.0,0.0,Pinus pinaster Aiton; Pinus pinea L.; Eucalyptus L'Hér.; Magnoliopsida; Oryza sativa L.; Tracheophyta; Pinales; 
2008,2008-06-19,Setúbal,Almada,Sobreda,JT AO RESTAURANTE TEXUGO (SOBREDA),38.64280325,-9.181967483348847,NC,62.0,2008-06-19T15:00,24.5,41,10.6,24.0,0.0,0.0,0.0,0.0,0,1019.3,1012.1,0,0,0,0,0.62,1.8,17.8,21.9,328,335,30.2,31.0,21.6,19.7,16.6,0.06,0.125,0.177,0.194,1,3600.0,863.7,755.0,108.8,907.2,863.7,1102.3,913.0,798.0,115.0,907.2,913.0,1165.2,Tracheophyta; Magnoliopsida
2008,2008-06-20,Setúbal,Seixal,Aldeia de Paio Pires,PRQ INDUSTRIAL FOROS CATRAPONA (ALDEIA DE PAIO PIRES),38.6460299,-9.089757660657,NC,0.0,2008-06-20T14:00,28.1,51,17.1,30.9,0.0,0.0,0.0,0.0,0,1018.3,1018.3,0,0,0,0,0.67,1.85,13.2,16.5,325,328,31.0,33.9,23.3,20.6,17.3,0.058,0.111,0.164,0.183,1,3600.0,925.8,806.0,119.7,876.5,925.8,1217.9,951.0,828.0,123.0,876.5,951.0,1251.1,Tracheophyta; Magnoliopsida
2008,2008-04-03,Setúbal,Sesimbra,Sesimbra (castelo),ALDEIA MECO (Aldeia do Meco),38.49240215,-9.11796389134298,NC,63.0,2008-04-03T21:00,16.9,70,11.4,16.0,0.0,0.0,0.0,0.0,0,1017.6,1010.1,4,0,0,15,0.02,0.58,8.9,14.0,317,325,13.7,17.9,19.2,15.4,14.8,0.072,0.159,0.199,0.19,0,0.0,0.0,0.0,0.0,0.0,0.0,0.0,0.0,0.0,0.0,0.0,0.0,0.0,Magnoliopsida; Quercus rotundifolia Lam.; Pinus pinaster Aiton; Tracheophyta
2008,2008-01-26,Setúbal,Sesimbra,Sesimbra (castelo),TRS PRQ CAMPISMO MAÇA (Castelo),38.4749148,-9.1111472,NC,105.0,2008-01-26T14:00,14.9,66,8.6,14.0,0.0,0.0,0.0,0.0,0,1031.5,1018.7,1,1,0,0,0.27,0.57,4.0,5.0,90,90,13.3,17.7,13.2,13.7,15.8,0.172,0.197,0.17,0.189,1,3600.0,495.1,409.7,85.4,810.4,495.1,713.4,516.0,427.0,89.0,810.4,516.0,743.6,Pinus pinea L.; Magnoliopsida; Tracheophyta; Vitis vinifera L.; Pinus pinaster Aiton
2008,2008-01-27,Setúbal,Sines,Sines,Vale da Roca,37.9574843,-8.812298931051298,NC,40.0,2008-01-27T13:00,15.7,61,8.3,14.0,0.0,0.0,0.0,0.0,0,1033.2,1028.3,2,0,0,5,0.29,0.69,8.4,10.5,80,82,21.6,16.5,12.5,14.0,16.1,0.178,0.199,0.179,0.182,1,3600.0,550.1,437.5,112.6,793.3,550.1,778.1,547.0,435.0,112.0,793.3,547.0,773.7,Tracheophyta; Pinus pinea L.; Pinus pinaster Aiton; Magnoliopsida
2008,2008-04-02,Setúbal,Palmela,Palmela,PADRE NABETO R SUCATA (Bairro do Padre Nabeto),38.5627915,-8.8766674,NC,58.0,2008-04-02T20:00,19.8,47,8.2,17.8,0.0,0.0,0.0,0.0,0,1021.0,1014.1,0,0,0,0,0.07,1.22,10.2,18.5,23,53,16.2,19.2,18.2,14.6,14.7,0.095,0.125,0.127,0.154,0,0.0,0.0,0.0,0.0,0.0,0.0,0.0,0.0,0.0,0.0,0.0,0.0,0.0,Vitis vinifera L.; ; Pinus pinea L.; Magnoliopsida; Tracheophyta; Olea europaea L.
2008,2008-04-05,Setúbal,Setúbal,Setúbal (são Julião),JT CAMPO FUTEBOL VARZEA (São Julião),38.5279518,-8.894774306731911,NC,6.0,2008-04-05T11:00,21.7,42,8.3,20.9,0.0,0.0,0.0,0.0,1,1012.5,1011.8,29,0,0,96,0.46,1.51,9.5,12.3,151,148,23.4,23.4,17.7,15.6,14.9,0.069,0.108,0.116,0.154,1,3600.0,778.3,605.1,173.2,780.4,778.3,1060.1,728.0,566.0,162.0,780.4,728.0,991.5,Tracheophyta; Magnoliopsida
2008,2008-06-28,Setúbal,Almada,Charneca De Caparica,Vale Fetal,38.6316288,-9.1792315,NC,47.0,2008-06-28T15:00,28.0,55,18.1,29.9,0.0,0.0,0.0,0.0,0,1016.4,1011.0,0,0,0,0,0.62,1.7,19.0,24.5,327,334,34.6,35.4,24.7,20.9,17.4,0.052,0.107,0.166,0.193,1,3600.0,841.7,733.8,107.9,879.4,841.7,1104.2,889.0,775.0,114.0,879.4,889.0,1166.2,Tracheophyta; Pinus pinaster Aiton; Magnoliopsida; Pinales; Eucalyptus L'Hér.
