2008,2008-06-07,Setúbal,Santiago do Cacém,Ermidas-Sado,JT ATERRO DAS ERMIDAS (ERMIDAS-SADO),38.0027881,-8.4141516,NC,79.0,2008-06-07T18:00,28.8,32,10.3,26.4,0.0,0.0,0.0,0.0,0,1013.9,1004.9,0,0,0,0,0.39,2.7,16.9,24.8,322,324,32.8,30.3,23.7,17.9,15.8,0.097,0.169,0.192,0.175,1,3600.0,300.9,236.3,64.6,689.8,300.9,454.8,382.0,300.0,82.0,689.8,382.0,577.5,Quercus suber L.; Tracheophyta; Eucalyptus L'Hér.; Pinus pinea L.; Olea europaea L.; Magnoliopsida; Quercus rotundifolia Lam.; 
2008,2008-11-26,Setúbal,Seixal,Fernão Ferro,R JORGE SENA JT LT 61A- PINHAL FRADES (Fernão Ferro),38.5640057,-9.094534,NC,69.0,2008-11-26T15:00,12.3,30,-4.8,6.5,0.0,0.0,0.0,0.0,0,1019.2,1010.8,0,0,0,0,0.25,1.0,20.4,28.1,41,41,38.5,14.8,12.6,15.8,19.3,0.081,0.107,0.092,0.166,1,3600.0,339.1,277.7,61.4,811.5,339.1,480.6,392.0,321.0,71.0,811.5,392.0,555.6,Tracheophyta; Pinus pinaster Aiton; Magnoliopsida
2008,2008-12-14,Setúbal,Grândola,Melides,ESTRADA PRQ CAMPISMO DA GALE (Estrada),38.12874205,-8.788642965319212,NC,15.0,2008-12-14T23:00,9.2,73,4.6,3.7,0.0,0.0,0.0,,0,1014.6,1012.8,13,7,11,0,0.05,0.32,28.7,38.3,333,333,45.7,12.0,12.9,13.7,15.2,0.086,0.075,0.041,0.061,0,0.0,0.0,0.0,0.0,0.0,0.0,0.0,0.0,0.0,0.0,0.0,0.0,0.0,Pinus pinaster Aiton; Magnoliopsida; Pinus pinea L.
2008,2008-03-30,Setúbal,Alcácer do Sal,Alcácer Do Sal (santiago),BRR FORNO DA CAL (Santiago),38.3717826,-8.507855987206362,NC,16.0,2008-03-30T09:00,15.3,79,11.7,13.0,0.0,0.0,0.0,0.0,3,1020.5,1018.6,100,89,22,67,0.13,0.36,19.2,27.1,264,265,36.0,15.0,14.6,14.5,15.0,0.132,0.173,0.172,0.188,1,3600.0,284.6,130.1,154.5,262.3,284.6,680.7,234.0,107.0,127.0,262.3,234.0,559.7,Olea europaea L.; Oryza sativa L.; Tracheophyta
2008,2008-10-23,Setúbal,Barreiro,Santo António da Charneca,IC32 ANTES SAIDA PENALVA (IC32 (IC32) Km 1),38.6246943,-9.031607,NC,52.0,2008-10-23T14:00,21.0,45,8.5,19.1,0.0,0.0,0.0,0.0,0,1017.5,1011.4,0,0,0,0,0.39,1.38,12.4,15.6,8,15,20.5,23.1,17.6,19.9,20.8,0.116,0.074,0.076,0.141,1,3600.0,565.2,480.3,84.9,845.5,565.2,785.3,599.0,509.0,90.0,845.5,599.0,832.3,Magnoliopsida; Tracheophyta; Quercus suber L.; Pinus pinaster Aiton; Pinus pinea L.; 
2008,2008-03-23,Setúbal,Sesimbra,Quinta do Conde,ESTR FONTAINHAS AV PARQUE VERDE (Quinta da Boa Estrela),38.5512344,-9.0530777,NC,58.0,2008-03-23T15:00,13.1,40,-0.1,7.4,0.0,0.0,0.0,0.0,0,1016.5,1009.5,1,1,0,0,0.37,0.9,30.5,38.7,353,355,53.6,16.3,13.1,14.0,14.7,0.187,0.197,0.191,0.183,1,3600.0,706.4,618.1,88.3,936.6,706.4,909.0,760.0,665.0,95.0,936.6,760.0,977.9,Pinus pinaster Aiton; Magnoliopsida; Tracheophyta
2008,2008-10-10,Setúbal,Alcochete,Alcochete,ESTRADA DA ATALAIA (ALCOCHETE),38.74885805,-8.972979556538611,NC,0.0,2008-10-10T11:00,23.5,49,12.2,20.6,0.0,0.0,0.0,0.0,0,1018.6,1018.6,8,0,0,26,0.42,1.48,25.6,35.7,62,64,52.6,21.2,18.7,19.8,20.1,0.22,0.19,0.196,0.235,1,3600.0,621.8,504.9,116.8,777.0,621.8,891.9,580.0,471.0,109.0,777.0,580.0,831.9,Tracheophyta
2008,2008-10-04,Setúbal,Setúbal,Setúbal (são Sebastião),AV BELO HORIZONTE JT DEPOSITO AGUA (Avenida Belo Horizonte),38.52734715,-8.85704211645389,NC,26.0,2008-10-04T12:00,22.8,23,0.5,21.2,0.0,0.0,0.0,0.0,0,1022.2,1019.1,6,0,0,19,0.49,2.15,5.9,7.7,76,79,17.6,25.6,18.6,21.5,21.3,0.089,0.063,0.063,0.135,1,3600.0,766.4,667.8,98.6,920.7,766.4,992.1,746.0,650.0,96.0,920.7,746.0,965.6,Tracheophyta; Pinus pinaster Aiton; Olea europaea L.; Magnoliopsida
2008,2008-08-31,Setúbal,Sesimbra,Sesimbra (castelo),SERRA ALMOINHA- JT QTA SALGADOS (Aldeamento Pé da Serra),38.49240215,-9.11796389134298,NC,63.0,2008-08-31T16:00,22.4,63,14.9,22.0,0.0,0.0,0.0,0.0,0,1019.3,1011.9,0,0,0,0,0.39,1.01,16.4,20.9,299,302,31.0,32.0,24.1,22.7,21.4,0.05,0.072,0.126,0.181,1,3600.0,559.9,473.7,86.2,817.2,559.9,778.5,630.0,533.0,97.0,817.2,630.0,876.0,Magnoliopsida; Quercus rotundifolia Lam.; Pinus pinaster Aiton; Tracheophyta
2008,2008-12-06,Setúbal,Santiago do Cacém,Santo André,MONTE DOS NAMORADOS (Barranco do Monte Novo de Besteiros),38.065594950000005,-8.778572225777431,NC,27.0,2008-12-06T18:00,14.6,96,14.0,13.6,0.0,0.0,0.0,,3,1020.6,1017.3,100,26,88,94,0.01,0.06,15.8,25.7,221,227,24.5,14.7,14.6,13.9,16.9,0.154,0.133,0.08,0.125,0,0.0,0.0,0.0,0.0,0.0,0.0,0.0,1.0,0.0,1.0,0.0,1.0,11.1,Pinus pinea L.; Pinus pinaster Aiton; Magnoliopsida; Quercus suber L.; Tracheophyta; Oryza sativa L.; Eucalyptus L'Hér.; Vitis vinifera L.; 
2008,2008-12-17,Setúbal,Barreiro,Santo António da Charneca,Cidade Sol,38.6209119,-9.0345137,NC,52.0,2008-12-17T10:00,11.7,86,9.4,9.7,0.0,0.0,0.0,0.0,2,1023.1,1016.7,54,0,49,82,0.07,0.2,12.8,18.0,320,323,19.8,10.8,10.6,13.5,18.2,0.186,0.167,0.076,0.14,1,3600.0,193.1,74.0,119.1,233.9,193.1,446.9,154.0,59.0,95.0,233.9,154.0,356.4,Magnoliopsida; Tracheophyta; Quercus suber L.; Pinus pinaster Aiton; Pinus pinea L.; 
2008,2008-11-09,Setúbal,Grândola,Grândola,BREJOS SECO - FERRARIAS (Brejos da Água Derramada),38.2058609,-8.4454817,NC,99.0,2008-11-09T15:00,19.7,41,6.0,17.9,0.0,0.0,0.0,0.0,0,1027.6,1015.8,0,0,0,0,0.27,1.36,5.9,7.4,43,47,16.6,19.8,13.5,16.2,20.4,0.148,0.113,0.064,0.114,1,3600.0,381.1,314.9,66.3,809.2,381.1,542.7,437.0,361.0,76.0,809.2,437.0,622.2,Quercus suber L.; Tracheophyta; Pinus pinea L.
2008,2008-12-22,Setúbal,Almada,Trafaria,ESTRADA MILITAR DO PORTINHO (TRAFARIA),38.66186915,-9.226016510778402,NC,48.0,2008-12-22T12:00,14.1,62,6.8,11.4,0.0,0.0,0.0,0.0,0,1026.9,1021.1,8,0,0,26,0.22,0.62,13.0,17.4,109,112,21.6,13.1,11.2,13.3,17.2,0.289,0.292,0.206,0.271,1,3600.0,451.0,364.8,86.2,793.2,451.0,650.1,429.0,347.0,82.0,793.2,429.0,618.4,Magnoliopsida; Tracheophyta
2008,2008-10-11,Setúbal,Almada,Trafaria,JT CAMPO FUTEBOL PEPITA- S. JOÃO (Bairro São João da Sobreda),38.66186915,-9.226016510778402,NC,48.0,2008-10-11T09:00,18.8,82,15.7,18.3,1.6,1.6,0.0,0.0,61,1014.4,1008.7,100,19,96,98,0.09,0.38,16.9,28.0,78,82,36.4,19.0,20.3,20.1,20.9,0.267,0.17,0.196,0.276,1,0.0,125.6,5.0,120.6,12.2,125.6,564.2,100.0,4.0,96.0,12.2,100.0,449.1,Magnoliopsida; Tracheophyta
2008,2008-03-06,Setúbal,Sesimbra,Sesimbra (castelo),CARRASQUEIRA JT ESCOLA EQUITAÇAO (Carrasqueira),38.48576415,-9.102601462884303,NC,102.0,2008-03-06T16:00,14.1,41,1.0,10.9,0.0,0.0,0.0,0.0,0,1024.0,1011.7,0,0,0,0,0.29,0.95,8.6,11.3,15,17,22.0,18.0,13.6,14.3,14.8,0.155,0.207,0.219,0.189,1,3600.0,476.4,403.4,73.0,871.5,476.4,643.4,548.0,464.0,84.0,871.5,548.0,740.0,Pinus pinaster Aiton; Tracheophyta; Magnoliopsida; Pinus pinea L.
2008,2008-06-10,Setúbal,Almada,Sobreda,ESTRADA ESTALEIROS CAMARA (SOBREDA),38.64280325,-9.181967483348847,NC,62.0,2008-06-10T12:00,23.2,46,10.8,23.7,0.0,0.0,0.0,0.0,1,1017.4,1010.2,33,4,49,0,0.6,1.55,13.2,17.4,17,24,25.9,27.3,20.4,18.4,16.0,0.081,0.153,0.189,0.195,1,3600.0,962.0,837.0,125.0,877.1,962.0,1266.3,939.0,817.0,122.0,877.1,939.0,1236.1,Tracheophyta; Magnoliopsida
2008,2008-04-05,Setúbal,Santiago do Cacém,Santo André,PARQUE CENTRAL (Parque de Campismo),38.065594950000005,-8.778572225777431,NC,27.0,2008-04-05T01:00,14.5,81,11.2,14.0,0.0,0.0,0.0,,0,1014.4,1011.2,0,0,0,0,0.0,0.32,6.0,11.0,197,229,11.2,14.9,17.7,15.4,14.3,0.035,0.112,0.146,0.14,0,0.0,0.0,0.0,0.0,0.0,0.0,0.0,0.0,0.0,0.0,0.0,0.0,0.0,Pinus pinea L.; Pinus pinaster Aiton; Magnoliopsida; Quercus suber L.; Tracheophyta; Oryza sativa L.; Eucalyptus L'Hér.; Vitis vinifera L.; 
2008,2008-05-17,Setúbal,Seixal,Aldeia de Paio Pires,A-2 KM 19 N/S (ALDEIA DE PAIO PIRES),38.6460299,-9.089757660657,NC,0.0,2008-05-17T12:00,18.9,58,10.5,17.8,0.0,0.0,0.0,0.0,2,1013.4,1013.4,58,35,44,0,0.44,0.91,16.8,21.7,332,333,37.4,21.4,17.4,17.2,15.9,0.193,0.159,0.201,0.186,1,3600.0,805.8,516.1,289.8,550.7,805.8,1253.5,787.0,504.0,283.0,550.7,787.0,1224.2,Tracheophyta; Magnoliopsida
2008,2008-10-05,Setúbal,Seixal,Corroios,Alto do Moinho,38.6406303,-9.1555128,NC,15.0,2008-10-05T09:00,16.4,57,7.8,14.3,0.0,0.0,0.0,0.0,0,1020.4,1018.6,0,0,0,0,0.18,0.81,10.9,13.8,27,28,21.2,16.9,18.4,20.9,21.3,0.087,0.069,0.104,0.18,1,3600.0,391.4,309.4,82.0,714.0,391.4,593.0,315.0,249.0,66.0,714.0,315.0,477.2,Tracheophyta
2008,2008-11-14,Setúbal,Almada,Caparica,JT ESCOLA BASICA RAPOSO DE CIMA (CAPARICA),38.6763403,-9.211800839693492,NC,3.0,2008-11-14T21:00,13.0,73,8.2,10.8,0.0,0.0,0.0,0.0,0,1024.6,1024.2,0,0,0,0,0.03,0.41,12.3,20.3,21,33,19.1,13.2,14.9,16.6,20.0,0.241,0.233,0.195,0.273,0,0.0,0.0,0.0,0.0,0.0,0.0,0.0,0.0,0.0,0.0,0.0,0.0,0.0,Magnoliopsida; Tracheophyta; Pinus pinaster Aiton
2008,2008-05-02,Setúbal,Grândola,Carvalhal,SOL TROIA (Soltroia),38.4930105,-8.900993,NC,6.0,2008-05-02T11:00,21.1,46,9.2,20.6,0.0,0.0,0.0,0.0,0,1016.9,1016.2,2,0,0,8,0.5,1.34,11.7,14.4,169,167,23.4,22.2,16.3,16.5,15.3,0.116,0.161,0.163,0.153,1,3600.0,848.1,652.4,195.6,759.1,848.1,1157.8,802.0,617.0,185.0,759.1,802.0,1094.9,Pinus pinaster Aiton; Magnoliopsida; Tracheophyta
2008,2008-06-13,Setúbal,Seixal,Aldeia de Paio Pires,FOROS DA CATRAPONA- POR TRAZ DA PIONIER (Foros da Catrapona),38.589562,-9.0784934,NC,36.0,2008-06-13T16:00,26.9,47,14.7,26.7,0.0,0.0,0.0,0.0,0,1014.7,1010.6,1,0,1,0,0.55,1.88,19.2,25.5,308,310,40.3,32.6,24.7,19.8,16.6,0.062,0.127,0.173,0.184,1,3600.0,675.8,579.1,96.7,828.5,675.8,926.9,741.0,635.0,106.0,828.5,741.0,1016.3,Tracheophyta; Magnoliopsida; Pinus pinaster Aiton; Pinus pinea L.; Eucalyptus L'Hér.
2008,2008-10-06,Setúbal,Santiago do Cacém,Santo André,JT PRAIA DAS ESCARRETAS (SANTO ANDRÉ),38.0554645,-8.8008697,Desconhecida,35.0,2008-10-06T03:00,13.3,79,9.7,11.7,0.0,0.0,0.0,,0,1020.1,1015.9,0,0,0,0,0.01,0.32,10.4,13.0,2,6,13.7,13.9,18.4,19.8,21.2,0.053,0.095,0.087,0.127,0,0.0,0.0,0.0,0.0,0.0,0.0,0.0,0.0,0.0,0.0,0.0,0.0,0.0,Pinus pinea L.; Pinus pinaster Aiton; Magnoliopsida; Quercus suber L.; Tracheophyta; Oryza sativa L.; Eucalyptus L'Hér.; Vitis vinifera L.; 
2008,2008-06-29,Setúbal,Seixal,Arrentela,AV 25 ABRIL- JT FARMÁCIA (ARRENTELA),38.6366418,-9.1003848,NC,33.0,2008-06-29T13:00,26.2,54,16.2,26.3,0.0,0.0,0.0,0.0,0,1017.3,1013.5,16,0,0,52,0.42,1.55,14.0,17.6,325,329,31.3,32.3,24.8,21.6,17.7,0.053,0.095,0.152,0.182,1,3600.0,539.9,464.9,75.0,483.8,539.9,1271.8,540.0,465.0,75.0,483.8,540.0,1272.0,Tracheophyta; Pinus pinea L.; Magnoliopsida
2008,2008-06-29,Setúbal,Seixal,Aldeia de Paio Pires,Alto dos Bonecos,38.6147747,-9.0848565,NC,31.0,2008-06-29T19:00,23.4,59,15.0,22.6,0.0,0.0,0.0,0.0,1,1016.0,1012.4,29,0,0,98,0.18,1.17,16.6,24.2,304,314,28.8,27.9,25.8,21.7,17.8,0.053,0.095,0.151,0.182,1,3600.0,113.6,50.8,62.7,278.8,113.6,241.3,172.0,77.0,95.0,278.8,172.0,365.5,Tracheophyta; Magnoliopsida
2008,2008-10-17,Setúbal,Almada,Charneca De Caparica,R ADRIANO CORREIA (CHARNECA DA CAPARICA),38.6240928,-9.195750238809074,NC,76.0,2008-10-17T02:00,17.5,98,17.2,19.0,0.0,0.0,0.0,0.0,3,1020.1,1011.0,100,100,1,98,0.0,0.04,8.1,15.1,328,335,10.8,17.9,19.4,19.8,20.7,0.136,0.084,0.102,0.179,0,0.0,0.0,0.0,0.0,0.0,0.0,0.0,0.0,0.0,0.0,0.0,0.0,0.0,Tracheophyta; Pinus pinaster Aiton; Magnoliopsida; Pinales
2008,2008-05-08,Setúbal,Barreiro,Santo António da Charneca,JUNTO RESTAURANTE ACORDEON (SANTO ANTÓNIO DA CHARNECA),38.5908586,-9.0198109,NC,64.0,2008-05-08T14:00,18.2,66,11.9,15.8,0.0,0.0,0.0,0.0,0,1012.7,1005.1,18,16,6,0,0.38,0.7,26.2,33.0,323,324,45.4,22.7,18.7,17.1,15.2,0.089,0.145,0.178,0.159,1,3600.0,717.9,457.3,260.6,520.6,717.9,1179.6,741.0,472.0,269.0,520.6,741.0,1217.6,Magnoliopsida; Tracheophyta; Quercus suber L.; Pinus pinaster Aiton; Pinus pinea L.; 
2008,2008-04-02,Setúbal,Setúbal,Sado,JT RUA TOMAS RIBEIRO - PRAIAS DO SADO (Sado),38.5178828,-8.838019632255051,NC,6.0,2008-04-02T16:00,25.3,31,7.1,23.5,0.0,0.0,0.0,0.0,0,1021.0,1020.3,0,0,0,0,0.46,2.21,10.4,15.5,88,90,19.4,30.0,18.7,15.0,14.8,0.055,0.143,0.167,0.178,1,3600.0,554.2,473.8,80.4,856.8,554.2,757.2,627.0,536.0,91.0,856.8,627.0,856.7,Quercus suber L.; Tracheophyta; Eucalyptus L'Hér.; Pinus pinea L.; Olea europaea L.; Magnoliopsida; Quercus rotundifolia Lam.; 
2008,2008-04-02,Setúbal,Alcácer do Sal,Alcácer Do Sal (santiago),E.N.253 ALCACER/MONTEMOR (Santiago),38.3717826,-8.507855987206362,NC,16.0,2008-04-02T20:00,20.8,47,9.1,19.7,0.0,0.0,0.0,0.0,0,1020.8,1018.9,0,0,0,0,0.04,1.3,5.8,10.8,112,116,11.9,20.2,18.9,15.0,15.0,0.105,0.161,0.169,0.188,0,0.0,0.0,0.0,0.0,0.0,0.0,0.0,0.0,0.0,0.0,0.0,0.0,0.0,Olea europaea L.; Oryza sativa L.; Tracheophyta
2008,2008-06-04,Setúbal,Sesimbra,Sesimbra (castelo),AIANA,38.4745204,-9.1395983,NC,88.0,2008-06-04T23:00,14.8,78,10.9,12.6,0.0,0.0,0.0,0.0,0,1021.7,1011.1,3,0,0,10,0.03,0.37,16.6,27.7,338,339,31.7,16.0,19.3,17.7,16.2,0.091,0.157,0.195,0.193,0,0.0,0.0,0.0,0.0,0.0,0.0,0.0,0.0,0.0,0.0,0.0,0.0,0.0,Tracheophyta; Magnoliopsida; Pinus pinea L.
2008,2008-11-18,Setúbal,Grândola,Carvalhal,CARVAHAL- BREJINHO AGUA (Carvalhal),38.3057634,-8.780952372059236,NC,0.0,2008-11-18T07:00,8.6,93,7.5,6.3,0.0,0.0,0.0,0.0,0,1022.4,1022.4,0,0,0,0,0.0,0.08,11.6,15.5,353,355,16.9,9.5,13.9,16.7,20.3,0.115,0.108,0.078,0.17,0,0.0,0.0,0.0,0.0,0.0,0.0,0.0,0.0,0.0,0.0,0.0,0.0,0.0,Tracheophyta; Pinus pinaster Aiton; Magnoliopsida; Oryza sativa L.
2008,2008-03-29,Setúbal,Almada,Charneca De Caparica,AROEIRA- R SARA AFONSO LT.23 (Aroeira),38.6027834,-9.1863216,NC,71.0,2008-03-29T16:00,16.4,68,10.5,14.2,0.0,0.0,0.0,0.0,0,1017.2,1008.7,2,0,0,7,0.31,0.6,18.9,25.2,310,312,36.7,20.2,15.9,13.9,14.3,0.15,0.186,0.202,0.192,1,3600.0,551.5,469.3,82.2,861.3,551.5,747.9,624.0,531.0,93.0,861.3,624.0,846.2,Pinus pinea L.; Tracheophyta; Magnoliopsida; Pinus pinaster Aiton
2008,2008-09-07,Setúbal,Almada,Caparica,BRR AMARELO (CAPARICA),38.6763403,-9.211800839693492,NC,3.0,2008-09-07T19:00,19.4,64,12.3,17.9,0.0,0.0,0.0,0.0,0,1013.3,1012.9,2,0,0,6,0.08,0.82,15.1,20.8,322,323,26.6,22.4,22.4,22.0,21.0,0.227,0.163,0.206,0.279,0,1882.7,0.0,0.0,0.0,0.0,0.0,0.0,49.0,29.0,20.0,230.7,49.0,110.6,Magnoliopsida; Tracheophyta; Pinus pinaster Aiton
2008,2008-03-13,Setúbal,Sesimbra,Sesimbra (castelo),QUINTA DE CALHARIZ (Quinta da Boa Estrela),38.49240215,-9.11796389134298,NC,63.0,2008-03-13T17:00,17.1,74,12.5,16.6,0.0,0.0,0.0,0.0,1,1017.8,1010.3,29,0,0,96,0.17,0.5,8.7,10.0,300,300,18.4,20.3,16.7,14.6,15.0,0.137,0.183,0.213,0.19,1,3600.0,250.9,136.0,114.8,424.1,250.9,444.2,319.0,173.0,146.0,424.1,319.0,564.9,Magnoliopsida; Quercus rotundifolia Lam.; Pinus pinaster Aiton; Tracheophyta
2008,2008-03-05,Setúbal,Setúbal,São Simão,BREJOS DE AZEITÃO - CHOILO (Brejos de Azeitão),38.5397077,-9.0259042,NC,65.0,2008-03-05T16:00,14.8,36,-0.1,9.5,0.0,0.0,0.0,0.0,0,1027.5,1019.6,0,0,0,0,0.32,1.07,21.7,27.6,32,33,34.9,17.3,14.1,14.8,15.1,0.157,0.206,0.203,0.183,1,3600.0,469.6,398.5,71.2,871.5,469.6,635.8,541.0,459.0,82.0,871.5,541.0,732.4,Tracheophyta; Magnoliopsida; Pinus pinaster Aiton; Quercus suber L.
2008,2008-06-17,Setúbal,Seixal,Corroios,R DAS AZINHEIRAS- ALTO DO MOINHO (CORROIOS),38.6364997,-9.1517196,NC,18.0,2008-06-17T16:00,21.5,54,11.7,19.1,0.0,0.0,0.0,0.0,0,1016.3,1014.2,0,0,0,0,0.46,1.18,26.9,34.0,332,333,45.0,27.6,22.0,20.1,16.8,0.066,0.13,0.18,0.194,1,3600.0,700.4,600.9,99.5,854.2,700.4,932.1,767.0,658.0,109.0,854.2,767.0,1020.7,Tracheophyta; Pinus pinea L.
2008,2008-11-20,Setúbal,Palmela,Pinhal Novo,SALGUEIRINHA,38.6494756,-8.88188565445473,NC,17.0,2008-11-20T19:00,14.7,49,4.2,11.6,0.0,0.0,0.0,0.0,0,1022.4,1020.3,0,0,0,0,0.06,0.85,11.7,24.7,34,43,20.5,14.6,15.1,16.2,20.1,0.096,0.099,0.063,0.133,0,0.0,0.0,0.0,0.0,0.0,0.0,0.0,0.0,0.0,0.0,0.0,0.0,0.0,Vitis vinifera L.; Quercus suber L.; Tracheophyta; Magnoliopsida
2008,2008-06-11,Setúbal,Seixal,Amora,JT RESTAURANTE CABAÇA (AMORA),38.629209,-9.1171074,NC,19.0,2008-06-11T12:00,26.1,46,13.6,28.6,0.0,0.0,0.0,0.0,0,1018.4,1016.2,0,0,0,0,0.64,1.83,6.8,8.5,3,12,20.5,31.1,21.9,19.2,16.6,0.073,0.137,0.177,0.184,1,3600.0,958.8,832.8,126.0,872.2,958.8,1266.6,936.0,813.0,123.0,872.2,936.0,1236.6,Tracheophyta; Pinus pinea L.; Magnoliopsida
2008,2008-06-14,Setúbal,Seixal,Fernão Ferro,ZONA PRQ INDUSTRIAL JT PIONEER (Fernão Ferro),38.5640057,-9.094534,NC,69.0,2008-06-14T16:00,25.7,41,11.5,24.6,0.0,0.0,0.0,0.0,0,1017.1,1009.1,17,0,0,57,0.54,1.94,17.4,22.4,310,314,35.6,31.5,24.0,19.9,16.4,0.06,0.124,0.171,0.184,1,3600.0,675.1,520.0,155.1,742.9,675.1,927.9,740.0,570.0,170.0,742.9,740.0,1017.1,Tracheophyta; Pinus pinaster Aiton; Magnoliopsida
2008,2008-10-17,Setúbal,Montijo,Montijo,ESTR REAL (Estrada do Vau),38.7060845,-8.9746372,NC,6.0,2008-10-17T03:00,18.0,97,17.4,19.6,0.0,0.0,0.0,0.0,3,1019.5,1018.8,100,100,1,94,0.0,0.07,7.3,13.5,340,344,11.2,19.1,20.0,20.3,20.7,0.233,0.204,0.195,0.235,0,0.0,0.0,0.0,0.0,0.0,0.0,0.0,0.0,0.0,0.0,0.0,0.0,0.0,Tracheophyta
2008,2008-10-19,Setúbal,Montijo,Montijo,ESTRADA PENAS JT GESTIPONTE (Estrada do Vau),38.7060845,-8.9746372,NC,6.0,2008-10-19T06:00,14.2,96,13.6,14.3,0.0,0.0,0.0,0.0,0,1016.2,1015.5,15,16,1,0,0.0,0.07,7.4,15.3,23,27,13.7,16.8,19.0,20.2,20.7,0.229,0.204,0.195,0.235,0,0.0,0.0,0.0,0.0,0.0,0.0,0.0,0.0,0.0,0.0,0.0,0.0,0.0,Tracheophyta
2008,2008-05-09,Setúbal,Sesimbra,Sesimbra (castelo),FACHO DA AZOIA (FACHO),38.4591222,-9.0966418,NC,223.0,2008-05-09T17:00,14.8,60,7.2,10.9,0.0,0.0,0.0,0.0,1,1012.5,986.1,37,15,31,15,0.25,0.67,21.7,29.6,312,312,46.1,20.5,17.7,16.6,14.5,0.076,0.156,0.21,0.185,1,3600.0,411.5,320.7,90.8,666.2,411.5,646.2,485.0,378.0,107.0,666.2,485.0,761.6,Tracheophyta; Magnoliopsida; Pinus pinaster Aiton
2008,2008-06-14,Setúbal,Seixal,Fernão Ferro,TRAZEIRAS DO REI DO COBRE (Fernão Ferro),38.5640057,-9.094534,NC,69.0,2008-06-14T17:00,24.9,44,11.6,23.0,0.0,0.0,0.0,0.0,0,1016.8,1008.8,17,0,0,58,0.44,1.78,17.6,23.5,316,319,36.7,30.2,24.1,19.9,16.4,0.06,0.124,0.171,0.184,1,3600.0,510.6,406.4,104.2,752.1,510.6,716.3,588.0,468.0,120.0,752.1,588.0,825.0,Tracheophyta; Pinus pinaster Aiton; Magnoliopsida
2008,2008-06-30,Setúbal,Seixal,Fernão Ferro,R FRANCISCO COSTA (Fernão Ferro),38.5640057,-9.094534,NC,69.0,2008-06-30T15:00,29.0,35,11.9,28.8,0.0,0.0,0.0,0.0,0,1016.7,1008.8,0,0,0,0,0.7,2.62,18.0,23.2,327,330,35.6,35.7,24.9,21.5,17.6,0.053,0.093,0.15,0.182,1,3600.0,856.7,749.7,107.0,899.3,856.7,1103.1,905.0,792.0,113.0,899.3,905.0,1165.3,Tracheophyta; Pinus pinaster Aiton; Magnoliopsida
2008,2008-03-05,Setúbal,Seixal,Amora,JUNTO FERTAGUS DO FOGUETEIRO (AMORA),38.629209,-9.1171074,NC,19.0,2008-03-05T14:00,14.2,39,0.4,10.8,0.0,0.0,0.0,0.0,0,1028.3,1026.0,0,0,0,0,0.39,0.99,16.8,22.1,45,46,36.4,16.8,13.6,14.8,15.1,0.185,0.212,0.202,0.183,1,3600.0,733.1,640.2,92.8,947.0,733.1,940.2,758.0,662.0,96.0,947.0,758.0,972.2,Tracheophyta; Pinus pinea L.; Magnoliopsida
2008,2008-11-27,Setúbal,Palmela,Pinhal Novo,Venda do Alcaide,38.6103929,-8.8864388,NC,40.0,2008-11-27T17:00,13.4,37,-1.1,9.4,0.0,0.0,0.0,0.0,0,1017.7,1012.9,0,0,0,0,0.1,0.97,11.1,20.4,335,339,24.5,14.0,12.0,15.6,19.6,0.078,0.092,0.063,0.133,1,2791.44,24.0,15.6,8.4,179.4,20.7,46.6,86.0,56.0,30.0,406.6,86.0,166.8,Vitis vinifera L.; Tracheophyta; Olea europaea L.
2008,2008-06-30,Setúbal,Barreiro,Santo António da Charneca,JT PORTAO NATO (SANTO ANTÓNIO DA CHARNECA),38.5908586,-9.0198109,NC,64.0,2008-06-30T15:00,30.7,28,10.3,29.1,0.0,0.0,0.0,0.0,0,1017.4,1010.1,0,0,0,0,0.76,3.16,22.6,29.5,338,342,37.1,36.9,25.3,21.5,17.4,0.052,0.074,0.12,0.154,1,3600.0,856.7,749.7,107.0,899.3,856.7,1103.1,905.0,792.0,113.0,899.3,905.0,1165.3,Magnoliopsida; Tracheophyta; Quercus suber L.; Pinus pinaster Aiton; Pinus pinea L.; 
2008,2008-06-30,Setúbal,Santiago do Cacém,Alvalade,EN 261- CRUZ DA MIMOSA (ALVALADE),37.9367312,-8.3830515,NC,49.0,2008-06-30T23:00,22.6,42,9.0,20.6,0.0,0.0,0.0,0.0,0,1017.4,1011.7,0,0,0,0,0.1,1.6,12.2,24.0,336,343,24.8,24.7,27.8,22.9,17.5,0.056,0.075,0.117,0.128,0,0.0,0.0,0.0,0.0,0.0,0.0,0.0,0.0,0.0,0.0,0.0,0.0,0.0,Olea europaea L.; Tracheophyta; Quercus suber L.; Quercus rotundifolia Lam.; Pinus pinea L.; Eucalyptus L'Hér.; Oryza sativa L.; Magnoliopsida; Vitis vinifera L.; 
2008,2008-06-10,Setúbal,Almada,Feijó,POR TRAZ DA R GOMES LEAL (Feijó),38.66001545,-9.17518149201292,NC,49.0,2008-06-10T21:00,19.6,70,14.0,17.9,0.0,0.0,0.0,0.0,0,1017.2,1011.4,1,0,1,0,0.07,0.68,20.3,33.1,353,358,33.1,20.9,21.3,18.4,16.1,0.224,0.269,0.296,0.291,0,0.0,0.0,0.0,0.0,0.0,0.0,0.0,0.0,0.0,0.0,0.0,0.0,0.0,Tracheophyta; Pinus pinea L.; Magnoliopsida
2008,2008-06-12,Setúbal,Seixal,Aldeia de Paio Pires,JT ALCOFUGICORA (ALDEIA DE PAIO PIRES),38.6460299,-9.089757660657,NC,0.0,2008-06-12T13:00,28.5,36,11.8,29.6,0.0,0.0,0.0,0.0,0,1017.1,1017.1,0,0,0,0,0.73,2.51,13.2,17.0,35,36,28.1,33.0,23.2,19.6,16.7,0.067,0.132,0.175,0.184,1,3600.0,983.4,861.6,121.8,897.5,983.4,1273.3,985.0,863.0,122.0,897.5,985.0,1275.4,Tracheophyta; Magnoliopsida
2008,2008-06-20,Setúbal,Setúbal,Setúbal (são Sebastião),AV BELO HORIZONTE (Avenida Belo Horizonte),38.52734715,-8.85704211645389,NC,26.0,2008-06-20T12:00,29.7,37,13.7,32.0,0.0,0.0,0.0,0.0,0,1019.0,1016.0,0,0,0,0,0.7,2.61,8.2,8.4,293,310,20.5,34.8,23.2,20.5,16.8,0.056,0.066,0.107,0.149,1,3600.0,961.2,838.2,123.0,876.7,961.2,1266.3,938.0,818.0,120.0,876.7,938.0,1235.8,Tracheophyta; Pinus pinaster Aiton; Olea europaea L.; Magnoliopsida
2008,2008-06-20,Setúbal,Seixal,Aldeia de Paio Pires,DPS BOMBAS AVIA CASAL MARCO (ALDEIA DE PAIO PIRES),38.6460299,-9.089757660657,NC,0.0,2008-06-20T16:00,27.3,56,17.8,28.4,0.0,0.0,0.0,0.0,0,1017.8,1017.8,0,0,0,0,0.53,1.59,18.1,23.5,329,333,38.2,33.0,23.9,20.6,17.3,0.058,0.111,0.164,0.183,1,3600.0,681.4,580.9,100.5,825.0,681.4,932.5,746.0,636.0,110.0,825.0,746.0,1021.0,Tracheophyta; Magnoliopsida
2008,2008-03-30,Setúbal,Alcácer do Sal,Santa Susana,Pego do Altar,38.3729735,-8.5122705,NC,50.0,2008-03-30T19:00,13.9,57,5.5,10.1,0.0,0.0,0.0,0.0,1,1024.0,1017.9,29,8,0,72,0.09,0.69,18.6,29.5,314,316,43.2,15.7,15.7,14.3,14.8,0.134,0.171,0.171,0.188,0,1812.16,0.0,0.0,0.0,0.0,0.0,0.0,46.0,26.0,20.0,209.7,46.0,110.4,Olea europaea L.; Oryza sativa L.; Tracheophyta
2008,2008-10-14,Setúbal,Almada,Charneca De Caparica,QT DA REGATEIRA (Quinta da Regateira),38.6363878,-9.1984786,NC,76.0,2008-10-14T12:00,21.3,66,14.6,21.8,0.0,0.0,0.0,0.0,0,1022.2,1013.2,1,0,0,2,0.39,0.87,10.8,13.1,345,351,22.7,23.3,18.5,19.8,20.7,0.168,0.083,0.103,0.179,1,3600.0,671.5,572.8,98.7,844.9,671.5,932.6,653.0,557.0,96.0,844.9,653.0,906.9,Magnoliopsida; Tracheophyta
2008,2008-09-19,Setúbal,Sesimbra,Quinta do Conde,AV DOS EMIGRANTES (Quinta do Conde),38.5724611,-9.0370259,Desconhecida,21.0,2008-09-19T22:00,22.2,73,17.2,24.0,0.2,0.2,0.0,0.0,51,1019.1,1016.6,27,0,19,51,0.01,0.72,5.8,12.2,330,326,9.7,22.8,23.0,21.8,21.1,0.059,0.062,0.079,0.144,0,0.0,0.0,0.0,0.0,0.0,0.0,0.0,0.0,0.0,0.0,0.0,0.0,0.0,Tracheophyta; Magnoliopsida
2008,2008-06-22,Setúbal,Seixal,Corroios,R QTA QUEIMADA (CORROIOS),38.6364997,-9.1517196,NC,18.0,2008-06-22T13:00,26.6,51,15.8,27.8,0.0,0.0,0.0,0.0,0,1015.6,1013.5,0,0,0,0,0.66,1.7,19.8,25.1,333,339,34.2,32.3,23.1,20.5,17.1,0.055,0.119,0.173,0.193,1,3600.0,970.5,840.6,129.9,873.8,970.5,1273.7,971.0,841.0,130.0,873.8,971.0,1274.4,Tracheophyta; Pinus pinea L.
2008,2008-03-31,Setúbal,Montijo,Pegões,BARRAGEM PEGÕES (Pegões),38.68008015,-8.591171494214755,NC,114.0,2008-03-31T19:00,14.6,55,5.6,10.9,0.0,0.0,0.0,0.0,0,1028.1,1014.3,0,0,0,0,0.1,0.76,18.2,30.4,333,336,32.0,15.7,14.8,13.6,14.0,0.08,0.136,0.128,0.156,0,1886.02,0.0,0.0,0.0,0.0,0.0,0.0,49.0,30.0,19.0,238.4,49.0,112.8,Pinus pinaster Aiton; Vitis vinifera L.; Pinus pinea L.; Tracheophyta; Quercus suber L.; Eucalyptus L'Hér.; Magnoliopsida; Olea europaea L.; Pinales; 
2008,2008-10-28,Setúbal,Palmela,Pinhal Novo,Vale da Vila,38.630096,-8.9128319,NC,39.0,2008-10-28T09:00,13.2,63,6.3,7.0,0.0,0.0,0.0,0.0,0,1013.4,1008.7,12,13,1,0,0.15,0.56,35.6,51.4,344,345,65.2,14.8,17.7,19.8,20.9,0.107,0.071,0.063,0.134,1,3600.0,270.4,192.0,78.4,554.3,270.4,480.2,207.0,147.0,60.0,554.3,207.0,367.6,Vitis vinifera L.; Magnoliopsida; Olea europaea L.; Tracheophyta
2008,2008-05-06,Setúbal,Sesimbra,Quinta do Conde,ANTES DO FERRO VELHO (Chã dos Navegantes),38.5512344,-9.0530777,NC,58.0,2008-05-06T18:00,21.2,61,13.3,19.2,0.0,0.0,0.0,0.0,0,1012.3,1005.5,2,0,0,6,0.24,0.99,20.6,30.2,348,351,32.8,23.1,19.7,16.9,15.2,0.117,0.171,0.213,0.186,1,3600.0,245.5,190.7,54.8,664.8,245.5,385.6,327.0,254.0,73.0,664.8,327.0,513.6,Pinus pinaster Aiton; Magnoliopsida; Tracheophyta
2008,2008-05-18,Setúbal,Grândola,Grândola,IC1 KM 615-6 - JT AZINHEIRAS DE BARROS / VALE DA ERA (GRÂNDOLA),38.1817962,-8.5544675,NC,91.0,2008-05-18T15:00,17.4,61,9.9,14.6,0.2,0.2,0.0,0.0,51,1013.5,1002.7,23,17,12,1,0.36,0.77,23.0,31.0,290,292,50.8,21.6,17.6,17.0,15.7,0.149,0.146,0.196,0.165,1,3600.0,626.3,441.3,185.0,554.1,626.3,1064.7,667.0,470.0,197.0,554.1,667.0,1133.9,Quercus suber L.; Tracheophyta; Magnoliopsida; Olea europaea L.
2008,2008-09-26,Setúbal,Seixal,Corroios,ZONA INDUSTRIAL SANTA MARTA (CORROIOS),38.6364997,-9.1517196,NC,18.0,2008-09-26T21:00,20.9,60,12.9,19.7,0.0,0.0,0.0,0.0,0,1016.6,1014.5,17,0,28,0,0.07,0.98,14.4,25.3,360,5,22.3,21.2,22.6,21.5,21.2,0.072,0.067,0.106,0.181,0,0.0,0.0,0.0,0.0,0.0,0.0,0.0,0.0,0.0,0.0,0.0,0.0,0.0,Tracheophyta; Pinus pinea L.
2008,2008-03-11,Setúbal,Almada,Caparica,JUNTO DEPOSITO DA AGUA DOS CAPUCHOS (CAPARICA),38.6763403,-9.211800839693492,NC,3.0,2008-03-11T00:00,13.9,87,11.7,12.4,0.0,0.0,0.0,0.0,2,1020.1,1019.7,70,53,0,76,0.01,0.21,14.3,23.2,311,312,26.3,13.5,14.1,14.3,15.1,0.308,0.31,0.307,0.29,0,0.0,0.0,0.0,0.0,0.0,0.0,0.0,0.0,0.0,0.0,0.0,0.0,0.0,Magnoliopsida; Tracheophyta; Pinus pinaster Aiton
2008,2008-06-01,Setúbal,Palmela,Quinta do Anjo,JUNTO RECTA DA LEAR (Monte dos Juntos),38.5674568,-8.9418673,NC,95.0,2008-06-01T12:00,19.5,58,10.9,17.4,0.0,0.0,0.0,0.0,3,1017.2,1006.0,92,71,46,0,0.36,0.96,16.6,21.4,318,319,35.3,21.4,17.4,16.8,15.6,0.149,0.114,0.138,0.151,1,3600.0,587.6,280.5,307.1,294.8,587.6,1265.6,574.0,274.0,300.0,294.8,574.0,1236.4,Vitis vinifera L.; Tracheophyta; Olea europaea L.; Quercus suber L.
2008,2008-06-16,Setúbal,Moita,Alhos Vedros,Quinta da Fonte da Prata,38.6547625,-9.0089043,NC,7.0,2008-06-16T04:00,17.9,86,15.5,18.0,0.0,0.0,0.0,0.0,1,1011.9,1011.1,32,25,16,0,0.01,0.28,12.3,20.5,267,271,24.1,20.7,22.5,21.4,19.1,0.186,0.206,0.235,0.244,0,0.0,0.0,0.0,0.0,0.0,0.0,0.0,0.0,0.0,0.0,0.0,0.0,0.0,Tracheophyta; Magnoliopsida
