2008,2008-05-09,Setúbal,Montijo,Pegões,TRASEIRAS DO CEMITERIO DE PEGOES (Pegões),38.68008015,-8.591171494214755,NC,114.0,2008-05-09T17:00,15.6,57,7.2,11.9,0.2,0.2,0.0,0.0,51,1012.0,998.5,48,23,40,11,0.24,0.76,20.6,28.4,303,303,42.8,19.9,18.3,17.3,14.8,0.105,0.139,0.175,0.154,1,3600.0,333.7,249.8,83.8,524.8,333.7,638.9,394.0,295.0,99.0,524.8,394.0,754.4,Pinus pinaster Aiton; Vitis vinifera L.; Pinus pinea L.; Tracheophyta; Quercus suber L.; Eucalyptus L'Hér.; Magnoliopsida; Olea europaea L.; Pinales; 
2008,2008-06-28,Setúbal,Alcácer do Sal,Comporta,JT AO CAMPO DA BOLA DA COMPORTA (Comporta),38.4397907,-8.8172644,NC,0.0,2008-06-28T19:00,28.8,46,16.1,28.9,0.0,0.0,0.0,0.0,0,1015.3,1015.3,0,0,0,0,0.23,2.13,14.0,20.1,282,299,27.7,34.1,29.1,23.4,18.4,0.043,0.092,0.155,0.175,1,3600.0,138.2,99.1,39.1,562.8,138.2,232.9,212.0,152.0,60.0,562.8,212.0,357.4,Pinus pinaster Aiton; Pinus pinea L.; Eucalyptus L'Hér.; Magnoliopsida; Oryza sativa L.; Tracheophyta; Pinales; 
2008,2008-07-08,Setúbal,Moita,Alhos Vedros,PINHAL DA PRETA (Pinhal do Forno),38.62511185,-8.998479129248048,NC,21.0,2008-07-08T00:00,17.2,70,11.8,15.2,0.0,0.0,0.0,0.0,0,1019.1,1016.6,2,0,0,8,0.05,0.58,18.0,31.0,358,359,34.6,18.8,22.9,21.8,18.2,0.053,0.07,0.113,0.153,0,0.0,0.0,0.0,0.0,0.0,0.0,0.0,0.0,0.0,0.0,0.0,0.0,0.0,Olea europaea L.; Tracheophyta; Magnoliopsida; Pinus pinaster Aiton
2008,2008-01-10,Setúbal,Santiago do Cacém,Alvalade,IC1 KM 624- RECTA DO ROXO (ALVALADE),37.9367312,-8.3830515,NC,49.0,2008-01-10T22:00,11.1,96,10.5,9.7,0.0,0.0,0.0,0.0,0,1022.0,1016.0,11,9,5,0,0.0,0.06,10.8,23.8,206,215,16.9,11.6,13.5,13.5,16.7,0.237,0.227,0.117,0.133,0,0.0,0.0,0.0,0.0,0.0,0.0,0.0,0.0,0.0,0.0,0.0,0.0,0.0,Olea europaea L.; Tracheophyta; Quercus suber L.; Quercus rotundifolia Lam.; Pinus pinea L.; Eucalyptus L'Hér.; Oryza sativa L.; Magnoliopsida; Vitis vinifera L.; 
2008,2008-06-21,Setúbal,Seixal,Fernão Ferro,JT IGREJA PINHAL FRADES (Fernão Ferro),38.5640057,-9.094534,NC,69.0,2008-06-21T08:00,20.4,77,16.2,21.6,0.0,0.0,0.0,0.0,0,1017.0,1008.9,0,0,0,0,0.2,0.56,6.9,9.3,9,13,18.7,22.1,22.1,20.3,16.9,0.058,0.11,0.163,0.183,1,3600.0,426.1,332.1,94.0,665.6,426.1,660.8,349.0,272.0,77.0,665.6,349.0,541.2,Tracheophyta; Pinus pinaster Aiton; Magnoliopsida
2008,2008-06-25,Setúbal,Seixal,Fernão Ferro,JT PAVIL (Fernão Ferro),38.5640057,-9.094534,NC,69.0,2008-06-25T00:00,16.9,76,12.7,15.2,0.0,0.0,0.0,0.0,0,1017.5,1009.3,0,0,0,0,0.04,0.46,17.8,31.4,353,356,32.8,18.6,22.7,20.8,17.2,0.055,0.103,0.158,0.183,0,0.0,0.0,0.0,0.0,0.0,0.0,0.0,0.0,0.0,0.0,0.0,0.0,0.0,Tracheophyta; Pinus pinaster Aiton; Magnoliopsida
2008,2008-01-31,Setúbal,Sesimbra,Sesimbra (castelo),FORNOS A SEGUIR ZINBROS (Fornos),38.49240215,-9.11796389134298,NC,63.0,2008-01-31T15:00,15.1,57,6.6,11.4,0.0,0.0,0.0,0.0,0,1026.9,1019.3,0,0,0,0,0.26,0.74,19.4,24.1,1,3,29.9,17.1,13.2,13.7,15.9,0.145,0.183,0.169,0.189,1,3600.0,445.7,373.1,72.6,841.3,445.7,625.1,491.0,411.0,80.0,841.3,491.0,688.6,Magnoliopsida; Quercus rotundifolia Lam.; Pinus pinaster Aiton; Tracheophyta
2008,2008-07-02,Setúbal,Seixal,Amora,JT ESCOLA C+S CRUZ PAU (AMORA),38.629209,-9.1171074,NC,19.0,2008-07-02T15:00,22.7,48,11.2,21.2,0.0,0.0,0.0,0.0,1,1016.9,1014.7,35,12,0,82,0.55,1.42,22.5,29.2,320,322,47.5,30.3,24.0,22.0,18.1,0.054,0.091,0.148,0.181,1,3600.0,818.9,653.3,165.7,783.8,818.9,1102.7,865.0,690.0,175.0,783.8,865.0,1164.7,Tracheophyta; Pinus pinea L.; Magnoliopsida
2008,2008-06-22,Setúbal,Setúbal,Setúbal (são Julião),TRAS LIDL (São Julião),38.5279518,-8.894774306731911,NC,6.0,2008-06-22T12:00,29.7,36,13.0,31.3,0.0,0.0,0.0,0.0,0,1014.9,1014.2,0,0,0,0,0.72,2.68,11.2,12.7,303,315,23.0,35.1,24.6,21.0,17.1,0.055,0.064,0.104,0.148,1,3600.0,974.9,858.0,116.9,897.9,974.9,1265.3,951.0,837.0,114.0,897.9,951.0,1234.3,Tracheophyta; Magnoliopsida
2008,2008-06-26,Setúbal,Barreiro,Coina,JT INSTALAÇÕES DA NATO- PENALVA (COINA),38.5846313,-9.0515846,NC,25.0,2008-06-26T14:00,27.9,50,16.4,30.1,0.0,0.0,0.0,0.0,0,1016.8,1013.9,0,0,0,0,0.68,1.89,15.1,18.4,298,309,26.3,34.2,23.9,21.1,17.6,0.054,0.1,0.156,0.182,1,3600.0,937.9,829.8,108.1,901.3,937.9,1218.5,963.0,852.0,111.0,901.3,963.0,1251.1,Magnoliopsida; Eucalyptus L'Hér.; Pinus pinaster Aiton; Pinus pinea L.; Tracheophyta; Quercus suber L.; Pinales; 
2008,2008-11-19,Setúbal,Almada,Pragal,R TRES VALES (Pragal),38.6662386,-9.1799968,NC,61.0,2008-11-19T17:00,16.8,48,5.7,13.4,0.0,0.0,0.0,0.0,0,1018.9,1011.6,0,0,0,0,0.12,1.0,15.9,26.1,25,35,29.5,16.5,14.8,15.8,19.4,0.216,0.226,0.195,0.273,1,3109.29,35.4,23.3,12.2,266.9,32.6,67.6,99.0,65.0,34.0,443.3,99.0,189.0,Tracheophyta; Magnoliopsida
2008,2008-05-15,Setúbal,Sesimbra,Quinta do Conde,ESTRADA PAVIL FRT DEPOSITO AGUA (Quinta do Conde),38.5724611,-9.0370259,NC,21.0,2008-05-15T08:00,15.3,88,13.3,14.6,0.2,0.2,0.0,0.0,51,1011.9,1009.4,100,95,89,43,0.07,0.21,12.1,15.4,217,217,22.0,15.9,16.8,17.2,15.7,0.101,0.13,0.171,0.159,1,922.26,138.8,43.4,95.5,90.7,138.8,640.2,112.0,35.0,77.0,90.7,112.0,516.4,Tracheophyta; Magnoliopsida
2008,2008-06-17,Setúbal,Montijo,Montijo,CAMINHO DE AREIA- ESTEVAL BRR AREIAS (MONTIJO),38.7060845,-8.9746372,NC,6.0,2008-06-17T15:00,24.2,44,11.3,23.9,0.0,0.0,0.0,0.0,0,1015.5,1014.8,0,0,0,0,0.59,1.69,17.1,22.2,321,324,38.2,27.9,22.9,21.8,19.7,0.189,0.204,0.234,0.243,1,3600.0,842.3,727.0,115.3,876.7,842.3,1098.8,891.0,769.0,122.0,876.7,891.0,1162.3,Tracheophyta
2008,2008-06-18,Setúbal,Sesimbra,Sesimbra (castelo),ESTR DAS PEDREIRAS (Quinta da Boa Estrela),38.49240215,-9.11796389134298,NC,63.0,2008-06-18T14:00,22.6,52,12.2,22.6,0.0,0.0,0.0,0.0,0,1018.3,1010.9,0,0,0,0,0.6,1.31,19.0,23.2,331,334,34.6,32.1,22.1,20.5,17.1,0.051,0.125,0.18,0.191,1,3600.0,954.9,838.1,116.8,911.0,954.9,1218.8,981.0,861.0,120.0,911.0,981.0,1252.1,Magnoliopsida; Quercus rotundifolia Lam.; Pinus pinaster Aiton; Tracheophyta
2008,2008-06-27,Setúbal,Almada,Feijó,Vale Mourelos,38.654983,-9.166009,NC,67.0,2008-06-27T16:00,26.9,57,17.6,27.2,0.0,0.0,0.0,0.0,0,1018.4,1010.7,0,0,0,0,0.54,1.53,24.3,32.7,336,341,41.0,30.0,23.7,20.3,17.0,0.157,0.21,0.272,0.289,1,3600.0,708.6,610.7,97.8,863.0,708.6,936.6,775.0,668.0,107.0,863.0,775.0,1024.4,Magnoliopsida; Tracheophyta; Pinus pinea L.
