2009,2009-10-16,Lisboa,Alenquer,Ribafria,Ribafria,39.06415665,-9.08696556489279,NC,138.0,2009-10-16T17:00,26.8,18,0.3,24.3,0.0,0.0,0.0,0.0,0,1015.9,1000.1,10,0,0,35,0.14,2.9,3.4,6.2,32,36,16.6,27.2,22.0,22.1,22.6,0.108,0.177,0.171,0.227,1,3600.0,143.2,106.1,37.1,629.1,143.2,232.3,220.0,163.0,57.0,629.1,220.0,356.8,Vitis vinifera L.; Tracheophyta; Pinales; Eucalyptus L'Hér.; Magnoliopsida
2009,2009-07-06,Lisboa,Cascais,Parede,S P DO ESTORIL (São João do Estoril),38.69741555,-9.331115878034677,NC,31.0,2009-07-06T14:00,21.3,52,11.0,19.1,0.0,0.0,0.0,0.0,2,1018.2,1014.5,56,30,0,96,0.54,1.21,28.0,34.8,336,337,47.5,25.2,21.8,21.1,18.0,0.188,0.198,0.234,0.271,1,3600.0,903.9,693.3,210.6,753.8,903.9,1216.9,927.0,711.0,216.0,753.8,927.0,1248.0,Magnoliopsida; Tracheophyta; Pinus pinea L.; Pinus pinaster Aiton; 
2009,2009-06-17,Lisboa,Sintra,Almargem do Bispo,VALE ALMORNOS (Azenha do Rio do Vale),38.8491202,-9.264334778649603,NC,283.0,2009-06-17T19:00,23.6,52,13.2,22.0,0.0,0.0,0.0,0.0,0,1017.0,984.5,4,0,0,14,0.21,1.39,17.7,27.6,343,348,35.6,27.4,24.3,19.2,15.3,0.108,0.183,0.24,0.259,1,3600.0,133.7,92.2,41.5,511.5,133.7,238.9,203.0,140.0,63.0,511.5,203.0,362.6,Tracheophyta; Magnoliopsida; Pinus pinaster Aiton; Eucalyptus L'Hér.; Vitis vinifera L.; 
2009,2009-05-28,Lisboa,Mafra,Venda do Pinheiro,CSL DA PANASQUEIRA (Casal da Panasqueira),38.92848,-9.2384452,Desconhecida,259.0,2009-05-28T16:00,28.5,23,5.5,25.8,0.0,0.0,0.0,0.0,0,1014.8,985.5,0,0,0,0,0.63,2.99,18.1,24.2,84,85,33.1,30.0,20.8,16.4,14.2,0.144,0.212,0.258,0.261,1,3600.0,685.2,589.8,95.4,864.8,685.2,908.4,754.0,649.0,105.0,864.8,754.0,999.6,Tracheophyta; Eucalyptus L'Hér.; Pinus pinaster Aiton; Pinales; Magnoliopsida
2009,2009-10-16,Lisboa,Vila Franca de Xira,São João dos Montes,TRANCOSO,38.9534953,-9.0721006,NC,233.0,2009-10-16T18:00,24.1,26,3.2,21.1,0.0,0.0,0.0,0.0,0,1016.4,989.6,3,0,0,11,0.12,2.23,9.3,20.8,62,72,22.0,24.1,21.6,21.4,21.8,0.107,0.173,0.174,0.23,0,1799.18,0.0,0.0,0.0,0.0,0.0,0.0,46.0,28.0,18.0,231.4,46.0,107.4,Magnoliopsida; Tracheophyta; Pinus pinaster Aiton; Vitis vinifera L.; Olea europaea L.; Eucalyptus L'Hér.; Pinales; 
2009,2009-10-08,Lisboa,Arruda dos Vinhos,Arruda dos Vinhos,Granja,38.99119885,-9.062929029605822,NC,72.0,2009-10-08T19:00,18.5,85,15.9,18.8,0.0,0.0,0.0,0.0,0,1018.7,1010.2,2,2,0,0,0.01,0.32,12.0,20.6,327,331,23.8,20.8,22.0,22.9,22.1,0.366,0.262,0.265,0.316,0,0.0,0.0,0.0,0.0,0.0,0.0,0.0,0.0,0.0,0.0,0.0,0.0,0.0,Vitis vinifera L.; Tracheophyta
2009,2009-10-10,Lisboa,Mafra,Milharado,Casais da Serra,38.9127427,-9.1807023,NC,198.0,2009-10-10T21:00,18.4,92,17.1,18.1,0.0,0.0,0.0,0.0,0,1021.5,998.1,10,11,0,1,0.01,0.17,19.5,33.5,356,359,35.6,19.3,20.7,21.6,21.6,0.226,0.179,0.182,0.244,0,0.0,0.0,0.0,0.0,0.0,0.0,0.0,0.0,0.0,0.0,0.0,0.0,0.0,Tracheophyta; Magnoliopsida; Pinus pinaster Aiton; Eucalyptus L'Hér.
2009,2009-07-07,Lisboa,Sintra,Algueirão-Mem Martins,AV ANASTACIO PINTO SOARES / ESTRADA VARGE MONDAR-PAIOES (Algueirão-Mem Martins),38.7977037,-9.341033451942735,NC,169.0,2009-07-07T15:00,20.8,58,12.4,19.1,0.0,0.0,0.0,0.0,0,1016.0,996.3,0,0,0,0,0.49,1.02,27.2,36.6,336,337,54.7,25.1,21.1,20.2,17.1,0.158,0.188,0.229,0.263,1,3600.0,839.5,727.7,111.8,872.6,839.5,1103.4,886.0,768.0,118.0,872.6,886.0,1164.6,Tracheophyta; Magnoliopsida; Pinales; 
2009,2009-06-22,Lisboa,Loures,Fanhões,RIBAS DE CIMA (ENTRADA PARQUE) (Forte das Ribas),38.8805246,-9.1541923,NC,176.0,2009-06-22T00:00,18.8,85,16.2,19.4,0.0,0.0,0.0,0.0,0,1016.9,996.2,14,16,0,0,0.01,0.33,10.6,16.6,260,269,11.9,21.8,26.4,21.4,16.3,0.091,0.176,0.235,0.258,0,0.0,0.0,0.0,0.0,0.0,0.0,0.0,0.0,0.0,0.0,0.0,0.0,0.0,Magnoliopsida; Tracheophyta; Eucalyptus L'Hér.; 
2009,2009-03-10,Lisboa,Loures,Bucelas,Quinta da Chamorra,38.9016248,-9.118728,NC,89.0,2009-03-10T16:00,21.1,56,11.8,21.0,0.0,0.0,0.0,0.0,0,1020.8,1010.3,0,0,0,0,0.33,1.11,4.4,5.1,305,309,13.7,21.4,15.0,12.8,12.9,0.283,0.326,0.34,0.274,1,3600.0,467.3,388.8,78.5,821.0,467.3,657.0,536.0,446.0,90.0,821.0,536.0,753.6,Magnoliopsida; Tracheophyta; Olea europaea L.; Pinus pinea L.; Pinus pinaster Aiton; Eucalyptus L'Hér.; Vitis vinifera L.; 
2009,2009-07-08,Lisboa,Torres Vedras,Ramalhal,AMEAL,39.1447908,-9.23308489562511,NC,49.0,2009-07-08T09:00,20.7,69,14.8,18.7,0.0,0.0,0.0,0.0,0,1017.0,1011.2,7,4,0,11,0.29,0.75,24.6,30.4,348,349,41.4,23.6,22.4,22.4,18.5,0.087,0.162,0.217,0.251,1,3600.0,569.9,436.0,133.9,674.5,569.9,855.4,498.0,381.0,117.0,674.5,498.0,747.4,Eucalyptus L'Hér.; Pinus pinaster Aiton; Magnoliopsida; Tracheophyta; Vitis vinifera L.; Pinales; Quercus suber L.; 
2009,2009-06-23,Lisboa,Sintra,Colares,ESTRADA PRAIA GRANDE ALMOÇAGEME (Quinta da Estrada),38.7795709,-9.4760411,NC,237.0,2009-06-23T17:00,19.8,76,15.4,19.3,0.0,0.0,0.0,0.0,0,1017.0,989.3,3,3,0,0,0.31,0.56,16.6,20.5,297,298,33.1,28.5,22.8,19.8,16.0,0.08,0.147,0.201,0.241,1,3600.0,501.1,405.3,95.9,736.9,501.1,728.1,575.0,465.0,110.0,736.9,575.0,835.4,Tracheophyta; Magnoliopsida; Pinus pinaster Aiton; Pinales; Pinus pinea L.; Eucalyptus L'Hér.; Vitis vinifera L.; Acacia Mill.; 
