year,date,district,municipality,parish,local,latitude,longitude,cause,elevation,hourly.time,hourly.temperature_2m,hourly.relative_humidity_2m,hourly.dew_point_2m,hourly.apparent_temperature,hourly.precipitation,hourly.rain,hourly.snowfall,hourly.snow_depth,hourly.weather_code,hourly.pressure_msl,hourly.surface_pressure,hourly.cloud_cover,hourly.cloud_cover_low,hourly.cloud_cover_mid,hourly.cloud_cover_high,hourly.et0_fao_evapotranspiration,hourly.vapour_pressure_deficit,hourly.wind_speed_10m,hourly.wind_speed_100m,hourly.wind_direction_10m,hourly.wind_direction_100m,hourly.wind_gusts_10m,hourly.soil_temperature_0_to_7cm,hourly.soil_temperature_7_to_28cm,hourly.soil_temperature_28_to_100cm,hourly.soil_temperature_100_to_255cm,hourly.soil_moisture_0_to_7cm,hourly.soil_moisture_7_to_28cm,hourly.soil_moisture_28_to_100cm,hourly.soil_moisture_100_to_255cm,hourly.is_day,hourly.sunshine_duration,hourly.shortwave_radiation_instant,hourly.direct_radiation_instant,hourly.diffuse_radiation_instant,hourly.direct_normal_irradiance_instant,hourly.global_tilted_irradiance_instant,hourly.terrestrial_radiation_instant,hourly.shortwave_radiation,hourly.direct_radiation,hourly.diffuse_radiation,hourly.direct_normal_irradiance,hourly.global_tilted_irradiance,hourly.terrestrial_radiation,scientificNames
2009,2009-09-24,Lisboa,Alenquer,Vila Verde dos Francos,CASAIS FONTE PIPA (Casais),39.1566625,-9.1177912,NC,183.0,2009-09-24T21:00,22.6,48,10.9,20.7,0.0,0.0,0.0,0.0,0,1019.3,998.0,2,0,3,0,0.11,1.43,15.2,28.7,14,20,28.1,24.0,25.1,22.3,21.5,0.082,0.146,0.175,0.227,0,0.0,0.0,0.0,0.0,0.0,0.0,0.0,0.0,0.0,0.0,0.0,0.0,0.0,Tracheophyta; Magnoliopsida; Vitis vinifera L.; Eucalyptus L'Hér.; Olea europaea L.
2009,2009-10-14,Lisboa,Vila Franca de Xira,Póvoa de Santa Iria,CASAL DA SERRA - POVOA STA IRIA (Casal Bandarra),38.8562721,-9.069732030166948,NC,17.0,2009-10-14T03:00,16.8,61,9.2,15.5,0.0,0.0,0.0,0.0,0,1015.3,1013.3,5,0,0,16,0.03,0.74,7.3,13.0,70,95,13.7,18.4,22.6,22.3,21.9,0.323,0.304,0.287,0.362,0,0.0,0.0,0.0,0.0,0.0,0.0,0.0,0.0,0.0,0.0,0.0,0.0,0.0,Tracheophyta; Magnoliopsida; Oryza sativa L.; 
2009,2009-11-05,Lisboa,Alenquer,Carnota,CARNOTA / PIPA (CARNOTA),39.0317277,-9.0493171,NC,146.0,2009-11-05T19:00,14.6,67,8.4,12.0,0.0,0.0,0.0,0.0,3,1020.7,1003.2,87,30,51,98,0.05,0.55,14.8,25.4,319,321,29.2,15.5,16.8,19.2,21.2,0.251,0.303,0.264,0.315,0,0.0,0.0,0.0,0.0,0.0,0.0,0.0,0.0,0.0,0.0,0.0,0.0,0.0,Magnoliopsida; Vitis vinifera L.; Tracheophyta
2009,2009-06-04,Lisboa,Oeiras,Carnaxide,CARNAXIDE,38.7275721,-9.238170738165364,NC,108.0,2009-06-04T20:00,17.4,77,13.4,16.2,0.0,0.0,0.0,0.0,0,1015.0,1002.2,17,8,17,0,0.05,0.46,15.7,21.9,286,287,28.8,20.7,21.1,18.9,15.5,0.171,0.213,0.253,0.274,0,1346.33,0.0,0.0,0.0,0.0,0.0,0.0,36.0,18.0,18.0,154.0,36.0,96.4,Tracheophyta; Magnoliopsida; Pinus pinea L.; Vitis vinifera L.; Eucalyptus L'Hér.; Olea europaea L.; Pinus pinaster Aiton
2009,2009-06-07,Lisboa,Loures,Camarate,Bº DE SAO JOSE (CAMARATE),38.8072917,-9.1455319,NC,102.0,2009-06-07T18:00,17.9,68,11.8,15.5,0.0,0.0,0.0,0.0,2,1012.8,1000.8,76,17,52,99,0.21,0.67,20.8,27.3,233,234,34.6,21.0,20.3,20.1,18.4,0.305,0.296,0.326,0.331,1,3600.0,272.7,161.4,111.3,456.8,272.7,469.2,343.0,203.0,140.0,456.8,343.0,590.1,Tracheophyta; Olea europaea L.; Magnoliopsida; 
2009,2009-05-29,Lisboa,Oeiras,Barcarena,EST BARCARENA PARA QUELUZ DE BAIXO (BARCARENA),38.7319947,-9.2789232,NC,55.0,2009-05-29T00:00,19.7,66,13.2,18.9,0.0,0.0,0.0,0.0,0,1015.0,1008.5,0,0,0,0,0.05,0.77,12.6,22.5,160,167,23.0,20.5,21.6,17.5,15.5,0.207,0.235,0.263,0.275,0,0.0,0.0,0.0,0.0,0.0,0.0,0.0,0.0,0.0,0.0,0.0,0.0,0.0,Tracheophyta; Magnoliopsida; Pinus pinea L.; Vitis vinifera L.; Eucalyptus L'Hér.; Olea europaea L.; Pinus pinaster Aiton
2009,2009-09-25,Lisboa,Sintra,Montelavar,CASAL SEQUEIRO (Casal Alentejano),38.8571312,-9.3250289,NC,150.0,2009-09-25T10:00,22.6,53,12.5,22.2,0.0,0.0,0.0,0.0,0,1018.6,1001.1,0,0,0,0,0.33,1.29,7.6,10.2,135,135,17.3,26.3,23.1,22.4,21.5,0.083,0.151,0.196,0.263,1,3600.0,566.6,463.0,103.6,760.2,566.6,828.6,503.0,411.0,92.0,760.2,503.0,735.5,Tracheophyta; Magnoliopsida; Pinus pinaster Aiton; Eucalyptus L'Hér.; Vitis vinifera L.; 
2009,2009-11-02,Lisboa,Arruda dos Vinhos,Arruda dos Vinhos,Mata,38.99119885,-9.062929029605822,NC,72.0,2009-11-02T14:00,17.8,55,8.6,13.6,0.0,0.0,0.0,0.0,2,1022.4,1013.8,77,82,1,9,0.28,0.92,26.6,36.8,347,348,50.0,20.3,19.1,20.2,21.8,0.271,0.307,0.264,0.315,1,3600.0,402.8,248.8,154.0,480.1,402.8,720.2,429.0,265.0,164.0,480.1,429.0,767.1,Vitis vinifera L.; Tracheophyta
2009,2009-10-18,Lisboa,Loures,Santo António Dos Cavaleiros,QUINTA DAS QUEIMADAS - SAC (Quinta da Abelheira),38.812632,-9.1613378,NC,53.0,2009-10-18T20:00,17.8,73,13.0,16.9,0.0,0.0,0.0,0.0,0,1013.6,1007.3,4,0,0,14,0.03,0.54,12.5,19.3,327,327,22.0,19.5,21.5,21.8,21.8,0.145,0.182,0.185,0.247,0,0.0,0.0,0.0,0.0,0.0,0.0,0.0,0.0,0.0,0.0,0.0,0.0,0.0,Tracheophyta; Olea europaea L.; Magnoliopsida; 
2009,2009-11-10,Lisboa,Sintra,Sintra (são Pedro De Penaferrim),Cabeço de Manique,38.7693037,-9.393216066576992,NC,238.0,2009-11-10T19:00,15.3,81,12.1,14.0,0.0,0.0,0.0,0.0,1,1021.0,992.7,37,39,0,7,0.02,0.33,13.2,20.3,334,335,22.7,16.0,17.1,18.2,20.6,0.203,0.208,0.192,0.26,0,0.0,0.0,0.0,0.0,0.0,0.0,0.0,0.0,0.0,0.0,0.0,0.0,0.0,Eucalyptus L'Hér.; Tracheophyta; Pinus pinaster Aiton; Pinales; Magnoliopsida
2009,2009-06-01,Lisboa,Cascais,Alcabideche,MANIQUE DE BAIXO (Manique),38.7359301,-9.3682258,NC,92.0,2009-06-01T14:00,22.1,65,15.3,24.5,0.0,0.0,0.0,0.0,0,1015.8,1005.1,3,3,0,0,0.57,0.93,11.4,11.9,283,284,24.5,27.0,21.3,18.5,15.4,0.174,0.224,0.259,0.275,1,3600.0,923.2,795.9,127.3,875.5,923.2,1209.4,950.0,819.0,131.0,875.5,950.0,1244.4,Tracheophyta; Eucalyptus L'Hér.; Magnoliopsida; Pinus pinea L.; Pinus pinaster Aiton; Pinales; Vitis vinifera L.; 
2009,2009-09-25,Lisboa,Loures,Santo Antão do Tojal,JT ROTUNDA OLIVEIRAS (SANTO ANTÃO DO TOJAL),38.8590093,-9.1617468,NC,68.0,2009-09-25T14:00,27.6,49,16.0,29.1,0.0,0.0,0.0,0.0,0,1016.8,1009.0,13,0,21,0,0.45,1.87,6.2,7.1,249,240,15.8,29.8,25.3,24.2,23.8,0.237,0.267,0.295,0.324,1,3600.0,586.8,472.9,113.9,670.6,586.8,959.5,613.0,494.0,119.0,670.6,613.0,1002.3,Magnoliopsida; Tracheophyta
2009,2009-06-04,Lisboa,Oeiras,Barcarena,ESTRADA DE VALEJAS (BARCARENA),38.7319947,-9.2789232,NC,55.0,2009-06-04T19:00,18.3,76,13.9,17.0,0.0,0.0,0.0,0.0,0,1015.2,1008.7,12,5,13,0,0.11,0.51,17.5,23.4,284,284,31.3,21.6,21.0,19.0,15.8,0.167,0.216,0.256,0.274,1,3600.0,107.7,69.7,38.0,428.0,107.7,216.4,170.0,110.0,60.0,428.0,170.0,341.6,Tracheophyta; Magnoliopsida; Pinus pinea L.; Vitis vinifera L.; Eucalyptus L'Hér.; Olea europaea L.; Pinus pinaster Aiton
2009,2009-10-18,Lisboa,Cadaval,Vilar,VILAR (Vila Nova),39.1861137,-9.144736826927373,Desconhecida,130.0,2009-10-18T14:00,23.9,26,3.1,21.4,0.0,0.0,0.0,0.0,0,1013.7,998.7,0,0,0,0,0.46,2.21,10.0,11.0,319,322,21.2,29.3,20.1,21.5,22.1,0.095,0.18,0.172,0.225,1,3600.0,613.1,524.2,88.9,892.7,613.1,809.5,648.0,554.0,94.0,892.7,648.0,855.5,Magnoliopsida; Eucalyptus L'Hér.; Vitis vinifera L.; Tracheophyta; Olea europaea L.; 
2009,2009-06-17,Lisboa,Vila Franca de Xira,Forte da Casa,TERRA PASTORIA - FORTE DA CASA (Terra das Pintas),38.8727839,-9.0593162,NC,32.0,2009-06-17T13:00,31.9,41,17.2,35.3,0.0,0.0,0.0,0.0,1,1017.5,1013.9,26,0,0,88,0.74,2.78,10.5,12.9,8,13,22.3,32.0,24.3,20.4,16.6,0.316,0.311,0.343,0.376,1,3600.0,958.9,825.1,133.9,859.1,958.9,1272.6,960.0,826.0,134.0,859.1,960.0,1274.1,Tracheophyta; Magnoliopsida; Oryza sativa L.; 
2009,2009-10-14,Lisboa,Cascais,Alcabideche,ALCABIDECHE,38.73146925,-9.410701803202649,NC,119.0,2009-10-14T23:00,19.7,70,14.2,19.1,0.0,0.0,0.0,0.0,0,1015.0,1001.0,0,0,0,0,0.05,0.68,13.7,26.7,14,16,20.5,19.1,21.4,21.2,21.0,0.125,0.149,0.156,0.226,0,0.0,0.0,0.0,0.0,0.0,0.0,0.0,0.0,0.0,0.0,0.0,0.0,0.0,Tracheophyta; Eucalyptus L'Hér.; Magnoliopsida; Pinus pinea L.; Pinus pinaster Aiton; Pinales; Vitis vinifera L.; 
2009,2009-10-16,Lisboa,Alenquer,Olhalvo,OLHALVO,39.101344,-9.062406,NC,108.0,2009-10-16T01:00,16.1,77,12.0,15.5,0.0,0.0,0.0,0.0,0,1014.8,1002.0,0,0,0,0,0.01,0.43,8.4,18.0,50,70,13.0,16.4,21.7,22.4,22.8,0.121,0.178,0.172,0.227,0,0.0,0.0,0.0,0.0,0.0,0.0,0.0,0.0,0.0,0.0,0.0,0.0,0.0,Magnoliopsida; Tracheophyta; Vitis vinifera L.
2009,2009-05-13,Lisboa,Cascais,Cascais,Ribeira das Vinhas,38.71502635,-9.456762952650216,NC,68.0,2009-05-13T16:00,16.1,82,12.9,14.0,0.0,0.0,0.0,0.0,1,1017.5,1009.4,46,43,10,5,0.23,0.34,20.8,26.1,296,296,37.4,20.5,17.8,17.0,15.0,0.216,0.207,0.233,0.246,1,3600.0,434.6,210.5,224.1,319.8,434.6,882.0,481.0,233.0,248.0,319.8,481.0,976.2,Pinus pinea L.; Tracheophyta; Magnoliopsida; Pinus pinaster Aiton
2009,2009-06-02,Lisboa,ODIVELAS,Ramada,JTO IGREJA RAMADA (Ramada),38.80800875,-9.196381569305192,NC,233.0,2009-06-02T13:00,22.9,55,13.5,24.5,0.0,0.0,0.0,0.0,0,1016.1,989.2,11,2,0,31,0.61,1.24,12.8,15.8,259,258,32.8,30.7,21.7,18.5,14.7,0.097,0.198,0.252,0.26,1,3600.0,984.8,869.1,115.7,911.0,984.8,1268.7,987.0,871.0,116.0,911.0,987.0,1271.5,Eucalyptus L'Hér.; Tracheophyta; Magnoliopsida; Olea europaea L.; Pinus pinea L.; 
2009,2009-09-28,Lisboa,Mafra,Mafra,Caeiros,38.96434055,-9.340462306966607,NC,88.0,2009-09-28T12:00,24.8,49,13.3,26.5,0.0,0.0,0.0,0.0,0,1017.2,1007.0,17,0,29,0,0.44,1.61,1.1,3.7,72,101,16.6,32.1,23.7,22.9,21.7,0.086,0.151,0.194,0.264,1,3600.0,685.4,577.3,108.1,772.9,685.4,1018.1,666.0,561.0,105.0,772.9,666.0,989.3,Magnoliopsida; Pinus pinaster Aiton; Tracheophyta; Eucalyptus L'Hér.
2009,2009-09-28,Lisboa,ODIVELAS,Odivelas,Pombais,38.7861376,-9.1832031,NC,36.0,2009-09-28T14:00,27.6,38,12.0,27.6,0.0,0.0,0.0,0.0,0,1015.7,1011.6,19,0,32,0,0.41,2.28,4.6,4.1,309,315,13.0,32.0,24.4,22.8,21.6,0.118,0.153,0.188,0.249,1,3600.0,532.6,360.5,172.1,520.8,532.6,943.4,557.0,377.0,180.0,520.8,557.0,986.6,Tracheophyta; Magnoliopsida
2009,2009-05-01,Lisboa,Torres Vedras,Maxial,Ermegeira,39.1367395,-9.190226187681349,NC,69.0,2009-05-01T14:00,19.9,51,9.4,17.6,0.0,0.0,0.0,0.0,0,1023.0,1014.8,0,0,0,0,0.52,1.14,26.3,32.4,360,3,43.6,24.0,16.5,15.2,14.2,0.184,0.24,0.279,0.258,1,3600.0,906.6,798.2,108.5,926.1,906.6,1161.6,936.0,824.0,112.0,926.1,936.0,1199.2,Eucalyptus L'Hér.; Tracheophyta; Magnoliopsida; Vitis vinifera L.; Pinales; Pinus pinaster Aiton; 
2009,2009-06-04,Lisboa,ODIVELAS,Famões,FAMOES (Famões),38.79343465,-9.209065683730335,NC,157.0,2009-06-04T19:00,18.0,71,12.7,16.3,0.0,0.0,0.0,0.0,0,1015.2,996.7,12,5,13,0,0.12,0.6,17.5,23.4,284,284,31.3,21.6,21.1,18.7,15.1,0.141,0.209,0.251,0.263,1,3600.0,107.5,69.6,37.9,429.7,107.5,215.2,170.0,110.0,60.0,429.7,170.0,340.2,Pinus pinea L.; Olea europaea L.; Tracheophyta; Magnoliopsida; 
2009,2009-10-16,Lisboa,Alenquer,Vila Verde dos Francos,CASAIS DO CHORÃO- VILA VERDE FRANCOS (Casais),39.1566625,-9.1177912,NC,183.0,2009-10-16T06:00,15.5,35,-0.1,11.6,0.0,0.0,0.0,0.0,0,1015.9,994.2,0,0,0,0,0.1,1.16,12.7,27.4,83,86,25.6,14.2,19.6,21.5,21.7,0.124,0.185,0.172,0.225,0,0.0,0.0,0.0,0.0,0.0,0.0,0.0,0.0,0.0,0.0,0.0,0.0,0.0,Tracheophyta; Magnoliopsida; Vitis vinifera L.; Eucalyptus L'Hér.; Olea europaea L.
2009,2009-10-16,Lisboa,Oeiras,Oeiras E São Julião Da Barra,RUA DO PARQUE (OEIRAS),38.6884786,-9.3189168,NC,22.0,2009-10-16T15:00,25.6,38,10.0,25.5,0.0,0.0,0.0,0.0,0,1015.8,1013.2,9,0,0,30,0.35,2.05,0.8,1.8,243,101,12.6,27.7,22.4,21.8,21.3,0.185,0.19,0.195,0.261,1,3600.0,497.3,421.9,75.4,848.0,497.3,685.0,554.0,470.0,84.0,848.0,554.0,763.2,Pinus pinea L.; Magnoliopsida; Tracheophyta; Vitis vinifera L.; Eucalyptus L'Hér.; Olea europaea L.; Pinus pinaster Aiton
2009,2009-09-28,Lisboa,Arruda dos Vinhos,Arranhó,LOURICEIRA (Louriceira de Baixo),38.95337155,-9.134980363016528,NC,239.0,2009-09-28T16:00,28.2,27,7.7,26.4,0.0,0.0,0.0,0.0,0,1014.5,987.4,16,0,26,0,0.3,2.77,8.0,10.2,324,328,22.0,33.9,25.4,22.9,21.6,0.081,0.146,0.176,0.232,1,3600.0,275.6,191.1,84.5,434.2,275.6,600.0,323.0,224.0,99.0,434.2,323.0,703.2,Tracheophyta; Magnoliopsida
2009,2009-09-29,Lisboa,Alenquer,Aldeia Gavinha,Montegil,39.0875006,-9.0631004,NC,86.0,2009-09-29T09:00,22.7,48,11.0,20.9,0.0,0.0,0.0,0.0,0,1016.0,1006.0,15,0,3,44,0.25,1.44,14.0,19.1,91,93,28.1,23.5,24.4,24.1,22.7,0.08,0.145,0.173,0.228,1,3600.0,387.2,293.8,93.4,647.6,387.2,618.5,315.0,239.0,76.0,647.6,315.0,503.2,Vitis vinifera L.; Tracheophyta; Magnoliopsida
2009,2009-06-21,Lisboa,Loures,Apelação,JUNTO A CASA DA CULTURA DA APELACAO (Apelação),38.815391000000005,-9.133030263713584,NC,100.0,2009-06-21T01:00,21.4,67,14.9,21.2,0.0,0.0,0.0,0.0,0,1016.9,1005.2,0,0,0,0,0.05,0.85,12.4,22.0,350,358,18.7,24.9,26.8,24.2,21.6,0.24,0.287,0.32,0.33,0,0.0,0.0,0.0,0.0,0.0,0.0,0.0,0.0,0.0,0.0,0.0,0.0,0.0,Tracheophyta; Olea europaea L.; Magnoliopsida; 
2009,2009-10-16,Lisboa,Azambuja,Maçussa,ESTRADA DA MAÇUSSA/MANIQUE INTENDENTE (Maçussa),39.19444745,-8.868368062682613,NC,55.0,2009-10-16T20:00,21.8,19,-2.8,17.2,0.0,0.0,0.0,0.0,0,1017.2,1010.7,7,0,0,24,0.17,2.11,14.2,29.3,66,74,24.5,21.2,22.5,22.4,22.8,0.108,0.175,0.166,0.216,0,0.0,0.0,0.0,0.0,0.0,0.0,0.0,0.0,0.0,0.0,0.0,0.0,0.0,Magnoliopsida; Tracheophyta; Vitis vinifera L.; Pinus pinea L.; Eucalyptus L'Hér.
2009,2009-10-16,Lisboa,Sintra,São João das Lampas,Assafora,38.9058678,-9.4102406,NC,123.0,2009-10-16T21:00,19.8,47,8.2,17.5,0.0,0.0,0.0,0.0,0,1017.1,1002.6,4,0,0,12,0.08,1.22,12.4,25.6,60,70,18.7,18.7,21.4,21.4,21.7,0.102,0.179,0.205,0.282,0,0.0,0.0,0.0,0.0,0.0,0.0,0.0,0.0,0.0,0.0,0.0,0.0,0.0,Tracheophyta; Magnoliopsida; Pinus pinaster Aiton; Pinus pinea L.; Vitis vinifera L.; Pinales; Olea europaea L.; 
2009,2009-06-11,Lisboa,ODIVELAS,Caneças,SERRA D LAURA (Casais da Serra),38.8165498,-9.221342021551935,NC,230.0,2009-06-11T23:00,16.1,85,13.6,15.0,0.0,0.0,0.0,0.0,0,1020.2,992.9,0,0,0,0,0.02,0.27,15.8,28.7,348,353,27.4,18.1,20.4,17.7,15.0,0.195,0.208,0.247,0.262,0,0.0,0.0,0.0,0.0,0.0,0.0,0.0,0.0,0.0,0.0,0.0,0.0,0.0,Eucalyptus L'Hér.; Tracheophyta; Magnoliopsida; Olea europaea L.; Pinus pinea L.; 
2009,2009-06-22,Lisboa,Vila Franca de Xira,Vialonga,JT R ANTONIO ALEIXO (VIALONGA),38.8773451,-9.0685711,NC,55.0,2009-06-22T23:00,17.8,82,14.7,17.3,0.0,0.0,0.0,0.0,1,1019.8,1013.2,34,38,0,0,0.02,0.36,14.0,20.5,325,326,27.7,21.6,26.4,22.6,17.0,0.101,0.187,0.244,0.269,0,0.0,0.0,0.0,0.0,0.0,0.0,0.0,0.0,0.0,0.0,0.0,0.0,0.0,Tracheophyta; Magnoliopsida; Pinus pinea L.; Olea europaea L.; Pinus pinaster Aiton; Pinales; 
2009,2009-06-23,Lisboa,Sintra,São João das Lampas,ESTRADA DA TERRUGEM PARA SAO JOAO LAMPAS (Quinta da Estrada),38.8815463,-9.405697273499548,NC,122.0,2009-06-23T16:00,21.0,69,15.2,21.5,0.0,0.0,0.0,0.0,0,1017.1,1002.8,1,1,0,0,0.42,0.77,15.9,19.5,295,298,32.8,33.5,24.7,21.3,16.7,0.072,0.183,0.257,0.3,1,3600.0,675.9,561.6,114.3,793.5,675.9,937.0,739.0,614.0,125.0,793.5,739.0,1024.5,Tracheophyta; Magnoliopsida; Pinus pinaster Aiton; Pinus pinea L.; Vitis vinifera L.; Pinales; Olea europaea L.; 
2009,2009-10-17,Lisboa,Sintra,São João das Lampas,ALVARINHOS (TRASEIRAS DA ADEGA) (Alvarinhos),38.8815463,-9.405697273499548,NC,122.0,2009-10-17T19:00,18.9,58,10.6,17.7,0.0,0.0,0.0,0.0,0,1016.0,1001.6,7,0,0,24,0.05,0.91,10.1,18.2,343,346,16.9,20.6,21.4,21.3,21.7,0.09,0.178,0.205,0.282,0,0.0,0.0,0.0,0.0,0.0,0.0,0.0,0.0,0.0,0.0,0.0,0.0,0.0,Tracheophyta; Magnoliopsida; Pinus pinaster Aiton; Pinus pinea L.; Vitis vinifera L.; Pinales; Olea europaea L.; 
2009,2009-09-27,Lisboa,Torres Vedras,Torres Vedras (são Pedro E São Tiago),Figueiredo,39.09299855,-9.25866085,NC,33.0,2009-09-27T15:00,24.6,54,14.8,25.2,0.0,0.0,0.0,0.0,0,1016.8,1013.0,0,0,0,0,0.43,1.42,10.5,11.2,311,320,21.2,33.9,24.8,22.7,21.6,0.089,0.152,0.193,0.259,1,3600.0,581.7,495.7,86.0,839.2,581.7,804.6,636.0,542.0,94.0,839.2,636.0,879.7,Tracheophyta; Magnoliopsida
2009,2009-09-29,Lisboa,Arruda dos Vinhos,Arranhó,A dos Arcos,38.95337155,-9.134980363016528,NC,239.0,2009-09-29T14:00,27.9,27,7.0,25.3,0.0,0.0,0.0,0.0,1,1013.5,986.5,30,0,36,29,0.52,2.75,14.8,19.1,67,68,29.9,34.1,24.6,23.0,21.6,0.082,0.146,0.176,0.232,1,3600.0,583.8,326.8,257.0,477.3,583.8,933.7,611.0,342.0,269.0,477.3,611.0,977.1,Tracheophyta; Magnoliopsida
2009,2009-03-11,Lisboa,Sintra,Colares,PRAIA ADRAGA (Praia da Adraga),38.7795709,-9.4760411,NC,237.0,2009-03-11T15:00,17.5,64,10.5,16.8,0.0,0.0,0.0,0.0,1,1019.8,991.9,26,0,0,86,0.36,0.73,10.6,13.0,18,28,20.2,20.9,14.8,12.8,12.7,0.217,0.257,0.285,0.249,1,3600.0,625.0,520.2,104.8,848.6,625.0,850.1,674.0,561.0,113.0,848.6,674.0,916.7,Tracheophyta; Magnoliopsida; Pinus pinaster Aiton; Pinales; Pinus pinea L.; Eucalyptus L'Hér.; Vitis vinifera L.; Acacia Mill.; 
2009,2009-10-17,Lisboa,Torres Vedras,Ventosa,CASTRO ZAMBUJAL (Casal do Zambujal),39.0669283,-9.3110571,NC,73.0,2009-10-17T07:00,15.5,34,-0.3,11.6,0.0,0.0,0.0,0.0,0,1017.9,1009.1,0,0,0,0,0.1,1.16,11.5,20.9,92,92,19.4,15.3,19.8,21.4,21.6,0.122,0.186,0.19,0.257,1,0.0,5.4,0.0,5.4,0.0,0.5,31.7,1.0,0.0,1.0,0.0,1.0,5.9,Vitis vinifera L.; Eucalyptus L'Hér.; Tracheophyta; Magnoliopsida; 
2009,2009-06-12,Lisboa,Sintra,Belas,VENDA  SECA (Venda Seca),38.7854627,-9.2808958,NC,215.0,2009-06-12T12:00,24.4,58,15.6,27.3,0.0,0.0,0.0,0.0,0,1017.2,992.5,0,0,0,0,0.62,1.28,9.4,11.6,360,5,24.8,25.6,19.6,17.7,15.1,0.191,0.208,0.249,0.266,1,3600.0,975.7,852.7,123.0,894.1,975.7,1265.0,952.0,832.0,120.0,894.1,952.0,1234.3,Pinus pinaster Aiton; Tracheophyta; Pinales; Eucalyptus L'Hér.; Magnoliopsida; 
2009,2009-01-08,Lisboa,Mafra,Malveira,CASAL PEDRA (Casal Pedroso),38.9315563,-9.2523258,NC,239.0,2009-01-08T19:00,4.6,62,-2.0,1.2,0.0,0.0,0.0,0.0,0,1018.1,988.7,0,0,0,0,0.01,0.32,6.6,13.2,22,35,12.6,5.4,7.9,11.6,15.2,0.326,0.343,0.249,0.267,0,0.0,0.0,0.0,0.0,0.0,0.0,0.0,0.0,0.0,0.0,0.0,0.0,0.0,Tracheophyta; Eucalyptus L'Hér.; Pinus pinaster Aiton; Magnoliopsida
2009,2009-06-13,Lisboa,ODIVELAS,Famões,Famões,38.79343465,-9.209065683730335,NC,157.0,2009-06-13T13:00,28.1,42,13.9,28.1,0.0,0.0,0.0,0.0,1,1015.8,997.9,30,1,36,25,0.68,2.22,20.7,26.8,343,349,33.8,29.0,21.6,18.4,15.5,0.172,0.205,0.245,0.262,1,3600.0,907.8,730.1,177.8,760.6,907.8,1272.9,909.0,731.0,178.0,760.6,909.0,1274.5,Pinus pinea L.; Olea europaea L.; Tracheophyta; Magnoliopsida; 
2009,2009-10-17,Lisboa,Mafra,Malveira,CARRASQUEIRA,38.9315563,-9.2523258,NC,239.0,2009-10-17T14:00,22.3,31,4.5,21.3,0.0,0.0,0.0,0.0,0,1016.2,988.6,3,0,0,9,0.41,1.86,2.9,4.0,353,360,16.6,28.0,20.2,20.9,21.1,0.106,0.177,0.192,0.261,1,3600.0,619.3,533.1,86.2,894.8,619.3,820.9,654.0,563.0,91.0,894.8,654.0,866.9,Tracheophyta; Eucalyptus L'Hér.; Pinus pinaster Aiton; Magnoliopsida
2009,2009-10-18,Lisboa,Amadora,Alfragide,IC-19 SAIDA DE ALFRAGIDE SNT/LX (Alfragide),38.7239073,-9.2094429,NC,79.0,2009-10-18T14:00,23.5,32,5.8,21.7,0.0,0.0,0.0,0.0,0,1013.6,1004.4,15,0,0,51,0.45,1.97,9.4,10.5,313,319,18.7,26.3,20.8,21.7,21.6,0.173,0.183,0.178,0.258,1,3600.0,619.0,527.2,91.8,888.5,619.0,818.0,654.0,557.0,97.0,888.5,654.0,864.3,Tracheophyta; Pinus pinea L.; Magnoliopsida; ; Eucalyptus L'Hér.; Pinales
2009,2009-09-29,Lisboa,Sintra,Almargem do Bispo,Mastrontas,38.8491202,-9.264334778649603,NC,283.0,2009-09-29T20:00,20.2,66,13.6,20.6,0.0,0.0,0.0,0.0,1,1014.5,981.7,46,0,46,63,0.01,0.82,5.1,10.0,8,21,15.1,22.9,24.2,22.2,20.9,0.093,0.149,0.183,0.245,0,0.0,0.0,0.0,0.0,0.0,0.0,0.0,0.0,0.0,0.0,0.0,0.0,0.0,Tracheophyta; Magnoliopsida; Pinus pinaster Aiton; Eucalyptus L'Hér.; Vitis vinifera L.; 
2009,2009-10-18,Lisboa,Torres Vedras,Torres Vedras (são Pedro E São Tiago),Fonte Grada,39.09299855,-9.25866085,NC,33.0,2009-10-18T20:00,17.3,77,13.3,17.0,0.0,0.0,0.0,0.0,0,1013.7,1009.8,0,0,0,0,0.01,0.45,9.1,15.9,326,327,17.6,18.8,21.0,21.5,21.8,0.108,0.183,0.19,0.257,0,0.0,0.0,0.0,0.0,0.0,0.0,0.0,0.0,0.0,0.0,0.0,0.0,0.0,Tracheophyta; Magnoliopsida
2009,2009-10-19,Lisboa,Azambuja,Vila Nova de São Pedro,CASAIS DE ALEM (Casais da Areia),39.2129579,-8.8452108,NC,97.0,2009-10-19T20:00,16.9,71,11.5,16.2,0.0,0.0,0.0,0.0,2,1009.7,998.2,52,25,0,100,0.02,0.56,8.0,16.1,252,254,16.9,18.7,20.2,21.5,22.1,0.108,0.175,0.166,0.215,0,0.0,0.0,0.0,0.0,0.0,0.0,0.0,0.0,0.0,0.0,0.0,0.0,0.0,Tracheophyta; Magnoliopsida
2009,2009-05-15,Lisboa,Cascais,São Domingos de Rana,Rebelva,38.6957797,-9.3430716,NC,40.0,2009-05-15T17:00,15.9,59,7.8,11.5,0.0,0.0,0.0,0.0,0,1019.6,1014.8,0,0,0,0,0.29,0.75,26.4,33.8,332,333,43.6,19.3,17.4,16.9,15.2,0.26,0.264,0.274,0.276,1,3600.0,464.7,385.2,79.4,775.5,464.7,665.0,544.0,451.0,93.0,775.5,544.0,778.5,Tracheophyta; Magnoliopsida
2009,2009-10-17,Lisboa,Mafra,Venda do Pinheiro,VENDA PINHEIRO (Casal da Venda),38.92848,-9.2384452,NC,259.0,2009-10-17T17:00,21.9,35,5.5,19.3,0.0,0.0,0.0,0.0,0,1015.4,985.5,5,0,0,17,0.19,1.72,9.9,13.6,316,320,22.3,25.1,21.0,20.9,21.2,0.107,0.173,0.181,0.243,1,3600.0,140.5,102.9,37.5,620.0,140.5,228.7,217.0,159.0,58.0,620.0,217.0,353.4,Tracheophyta; Eucalyptus L'Hér.; Pinus pinaster Aiton; Pinales; Magnoliopsida
2009,2009-05-04,Lisboa,Sintra,Algueirão-Mem Martins,TAPADA MERCES (ATRAS DA ESCOLA) (Casal da Tapada),38.7999099,-9.3397834,NC,166.0,2009-05-04T14:00,21.1,60,13.1,23.2,0.0,0.0,0.0,0.0,0,1019.3,999.9,12,0,0,41,0.57,0.99,7.9,9.0,286,293,21.2,24.6,18.4,15.1,13.8,0.228,0.276,0.281,0.269,1,3600.0,909.0,801.5,107.6,920.3,909.0,1171.9,938.0,827.0,111.0,920.3,938.0,1209.3,Tracheophyta; Magnoliopsida; Pinales; 
2009,2009-10-17,Lisboa,Torres Vedras,Monte Redondo,Lapas Grandes,39.11758505,-9.201044,NC,97.0,2009-10-17T18:00,21.0,46,8.8,19.2,0.0,0.0,0.0,0.0,0,1015.7,1004.3,7,0,0,24,0.09,1.35,9.8,16.6,332,333,22.7,23.4,21.8,21.8,22.3,0.102,0.179,0.177,0.237,0,1706.49,0.0,0.0,0.0,0.0,0.0,0.0,47.0,28.0,19.0,236.6,47.0,103.8,Eucalyptus L'Hér.; Tracheophyta; Magnoliopsida; Vitis vinifera L.; Pinales; Pinus pinaster Aiton; 
2009,2009-10-17,Lisboa,Torres Vedras,Torres Vedras (são Pedro E São Tiago),Figueiredo,39.09299855,-9.25866085,NC,33.0,2009-10-17T19:00,19.7,57,10.9,18.5,0.0,0.0,0.0,0.0,0,1016.0,1012.1,7,0,0,24,0.05,0.99,10.1,18.2,343,346,16.9,21.1,21.8,21.7,21.9,0.113,0.184,0.19,0.257,0,0.0,0.0,0.0,0.0,0.0,0.0,0.0,0.0,0.0,0.0,0.0,0.0,0.0,Tracheophyta; Magnoliopsida
2009,2009-10-17,Lisboa,Torres Vedras,Turcifal,MUJIDEIRA (Mugideira),39.0507668,-9.2409261,NC,93.0,2009-10-17T20:00,18.6,57,9.8,17.1,0.0,0.0,0.0,0.0,0,1016.1,1005.1,6,0,0,21,0.05,0.93,10.2,19.1,352,357,16.6,19.7,21.7,21.9,22.3,0.102,0.179,0.177,0.237,0,0.0,0.0,0.0,0.0,0.0,0.0,0.0,0.0,0.0,0.0,0.0,0.0,0.0,Tracheophyta; Castanea sativa Mill.; Vitis vinifera L.; Magnoliopsida; Pinales; Eucalyptus L'Hér.; 
2009,2009-09-29,Lisboa,Arruda dos Vinhos,Santiago dos Velhos,A dos Eiros,38.9504877,-9.1117692,NC,267.0,2009-09-29T01:00,19.5,60,11.5,18.8,0.0,0.0,0.0,0.0,0,1014.9,983.8,2,0,2,1,0.04,0.91,7.9,17.8,24,48,14.0,20.4,24.7,22.9,21.5,0.082,0.146,0.176,0.232,0,0.0,0.0,0.0,0.0,0.0,0.0,0.0,0.0,0.0,0.0,0.0,0.0,0.0,Magnoliopsida; Pinus pinea L.; Tracheophyta
2009,2009-02-13,Lisboa,Mafra,Igreja Nova,Raimonda,38.897459,-9.2913723,NC,146.0,2009-02-13T17:00,15.6,61,8.2,14.4,0.0,0.0,0.0,0.0,0,1017.7,1000.3,0,0,0,0,0.14,0.69,5.6,8.7,27,52,15.5,15.7,12.3,11.8,13.7,0.348,0.373,0.377,0.274,1,3600.0,190.6,147.6,43.0,701.7,190.6,295.1,266.0,206.0,60.0,701.7,266.0,412.0,Tracheophyta; Magnoliopsida; Eucalyptus L'Hér.; Pinus pinaster Aiton
2009,2009-09-30,Lisboa,Loures,Bucelas,QUINTA BOIÇÃO (Quinta da Abelheira),38.9016248,-9.118728,NC,89.0,2009-09-30T13:00,26.1,47,14.0,28.1,0.0,0.0,0.0,0.0,0,1015.3,1005.0,17,6,15,9,0.44,1.79,0.4,0.5,270,315,20.2,33.0,24.7,23.5,22.1,0.103,0.159,0.194,0.257,1,3600.0,647.7,524.7,123.0,712.7,647.7,1004.5,653.0,529.0,124.0,712.7,653.0,1012.8,Magnoliopsida; Tracheophyta; Olea europaea L.; Pinus pinea L.; Pinus pinaster Aiton; Eucalyptus L'Hér.; Vitis vinifera L.; 
2009,2009-09-29,Lisboa,Arruda dos Vinhos,Santiago dos Velhos,A dos Eiros,38.9504877,-9.1117692,NC,267.0,2009-09-29T14:00,27.7,27,6.8,24.6,0.0,0.0,0.0,0.0,1,1013.6,983.4,41,0,36,65,0.52,2.73,16.9,21.3,79,78,32.8,33.9,24.4,22.9,21.5,0.082,0.146,0.176,0.232,1,3600.0,563.8,289.5,274.2,422.9,563.8,933.7,590.0,303.0,287.0,422.9,590.0,977.1,Magnoliopsida; Pinus pinea L.; Tracheophyta
2009,2009-06-10,Lisboa,Sintra,Algueirão-Mem Martins,TRASEIRAS DO FEIRA NOVA (Algueirão-Mem Martins),38.7977037,-9.341033451942735,NC,169.0,2009-06-10T21:00,17.6,88,15.6,18.2,0.0,0.0,0.0,0.0,0,1022.2,1002.1,0,0,0,0,0.0,0.23,8.7,17.1,312,314,18.4,19.3,20.1,17.8,15.4,0.21,0.21,0.25,0.266,0,0.0,0.0,0.0,0.0,0.0,0.0,0.0,0.0,0.0,0.0,0.0,0.0,0.0,Tracheophyta; Magnoliopsida; Pinales; 
2009,2009-09-29,Lisboa,Arruda dos Vinhos,Arranhó,A-dos-Arcos,38.95337155,-9.134980363016528,NC,239.0,2009-09-29T20:00,21.5,57,12.8,21.7,0.0,0.0,0.0,0.0,1,1014.5,986.8,46,0,46,63,0.02,1.09,5.1,10.0,8,21,15.1,24.1,25.1,23.1,21.6,0.086,0.146,0.175,0.231,0,0.0,0.0,0.0,0.0,0.0,0.0,0.0,0.0,0.0,0.0,0.0,0.0,0.0,Tracheophyta; Magnoliopsida
2009,2009-05-21,Lisboa,Azambuja,Maçussa,MAÇUSSA - VAL DO BUGALHO (Maçussa),39.19444745,-8.868368062682613,NC,55.0,2009-05-21T16:00,23.3,40,9.0,21.4,0.0,0.0,0.0,0.0,1,1012.1,1005.7,26,0,0,86,0.5,1.71,17.1,21.4,242,241,38.2,30.0,21.1,17.5,15.1,0.102,0.193,0.243,0.233,1,3600.0,654.0,522.7,131.3,783.0,654.0,891.4,722.0,577.0,145.0,783.0,722.0,984.1,Magnoliopsida; Tracheophyta; Vitis vinifera L.; Pinus pinea L.; Eucalyptus L'Hér.
2009,2009-06-12,Lisboa,ODIVELAS,Caneças,Casal Novo,38.8165498,-9.221342021551935,NC,230.0,2009-06-12T13:00,27.6,47,15.1,30.5,0.0,0.0,0.0,0.0,0,1016.7,990.5,0,0,0,0,0.7,1.97,8.9,10.9,346,352,25.2,28.2,20.2,17.7,15.0,0.187,0.207,0.246,0.262,1,3600.0,983.7,862.8,120.8,899.5,983.7,1272.3,985.0,864.0,121.0,899.5,985.0,1274.0,Eucalyptus L'Hér.; Tracheophyta; Magnoliopsida; Olea europaea L.; Pinus pinea L.; 
2009,2009-06-19,Lisboa,Cascais,Parede,ESTRADA DE MANIQUE - TRAJOUCE (Bairro da Estrada),38.69741555,-9.331115878034677,NC,31.0,2009-06-19T23:00,21.1,74,16.4,21.1,0.0,0.0,0.0,0.0,0,1018.4,1014.7,0,0,0,0,0.04,0.64,15.0,23.8,349,356,24.8,23.0,24.8,20.6,16.8,0.159,0.202,0.245,0.273,0,0.0,0.0,0.0,0.0,0.0,0.0,0.0,0.0,0.0,0.0,0.0,0.0,0.0,Magnoliopsida; Tracheophyta; Pinus pinea L.; Pinus pinaster Aiton; 
