year,date,district,municipality,parish,local,latitude,longitude,cause,elevation,hourly.time,hourly.temperature_2m,hourly.relative_humidity_2m,hourly.dew_point_2m,hourly.apparent_temperature,hourly.precipitation,hourly.rain,hourly.snowfall,hourly.snow_depth,hourly.weather_code,hourly.pressure_msl,hourly.surface_pressure,hourly.cloud_cover,hourly.cloud_cover_low,hourly.cloud_cover_mid,hourly.cloud_cover_high,hourly.et0_fao_evapotranspiration,hourly.vapour_pressure_deficit,hourly.wind_speed_10m,hourly.wind_speed_100m,hourly.wind_direction_10m,hourly.wind_direction_100m,hourly.wind_gusts_10m,hourly.soil_temperature_0_to_7cm,hourly.soil_temperature_7_to_28cm,hourly.soil_temperature_28_to_100cm,hourly.soil_temperature_100_to_255cm,hourly.soil_moisture_0_to_7cm,hourly.soil_moisture_7_to_28cm,hourly.soil_moisture_28_to_100cm,hourly.soil_moisture_100_to_255cm,hourly.is_day,hourly.sunshine_duration,hourly.shortwave_radiation_instant,hourly.direct_radiation_instant,hourly.diffuse_radiation_instant,hourly.direct_normal_irradiance_instant,hourly.global_tilted_irradiance_instant,hourly.terrestrial_radiation_instant,hourly.shortwave_radiation,hourly.direct_radiation,hourly.diffuse_radiation,hourly.direct_normal_irradiance,hourly.global_tilted_irradiance,hourly.terrestrial_radiation,scientificNames
2011,2011-07-28,Leiria,Pombal,Louriçal,Matos da Vila,40.0031383,-8.7387872,Desconhecida,25.0,2011-07-28T21:00,22.6,61,14.6,23.3,0.0,0.0,0.0,0.0,0,1015.0,1012.1,0,0,0,0,0.02,1.08,5.2,9.5,295,331,11.5,26.3,26.6,21.6,19.2,0.048,0.061,0.102,0.208,0,0.0,0.0,0.0,0.0,0.0,0.0,0.0,0.0,0.0,0.0,0.0,0.0,0.0,Tracheophyta; Pinus pinaster Aiton; Magnoliopsida; Eucalyptus L'Hér.
2011,2011-07-28,Porto,Felgueiras,Pinheiro,Azenha,41.3684352,-8.152882,NC,497.0,2011-07-28T21:00,26.9,37,11.1,26.8,0.0,0.0,0.0,0.0,0,1014.9,959.4,9,0,0,29,0.03,2.22,3.4,4.5,328,331,9.7,26.2,25.2,19.9,16.0,0.096,0.145,0.224,0.339,0,0.0,0.0,0.0,0.0,0.0,0.0,0.0,0.0,0.0,0.0,0.0,0.0,0.0,Pinus pinaster Aiton; Tracheophyta; Magnoliopsida; Vitis vinifera L.; Eucalyptus L'Hér.
2011,2011-08-19,Porto,Paredes,Cristelo,LUGAR DE GAIJÃO (Lugar),41.2293203,-8.3635497,NC,325.0,2011-08-19T22:00,24.8,63,17.2,26.5,0.0,0.0,0.0,0.0,0,1013.5,976.6,0,0,0,0,0.02,1.16,5.8,10.2,68,45,10.8,25.6,25.8,21.7,18.3,0.094,0.142,0.21,0.328,0,0.0,0.0,0.0,0.0,0.0,0.0,0.0,0.0,0.0,0.0,0.0,0.0,0.0,Magnoliopsida; Pinus pinaster Aiton; Eucalyptus L'Hér.; Tracheophyta; Vitis vinifera L.
2011,2011-07-07,Faro,Albufeira,Albufeira,Cerro Grande - Albufeira (Cerro da Águia),37.0918306,-8.2709528,NC,111.0,2011-07-07T23:00,17.9,59,9.8,14.6,0.0,0.0,0.0,0.0,0,1017.4,1004.2,0,0,0,0,0.1,0.84,22.2,35.1,343,345,44.3,21.9,25.7,24.1,19.5,0.106,0.147,0.213,0.271,0,0.0,0.0,0.0,0.0,0.0,0.0,0.0,0.0,0.0,0.0,0.0,0.0,0.0,Tracheophyta; Ceratonia siliqua L.
2011,2011-07-08,Viana do Castelo,Caminha,Vila Praia de Âncora,QUINTA DO SOCORRO (Quinta da Barrosa),41.8135365,-8.8624681,Desconhecida,16.0,2011-07-08T12:00,18.2,88,16.2,16.8,0.6,0.6,0.0,0.0,53,1017.0,1015.1,100,100,93,0,0.13,0.25,24.5,33.9,221,223,39.6,19.3,19.7,20.5,17.5,0.146,0.173,0.263,0.357,1,0.0,224.7,6.2,218.5,6.6,224.7,1234.5,219.0,6.0,213.0,6.6,219.0,1203.4,Tracheophyta; Pinus pinaster Aiton; Magnoliopsida; Eucalyptus L'Hér.
2011,2011-07-08,Aveiro,Águeda,Águeda,Cavadas,40.6402567,-8.448851,Desconhecida,53.0,2011-07-08T13:00,21.6,65,14.7,20.5,0.0,0.0,0.0,0.0,3,1018.4,1012.2,100,92,55,0,0.34,0.91,18.4,23.4,244,245,30.6,24.8,21.0,21.5,18.0,0.101,0.155,0.24,0.344,1,2633.11,509.8,139.9,369.9,147.8,509.8,1253.1,510.0,140.0,370.0,147.8,510.0,1253.6,Tracheophyta; Eucalyptus L'Hér.; Magnoliopsida; Pinus pinaster Aiton
2011,2011-07-08,Aveiro,Arouca,Alvarenga,Chieira,40.9651664,-8.1662362,Desconhecida,352.0,2011-07-08T16:00,18.4,79,14.7,17.6,0.3,0.3,0.0,0.0,51,1018.0,977.0,100,100,74,0,0.14,0.44,16.3,24.8,256,257,39.2,20.2,18.8,19.4,16.1,0.117,0.186,0.279,0.362,1,0.0,165.5,10.1,155.5,14.5,165.5,919.8,181.0,11.0,170.0,14.5,181.0,1005.7,Tracheophyta; Magnoliopsida; Quercus L.; Eucalyptus L'Hér.; Castanea sativa Mill.; Pinus pinaster Aiton
2011,2011-07-09,Porto,Vila Nova de Gaia,Arcozelo,BAIRRO LUSO (Bairro),41.0477168,-8.6417328,NC,32.0,2011-07-09T07:00,18.1,96,17.5,19.3,0.0,0.0,0.0,0.0,3,1017.9,1014.1,100,91,60,0,0.04,0.08,10.6,15.5,215,222,16.9,18.8,20.1,20.9,18.0,0.129,0.139,0.218,0.329,1,0.0,81.9,9.9,72.0,31.7,81.9,413.0,58.0,7.0,51.0,31.7,58.0,292.4,Pinus pinaster Aiton; Tracheophyta; Eucalyptus L'Hér.; Magnoliopsida
2011,2011-07-28,Braga,Celorico de Basto,Gémeos,VILAR (GÉMEOS) (Lugar de Vilar),41.3915781,-8.016175471864585,NC,307.0,2011-07-28T19:00,29.9,31,11.1,29.5,0.0,0.0,0.0,0.0,0,1014.0,979.6,9,0,0,31,0.16,2.9,5.2,10.5,304,311,15.5,32.0,26.1,20.9,17.1,0.093,0.151,0.234,0.343,1,3600.0,116.7,83.3,33.3,557.2,116.7,198.4,189.0,135.0,54.0,557.2,189.0,321.4,Pinus pinaster Aiton; Tracheophyta; Magnoliopsida
2011,2011-07-28,Porto,Santo Tirso,Burgães,LG. STª CRUZ (SEQUEIRO),41.3401777,-8.4491846,NC,242.0,2011-07-28T20:00,27.5,42,13.5,27.2,0.0,0.0,0.0,0.0,0,1014.1,986.7,8,0,0,26,0.11,2.13,9.9,15.9,327,342,19.4,29.4,26.4,20.9,17.4,0.094,0.149,0.23,0.341,0,1420.38,0.0,0.0,0.0,0.0,0.0,0.0,35.0,19.0,16.0,168.8,35.0,90.6,Eucalyptus L'Hér.; Magnoliopsida; Tracheophyta; Pinus pinaster Aiton; Vitis vinifera L.
2011,2011-07-28,Viana do Castelo,Monção,Longos Vales,Costa,42.0469757,-8.4513856,Desconhecida,139.0,2011-07-28T21:00,24.9,54,14.8,23.7,0.0,0.0,0.0,0.0,0,1015.4,999.4,8,0,0,27,0.13,1.46,19.2,31.6,34,41,31.0,25.8,24.2,19.6,17.1,0.104,0.161,0.238,0.346,0,0.0,0.0,0.0,0.0,0.0,0.0,0.0,0.0,0.0,0.0,0.0,0.0,0.0,Vitis vinifera L.; Pinus pinaster Aiton; Tracheophyta; Magnoliopsida; Quercus L.; Eucalyptus L'Hér.; Acacia Mill.; 
2011,2011-07-28,Porto,Felgueiras,Pinheiro,LG OURO (PINHEIRO),41.3681455,-8.1611681,NC,454.0,2011-07-28T21:00,27.2,37,11.4,27.1,0.0,0.0,0.0,0.0,0,1014.9,964.1,9,0,0,29,0.03,2.26,3.4,4.5,328,331,9.7,26.4,25.4,20.1,16.3,0.096,0.145,0.224,0.339,0,0.0,0.0,0.0,0.0,0.0,0.0,0.0,0.0,0.0,0.0,0.0,0.0,0.0,Pinus pinaster Aiton; Tracheophyta; Eucalyptus L'Hér.; Magnoliopsida; Vitis vinifera L.
2011,2011-07-28,Leiria,Leiria,Cortes,Senhora do Monte,39.6942971,-8.7615534,Desconhecida,224.0,2011-07-28T22:00,20.3,67,14.1,21.0,0.0,0.0,0.0,0.0,0,1016.2,990.1,0,0,0,0,0.01,0.78,4.8,8.9,312,346,7.9,23.1,24.9,20.4,18.2,0.048,0.062,0.107,0.211,0,0.0,0.0,0.0,0.0,0.0,0.0,0.0,0.0,0.0,0.0,0.0,0.0,0.0,Tracheophyta; Pinus pinaster Aiton; Eucalyptus L'Hér.; Magnoliopsida; Acacia Mill.
2011,2011-07-28,Porto,Santo Tirso,São Martinho Campo,LG. TALEGRE (AVES),41.35849115,-8.368132875977032,NC,130.0,2011-07-28T22:00,26.9,47,14.7,28.0,0.0,0.0,0.0,0.0,0,1015.0,1000.1,1,0,0,2,0.02,1.88,3.3,6.1,319,360,11.9,26.1,26.7,21.4,17.9,0.104,0.15,0.228,0.34,0,0.0,0.0,0.0,0.0,0.0,0.0,0.0,0.0,0.0,0.0,0.0,0.0,0.0,Magnoliopsida; Tracheophyta; Vitis vinifera L.; Pinus pinaster Aiton; Eucalyptus L'Hér.
2011,2011-07-27,Aveiro,Albergaria-a-Velha,Albergaria-a-Velha,SOBREIRO,40.6938582,-8.5060594,Desconhecida,126.0,2011-07-27T14:00,32.7,24,9.6,32.8,0.0,0.0,0.0,0.0,0,1012.5,998.4,0,0,0,0,0.76,3.76,13.0,16.5,6,10,29.5,37.9,25.0,21.2,18.4,0.066,0.091,0.144,0.256,1,3600.0,902.4,796.3,106.1,897.1,902.4,1177.0,927.0,818.0,109.0,897.1,927.0,1209.1,Tracheophyta; Eucalyptus L'Hér.
2011,2011-07-27,Leiria,Óbidos,Vau,Poça do Vau,39.3657979,-9.2173555,Desconhecida,37.0,2011-07-27T13:00,25.1,51,14.2,24.5,0.0,0.0,0.0,0.0,0,1013.2,1008.9,0,0,0,0,0.62,1.56,26.1,34.3,353,356,44.6,33.4,22.6,21.3,19.6,0.045,0.09,0.144,0.228,1,3600.0,947.4,834.2,113.2,890.2,947.4,1242.6,946.0,833.0,113.0,890.2,946.0,1240.8,Tracheophyta; Magnoliopsida; Eucalyptus L'Hér.
2011,2011-07-27,Aveiro,Vale de Cambra,São Pedro de Castelões,Felgueira,40.794422,-8.4246334,Desconhecida,252.0,2011-07-27T18:00,30.7,28,9.9,28.2,0.0,0.0,0.0,0.0,0,1012.7,984.5,0,0,0,0,0.41,3.2,17.0,23.9,343,348,37.1,32.9,26.0,21.4,18.1,0.1,0.152,0.237,0.343,1,3600.0,301.0,241.8,59.3,712.2,301.0,450.1,381.0,306.0,75.0,712.2,381.0,569.7,Eucalyptus L'Hér.; Tracheophyta; Magnoliopsida; Pinus pinaster Aiton
2011,2011-07-27,Santarém,Rio Maior,Outeiro da Cortiçada,Correias,39.3306482,-8.8285076,Desconhecida,49.0,2011-07-27T15:00,33.0,32,13.9,32.9,0.0,0.0,0.0,0.0,0,1011.2,1005.7,0,0,0,0,0.74,3.44,19.7,25.4,336,339,43.2,36.1,25.2,21.9,19.3,0.101,0.17,0.24,0.337,1,3600.0,808.0,703.1,104.9,868.1,808.0,1074.0,855.0,744.0,111.0,868.1,855.0,1136.5,Magnoliopsida; Eucalyptus L'Hér.; Vitis vinifera L.; Tracheophyta; Olea europaea L.; Pinus pinaster Aiton; Quercus suber L.; 
2011,2011-08-15,Braga,Póvoa de Lanhoso,Taíde,L. PORTO D'AVE(TAIDE)M6 (FRIANDE),41.5578325,-8.2297605,NC,171.0,2011-08-15T15:00,29.1,49,17.2,30.7,0.0,0.0,0.0,0.0,0,1016.0,996.6,6,7,0,0,0.6,2.07,15.0,18.8,294,296,33.8,34.5,25.5,22.3,19.0,0.104,0.145,0.205,0.325,1,3600.0,745.2,639.0,106.2,850.5,745.2,1001.8,793.0,680.0,113.0,850.5,793.0,1066.1,Vitis vinifera L.; Tracheophyta; Pinales; Eucalyptus L'Hér.; Magnoliopsida
2011,2011-08-15,Leiria,Pombal,Redinha,Arroteia,40.0194761,-8.5783043,Desconhecida,50.0,2011-08-15T14:00,27.6,55,17.7,28.9,0.0,0.0,0.0,0.0,1,1016.3,1010.5,33,37,0,0,0.55,1.68,17.4,20.9,308,312,32.4,35.6,25.1,22.7,20.0,0.05,0.059,0.09,0.199,1,3600.0,740.7,520.4,220.4,610.2,740.7,1137.0,763.0,536.0,227.0,610.2,763.0,1171.2,Eucalyptus L'Hér.; Olea europaea L.; Magnoliopsida; Tracheophyta; Pinus pinaster Aiton
2011,2011-08-15,Aveiro,Santa Maria da Feira,São João de Ver,R. Sá Castro (SÃO JOÃO DE VÊR),40.95530765,-8.551133345203194,Desconhecida,169.0,2011-08-15T18:00,23.2,66,16.5,23.1,0.0,0.0,0.0,0.0,0,1016.2,996.6,0,0,0,0,0.22,0.97,16.1,21.1,321,323,35.6,29.8,25.6,22.0,19.0,0.094,0.118,0.177,0.31,1,3600.0,234.1,179.9,54.2,637.8,234.1,376.2,311.0,239.0,72.0,637.8,311.0,499.7,Tracheophyta; Pinus pinaster Aiton; Eucalyptus L'Hér.; Quercus suber L.; Magnoliopsida
2011,2011-07-28,Viana do Castelo,Ponte de Lima,Queijada,QUEIJADA,41.71362325,-8.535539596319527,NC,238.0,2011-07-28T17:00,30.8,34,12.9,30.4,0.0,0.0,0.0,0.0,0,1014.4,987.7,0,0,0,0,0.46,2.95,9.7,12.5,309,311,24.8,34.1,25.0,19.9,16.7,0.098,0.153,0.232,0.343,1,3600.0,492.1,414.1,78.0,801.4,492.1,685.5,568.0,478.0,90.0,801.4,568.0,791.2,Magnoliopsida; Eucalyptus L'Hér.; Tracheophyta
2011,2011-07-28,Aveiro,Santa Maria da Feira,Rio Meão,Casais de Baixo,40.9438427,-8.5923096,Desconhecida,86.0,2011-07-28T18:00,30.7,35,13.6,29.0,0.0,0.0,0.0,0.0,0,1013.5,1003.8,6,0,0,21,0.41,2.86,19.3,26.3,333,341,36.4,34.4,27.1,21.4,18.5,0.103,0.11,0.162,0.302,1,3600.0,301.9,244.2,57.7,719.7,301.9,450.0,382.0,309.0,73.0,719.7,382.0,569.5,Eucalyptus L'Hér.; Tracheophyta; Magnoliopsida; Pinus pinaster Aiton
2011,2011-07-28,Porto,Vila Nova de Gaia,São Felix da Marinha,MOURÕES (Mourilhe),41.0305323,-8.6290322,Desconhecida,26.0,2011-07-28T14:00,33.7,24,10.6,33.8,0.0,0.0,0.0,0.0,0,1014.3,1011.4,0,0,0,0,0.78,3.95,14.1,15.0,322,333,26.3,38.8,26.3,22.0,19.0,0.09,0.124,0.193,0.319,1,3600.0,901.8,795.6,106.1,899.2,901.8,1173.6,926.0,817.0,109.0,899.2,926.0,1205.1,Eucalyptus L'Hér.; Magnoliopsida; Tracheophyta; Pinales; Pinus pinaster Aiton
2011,2011-07-29,Porto,Santo Tirso,Aves,Barca,41.3606851,-8.407702,NC,119.0,2011-07-29T05:00,23.0,59,14.6,24.1,0.0,0.0,0.0,0.0,0,1014.9,1001.1,14,7,0,27,0.01,1.16,3.1,8.4,216,211,14.4,19.9,25.1,21.6,17.9,0.104,0.15,0.228,0.339,0,0.0,0.0,0.0,0.0,0.0,0.0,0.0,0.0,0.0,0.0,0.0,0.0,0.0,Magnoliopsida; Tracheophyta; Pinus pinaster Aiton; Eucalyptus L'Hér.; Vitis vinifera L.; Pinales; Acacia Mill.; 
2011,2011-07-28,Porto,TROFA,Covelas,COURA (Corredoura),41.3008521,-8.5349796,Desconhecida,115.0,2011-07-28T14:00,32.5,25,9.7,34.7,0.0,0.0,0.0,0.0,0,1014.5,1001.6,0,0,0,0,0.69,3.69,2.3,3.1,18,45,17.6,35.2,25.5,21.3,18.1,0.122,0.141,0.21,0.343,1,3600.0,908.5,804.3,104.2,911.1,908.5,1170.9,933.0,826.0,107.0,911.1,933.0,1202.5,Magnoliopsida; Pinus pinaster Aiton; Vitis vinifera L.; Quercus L.; Tracheophyta; Eucalyptus L'Hér.; Olea europaea L.; ; Pinales
2011,2011-07-31,Porto,Matosinhos,São Mamede de Infesta,Cavadas,41.1903142,-8.6133088,NC,93.0,2011-07-31T00:00,18.1,90,16.5,19.5,0.0,0.0,0.0,0.0,0,1016.0,1005.0,0,0,0,0,0.0,0.21,6.3,9.8,283,298,13.7,21.1,24.5,21.8,18.4,0.116,0.145,0.222,0.344,0,0.0,0.0,0.0,0.0,0.0,0.0,0.0,0.0,0.0,0.0,0.0,0.0,0.0,Tracheophyta; Magnoliopsida
2011,2011-07-29,Braga,Celorico de Basto,Canedo de Basto,CORREDOURA(CANEDO)M2 (Corredoura),41.4455172,-7.956957651243487,NC,259.0,2011-07-29T15:00,30.3,36,13.5,31.3,0.0,0.0,0.0,0.0,0,1015.3,986.2,10,0,0,35,0.66,2.78,12.5,15.9,258,257,34.6,36.1,26.0,21.4,17.5,0.093,0.15,0.233,0.342,1,3600.0,800.6,695.8,104.8,879.1,800.6,1050.0,848.0,737.0,111.0,879.1,848.0,1112.2,Tracheophyta; Eucalyptus L'Hér.; Magnoliopsida; Pinus pinaster Aiton; Vitis vinifera L.
2011,2011-07-31,Porto,Lousada,Lustosa,CORGOS (Corgo),41.3321025,-8.3085374,NC,411.0,2011-07-31T02:00,17.4,85,14.8,18.3,0.0,0.0,0.0,0.0,0,1015.6,967.9,3,3,0,0,0.0,0.3,4.6,5.8,198,240,11.9,18.8,24.0,20.7,16.6,0.098,0.143,0.217,0.334,0,0.0,0.0,0.0,0.0,0.0,0.0,0.0,0.0,0.0,0.0,0.0,0.0,0.0,Vitis vinifera L.; Eucalyptus L'Hér.; Tracheophyta; Magnoliopsida
2011,2011-07-27,Porto,Maia,Avioso (São Pedro),LG. IGREJA (Largo da Igreja),41.2780956,-8.6155202,NC,97.0,2011-07-27T19:00,27.5,42,13.5,26.2,0.0,0.0,0.0,0.0,0,1013.0,1001.9,0,0,0,0,0.24,2.11,16.1,26.9,340,348,27.7,30.2,25.6,21.0,18.1,0.107,0.146,0.223,0.342,1,3600.0,121.0,87.0,34.0,550.2,121.0,209.7,192.0,138.0,54.0,550.2,192.0,332.6,Magnoliopsida; Eucalyptus L'Hér.; Tracheophyta; Vitis vinifera L.
2011,2011-07-27,Porto,Marco de Canaveses,Vila Boa de Quires,Quires,41.20809775,-8.20114511603261,Desconhecida,261.0,2011-07-27T17:00,31.3,23,7.5,29.7,0.0,0.0,0.0,0.0,0,1012.9,983.7,0,0,0,0,0.45,3.52,7.4,9.8,23,28,21.6,32.9,24.6,20.2,17.0,0.109,0.158,0.241,0.346,1,3600.0,494.7,418.6,76.1,812.4,494.7,683.3,572.0,484.0,88.0,812.4,572.0,790.0,Pinus pinaster Aiton; Tracheophyta; Eucalyptus L'Hér.; Magnoliopsida; Vitis vinifera L.; Quercus L.; Pinales; 
2011,2011-07-27,Porto,Vila do Conde,Mosteiró,LG. AROES (RIO MAU),41.2800819,-8.6608312,NC,59.0,2011-07-27T21:00,24.8,50,13.6,22.6,0.0,0.0,0.0,0.0,0,1014.3,1007.5,0,0,0,0,0.16,1.57,22.7,37.9,1,9,38.5,26.5,25.5,21.1,18.3,0.091,0.152,0.235,0.341,0,0.0,0.0,0.0,0.0,0.0,0.0,0.0,0.0,0.0,0.0,0.0,0.0,0.0,Eucalyptus L'Hér.
2011,2011-08-17,Porto,Gondomar,Valbom,SETE CAPELAS (Sete Caminhos),41.1435343,-8.5253272,NC,150.0,2011-08-17T15:00,23.7,55,14.1,24.6,0.0,0.0,0.0,0.0,0,1013.3,996.0,0,0,0,0,0.52,1.32,12.7,15.0,295,297,26.3,30.9,24.2,22.3,19.1,0.125,0.137,0.195,0.337,1,3600.0,750.4,651.8,98.6,870.3,750.4,999.3,799.0,694.0,105.0,870.3,799.0,1064.1,Magnoliopsida; Eucalyptus L'Hér.; Tracheophyta
2011,2011-08-17,Bragança,Macedo de Cavaleiros,Podence,PODENCE,41.562716,-6.9444115,NC,683.0,2011-08-17T15:00,29.1,27,8.2,28.5,0.0,0.0,0.0,0.0,0,1011.4,936.8,0,0,0,0,0.62,2.95,10.7,13.3,256,257,29.5,35.5,27.0,23.1,18.6,0.136,0.147,0.182,0.334,1,3600.0,746.6,653.1,93.6,889.5,746.6,979.7,798.0,698.0,100.0,889.5,798.0,1047.1,Olea europaea L.; Castanea sativa Mill.; Quercus L.; Magnoliopsida; Tracheophyta; Quercus suber L.
2011,2011-08-17,Portalegre,Portalegre,Urra,HERDADE DO PORTO DA BOGA,39.4005097,-7.4174073,Desconhecida,771.0,2011-08-17T16:00,29.4,22,5.3,27.4,0.0,0.0,0.0,0.0,0,1010.8,927.2,0,0,0,0,0.55,3.21,11.0,14.3,259,260,27.7,36.9,27.1,24.2,19.7,0.085,0.139,0.192,0.274,1,3600.0,609.1,523.1,86.0,852.8,609.1,818.5,680.0,584.0,96.0,852.8,680.0,913.8,Pinus pinaster Aiton; Quercus L.; Magnoliopsida; Tracheophyta; Olea europaea L.
2011,2011-08-17,Bragança,Vimioso,Uva,Mora,41.4739403,-6.5168993,NC,515.0,2011-08-17T13:00,28.8,37,12.5,30.6,0.0,0.0,0.0,0.0,0,1012.4,955.4,0,0,0,0,0.67,2.51,8.0,10.2,260,260,25.6,32.3,25.9,23.0,19.0,0.142,0.162,0.216,0.34,1,3600.0,906.9,797.4,109.5,909.5,906.9,1170.0,911.0,801.0,110.0,909.5,911.0,1175.2,Olea europaea L.; Magnoliopsida; Tracheophyta; Pinus pinaster Aiton
2011,2011-08-03,Viana do Castelo,Ponte da Barca,Vila Nova de Muia,STª RITA - VILA NOVA MUIA (Santa Rita),41.8005829,-8.391649212359795,NC,269.0,2011-08-03T16:00,24.2,57,15.1,24.7,0.0,0.0,0.0,0.0,0,1021.0,990.0,1,0,0,3,0.46,1.3,13.9,17.9,307,310,34.6,30.6,23.0,20.9,17.2,0.103,0.154,0.236,0.345,1,3600.0,628.9,526.2,102.7,802.0,628.9,871.5,692.0,579.0,113.0,802.0,692.0,958.9,Vitis vinifera L.; Tracheophyta; Eucalyptus L'Hér.; Magnoliopsida; Pinus pinaster Aiton
2011,2011-08-03,Braga,Guimarães,Gominhães,L. ESCOLAS (GOMINHÃES) M7 (CASTELÕES),41.4827506,-8.283272461002646,NC,244.0,2011-08-03T16:00,25.4,51,14.6,25.8,0.0,0.0,0.0,0.0,0,1020.3,992.3,0,0,0,0,0.49,1.59,13.7,17.6,293,296,31.7,31.3,23.5,21.7,17.8,0.109,0.142,0.215,0.333,1,3600.0,639.5,549.6,89.9,837.1,639.5,872.1,704.0,605.0,99.0,837.1,704.0,960.0,Magnoliopsida; Eucalyptus L'Hér.; Tracheophyta
2011,2011-08-03,Porto,Felgueiras,Vila Cova de Lixa,BARREIROS (Barreiro),41.3243291,-8.1571341,NC,306.0,2011-08-03T17:00,24.4,53,14.2,23.5,0.0,0.0,0.0,0.0,0,1020.7,985.6,0,0,0,0,0.38,1.43,15.3,20.1,300,303,33.8,30.1,23.5,21.4,17.4,0.106,0.146,0.226,0.338,1,3600.0,458.9,374.7,84.2,753.7,458.9,660.4,534.0,436.0,98.0,753.7,534.0,768.4,Magnoliopsida; Tracheophyta; Vitis vinifera L.; Eucalyptus L'Hér.
2011,2011-08-03,Vila Real,Mesão frio,Santa Cristina,ROJÃO,41.1726128,-7.8895537,NC,518.0,2011-08-03T23:00,17.0,85,14.5,17.7,0.0,0.0,0.0,0.0,0,1022.3,962.2,1,0,0,3,0.0,0.29,5.8,7.3,266,281,12.6,20.2,22.7,20.6,16.6,0.131,0.144,0.219,0.341,0,0.0,0.0,0.0,0.0,0.0,0.0,0.0,0.0,0.0,0.0,0.0,0.0,0.0,Eucalyptus L'Hér.; Vitis vinifera L.; Pinus pinaster Aiton; Magnoliopsida; Pinales
2011,2011-08-15,Aveiro,Sever do Vouga,Couto de Esteves,Qta da Espinheirinha (Dornelas),40.75758,-8.307421,Desconhecida,286.0,2011-08-15T12:00,26.4,54,16.3,29.2,0.0,0.0,0.0,0.0,0,1016.3,983.8,10,11,0,0,0.55,1.59,5.7,6.9,305,309,22.0,31.0,24.3,22.1,18.9,0.1,0.138,0.201,0.322,1,3600.0,808.1,579.8,228.2,656.3,808.1,1177.9,786.0,564.0,222.0,656.3,786.0,1145.8,Magnoliopsida; Pinus pinaster Aiton; Tracheophyta; Eucalyptus L'Hér.
2011,2011-08-15,Setúbal,Palmela,Pinhal Novo,RUA LUIS DE CAMÕES - TERRIM (Poceirão),38.630096,-8.9128319,Desconhecida,39.0,2011-08-15T15:00,28.9,50,17.4,30.4,0.0,0.0,0.0,0.0,0,1015.6,1011.1,12,9,0,14,0.6,2.0,17.1,21.7,309,312,36.0,35.9,26.1,23.3,20.6,0.057,0.059,0.083,0.197,1,3600.0,759.4,642.0,117.5,830.8,759.4,1030.4,808.0,683.0,125.0,830.8,808.0,1096.2,Vitis vinifera L.; Magnoliopsida; Olea europaea L.; Tracheophyta
2011,2011-08-15,Vila Real,Valpaços,Valpaços,Vale Casas (Alto de Vale Saim),41.60710385,-7.304712511472436,NC,414.0,2011-08-15T16:00,30.8,34,13.0,31.2,0.0,0.0,0.0,0.0,0,1014.3,968.4,0,0,0,0,0.51,2.94,7.8,9.5,292,295,21.2,35.5,26.8,22.5,18.5,0.124,0.15,0.192,0.331,1,3600.0,586.9,484.4,102.5,792.1,586.9,815.5,653.0,539.0,114.0,792.1,653.0,907.4,Olea europaea L.; Acacia Mill.; Tracheophyta; Magnoliopsida
2011,2011-07-27,Aveiro,Albergaria-a-Velha,Albergaria-a-Velha,FRIAS,40.690328,-8.479538190307041,Desconhecida,121.0,2011-07-27T11:00,29.4,32,10.9,29.2,0.0,0.0,0.0,0.0,0,1013.3,999.6,0,0,0,0,0.63,2.79,12.5,16.1,39,42,30.6,32.1,24.1,21.2,18.4,0.067,0.091,0.144,0.256,1,3600.0,855.4,744.4,111.0,862.0,855.4,1145.1,809.0,704.0,105.0,862.0,809.0,1083.0,Tracheophyta; Eucalyptus L'Hér.
2011,2011-07-27,Porto,Penafiel,Duas Igrejas,Oliveira,41.1864654,-8.2690378,NC,403.0,2011-07-27T12:00,27.5,29,8.0,27.0,0.0,0.0,0.0,0.0,0,1014.5,969.3,0,0,0,0,0.69,2.6,14.0,18.6,67,68,39.6,30.3,22.9,19.7,16.3,0.092,0.152,0.236,0.343,1,3600.0,943.3,832.4,110.9,907.4,943.3,1216.5,919.0,811.0,108.0,907.4,919.0,1185.2,Eucalyptus L'Hér.; Tracheophyta; Magnoliopsida
2011,2011-07-27,Porto,Vila Nova de Gaia,Pedroso,Alheira de Aquém,41.083123,-8.5366454,NC,101.0,2011-07-27T13:00,30.8,27,9.7,31.4,0.0,0.0,0.0,0.0,0,1014.3,1002.9,0,0,0,0,0.74,3.24,11.2,14.3,33,39,23.8,33.1,24.5,21.3,18.3,0.122,0.142,0.218,0.349,1,3600.0,954.2,844.2,110.0,912.2,954.2,1227.2,954.0,844.0,110.0,912.2,954.0,1226.9,Eucalyptus L'Hér.; Tracheophyta; Magnoliopsida
2011,2011-07-24,Santarém,Cartaxo,Pontével,PONTÉVEL,39.1485725,-8.877689484405941,Desconhecida,112.0,2011-07-24T16:00,29.0,35,12.2,26.4,0.0,0.0,0.0,0.0,0,1016.3,1003.5,0,0,0,1,0.64,2.59,28.5,38.3,344,345,55.1,34.9,25.1,21.8,19.1,0.113,0.203,0.273,0.348,1,3600.0,675.4,580.6,94.8,843.5,675.4,912.3,741.0,637.0,104.0,843.5,741.0,1000.8,Vitis vinifera L.; Eucalyptus L'Hér.; Tracheophyta
2011,2011-08-19,Vila Real,Chaves,Bustelo,BUSTELO,41.7861522,-7.4910633,NC,464.0,2011-08-19T13:00,32.4,26,10.3,33.8,0.0,0.0,0.0,0.0,0,1015.2,964.1,0,0,0,0,0.7,3.6,6.3,8.1,149,148,20.5,35.3,25.5,22.4,18.0,0.112,0.138,0.195,0.333,1,3600.0,899.2,794.5,104.7,913.7,899.2,1161.2,902.0,797.0,105.0,913.7,902.0,1164.9,Tracheophyta; Magnoliopsida; Vitis vinifera L.; Pinus pinaster Aiton
2011,2011-08-19,Vila Real,Vila Pouca de Aguiar,Vila Pouca de Aguiar,PENEDO DOS CORVOS - FREIRIA,41.50149155,-7.629094418050191,Desconhecida,913.0,2011-08-19T11:00,27.1,36,10.6,27.8,0.0,0.0,0.0,0.0,0,1016.9,917.5,0,0,0,0,0.56,2.31,6.5,8.2,161,157,24.8,29.5,22.7,20.6,16.4,0.112,0.142,0.207,0.333,1,3600.0,821.9,717.1,104.9,878.6,821.9,1089.9,776.0,677.0,99.0,878.6,776.0,1028.9,Magnoliopsida; Quercus L.; Pinus pinaster Aiton; Tracheophyta; Castanea sativa Mill.; Pinales
2011,2011-08-19,Viseu,Cinfães,Moimenta,VALINHAS (ESPADANEDO),41.0529498,-8.1993626,Desconhecida,364.0,2011-08-19T13:00,32.4,32,13.4,35.7,0.0,0.0,0.0,0.0,0,1014.8,974.5,0,0,0,0,0.66,3.32,1.1,1.6,180,153,15.5,35.2,23.5,21.5,18.1,0.103,0.145,0.219,0.335,1,3600.0,897.5,792.7,104.8,903.8,897.5,1171.2,899.0,794.0,105.0,903.8,899.0,1173.2,Magnoliopsida; Eucalyptus L'Hér.; Tracheophyta; Pinus pinaster Aiton; Castanea sativa Mill.; Quercus L.; 
2011,2011-08-19,Porto,Póvoa de Varzim,Argivai,S. MIGUEL O'ANJO (ESTELA),41.3756541,-8.7341865,NC,33.0,2011-08-19T14:00,31.3,39,15.6,33.3,0.0,0.0,0.0,0.0,0,1014.8,1011.1,0,0,0,0,0.68,2.79,11.7,11.6,304,306,20.9,35.6,24.2,22.2,19.5,0.097,0.138,0.203,0.322,1,3600.0,851.0,750.1,100.9,901.6,851.0,1110.9,877.0,773.0,104.0,901.6,877.0,1144.9,Tracheophyta; Eucalyptus L'Hér.; Pinus pinaster Aiton
2011,2011-08-31,Castelo Branco,Covilhã,São Martinho,Ribeiro Negro - Barrigais,40.2732358,-7.522488018895897,Desconhecida,910.0,2011-08-31T14:00,19.1,50,8.3,15.8,0.0,0.0,0.0,0.0,3,1008.7,907.9,100,77,84,98,0.32,1.12,19.8,26.6,199,199,42.5,23.0,20.7,20.8,18.8,0.14,0.187,0.259,0.363,1,2018.42,408.1,101.3,306.8,127.3,408.1,1068.3,423.0,105.0,318.0,127.3,423.0,1107.4,Magnoliopsida; Pinus pinaster Aiton; Acacia Mill.; Olea europaea L.
2011,2011-07-28,Porto,Felgueiras,Rande,LG BREIAS (JUGUEIROS),41.3308088,-8.2277133,NC,214.0,2011-07-28T23:00,26.0,49,14.6,26.8,0.0,0.0,0.0,0.0,0,1015.2,990.7,0,0,0,0,0.03,1.71,5.0,3.2,159,180,7.6,23.7,25.6,20.8,17.3,0.115,0.149,0.226,0.345,0,0.0,0.0,0.0,0.0,0.0,0.0,0.0,0.0,0.0,0.0,0.0,0.0,0.0,Magnoliopsida; Tracheophyta; Eucalyptus L'Hér.; Vitis vinifera L.
2011,2011-07-29,Bragança,Mirandela,Mirandela,CHOUPIM (Soutilha),41.47803215,-7.180141898960005,NC,236.0,2011-07-29T00:00,21.7,47,9.8,21.6,0.0,0.0,0.0,0.0,0,1015.9,988.6,0,0,0,0,0.0,1.38,0.4,4.0,270,100,6.5,22.7,26.5,22.5,18.4,0.129,0.16,0.213,0.339,0,0.0,0.0,0.0,0.0,0.0,0.0,0.0,0.0,0.0,0.0,0.0,0.0,0.0,Tracheophyta; Magnoliopsida; Olea europaea L.; Pinus pinaster Aiton
2011,2011-07-28,Porto,Gondomar,Rio Tinto,RUA RIO DE FORA (Rio Tinto),41.1845394,-8.5571542,NC,94.0,2011-07-28T19:00,28.4,48,16.3,29.0,0.0,0.0,0.0,0.0,0,1013.5,1002.8,12,0,0,41,0.19,2.01,11.1,18.7,331,337,22.7,30.9,26.5,21.3,18.2,0.117,0.146,0.224,0.346,1,3600.0,118.1,84.5,33.6,553.2,118.1,202.7,190.0,136.0,54.0,553.2,190.0,326.1,Tracheophyta; Magnoliopsida
2011,2011-07-29,Viana do Castelo,Monção,Longos Vales,QUINTA DA PEDRA,42.0496148,-8.4404588,Desconhecida,193.0,2011-07-29T03:00,17.1,87,14.9,17.7,0.0,0.0,0.0,0.0,0,1014.3,991.6,9,0,0,29,0.0,0.26,7.7,7.3,49,70,16.2,19.1,22.9,19.2,16.5,0.105,0.162,0.242,0.348,0,0.0,0.0,0.0,0.0,0.0,0.0,0.0,0.0,0.0,0.0,0.0,0.0,0.0,Vitis vinifera L.; Pinus pinaster Aiton; Tracheophyta; Magnoliopsida; Quercus L.; Eucalyptus L'Hér.; Acacia Mill.; 
2011,2011-07-25,Lisboa,Sintra,Almargem do Bispo,Covas de Ferro,38.8650922,-9.2485767,Desconhecida,295.0,2011-07-25T00:00,16.4,86,14.0,14.3,0.0,0.0,0.0,0.0,0,1017.1,982.4,15,17,0,0,0.02,0.27,23.1,38.8,346,349,46.8,18.9,22.8,20.6,18.3,0.091,0.172,0.244,0.339,0,0.0,0.0,0.0,0.0,0.0,0.0,0.0,0.0,0.0,0.0,0.0,0.0,0.0,Tracheophyta; Magnoliopsida; Pinus pinaster Aiton; Eucalyptus L'Hér.; Vitis vinifera L.; 
2011,2011-08-28,Braga,Guimarães,Costa,PARQUE DA CIDADE (COSTA)M5 (CASTELÕES),41.4355601,-8.2816985,NC,298.0,2011-08-28T16:00,23.5,46,11.1,22.7,0.0,0.0,0.0,0.0,0,1017.2,983.0,10,0,0,33,0.42,1.58,10.9,13.8,261,263,27.4,27.7,21.0,21.1,18.9,0.15,0.141,0.199,0.319,1,3600.0,555.2,439.3,115.8,767.7,555.2,767.2,623.0,493.0,130.0,767.7,623.0,860.9,Eucalyptus L'Hér.; Tracheophyta; Pinales; Magnoliopsida
2011,2011-08-28,Braga,Guimarães,Santa Eufémia Prazins,MONTE DE ALÉM (PRAZINS SANTA EUFÉMIA)M2 (Bouça do Monte),41.4868383,-8.3191267,NC,159.0,2011-08-28T16:00,23.8,47,11.9,23.1,0.0,0.0,0.0,0.0,0,1017.4,999.0,12,0,0,40,0.42,1.55,11.4,14.0,281,282,27.0,27.1,21.0,21.1,19.1,0.176,0.152,0.204,0.323,1,3600.0,555.5,433.3,122.2,755.8,555.5,768.6,623.0,486.0,137.0,755.8,623.0,862.0,Tracheophyta; Pinus pinaster Aiton; Eucalyptus L'Hér.; Pinus pinea L.; Magnoliopsida
2011,2011-08-28,Setúbal,Seixal,Fernão Ferro,MARCO DO GRILO - JUNTO A GALP (Casal do Marco),38.5654433,-9.0907969,Desconhecida,73.0,2011-08-28T17:00,23.0,50,11.9,21.0,0.0,0.0,0.0,0.0,0,1017.4,1008.9,0,0,0,0,0.35,1.42,18.1,23.7,317,319,36.7,29.5,23.9,22.8,21.2,0.058,0.066,0.108,0.213,1,3600.0,402.4,332.0,70.4,785.8,402.4,566.5,486.0,401.0,85.0,785.8,486.0,684.2,Tracheophyta; Pinus pinaster Aiton; Magnoliopsida
2011,2011-08-28,Viseu,Resende,Barrô,SAO DOIMNGOS-BARRO (BARRÔ),41.1291961,-7.8823471,Desconhecida,255.0,2011-08-28T18:00,22.3,56,13.2,22.0,0.0,0.0,0.0,0.0,0,1017.4,987.9,11,0,0,36,0.19,1.18,9.6,12.7,283,285,26.3,26.1,22.6,22.1,19.9,0.159,0.144,0.208,0.325,1,3600.0,185.9,138.1,47.9,645.1,185.9,286.9,268.0,199.0,69.0,645.1,268.0,413.5,Magnoliopsida; Pinus pinaster Aiton; Pinales; Vitis vinifera L.; Tracheophyta; Eucalyptus L'Hér.; Olea europaea L.; 
