2011,2011-09-14,Aveiro,Oliveira de Azemeis,Macinhata de Seixa,Alto do Monte,40.81937515,-8.469500639810587,Desconhecida,161.0,2011-09-14T12:00,30.5,43,16.5,33.5,0.0,0.0,0.0,0.0,0,1012.1,994.0,10,0,0,34,0.56,2.48,4.4,6.6,125,119,20.9,30.3,22.7,20.9,20.1,0.125,0.174,0.187,0.301,1,3600.0,786.3,670.1,116.1,850.2,786.3,1065.5,765.0,652.0,113.0,850.2,765.0,1036.7,Tracheophyta; Magnoliopsida; Eucalyptus L'Hér.
2011,2011-08-17,Porto,Valongo,Campo,ALTO DA RIBEIRA (Alto da Fonte),41.1773425,-8.4625916,NC,117.0,2011-08-17T12:00,22.9,64,15.7,24.8,0.0,0.0,0.0,0.0,1,1014.5,1000.9,40,45,0,0,0.49,1.02,9.0,10.5,307,308,23.0,28.7,23.7,22.6,19.4,0.113,0.139,0.203,0.331,1,3600.0,787.6,585.0,202.6,668.5,787.6,1167.7,766.0,569.0,197.0,668.5,766.0,1135.7,Magnoliopsida; Tracheophyta; Quercus suber L.; Vitis vinifera L.
2011,2011-07-30,Viana do Castelo,Ponte de Lima,Santa Maria Rebordões,CORUCHO-REB.STª MARIA (RENDUFE),41.7353587,-8.5781207,NC,74.0,2011-07-30T22:00,19.9,76,15.6,19.8,0.0,0.0,0.0,0.0,0,1016.1,1007.4,0,0,0,0,0.03,0.55,13.7,23.5,330,339,27.0,22.7,24.6,21.3,18.1,0.098,0.147,0.223,0.336,0,0.0,0.0,0.0,0.0,0.0,0.0,0.0,0.0,0.0,0.0,0.0,0.0,0.0,Eucalyptus L'Hér.; Pinus pinaster Aiton; Tracheophyta; Magnoliopsida
2011,2011-07-30,Aveiro,Estarreja,Veiros,Rua Nova dos Casalinhos,40.75077,-8.6129271,Desconhecida,8.0,2011-07-30T23:00,18.0,88,16.0,18.1,0.0,0.0,0.0,0.0,0,1016.6,1015.6,0,0,0,0,0.01,0.25,13.5,20.6,314,324,21.2,21.4,25.3,22.5,19.2,0.088,0.135,0.212,0.321,0,0.0,0.0,0.0,0.0,0.0,0.0,0.0,0.0,0.0,0.0,0.0,0.0,0.0,Tracheophyta; Magnoliopsida; Pinus pinaster Aiton
2011,2011-07-31,Viana do Castelo,Ponte da Barca,Vila Nova de Muia,LOTA-VILA NOVA DE MUIA (LINDOSO),41.8066265,-8.4012727,NC,48.0,2011-07-31T02:00,18.4,84,15.7,18.3,0.0,0.0,0.0,0.0,0,1015.0,1009.3,0,0,0,0,0.02,0.34,13.7,23.0,333,340,20.9,20.1,25.0,21.8,18.1,0.097,0.15,0.228,0.341,0,0.0,0.0,0.0,0.0,0.0,0.0,0.0,0.0,0.0,0.0,0.0,0.0,0.0,Tracheophyta; Vitis vinifera L.; Magnoliopsida; Eucalyptus L'Hér.; Pinus pinaster Aiton
2011,2011-08-23,Faro,Loulé,São Sebastião,Cerro de Cabeça de Camera (Cerca do Cerro),37.14550365,-8.06833615770782,Desconhecida,148.0,2011-08-23T16:00,26.1,48,14.2,24.9,0.0,0.0,0.0,0.0,0,1015.8,998.8,5,0,0,16,0.49,1.76,21.4,28.2,319,321,41.8,32.1,25.9,25.1,22.0,0.104,0.146,0.208,0.31,1,3600.0,588.6,485.2,103.5,797.5,588.6,813.8,660.0,544.0,116.0,797.5,660.0,912.4,Magnoliopsida; Tracheophyta; Ceratonia siliqua L.; Pinus pinaster Aiton; Olea europaea L.; Quercus suber L.; Vitis vinifera L.; 
2011,2011-08-17,Porto,Amarante,Telões,L.GRANJA (Granja),41.3096543,-8.1007731,Desconhecida,242.0,2011-08-17T13:00,24.3,54,14.3,26.3,0.0,0.0,0.0,0.0,0,1013.9,986.2,0,0,0,0,0.58,1.41,8.6,10.1,285,287,26.6,29.8,23.4,21.8,18.4,0.114,0.146,0.219,0.333,1,3600.0,871.8,719.0,152.8,816.8,871.8,1174.7,873.0,720.0,153.0,816.8,873.0,1176.3,Magnoliopsida; Pinus pinaster Aiton; Tracheophyta; Vitis vinifera L.; Eucalyptus L'Hér.; 
2011,2011-08-17,Braga,Guimarães,Vila Nova Sande,POJEIRA (V. N. SANDE) M.7 (Pojeira),41.4693469,-8.3535765,NC,131.0,2011-08-17T18:00,22.3,62,14.7,21.6,0.0,0.0,0.0,0.0,0,1012.8,997.6,0,0,0,0,0.22,1.02,14.8,19.1,311,313,29.2,28.3,24.9,22.2,19.0,0.106,0.143,0.205,0.325,1,3600.0,231.6,179.3,52.3,658.0,231.6,363.6,310.0,240.0,70.0,658.0,310.0,486.7,Eucalyptus L'Hér.; Magnoliopsida; Tracheophyta; Quercus L.
2011,2011-07-28,Porto,Lousada,Boim,POUPA (Pé da Serra),41.261773,-8.2817803,NC,239.0,2011-07-28T13:00,31.1,26,9.6,32.1,0.0,0.0,0.0,0.0,0,1015.3,988.5,0,0,0,0,0.74,3.33,9.2,11.4,101,103,33.5,33.8,24.6,20.9,17.4,0.093,0.15,0.232,0.342,1,3600.0,958.8,849.8,109.0,921.0,958.8,1223.9,959.0,850.0,109.0,921.0,959.0,1224.1,Tracheophyta; Eucalyptus L'Hér.; Pinus pinaster Aiton; Magnoliopsida; Vitis vinifera L.; ; Olea europaea L.
2011,2011-07-28,Faro,Lagoa,Carvoeiro,Poço Partido,37.112334,-8.454001,Desconhecida,37.0,2011-07-28T15:00,29.4,51,18.3,32.4,0.0,0.0,0.0,0.0,0,1015.0,1010.8,10,11,0,0,0.63,2.01,12.2,15.9,178,167,37.4,36.1,28.6,25.2,21.1,0.088,0.167,0.237,0.308,1,3600.0,801.6,679.0,122.6,833.7,801.6,1080.2,850.0,720.0,130.0,833.7,850.0,1145.5,Vitis vinifera L.; Magnoliopsida; Tracheophyta; Olea europaea L.
2011,2011-07-28,Porto,Lousada,Lustosa,LG SERRA (MIDÕES),41.3321025,-8.3085374,NC,411.0,2011-07-28T16:00,31.6,23,8.0,31.3,0.0,0.0,0.0,0.0,0,1014.2,968.7,0,0,0,0,0.55,3.57,5.5,6.8,302,302,16.2,35.3,24.9,20.1,16.4,0.098,0.144,0.221,0.336,1,3600.0,664.5,575.3,89.2,860.3,664.5,887.0,730.0,632.0,98.0,860.3,730.0,974.4,Vitis vinifera L.; Eucalyptus L'Hér.; Tracheophyta; Magnoliopsida
2011,2011-07-27,Porto,Santo Tirso,São Mamede Negrelos,Quintão,41.3488993,-8.403043,NC,145.0,2011-07-27T17:00,31.5,27,10.4,29.5,0.0,0.0,0.0,0.0,0,1012.8,996.5,0,0,0,0,0.53,3.37,15.6,21.3,341,344,24.8,33.6,25.4,20.7,17.6,0.119,0.143,0.213,0.341,1,3600.0,493.5,417.3,76.2,807.2,493.5,685.5,570.0,482.0,88.0,807.2,570.0,791.9,Magnoliopsida; Tracheophyta; Vitis vinifera L.; Quercus suber L.
2011,2011-07-27,Porto,Lousada,Caíde de Rei,L. MOURE (Monte da Pena),41.2665233,-8.2216457,NC,244.0,2011-07-27T19:00,29.9,28,9.5,28.8,0.0,0.0,0.0,0.0,0,1013.1,985.7,0,0,0,0,0.18,3.02,6.4,11.9,344,357,16.2,31.4,25.9,20.8,17.3,0.092,0.151,0.234,0.343,1,3600.0,119.6,85.4,34.3,556.8,119.6,203.3,192.0,137.0,55.0,556.8,192.0,326.3,Eucalyptus L'Hér.; Tracheophyta; Magnoliopsida
2011,2011-07-27,Santarém,Constância,Constância,Estrada 358/2 (Estrada da Serra),39.482611000000006,-8.326647983654219,NC,57.0,2011-07-27T22:00,27.5,38,11.9,26.2,0.0,0.0,0.0,0.0,0,1012.3,1005.8,0,0,0,0,0.13,2.29,12.9,24.3,330,339,28.8,29.0,29.2,23.9,20.6,0.042,0.065,0.113,0.217,0,0.0,0.0,0.0,0.0,0.0,0.0,0.0,0.0,0.0,0.0,0.0,0.0,0.0,Magnoliopsida; Olea europaea L.; Pinus pinea L.; Tracheophyta; Eucalyptus L'Hér.; Pinales
2011,2011-07-27,Braga,Barcelos,Tamel (Santa Leocádia),VARZIELA(TAMEL ST-ª LEOCADIA)M-2 (Varziela),41.5761592,-8.6498023,NC,143.0,2011-07-27T21:00,24.2,47,12.2,21.6,0.0,0.0,0.0,0.0,0,1014.3,997.8,0,0,0,0,0.16,1.6,22.7,37.9,1,9,38.5,26.0,25.1,20.5,17.6,0.097,0.149,0.226,0.339,0,0.0,0.0,0.0,0.0,0.0,0.0,0.0,0.0,0.0,0.0,0.0,0.0,0.0,Magnoliopsida; Eucalyptus L'Hér.; Tracheophyta; Pinus pinaster Aiton
2011,2011-06-11,Porto,Póvoa de Varzim,A-Ver-o-Mar,COVA DO COELHO (Cova da Andorinha),41.4037531,-8.7695279,NC,13.0,2011-06-11T16:00,20.1,51,9.7,17.6,0.0,0.0,0.0,0.0,1,1020.0,1018.5,27,0,1,89,0.38,1.14,17.8,21.4,317,319,34.6,25.3,20.1,18.7,16.0,0.122,0.216,0.294,0.368,1,3600.0,538.9,267.6,271.3,388.1,538.9,914.9,590.0,293.0,297.0,388.1,590.0,1001.6,Tracheophyta
2011,2011-07-27,Porto,Paredes,Baltar,Serra,41.1848137,-8.4031111,NC,350.0,2011-07-27T14:00,30.2,25,7.7,30.7,0.0,0.0,0.0,0.0,0,1014.2,975.1,0,0,0,0,0.71,3.23,8.4,10.8,65,64,27.4,33.7,23.7,19.9,16.6,0.094,0.151,0.234,0.342,1,3600.0,912.9,807.8,105.1,913.8,912.9,1172.3,938.0,830.0,108.0,913.8,938.0,1204.5,Magnoliopsida; Pinus pinaster Aiton; Eucalyptus L'Hér.; Tracheophyta; Vitis vinifera L.
2011,2011-07-27,Porto,Santo Tirso,Água Longa,PISAO (SANTO TIRSO),41.2603698,-8.4972609,NC,120.0,2011-07-27T18:00,30.2,32,11.7,28.5,0.0,0.0,0.0,0.0,0,1012.8,999.2,0,0,0,0,0.39,2.93,15.7,23.1,340,345,25.6,32.4,25.8,21.1,18.0,0.123,0.141,0.211,0.343,1,3600.0,303.4,244.0,59.4,714.7,303.4,452.7,383.0,308.0,75.0,714.7,383.0,571.5,Tracheophyta; Eucalyptus L'Hér.; Pinales; Vitis vinifera L.; Pinus pinaster Aiton
2011,2011-07-27,Viseu,Vila Nova de Paiva,Vila Cova à Coelheira,Picouto do Vasco-Carvalha (Padre Navalha),40.8777559,-7.802428,Desconhecida,734.0,2011-07-27T21:00,23.8,31,5.6,21.5,0.0,0.0,0.0,0.0,0,1014.7,933.2,0,0,0,0,0.09,2.04,8.7,22.7,45,49,20.9,25.1,24.5,19.9,15.9,0.111,0.156,0.239,0.348,0,0.0,0.0,0.0,0.0,0.0,0.0,0.0,0.0,0.0,0.0,0.0,0.0,0.0,Magnoliopsida; Pinus pinaster Aiton; Tracheophyta
2011,2011-07-27,Porto,Penafiel,Lagares,Ribas,41.127025,-8.369727,NC,192.0,2011-07-27T14:00,31.2,25,8.8,31.7,0.0,0.0,0.0,0.0,0,1013.9,992.3,0,0,0,0,0.73,3.4,9.8,12.9,62,63,30.6,33.6,24.3,20.7,17.6,0.116,0.152,0.232,0.348,1,3600.0,916.1,810.0,106.1,915.7,916.1,1173.0,941.0,832.0,109.0,915.7,941.0,1204.9,Eucalyptus L'Hér.; Magnoliopsida; Tracheophyta
2011,2011-07-29,Setúbal,Seixal,Amora,BAIRRO DA CHARNEQUINHA FOROS DE AMORA (Bairro 1º de Maio),38.6270207,-9.1185201,Desconhecida,32.0,2011-07-29T12:00,22.8,66,16.2,25.8,0.0,0.0,0.0,0.0,0,1016.8,1013.1,1,1,0,0,0.55,0.94,7.7,8.7,233,232,25.2,31.1,24.1,22.5,20.2,0.053,0.074,0.123,0.222,1,3600.0,910.6,747.0,163.6,805.3,910.6,1230.7,885.0,726.0,159.0,805.3,885.0,1196.0,Tracheophyta; Pinus pinea L.; Magnoliopsida
2011,2011-07-27,Porto,Vila Nova de Gaia,Pedroso,ALHEIRA D'AQUÉM (Alheira de Aquém),41.083123,-8.5366454,NC,101.0,2011-07-27T15:00,32.2,24,9.2,32.0,0.0,0.0,0.0,0.0,0,1013.5,1002.1,0,0,0,0,0.7,3.65,11.5,14.6,4,9,21.6,34.8,25.2,21.3,18.3,0.122,0.142,0.218,0.349,1,3600.0,812.0,713.6,98.3,892.2,812.0,1060.8,859.0,755.0,104.0,892.2,859.0,1122.2,Eucalyptus L'Hér.; Tracheophyta; Magnoliopsida
2011,2011-07-30,Braga,Guimarães,Donim,L. DEVESA (DONIM) M7 (DONIM),41.5297033,-8.30506908988599,NC,150.0,2011-07-30T21:00,22.1,66,15.5,22.9,0.0,0.0,0.0,0.0,0,1015.7,998.3,0,0,0,0,0.03,0.89,7.4,14.1,299,322,18.7,25.2,25.6,21.3,17.5,0.097,0.148,0.227,0.34,0,0.0,0.0,0.0,0.0,0.0,0.0,0.0,0.0,0.0,0.0,0.0,0.0,0.0,Quercus L.; Eucalyptus L'Hér.; Pinus pinaster Aiton; Magnoliopsida; Tracheophyta; Pinales; Olea europaea L.
2011,2011-07-30,Porto,Amarante,Telões,ZONA INDUSTRIAL (REBORDELO),41.3096543,-8.1007731,Desconhecida,242.0,2011-07-30T22:00,20.1,76,15.8,21.3,0.0,0.0,0.0,0.0,0,1016.4,988.2,0,0,0,0,0.0,0.56,5.4,6.6,217,229,10.4,23.2,24.9,21.1,17.3,0.104,0.154,0.236,0.343,0,0.0,0.0,0.0,0.0,0.0,0.0,0.0,0.0,0.0,0.0,0.0,0.0,0.0,Magnoliopsida; Pinus pinaster Aiton; Tracheophyta; Vitis vinifera L.; Eucalyptus L'Hér.; 
2011,2011-07-31,Viseu,Mortágua,Sobral,Vila Nova,40.44113065,-8.23302021546179,Desconhecida,167.0,2011-07-31T01:00,16.4,95,15.6,17.4,0.0,0.0,0.0,0.0,1,1016.3,996.5,46,51,0,0,0.0,0.09,6.5,12.2,304,313,13.3,20.7,25.8,22.9,18.6,0.097,0.138,0.207,0.326,0,0.0,0.0,0.0,0.0,0.0,0.0,0.0,0.0,0.0,0.0,0.0,0.0,0.0,Eucalyptus L'Hér.; Tracheophyta
2011,2011-08-11,Porto,Felgueiras,Jugueiros,LUGAR DA IGREJA NOVA (Lugar),41.4013104,-8.2104389,NC,157.0,2011-08-11T17:00,33.5,28,12.5,32.5,0.0,0.0,0.0,0.0,0,1013.4,995.9,0,0,0,1,0.49,3.73,12.6,17.0,323,328,27.4,33.8,25.4,21.8,18.8,0.127,0.149,0.208,0.328,1,3600.0,458.6,385.3,73.3,811.3,458.6,632.3,538.0,452.0,86.0,811.3,538.0,741.9,Pinus pinaster Aiton; Eucalyptus L'Hér.; Tracheophyta; Magnoliopsida
2011,2011-08-11,Vila Real,Vila Real,Campeã,Cotorinho,41.2659028,-7.8668611,NC,580.0,2011-08-11T17:00,31.8,23,7.9,30.0,0.0,0.0,0.0,0.0,0,1013.6,950.2,0,0,0,0,0.43,3.63,8.3,10.9,304,304,22.7,33.8,24.5,20.4,17.0,0.13,0.138,0.199,0.337,1,3600.0,446.5,377.6,68.9,802.8,446.5,626.3,525.0,444.0,81.0,802.8,525.0,736.4,Magnoliopsida; Pinus pinaster Aiton; Olea europaea L.; Pinales
2011,2011-08-15,Bragança,Vinhais,Moimenta,Moimenta-(Carvalhozo)-PNM (MOIMENTA),41.9508583,-6.9744425,NC,895.0,2011-08-15T11:00,24.0,51,13.2,24.9,0.0,0.0,0.0,0.0,0,1017.6,919.0,7,8,0,0,0.38,1.48,1.0,0.5,315,315,15.1,27.3,22.6,19.9,15.7,0.194,0.214,0.262,0.395,1,3600.0,582.2,303.3,279.0,366.9,582.2,1102.0,551.0,287.0,264.0,366.9,551.0,1042.9,Tracheophyta; Quercus L.; Magnoliopsida; Castanea sativa Mill.
2011,2011-08-15,Porto,Penafiel,Rãs,Enxameia,41.1702136,-8.2919262,NC,283.0,2011-08-15T15:00,27.9,49,16.1,29.7,0.0,0.0,0.0,0.0,0,1015.7,983.7,0,0,0,0,0.58,1.93,12.0,15.0,291,294,29.5,32.8,24.5,21.3,18.0,0.123,0.143,0.208,0.335,1,3600.0,748.7,648.2,100.5,860.5,748.7,1004.4,797.0,690.0,107.0,860.5,797.0,1069.3,Magnoliopsida; Eucalyptus L'Hér.; Tracheophyta; Vitis vinifera L.
2011,2011-08-15,Porto,Felgueiras,Borba de Godim,Ribeira,41.3219949,-8.1424064,NC,386.0,2011-08-15T18:00,25.3,58,16.6,25.9,0.0,0.0,0.0,0.0,0,1016.2,972.5,0,0,0,0,0.24,1.34,12.0,16.3,309,311,34.6,30.5,25.3,21.3,17.8,0.101,0.144,0.217,0.332,1,3600.0,232.5,179.2,53.2,647.4,232.5,369.2,310.0,239.0,71.0,647.4,310.0,492.3,Vitis vinifera L.; Tracheophyta; Magnoliopsida
2011,2011-08-15,Setúbal,Sesimbra,Quinta do Conde,CASAL DO SAPO - COZINHAS DE SESIMBRA (Casal),38.5562715,-9.079325951573804,NC,75.0,2011-08-15T19:00,21.9,77,17.6,22.1,0.0,0.0,0.0,0.0,0,1016.0,1007.2,2,2,0,0,0.1,0.62,17.6,25.1,325,328,37.4,27.1,25.6,23.0,20.6,0.054,0.069,0.114,0.217,1,3600.0,59.7,37.3,22.4,428.3,59.7,115.6,128.0,80.0,48.0,430.5,128.0,247.8,Magnoliopsida; Pinales; Tracheophyta; Pinus pinaster Aiton
2011,2011-08-03,Viana do Castelo,Arcos de Valdevez,Gondoriz,FERREIROS-GONDORIZ (Ferreiros),41.9110284,-8.4075451,NC,389.0,2011-08-03T19:00,21.3,68,15.1,21.9,0.0,0.0,0.0,0.0,0,1021.9,977.0,7,0,0,23,0.11,0.82,7.4,9.9,309,314,22.7,25.8,23.0,20.4,16.8,0.106,0.16,0.244,0.349,1,3600.0,100.7,68.3,32.4,492.3,100.7,184.4,168.0,114.0,54.0,492.3,168.0,307.6,Pinus pinaster Aiton; Magnoliopsida; Tracheophyta; Vitis vinifera L.; Quercus L.
2011,2011-08-03,Porto,Amarante,Mancelos,SRª DA COSTA (Senhora da Costa),41.2757739,-8.1585546,Desconhecida,247.0,2011-08-03T16:00,25.6,50,14.4,25.8,0.0,0.0,0.0,0.0,0,1020.4,992.1,0,0,0,0,0.49,1.64,14.0,18.1,299,301,32.4,31.5,23.6,21.7,17.8,0.106,0.146,0.226,0.338,1,3600.0,639.3,547.6,91.7,833.7,639.3,872.5,704.0,603.0,101.0,833.7,704.0,960.7,Tracheophyta; Magnoliopsida; Eucalyptus L'Hér.; Pinus pinaster Aiton; Vitis vinifera L.; 
2011,2011-08-03,Braga,Celorico de Basto,Infesta,L. REBORDÕES (INFESTA) M3 (São Clemente),41.4008308,-8.048084608930965,NC,433.0,2011-08-03T20:00,21.0,66,14.5,21.7,0.0,0.0,0.0,0.0,0,1021.4,971.5,2,0,0,5,0.03,0.84,5.4,11.7,274,279,22.3,24.9,23.8,21.2,17.1,0.108,0.143,0.22,0.335,0,450.1,0.0,0.0,0.0,0.0,0.0,0.0,24.0,11.0,13.0,108.7,24.0,76.0,Magnoliopsida; Pinus pinaster Aiton; Vitis vinifera L.; Tracheophyta
2011,2011-08-04,Porto,Matosinhos,Guifões,Gatões,41.2020549,-8.6592574,NC,58.0,2011-08-04T15:00,24.3,68,18.1,25.2,0.0,0.0,0.0,0.0,3,1020.6,1013.8,96,76,0,92,0.39,0.97,15.1,19.5,273,275,29.5,29.1,23.3,21.9,18.9,0.13,0.146,0.224,0.348,1,3600.0,552.1,294.5,257.7,375.3,552.1,1042.5,585.0,312.0,273.0,375.3,585.0,1104.6,Tracheophyta; Magnoliopsida
2011,2011-08-04,Faro,Lagoa,Parchal,Parchal,37.1358048,-8.51644341178837,NC,14.0,2011-08-04T17:00,29.1,48,16.8,27.3,0.0,0.0,0.0,0.0,0,1018.7,1017.1,0,0,0,0,0.49,2.11,28.9,38.6,327,329,49.0,31.9,25.8,24.6,21.8,0.132,0.167,0.232,0.306,1,3600.0,466.0,390.0,76.0,778.0,466.0,666.2,546.0,457.0,89.0,778.0,546.0,780.5,Tracheophyta; Magnoliopsida; Vitis vinifera L.; Ceratonia siliqua L.; Oryza sativa L.; Olea europaea L.; Quercus suber L.; Pinus pinea L.; Quercus rotundifolia Lam.; 
2011,2011-08-28,Leiria,Alcobaça,Turquel,COVÃO DO MILHO,39.4813678,-8.9301527,Desconhecida,200.0,2011-08-28T16:00,22.6,49,11.4,20.7,0.0,0.0,0.0,0.0,0,1018.1,994.9,0,0,0,0,0.44,1.39,19.5,24.0,326,327,39.6,31.8,23.9,23.2,21.1,0.085,0.158,0.224,0.335,1,3600.0,584.3,495.1,89.2,841.3,584.3,789.0,655.0,555.0,100.0,841.3,655.0,884.4,Magnoliopsida; Eucalyptus L'Hér.; Olea europaea L.; Tracheophyta
2011,2011-08-09,Braga,Vieira do Minho,Cova,PORTELINHA (COVA) M7 (Portelinha),41.6755312,-8.1631404,NC,291.0,2011-08-09T15:00,30.3,29,10.1,31.1,0.0,0.0,0.0,0.0,0,1019.4,986.6,0,0,0,0,0.63,3.07,6.9,9.5,47,53,23.4,29.7,21.7,20.7,17.7,0.181,0.158,0.221,0.335,1,3600.0,791.2,694.2,97.0,903.8,791.2,1022.1,840.0,737.0,103.0,903.8,840.0,1085.1,Quercus L.; Magnoliopsida; Tracheophyta; Pinus pinaster Aiton
2011,2011-08-09,Porto,Póvoa de Varzim,Estela,PEDRAS BRANCAS (Pedra Negra),41.450335,-8.7529154,NC,25.0,2011-08-09T15:00,30.8,31,11.9,31.1,0.0,0.0,0.0,0.0,0,1018.9,1016.0,0,0,0,0,0.67,3.05,13.0,16.9,5,16,26.6,32.1,23.0,21.5,19.1,0.133,0.141,0.212,0.328,1,3600.0,789.9,691.8,98.0,896.4,789.9,1027.0,838.0,734.0,104.0,896.4,838.0,1089.6,Tracheophyta
2011,2011-07-28,Porto,Felgueiras,Borba de Godim,Balazar,41.3219949,-8.1424064,NC,386.0,2011-07-28T18:00,30.7,25,8.7,29.1,0.0,0.0,0.0,0.0,0,1014.0,971.1,2,0,0,8,0.33,3.3,8.9,12.3,320,322,21.6,33.5,25.4,20.3,16.5,0.093,0.151,0.234,0.343,1,3600.0,296.4,236.5,59.9,707.0,296.4,443.7,376.0,300.0,76.0,707.0,376.0,562.8,Vitis vinifera L.; Tracheophyta; Magnoliopsida
2011,2011-07-28,Porto,Paços de Ferreira,Frazão,Vila Nova,41.2615463,-8.4087418,NC,298.0,2011-07-28T18:00,30.4,30,10.9,29.5,0.0,0.0,0.0,0.0,0,1013.7,980.4,2,0,0,7,0.32,3.03,8.2,11.1,319,324,16.2,33.5,25.8,20.6,17.0,0.094,0.149,0.23,0.341,1,3600.0,300.1,240.9,59.2,714.1,300.1,447.5,380.0,305.0,75.0,714.1,380.0,566.6,Eucalyptus L'Hér.; Tracheophyta; Magnoliopsida; Vitis vinifera L.; 
2011,2011-07-27,Braga,Celorico de Basto,Infesta,ROSSIO (INFESTA) M5 (Rossinho),41.4008308,-8.048084608930965,NC,433.0,2011-07-27T14:00,29.2,27,8.1,29.4,0.0,0.0,0.0,0.0,0,1014.6,966.4,0,0,0,0,0.72,2.98,10.6,14.2,66,66,34.9,33.5,24.1,20.2,16.5,0.098,0.148,0.229,0.341,1,3600.0,917.5,812.4,105.1,921.3,917.5,1169.4,943.0,835.0,108.0,921.3,943.0,1201.9,Magnoliopsida; Pinus pinaster Aiton; Vitis vinifera L.; Tracheophyta
2011,2011-07-28,Braga,Celorico de Basto,Arnoia,VILAR (ARNOIA) M3 (Lugar de Vilar),41.38407775,-8.000551177413247,NC,218.0,2011-07-28T14:00,31.7,26,9.9,33.4,0.0,0.0,0.0,0.0,0,1014.8,990.4,0,0,0,0,0.71,3.47,5.0,6.2,111,111,25.9,35.4,25.2,21.4,17.6,0.093,0.152,0.235,0.343,1,3600.0,912.7,807.7,105.1,917.0,912.7,1168.2,938.0,830.0,108.0,917.0,938.0,1200.5,Tracheophyta; Pinus pinaster Aiton; Magnoliopsida; Pinales; Vitis vinifera L.
2011,2011-07-28,Porto,Marco de Canaveses,Banho e Carvalhosa,QUINTA DO PAÇO (Quinta),41.2439665,-8.1556391,Desconhecida,277.0,2011-07-28T17:00,32.3,24,9.4,31.3,0.0,0.0,0.0,0.0,0,1013.7,982.9,0,0,0,0,0.45,3.66,6.4,7.9,313,317,15.1,34.2,25.0,20.4,16.9,0.106,0.156,0.239,0.345,1,3600.0,490.6,413.7,76.9,808.6,490.6,678.7,568.0,479.0,89.0,808.6,568.0,785.7,Tracheophyta; Pinus pinaster Aiton; Magnoliopsida; Vitis vinifera L.; Eucalyptus L'Hér.; 
2011,2011-08-24,Aveiro,Albergaria-a-Velha,Alquerubim,Paus,40.6374205,-8.4885711,Desconhecida,75.0,2011-08-24T19:00,20.2,58,11.6,18.3,0.0,0.0,0.0,0.0,0,1016.5,1007.7,4,0,7,0,0.12,1.0,16.6,22.6,326,326,27.4,24.0,23.4,22.6,20.0,0.096,0.077,0.11,0.224,1,3146.64,31.1,19.6,11.6,224.3,28.7,64.5,94.0,59.0,35.0,374.1,94.0,194.7,Magnoliopsida; Eucalyptus L'Hér.; Tracheophyta; Pinus pinaster Aiton; 
2011,2011-08-25,Porto,TROFA,Muro,LG. VILAR (Gravanço),41.3010941,-8.5941379,NC,119.0,2011-08-25T02:00,15.5,92,14.3,16.5,0.0,0.0,0.0,0.0,0,1015.7,1001.5,16,5,13,13,0.0,0.14,2.9,3.9,330,326,12.6,17.8,22.0,22.4,19.6,0.175,0.141,0.201,0.327,0,0.0,0.0,0.0,0.0,0.0,0.0,0.0,0.0,0.0,0.0,0.0,0.0,0.0,Tracheophyta; Eucalyptus L'Hér.; Magnoliopsida
2011,2011-07-28,Viana do Castelo,Ponte da Barca,Nogueira,COUTINHO (Couto),41.7899908,-8.4200146,NC,94.0,2011-07-28T23:00,23.7,63,16.1,24.6,0.0,0.0,0.0,0.0,0,1014.6,1003.7,0,0,0,0,0.04,1.09,8.1,11.0,13,32,17.3,24.1,26.0,21.0,17.7,0.098,0.153,0.232,0.342,0,0.0,0.0,0.0,0.0,0.0,0.0,0.0,0.0,0.0,0.0,0.0,0.0,0.0,Tracheophyta; Vitis vinifera L.; Quercus L.; Magnoliopsida
2011,2011-07-28,Porto,Maia,Vermoim,SEARA (SÃO PEDRO DE AVIOSO),41.2357067,-8.6089608,NC,80.0,2011-07-28T23:00,24.7,67,18.1,27.5,0.0,0.0,0.0,0.0,0,1014.8,1005.5,0,0,0,0,0.0,1.04,1.3,1.6,146,63,9.0,24.6,26.3,21.5,18.3,0.117,0.146,0.224,0.346,0,0.0,0.0,0.0,0.0,0.0,0.0,0.0,0.0,0.0,0.0,0.0,0.0,0.0,Tracheophyta; Eucalyptus L'Hér.; Magnoliopsida
2011,2011-07-28,Porto,Amarante,Real,PASSO (Passal),41.2472875,-8.172050257445942,Desconhecida,179.0,2011-07-28T19:00,30.6,33,12.5,30.2,0.0,0.0,0.0,0.0,0,1013.6,993.4,11,0,0,37,0.19,2.94,8.1,15.5,328,335,21.2,31.5,26.0,21.0,17.5,0.106,0.156,0.239,0.345,1,3600.0,118.0,84.6,33.4,563.6,118.0,199.1,191.0,137.0,54.0,563.6,191.0,322.4,Tracheophyta; Acacia Mill.; Magnoliopsida; Pinales; Eucalyptus L'Hér.; Vitis vinifera L.
2011,2011-07-30,Castelo Branco,Sertã,Cabeçudo,Junto cemitério do Cabeçudo,39.8303567,-8.1432476,Desconhecida,397.0,2011-07-30T15:00,29.0,36,12.6,28.8,0.0,0.0,0.0,0.0,0,1016.5,972.1,0,0,0,0,0.66,2.55,17.4,22.7,310,312,40.3,36.2,27.2,23.9,19.1,0.102,0.153,0.2,0.328,1,3600.0,803.7,702.8,100.9,880.8,803.7,1058.8,852.0,745.0,107.0,880.8,852.0,1122.4,Eucalyptus L'Hér.; Tracheophyta; Pinus pinaster Aiton; Olea europaea L.; Magnoliopsida
2011,2011-08-15,Setúbal,Palmela,Pinhal Novo,JT ESCOLA PRIMÁRIA CARREGUEIRA (Poceirão),38.630096,-8.9128319,NC,39.0,2011-08-15T15:00,28.9,50,17.4,30.4,0.0,0.0,0.0,0.0,0,1015.6,1011.1,12,9,0,14,0.6,2.0,17.1,21.7,309,312,36.0,35.9,26.1,23.3,20.6,0.057,0.059,0.083,0.197,1,3600.0,759.4,642.0,117.5,830.8,759.4,1030.4,808.0,683.0,125.0,830.8,808.0,1096.2,Vitis vinifera L.; Magnoliopsida; Olea europaea L.; Tracheophyta
2011,2011-08-15,Aveiro,Santa Maria da Feira,Romariz,Carvalhal (R. espadanal),40.9432485,-8.4589611,Desconhecida,302.0,2011-08-15T16:00,25.5,58,16.5,25.7,0.0,0.0,0.0,0.0,0,1016.2,981.8,16,18,0,0,0.46,1.38,17.9,22.7,310,312,35.6,31.6,24.6,21.4,18.3,0.114,0.141,0.208,0.334,1,3600.0,598.8,507.7,91.1,811.3,598.8,834.4,664.0,563.0,101.0,811.3,664.0,925.3,Eucalyptus L'Hér.; Tracheophyta; Pinales; Magnoliopsida
2011,2011-08-15,Porto,Felgueiras,Macieira da Lixa,Felgueiras,41.3496108,-8.1492033,NC,406.0,2011-08-15T15:00,28.1,46,15.3,29.5,0.0,0.0,0.0,0.0,0,1016.0,970.5,0,0,0,0,0.58,2.06,11.9,14.7,299,301,30.6,33.8,24.5,21.1,17.7,0.102,0.144,0.217,0.332,1,3600.0,734.5,620.8,113.6,826.3,734.5,1001.8,782.0,661.0,121.0,826.3,782.0,1066.6,Eucalyptus L'Hér.; Tracheophyta; Pinus pinaster Aiton; Magnoliopsida; Vitis vinifera L.
2011,2011-08-15,Aveiro,Santa Maria da Feira,Canedo,Várzea,41.0387586,-8.478814,Desconhecida,50.0,2011-08-15T18:00,24.7,65,17.7,24.6,0.0,0.0,0.0,0.0,0,1016.2,1010.4,6,7,0,0,0.24,1.09,20.4,26.4,328,331,36.4,30.8,26.7,23.0,19.8,0.114,0.118,0.165,0.309,1,3600.0,227.5,166.5,61.0,589.5,227.5,376.6,302.0,221.0,81.0,589.5,302.0,499.9,Eucalyptus L'Hér.; Pinus pinaster Aiton; Tracheophyta
2011,2011-08-15,Bragança,Vila FLor,Vilas Boas,VILAS BOAS,41.345593,-7.19272617444905,NC,599.0,2011-08-15T19:00,27.9,40,13.0,27.8,0.0,0.0,0.0,0.0,0,1015.3,949.0,0,0,0,0,0.12,2.26,6.9,13.6,298,302,21.2,31.9,28.1,23.2,18.7,0.11,0.15,0.173,0.312,1,3600.0,53.3,34.9,18.4,400.8,53.3,102.9,119.0,78.0,41.0,452.8,119.0,229.7,Magnoliopsida; Tracheophyta; Olea europaea L.; Vitis vinifera L.
2011,2011-08-15,Aveiro,Sever do Vouga,Rocas do Vouga,Nespereira de Cima,40.7599485,-8.3439116,Desconhecida,384.0,2011-08-15T22:00,18.9,90,17.1,21.0,0.0,0.0,0.0,0.0,0,1017.7,973.2,4,4,0,0,0.0,0.23,2.6,4.3,286,312,10.1,22.3,24.7,21.4,18.2,0.105,0.147,0.224,0.336,0,0.0,0.0,0.0,0.0,0.0,0.0,0.0,0.0,0.0,0.0,0.0,0.0,0.0,Eucalyptus L'Hér.; Tracheophyta
2011,2011-06-11,Viana do Castelo,Viana do Castelo,Vila Nova de Anha,MONTE GALEAO - ANHA (Monte),41.6659709,-8.7959069,Desconhecida,35.0,2011-06-11T20:00,15.7,68,9.9,14.2,0.0,0.0,0.0,0.0,1,1020.3,1016.1,22,0,0,73,0.05,0.57,10.0,14.3,330,332,26.6,19.7,20.0,18.5,15.8,0.108,0.214,0.298,0.372,1,2280.76,5.6,2.6,3.0,30.4,4.2,13.5,53.0,25.0,28.0,195.0,53.0,127.8,Magnoliopsida; Pinus pinaster Aiton; Tracheophyta; Eucalyptus L'Hér.
2011,2011-06-12,Porto,Maia,Avioso (São Pedro),PARQUE DO AVIOSO (Parque de Santo Ovídio),41.265597850000006,-8.612512261405886,NC,90.0,2011-06-12T14:00,20.2,55,10.9,20.0,0.0,0.0,0.0,0.0,1,1019.4,1008.8,27,0,33,23,0.47,1.07,12.6,15.7,290,290,32.0,24.8,19.4,18.3,15.7,0.14,0.213,0.288,0.369,1,3600.0,767.3,500.9,266.5,554.9,767.3,1197.3,789.0,515.0,274.0,554.9,789.0,1231.1,Magnoliopsida; Tracheophyta; Eucalyptus L'Hér.
2011,2011-06-12,Aveiro,Santa Maria da Feira,Paços de Brandão,Rua das Escolas (Rua das Costouras),40.9738702,-8.5915442,Desconhecida,105.0,2011-06-12T16:00,19.9,56,11.0,18.7,0.0,0.0,0.0,0.0,1,1018.9,1006.5,28,0,39,15,0.35,1.01,10.6,12.8,280,280,25.6,24.9,19.9,18.2,16.0,0.149,0.21,0.264,0.343,1,3600.0,512.2,317.7,194.5,460.2,512.2,915.8,561.0,348.0,213.0,460.2,561.0,1003.0,Pinus pinaster Aiton; Magnoliopsida; Tracheophyta; Eucalyptus L'Hér.; Pinales
2011,2011-06-12,Porto,Lousada,Lodares,Sequeiros,41.2389255,-8.2922928,NC,201.0,2011-06-12T18:00,18.7,62,11.2,17.6,0.0,0.0,0.0,0.0,0,1018.5,994.9,2,0,3,0,0.17,0.83,9.7,13.0,270,270,26.6,21.5,19.2,17.1,14.7,0.205,0.256,0.305,0.373,1,3600.0,194.3,95.5,98.7,266.9,194.3,474.7,242.0,119.0,123.0,266.9,242.0,591.4,Magnoliopsida; Tracheophyta; Eucalyptus L'Hér.; Pinus pinaster Aiton
2011,2011-06-12,Setúbal,Seixal,Corroios,AV BAIA NATURAL DO SEIXAL,38.6415327,-9.1522335,Desconhecida,10.0,2011-06-12T20:00,18.2,73,13.2,16.8,0.0,0.0,0.0,0.0,0,1019.6,1018.4,9,0,0,31,0.06,0.57,16.8,23.2,329,330,30.2,21.2,22.0,19.8,17.8,0.077,0.147,0.168,0.242,1,1936.55,0.0,0.0,0.0,0.0,0.0,0.0,47.0,24.0,23.0,196.3,47.0,106.2,Tracheophyta
2011,2011-08-18,Porto,Santo Tirso,Roriz,LG. CHÃOS (AVES),41.3515405,-8.3829071,NC,220.0,2011-08-18T05:00,16.2,91,14.6,17.0,0.0,0.0,0.0,0.0,2,1010.3,984.5,57,59,1,12,0.0,0.17,4.7,6.1,4,357,9.4,16.3,22.2,21.7,18.5,0.113,0.145,0.212,0.328,0,0.0,0.0,0.0,0.0,0.0,0.0,0.0,0.0,0.0,0.0,0.0,0.0,0.0,Magnoliopsida; Tracheophyta; Vitis vinifera L.; Quercus suber L.
2011,2011-08-18,Aveiro,Santa Maria da Feira,Canedo,Varzea,41.017568,-8.4518566,Desconhecida,188.0,2011-08-18T12:00,24.8,55,15.1,27.3,0.0,0.0,0.0,0.0,0,1011.0,989.5,4,0,1,10,0.56,1.42,7.1,7.8,300,304,25.2,30.3,22.8,22.1,19.1,0.113,0.118,0.163,0.307,1,3600.0,866.8,742.3,124.4,849.6,866.8,1166.4,843.0,722.0,121.0,849.6,843.0,1134.4,Pinus pinaster Aiton; Tracheophyta; Eucalyptus L'Hér.; Magnoliopsida
2011,2011-08-18,Viseu,Tondela,São Miguel do Outeiro,Fial,40.5882178,-8.027917,Desconhecida,358.0,2011-08-18T13:00,28.6,34,11.0,29.9,0.0,0.0,0.0,0.0,0,1010.3,970.3,12,0,0,39,0.66,2.6,7.8,9.2,248,244,23.8,34.6,25.0,23.5,19.7,0.093,0.137,0.191,0.314,1,3600.0,902.0,792.3,109.8,897.5,902.0,1178.4,904.0,794.0,110.0,897.5,904.0,1181.0,Pinus pinaster Aiton; Magnoliopsida; Olea europaea L.; Tracheophyta; Vitis vinifera L.
2011,2011-09-03,Bragança,Bragança,Rio Frio,Paço de Rio Frio (PAÇO),41.7146188,-6.6087914,NC,735.0,2011-09-03T13:00,21.0,50,10.3,19.7,0.0,0.0,0.0,0.0,3,1014.3,932.0,89,99,0,0,0.44,1.24,14.5,19.2,240,242,34.2,22.3,17.7,19.5,18.5,0.286,0.186,0.198,0.331,1,3600.0,666.2,421.0,245.2,513.8,666.2,1101.5,671.0,424.0,247.0,513.8,671.0,1109.5,Olea europaea L.; Castanea sativa Mill.; Magnoliopsida; Pinus pinaster Aiton; Tracheophyta; Quercus L.
