year,date,district,municipality,parish,local,latitude,longitude,cause,elevation,hourly.time,hourly.temperature_2m,hourly.relative_humidity_2m,hourly.dew_point_2m,hourly.apparent_temperature,hourly.precipitation,hourly.rain,hourly.snowfall,hourly.snow_depth,hourly.weather_code,hourly.pressure_msl,hourly.surface_pressure,hourly.cloud_cover,hourly.cloud_cover_low,hourly.cloud_cover_mid,hourly.cloud_cover_high,hourly.et0_fao_evapotranspiration,hourly.vapour_pressure_deficit,hourly.wind_speed_10m,hourly.wind_speed_100m,hourly.wind_direction_10m,hourly.wind_direction_100m,hourly.wind_gusts_10m,hourly.soil_temperature_0_to_7cm,hourly.soil_temperature_7_to_28cm,hourly.soil_temperature_28_to_100cm,hourly.soil_temperature_100_to_255cm,hourly.soil_moisture_0_to_7cm,hourly.soil_moisture_7_to_28cm,hourly.soil_moisture_28_to_100cm,hourly.soil_moisture_100_to_255cm,hourly.is_day,hourly.sunshine_duration,hourly.shortwave_radiation_instant,hourly.direct_radiation_instant,hourly.diffuse_radiation_instant,hourly.direct_normal_irradiance_instant,hourly.global_tilted_irradiance_instant,hourly.terrestrial_radiation_instant,hourly.shortwave_radiation,hourly.direct_radiation,hourly.diffuse_radiation,hourly.direct_normal_irradiance,hourly.global_tilted_irradiance,hourly.terrestrial_radiation,scientificNames
2016,2016-08-08,Porto,Marco de Canaveses,Alpendurada e Matos,Alpendorada (Casa Nova),41.0848007202148,-8.25579260932075,Reacendimento,162.0,2016-08-08T14:00,36.7,24,12.6,38.5,0.0,0.0,0.0,0.0,0,1018.9,1000.9,0,0,0,0,0.75,4.7,7.5,8.7,325,330,16.2,37.9,26.9,23.2,18.6,0.101,0.157,0.25,0.36,1,3600.0,882.2,784.1,98.1,912.2,882.2,1143.7,908.0,807.0,101.0,912.2,908.0,1177.2,Eucalyptus L'Hér.; Tracheophyta; Magnoliopsida; Pinus pinaster Aiton; Castanea sativa Mill.; Vitis vinifera L.
2016,2016-08-08,Porto,Felgueiras,Airães,Lugar de Pedraços (Monte da Pena Alta),41.3251190185547,-8.18260192871094,Reacendimento,321.0,2016-08-08T14:00,35.4,22,10.8,37.6,0.0,0.0,0.0,0.0,0,1019.2,983.7,0,0,0,0,0.7,4.46,2.9,4.0,353,5,20.2,37.5,26.2,22.6,17.7,0.091,0.154,0.248,0.359,1,3600.0,886.9,788.8,98.1,919.6,886.9,1141.3,913.0,812.0,101.0,919.6,913.0,1174.8,Magnoliopsida; Vitis vinifera L.; Tracheophyta; Pinales; Pinus pinaster Aiton
2016,2016-08-08,Porto,Penafiel,Capela,Lugar de Vila Meã (Igreja),41.1054550001356,-8.34822699970669,NC,293.0,2016-08-08T14:00,35.8,23,11.8,38.3,0.0,0.0,0.0,0.0,0,1019.2,986.8,0,0,0,0,0.7,4.5,2.9,4.0,353,5,20.2,37.0,26.0,22.4,17.7,0.101,0.157,0.25,0.36,1,3600.0,887.1,788.9,98.1,917.8,887.1,1143.7,913.0,812.0,101.0,917.8,913.0,1177.2,Tracheophyta; Eucalyptus L'Hér.
2016,2016-05-02,Porto,Santo Tirso,Couto (Santa Cristina),MONTALVÃO MACHADO (Teixeira),41.3219879998101,-8.48375500000185,NC,127.0,2016-05-02T17:00,20.6,58,12.0,19.0,0.0,0.0,0.0,0.0,0,1020.4,1005.5,0,0,0,0,0.32,1.02,14.6,19.8,327,331,25.2,21.2,16.4,13.6,11.9,0.298,0.327,0.371,0.417,1,3600.0,437.1,366.1,71.0,799.6,437.1,616.6,517.0,433.0,84.0,799.6,517.0,729.3,Eucalyptus L'Hér.; Magnoliopsida; Vitis vinifera L.; Tracheophyta; Pinus pinaster Aiton
2016,2016-08-08,Porto,Amarante,Figueiró (Santa Cristina),Lugar de Carido (Tapada da Preta),41.2940679995219,-8.16003799968296,Desconhecida,406.0,2016-08-08T14:00,34.9,22,10.2,36.7,0.0,0.0,0.0,0.0,0,1019.5,974.8,0,0,0,0,0.71,4.33,4.0,5.0,355,360,18.7,36.9,25.6,22.1,17.2,0.091,0.154,0.248,0.359,1,3600.0,886.0,786.9,99.1,917.4,886.0,1141.3,912.0,810.0,102.0,917.4,912.0,1174.8,Tracheophyta; Magnoliopsida; Eucalyptus L'Hér.; Vitis vinifera L.; Pinus pinaster Aiton
2016,2016-08-08,Porto,Vila Nova de Gaia,Pedroso,Lugar do Monte (Rampa de Borreles),41.0876549998919,-8.5756849998898,NC,127.0,2016-08-08T14:00,35.8,25,12.6,37.4,0.0,0.0,0.0,0.0,0,1019.1,1004.9,0,0,0,0,0.76,4.42,8.9,10.1,328,333,18.7,37.7,27.7,22.9,18.6,0.115,0.152,0.241,0.365,1,3600.0,882.9,783.7,99.2,909.9,882.9,1146.0,908.0,806.0,102.0,909.9,908.0,1178.6,Tracheophyta; Magnoliopsida; Eucalyptus L'Hér.
2016,2016-08-08,Porto,Paredes,Cete,LUGAR DO MONTE (Monte),41.1761700005002,-8.37203299999237,NC,190.0,2016-08-08T14:00,36.2,22,11.5,38.6,0.0,0.0,0.0,0.0,0,1019.2,998.1,0,0,0,0,0.7,4.65,2.9,4.0,353,5,20.2,37.0,26.8,22.7,18.2,0.123,0.141,0.221,0.362,1,3600.0,887.3,789.2,98.2,917.9,887.3,1143.9,913.0,812.0,101.0,917.9,913.0,1177.0,Magnoliopsida; Pinus pinaster Aiton; Eucalyptus L'Hér.; Tracheophyta; Vitis vinifera L.
2016,2016-08-08,Porto,Gondomar,São Pedro da Cova,Passal,41.1507820000251,-8.49765099949307,Desconhecida,116.0,2016-08-08T14:00,36.2,24,12.3,38.0,0.0,0.0,0.0,0.0,0,1018.9,1005.9,0,0,0,0,0.75,4.59,7.5,8.7,325,330,16.2,38.3,27.7,23.3,18.8,0.105,0.148,0.234,0.359,1,3600.0,882.7,784.5,98.2,911.9,882.7,1144.7,908.0,807.0,101.0,911.9,908.0,1177.5,Eucalyptus L'Hér.; Pinus pinaster Aiton; Tracheophyta; Magnoliopsida
2016,2016-08-08,Porto,Trofa,Alvarelhos,LUGAR PEDROGOSO (Fonte da Rivolta),41.3151169999441,-8.59799699995253,NC,110.0,2016-08-08T14:00,35.6,25,12.7,37.5,0.0,0.0,0.0,0.0,0,1018.9,1006.6,0,0,0,0,0.74,4.35,7.5,8.7,325,330,16.2,38.1,27.7,23.0,18.6,0.104,0.15,0.237,0.359,1,3600.0,883.0,784.8,98.2,912.5,883.0,1144.3,908.0,807.0,101.0,912.5,908.0,1176.7,Magnoliopsida; Pinales
2016,2016-08-08,Porto,Felgueiras,Varziela,Lugar de Cestais (VARZIELA),41.3500230000002,-8.21236399968465,Desconhecida,310.0,2016-08-08T14:00,35.8,22,10.7,38.0,0.0,0.0,0.0,0.0,0,1019.2,985.0,0,0,0,0,0.7,4.6,2.9,4.0,353,5,20.2,37.4,26.4,22.7,17.8,0.098,0.148,0.238,0.355,1,3600.0,887.2,789.1,98.1,919.8,887.2,1141.5,913.0,812.0,101.0,919.8,913.0,1174.7,Tracheophyta; Magnoliopsida; Vitis vinifera L.
2016,2016-08-08,Porto,Santo Tirso,Monte Córdova,Lugar do Carvalhinho (MONTE CORDOVA),41.3177719999684,-8.43806000020769,NC,399.0,2016-08-08T15:00,35.2,22,10.4,35.9,0.0,0.0,0.0,0.0,0,1018.7,974.8,0,0,0,0,0.68,4.42,7.9,9.8,330,332,22.0,37.6,26.0,21.9,17.1,0.093,0.154,0.248,0.359,1,3600.0,784.4,692.1,92.3,898.8,784.4,1024.6,833.0,735.0,98.0,898.8,833.0,1088.1,Pinus pinaster Aiton; Tracheophyta; Vitis vinifera L.; Eucalyptus L'Hér.; Magnoliopsida
2016,2016-08-08,Porto,Amarante,Candemil,Lugar de Gião (ED15 (ED15) Km 77),41.2482032775879,-7.97021484401491,Desconhecida,367.0,2016-08-08T15:00,35.5,22,10.4,36.4,0.0,0.0,0.0,0.0,0,1018.5,978.1,0,0,0,0,0.67,4.51,6.4,7.4,286,293,18.0,37.6,26.2,22.4,17.5,0.097,0.156,0.248,0.359,1,3600.0,781.1,689.8,91.3,897.6,781.1,1022.5,830.0,733.0,97.0,897.6,830.0,1086.6,Magnoliopsida; Quercus L.; Tracheophyta; Eucalyptus L'Hér.; Pinus pinaster Aiton; 
2016,2016-08-08,Porto,Santo Tirso,São Salvador do Campo,LUGAR BELAVISTA (Devesa),41.3566800000932,-8.34597499953376,NC,184.0,2016-08-08T15:00,36.3,24,12.7,37.9,0.0,0.0,0.0,0.0,0,1018.3,997.9,0,0,0,0,0.68,4.56,6.6,8.2,315,322,19.8,38.6,27.5,22.9,18.1,0.098,0.15,0.24,0.356,1,3600.0,784.7,692.4,92.3,898.3,784.7,1025.5,833.0,735.0,98.0,898.3,833.0,1088.6,Tracheophyta; Eucalyptus L'Hér.; Pinus pinaster Aiton; Vitis vinifera L.
2016,2016-05-02,Porto,Valongo,Sobrado,PARTEIRA (Balsa),41.2289369996389,-8.44110199981266,NC,159.0,2016-05-02T18:00,20.1,62,12.7,19.0,0.0,0.0,0.0,0.0,0,1020.2,1001.5,0,0,0,0,0.21,0.88,13.0,20.6,326,331,25.9,20.2,16.4,13.4,11.7,0.3,0.327,0.371,0.417,1,3600.0,240.1,188.5,51.6,688.2,240.1,368.8,321.0,252.0,69.0,688.2,321.0,493.2,Eucalyptus L'Hér.; Tracheophyta; Magnoliopsida; Vitis vinifera L.
2016,2016-08-08,Porto,Valongo,Alfena,Lugar de Sao Bartolomeu (São Lázaro),41.2389219999313,-8.52206500000424,NC,111.0,2016-08-08T15:00,35.8,27,13.7,36.6,0.0,0.0,0.0,0.0,0,1018.1,1005.7,0,0,0,0,0.73,4.3,12.7,15.5,313,316,24.5,38.6,28.1,23.3,18.8,0.105,0.148,0.234,0.359,1,3600.0,781.1,689.7,91.4,893.0,781.1,1027.5,829.0,732.0,97.0,893.0,829.0,1090.6,Eucalyptus L'Hér.; Tracheophyta; Magnoliopsida
2016,2016-08-08,Porto,Baião,Valadares,L. Furacasas (VALADARES),41.1441280004713,-7.98793000009325,Desconhecida,542.0,2016-08-08T16:00,34.8,21,9.1,34.4,0.0,0.0,0.0,0.0,0,1018.6,959.5,0,0,0,0,0.55,4.41,6.5,8.1,326,328,22.3,37.4,26.6,22.5,17.5,0.1,0.149,0.237,0.358,1,3600.0,613.1,523.6,89.5,818.9,613.1,850.8,678.0,579.0,99.0,818.9,678.0,940.8,Magnoliopsida; Pinus pinaster Aiton; Tracheophyta; Eucalyptus L'Hér.; Vitis vinifera L.; Pinales; Quercus L.; 
2016,2016-08-08,Porto,Vila Nova de Gaia,Madalena,Madalena (Rua do Campismo),41.1027829999394,-8.65850900014241,NC,17.0,2016-08-08T16:00,34.6,34,16.2,34.1,0.0,0.0,0.0,0.0,0,1018.0,1016.1,0,0,0,0,0.68,3.65,22.7,29.3,324,331,41.4,39.9,29.5,23.9,19.6,0.09,0.124,0.198,0.331,1,3600.0,638.8,555.4,83.4,860.0,638.8,859.3,705.0,613.0,92.0,860.0,705.0,948.4,Tracheophyta; Magnoliopsida; Eucalyptus L'Hér.; Pinus pinaster Aiton
2016,2016-08-08,Porto,Paços de Ferreira,Carvalhosa,lugar da boa vista (Barreiras),41.3034299998813,-8.35635500007206,NC,341.0,2016-08-08T15:00,34.9,24,11.5,36.1,0.0,0.0,0.0,0.0,0,1018.3,980.6,0,0,0,0,0.67,4.23,6.6,8.2,315,322,19.8,37.9,26.5,22.1,17.4,0.094,0.155,0.247,0.359,1,3600.0,784.6,692.3,92.3,897.9,784.6,1025.9,833.0,735.0,98.0,897.9,833.0,1089.1,Tracheophyta; Eucalyptus L'Hér.; Pinus pinaster Aiton; Magnoliopsida; Vitis vinifera L.; Quercus L.; 
2016,2016-08-08,Porto,Vila Nova de Gaia,Madalena,orbicoop (Rua da Marinha),41.1016510000494,-8.65451799975501,Desconhecida,27.0,2016-08-08T16:00,34.5,34,16.2,34.1,0.0,0.0,0.0,0.0,0,1018.0,1015.0,0,0,0,0,0.68,3.64,22.7,29.3,324,331,41.4,39.8,29.5,23.9,19.5,0.09,0.124,0.198,0.331,1,3600.0,638.8,555.4,83.4,860.0,638.8,859.3,705.0,613.0,92.0,860.0,705.0,948.4,Magnoliopsida; Tracheophyta; Eucalyptus L'Hér.; Pinus pinaster Aiton
2016,2016-08-08,Porto,Gondomar,Jovim,lugar de Cambitos (Cambitos),41.1064580000771,-8.51378200001187,Reacendimento,112.0,2016-08-08T13:00,35.8,24,12.4,38.4,0.0,0.0,0.0,0.0,0,1019.2,1006.7,0,0,0,0,0.73,4.44,4.5,5.3,14,28,18.4,37.1,27.3,23.2,18.8,0.116,0.142,0.224,0.362,1,3600.0,929.8,826.8,103.0,916.4,929.8,1200.4,930.0,827.0,103.0,916.4,930.0,1200.7,Vitis vinifera L.; Eucalyptus L'Hér.; Tracheophyta; Magnoliopsida
2016,2016-05-02,Porto,Gondomar,São Pedro da Cova,paradela (ER209 (ER209) Km 6),41.1557020001941,-8.51106000052558,NC,91.0,2016-05-02T18:00,19.5,65,12.8,18.5,0.0,0.0,0.0,0.0,0,1020.2,1009.4,0,0,0,0,0.2,0.79,13.0,20.6,326,331,25.9,20.3,16.8,13.9,12.2,0.286,0.326,0.374,0.416,1,3600.0,240.3,188.7,51.7,685.6,240.3,370.6,321.0,252.0,69.0,685.6,321.0,495.0,Tracheophyta; Eucalyptus L'Hér.; Pinus pinaster Aiton; Magnoliopsida
2016,2016-08-08,Porto,Lousada,Nespereira,lugar do cruzeiro (Vila Verde),41.2537249999576,-8.29667099952698,NC,207.0,2016-08-08T16:00,36.0,24,12.3,36.1,0.0,0.0,0.0,0.0,0,1018.1,995.1,0,0,0,0,0.6,4.52,9.8,12.5,306,311,24.5,38.4,27.6,23.2,18.3,0.093,0.154,0.247,0.359,1,3600.0,620.0,532.2,87.8,829.3,620.0,854.0,685.0,588.0,97.0,829.3,685.0,943.5,Tracheophyta; Olea europaea L.; Magnoliopsida; Vitis vinifera L.; Eucalyptus L'Hér.
2016,2016-08-08,Porto,Gondomar,Jovim,LUGAR DAS QUINTAS (Cambitos),41.1017979999383,-8.5129919995202,Reacendimento,143.0,2016-08-08T17:00,33.6,36,16.3,33.3,0.0,0.0,0.0,0.0,0,1017.8,1001.7,0,0,0,0,0.49,3.34,16.7,23.1,323,326,36.0,36.2,28.4,23.1,18.6,0.115,0.142,0.223,0.362,1,3600.0,420.7,343.7,77.0,709.3,420.7,644.8,492.0,402.0,90.0,709.3,492.0,754.1,Tracheophyta; Eucalyptus L'Hér.; Magnoliopsida
2016,2016-08-08,Porto,Felgueiras,Airães,L. Campelo (Monte da Pena Alta),41.3269195556641,-8.17867184109158,Reacendimento,334.0,2016-08-08T16:00,35.5,22,10.7,35.1,0.0,0.0,0.0,0.0,0,1018.1,981.3,0,0,0,0,0.6,4.5,9.8,12.5,306,311,24.5,37.9,26.8,22.5,17.6,0.091,0.154,0.247,0.358,1,3600.0,619.8,532.1,87.8,830.8,619.8,852.1,685.0,588.0,97.0,830.8,685.0,941.7,Vitis vinifera L.; Tracheophyta; Magnoliopsida; Pinales; Pinus pinaster Aiton
2016,2016-08-08,Porto,Trofa,Coronado (São Mamede),Lugar de Vilar de Lila (Pereiro),41.2836369999912,-8.57345000002119,NC,122.0,2016-08-08T17:00,33.1,38,17.1,33.4,0.0,0.0,0.0,0.0,0,1017.5,1003.8,0,0,0,0,0.47,3.12,15.0,21.3,316,321,28.8,35.9,28.4,23.0,18.5,0.104,0.15,0.237,0.359,1,3600.0,416.7,337.9,78.7,697.1,416.7,645.1,487.0,395.0,92.0,697.1,487.0,754.0,Tracheophyta; Pinales; Pinus pinaster Aiton; Magnoliopsida
2016,2016-08-08,Porto,Valongo,Campo,Balselhos (EN15 (EN15) Km 11),41.1822870000203,-8.46504400041368,NC,103.0,2016-08-08T16:00,34.8,31,15.4,35.1,0.0,0.0,0.0,0.0,0,1017.9,1006.3,0,0,0,0,0.63,3.8,15.3,19.9,313,316,28.4,37.8,28.4,23.4,18.9,0.104,0.147,0.234,0.358,1,3600.0,623.2,537.1,86.0,833.5,623.2,857.5,688.0,593.0,95.0,833.5,688.0,946.7,Magnoliopsida; Tracheophyta; Quercus suber L.; Pinus pinaster Aiton; Vitis vinifera L.
2016,2016-08-08,Porto,Baião,Campelo,L. Aboboreira (CAMPELO),41.1616096496582,-8.03568840026855,Reacendimento,582.0,2016-08-08T17:00,34.0,19,7.5,31.9,0.0,0.0,0.0,0.0,0,1018.5,955.0,4,0,6,0,0.43,4.27,9.7,12.9,329,330,27.0,35.6,26.6,22.0,16.9,0.111,0.142,0.22,0.358,1,3600.0,383.0,298.6,84.5,623.7,383.0,637.0,449.0,350.0,99.0,623.7,449.0,746.7,Tracheophyta; Pinus pinaster Aiton; Magnoliopsida; Eucalyptus L'Hér.; Pinales; Quercus L.; Vitis vinifera L.; 
2016,2016-08-08,Porto,Marco de Canaveses,Manhuncelos,LUGAR  BOI MORTO (Boi Morto),41.1533660888672,-8.14344501071506,Reacendimento,315.0,2016-08-08T18:00,34.1,29,13.4,33.7,0.0,0.0,0.0,0.0,0,1017.7,982.8,0,0,0,0,0.33,3.8,9.7,15.9,301,309,26.3,35.0,27.4,22.8,17.9,0.096,0.156,0.248,0.359,1,3600.0,251.9,202.1,49.8,675.4,251.9,398.2,329.0,264.0,65.0,675.4,329.0,520.1,Magnoliopsida; Pinus pinaster Aiton; Eucalyptus L'Hér.; Tracheophyta; Vitis vinifera L.; ; Quercus L.
2016,2016-08-08,Porto,Amarante,Fregim,Chãos (FREGIM),41.2632680002848,-8.10585199991862,Desconhecida,246.0,2016-08-08T17:00,35.0,26,12.9,34.2,0.0,0.0,0.0,0.0,0,1017.7,990.4,0,0,0,0,0.46,4.14,12.0,16.2,303,307,26.3,36.0,27.2,22.6,17.9,0.104,0.158,0.249,0.36,1,3600.0,391.0,307.4,83.7,639.9,391.0,639.1,458.0,360.0,98.0,639.9,458.0,748.5,Tracheophyta; Magnoliopsida; Pinus pinaster Aiton; Vitis vinifera L.; Quercus L.; Eucalyptus L'Hér.; 
2016,2016-08-08,Porto,Felgueiras,Torrados,L.Silvas (Igreja),41.3560066053602,-8.24173736572266,Reacendimento,324.0,2016-08-08T17:00,35.2,25,12.0,34.0,0.0,0.0,0.0,0.0,0,1017.7,981.9,0,0,0,0,0.47,4.27,12.0,16.2,303,307,26.3,36.5,27.4,22.7,17.7,0.098,0.148,0.237,0.354,1,3600.0,391.4,307.7,83.8,638.5,391.4,641.2,458.0,360.0,98.0,638.5,458.0,750.3,Tracheophyta; Vitis vinifera L.; Eucalyptus L'Hér.; Magnoliopsida
2016,2016-08-08,Porto,Trofa,Coronado (São Mamede),Lugar de lila (Ameal),41.2744859997431,-8.57776400036282,NC,148.0,2016-08-08T18:00,32.5,40,17.2,33.2,0.0,0.0,0.0,0.0,0,1017.4,1000.7,0,0,0,0,0.34,2.94,12.9,20.3,324,330,26.3,34.4,28.4,22.8,18.4,0.104,0.15,0.237,0.359,1,3600.0,256.3,205.5,50.8,674.4,256.3,405.4,333.0,267.0,66.0,674.4,333.0,526.8,Magnoliopsida; Pinales; Tracheophyta; Eucalyptus L'Hér.
2016,2016-08-08,Porto,Paços de Ferreira,Sanfins de Ferreira,LUGAR DE CAMPO NOVO (Alto do Castro),41.3297630002764,-8.36466300010681,Desconhecida,435.0,2016-08-08T18:00,32.7,31,13.6,32.2,0.0,0.0,0.0,0.0,0,1018.3,970.2,0,0,0,0,0.33,3.38,10.7,16.6,312,318,33.1,34.0,26.7,21.7,16.9,0.092,0.154,0.247,0.358,1,3600.0,262.5,210.3,52.2,697.6,262.5,401.1,342.0,274.0,68.0,697.6,342.0,522.6,Eucalyptus L'Hér.; Pinus pinaster Aiton; Magnoliopsida; Tracheophyta
2016,2016-08-08,Porto,Santo Tirso,Palmeira,Lugar da Igreja (Rio Pele),41.3606330002679,-8.50341200007333,Desconhecida,54.0,2016-08-08T19:00,32.7,38,16.7,33.4,0.0,0.0,0.0,0.0,0,1017.0,1010.9,0,0,0,0,0.21,3.06,11.4,20.3,332,343,23.8,33.6,29.2,23.5,18.9,0.116,0.145,0.227,0.359,1,3600.0,85.6,59.7,26.0,512.3,85.6,155.0,155.0,108.0,47.0,512.3,155.0,280.5,Magnoliopsida; Vitis vinifera L.; Tracheophyta; Pinus pinaster Aiton
2016,2016-08-08,Porto,Valongo,Valongo,Quinta Rei (Solgidro),41.1902199999491,-8.48756899992625,Desconhecida,131.0,2016-08-08T19:00,31.5,43,17.4,32.5,0.0,0.0,0.0,0.0,0,1017.0,1002.2,0,0,0,0,0.2,2.64,11.4,20.3,332,343,23.8,33.1,28.7,23.2,18.7,0.104,0.147,0.234,0.358,1,3600.0,85.1,59.3,25.8,515.1,85.1,153.1,155.0,108.0,47.0,515.1,155.0,279.0,Tracheophyta; Magnoliopsida; Eucalyptus L'Hér.
2016,2016-08-08,Porto,Maia,Águas Santas,Lugar manuel morreira silva (A3-N-S Km 4),41.2082023620605,-8.58382703999678,NC,68.0,2016-08-08T17:00,33.2,40,18.0,33.9,0.0,0.0,0.0,0.0,0,1017.5,1009.8,0,0,0,0,0.46,3.03,15.0,21.3,316,321,28.8,35.7,28.8,23.3,19.0,0.115,0.149,0.237,0.361,1,3600.0,416.8,338.1,78.7,695.4,416.8,646.9,487.0,395.0,92.0,695.4,487.0,755.8,Tracheophyta; Pinus pinaster Aiton; Magnoliopsida; Eucalyptus L'Hér.; 
2016,2016-08-08,Porto,Vila Nova de Gaia,Pedroso,Rua Aldeia Galega (Praceta da Pitança),41.0513305664063,-8.55784986707899,NC,150.0,2016-08-08T19:00,30.5,47,17.8,31.7,0.0,0.0,0.0,0.0,0,1017.4,1000.4,0,0,0,0,0.18,2.32,10.8,18.8,334,343,27.4,32.4,28.6,22.8,18.5,0.115,0.151,0.241,0.365,1,3600.0,84.6,59.4,25.3,512.9,84.6,154.0,154.0,108.0,46.0,512.9,154.0,280.2,Eucalyptus L'Hér.; Magnoliopsida; Tracheophyta
2016,2016-08-08,Porto,Vila Nova de Gaia,Pedroso,lugar da alheira daquem (Avenida de João XXI),41.0633320003086,-8.55785000006358,Desconhecida,134.0,2016-08-08T21:00,28.5,51,17.2,29.5,0.0,0.0,0.0,0.0,0,1017.8,1002.5,0,0,0,0,0.08,1.92,10.2,19.1,352,1,18.4,29.4,28.6,23.0,18.6,0.115,0.151,0.241,0.364,0,0.0,0.0,0.0,0.0,0.0,0.0,0.0,0.0,0.0,0.0,0.0,0.0,0.0,Magnoliopsida; Eucalyptus L'Hér.; Tracheophyta
2016,2016-08-08,Porto,Marco de Canaveses,Penha Longa,Carrapatelo,41.0885963439941,-8.13353729249703,Desconhecida,180.0,2016-08-08T20:00,30.7,49,18.9,32.3,0.0,0.0,0.0,0.0,0,1017.1,996.8,0,0,0,0,0.13,2.24,12.4,22.0,343,355,18.4,31.1,28.0,23.1,18.3,0.104,0.157,0.249,0.359,0,232.69,0.0,0.0,0.0,0.0,0.0,0.0,18.0,9.0,9.0,97.9,18.0,63.8,Tracheophyta; Quercus suber L.; Vitis vinifera L.; Magnoliopsida; Pinus pinaster Aiton
2016,2016-08-08,Porto,Felgueiras,Borba de Godim,Lugar de Agra (Tapada do Barreiro),41.326492000156,-8.1386240000195,Desconhecida,362.0,2016-08-08T21:00,28.7,43,15.1,29.3,0.0,0.0,0.0,0.0,0,1017.9,977.2,0,0,0,0,0.07,2.23,8.1,12.6,347,2,15.5,28.5,27.5,22.6,17.6,0.093,0.154,0.246,0.358,0,0.0,0.0,0.0,0.0,0.0,0.0,0.0,0.0,0.0,0.0,0.0,0.0,0.0,Vitis vinifera L.; Magnoliopsida; Tracheophyta; Pinus pinaster Aiton
2016,2016-08-08,Porto,Marco de Canaveses,Paredes de Viadores,Juncal,41.1421966552734,-8.12211990356445,Reacendimento,178.0,2016-08-08T20:00,30.7,49,18.9,32.9,0.0,0.0,0.0,0.0,0,1017.5,997.4,0,0,0,0,0.09,2.24,8.4,12.1,317,337,15.8,31.1,28.0,23.1,18.3,0.104,0.157,0.249,0.359,0,166.78,0.0,0.0,0.0,0.0,0.0,0.0,17.0,8.0,9.0,86.8,17.0,64.2,Magnoliopsida; Pinus pinaster Aiton; Eucalyptus L'Hér.; Tracheophyta; Vitis vinifera L.; 
2016,2016-08-08,Porto,Felgueiras,Borba de Godim,lugar de campelo (Balazar),41.3295379998949,-8.14265800052219,Desconhecida,351.0,2016-08-08T19:00,32.3,34,14.4,32.6,0.0,0.0,0.0,0.0,0,1017.4,978.4,0,0,0,0,0.17,3.19,7.5,12.8,305,320,22.3,33.1,27.6,22.7,17.7,0.093,0.154,0.246,0.358,1,3600.0,82.7,57.3,25.4,515.7,82.7,147.9,153.0,106.0,47.0,515.7,153.0,273.5,Vitis vinifera L.; Pinus pinaster Aiton; Magnoliopsida; Tracheophyta
2016,2016-08-08,Porto,Amarante,Vila Chã do Marão,lugar de novios (VILA CHÃO DO MARÃO),41.2907295057509,-8.02758502960205,Reacendimento,318.0,2016-08-08T21:00,30.6,38,14.5,30.4,0.0,0.0,0.0,0.0,0,1018.5,982.8,0,0,0,0,0.12,2.73,11.3,18.8,9,17,20.2,28.5,27.6,22.8,17.9,0.096,0.156,0.248,0.359,0,0.0,0.0,0.0,0.0,0.0,0.0,0.0,0.0,0.0,0.0,0.0,0.0,0.0,Eucalyptus L'Hér.; Magnoliopsida; Vitis vinifera L.; Pinus pinaster Aiton; Tracheophyta; 
2016,2016-08-08,Porto,Lousada,Nevogilde,lugar santiago (Barrimau),41.2535979999436,-8.3234849998686,NC,230.0,2016-08-08T20:00,30.3,46,17.5,31.8,0.0,0.0,0.0,0.0,0,1017.5,991.6,0,0,0,0,0.1,2.31,8.4,12.1,317,337,15.8,31.2,28.1,23.1,18.2,0.092,0.154,0.247,0.358,0,169.51,0.0,0.0,0.0,0.0,0.0,0.0,17.0,8.0,9.0,85.9,17.0,65.5,Eucalyptus L'Hér.; Quercus L.; Tracheophyta; Magnoliopsida; Vitis vinifera L.
2016,2016-08-08,Porto,Paços de Ferreira,Freamunde,Lugar de Plaina (Panelas),41.2948303222656,-8.33391954223315,NC,383.0,2016-08-08T21:00,27.8,47,15.4,28.4,0.0,0.0,0.0,0.0,0,1017.9,974.8,0,0,0,0,0.07,1.98,8.1,12.6,347,2,15.5,28.1,27.1,22.1,17.2,0.092,0.154,0.247,0.358,0,0.0,0.0,0.0,0.0,0.0,0.0,0.0,0.0,0.0,0.0,0.0,0.0,0.0,Tracheophyta; Eucalyptus L'Hér.; Magnoliopsida; Pinus pinaster Aiton; 
2016,2016-08-08,Porto,Baião,Gestaçô,Igreja (Casa Nova),41.1705630000432,-7.93826400015089,Desconhecida,654.0,2016-08-08T22:00,25.1,47,13.1,24.9,0.0,0.0,0.0,0.0,1,1020.4,947.3,34,0,43,27,0.07,1.68,8.6,16.2,2,12,20.2,25.8,26.5,21.8,16.6,0.119,0.141,0.219,0.359,0,0.0,0.0,0.0,0.0,0.0,0.0,0.0,0.0,0.0,0.0,0.0,0.0,0.0,Pinus pinaster Aiton; Magnoliopsida; Eucalyptus L'Hér.; Tracheophyta; Vitis vinifera L.; Quercus L.; 
2016,2016-08-08,Porto,Felgueiras,Vila Cova da Lixa,lordelo (Eira Vedra),41.323111000061,-8.15441399998135,Desconhecida,355.0,2016-08-08T21:00,28.4,46,15.6,29.1,0.0,0.0,0.0,0.0,0,1017.9,977.9,0,0,0,0,0.07,2.1,8.1,12.6,347,2,15.5,28.3,27.3,22.4,17.5,0.091,0.154,0.247,0.358,0,0.0,0.0,0.0,0.0,0.0,0.0,0.0,0.0,0.0,0.0,0.0,0.0,0.0,Magnoliopsida; Tracheophyta; Vitis vinifera L.; Eucalyptus L'Hér.
2016,2016-08-08,Porto,Vila Nova de Gaia,Sandim,Lugar do Monte (Travessa da Várzea),41.0280959998237,-8.50712699996101,NC,117.0,2016-08-08T21:00,29.0,50,17.5,29.8,0.0,0.0,0.0,0.0,0,1017.5,1004.1,0,0,0,0,0.11,2.01,13.0,23.6,358,8,19.4,29.9,29.2,23.4,19.0,0.105,0.12,0.183,0.331,0,0.0,0.0,0.0,0.0,0.0,0.0,0.0,0.0,0.0,0.0,0.0,0.0,0.0,Tracheophyta; Eucalyptus L'Hér.; Magnoliopsida
2016,2016-08-08,Porto,Marco de Canaveses,Tabuado,Verdeal (Calvário),41.1821350002289,-8.1269710000356,Desconhecida,209.0,2016-08-08T23:00,28.3,45,15.4,28.7,0.0,0.0,0.0,0.0,0,1018.3,994.5,4,0,6,1,0.09,2.11,10.2,18.7,48,40,15.8,25.6,27.5,22.9,18.2,0.104,0.157,0.249,0.359,0,0.0,0.0,0.0,0.0,0.0,0.0,0.0,0.0,0.0,0.0,0.0,0.0,0.0,Quercus L.; Tracheophyta; Magnoliopsida; Pinus pinaster Aiton; Vitis vinifera L.; Eucalyptus L'Hér.; 
2016,2016-08-08,Porto,Vila Nova de Gaia,Gulpilhares,Fojo (Travessa Nuno Álvares),41.0762080001831,-8.626972000334,NC,70.0,2016-08-08T22:00,28.2,52,17.3,28.6,0.0,0.0,0.0,0.0,0,1017.5,1009.5,1,0,1,0,0.12,1.84,14.8,25.1,354,8,21.6,28.7,28.9,23.4,19.0,0.115,0.151,0.241,0.364,0,0.0,0.0,0.0,0.0,0.0,0.0,0.0,0.0,0.0,0.0,0.0,0.0,0.0,Tracheophyta; Eucalyptus L'Hér.; Magnoliopsida
2016,2016-08-08,Porto,Vila Nova de Gaia,Pedroso,Lugar da Feira Nova (Rua de São Pedro de Pedroso),41.0655160003238,-8.55624099996355,Desconhecida,129.0,2016-08-08T22:00,27.8,52,16.9,28.8,0.0,0.0,0.0,0.0,0,1017.9,1003.1,11,0,17,1,0.08,1.8,9.8,18.4,17,17,17.6,28.3,28.5,23.0,18.6,0.115,0.151,0.241,0.364,0,0.0,0.0,0.0,0.0,0.0,0.0,0.0,0.0,0.0,0.0,0.0,0.0,0.0,Magnoliopsida; Eucalyptus L'Hér.; Tracheophyta
2016,2016-08-08,Porto,Penafiel,Santa Marta,Rua nova pala (A4-O-E Km 40),41.2191950000657,-8.25550300015344,NC,357.0,2016-08-08T23:00,24.6,54,14.8,24.7,0.0,0.0,0.0,0.0,0,1018.3,977.6,4,0,6,1,0.07,1.41,10.2,18.7,48,40,15.8,25.1,27.1,22.5,17.5,0.091,0.154,0.247,0.358,0,0.0,0.0,0.0,0.0,0.0,0.0,0.0,0.0,0.0,0.0,0.0,0.0,0.0,Tracheophyta; Magnoliopsida; Eucalyptus L'Hér.; Vitis vinifera L.; Quercus L.; Pinales
2016,2016-08-08,Porto,Trofa,Bougado (São Martinho),Valdeirigo (Paranho),41.3314150004917,-8.55394499990675,NC,83.0,2016-08-08T23:00,26.9,50,15.6,26.9,0.0,0.0,0.0,0.0,0,1017.8,1008.2,1,0,2,0,0.1,1.77,12.9,25.3,18,26,23.0,27.7,28.7,23.3,18.8,0.104,0.15,0.237,0.358,0,0.0,0.0,0.0,0.0,0.0,0.0,0.0,0.0,0.0,0.0,0.0,0.0,0.0,Tracheophyta; Magnoliopsida; Pinus pinaster Aiton; Pinales
2016,2016-08-09,Porto,Paços de Ferreira,Carvalhosa,Aldozinde (Facho),41.2967889997694,-8.35875,NC,331.0,2016-08-09T00:00,23.7,53,13.7,23.4,0.0,0.0,0.0,0.0,0,1018.5,980.6,2,0,0,5,0.06,1.36,9.7,17.7,45,39,17.3,24.8,27.1,22.4,17.5,0.094,0.154,0.247,0.358,0,0.0,0.0,0.0,0.0,0.0,0.0,0.0,0.0,0.0,0.0,0.0,0.0,0.0,Tracheophyta; Eucalyptus L'Hér.; Pinus pinaster Aiton; Magnoliopsida; Vitis vinifera L.; Quercus L.; 
2016,2016-08-09,Porto,Vila Nova de Gaia,Madalena,Orbicup (Rua da Cova Marinha),41.1010370000203,-8.65786499977112,NC,18.0,2016-08-09T01:00,25.9,57,16.6,25.7,0.0,0.0,0.0,0.0,0,1017.3,1015.2,0,0,0,0,0.11,1.44,17.3,30.6,359,9,29.2,26.5,29.3,24.1,19.6,0.09,0.124,0.198,0.331,0,0.0,0.0,0.0,0.0,0.0,0.0,0.0,0.0,0.0,0.0,0.0,0.0,0.0,Magnoliopsida; Tracheophyta; Eucalyptus L'Hér.
2016,2016-08-09,Porto,Maia,Folgosa,Folgosa (Pedrosa),41.272705078125,-8.54996490478516,NC,121.0,2016-08-09T01:00,25.0,52,14.4,24.8,0.0,0.0,0.0,0.0,0,1017.9,1003.9,1,0,2,0,0.08,1.53,11.4,22.6,18,31,25.9,26.0,28.2,23.2,18.6,0.118,0.143,0.224,0.359,0,0.0,0.0,0.0,0.0,0.0,0.0,0.0,0.0,0.0,0.0,0.0,0.0,0.0,Magnoliopsida; Eucalyptus L'Hér.; Tracheophyta; Pinus pinaster Aiton; 
2016,2016-08-09,Porto,Marco de Canaveses,Paredes de Viadores,Viadores (Nuvens),41.1278762817383,-8.13498974283536,Reacendimento,440.0,2016-08-09T01:00,24.4,53,14.3,24.5,0.0,0.0,0.0,0.0,0,1018.4,968.5,0,0,0,0,0.06,1.43,8.9,12.7,47,35,18.0,23.3,26.7,22.5,17.6,0.119,0.14,0.219,0.36,0,0.0,0.0,0.0,0.0,0.0,0.0,0.0,0.0,0.0,0.0,0.0,0.0,0.0,Magnoliopsida; Pinus pinaster Aiton; Eucalyptus L'Hér.; Tracheophyta; Vitis vinifera L.; 
2016,2016-05-03,Porto,Valongo,Sobrado,rua alto de vilar (Vale da Cobra),41.2186029999786,-8.47399000008901,NC,165.0,2016-05-03T00:00,11.8,92,10.6,11.1,0.0,0.0,0.0,0.0,0,1020.9,1000.9,0,0,0,0,0.0,0.11,6.0,12.0,57,49,14.8,13.2,15.8,13.5,11.8,0.289,0.326,0.373,0.416,0,0.0,0.0,0.0,0.0,0.0,0.0,0.0,0.0,0.0,0.0,0.0,0.0,0.0,Eucalyptus L'Hér.; Magnoliopsida; Tracheophyta; Pinus pinaster Aiton
2016,2016-08-09,Porto,Penafiel,Lagares,Lugar de Ribas (Carvalhas),41.1371429999669,-8.33498299996058,NC,361.0,2016-08-09T02:00,22.4,63,15.1,22.7,0.0,0.0,0.0,0.0,0,1018.0,976.6,0,0,0,0,0.04,0.99,9.4,16.5,67,58,23.4,22.9,26.9,22.7,17.9,0.1,0.152,0.244,0.358,0,0.0,0.0,0.0,0.0,0.0,0.0,0.0,0.0,0.0,0.0,0.0,0.0,0.0,Magnoliopsida; Eucalyptus L'Hér.; Vitis vinifera L.
2016,2016-08-09,Porto,Lousada,Aveleda,Quinta dos Ingleses (Barrimau de Cima),41.2761580000983,-8.24072700023651,NC,199.0,2016-08-09T02:00,22.2,62,14.6,22.3,0.0,0.0,0.0,0.0,0,1018.0,994.9,0,0,0,0,0.04,1.01,9.4,16.5,67,58,23.4,22.9,26.9,22.9,18.2,0.112,0.15,0.237,0.36,0,0.0,0.0,0.0,0.0,0.0,0.0,0.0,0.0,0.0,0.0,0.0,0.0,0.0,Tracheophyta; Magnoliopsida; Vitis vinifera L.; Pinus pinaster Aiton
