2016,2016-05-04,Porto,Felgueiras,Pinheiro,LG. POEIRA DE CIMA (ER101-4 (ER101-4) Km 4),41.3648669995202,-8.15110699998008,Desconhecida,504.0,2016-05-04T11:00,21.8,47,9.8,21.9,0.0,0.0,0.0,0.0,1,1016.0,958.7,28,0,0,93,0.52,1.39,9.7,12.6,94,95,31.7,19.4,13.8,11.6,9.4,0.276,0.32,0.37,0.415,1,3600.0,863.7,704.6,159.0,827.8,863.7,1145.5,820.0,669.0,151.0,827.8,820.0,1087.5,Pinus pinaster Aiton; Tracheophyta; Magnoliopsida; Eucalyptus L'Hér.; Vitis vinifera L.
2016,2016-08-09,Porto,Maia,Águas Santas,Lugar da Cabroneira (A3-N-S Km 4),41.2082023620605,-8.58382703999678,NC,68.0,2016-08-09T17:00,30.7,39,15.2,29.4,0.0,0.0,0.0,0.0,0,1014.4,1006.7,19,0,1,61,0.48,2.68,20.7,29.0,340,343,34.6,33.6,28.5,23.6,19.0,0.115,0.148,0.235,0.36,1,3600.0,419.7,328.3,91.5,679.7,419.7,642.9,491.0,384.0,107.0,679.7,491.0,752.0,Tracheophyta; Pinus pinaster Aiton; Magnoliopsida; Eucalyptus L'Hér.; 
2016,2016-08-09,Porto,Paredes,Mouriz,Lugar da Devesa (Barreiras),41.19875,-8.36127500004238,NC,241.0,2016-08-09T17:00,31.0,32,12.5,29.8,0.0,0.0,0.0,0.0,1,1014.3,987.3,22,0,4,65,0.44,3.03,13.6,18.2,338,342,31.0,33.6,27.4,22.6,18.0,0.122,0.139,0.218,0.361,1,3600.0,400.4,299.7,100.7,624.3,400.4,638.9,469.0,351.0,118.0,624.3,469.0,748.3,Magnoliopsida; Pinus pinaster Aiton; Eucalyptus L'Hér.; Tracheophyta; Vitis vinifera L.
2016,2016-08-09,Porto,Lousada,Aveleda,Lugar de Duas Pontes (Paiva),41.2802060000102,-8.25974399990506,Desconhecida,254.0,2016-08-09T17:00,31.3,30,11.5,29.8,0.0,0.0,0.0,0.0,1,1014.3,985.9,22,0,4,65,0.45,3.21,13.6,18.2,338,342,31.0,34.9,27.9,23.1,18.1,0.092,0.153,0.245,0.358,1,3600.0,400.3,299.5,100.7,625.9,400.3,637.0,469.0,351.0,118.0,625.9,469.0,746.4,Vitis vinifera L.; Magnoliopsida; Tracheophyta; Eucalyptus L'Hér.; Pinus pinaster Aiton
2016,2016-08-09,Porto,Amarante,Fregim,Lugar De Chaos (Ribeira de Fregim),41.2729530334473,-8.11092185974121,Reacendimento,231.0,2016-08-09T17:00,31.9,30,12.0,30.5,0.0,0.0,0.0,0.0,1,1014.3,988.5,22,0,4,65,0.45,3.33,13.6,18.2,338,342,31.0,34.6,27.6,22.9,18.1,0.103,0.156,0.248,0.359,1,3600.0,400.3,299.5,100.7,625.9,400.3,637.0,469.0,351.0,118.0,625.9,469.0,746.4,Tracheophyta; Magnoliopsida; Pinus pinaster Aiton; Vitis vinifera L.; Quercus L.; Eucalyptus L'Hér.; 
2016,2016-08-09,Porto,Paredes,Rebordosa,Lugar de Santa Marinha (Portela),41.2025800000297,-8.42821999973721,NC,216.0,2016-08-09T17:00,31.1,32,12.7,28.9,0.0,0.0,0.0,0.0,0,1014.4,990.2,19,0,1,61,0.5,3.06,20.7,29.0,340,343,34.6,33.8,27.6,22.8,18.1,0.122,0.139,0.218,0.361,1,3600.0,419.2,327.9,91.4,683.0,419.2,638.9,491.0,384.0,107.0,683.0,491.0,748.3,Magnoliopsida; Pinus pinaster Aiton; Eucalyptus L'Hér.; Tracheophyta; Vitis vinifera L.
2016,2016-08-09,Porto,Santo Tirso,Lamelas,Lugar do vilar (Rio Leça),41.2755199999279,-8.47013700008392,NC,163.0,2016-08-09T17:00,30.9,34,13.2,28.8,0.0,0.0,0.0,0.0,0,1014.4,996.0,19,0,1,61,0.5,2.94,20.7,29.0,340,343,34.6,33.8,28.2,23.1,18.4,0.118,0.142,0.222,0.359,1,3600.0,419.6,328.1,91.4,681.4,419.6,641.0,491.0,384.0,107.0,681.4,491.0,750.1,Tracheophyta; Eucalyptus L'Hér.; Vitis vinifera L.; Pinus pinaster Aiton
2016,2016-08-09,Porto,Marco de Canaveses,Tabuado,LG Verdial (TABUADO),41.1861119998826,-8.12022500011656,Desconhecida,234.0,2016-08-09T18:00,31.1,31,12.0,29.8,0.0,0.0,0.0,0.0,0,1014.4,988.2,5,0,8,2,0.32,3.11,13.3,20.2,357,1,31.0,33.1,27.7,22.9,18.1,0.103,0.156,0.248,0.359,1,3600.0,214.8,164.3,50.4,552.6,214.8,395.8,281.0,215.0,66.0,552.6,281.0,517.9,Quercus L.; Tracheophyta; Magnoliopsida; Pinus pinaster Aiton; Vitis vinifera L.; Eucalyptus L'Hér.; 
2016,2016-03-13,Porto,Vila do Conde,Labruge,LG. FOJO,41.2797060002221,-8.71415699958801,NC,32.0,2016-03-13T19:00,12.2,79,8.7,10.1,0.0,0.0,0.0,0.0,0,1017.6,1013.7,0,0,0,0,0.03,0.3,11.6,19.5,334,337,20.5,12.9,12.1,11.1,12.6,0.337,0.359,0.385,0.413,0,300.37,0.0,0.0,0.0,0.0,0.0,0.0,20.0,10.0,10.0,107.3,20.0,68.9,Tracheophyta; Magnoliopsida; Eucalyptus L'Hér.
2016,2016-05-04,Porto,Valongo,Sobrado,LG. 5 CAMINHOS (Vale da Cobra),41.2267303466797,-8.47523213704427,Desconhecida,224.0,2016-05-04T11:00,23.6,48,11.9,23.7,0.0,0.0,0.0,0.0,1,1014.6,988.8,29,0,0,95,0.54,1.52,13.1,17.6,99,101,28.4,21.0,16.0,13.5,11.5,0.272,0.315,0.368,0.415,1,3600.0,863.6,711.7,151.8,837.6,863.6,1143.5,819.0,675.0,144.0,837.6,819.0,1084.5,Magnoliopsida; Pinus pinaster Aiton; Eucalyptus L'Hér.
2016,2016-08-09,Porto,Marco de Canaveses,Toutosa,Quinta Feiteira (Cruzeiro),41.2240270000034,-8.14979500028822,Desconhecida,236.0,2016-08-09T18:00,31.1,31,12.0,29.7,0.0,0.0,0.0,0.0,0,1014.4,987.9,5,0,8,2,0.32,3.11,13.3,20.2,357,1,31.0,33.1,27.7,22.9,18.1,0.103,0.156,0.248,0.359,1,3600.0,214.6,164.2,50.4,554.6,214.6,394.0,281.0,215.0,66.0,554.6,281.0,516.0,Magnoliopsida; Tracheophyta; Pinus pinaster Aiton; Vitis vinifera L.; Eucalyptus L'Hér.
2016,2016-08-09,Porto,Lousada,Nevogilde,Lugar de Santiago (Outeiro),41.2565080001619,-8.31912799994151,NC,200.0,2016-08-09T19:00,28.9,37,12.7,27.8,0.0,0.0,0.0,0.0,0,1014.4,991.8,1,0,1,0,0.21,2.51,13.2,22.8,11,16,32.0,31.7,28.4,23.5,18.5,0.092,0.153,0.245,0.357,1,3600.0,68.8,40.9,28.0,371.2,68.8,146.5,128.0,76.0,52.0,371.2,128.0,272.5,Tracheophyta; Quercus L.; Magnoliopsida; Eucalyptus L'Hér.; Vitis vinifera L.
2016,2016-08-09,Porto,Lousada,Caíde de Rei,Lugar da Estação (CAIDE DE REI),41.2653789997101,-8.22334799978468,Desconhecida,241.0,2016-08-09T19:00,28.9,36,12.4,27.7,0.0,0.0,0.0,0.0,0,1014.4,987.2,1,0,1,0,0.21,2.55,13.2,22.8,11,16,32.0,31.7,28.3,23.4,18.3,0.091,0.153,0.245,0.357,1,3600.0,68.5,40.7,27.8,373.5,68.5,145.0,128.0,76.0,52.0,373.5,128.0,270.9,Eucalyptus L'Hér.; Tracheophyta; Magnoliopsida; Pinus pinaster Aiton
2016,2016-08-09,Porto,Felgueiras,Borba de Godim,Padraços (Roço),41.3245420000288,-8.13894499990675,Desconhecida,378.0,2016-08-09T19:00,28.2,35,11.5,26.7,0.0,0.0,0.0,0.0,0,1014.4,972.0,1,0,1,0,0.2,2.47,13.2,22.8,11,16,32.0,30.9,27.6,22.7,17.6,0.093,0.153,0.244,0.357,1,3600.0,68.0,40.4,27.6,376.5,68.0,142.9,128.0,76.0,52.0,376.5,128.0,268.7,Vitis vinifera L.; Tracheophyta; Magnoliopsida; Pinus pinaster Aiton
2016,2016-08-09,Porto,Felgueiras,Sendim,Lugar de Calvário (Calvário),41.3872369999356,-8.17489499992795,Desconhecida,440.0,2016-08-09T19:00,27.7,36,11.2,26.3,0.0,0.0,0.0,0.0,0,1014.8,965.6,8,0,13,0,0.18,2.38,11.7,21.5,34,38,32.8,30.4,27.2,22.2,17.1,0.098,0.147,0.235,0.353,1,3600.0,62.4,34.6,27.7,321.4,62.4,143.5,117.0,65.0,52.0,321.4,117.0,269.2,Pinus pinaster Aiton; Tracheophyta; Magnoliopsida; Eucalyptus L'Hér.
2016,2016-08-09,Porto,Paredes,Cete,Quinta Pinto Bastos (Rodo),41.184613000022,-8.35734800020854,NC,184.0,2016-08-09T20:00,27.7,40,12.8,26.8,0.0,0.0,0.0,0.0,0,1014.6,993.7,1,0,1,0,0.14,2.23,12.4,25.1,26,32,32.0,29.4,28.0,23.0,18.3,0.122,0.139,0.218,0.36,0,98.89,0.0,0.0,0.0,0.0,0.0,0.0,15.0,7.0,8.0,76.9,15.0,62.7,Magnoliopsida; Pinus pinaster Aiton; Eucalyptus L'Hér.; Tracheophyta; Vitis vinifera L.
2016,2016-08-09,Porto,Maia,Águas Santas,Lugar da cabreneira (Rua Doutor António dos Santos),41.2057838439941,-8.58193210177951,NC,88.0,2016-08-09T20:00,27.1,45,14.3,25.7,0.0,0.0,0.0,0.0,0,1014.4,1004.3,0,0,0,0,0.18,1.95,18.9,32.7,8,15,35.6,29.3,28.4,23.5,18.9,0.115,0.148,0.235,0.36,0,168.54,0.0,0.0,0.0,0.0,0.0,0.0,17.0,8.0,9.0,86.1,17.0,65.2,Tracheophyta; Pinus pinaster Aiton; Magnoliopsida; Eucalyptus L'Hér.; 
2016,2016-08-09,Porto,Marco de Canaveses,Constance,Venda nova (Fontelas),41.2135840002696,-8.1619710000356,Desconhecida,139.0,2016-08-09T20:00,28.9,39,13.6,27.2,0.0,0.0,0.0,0.0,0,1014.4,998.6,0,0,0,0,0.2,2.42,18.9,32.7,8,15,35.6,30.3,28.5,23.6,18.9,0.101,0.155,0.247,0.359,0,161.48,0.0,0.0,0.0,0.0,0.0,0.0,17.0,8.0,9.0,88.4,17.0,62.0,Vitis vinifera L.; Tracheophyta; Pinus pinaster Aiton; Magnoliopsida; Eucalyptus L'Hér.; ; Pinales; Quercus L.
2016,2016-08-09,Porto,Gondomar,Foz do Sousa,gens (Ribeira de Fontão),41.096922999488,-8.48211700015598,NC,66.0,2016-08-09T14:00,32.1,35,14.7,30.8,0.0,0.0,0.0,0.0,0,1016.4,1008.9,17,0,0,56,0.79,3.1,29.8,39.8,332,336,49.3,36.2,28.2,23.8,19.2,0.115,0.141,0.222,0.361,1,3600.0,875.7,767.8,107.9,894.5,875.7,1142.4,901.0,790.0,111.0,894.5,901.0,1175.4,Eucalyptus L'Hér.; Tracheophyta; Magnoliopsida
2016,2016-08-09,Porto,Gondomar,São Pedro da Cova,lg belo horizonte (Bocas),41.1513671875,-8.51216698540582,NC,122.0,2016-08-09T14:00,31.6,35,14.4,32.0,0.0,0.0,0.0,0.0,0,1015.9,1002.1,10,0,0,35,0.71,3.0,17.9,22.6,332,335,30.6,35.8,27.9,23.5,18.8,0.104,0.147,0.232,0.358,1,3600.0,836.8,720.2,116.6,839.5,836.8,1141.8,861.0,741.0,120.0,839.5,861.0,1174.8,Tracheophyta; Magnoliopsida; Eucalyptus L'Hér.; Pinus pinaster Aiton
2016,2016-08-09,Porto,Gondomar,Jovim,Estrada Dom Miguel (Vessada),41.10575799995,-8.51621500015259,NC,109.0,2016-08-09T20:00,27.7,43,14.1,26.2,0.0,0.0,0.0,0.0,0,1014.4,1001.9,0,0,0,0,0.18,2.1,18.9,32.7,8,15,35.6,29.9,28.7,23.6,19.0,0.115,0.141,0.221,0.361,0,164.81,0.0,0.0,0.0,0.0,0.0,0.0,17.0,8.0,9.0,87.3,17.0,63.5,Tracheophyta; Vitis vinifera L.; Eucalyptus L'Hér.; Magnoliopsida
2016,2016-08-09,Porto,Paços de Ferreira,Carvalhosa,Lugar de Aldozinde (Igreja),41.3007720000214,-8.35903800010681,NC,356.0,2016-08-09T21:00,25.4,39,10.5,23.5,0.0,0.0,0.0,0.0,0,1015.2,974.8,0,0,0,0,0.13,1.97,14.4,28.7,53,57,37.1,27.2,27.2,22.3,17.4,0.093,0.153,0.245,0.358,0,0.0,0.0,0.0,0.0,0.0,0.0,0.0,0.0,0.0,0.0,0.0,0.0,0.0,Tracheophyta; Eucalyptus L'Hér.; Pinus pinaster Aiton; Magnoliopsida; Vitis vinifera L.; Quercus L.; 
2016,2016-08-09,Porto,Matosinhos,São Mamede de Infesta,Travessa Henrique Bravo (Rua Padre Alberto Rebelo),41.1937141418457,-8.60399244520399,NC,97.0,2016-08-09T22:00,26.3,44,13.0,24.9,0.0,0.0,0.0,0.0,0,1015.2,1004.0,2,0,3,0,0.14,1.93,16.1,29.6,42,53,36.4,27.4,28.1,23.4,18.9,0.115,0.148,0.235,0.36,0,0.0,0.0,0.0,0.0,0.0,0.0,0.0,0.0,0.0,0.0,0.0,0.0,0.0,Tracheophyta; Magnoliopsida
2016,2016-08-09,Porto,Amarante,Salvador do Monte,Lugar do Picoto (Picoto),41.2262268066406,-8.097775455051,Reacendimento,290.0,2016-08-09T22:00,26.1,36,10.0,23.7,0.0,0.0,0.0,0.0,0,1015.8,982.8,1,0,1,0,0.16,2.15,16.4,31.4,75,77,43.6,27.3,27.8,23.2,18.2,0.096,0.155,0.246,0.358,0,0.0,0.0,0.0,0.0,0.0,0.0,0.0,0.0,0.0,0.0,0.0,0.0,0.0,Eucalyptus L'Hér.; Magnoliopsida; Pinus pinaster Aiton; Vitis vinifera L.; Tracheophyta; 
2016,2016-08-09,Porto,Vila Nova de Gaia,Grijó,Lugar de Entre Rios (Rua da Cabreira),41.0156470002068,-8.59258700052897,Desconhecida,84.0,2016-08-09T22:00,26.6,43,13.0,24.7,0.0,0.0,0.0,0.0,0,1014.2,1004.5,5,0,9,0,0.17,1.99,19.9,32.7,356,8,36.0,27.6,28.9,23.8,19.2,0.089,0.124,0.196,0.33,0,0.0,0.0,0.0,0.0,0.0,0.0,0.0,0.0,0.0,0.0,0.0,0.0,0.0,Tracheophyta; Eucalyptus L'Hér.; Pinales
2016,2016-08-09,Porto,Marco de Canaveses,Soalhães,Lugar de Miraz (SOALHÃES),41.1613599999746,-8.10375300010045,Desconhecida,420.0,2016-08-09T22:00,25.2,36,9.1,22.6,0.0,0.0,0.0,0.0,0,1017.0,969.5,0,0,0,0,0.16,2.05,16.7,30.9,76,78,52.6,26.4,27.0,22.3,17.3,0.096,0.155,0.246,0.358,0,0.0,0.0,0.0,0.0,0.0,0.0,0.0,0.0,0.0,0.0,0.0,0.0,0.0,Magnoliopsida; Tracheophyta; Quercus L.; Eucalyptus L'Hér.; Pinus pinaster Aiton; Vitis vinifera L.; Castanea sativa Mill.; Pinales; 
2016,2016-08-09,Porto,Paços de Ferreira,Raimonda,Lugar da Aldeia (Aldeia),41.3107830005222,-8.33078300052219,NC,355.0,2016-08-09T22:00,25.3,36,9.2,22.7,0.0,0.0,0.0,0.0,0,1015.8,975.5,1,0,1,0,0.16,2.07,16.4,31.4,75,77,43.6,26.4,27.2,22.5,17.5,0.092,0.153,0.245,0.357,0,0.0,0.0,0.0,0.0,0.0,0.0,0.0,0.0,0.0,0.0,0.0,0.0,0.0,Eucalyptus L'Hér.; Tracheophyta; Pinus pinaster Aiton; Magnoliopsida; 
2016,2016-08-09,Porto,Marco de Canaveses,Várzea do Douro,Lugar de Picotos (Travassos),41.0790519714355,-8.27902031792535,Reacendimento,148.0,2016-08-09T22:00,27.6,35,10.9,25.5,0.0,0.0,0.0,0.0,0,1015.2,998.3,2,0,3,0,0.17,2.39,16.1,29.6,42,53,36.4,28.0,28.3,23.6,18.8,0.101,0.155,0.247,0.359,0,0.0,0.0,0.0,0.0,0.0,0.0,0.0,0.0,0.0,0.0,0.0,0.0,0.0,Pinus pinaster Aiton; Magnoliopsida; Eucalyptus L'Hér.; Tracheophyta
2016,2016-08-09,Porto,Paredes,Bitarães,Lugar da Fronteira bitarães (Febros),41.2243779998355,-8.32509499973721,NC,190.0,2016-08-09T22:00,27.0,35,10.3,24.7,0.0,0.0,0.0,0.0,0,1015.8,994.1,1,0,1,0,0.17,2.3,16.4,31.4,75,77,43.6,27.5,27.8,23.1,18.3,0.111,0.149,0.235,0.359,0,0.0,0.0,0.0,0.0,0.0,0.0,0.0,0.0,0.0,0.0,0.0,0.0,0.0,Magnoliopsida; Pinus pinaster Aiton; Eucalyptus L'Hér.; Tracheophyta; Vitis vinifera L.; Quercus L.
2016,2016-08-09,Porto,Baião,Gove,Lugar de Gozende (Giz),41.143363000022,-8.05539500024584,Desconhecida,524.0,2016-08-09T23:00,23.6,39,8.9,20.7,0.0,0.0,0.0,0.0,0,1017.8,958.5,2,0,3,0,0.15,1.77,18.1,32.9,77,80,53.3,25.4,26.8,22.1,17.2,0.118,0.14,0.216,0.359,0,0.0,0.0,0.0,0.0,0.0,0.0,0.0,0.0,0.0,0.0,0.0,0.0,0.0,Tracheophyta; Magnoliopsida; Pinales; Eucalyptus L'Hér.; Vitis vinifera L.; Quercus L.; Pinus pinaster Aiton; ; Castanea sativa Mill.
2016,2016-08-09,Porto,Marco de Canaveses,Sobretâmega,R. Abrochão (Outeirinho),41.1949790000916,-8.17234800020854,Desconhecida,144.0,2016-08-09T23:00,26.6,37,10.8,24.1,0.0,0.0,0.0,0.0,0,1015.9,999.4,1,0,2,0,0.18,2.18,18.7,33.2,60,69,35.3,27.2,28.2,23.6,18.8,0.101,0.155,0.247,0.359,0,0.0,0.0,0.0,0.0,0.0,0.0,0.0,0.0,0.0,0.0,0.0,0.0,0.0,Vitis vinifera L.; Tracheophyta; Pinus pinaster Aiton; Magnoliopsida; Quercus L.; ; Eucalyptus L'Hér.
2016,2016-08-09,Porto,Paços de Ferreira,Sanfins de Ferreira,Lugar da Cruz (Alto do Castro),41.3288449997372,-8.36448300043742,NC,428.0,2016-08-09T22:00,24.9,36,8.7,22.3,0.0,0.0,0.0,0.0,0,1015.6,967.2,1,0,2,0,0.15,2.02,15.3,30.3,75,77,48.6,26.0,26.7,22.1,17.1,0.092,0.153,0.245,0.357,0,0.0,0.0,0.0,0.0,0.0,0.0,0.0,0.0,0.0,0.0,0.0,0.0,0.0,Magnoliopsida; Pinus pinaster Aiton; Eucalyptus L'Hér.; Tracheophyta
2016,2016-08-09,Porto,Felgueiras,Refontoura,OUTEIRO (REFONTOURA),41.3327680004968,-8.19260700013902,NC,281.0,2016-08-09T23:00,24.8,38,9.4,21.7,0.0,0.0,0.0,0.0,0,1016.5,984.4,2,0,3,0,0.18,1.95,20.4,35.9,82,83,47.5,26.2,27.7,23.2,18.1,0.091,0.153,0.245,0.357,0,0.0,0.0,0.0,0.0,0.0,0.0,0.0,0.0,0.0,0.0,0.0,0.0,0.0,Vitis vinifera L.; Magnoliopsida; Tracheophyta; Pinus pinaster Aiton; Eucalyptus L'Hér.
2016,2016-08-09,Porto,Amarante,Padronelo,Lugar de Moure (Olival),41.257248000039,-8.04949300024245,Desconhecida,224.0,2016-08-09T22:00,26.5,36,10.4,24.2,0.0,0.0,0.0,0.0,0,1015.8,990.2,1,0,1,0,0.16,2.2,16.4,31.4,75,77,43.6,27.7,28.2,23.6,18.6,0.096,0.155,0.246,0.358,0,0.0,0.0,0.0,0.0,0.0,0.0,0.0,0.0,0.0,0.0,0.0,0.0,0.0,Tracheophyta; Pinus pinaster Aiton; Eucalyptus L'Hér.; Vitis vinifera L.; ; Magnoliopsida
2016,2016-08-09,Porto,Baião,Santa Marinha do Zêzere,Fragueta (Casal Novo),41.1386240000195,-7.95047800001171,Desconhecida,298.0,2016-08-09T23:00,24.7,39,10.0,21.7,0.0,0.0,0.0,0.0,0,1016.5,982.5,2,0,3,0,0.17,1.89,20.4,35.9,82,83,47.5,26.3,27.7,23.1,18.1,0.096,0.155,0.246,0.358,0,0.0,0.0,0.0,0.0,0.0,0.0,0.0,0.0,0.0,0.0,0.0,0.0,0.0,Tracheophyta; Eucalyptus L'Hér.; Vitis vinifera L.; Magnoliopsida
2016,2016-08-09,Porto,Santo Tirso,Areias,Lugar 25 abril (Igreja),41.3658142089844,-8.47459696451823,NC,108.0,2016-08-09T23:00,25.4,41,11.2,23.0,0.0,0.0,0.0,0.0,0,1015.9,1003.4,1,0,2,0,0.16,1.91,18.7,33.2,60,69,35.3,26.7,28.2,23.4,18.6,0.115,0.145,0.226,0.358,0,0.0,0.0,0.0,0.0,0.0,0.0,0.0,0.0,0.0,0.0,0.0,0.0,0.0,Vitis vinifera L.; Tracheophyta
2016,2016-08-09,Porto,Felgueiras,Idães,Lugar de Tarrio (Gondares),41.3140049997966,-8.2568450000551,Desconhecida,315.0,2016-08-09T23:00,24.7,37,9.1,21.5,0.0,0.0,0.0,0.0,0,1016.5,980.6,2,0,3,0,0.18,1.96,20.4,35.9,82,83,47.5,25.8,27.3,22.8,17.8,0.092,0.153,0.245,0.357,0,0.0,0.0,0.0,0.0,0.0,0.0,0.0,0.0,0.0,0.0,0.0,0.0,0.0,Vitis vinifera L.; Pinus pinaster Aiton; Tracheophyta; Eucalyptus L'Hér.; Magnoliopsida
2016,2016-08-10,Porto,Amarante,Mancelos,Lugar de Manhufe (Consola),41.2618713378906,-8.16229724460178,Desconhecida,299.0,2016-08-10T00:00,23.6,40,9.2,20.3,0.0,0.0,0.0,0.0,0,1017.0,982.7,0,0,0,0,0.17,1.74,21.0,36.3,83,83,49.0,25.2,27.4,23.1,18.0,0.091,0.153,0.245,0.357,0,0.0,0.0,0.0,0.0,0.0,0.0,0.0,0.0,0.0,0.0,0.0,0.0,0.0,Tracheophyta; Magnoliopsida; Eucalyptus L'Hér.; Pinus pinaster Aiton; Vitis vinifera L.; 
2016,2016-08-10,Porto,Gondomar,Jovim,Lugar de Cambidos (Cambitos),41.1043434145716,-8.51081753200955,Reacendimento,154.0,2016-08-10T00:00,25.4,40,10.7,22.6,0.0,0.0,0.0,0.0,0,1016.0,998.3,0,0,0,0,0.18,1.95,20.4,35.5,69,75,43.6,26.2,28.0,23.4,18.7,0.115,0.141,0.221,0.361,0,0.0,0.0,0.0,0.0,0.0,0.0,0.0,0.0,0.0,0.0,0.0,0.0,0.0,Tracheophyta; Eucalyptus L'Hér.; Vitis vinifera L.; Magnoliopsida
2016,2016-08-10,Porto,Gondomar,São Pedro da Cova,Silveirinhos (ER209 (ER209) Km 6),41.1551895141602,-8.51215935601128,Desconhecida,83.0,2016-08-10T00:00,25.5,41,11.2,22.9,0.0,0.0,0.0,0.0,0,1016.3,1006.7,0,0,0,0,0.17,1.93,20.3,34.8,70,76,37.1,26.5,28.4,23.9,19.1,0.104,0.146,0.232,0.357,0,0.0,0.0,0.0,0.0,0.0,0.0,0.0,0.0,0.0,0.0,0.0,0.0,0.0,Tracheophyta; Eucalyptus L'Hér.; Pinus pinaster Aiton; Magnoliopsida
2016,2016-08-10,Porto,Gondomar,São Pedro da Cova,Lg. Carvalhal (ER209 (ER209) Km 6),41.1553497314453,-8.51144504123264,Reacendimento,91.0,2016-08-10T01:00,24.7,42,10.8,21.8,0.0,0.0,0.0,0.0,0,1016.6,1006.1,1,0,1,0,0.18,1.81,21.5,36.2,72,77,40.0,25.8,28.1,23.8,19.1,0.104,0.146,0.232,0.357,0,0.0,0.0,0.0,0.0,0.0,0.0,0.0,0.0,0.0,0.0,0.0,0.0,0.0,Tracheophyta; Eucalyptus L'Hér.; Pinus pinaster Aiton; Magnoliopsida
2016,2016-05-04,Porto,Santo Tirso,Negrelos (São Mamede),LG. BOAVISTA (Covelos),41.3511819999748,-8.35319499995973,NC,146.0,2016-05-04T12:00,25.4,44,12.1,26.6,0.0,0.0,0.0,0.0,1,1013.9,997.1,26,0,0,87,0.61,1.82,9.8,12.4,114,112,24.1,22.5,16.3,13.6,11.5,0.275,0.318,0.367,0.415,1,3600.0,915.9,728.7,187.3,811.0,915.9,1209.0,895.0,712.0,183.0,811.0,895.0,1181.4,Tracheophyta; Pinus pinaster Aiton; Vitis vinifera L.; Magnoliopsida; Eucalyptus L'Hér.
2016,2016-08-10,Porto,Marco de Canaveses,Folhada,Lugar do Prado (Vinhal),41.2142601013184,-8.08218002319336,NC,205.0,2016-08-10T01:00,23.2,42,9.7,20.0,0.0,0.0,0.0,0.0,0,1017.3,993.6,1,0,1,0,0.16,1.63,21.1,36.3,82,83,50.4,25.1,27.4,23.2,18.3,0.103,0.156,0.248,0.358,0,0.0,0.0,0.0,0.0,0.0,0.0,0.0,0.0,0.0,0.0,0.0,0.0,0.0,Magnoliopsida; Tracheophyta; Pinus pinaster Aiton; Vitis vinifera L.; Eucalyptus L'Hér.; Olea europaea L.; Quercus L.; Pinales; 
2016,2016-08-10,Porto,Lousada,Silvares,Lug Silvares (Mós),41.2911071777344,-8.28117370605469,Desconhecida,312.0,2016-08-10T01:00,22.9,41,8.9,19.5,0.0,0.0,0.0,0.0,0,1017.3,981.4,1,0,1,0,0.16,1.65,21.1,36.3,82,83,50.4,24.4,27.0,22.8,17.8,0.092,0.153,0.245,0.357,0,0.0,0.0,0.0,0.0,0.0,0.0,0.0,0.0,0.0,0.0,0.0,0.0,0.0,Tracheophyta; Eucalyptus L'Hér.; Magnoliopsida; Pinus pinaster Aiton
2016,2016-08-10,Porto,Paredes,Rebordosa,fijo de baixo (Fijó),41.2264060974121,-8.42001722547743,NC,159.0,2016-08-10T01:00,24.1,41,10.2,21.0,0.0,0.0,0.0,0.0,0,1016.6,998.2,1,0,1,0,0.17,1.76,21.5,36.2,72,77,40.0,25.5,27.6,23.3,18.6,0.122,0.14,0.218,0.36,0,0.0,0.0,0.0,0.0,0.0,0.0,0.0,0.0,0.0,0.0,0.0,0.0,0.0,Magnoliopsida; Pinus pinaster Aiton; Eucalyptus L'Hér.; Tracheophyta; Vitis vinifera L.
2016,2016-08-10,Porto,Trofa,Coronado (São Mamede),Marques (Vila),41.2756881713867,-8.57067301432292,NC,126.0,2016-08-10T02:00,23.4,43,10.3,20.4,0.0,0.0,0.0,0.0,0,1016.6,1002.0,0,0,0,0,0.16,1.63,21.3,35.6,74,79,41.4,24.6,27.4,23.4,18.7,0.104,0.149,0.235,0.358,0,0.0,0.0,0.0,0.0,0.0,0.0,0.0,0.0,0.0,0.0,0.0,0.0,0.0,Pinus pinaster Aiton; Tracheophyta; Magnoliopsida; Pinales
2016,2016-08-10,Porto,Felgueiras,Jugueiros,VESSADAS (Arco),41.4063262939453,-8.22019958496094,Desconhecida,170.0,2016-08-10T02:00,22.8,44,9.9,20.7,0.0,0.0,0.0,0.0,0,1017.3,997.6,0,0,0,0,0.11,1.56,14.2,28.0,69,74,34.9,24.6,28.0,23.9,18.7,0.094,0.147,0.236,0.354,0,0.0,0.0,0.0,0.0,0.0,0.0,0.0,0.0,0.0,0.0,0.0,0.0,0.0,Vitis vinifera L.; Eucalyptus L'Hér.; Magnoliopsida; Pinus pinaster Aiton
2016,2016-05-04,Porto,Valongo,Sobrado,Campelo (Serra do Penedo),41.2354280000263,-8.48172199991014,NC,220.0,2016-05-04T12:00,25.1,45,12.4,26.4,0.0,0.0,0.0,0.0,1,1013.9,988.7,26,0,0,87,0.61,1.75,9.8,12.4,114,112,24.1,22.4,16.4,13.5,11.5,0.269,0.314,0.367,0.415,1,3600.0,916.1,728.8,187.3,810.4,916.1,1210.2,895.0,712.0,183.0,810.4,895.0,1182.2,Eucalyptus L'Hér.; Pinus pinaster Aiton; Magnoliopsida
2016,2016-08-10,Porto,Póvoa de Varzim,Estela,Lugar de Vila Mendo (Carrascos),41.4551734754774,-8.75559522840712,Desconhecida,18.0,2016-08-10T02:00,23.4,45,10.9,21.3,0.0,0.0,0.0,0.0,0,1017.2,1015.1,0,0,0,0,0.13,1.58,16.3,27.0,31,48,32.0,24.5,27.4,23.6,19.1,0.095,0.149,0.237,0.353,0,0.0,0.0,0.0,0.0,0.0,0.0,0.0,0.0,0.0,0.0,0.0,0.0,0.0,Tracheophyta
2016,2016-08-10,Porto,Gondomar,Gondomar (São Cosme),bulho (Paço),41.1362113952637,-8.53692626953125,Desconhecida,108.0,2016-08-10T02:00,23.8,42,10.3,20.7,0.0,0.0,0.0,0.0,0,1016.6,1004.1,0,0,0,0,0.17,1.69,21.3,35.6,74,79,41.4,25.3,27.9,23.7,19.0,0.115,0.141,0.221,0.361,0,0.0,0.0,0.0,0.0,0.0,0.0,0.0,0.0,0.0,0.0,0.0,0.0,0.0,Magnoliopsida; Tracheophyta; Eucalyptus L'Hér.
2016,2016-08-10,Porto,Amarante,Lufrei,LUGAR DE CAMBITOS (Moure),41.2609329223633,-8.05440902709961,Desconhecida,270.0,2016-08-10T02:00,21.6,45,9.1,18.4,0.0,0.0,0.0,0.0,0,1017.3,986.1,0,0,0,0,0.15,1.43,21.0,36.1,85,85,50.8,23.9,26.8,22.8,17.9,0.103,0.156,0.248,0.358,0,0.0,0.0,0.0,0.0,0.0,0.0,0.0,0.0,0.0,0.0,0.0,0.0,0.0,Magnoliopsida; Tracheophyta; Pinus pinaster Aiton; Vitis vinifera L.; Eucalyptus L'Hér.; 
2016,2016-08-10,Porto,Felgueiras,Várzea,MONTE LEBRE (Ambrães),41.3559494018555,-8.20415686713325,Desconhecida,290.0,2016-08-10T02:00,22.0,44,9.0,18.7,0.0,0.0,0.0,0.0,0,1017.3,983.8,0,0,0,0,0.15,1.49,21.0,36.1,85,85,50.8,24.0,27.2,23.2,18.1,0.098,0.147,0.235,0.353,0,0.0,0.0,0.0,0.0,0.0,0.0,0.0,0.0,0.0,0.0,0.0,0.0,0.0,Magnoliopsida; Eucalyptus L'Hér.; Tracheophyta; Pinus pinaster Aiton; Vitis vinifera L.; Castanea sativa Mill.; Quercus L.; Olea europaea L.; Acacia Mill.; Pinales; 
2016,2016-08-10,Porto,Marco de Canaveses,Várzea do Douro,Lugar do Picoto (Picotos),41.0704040527344,-8.27736473931207,Reacendimento,91.0,2016-08-10T03:00,22.6,45,10.1,19.6,0.0,0.0,0.0,0.0,0,1016.6,1006.0,0,0,0,0,0.15,1.5,20.7,34.2,73,78,41.4,24.7,27.8,23.9,19.1,0.109,0.148,0.234,0.359,0,0.0,0.0,0.0,0.0,0.0,0.0,0.0,0.0,0.0,0.0,0.0,0.0,0.0,Pinus pinaster Aiton; Magnoliopsida; Quercus L.
2016,2016-08-10,Porto,Felgueiras,Borba de Godim,lg campelo (Tapada do Barreiro),41.3267974853516,-8.13894558376736,Desconhecida,348.0,2016-08-10T03:00,19.9,49,8.8,16.6,0.0,0.0,0.0,0.0,0,1017.2,976.9,0,0,0,0,0.13,1.2,20.5,35.7,87,87,50.8,22.6,26.6,22.9,17.8,0.093,0.153,0.244,0.357,0,0.0,0.0,0.0,0.0,0.0,0.0,0.0,0.0,0.0,0.0,0.0,0.0,0.0,Vitis vinifera L.; Magnoliopsida; Tracheophyta; Pinus pinaster Aiton
2016,2016-08-10,Porto,Marco de Canaveses,Vila Boa de Quires,Lug da Gaia (Lage),41.1946067810059,-8.20472430759006,Desconhecida,261.0,2016-08-10T04:00,20.0,49,8.8,16.6,0.0,0.0,0.0,0.0,0,1017.5,987.1,0,0,0,0,0.13,1.2,20.9,36.1,86,87,49.7,22.6,26.4,22.9,18.0,0.103,0.156,0.248,0.358,0,0.0,0.0,0.0,0.0,0.0,0.0,0.0,0.0,0.0,0.0,0.0,0.0,0.0,Pinus pinaster Aiton; Tracheophyta; Eucalyptus L'Hér.; Magnoliopsida; Vitis vinifera L.; Quercus L.; Pinales; 
2016,2016-08-10,Porto,Gondomar,Foz do Sousa,Esposade (Zibreiros),41.0856323242188,-8.50793741861979,Desconhecida,78.0,2016-08-10T04:00,22.2,46,10.1,19.0,0.0,0.0,0.0,0.0,0,1015.4,1006.3,0,0,0,0,0.15,1.44,22.2,35.9,48,59,38.9,24.4,27.7,23.9,19.2,0.115,0.141,0.221,0.361,0,0.0,0.0,0.0,0.0,0.0,0.0,0.0,0.0,0.0,0.0,0.0,0.0,0.0,Eucalyptus L'Hér.; Tracheophyta; Pinus pinaster Aiton
2016,2016-08-10,Porto,Amarante,Mancelos,Maninhos (Plaina),41.2867317030165,-8.15268802218967,Desconhecida,380.0,2016-08-10T04:00,19.4,48,8.0,15.8,0.0,0.0,0.0,0.0,0,1017.5,973.5,0,0,0,0,0.13,1.17,20.9,36.1,86,87,49.7,21.8,26.1,22.5,17.5,0.091,0.153,0.245,0.357,0,0.0,0.0,0.0,0.0,0.0,0.0,0.0,0.0,0.0,0.0,0.0,0.0,0.0,Tracheophyta; Magnoliopsida; Eucalyptus L'Hér.; Pinus pinaster Aiton; Vitis vinifera L.; 
2016,2016-05-04,Porto,Maia,Águas Santas,LUGAR DA CARVERNEIRA,41.2082009998957,-8.58382699999544,NC,68.0,2016-05-04T14:00,27.0,45,13.9,29.8,0.0,0.0,0.0,0.0,1,1012.9,1005.1,28,0,0,92,0.59,1.97,2.6,3.1,214,201,16.9,25.2,18.3,14.6,12.6,0.282,0.318,0.368,0.414,1,3600.0,820.2,578.1,242.1,678.0,820.2,1147.3,847.0,597.0,250.0,678.0,847.0,1184.8,Tracheophyta; Pinus pinaster Aiton; Magnoliopsida; Eucalyptus L'Hér.; 
2016,2016-08-10,Porto,Gondomar,Valbom,Lug Arecheira (VALBOM),41.1293640136719,-8.55926323784722,Desconhecida,52.0,2016-08-10T05:00,22.0,46,9.9,18.9,0.0,0.0,0.0,0.0,0,1017.2,1011.1,0,0,0,0,0.15,1.43,21.9,35.9,73,77,41.4,24.0,27.4,23.8,19.2,0.114,0.151,0.239,0.364,0,0.0,0.0,0.0,0.0,0.0,0.0,0.0,0.0,0.0,0.0,0.0,0.0,0.0,Tracheophyta; Magnoliopsida; Pinus pinaster Aiton; Eucalyptus L'Hér.
2016,2016-08-10,Porto,Marco de Canaveses,Soalhães,Vila Pouca,41.1562461853027,-8.131472591824,Reacendimento,171.0,2016-08-10T06:00,19.3,48,8.1,16.8,0.0,0.0,0.0,0.0,0,1018.3,998.2,0,0,0,0,0.11,1.15,14.0,27.2,72,75,30.2,22.0,26.5,23.4,18.5,0.103,0.156,0.248,0.358,1,0.0,8.2,2.7,5.5,31.5,2.6,72.6,3.0,1.0,2.0,15.7,3.0,26.5,Magnoliopsida; Tracheophyta; Quercus L.; Eucalyptus L'Hér.; Pinus pinaster Aiton; Vitis vinifera L.; Castanea sativa Mill.; Pinales; 
2016,2016-05-04,Porto,Valongo,Alfena,LUGAR DE FERRARIA (Gandra),41.2585070000754,-8.51701699998644,Desconhecida,161.0,2016-05-04T14:00,26.5,42,12.4,28.8,0.0,0.0,0.0,0.0,1,1012.9,994.5,28,0,0,92,0.58,2.02,2.6,3.1,214,201,16.9,24.4,17.4,13.8,11.7,0.278,0.313,0.364,0.415,1,3600.0,820.0,578.0,242.0,678.3,820.0,1146.5,847.0,597.0,250.0,678.3,847.0,1184.2,Eucalyptus L'Hér.; Tracheophyta; Pinus pinaster Aiton
2016,2016-08-10,Porto,Marco de Canaveses,Soalhães,Lugar de Pereiro (Sardoira),41.1719970703125,-8.11242007785373,Reacendimento,203.0,2016-08-10T07:00,19.0,49,8.0,15.2,0.0,0.0,0.0,0.0,0,1018.8,995.0,0,0,0,0,0.16,1.12,22.1,34.8,83,83,50.8,21.8,26.1,23.2,18.3,0.103,0.156,0.248,0.358,1,3250.22,170.2,109.7,60.6,449.8,160.3,324.5,104.0,67.0,37.0,423.7,104.0,198.3,Magnoliopsida; Tracheophyta; Quercus L.; Eucalyptus L'Hér.; Pinus pinaster Aiton; Vitis vinifera L.; Castanea sativa Mill.; Pinales; 
