2016,2016-08-09,Porto,Vila Nova de Gaia,Pedroso,Alheira (Rampa da Alheira dAquem),41.0756225585938,-8.54413126627604,NC,148.0,2016-08-09T02:00,24.1,58,15.4,24.2,0.0,0.0,0.0,0.0,0,1017.4,1000.3,0,0,0,0,0.07,1.26,11.8,20.1,20,24,24.1,24.8,27.9,23.2,18.6,0.115,0.142,0.223,0.361,0,0.0,0.0,0.0,0.0,0.0,0.0,0.0,0.0,0.0,0.0,0.0,0.0,0.0,Eucalyptus L'Hér.; Magnoliopsida; Tracheophyta
2016,2016-08-09,Porto,Maia,Águas Santas,Travessa Joaquim Carvalho da Costa (A3-N-S Km 4),41.2082023620605,-8.58382703999678,NC,68.0,2016-08-09T02:00,24.9,57,15.8,25.3,0.0,0.0,0.0,0.0,0,1017.5,1009.6,0,0,0,0,0.07,1.36,11.0,21.7,19,32,26.6,25.9,28.3,23.4,19.0,0.115,0.149,0.237,0.361,0,0.0,0.0,0.0,0.0,0.0,0.0,0.0,0.0,0.0,0.0,0.0,0.0,0.0,Tracheophyta; Pinus pinaster Aiton; Magnoliopsida; Eucalyptus L'Hér.; 
2016,2016-08-09,Porto,Marco de Canaveses,Santo Isidoro,Livração (Lameiro),41.2137190002865,-8.14387600051032,Desconhecida,174.0,2016-08-09T02:00,22.6,62,15.0,22.9,0.0,0.0,0.0,0.0,0,1018.0,997.8,0,0,0,0,0.05,1.04,9.7,21.9,22,36,26.6,23.1,27.1,23.2,18.4,0.104,0.158,0.249,0.359,0,0.0,0.0,0.0,0.0,0.0,0.0,0.0,0.0,0.0,0.0,0.0,0.0,0.0,Magnoliopsida; Pinales; Pinus pinaster Aiton; Tracheophyta; Vitis vinifera L.; 
2016,2016-08-09,Porto,Baião,Gove,Lameirão (Entrevezas),41.1318870004018,-8.07104199992286,Desconhecida,548.0,2016-08-09T03:00,20.3,64,13.2,19.8,0.0,0.0,0.0,0.0,0,1018.7,956.1,0,0,0,0,0.04,0.86,9.9,16.3,71,72,31.7,21.3,25.5,21.8,16.9,0.119,0.14,0.219,0.36,0,0.0,0.0,0.0,0.0,0.0,0.0,0.0,0.0,0.0,0.0,0.0,0.0,0.0,Tracheophyta; Magnoliopsida; Pinales; Eucalyptus L'Hér.; Vitis vinifera L.; Quercus L.; Pinus pinaster Aiton; 
2016,2016-05-03,Porto,Maia,Águas Santas,TEOFILO BRAGA,41.2082009998957,-8.58382699999544,NC,68.0,2016-05-03T00:00,13.1,94,12.1,12.8,0.0,0.0,0.0,0.0,0,1020.9,1012.7,0,0,0,0,0.0,0.1,6.0,12.0,57,49,14.8,14.3,16.4,14.2,12.6,0.303,0.331,0.374,0.416,0,0.0,0.0,0.0,0.0,0.0,0.0,0.0,0.0,0.0,0.0,0.0,0.0,0.0,Tracheophyta; Pinus pinaster Aiton; Magnoliopsida; Eucalyptus L'Hér.; 
2016,2016-08-09,Porto,Baião,Gove,Gozende (GOVE),41.1335320000019,-8.06296499994066,Desconhecida,453.0,2016-08-09T03:00,20.9,64,13.8,20.7,0.0,0.0,0.0,0.0,0,1018.7,966.7,0,0,0,0,0.04,0.89,9.9,16.3,71,72,31.7,21.9,26.1,22.4,17.5,0.119,0.14,0.219,0.36,0,0.0,0.0,0.0,0.0,0.0,0.0,0.0,0.0,0.0,0.0,0.0,0.0,0.0,Tracheophyta; Magnoliopsida; Pinales; Eucalyptus L'Hér.; Vitis vinifera L.; Quercus L.; Pinus pinaster Aiton; 
2016,2016-08-09,Porto,Maia,Avioso (Santa Maria),Lugar de Quiraz (Praça 5 de Outubro),41.2648811340332,-8.61209391276042,NC,96.0,2016-08-09T03:00,23.8,56,14.5,23.5,0.0,0.0,0.0,0.0,0,1017.3,1006.1,0,0,0,0,0.07,1.29,11.6,21.8,22,34,26.3,24.9,27.9,23.3,18.8,0.104,0.15,0.237,0.358,0,0.0,0.0,0.0,0.0,0.0,0.0,0.0,0.0,0.0,0.0,0.0,0.0,0.0,Magnoliopsida; Tracheophyta; Eucalyptus L'Hér.
2016,2016-08-09,Porto,Paços de Ferreira,Frazão,Anjo da Guarda (Quinta),41.2573879999585,-8.40518500010173,NC,263.0,2016-08-09T03:00,22.0,56,12.9,21.4,0.0,0.0,0.0,0.0,0,1017.8,987.4,0,0,0,0,0.06,1.15,10.2,16.8,72,67,24.1,23.1,27.0,22.8,18.0,0.094,0.155,0.247,0.358,0,0.0,0.0,0.0,0.0,0.0,0.0,0.0,0.0,0.0,0.0,0.0,0.0,0.0,Eucalyptus L'Hér.; Tracheophyta; Magnoliopsida; Vitis vinifera L.; 
2016,2016-08-09,Porto,Felgueiras,Airães,Lugar de Lordelo (Alto de Penude),41.3279380003611,-8.17819199985928,NC,340.0,2016-08-09T04:00,20.1,64,13.0,19.6,0.0,0.0,0.0,0.0,0,1017.6,978.2,0,0,0,0,0.04,0.85,10.0,16.1,75,70,23.4,21.3,26.1,22.6,17.6,0.091,0.154,0.247,0.358,0,0.0,0.0,0.0,0.0,0.0,0.0,0.0,0.0,0.0,0.0,0.0,0.0,0.0,Vitis vinifera L.; Tracheophyta; Magnoliopsida; Pinales; Pinus pinaster Aiton
2016,2016-08-09,Porto,Valongo,Sobrado,Sobrado (Alto do Vilar),41.2196044921875,-8.4697351413303,Desconhecida,183.0,2016-08-09T05:00,22.1,63,14.8,22.2,0.0,0.0,0.0,0.0,0,1017.4,996.1,0,0,0,0,0.05,0.98,10.3,18.9,29,40,23.4,23.1,27.0,23.0,18.4,0.104,0.147,0.234,0.358,0,0.0,0.0,0.0,0.0,0.0,0.0,0.0,0.0,0.0,0.0,0.0,0.0,0.0,Magnoliopsida; Eucalyptus L'Hér.; Tracheophyta; Pinus pinaster Aiton
2016,2016-08-09,Porto,Paços de Ferreira,Sanfins de Ferreira,Lugar de Campo da Futebol (Alto do Castro),41.3279113769531,-8.36415863037109,Reacendimento,429.0,2016-08-09T05:00,18.9,66,12.3,18.1,0.0,0.0,0.0,0.0,0,1017.9,968.3,0,0,0,0,0.04,0.75,10.3,16.0,78,67,25.6,20.3,25.2,21.9,16.9,0.093,0.154,0.247,0.358,0,0.0,0.0,0.0,0.0,0.0,0.0,0.0,0.0,0.0,0.0,0.0,0.0,0.0,Magnoliopsida; Pinus pinaster Aiton; Eucalyptus L'Hér.; Tracheophyta
2016,2016-08-09,Porto,Baião,Campelo,Lugar de Currais (CAMPELO),41.1599379995134,-8.03175800005595,Desconhecida,535.0,2016-08-09T06:00,17.8,76,13.6,17.7,0.0,0.0,0.0,0.0,0,1019.0,957.3,0,0,0,0,0.04,0.48,9.1,15.7,81,81,25.9,19.5,24.8,22.0,16.9,0.096,0.153,0.243,0.357,1,0.0,10.6,2.6,7.9,30.4,3.6,80.8,4.0,1.0,3.0,15.0,4.0,30.5,Tracheophyta; Pinus pinaster Aiton; Magnoliopsida; Eucalyptus L'Hér.; Pinales; Quercus L.; Vitis vinifera L.; 
2016,2016-05-03,Porto,Vila Nova de Gaia,Vilar de Andorinho,rua conceição fernandes (Viela do Monte da Virgem),41.1029620001051,-8.58687999990251,NC,201.0,2016-05-03T11:00,21.9,45,9.5,21.5,0.0,0.0,0.0,0.0,0,1019.9,996.5,0,0,0,0,0.53,1.44,13.0,17.3,90,92,29.2,19.6,14.7,13.3,11.6,0.287,0.323,0.372,0.416,1,3600.0,883.9,776.3,107.6,914.9,883.9,1142.3,838.0,736.0,102.0,914.9,838.0,1083.0,Tracheophyta; Magnoliopsida; Pinus pinaster Aiton; Pinus pinea L.
2016,2016-08-09,Porto,Paredes,Gandra,Lugar de Vilarinho de Cima (GANDRA),41.2023450001081,-8.44131899992625,NC,149.0,2016-08-09T06:00,20.3,74,15.5,20.7,0.0,0.0,0.0,0.0,0,1017.6,1000.1,0,0,0,0,0.05,0.62,9.8,16.8,28,45,22.3,21.6,26.4,23.1,18.5,0.123,0.14,0.221,0.361,1,0.0,11.0,2.7,8.2,31.5,3.4,72.5,4.0,1.0,3.0,15.7,4.0,26.4,Magnoliopsida; Pinus pinaster Aiton; Eucalyptus L'Hér.; Tracheophyta; Vitis vinifera L.
2016,2016-08-09,Porto,Maia,Silva Escura,Trina Terra (Rua da Terra Cavada),41.2612342834473,-8.57785319010417,NC,116.0,2016-08-09T07:00,22.1,69,16.2,22.8,0.0,0.0,0.0,0.0,0,1017.9,1004.3,0,0,0,0,0.08,0.82,9.3,15.3,28,45,19.8,23.5,26.9,23.2,18.6,0.104,0.15,0.237,0.358,1,3217.54,166.0,108.5,57.5,448.9,155.4,321.5,101.0,66.0,35.0,420.3,101.0,195.6,Magnoliopsida; Eucalyptus L'Hér.; Tracheophyta; Pinus pinaster Aiton; 
2016,2016-08-09,Porto,Paredes,Cete,Valeverde (Ganderelas),41.1859680000941,-8.36051799986098,NC,229.0,2016-08-09T08:00,25.3,54,15.3,26.1,0.0,0.0,0.0,0.0,0,1018.3,992.0,0,0,0,0,0.21,1.5,7.2,11.9,87,90,16.9,24.9,25.6,22.6,18.0,0.123,0.14,0.221,0.361,1,3600.0,367.1,288.4,78.8,671.8,367.1,571.2,289.0,227.0,62.0,671.8,289.0,449.7,Magnoliopsida; Pinus pinaster Aiton; Eucalyptus L'Hér.; Tracheophyta; Vitis vinifera L.
2016,2016-08-09,Porto,Paços de Ferreira,Lamoso,PEDREIRAS (Corgo),41.321418762207,-8.35767842610677,Reacendimento,371.0,2016-08-09T07:00,19.9,76,15.5,20.5,0.0,0.0,0.0,0.0,0,1018.2,975.3,0,0,0,0,0.07,0.56,8.7,15.5,83,86,18.0,21.1,25.1,22.3,17.3,0.093,0.154,0.247,0.358,1,3314.53,170.3,111.9,58.4,453.9,162.3,328.0,105.0,69.0,36.0,432.6,105.0,202.3,Magnoliopsida; Eucalyptus L'Hér.; Pinus pinaster Aiton; Tracheophyta; Quercus suber L.; 
2016,2016-08-09,Porto,Amarante,Vila Chã do Marão,Vila Chã do Marão (Alto da Capela Velha),41.2736206054688,-8.0259952545166,Reacendimento,353.0,2016-08-09T08:00,25.2,50,14.1,25.6,0.0,0.0,0.0,0.0,0,1018.6,978.4,0,0,0,0,0.21,1.6,6.7,10.7,74,78,19.1,24.4,25.2,22.7,17.7,0.097,0.156,0.248,0.359,1,3600.0,370.0,290.2,79.8,671.7,370.0,574.9,292.0,229.0,63.0,671.7,292.0,453.7,Eucalyptus L'Hér.; Magnoliopsida; Vitis vinifera L.; Pinus pinaster Aiton; Tracheophyta; 
2016,2016-08-09,Porto,Paredes,Mouriz,LUGAR DA DEVEZA (Barreiras),41.1983950000339,-8.36215200000339,NC,273.0,2016-08-09T08:00,25.1,54,15.0,25.7,0.0,0.0,0.0,0.0,0,1018.3,987.0,0,0,0,0,0.21,1.47,7.2,11.9,87,90,16.9,24.6,25.3,22.4,17.7,0.123,0.14,0.221,0.361,1,3600.0,367.1,288.3,78.7,672.0,367.1,571.0,289.0,227.0,62.0,672.0,289.0,449.6,Magnoliopsida; Pinus pinaster Aiton; Eucalyptus L'Hér.; Tracheophyta; Vitis vinifera L.
2016,2016-08-09,Porto,Penafiel,Capela,LUGAR VILA MEA (Outeiro),41.1054079998864,-8.36475200017293,NC,291.0,2016-08-09T08:00,26.0,50,14.9,26.6,0.0,0.0,0.0,0.0,0,1018.3,985.1,0,0,0,0,0.21,1.67,7.2,11.9,87,90,16.9,25.2,25.8,22.8,18.1,0.103,0.149,0.236,0.357,1,3600.0,366.8,288.1,78.7,668.6,366.8,573.5,289.0,227.0,62.0,668.6,289.0,451.9,Magnoliopsida; Eucalyptus L'Hér.
2016,2016-08-09,Porto,Trofa,Bougado (Santiago),LUGAR DE CIDAI (Celões),41.3286650000678,-8.59541700045268,NC,83.0,2016-08-09T08:00,24.5,61,16.5,25.7,0.0,0.0,0.0,0.0,0,1018.0,1008.4,0,0,0,0,0.2,1.2,7.6,10.8,19,37,18.7,25.5,27.0,23.4,18.8,0.104,0.15,0.237,0.358,1,3600.0,360.2,281.3,78.9,660.5,360.2,566.7,283.0,221.0,62.0,660.5,283.0,445.3,Magnoliopsida; Tracheophyta; Pinales; Olea europaea L.
2016,2016-08-09,Porto,Santo Tirso,Refojos de Riba de Ave,Lug do Campo de Futebol (Represas),41.2972410000695,-8.44906799952189,NC,184.0,2016-08-09T09:00,27.2,46,14.7,27.8,0.0,0.0,0.0,0.0,0,1017.8,996.8,0,0,0,0,0.34,1.94,6.7,9.0,16,23,17.6,28.0,26.5,23.4,18.5,0.094,0.155,0.247,0.358,1,3600.0,551.6,461.2,90.4,773.9,551.6,793.1,476.0,398.0,78.0,773.9,476.0,684.4,Eucalyptus L'Hér.; Tracheophyta; Magnoliopsida; Pinus pinaster Aiton; Vitis vinifera L.
2016,2016-08-09,Porto,Marco de Canaveses,Paredes de Viadores,Lug das Nuvens (Alto do Ladário),41.1248435974121,-8.13608741760254,Reacendimento,555.0,2016-08-09T09:00,26.0,41,11.9,25.2,0.0,0.0,0.0,0.0,0,1019.1,956.9,0,0,0,0,0.36,1.97,9.4,12.4,67,68,25.2,26.2,24.5,21.8,16.9,0.119,0.14,0.219,0.36,1,3600.0,558.8,468.6,90.2,780.2,558.8,799.2,483.0,405.0,78.0,780.2,483.0,690.8,Magnoliopsida; Pinus pinaster Aiton; Eucalyptus L'Hér.; Tracheophyta; Vitis vinifera L.; 
2016,2016-08-09,Porto,Santo Tirso,Santo Tirso,CARVALHINHO (Tapado),41.3383350001441,-8.47144999980926,NC,55.0,2016-08-09T10:00,28.2,48,16.2,29.8,0.0,0.0,0.0,0.0,0,1017.8,1011.5,0,0,0,0,0.47,1.99,8.4,10.4,340,346,19.4,30.0,27.0,23.5,18.9,0.1,0.149,0.237,0.355,1,3600.0,716.1,618.2,97.9,843.4,716.1,975.5,651.0,562.0,89.0,843.4,651.0,886.8,Tracheophyta; Vitis vinifera L.; Magnoliopsida
2016,2016-08-09,Porto,Maia,Folgosa,lugar de pedrosa (Avenida de São Salvador),41.2596740722656,-8.54361056857639,NC,150.0,2016-08-09T10:00,28.4,45,15.3,29.5,0.0,0.0,0.0,0.0,0,1017.8,1000.7,0,0,0,0,0.48,2.14,8.4,10.4,340,346,19.4,30.2,26.8,23.2,18.5,0.118,0.143,0.223,0.359,1,3600.0,716.1,618.2,97.9,842.4,716.1,976.7,651.0,562.0,89.0,842.4,651.0,887.9,Magnoliopsida; Eucalyptus L'Hér.; Tracheophyta; Pinus pinaster Aiton; 
2016,2016-08-09,Porto,Amarante,Salvador do Monte,LUGAR DA JOIA (Portela),41.226634979248,-8.10040378140079,Reacendimento,267.0,2016-08-09T10:00,28.8,39,13.7,30.3,0.0,0.0,0.0,0.0,0,1018.0,987.8,0,0,0,0,0.46,2.4,2.5,3.2,90,90,16.9,30.2,25.9,23.2,18.3,0.096,0.156,0.248,0.359,1,3600.0,720.8,624.1,96.7,846.9,720.8,980.8,656.0,568.0,88.0,846.9,656.0,892.6,Eucalyptus L'Hér.; Magnoliopsida; Pinus pinaster Aiton; Vitis vinifera L.; Tracheophyta; 
2016,2016-08-09,Porto,Valongo,Alfena,Lugar da aldeia nova (São Lázaro),41.2394119999144,-8.52256400002374,NC,94.0,2016-08-09T10:00,28.9,45,15.9,30.3,0.0,0.0,0.0,0.0,0,1017.8,1007.0,0,0,0,0,0.48,2.18,8.4,10.4,340,346,19.4,30.9,27.1,23.6,19.0,0.104,0.147,0.233,0.358,1,3600.0,716.1,618.2,97.9,842.4,716.1,976.7,651.0,562.0,89.0,842.4,651.0,887.9,Eucalyptus L'Hér.; Tracheophyta; Magnoliopsida
2016,2016-08-09,Porto,Paços de Ferreira,Carvalhosa,LUGAR ALDOZINDE (Igreja),41.3012059999837,-8.35812999990251,NC,344.0,2016-08-09T10:00,27.6,42,13.5,29.1,0.0,0.0,0.0,0.0,0,1018.0,979.1,0,0,0,0,0.45,2.15,2.5,3.2,90,90,16.9,29.8,25.5,22.3,17.5,0.094,0.154,0.247,0.358,1,3600.0,721.3,624.6,96.8,850.4,721.3,977.5,656.0,568.0,88.0,850.4,656.0,888.9,Tracheophyta; Eucalyptus L'Hér.; Pinus pinaster Aiton; Magnoliopsida; Vitis vinifera L.; Quercus L.; 
2016,2016-08-09,Porto,Marco de Canaveses,Rio de Galinhas,LUGAR DA SEARINHA (Rio de Galinhas),41.1811730003357,-8.14385999997457,Desconhecida,172.0,2016-08-09T11:00,30.9,36,13.9,32.2,0.0,0.0,0.0,0.0,0,1017.6,998.2,10,0,0,35,0.62,2.88,9.9,12.7,341,345,24.8,32.8,26.2,23.2,18.5,0.104,0.157,0.249,0.359,1,3600.0,836.8,726.6,110.2,868.3,836.8,1113.8,790.0,686.0,104.0,868.3,790.0,1051.5,Tracheophyta; Magnoliopsida
2016,2016-05-03,Porto,Felgueiras,Airães,s. vicente,41.314412999683,-8.20359599987666,Desconhecida,241.0,2016-05-03T12:00,22.4,44,9.4,22.4,0.0,0.0,0.0,0.0,0,1019.5,991.6,0,0,0,0,0.6,1.53,13.4,17.7,96,96,35.3,20.7,14.6,12.7,10.8,0.28,0.325,0.372,0.416,1,3600.0,954.7,847.3,107.4,944.5,954.7,1207.6,933.0,828.0,105.0,944.5,933.0,1180.2,Tracheophyta; Magnoliopsida; Eucalyptus L'Hér.; Vitis vinifera L.
2016,2016-08-09,Porto,Baião,Campelo,Aboboreira (CAMPELO),41.1621322631836,-8.02892017364502,Reacendimento,525.0,2016-08-09T11:00,28.2,37,12.1,30.0,0.0,0.0,0.0,0.0,0,1018.0,959.5,5,0,0,18,0.57,2.41,3.4,4.0,58,63,20.2,31.4,24.9,22.1,17.0,0.096,0.153,0.243,0.356,1,3600.0,844.8,742.1,102.7,885.3,844.8,1115.5,798.0,701.0,97.0,885.3,798.0,1053.8,Tracheophyta; Pinus pinaster Aiton; Magnoliopsida; Eucalyptus L'Hér.; Pinales; Quercus L.; Vitis vinifera L.; 
2016,2016-08-09,Porto,Paredes,Cete,Quinta Pinto Basto (CETE),41.1819549994999,-8.36473299980164,NC,197.0,2016-08-09T11:00,30.1,38,14.3,32.6,0.0,0.0,0.0,0.0,0,1017.4,995.1,6,0,0,19,0.57,2.63,3.1,3.6,315,323,15.1,32.2,26.2,22.9,18.3,0.122,0.14,0.22,0.361,1,3600.0,843.4,738.5,104.9,883.2,843.4,1112.8,796.0,697.0,99.0,883.2,796.0,1050.4,Magnoliopsida; Pinus pinaster Aiton; Eucalyptus L'Hér.; Tracheophyta; Vitis vinifera L.
2016,2016-08-09,Porto,Paredes,Bitarães,lugar da fronteira (Febros),41.2243779998355,-8.32509499973721,NC,190.0,2016-08-09T11:00,30.7,36,13.9,33.1,0.0,0.0,0.0,0.0,0,1017.4,995.9,6,0,0,19,0.58,2.82,3.1,3.6,315,323,15.1,32.6,26.1,23.0,18.3,0.112,0.15,0.237,0.36,1,3600.0,843.4,738.5,104.9,883.7,843.4,1112.2,796.0,697.0,99.0,883.7,796.0,1049.7,Magnoliopsida; Pinus pinaster Aiton; Eucalyptus L'Hér.; Tracheophyta; Vitis vinifera L.; Quercus L.
2016,2016-08-09,Porto,Felgueiras,Idães,lugar antonio ferreira carvalho (Outeiro),41.3349159999689,-8.24663299984402,Desconhecida,330.0,2016-08-09T11:00,29.5,37,13.1,31.7,0.0,0.0,0.0,0.0,0,1017.4,980.3,6,0,0,19,0.57,2.62,3.1,3.6,315,323,15.1,32.8,25.7,22.7,17.7,0.091,0.154,0.246,0.358,1,3600.0,843.1,738.2,104.9,883.3,843.1,1112.4,796.0,697.0,99.0,883.3,796.0,1050.2,Magnoliopsida; Tracheophyta; Eucalyptus L'Hér.; Pinus pinaster Aiton; Vitis vinifera L.
2016,2016-08-09,Porto,Gondomar,Jovim,cambitos,41.1062989997864,-8.51365100012885,Reacendimento,112.0,2016-08-09T11:00,30.2,41,15.6,31.6,0.0,0.0,0.0,0.0,0,1017.3,1004.6,6,0,0,19,0.61,2.52,12.4,15.1,330,335,22.0,32.8,27.2,23.5,18.9,0.115,0.141,0.223,0.361,1,3600.0,838.3,733.4,104.9,877.3,838.3,1112.6,791.0,692.0,99.0,877.3,791.0,1049.9,Vitis vinifera L.; Eucalyptus L'Hér.; Tracheophyta; Magnoliopsida
2016,2016-05-04,Porto,Valongo,Sobrado,lg. aldeia (Alto Vilar),41.2154399998983,-8.47325199974908,NC,145.0,2016-05-04T00:00,15.5,72,10.4,14.3,0.0,0.0,0.0,0.0,0,1016.3,999.0,0,0,0,0,0.02,0.5,9.4,20.4,72,81,22.3,15.3,17.1,13.9,11.9,0.275,0.317,0.369,0.415,0,0.0,0.0,0.0,0.0,0.0,0.0,0.0,0.0,0.0,0.0,0.0,0.0,0.0,Tracheophyta; Eucalyptus L'Hér.; Magnoliopsida; Pinus pinaster Aiton
2016,2016-08-09,Porto,Lousada,Figueiras,Figueiras (Fogaça),41.2803569995032,-8.32901000022888,NC,324.0,2016-08-09T12:00,30.4,35,13.0,32.5,0.0,0.0,0.0,0.0,0,1017.1,980.8,7,0,0,23,0.66,2.84,6.4,7.9,313,317,19.1,34.7,26.0,22.6,17.7,0.092,0.154,0.246,0.358,1,3600.0,911.6,803.7,107.9,902.0,911.6,1185.9,887.0,782.0,105.0,902.0,887.0,1153.8,Eucalyptus L'Hér.; Tracheophyta; Pinus pinaster Aiton; Magnoliopsida
2016,2016-08-09,Porto,Paredes,Baltar,Alto de Trigais (ER319 (ER319) Km 29),41.1875877380371,-8.38666819254557,NC,284.0,2016-08-09T13:00,30.9,33,12.9,32.9,0.0,0.0,0.0,0.0,0,1016.2,984.4,7,0,0,24,0.7,2.99,8.1,10.0,315,319,22.3,34.3,26.1,22.3,17.7,0.122,0.14,0.219,0.361,1,3600.0,920.5,803.6,116.9,893.6,920.5,1196.9,921.0,804.0,117.0,893.6,921.0,1197.6,Magnoliopsida; Pinus pinaster Aiton; Eucalyptus L'Hér.; Tracheophyta; Vitis vinifera L.
2016,2016-08-09,Porto,Vila Nova de Gaia,Pedroso,Lugar alto do monte (Avenida Padre Marçal da Silva Pereira),41.0597076416016,-8.55458831787109,NC,141.0,2016-08-09T12:00,29.7,43,15.8,30.9,0.0,0.0,0.0,0.0,0,1017.3,1001.3,6,0,0,19,0.68,2.38,17.3,21.7,329,331,31.7,33.0,27.1,23.1,18.6,0.115,0.151,0.24,0.364,1,3600.0,908.9,803.0,105.9,900.2,908.9,1187.3,884.0,781.0,103.0,900.2,884.0,1154.7,Eucalyptus L'Hér.; Magnoliopsida; Tracheophyta
2016,2016-08-09,Porto,Amarante,Freixo de Baixo,CHAOS (Cestais),41.2799682617188,-8.10233020358615,Reacendimento,237.0,2016-08-09T13:00,32.2,31,12.9,34.1,0.0,0.0,0.0,0.0,0,1016.2,989.7,7,0,0,24,0.72,3.31,8.1,10.0,315,319,22.3,35.8,26.4,22.9,18.1,0.103,0.157,0.248,0.359,1,3600.0,920.3,803.4,116.9,894.5,920.3,1195.4,921.0,804.0,117.0,894.5,921.0,1196.2,Tracheophyta; Eucalyptus L'Hér.; Magnoliopsida; Vitis vinifera L.
2016,2016-08-09,Porto,Póvoa de Varzim,Balazar,Lugar de S Pedro (Monte das Pedreiras),41.3934898546007,-8.62699225531684,Reacendimento,89.0,2016-08-09T12:00,30.2,41,15.5,30.0,0.0,0.0,0.0,0.0,0,1017.6,1007.5,9,0,0,31,0.7,2.53,24.0,32.6,343,349,40.0,33.5,27.2,23.3,18.7,0.1,0.149,0.237,0.355,1,3600.0,901.8,792.8,109.0,890.9,901.8,1184.4,877.0,771.0,106.0,890.9,877.0,1151.8,Magnoliopsida; Pinus pinaster Aiton; Eucalyptus L'Hér.; Tracheophyta; Vitis vinifera L.
2016,2016-08-09,Porto,Felgueiras,Caramos,Lugar da ispiouca (Mouta),41.3371467418141,-8.16631317138672,Reacendimento,327.0,2016-08-09T13:00,31.3,32,12.4,33.0,0.0,0.0,0.0,0.0,0,1016.2,979.7,7,0,0,24,0.71,3.12,8.1,10.0,315,319,22.3,36.4,26.4,22.7,17.7,0.091,0.153,0.246,0.358,1,3600.0,920.1,803.2,116.9,895.0,920.1,1194.5,921.0,804.0,117.0,895.0,921.0,1195.6,Pinus pinaster Aiton; Tracheophyta; Magnoliopsida; Eucalyptus L'Hér.
2016,2016-05-04,Porto,Vila Do Conde,Vilar de Pinheiro,PADINHO,41.2699179999034,-8.67853199958801,NC,47.0,2016-05-04T05:00,15.8,62,8.6,13.3,0.0,0.0,0.0,0.0,0,1014.8,1009.2,0,0,0,0,0.06,0.68,14.4,28.1,86,91,25.6,14.9,16.8,14.4,12.5,0.268,0.318,0.37,0.415,0,0.0,0.0,0.0,0.0,0.0,0.0,0.0,0.0,0.0,0.0,0.0,0.0,0.0,Magnoliopsida; Eucalyptus L'Hér.; Tracheophyta
2016,2016-08-09,Porto,Baião,Gove,Picoto (Giz),41.1427219994863,-8.05765300008986,Desconhecida,493.0,2016-08-09T14:00,31.4,29,11.0,32.8,0.0,0.0,0.0,0.0,0,1016.2,961.8,14,0,1,44,0.64,3.27,5.3,6.3,332,336,18.7,35.8,26.2,22.2,17.3,0.119,0.14,0.217,0.36,1,3600.0,820.5,694.2,126.2,811.4,820.5,1138.8,845.0,715.0,130.0,811.4,845.0,1172.9,Tracheophyta; Magnoliopsida; Pinales; Eucalyptus L'Hér.; Vitis vinifera L.; Quercus L.; Pinus pinaster Aiton; ; Castanea sativa Mill.
2016,2016-08-09,Porto,Vila Nova de Gaia,Grijó,Grijo (Quinta do Mosteiro),41.0302009995778,-8.57995500034756,NC,111.0,2016-08-09T14:00,31.0,38,15.0,31.6,0.0,0.0,0.0,0.0,0,1015.9,1003.3,10,0,0,35,0.7,2.78,17.9,22.6,332,335,30.6,36.8,28.3,23.6,19.1,0.089,0.124,0.197,0.331,1,3600.0,837.0,720.3,116.7,838.3,837.0,1143.7,861.0,741.0,120.0,838.3,861.0,1176.5,Magnoliopsida; Tracheophyta; Eucalyptus L'Hér.
2016,2016-08-09,Porto,Santo Tirso,Palmeira,Vale de moura (Sapateira),41.3535620000627,-8.50065300001038,NC,61.0,2016-08-09T14:00,32.3,34,14.5,32.7,0.0,0.0,0.0,0.0,0,1015.9,1009.0,10,0,0,35,0.72,3.18,17.9,22.6,332,335,30.6,35.8,28.2,23.6,18.9,0.115,0.145,0.226,0.358,1,3600.0,836.9,720.3,116.6,840.9,836.9,1140.1,861.0,741.0,120.0,840.9,861.0,1172.9,Tracheophyta; Magnoliopsida; Vitis vinifera L.; Pinus pinaster Aiton; Eucalyptus L'Hér.
2016,2016-08-09,Porto,Gondomar,Melres,Castelo (Quinta da Varziela),41.0608549997542,-8.41979199992286,Desconhecida,57.0,2016-08-09T15:00,32.2,35,14.8,30.3,0.0,0.0,0.0,0.0,0,1015.8,1009.3,13,0,0,43,0.75,3.12,31.7,42.7,332,337,49.7,36.3,28.5,23.9,19.2,0.115,0.141,0.222,0.361,1,3600.0,767.5,658.3,109.2,854.7,767.5,1025.1,815.0,699.0,116.0,854.7,815.0,1088.6,Eucalyptus L'Hér.; Tracheophyta; Pinus pinaster Aiton; Magnoliopsida
2016,2016-08-09,Porto,Marco de Canaveses,Paredes de Viadores,Lugar Penedo do Cavalo (Mondim de Cima),41.1438026428223,-8.13400459276305,Reacendimento,325.0,2016-08-09T13:00,31.5,31,12.5,33.3,0.0,0.0,0.0,0.0,0,1016.2,980.0,7,0,0,24,0.71,3.18,8.1,10.0,315,319,22.3,36.2,26.4,22.8,17.9,0.096,0.155,0.247,0.358,1,3600.0,920.1,803.2,116.9,893.4,920.1,1196.5,921.0,804.0,117.0,893.4,921.0,1197.7,Magnoliopsida; Pinus pinaster Aiton; Eucalyptus L'Hér.; Tracheophyta; Vitis vinifera L.; 
2016,2016-08-09,Porto,Lousada,Caíde de Rei,MOURE (Mouro),41.2595350000593,-8.22495499981774,Desconhecida,249.0,2016-08-09T14:00,32.0,31,12.6,33.3,0.0,0.0,0.0,0.0,0,1015.8,987.9,11,0,0,37,0.68,3.3,9.2,11.0,318,322,24.8,37.4,27.2,23.3,18.3,0.091,0.153,0.246,0.358,1,3600.0,826.7,701.4,125.3,819.1,826.7,1139.7,851.0,722.0,129.0,819.1,851.0,1173.2,Tracheophyta; Eucalyptus L'Hér.; Pinus pinaster Aiton; Magnoliopsida
2016,2016-08-09,Porto,Marco de Canaveses,Sobretâmega,Pombal (Agrochão de Além),41.1996530003018,-8.16803500003285,Desconhecida,144.0,2016-08-09T15:00,33.0,31,13.7,32.4,0.0,0.0,0.0,0.0,0,1015.2,999.0,17,0,3,50,0.69,3.47,19.8,25.9,331,335,32.4,36.9,27.8,23.5,18.8,0.101,0.155,0.248,0.359,1,3600.0,720.1,601.5,118.6,783.4,720.1,1021.8,765.0,639.0,126.0,783.4,765.0,1085.6,Vitis vinifera L.; Tracheophyta; Pinus pinaster Aiton; Magnoliopsida; Quercus L.; ; Eucalyptus L'Hér.
2016,2016-08-09,Porto,Marco de Canaveses,Várzea do Douro,Lugar de Picotos (Picotos),41.0702620000309,-8.27773800002204,Desconhecida,78.0,2016-08-09T15:00,32.8,33,14.4,32.4,0.0,0.0,0.0,0.0,0,1015.2,1006.4,17,0,3,50,0.69,3.34,19.8,25.9,331,335,32.4,36.7,28.3,23.8,19.2,0.109,0.148,0.234,0.359,1,3600.0,720.2,601.6,118.6,782.0,720.2,1023.9,765.0,639.0,126.0,782.0,765.0,1087.6,Pinus pinaster Aiton; Magnoliopsida; Quercus L.
2016,2016-05-04,Porto,Valongo,Sobrado,LUGAR DO PASSO (SOBRADO),41.2104179996914,-8.46103000005086,NC,119.0,2016-05-04T10:00,22.6,51,11.9,21.7,0.0,0.0,0.0,0.0,1,1014.7,1000.9,25,0,0,82,0.45,1.35,15.5,20.9,91,92,29.2,20.1,16.4,14.2,12.2,0.274,0.316,0.368,0.415,1,3600.0,763.8,645.8,118.0,855.5,763.8,1015.7,699.0,591.0,108.0,855.5,699.0,929.6,Tracheophyta; Pinus pinaster Aiton; Magnoliopsida
2016,2016-08-09,Porto,Marco de Canaveses,Paredes de Viadores,São João do Couto (Couto),41.1541938781738,-8.13047790527344,Reacendimento,180.0,2016-08-09T15:00,32.9,30,13.1,32.3,0.0,0.0,0.0,0.0,1,1015.5,995.3,20,0,4,59,0.66,3.51,17.0,22.2,343,347,34.2,36.6,27.4,23.2,18.4,0.103,0.157,0.248,0.359,1,3600.0,685.2,567.6,117.7,739.0,685.2,1022.2,728.0,603.0,125.0,739.0,728.0,1086.1,Magnoliopsida; Pinus pinaster Aiton; Eucalyptus L'Hér.; Tracheophyta; Vitis vinifera L.; 
2016,2016-08-09,Porto,Amarante,Oliveira,Lugar do barreiro (Oliveira),41.2576760000653,-8.19737300025092,Desconhecida,219.0,2016-08-09T15:00,32.3,31,12.9,32.8,0.0,0.0,0.0,0.0,0,1015.1,990.6,18,0,6,48,0.63,3.35,11.0,13.6,319,323,26.3,35.7,27.1,22.8,18.1,0.112,0.149,0.236,0.359,1,3600.0,710.7,591.1,119.5,770.0,710.7,1021.8,755.0,628.0,127.0,770.0,755.0,1085.6,Magnoliopsida; Eucalyptus L'Hér.; Tracheophyta; Vitis vinifera L.
2016,2016-08-09,Porto,Gondomar,Foz do Sousa,jancido (Central Elevatória de Águas),41.0956989998288,-8.49942799992031,NC,27.0,2016-08-09T09:00,28.0,52,17.2,27.8,0.0,0.0,0.0,0.0,0,1017.6,1014.5,0,0,0,0,0.39,1.81,18.3,23.7,344,351,29.9,29.2,27.9,24.1,19.6,0.09,0.124,0.198,0.331,1,3600.0,541.8,449.0,92.8,755.7,541.8,790.8,467.0,387.0,80.0,755.7,467.0,681.6,Eucalyptus L'Hér.; Vitis vinifera L.; Tracheophyta; Magnoliopsida; Pinus pinaster Aiton
2016,2016-08-09,Porto,Felgueiras,Pedreira,Lugar de Tarrario (Tarrio),41.3340259999699,-8.2103719997406,NC,249.0,2016-08-09T16:00,31.9,29,11.9,31.1,0.0,0.0,0.0,0.0,1,1014.6,986.8,26,0,6,73,0.54,3.34,12.2,15.8,326,330,28.8,36.5,27.8,23.3,18.3,0.091,0.153,0.245,0.358,1,3600.0,558.2,435.1,123.0,681.3,558.2,850.2,617.0,481.0,136.0,681.3,617.0,939.8,Tracheophyta; Magnoliopsida; Eucalyptus L'Hér.
2016,2016-08-09,Porto,Felgueiras,Pinheiro,Pinheiro (SENHORA DO PINHEIRO),41.3710429999563,-8.15251299990548,NC,550.0,2016-08-09T16:00,30.1,30,10.7,29.1,0.0,0.0,0.0,0.0,1,1015.6,954.9,37,0,33,56,0.47,2.99,9.0,11.2,360,4,24.5,34.8,26.5,21.8,16.7,0.096,0.145,0.232,0.352,1,3600.0,503.5,384.2,119.3,604.0,503.5,846.6,557.0,425.0,132.0,604.0,557.0,936.5,Pinus pinaster Aiton; Tracheophyta; Magnoliopsida; Eucalyptus L'Hér.; Vitis vinifera L.
2016,2016-08-09,Porto,Gondomar,Gondomar (São Cosme),Lugar de ferreira cardoso (Murejães),41.126216000451,-8.54067000018226,NC,108.0,2016-08-09T16:00,31.5,36,14.7,30.4,0.0,0.0,0.0,0.0,1,1014.7,1002.5,25,0,4,74,0.58,2.95,20.8,27.7,334,337,33.8,35.4,28.4,23.6,18.9,0.115,0.141,0.221,0.361,1,3600.0,573.0,454.4,118.6,708.3,573.0,853.9,633.0,502.0,131.0,708.3,633.0,943.3,Tracheophyta; Magnoliopsida; Eucalyptus L'Hér.
2016,2016-08-09,Porto,Santo Tirso,Lamelas,Lugar do calvario (Guarda),41.2813279999627,-8.46964799986945,NC,142.0,2016-08-09T16:00,31.4,34,13.6,29.9,0.0,0.0,0.0,0.0,1,1014.7,998.7,25,0,4,74,0.59,3.04,20.8,27.7,334,337,33.8,34.8,28.2,23.3,18.6,0.118,0.142,0.222,0.359,1,3600.0,573.1,454.5,118.6,708.8,573.1,853.5,633.0,502.0,131.0,708.8,633.0,942.7,Pinus pinaster Aiton; Vitis vinifera L.; Eucalyptus L'Hér.; Tracheophyta
2016,2016-08-09,Porto,Lousada,Lustosa,Serra de campelos (LUSTOSA),41.3394890001085,-8.32309438069661,Reacendimento,436.0,2016-08-09T16:00,30.9,28,10.4,29.5,0.0,0.0,0.0,0.0,1,1014.9,966.6,23,0,1,76,0.56,3.2,14.3,18.9,317,320,35.3,35.1,26.8,22.1,17.1,0.098,0.147,0.235,0.353,1,3600.0,587.9,470.3,117.6,737.9,587.9,848.3,650.0,520.0,130.0,737.9,650.0,938.0,Eucalyptus L'Hér.; Tracheophyta; Magnoliopsida
2016,2016-08-09,Porto,Lousada,Boim,Lugar de Eiras (Vila Chã),41.2616399998135,-8.27653100013733,NC,235.0,2016-08-09T16:00,31.8,30,12.1,31.0,0.0,0.0,0.0,0.0,1,1014.6,988.3,26,0,6,73,0.54,3.28,12.2,15.8,326,330,28.8,36.1,27.8,23.2,18.3,0.092,0.153,0.246,0.358,1,3600.0,558.1,435.1,123.0,681.0,558.1,850.3,617.0,481.0,136.0,681.0,617.0,940.1,Tracheophyta; Eucalyptus L'Hér.; Pinus pinaster Aiton; Magnoliopsida; Vitis vinifera L.; 
