2016,2016-08-10,Porto,Marco de Canaveses,Penha Longa,Piares,41.1038513183594,-8.1473245578342,Reacendimento,443.0,2016-08-10T08:00,18.6,44,6.1,14.1,0.0,0.0,0.0,0.0,0,1018.6,967.4,0,0,0,0,0.25,1.2,24.1,35.8,81,80,60.1,22.0,25.3,22.7,17.7,0.118,0.14,0.217,0.359,1,3600.0,364.5,283.2,81.3,658.6,364.5,572.5,287.0,223.0,64.0,658.6,287.0,450.7,Pinus pinaster Aiton; Magnoliopsida; Tracheophyta; Eucalyptus L'Hér.
2016,2016-08-10,Porto,Marco de Canaveses,Paredes de Viadores,Montedeiras (Granja),41.1347198486328,-8.13411331163512,Reacendimento,390.0,2016-08-10T08:00,18.9,44,6.4,14.5,0.0,0.0,0.0,0.0,0,1018.6,973.4,0,0,0,0,0.25,1.23,24.1,35.8,81,80,60.1,22.3,25.7,23.0,18.0,0.118,0.14,0.217,0.359,1,3600.0,364.5,283.2,81.3,658.8,364.5,572.3,287.0,223.0,64.0,658.8,287.0,450.6,Magnoliopsida; Pinus pinaster Aiton; Eucalyptus L'Hér.; Tracheophyta; Vitis vinifera L.; 
2016,2016-03-13,Porto,Amarante,Travanca,RUA PINHEIRAIS (TRAVANCA),41.2784039995405,-8.19162099997203,Desconhecida,220.0,2016-03-13T19:00,12.7,57,4.4,10.8,0.0,0.0,0.0,0.0,0,1017.2,990.9,0,0,0,0,0.02,0.64,3.7,5.1,331,356,10.1,10.8,10.0,9.1,11.0,0.359,0.373,0.388,0.414,0,218.74,0.0,0.0,0.0,0.0,0.0,0.0,18.0,9.0,9.0,99.2,18.0,65.4,Tracheophyta; Magnoliopsida; Eucalyptus L'Hér.; Vitis vinifera L.; Pinus pinaster Aiton; 
2016,2016-05-04,Porto,Vila Do Conde,Gião,LUGAR DA FONTE,41.3086569997999,-8.67407900015513,NC,55.0,2016-05-04T14:00,26.9,44,13.6,29.2,0.0,0.0,0.0,0.0,1,1013.0,1006.7,27,0,0,89,0.6,1.98,5.4,3.4,307,288,18.4,25.2,18.1,14.4,12.4,0.253,0.314,0.368,0.415,1,3600.0,831.9,605.3,226.6,710.2,831.9,1146.7,859.0,625.0,234.0,710.2,859.0,1184.2,Magnoliopsida; Tracheophyta; Eucalyptus L'Hér.
2016,2016-08-10,Porto,Marco de Canaveses,Rio de Galinhas,L. Monte (Tapadinha),41.1784057617188,-8.14699459499783,Desconhecida,234.0,2016-08-10T10:00,23.0,33,5.7,19.2,0.0,0.0,0.0,0.0,0,1018.8,991.7,0,0,0,0,0.49,1.89,22.3,31.0,81,81,57.2,25.8,25.6,23.0,18.1,0.103,0.156,0.247,0.358,1,3600.0,735.7,634.5,101.2,864.2,735.7,977.5,669.0,577.0,92.0,864.2,669.0,888.9,Tracheophyta; Magnoliopsida; Pinus pinaster Aiton
2016,2016-08-10,Porto,Marco de Canaveses,Vila Boa de Quires,VILA BOA DE QUIRES (Ribeira de Vila Boa),41.2077484130859,-8.1970071750217,Desconhecida,224.0,2016-08-10T11:00,24.8,30,6.1,22.0,0.0,0.0,0.0,0.0,0,1018.8,993.0,0,0,0,0,0.6,2.19,21.8,29.9,77,77,55.8,27.8,25.7,23.1,18.2,0.103,0.156,0.247,0.358,1,3600.0,860.2,756.4,103.8,906.7,860.2,1110.6,812.0,714.0,98.0,906.7,812.0,1048.4,Pinus pinaster Aiton; Tracheophyta; Eucalyptus L'Hér.; Magnoliopsida; Vitis vinifera L.; Quercus L.; Pinales; 
2016,2016-08-10,Porto,Felgueiras,Vila Cova da Lixa,Alminhas (Alto do Coto),41.3185195922852,-8.16069793701172,Reacendimento,393.0,2016-08-10T11:00,24.1,29,4.8,21.0,0.0,0.0,0.0,0.0,0,1018.4,973.6,0,0,0,0,0.59,2.14,20.9,29.0,75,76,61.2,27.5,25.0,22.5,17.4,0.091,0.153,0.245,0.357,1,3600.0,855.7,751.9,103.8,901.2,855.7,1110.8,808.0,710.0,98.0,901.2,808.0,1048.9,Magnoliopsida; Tracheophyta; Eucalyptus L'Hér.
2016,2016-08-10,Porto,Vila Nova de Gaia,Pedroso,Lugar de Idanha (Rampa da Senhora da Saúde),41.0588226318359,-8.57127000596788,Reacendimento,213.0,2016-08-10T11:00,25.5,28,5.8,22.7,0.0,0.0,0.0,0.0,0,1018.0,993.6,0,0,0,0,0.61,2.35,20.6,27.4,63,65,50.4,28.4,25.9,23.1,18.3,0.104,0.146,0.231,0.357,1,3600.0,849.0,746.2,102.8,894.9,849.0,1110.2,801.0,704.0,97.0,894.9,801.0,1047.4,Eucalyptus L'Hér.; Magnoliopsida; Tracheophyta
2016,2016-05-04,Porto,Santo Tirso,Agrela,ESTRADA DA AGRELA (Ribeiro da Balinha),41.2504399999976,-8.46646000014411,NC,148.0,2016-05-04T14:00,26.6,42,12.5,28.9,0.0,0.0,0.0,0.0,1,1012.9,996.0,28,0,0,92,0.59,2.03,2.6,3.1,214,201,16.9,24.5,17.5,13.9,11.8,0.278,0.313,0.364,0.415,1,3600.0,820.0,578.0,242.0,678.3,820.0,1146.5,847.0,597.0,250.0,678.3,847.0,1184.2,Eucalyptus L'Hér.; Tracheophyta; Magnoliopsida
2016,2016-08-10,Porto,Lousada,Nevogilde,LUGAR DE SANTIAGO (Barrimau),41.2542610168457,-8.3260583835178,Desconhecida,262.0,2016-08-10T11:00,25.2,28,5.5,22.2,0.0,0.0,0.0,0.0,0,1018.8,988.8,0,0,0,0,0.61,2.31,21.8,29.9,77,77,55.8,28.4,25.8,23.2,18.2,0.092,0.153,0.245,0.357,1,3600.0,860.4,756.6,103.8,907.7,860.4,1109.7,812.0,714.0,98.0,907.7,812.0,1047.2,Eucalyptus L'Hér.; Magnoliopsida; Quercus L.; Tracheophyta; Vitis vinifera L.
2016,2016-08-10,Porto,Penafiel,Urrô,Lugar da Seca (Seca),41.1831817626953,-8.34856319851346,NC,137.0,2016-08-10T11:00,25.8,29,6.5,22.9,0.0,0.0,0.0,0.0,0,1018.4,1002.6,0,0,0,0,0.62,2.35,21.7,29.2,66,68,46.8,28.5,26.3,23.5,18.7,0.111,0.149,0.235,0.359,1,3600.0,853.0,749.2,103.8,898.3,853.0,1110.4,805.0,707.0,98.0,898.3,805.0,1047.9,Tracheophyta; Magnoliopsida; Eucalyptus L'Hér.
2016,2016-08-10,Porto,Trofa,Covelas,Serra do Cantoneiros (Quereledo),41.2968978881836,-8.53876780192057,Desconhecida,107.0,2016-08-10T12:00,28.0,25,6.0,25.6,0.0,0.0,0.0,0.0,0,1017.8,1005.5,0,0,0,0,0.71,2.84,21.0,27.7,68,69,44.3,30.8,26.7,23.6,18.8,0.118,0.142,0.221,0.358,1,3600.0,925.2,821.4,103.8,924.4,925.2,1183.0,900.0,799.0,101.0,924.4,900.0,1150.7,Magnoliopsida; Pinus pinaster Aiton; Vitis vinifera L.; Quercus L.; Tracheophyta; Eucalyptus L'Hér.; Olea europaea L.; ; Pinales
2016,2016-08-10,Porto,Amarante,Vila Chã do Marão,Outeiro (Real),41.2825088500977,-8.03844547271729,Reacendimento,285.0,2016-08-10T13:00,27.4,27,6.7,25.7,0.0,0.0,0.0,0.0,0,1017.5,985.2,0,0,0,0,0.72,2.68,19.5,26.1,78,78,51.1,31.5,26.0,23.2,18.2,0.096,0.154,0.245,0.357,1,3600.0,943.0,841.1,101.9,939.1,943.0,1192.5,944.0,842.0,102.0,939.1,944.0,1193.7,Eucalyptus L'Hér.; Magnoliopsida; Vitis vinifera L.; Pinus pinaster Aiton; Tracheophyta; 
2016,2016-05-04,Porto,Amarante,Figueiró (Santiago),RUA SERRINHA (Serrinha),41.3103399997287,-8.16880799995528,Desconhecida,415.0,2016-05-04T14:00,25.0,40,10.4,26.7,0.0,0.0,0.0,0.0,1,1013.4,966.5,28,0,0,93,0.57,1.9,2.9,3.4,150,148,23.4,22.6,15.1,11.9,9.7,0.258,0.315,0.368,0.415,1,3600.0,817.5,574.6,242.8,676.2,817.5,1143.4,845.0,594.0,251.0,676.2,845.0,1181.9,Tracheophyta; Magnoliopsida; Vitis vinifera L.
2016,2016-08-10,Porto,Amarante,Fregim,São Jorge (FREGIM),41.2640113830566,-8.10688209533691,Desconhecida,258.0,2016-08-10T13:00,27.8,26,6.5,26.1,0.0,0.0,0.0,0.0,0,1017.5,988.2,0,0,0,0,0.73,2.77,19.5,26.1,78,78,51.1,31.0,25.8,22.9,18.0,0.103,0.156,0.247,0.358,1,3600.0,943.0,841.1,101.9,938.5,943.0,1193.2,944.0,842.0,102.0,938.5,944.0,1194.4,Tracheophyta; Magnoliopsida; Pinus pinaster Aiton; Vitis vinifera L.; Quercus L.; Eucalyptus L'Hér.; 
2016,2016-08-10,Porto,Póvoa de Varzim,Estela,Lugar das Hortas (Carrascos),41.4542388916016,-8.75676730685764,Reacendimento,19.0,2016-08-10T13:00,29.1,25,6.9,28.3,0.0,0.0,0.0,0.0,0,1017.8,1015.6,0,0,0,0,0.72,3.03,14.3,19.8,28,37,34.9,32.7,26.6,23.7,19.1,0.095,0.148,0.237,0.353,1,3600.0,934.0,831.0,103.0,928.2,934.0,1191.9,934.0,831.0,103.0,928.2,934.0,1191.9,Tracheophyta
2016,2016-08-10,Porto,Penafiel,Novelas,Lugar de Pegas- marecos (Monte),41.2235298156738,-8.29717444525825,NC,183.0,2016-08-10T12:00,27.2,27,6.5,25.6,0.0,0.0,0.0,0.0,0,1018.3,997.4,0,0,0,0,0.68,2.63,17.0,22.9,73,74,42.1,30.1,26.1,23.2,18.4,0.111,0.149,0.234,0.359,1,3600.0,926.8,822.0,104.8,924.0,926.8,1184.4,902.0,800.0,102.0,924.0,902.0,1152.7,Tracheophyta; Eucalyptus L'Hér.; Vitis vinifera L.
2016,2016-08-10,Porto,Vila Nova de Gaia,Canelas,Brito e Cunha (Rua de Canelas de Baixo),41.0803413391113,-8.59665778266059,Desconhecida,141.0,2016-08-10T13:00,29.0,25,7.1,27.5,0.0,0.0,0.0,0.0,0,1017.0,1000.9,0,0,0,0,0.74,3.0,18.5,24.5,63,66,45.0,31.9,26.5,23.3,18.7,0.114,0.15,0.238,0.363,1,3600.0,934.9,831.9,103.0,926.5,934.9,1195.4,935.0,832.0,103.0,926.5,935.0,1195.5,Tracheophyta; Magnoliopsida; Eucalyptus L'Hér.
2016,2016-08-10,Porto,Marco de Canaveses,Vila Boa de Quires,Portela,41.1826324462891,-8.21188641018338,Desconhecida,342.0,2016-08-10T13:00,27.3,26,6.0,25.4,0.0,0.0,0.0,0.0,0,1017.5,978.8,0,0,0,0,0.72,2.69,19.5,26.1,78,78,51.1,30.5,25.2,22.3,17.5,0.103,0.156,0.247,0.358,1,3600.0,943.0,841.1,101.9,938.0,943.0,1193.9,944.0,842.0,102.0,938.0,944.0,1195.2,Pinus pinaster Aiton; Tracheophyta; Eucalyptus L'Hér.; Magnoliopsida; Vitis vinifera L.; Quercus L.; Pinales; 
2016,2016-08-10,Porto,Santo Tirso,Monte Córdova,Cabanas (Quinta de Linhares),41.3196449110243,-8.4422807820638,Desconhecida,410.0,2016-08-10T13:00,27.4,24,4.8,25.2,0.0,0.0,0.0,0.0,0,1017.4,971.3,0,0,0,0,0.73,2.78,19.4,26.4,75,76,55.8,31.0,25.2,22.2,17.2,0.092,0.152,0.244,0.357,1,3600.0,939.3,836.3,102.9,933.6,939.3,1192.7,940.0,837.0,103.0,933.6,940.0,1193.6,Pinus pinaster Aiton; Tracheophyta; Eucalyptus L'Hér.; Vitis vinifera L.
2016,2016-05-04,Porto,Felgueiras,Jugueiros,LG. CORVETE (Rio Ferro),41.4044410000907,-8.22043800009621,Desconhecida,180.0,2016-05-04T15:00,27.2,35,10.4,28.2,0.0,0.0,0.0,0.0,1,1012.6,992.1,28,0,0,92,0.55,2.35,4.4,5.2,261,258,20.5,24.6,17.4,13.5,11.3,0.255,0.312,0.367,0.415,1,3600.0,734.1,525.9,208.1,694.9,734.1,1018.4,783.0,561.0,222.0,694.9,783.0,1086.3,Vitis vinifera L.; Eucalyptus L'Hér.; Magnoliopsida; Pinus pinaster Aiton
2016,2016-08-10,Porto,Gondomar,Valbom,Alto Acheira (Ponte Gramido),41.1281700134277,-8.55939673529731,Reacendimento,39.0,2016-08-10T13:00,29.7,25,7.8,28.3,0.0,0.0,0.0,0.0,0,1017.3,1012.8,0,0,0,0,0.76,3.11,18.9,24.7,66,69,41.0,32.5,27.1,24.0,19.3,0.114,0.15,0.238,0.363,1,3600.0,937.9,835.9,102.0,931.6,937.9,1194.7,938.0,836.0,102.0,931.6,938.0,1194.8,Tracheophyta; Magnoliopsida; Pinus pinaster Aiton; Eucalyptus L'Hér.
2016,2016-08-10,Porto,Penafiel,Urrô,Lugar da Seca (Torre),41.188419342041,-8.33911610921224,NC,128.0,2016-08-10T14:00,30.2,24,7.6,29.0,0.0,0.0,0.0,0.0,0,1016.9,1002.4,0,0,0,0,0.74,3.24,16.7,21.9,65,67,37.1,33.6,27.0,23.7,18.9,0.109,0.147,0.232,0.359,1,3600.0,891.8,793.7,98.1,928.5,891.8,1138.1,918.0,817.0,101.0,928.5,918.0,1171.5,Tracheophyta; Eucalyptus L'Hér.
