2017,2017-01-14,Lisboa,Cascais,São Domingos de Rana,Parque Industrial Talaide (Quinta do Sirgado),38.7408720000585,-9.30970399962531,Desconhecida,124.0,2017-01-14T15:00,12.1,44,0.2,8.1,0.0,0.0,0.0,0.0,0,1028.9,1013.8,0,0,0,0,0.22,0.79,13.1,18.8,32,32,30.2,12.4,10.8,12.8,15.3,0.338,0.355,0.367,0.309,1,3600.0,381.7,309.3,72.4,812.8,381.7,538.0,427.0,346.0,81.0,812.8,427.0,601.8,Tracheophyta; Magnoliopsida
2017,2017-04-09,Lisboa,Lourinhã,Reguengo Grande,Cesaredas (Vale de Tornada),39.3005019999875,-9.22234999974569,Desconhecida,152.0,2017-04-09T14:00,25.5,24,3.7,22.6,0.0,0.0,0.0,0.0,0,1016.8,999.3,19,0,0,63,0.66,2.47,21.2,28.5,145,145,45.0,22.4,16.1,14.3,12.5,0.104,0.179,0.222,0.219,1,3600.0,846.9,723.0,123.9,899.4,846.9,1096.7,875.0,747.0,128.0,899.4,875.0,1133.1,Vitis vinifera L.; Tracheophyta; Magnoliopsida; Eucalyptus L'Hér.; Quercus L.; 
2017,2017-04-09,Lisboa,Alenquer,Carnota,Casal das Eiras (Santana da Carnota),39.0393639998966,-9.07326099978553,Desconhecida,194.0,2017-04-09T12:00,22.7,31,4.8,19.6,0.0,0.0,0.0,0.0,0,1017.6,995.1,8,0,0,28,0.59,1.89,22.7,29.0,133,133,42.1,20.2,15.5,14.5,12.7,0.159,0.264,0.295,0.268,1,3600.0,885.2,735.8,149.4,871.6,885.2,1151.6,859.0,714.0,145.0,871.6,859.0,1117.5,Magnoliopsida; Vitis vinifera L.; Tracheophyta; Eucalyptus L'Hér.; Olea europaea L.
2017,2017-04-10,Lisboa,Lisboa,Marvila,Rua João césar monteiro (Marvila),38.7391040001975,-9.11070999993218,NC,39.0,2017-04-10T01:00,15.6,73,10.9,14.4,0.0,0.0,0.0,0.0,0,1018.8,1014.1,0,0,0,0,0.02,0.47,10.4,22.6,104,119,19.1,15.7,17.6,16.0,14.1,0.231,0.284,0.328,0.317,0,0.0,0.0,0.0,0.0,0.0,0.0,0.0,0.0,0.0,0.0,0.0,0.0,0.0,Tracheophyta; Magnoliopsida
2017,2017-04-10,Lisboa,Alenquer,Alenquer (Triana),Ic2 jt Km 35 (Cheganças),39.082345000373,-8.98946899996863,Desconhecida,40.0,2017-04-10T00:00,13.9,78,10.2,12.4,0.0,0.0,0.0,0.0,0,1019.2,1014.4,1,0,0,4,0.02,0.34,11.0,16.6,113,146,13.0,16.1,18.2,15.7,13.7,0.141,0.257,0.292,0.268,0,0.0,0.0,0.0,0.0,0.0,0.0,0.0,0.0,0.0,0.0,0.0,0.0,0.0,Tracheophyta; Olea europaea L.; Eucalyptus L'Hér.; Vitis vinifera L.; Magnoliopsida; Pinus pinea L.
2017,2017-04-10,Lisboa,Sobral de Monte Agraço,Santo Quintino,Pontes de Monfalim (Quinta do Paço),39.00111700005,-9.1235449997584,Desconhecida,242.0,2017-04-10T17:00,24.9,31,6.8,23.1,0.0,0.0,0.0,0.0,0,1020.2,992.4,6,0,0,21,0.33,2.17,6.9,8.8,174,168,27.0,24.2,18.2,14.8,12.7,0.133,0.254,0.286,0.236,1,3600.0,386.1,312.8,73.3,767.1,386.1,556.0,469.0,380.0,89.0,767.1,469.0,675.4,Magnoliopsida; Vitis vinifera L.; Pinus pinaster Aiton
2017,2017-04-11,Lisboa,Alenquer,Alenquer (Santo Estêvão),Cabeços (Casal do Burço),39.04,-9.01139000044929,Desconhecida,151.0,2017-04-11T17:00,25.4,39,10.3,23.1,0.0,0.0,0.0,0.0,0,1019.2,1001.8,0,0,0,0,0.39,1.98,16.3,20.2,288,289,26.3,26.2,19.3,15.4,13.1,0.123,0.25,0.294,0.267,1,3600.0,391.3,319.6,71.7,781.1,391.3,557.5,475.0,388.0,87.0,781.1,475.0,676.8,Olea europaea L.; Tracheophyta; Magnoliopsida; Vitis vinifera L.
2017,2017-04-11,Lisboa,Lourinhã,Lourinhã,Zambujeira (Rio do Toxofal),39.2676960000065,-9.319632999897,Desconhecida,9.0,2017-04-11T16:00,22.3,52,12.0,21.7,0.0,0.0,0.0,0.0,0,1019.6,1018.5,0,0,0,0,0.42,1.28,12.1,15.9,307,321,27.7,26.7,19.5,15.9,13.8,0.087,0.182,0.247,0.247,1,3600.0,586.1,497.0,89.1,854.8,586.1,792.3,658.0,558.0,100.0,854.8,658.0,889.4,Tracheophyta; Acacia Mill.
2017,2017-04-12,Lisboa,Torres Vedras,Freiria,Poços (Ribeira dos Poços),39.0308750004239,-9.31334799978468,Desconhecida,48.0,2017-04-12T21:00,14.6,97,14.2,14.9,0.0,0.0,0.0,0.0,0,1019.3,1013.5,7,5,0,9,0.0,0.04,6.9,15.1,9,3,14.0,18.5,19.9,16.2,13.8,0.155,0.267,0.333,0.3,0,0.0,0.0,0.0,0.0,0.0,0.0,0.0,0.0,0.0,0.0,0.0,0.0,0.0,Vitis vinifera L.; Magnoliopsida; Tracheophyta; Eucalyptus L'Hér.; 
2017,2017-04-12,Lisboa,Sobral de Monte Agraço,Santo Quintino,Vermões (Vermães),38.9944209999508,-9.16846600002713,Desconhecida,224.0,2017-04-12T21:00,14.1,89,12.3,12.5,0.0,0.0,0.0,0.0,0,1018.9,992.2,4,2,0,6,0.01,0.18,15.8,26.3,317,324,34.2,19.1,20.3,15.7,13.0,0.11,0.24,0.283,0.236,0,0.0,0.0,0.0,0.0,0.0,0.0,0.0,0.0,0.0,0.0,0.0,0.0,0.0,Magnoliopsida; Tracheophyta; Vitis vinifera L.
2017,2017-04-12,Lisboa,Mafra,São Miguel de Alcainça,Casal Moinho (Alto das Comeras),38.9266700002882,-9.27777999983893,Desconhecida,230.0,2017-04-12T12:00,26.1,32,8.3,27.0,0.0,0.0,0.0,0.0,0,1019.2,992.8,0,0,0,0,0.6,2.28,4.5,5.2,151,155,13.7,23.8,17.3,15.3,12.9,0.156,0.267,0.333,0.306,1,3600.0,894.1,778.8,115.4,910.6,894.1,1164.8,868.0,756.0,112.0,910.6,868.0,1130.7,Tracheophyta; Eucalyptus L'Hér.; Pinus pinaster Aiton
2017,2017-04-13,Lisboa,Sintra,Colares,Atalaia (Moinho da Atalaia),38.7782879998949,-9.47756900045607,Desconhecida,224.0,2017-04-13T07:00,12.4,96,11.8,11.2,0.0,0.0,0.0,0.0,2,1019.4,992.5,73,75,0,17,0.01,0.05,11.6,17.6,324,325,22.7,14.5,16.3,15.3,13.0,0.241,0.291,0.353,0.339,1,440.63,80.9,24.0,56.8,138.2,52.2,236.8,37.0,11.0,26.0,89.2,37.0,108.4,Tracheophyta; Magnoliopsida; Pinus pinaster Aiton; Pinales; Pinus pinea L.; Eucalyptus L'Hér.; Vitis vinifera L.; Acacia Mill.; 
2017,2017-04-13,Lisboa,Cadaval,Vilar,Rua Valeverde (COSTA),39.1889469999737,-9.10363099998898,Desconhecida,103.0,2017-04-13T16:00,17.3,67,11.1,15.7,0.0,0.0,0.0,0.0,1,1020.2,1007.9,40,19,0,77,0.33,0.65,17.0,21.6,302,303,34.2,23.3,18.9,16.0,13.3,0.129,0.253,0.318,0.312,1,3600.0,572.1,465.2,106.9,793.8,572.1,797.6,642.0,522.0,120.0,793.8,642.0,895.0,Magnoliopsida; Eucalyptus L'Hér.; Vitis vinifera L.; Tracheophyta; Olea europaea L.; 
2017,2017-04-13,Lisboa,Torres Vedras,A Dos Cunhados,Casal do Alem (Casal de Além),39.1641700002882,-9.32917000028822,Desconhecida,49.0,2017-04-13T16:00,16.7,73,11.8,15.4,0.0,0.0,0.0,0.0,3,1020.4,1014.5,82,64,0,80,0.31,0.52,15.8,19.6,305,306,32.4,21.6,18.0,15.9,13.7,0.179,0.275,0.346,0.321,1,3600.0,559.0,427.1,132.0,727.2,559.0,799.3,627.0,479.0,148.0,727.2,627.0,896.5,Eucalyptus L'Hér.; Tracheophyta; Vitis vinifera L.; Magnoliopsida; Pinus pinea L.; 
2017,2017-04-14,Lisboa,Sintra,Sintra (São Pedro de Penaferrim),Cruz Alta,38.7822189998627,-9.39122499995761,Desconhecida,507.0,2017-04-14T10:00,15.5,64,8.7,13.3,0.0,0.0,0.0,0.0,0,1022.2,963.0,10,11,0,0,0.29,0.64,13.2,16.8,325,329,32.0,14.7,13.4,13.5,11.2,0.242,0.29,0.351,0.339,1,3600.0,623.8,453.7,170.1,649.7,623.8,949.9,561.0,408.0,153.0,649.7,561.0,854.3,Pinales; Magnoliopsida; Pinus pinaster Aiton
2017,2017-04-15,Lisboa,Torres Vedras,Freiria,Estrada da Freiria para Picanceira (FREIRIA),39.0231890000237,-9.31725799997648,Desconhecida,84.0,2017-04-15T23:00,12.7,91,11.3,11.7,0.0,0.0,0.0,0.0,1,1020.9,1010.7,31,1,0,100,0.0,0.13,10.1,20.9,354,1,20.2,15.7,18.2,16.4,13.8,0.157,0.259,0.33,0.3,0,0.0,0.0,0.0,0.0,0.0,0.0,0.0,0.0,0.0,0.0,0.0,0.0,0.0,Vitis vinifera L.; Magnoliopsida; Tracheophyta; Eucalyptus L'Hér.; 
2017,2017-04-16,Lisboa,Alenquer,Alenquer (Triana),Cheganças (Ribeira do Camarnal),39.0677799999714,-8.99138999991947,Desconhecida,28.0,2017-04-16T20:00,15.1,82,12.1,13.3,0.0,0.0,0.0,0.0,0,1019.0,1015.6,0,0,0,0,0.04,0.3,16.3,26.4,319,322,29.9,20.6,20.7,17.3,14.3,0.109,0.229,0.288,0.267,0,0.0,0.0,0.0,0.0,0.0,0.0,0.0,1.0,0.0,1.0,0.0,1.0,12.5,Magnoliopsida; Eucalyptus L'Hér.; Vitis vinifera L.; Tracheophyta
2017,2017-04-17,Lisboa,Torres Vedras,Torres Vedras (Santa Maria do Castelo e São Miguel),Ribeira de Pedrulhos,39.0816459994846,-9.30617600017124,Desconhecida,17.0,2017-04-17T23:00,17.5,50,6.9,13.6,0.0,0.0,0.0,0.0,1,1015.8,1013.8,30,0,20,60,0.12,1.01,21.1,38.3,67,63,39.6,17.2,18.8,16.7,14.4,0.178,0.273,0.352,0.353,0,0.0,0.0,0.0,0.0,0.0,0.0,0.0,0.0,0.0,0.0,0.0,0.0,0.0,Magnoliopsida; Vitis vinifera L.; Tracheophyta
2017,2017-04-17,Lisboa,Sintra,São João das Lampas,Arneiro dos Marinheiros,38.8581299999025,-9.41243199984233,Desconhecida,159.0,2017-04-17T18:00,18.0,66,11.6,16.0,0.0,0.0,0.0,0.0,1,1017.2,998.4,42,0,21,99,0.16,0.69,16.9,25.9,2,2,35.3,20.9,18.5,15.8,13.5,0.197,0.272,0.349,0.354,1,3600.0,172.2,91.1,81.1,380.8,172.2,324.8,242.0,128.0,114.0,380.8,242.0,456.4,Tracheophyta; Magnoliopsida; Pinus pinaster Aiton; Pinus pinea L.; Vitis vinifera L.; Pinales; Olea europaea L.; 
2017,2017-04-17,Lisboa,Azambuja,Maçussa,Maçussa (Ribeira da Maçussa),39.2002800000045,-8.8672199999955,Desconhecida,51.0,2017-04-17T15:00,27.0,41,12.6,27.3,0.0,0.0,0.0,0.0,0,1016.5,1010.6,1,0,0,3,0.58,2.1,12.7,14.8,317,317,26.3,29.7,20.3,17.4,14.0,0.103,0.213,0.27,0.271,1,3600.0,742.6,644.6,98.1,881.0,742.6,993.5,795.0,690.0,105.0,881.0,795.0,1063.5,Magnoliopsida; Vitis vinifera L.; Tracheophyta; Pinus pinea L.; Eucalyptus L'Hér.
2017,2017-04-18,Lisboa,Mafra,Carvoeira,Senhora do Ó (ER247 (ER247) Km 56),38.9399650001526,-9.39124200026194,Desconhecida,25.0,2017-04-18T19:00,23.4,45,10.8,20.6,0.0,0.0,0.0,0.0,0,1009.6,1006.7,5,0,8,0,0.19,1.58,20.4,38.5,64,66,36.4,22.8,20.5,17.3,14.6,0.136,0.26,0.347,0.348,1,3066.33,29.3,18.4,10.9,211.3,26.5,58.5,97.0,61.0,36.0,386.9,97.0,193.9,Vitis vinifera L.; Magnoliopsida; Eucalyptus L'Hér.; Tracheophyta; Pinus pinea L.; ; Pinus pinaster Aiton
2017,2017-04-19,Lisboa,Alenquer,Carregado,Carambancha,39.0328009997474,-8.99002500004238,Desconhecida,36.0,2017-04-19T17:00,23.1,58,14.5,21.7,0.0,0.0,0.0,0.0,0,1008.4,1004.2,11,0,0,37,0.33,1.18,19.5,25.5,196,196,40.3,27.1,21.6,17.8,14.4,0.112,0.222,0.286,0.267,1,3600.0,385.2,308.6,76.5,715.4,385.2,585.1,463.0,371.0,92.0,715.4,463.0,703.4,Tracheophyta; Magnoliopsida; Vitis vinifera L.
2017,2017-04-19,Lisboa,Alenquer,Alenquer (Santo Estêvão),Cabeços (Pipalete),39.045033999549,-9.03983999994066,Desconhecida,222.0,2017-04-19T13:00,24.4,39,9.7,23.7,0.0,0.0,0.0,0.0,0,1008.8,983.5,0,0,0,0,0.63,1.85,17.6,21.3,152,152,34.2,25.4,18.8,16.6,13.3,0.127,0.232,0.303,0.282,1,3600.0,924.0,808.2,115.7,917.4,924.0,1195.1,926.0,810.0,116.0,917.4,926.0,1197.7,Magnoliopsida; Vitis vinifera L.; Tracheophyta; Olea europaea L.
2017,2017-04-20,Lisboa,Alenquer,Alenquer (Santo Estêvão),casal do bruxo (Casais do Bruxo),39.0468199994829,-9.01964000013139,Desconhecida,192.0,2017-04-20T07:00,14.5,82,11.4,12.8,0.0,0.0,0.0,0.0,0,1012.2,989.4,17,0,0,56,0.04,0.3,14.8,25.6,93,93,25.2,15.6,18.4,17.0,13.4,0.112,0.221,0.286,0.267,1,2479.71,131.2,72.2,58.9,344.6,102.5,284.2,69.0,38.0,31.0,269.2,69.0,149.5,Tracheophyta; Olea europaea L.; Vitis vinifera L.; Magnoliopsida
2017,2017-04-20,Lisboa,Alenquer,Alenquer (Santo Estêvão),quinta de santa teresa,39.0430099995931,-8.99602700021532,Desconhecida,33.0,2017-04-20T03:00,15.1,97,14.6,14.7,0.0,0.0,0.0,0.0,1,1010.8,1006.9,24,3,0,72,0.0,0.06,13.2,25.1,107,119,22.7,17.8,20.5,18.0,14.5,0.112,0.221,0.286,0.267,0,0.0,0.0,0.0,0.0,0.0,0.0,0.0,0.0,0.0,0.0,0.0,0.0,0.0,Magnoliopsida; Tracheophyta; Vitis vinifera L.; Olea europaea L.
2017,2017-04-20,Lisboa,Arruda Dos Vinhos,Arranhó,A do Baço (Casal do Penedo do Mocho),38.9789280001322,-9.16802999999788,Desconhecida,305.0,2017-04-20T13:00,23.3,40,8.8,21.2,0.0,0.0,0.0,0.0,1,1011.5,976.7,25,1,0,81,0.58,1.73,22.5,29.0,122,122,47.9,22.3,17.6,15.8,12.8,0.156,0.245,0.318,0.295,1,3600.0,863.2,628.7,234.5,710.9,863.2,1199.0,865.0,630.0,235.0,710.9,865.0,1201.5,Eucalyptus L'Hér.; Tracheophyta; Magnoliopsida
2017,2017-04-21,Lisboa,Cascais,São Domingos de Rana,Rua Ondina Pereira (Bairro Alentejano),38.6971409999,-9.34989599969652,Desconhecida,70.0,2017-04-21T11:00,20.8,38,5.8,18.0,0.0,0.0,0.0,0.0,1,1017.4,1009.2,27,0,0,90,0.49,1.53,18.9,25.5,111,109,46.1,20.6,18.5,17.6,14.9,0.207,0.261,0.325,0.28,1,3600.0,800.8,631.9,168.9,763.8,800.8,1121.1,754.0,595.0,159.0,763.8,754.0,1055.6,Tracheophyta; Pinus pinaster Aiton
2017,2017-04-21,Lisboa,Azambuja,Vila Nova de São Pedro,Torre Penalva (Torre de Penalva),39.2138070000543,-8.83779000017378,Desconhecida,92.0,2017-04-21T12:00,20.6,38,5.8,18.3,0.0,0.0,0.0,0.0,1,1018.8,1008.0,31,0,7,90,0.54,1.51,19.9,26.1,110,110,42.5,22.7,19.1,17.4,13.7,0.137,0.219,0.27,0.256,1,3600.0,898.5,753.7,144.8,855.2,898.5,1194.2,875.0,734.0,141.0,855.2,875.0,1162.9,Tracheophyta; Magnoliopsida
2017,2017-04-22,Lisboa,Mafra,Sobral da Abelheira,Sobral da Abelheira,38.9954590002696,-9.3333610000006,Desconhecida,103.0,2017-04-22T23:00,14.6,91,13.1,14.1,0.0,0.0,0.0,0.0,1,1018.8,1006.4,38,0,58,9,0.0,0.15,10.1,19.2,6,5,20.2,17.6,20.0,17.4,14.3,0.127,0.251,0.339,0.34,0,0.0,0.0,0.0,0.0,0.0,0.0,0.0,0.0,0.0,0.0,0.0,0.0,0.0,Eucalyptus L'Hér.; Magnoliopsida; Pinus pinaster Aiton; Vitis vinifera L.; Tracheophyta
2017,2017-04-22,Lisboa,Loures,Lousa,Casais Monte Gordo (Freixeira),38.9065569999483,-9.22252099990845,Desconhecida,189.0,2017-04-22T22:00,14.3,80,10.9,12.3,0.0,0.0,0.0,0.0,1,1019.3,996.7,25,0,39,4,0.02,0.33,16.0,28.3,337,342,29.2,17.8,19.7,17.1,13.9,0.13,0.237,0.32,0.305,0,0.0,0.0,0.0,0.0,0.0,0.0,0.0,0.0,0.0,0.0,0.0,0.0,0.0,Tracheophyta; Magnoliopsida; Pinus pinaster Aiton; Eucalyptus L'Hér.; Pinales; 
2017,2017-01-16,Lisboa,Sintra,Almargem do Bispo,OLELAS,38.8408300002416,-9.28443999999099,Desconhecida,235.0,2017-01-16T22:00,6.9,77,3.1,3.7,0.0,0.0,0.0,0.0,0,1026.3,997.4,0,0,0,0,0.01,0.23,11.2,25.1,33,29,21.2,7.9,9.7,11.4,14.4,0.317,0.339,0.357,0.332,0,0.0,0.0,0.0,0.0,0.0,0.0,0.0,0.0,0.0,0.0,0.0,0.0,0.0,Tracheophyta; Magnoliopsida; Pinus pinaster Aiton; Eucalyptus L'Hér.; Vitis vinifera L.; 
2017,2017-04-23,Lisboa,Alenquer,Alenquer (Triana),Alenquer (Triana),39.05424200005,-9.00791800022125,Desconhecida,27.0,2017-04-23T04:00,15.7,65,9.1,14.1,0.0,0.0,0.0,0.0,2,1016.5,1013.3,55,4,85,0,0.03,0.62,9.0,18.8,344,357,18.4,17.6,20.3,18.6,14.8,0.107,0.216,0.284,0.267,0,0.0,0.0,0.0,0.0,0.0,0.0,0.0,0.0,0.0,0.0,0.0,0.0,0.0,Magnoliopsida; Tracheophyta
2017,2017-04-23,Lisboa,Cascais,São Domingos de Rana,Rua Garcia Resende (Bairro do Cabeço de Mouro),38.7200689999262,-9.33090000046624,Desconhecida,102.0,2017-04-23T18:00,18.4,63,11.2,16.7,0.0,0.0,0.0,0.0,0,1015.0,1003.0,8,0,7,13,0.19,0.79,14.4,19.7,302,308,31.3,22.5,20.5,17.6,14.8,0.198,0.254,0.32,0.28,1,3600.0,213.4,161.1,52.3,630.4,213.4,345.9,294.0,222.0,72.0,630.4,294.0,476.6,Tracheophyta; Magnoliopsida
2017,2017-04-23,Lisboa,Mafra,Cheleiros,Carvalhal (Saião),38.9,-9.34360999955071,Desconhecida,128.0,2017-04-23T13:00,19.9,67,13.5,20.5,0.0,0.0,0.0,0.0,0,1016.1,1001.1,9,3,10,1,0.5,0.77,17.1,20.3,305,307,34.2,25.8,19.4,17.4,14.2,0.113,0.248,0.339,0.347,1,3600.0,920.1,802.3,117.8,898.6,920.1,1208.5,922.0,804.0,118.0,898.6,922.0,1211.0,Magnoliopsida; Tracheophyta
2017,2017-04-24,Lisboa,Amadora,Falagueira,Estrada dos salgados (Praça de São Silvestre),38.7588900004493,-9.21358999994066,Desconhecida,87.0,2017-04-24T18:00,19.2,59,11.0,17.2,0.0,0.0,0.0,0.0,0,1012.8,1002.6,1,0,1,0,0.2,0.91,15.7,23.0,323,328,33.1,23.2,20.6,17.8,14.7,0.173,0.238,0.308,0.315,1,3600.0,218.2,165.1,53.1,642.3,218.2,347.7,300.0,227.0,73.0,642.3,300.0,478.1,Tracheophyta; 
2017,2017-04-25,Lisboa,Torres Vedras,Ponte do Rol,Ribeira de Pedrulhos (Benfica),39.0858439999157,-9.31079799969991,Desconhecida,15.0,2017-04-25T19:00,15.2,77,11.2,12.5,0.1,0.1,0.0,0.0,51,1012.8,1011.0,79,37,28,96,0.07,0.4,20.8,27.4,334,335,34.9,18.5,18.9,17.7,14.9,0.154,0.254,0.338,0.352,1,0.0,22.7,1.2,21.5,13.7,22.3,88.5,57.0,3.0,54.0,17.9,57.0,221.9,Eucalyptus L'Hér.; Magnoliopsida; Vitis vinifera L.; Tracheophyta; 
2017,2017-04-25,Lisboa,Alenquer,Alenquer (Triana),Cheganças (Ribeira do Camarnal),39.0687270000246,-8.98789699978299,Desconhecida,25.0,2017-04-25T17:00,17.5,61,9.9,14.5,0.0,0.0,0.0,0.0,2,1012.5,1009.5,77,52,0,100,0.23,0.79,20.6,26.2,314,314,43.9,24.1,21.2,18.9,15.0,0.094,0.21,0.281,0.266,1,3600.0,302.3,104.7,197.7,234.1,302.3,604.5,361.0,125.0,236.0,234.1,361.0,721.8,Magnoliopsida; Eucalyptus L'Hér.; Vitis vinifera L.; Tracheophyta
2017,2017-04-26,Lisboa,Alenquer,Alenquer (Triana),Bemposta,39.0581950002246,-8.96607099956936,Desconhecida,24.0,2017-04-26T04:00,12.5,91,11.1,10.9,0.0,0.0,0.0,0.0,1,1011.4,1008.5,48,22,0,95,0.0,0.13,13.5,24.6,314,321,23.4,15.2,19.4,18.9,15.1,0.096,0.21,0.281,0.266,0,0.0,0.0,0.0,0.0,0.0,0.0,0.0,0.0,0.0,0.0,0.0,0.0,0.0,Vitis vinifera L.; Magnoliopsida; Eucalyptus L'Hér.; Tracheophyta
2017,2017-04-26,Lisboa,Alenquer,Cadafais,Preçes (Quinta das Pressas),39.0201840000682,-9.01077100012037,Desconhecida,130.0,2017-04-26T01:00,12.1,87,10.0,10.2,0.0,0.0,0.0,0.0,0,1012.5,996.9,4,3,0,6,0.01,0.18,13.5,25.2,312,317,23.4,15.4,19.5,18.3,14.3,0.096,0.21,0.281,0.266,0,0.0,0.0,0.0,0.0,0.0,0.0,0.0,0.0,0.0,0.0,0.0,0.0,0.0,Magnoliopsida; Olea europaea L.; Vitis vinifera L.; Tracheophyta; Pinus pinaster Aiton
2017,2017-04-26,Lisboa,Mafra,Malveira,Estrada da Abrunheira (Abrunheira),38.9384599998262,-9.27721400048998,Desconhecida,247.0,2017-04-26T16:00,13.5,52,3.9,9.2,0.0,0.0,0.0,0.0,3,1011.6,982.3,90,0,100,100,0.23,0.74,19.4,25.5,329,329,40.7,19.5,17.3,16.9,13.8,0.127,0.231,0.315,0.305,1,1924.55,316.6,77.1,239.5,124.2,316.6,839.5,353.0,86.0,267.0,124.2,353.0,936.0,Eucalyptus L'Hér.; Tracheophyta; Magnoliopsida; Pinus pinaster Aiton
2017,2017-04-27,Lisboa,Sintra,Colares,Rua dos Banagazes (Canejo),38.8355739998817,-9.45419899993473,Desconhecida,60.0,2017-04-27T10:00,16.1,43,3.3,13.6,0.0,0.0,0.0,0.0,0,1012.4,1005.3,9,0,0,31,0.38,1.05,11.9,15.9,35,39,29.2,16.6,15.4,17.1,14.8,0.18,0.252,0.332,0.353,1,3600.0,763.4,647.7,115.7,874.5,763.4,1000.4,693.0,588.0,105.0,874.5,693.0,908.2,Tracheophyta; Magnoliopsida; Pinus pinaster Aiton; Pinales; Pinus pinea L.; Eucalyptus L'Hér.; Vitis vinifera L.; Acacia Mill.; 
2017,2017-04-27,Lisboa,Torres Vedras,Ventosa,Montengrão,39.0644400003221,-9.29972000016106,Desconhecida,48.0,2017-04-27T22:00,13.6,61,6.1,10.3,0.0,0.0,0.0,0.0,1,1010.6,1004.8,30,0,0,99,0.06,0.61,15.6,30.2,29,33,32.0,16.2,18.4,17.5,14.9,0.12,0.229,0.313,0.299,0,0.0,0.0,0.0,0.0,0.0,0.0,0.0,0.0,0.0,0.0,0.0,0.0,0.0,Vitis vinifera L.; Eucalyptus L'Hér.; Tracheophyta; Magnoliopsida; 
2017,2017-04-27,Lisboa,Arruda Dos Vinhos,Arranhó,A do Baço (Casal do Penedo do Mocho),38.9738899999195,-9.17,Desconhecida,309.0,2017-04-27T19:00,12.6,56,4.1,7.7,0.0,0.0,0.0,0.0,1,1009.8,973.3,29,0,0,98,0.12,0.64,24.1,39.8,3,6,48.6,17.5,16.8,15.8,13.3,0.133,0.228,0.308,0.295,1,2754.69,40.1,10.8,29.4,123.4,39.7,93.8,97.0,26.0,71.0,153.3,97.0,226.8,Tracheophyta; Magnoliopsida; Eucalyptus L'Hér.
2017,2017-04-27,Lisboa,Alenquer,Pereiro de Palhacana,Pereiro de Palhacana (PEREIRO DA PALHACANA),39.0438140000237,-9.11004199981689,Desconhecida,217.0,2017-04-27T18:00,16.7,45,4.8,12.3,0.0,0.0,0.0,0.0,1,1009.6,984.2,30,0,0,100,0.23,1.04,21.7,28.4,355,359,36.7,22.1,18.5,17.2,14.0,0.1,0.214,0.293,0.281,1,3600.0,224.8,152.1,72.7,574.2,224.8,357.6,306.0,207.0,99.0,574.2,306.0,486.9,Magnoliopsida; Vitis vinifera L.; Tracheophyta
2017,2017-04-27,Lisboa,Oeiras,Barcarena,Avenida Infante D Henrique (Tercena),38.7470649994744,-9.28406599998474,Desconhecida,100.0,2017-04-27T18:00,16.7,44,4.3,12.3,0.0,0.0,0.0,0.0,1,1009.4,997.6,30,0,0,100,0.22,1.07,21.1,32.1,351,356,44.3,19.4,17.4,16.8,14.7,0.197,0.255,0.327,0.337,1,3600.0,175.8,53.0,122.8,198.4,175.8,360.4,239.0,72.0,167.0,198.4,239.0,490.1,Tracheophyta; Magnoliopsida; Pinus pinea L.; Vitis vinifera L.; Eucalyptus L'Hér.; Olea europaea L.; Pinus pinaster Aiton
2017,2017-04-27,Lisboa,Alenquer,Pereiro de Palhacana,Bonvizinho,39.0373969999949,-9.10154800004429,Desconhecida,219.0,2017-04-27T16:00,19.2,28,0.2,15.2,0.0,0.0,0.0,0.0,1,1009.5,984.1,24,0,0,80,0.45,1.6,17.9,22.2,22,25,34.6,24.2,17.8,17.2,14.0,0.101,0.214,0.293,0.281,1,3600.0,617.2,488.0,129.2,784.4,617.2,840.2,688.0,544.0,144.0,784.4,688.0,936.6,Magnoliopsida; Tracheophyta; Vitis vinifera L.
2017,2017-04-27,Lisboa,Torres Vedras,Matacães,MATACÃES (Moinho Inácio),39.0944019995795,-9.20674800025092,Desconhecida,191.0,2017-04-27T14:00,19.3,28,0.3,17.1,0.0,0.0,0.0,0.0,1,1010.9,988.6,30,0,0,99,0.57,1.61,14.8,18.4,49,50,35.3,23.9,17.1,17.2,14.1,0.106,0.214,0.295,0.297,1,3600.0,897.7,751.5,146.2,880.7,897.7,1152.5,927.0,776.0,151.0,880.7,927.0,1190.1,Tracheophyta; Vitis vinifera L.; Eucalyptus L'Hér.; Magnoliopsida; Pinus pinaster Aiton; Olea europaea L.; 
2017,2017-04-27,Lisboa,Alenquer,Alenquer (Santo Estêvão),Pedra do Ouro (Ribeira Nova),39.0325,-9.03472000002861,Desconhecida,152.0,2017-04-27T14:00,19.5,28,0.3,17.0,0.0,0.0,0.0,0.0,0,1010.8,993.1,18,0,1,58,0.58,1.65,17.1,20.9,48,48,37.1,24.1,17.6,17.7,14.3,0.099,0.208,0.28,0.266,1,3600.0,908.1,783.2,124.9,918.0,908.1,1152.2,938.0,809.0,129.0,918.0,938.0,1190.2,Magnoliopsida; Olea europaea L.; Tracheophyta; Vitis vinifera L.
2017,2017-04-28,Lisboa,Alenquer,Carnota,Pedra do Ouro (Quinta da Borjana),39.0350910000006,-9.04433199988471,Desconhecida,163.0,2017-04-28T11:00,17.8,37,2.9,13.5,0.0,0.0,0.0,0.0,1,1010.8,991.7,33,24,18,3,0.43,1.28,22.4,28.6,84,84,45.4,19.5,16.8,17.5,14.3,0.1,0.207,0.279,0.266,1,3600.0,720.8,496.4,224.4,586.7,720.8,1142.3,681.0,469.0,212.0,586.7,681.0,1079.2,Magnoliopsida; Tracheophyta; Vitis vinifera L.
2017,2017-04-28,Lisboa,Alenquer,Olhalvo,OLHALVO (RELVA),39.0996979999542,-9.07521900018056,NC,124.0,2017-04-28T11:00,18.0,36,2.6,13.6,0.0,0.0,0.0,0.0,1,1010.9,996.3,35,24,22,0,0.45,1.32,24.3,30.4,84,85,48.6,19.9,17.1,17.9,14.7,0.102,0.203,0.275,0.272,1,3600.0,772.7,581.1,191.6,687.2,772.7,1141.6,730.0,549.0,181.0,687.2,730.0,1078.5,Tracheophyta; Vitis vinifera L.
2017,2017-04-28,Lisboa,Alenquer,Olhalvo,EN9 KM 87.1 (Quinta da Margem da Arada),39.0903619999356,-9.07677499983046,Desconhecida,78.0,2017-04-28T10:00,17.3,34,1.3,11.9,0.0,0.0,0.0,0.0,1,1011.1,1001.9,30,17,12,25,0.41,1.3,26.9,34.1,82,83,49.3,18.5,17.2,18.2,15.0,0.103,0.203,0.275,0.272,1,3600.0,721.4,586.1,135.3,787.0,721.4,1005.4,656.0,533.0,123.0,787.0,656.0,914.3,Tracheophyta; Vitis vinifera L.; Magnoliopsida; Pinales
2017,2017-04-28,Lisboa,Alenquer,Carnota,Santana da Carnota (Quinta da Pratra),39.0366160000695,-9.07900000042386,Desconhecida,210.0,2017-04-28T22:00,13.4,72,8.5,11.0,0.0,0.0,0.0,0.0,0,1011.9,986.9,16,6,17,0,0.03,0.42,14.1,23.6,93,98,28.4,17.1,18.6,17.1,14.2,0.092,0.209,0.289,0.281,0,0.0,0.0,0.0,0.0,0.0,0.0,0.0,0.0,0.0,0.0,0.0,0.0,0.0,Tracheophyta; Magnoliopsida; Vitis vinifera L.; Eucalyptus L'Hér.; Olea europaea L.
2017,2017-04-28,Lisboa,Alenquer,Alenquer (Triana),fiandal (Vale de Figueira),39.0681290000015,-9.03034799999661,Desconhecida,61.0,2017-04-28T22:00,14.4,71,9.3,12.7,0.0,0.0,0.0,0.0,0,1011.9,1004.6,8,4,7,0,0.02,0.47,10.1,18.4,88,94,21.6,18.0,19.7,18.2,15.0,0.092,0.205,0.277,0.266,0,0.0,0.0,0.0,0.0,0.0,0.0,0.0,0.0,0.0,0.0,0.0,0.0,0.0,Magnoliopsida; Tracheophyta; Vitis vinifera L.
2017,2017-04-28,Lisboa,Torres Vedras,Carvoeira,EN9 (Casal de São José),39.0725879997677,-9.19040799988641,Desconhecida,77.0,2017-04-28T21:00,14.8,68,9.0,12.7,0.0,0.0,0.0,0.0,0,1011.6,1002.4,11,2,16,0,0.04,0.53,12.6,22.1,93,96,34.2,19.0,19.7,18.1,14.9,0.092,0.205,0.277,0.266,0,0.0,0.0,0.0,0.0,0.0,0.0,0.0,0.0,0.0,0.0,0.0,0.0,0.0,Vitis vinifera L.; Magnoliopsida; Eucalyptus L'Hér.; Tracheophyta; Pinus pinea L.; 
2017,2017-04-28,Lisboa,Sintra,Colares,Rua dos Banagases (Vila Leitão),38.8354739999771,-9.45532700008816,Desconhecida,57.0,2017-04-28T20:00,16.2,61,8.7,14.9,0.0,0.0,0.0,0.0,1,1010.4,1003.6,49,29,38,0,0.05,0.72,6.5,12.0,360,46,14.0,18.3,18.2,16.9,14.9,0.162,0.246,0.327,0.352,0,0.0,0.0,0.0,0.0,0.0,0.0,0.0,5.0,1.0,4.0,13.7,5.0,39.4,Tracheophyta; Magnoliopsida; Pinus pinaster Aiton; Pinales; Pinus pinea L.; Eucalyptus L'Hér.; Vitis vinifera L.; Acacia Mill.; 
2017,2017-04-28,Lisboa,Alenquer,Abrigada,Bairro (BAIRRO SEGUNDO),39.1136690002018,-9.01644099977281,Desconhecida,165.0,2017-04-28T19:00,18.5,48,7.3,16.2,0.0,0.0,0.0,0.0,1,1009.5,990.2,28,1,45,0,0.11,1.1,11.4,17.0,79,86,20.9,21.1,19.2,17.6,14.4,0.092,0.2,0.273,0.272,1,3554.77,37.5,16.7,20.9,191.4,37.3,94.8,90.0,40.0,50.0,235.9,90.0,227.2,Magnoliopsida; Vitis vinifera L.; Olea europaea L.; Tracheophyta; Pinus pinaster Aiton; Eucalyptus L'Hér.
2017,2017-04-28,Lisboa,Alenquer,Meca,Bugarreos (Casal da Preza),39.0965219995711,-9.02085000011656,Desconhecida,194.0,2017-04-28T18:00,19.6,40,5.8,16.9,0.0,0.0,0.0,0.0,1,1009.3,986.8,25,2,39,0,0.19,1.36,11.5,14.4,86,90,27.4,22.1,19.0,17.4,14.3,0.092,0.2,0.273,0.272,1,3600.0,142.0,86.1,55.9,323.4,142.0,359.4,193.0,117.0,76.0,323.4,193.0,488.3,Tracheophyta; Magnoliopsida; Pinus pinaster Aiton; Pinus pinea L.
2017,2017-04-28,Lisboa,Alenquer,Alenquer (Triana),EN-1 (Quinta das Sete Pedras),39.0463110001882,-8.99018799993727,Desconhecida,15.0,2017-04-28T17:00,21.3,40,7.0,17.9,0.0,0.0,0.0,0.0,0,1009.4,1007.6,18,0,30,0,0.27,1.53,18.1,23.5,96,96,33.5,24.0,19.8,18.5,15.3,0.092,0.205,0.277,0.266,1,3600.0,210.1,97.5,112.6,214.3,210.1,613.8,250.0,116.0,134.0,214.3,250.0,730.5,Vitis vinifera L.; Tracheophyta; Magnoliopsida
2017,2017-04-29,Lisboa,Amadora,Brandoa,encosta da brandoa (Rua Machado de Castro),38.7723740000195,-9.21932399988174,Desconhecida,121.0,2017-04-29T20:00,13.0,59,5.2,9.8,0.0,0.0,0.0,0.0,3,1014.1,999.6,84,93,0,0,0.07,0.61,14.1,22.9,276,278,32.4,17.0,17.8,16.9,14.8,0.165,0.229,0.301,0.314,0,0.0,0.0,0.0,0.0,0.0,0.0,0.0,6.0,2.0,4.0,27.3,6.0,40.0,Tracheophyta; Magnoliopsida
2017,2017-04-29,Lisboa,Amadora,São Brás,Mina de Água (Rua São Clemente),38.7774379995134,-9.23690800004535,Desconhecida,228.0,2017-04-29T20:00,12.3,59,4.4,8.8,0.0,0.0,0.0,0.0,3,1014.2,987.0,88,98,0,0,0.07,0.59,14.8,24.3,276,278,34.9,15.7,16.5,15.7,13.9,0.186,0.249,0.322,0.337,0,0.0,0.0,0.0,0.0,0.0,0.0,0.0,6.0,2.0,4.0,27.0,6.0,41.0,Tracheophyta; Magnoliopsida
2017,2017-04-29,Lisboa,Alenquer,Olhalvo,Quinta da Mazarada (RELVA),39.0996979999542,-9.07521900018056,Desconhecida,124.0,2017-04-29T17:00,15.6,50,5.1,11.1,0.0,0.0,0.0,0.0,0,1012.6,997.9,6,0,0,20,0.3,0.89,22.7,28.2,281,281,43.9,23.5,18.9,17.7,14.8,0.092,0.198,0.272,0.272,1,3600.0,440.0,354.2,85.8,774.4,440.0,617.0,523.0,421.0,102.0,774.4,523.0,733.4,Tracheophyta; Vitis vinifera L.
2017,2017-04-29,Lisboa,Alenquer,Ribafria,Palaios,39.0544669999017,-9.09887600051032,Desconhecida,168.0,2017-04-29T16:00,15.5,52,5.6,11.7,0.0,0.0,0.0,0.0,0,1012.6,992.7,15,8,0,26,0.35,0.85,22.7,28.3,288,288,43.9,23.8,18.2,17.2,14.5,0.092,0.208,0.288,0.281,1,3600.0,609.7,484.0,125.7,772.2,609.7,845.6,679.0,539.0,140.0,772.2,679.0,941.7,Vitis vinifera L.; Tracheophyta; Magnoliopsida
