year,date,district,municipality,parish,local,latitude,longitude,cause,elevation,hourly.time,hourly.temperature_2m,hourly.relative_humidity_2m,hourly.dew_point_2m,hourly.apparent_temperature,hourly.precipitation,hourly.rain,hourly.snowfall,hourly.snow_depth,hourly.weather_code,hourly.pressure_msl,hourly.surface_pressure,hourly.cloud_cover,hourly.cloud_cover_low,hourly.cloud_cover_mid,hourly.cloud_cover_high,hourly.et0_fao_evapotranspiration,hourly.vapour_pressure_deficit,hourly.wind_speed_10m,hourly.wind_speed_100m,hourly.wind_direction_10m,hourly.wind_direction_100m,hourly.wind_gusts_10m,hourly.soil_temperature_0_to_7cm,hourly.soil_temperature_7_to_28cm,hourly.soil_temperature_28_to_100cm,hourly.soil_temperature_100_to_255cm,hourly.soil_moisture_0_to_7cm,hourly.soil_moisture_7_to_28cm,hourly.soil_moisture_28_to_100cm,hourly.soil_moisture_100_to_255cm,hourly.is_day,hourly.sunshine_duration,hourly.shortwave_radiation_instant,hourly.direct_radiation_instant,hourly.diffuse_radiation_instant,hourly.direct_normal_irradiance_instant,hourly.global_tilted_irradiance_instant,hourly.terrestrial_radiation_instant,hourly.shortwave_radiation,hourly.direct_radiation,hourly.diffuse_radiation,hourly.direct_normal_irradiance,hourly.global_tilted_irradiance,hourly.terrestrial_radiation,scientificNames
2017,2017-11-19,Lisboa,Sintra,Sintra (São Martinho),Pena (Serra de Sintra) (Quinta do Vale dos Anjos),38.79,-9.39193999979231,NC,388.0,2017-11-19T05:00,9.3,74,4.9,6.8,0.0,0.0,0.0,0.0,0,1019.0,972.5,0,0,0,0,0.01,0.3,8.2,19.4,41,48,15.1,9.4,12.3,14.4,18.2,0.224,0.256,0.234,0.299,0,0.0,0.0,0.0,0.0,0.0,0.0,0.0,0.0,0.0,0.0,0.0,0.0,0.0,Magnoliopsida; Pinales; Pinus pinaster Aiton; Tracheophyta
2017,2017-11-19,Lisboa,Alenquer,Carregado,Carregado (Charnequinha),39.0316700002882,-8.99639000044929,NC,47.0,2017-11-19T17:00,16.6,66,10.3,15.4,0.0,0.0,0.0,0.0,0,1020.3,1014.7,0,0,0,0,0.06,0.64,8.8,13.4,12,31,12.2,17.2,15.0,16.4,21.2,0.146,0.22,0.192,0.243,1,3008.69,31.5,19.7,11.7,226.5,28.4,60.8,94.0,59.0,35.0,410.2,94.0,181.8,Magnoliopsida; Tracheophyta; Vitis vinifera L.
2017,2017-11-19,Lisboa,Arruda Dos Vinhos,Arranhó,A do Baço (Casal do Rossio),38.9663900004493,-9.16222000016107,NC,281.0,2017-11-19T17:00,15.5,65,8.9,14.2,0.0,0.0,0.0,0.0,0,1020.4,987.1,0,0,0,0,0.06,0.62,7.4,13.0,47,44,16.2,16.5,14.0,15.3,19.8,0.126,0.205,0.199,0.221,1,3047.6,33.0,20.7,12.4,237.0,30.0,63.5,96.0,60.0,36.0,414.3,96.0,184.4,Tracheophyta; Magnoliopsida; Pinus pinea L.
2017,2017-11-19,Lisboa,Torres Vedras,Turcifal,Aldeia da Serra (Casal Rosmaninho),39.0163220002916,-9.2357509999805,NC,174.0,2017-11-19T19:00,12.8,74,8.2,11.1,0.0,0.0,0.0,0.0,0,1020.7,999.7,0,0,0,0,0.01,0.39,8.5,15.0,54,48,12.6,13.7,14.4,15.5,19.7,0.135,0.201,0.209,0.267,0,0.0,0.0,0.0,0.0,0.0,0.0,0.0,0.0,0.0,0.0,0.0,0.0,0.0,Tracheophyta; Castanea sativa Mill.; Vitis vinifera L.; Magnoliopsida; Pinales; Eucalyptus L'Hér.; 
2017,2017-11-20,Lisboa,Torres Vedras,São Pedro da Cadeira,EN 247 (Vale da Fonte),39.0740919997957,-9.40073000000583,NC,33.0,2017-11-20T15:00,20.0,52,9.8,19.1,0.0,0.0,0.0,,0,1020.6,1016.7,0,0,0,0,0.24,1.14,6.1,5.5,270,247,13.0,19.1,14.6,16.0,20.0,0.175,0.238,0.243,0.318,1,3600.0,342.9,278.6,64.2,790.2,342.9,494.1,395.0,321.0,74.0,790.2,395.0,569.3,Magnoliopsida; Tracheophyta; Vitis vinifera L.; Eucalyptus L'Hér.; 
2017,2017-11-20,Lisboa,Mafra,Mafra,Zambujal (Rua da Escola),38.9482510005103,-9.37656799952189,NC,112.0,2017-11-20T17:00,15.5,86,13.2,15.8,0.0,0.0,0.0,0.0,0,1021.4,1008.0,0,0,0,0,0.04,0.25,5.2,7.7,326,311,11.2,17.8,15.3,16.0,20.0,0.135,0.211,0.233,0.301,1,3064.66,33.9,21.3,12.6,244.8,31.0,64.8,97.0,61.0,36.0,420.8,97.0,185.3,Magnoliopsida; Tracheophyta; Eucalyptus L'Hér.
2017,2017-11-20,Lisboa,Sintra,Sintra (São Martinho),Rua do moinho (Moinho do Gato),38.8227799998389,-9.39889000044929,NC,125.0,2017-11-20T19:00,12.4,84,9.8,11.3,0.0,0.0,0.0,0.0,0,1021.7,1006.6,0,0,0,0,0.0,0.23,7.2,5.9,360,317,9.0,14.0,15.2,15.8,19.5,0.198,0.247,0.245,0.307,0,0.0,0.0,0.0,0.0,0.0,0.0,0.0,0.0,0.0,0.0,0.0,0.0,0.0,Pinales; Magnoliopsida; Tracheophyta; Pinus pinaster Aiton
2017,2017-11-21,Lisboa,Torres Vedras,Ventosa,Quinta do Infesta de Cima (Casal do Campos),39.059912999471,-9.29188199996948,NC,84.0,2017-11-21T15:00,19.6,63,12.4,17.8,0.0,0.0,0.0,0.0,0,1018.0,1008.1,1,1,0,0,0.24,0.85,17.7,23.1,186,184,32.8,18.7,14.4,16.0,20.1,0.129,0.202,0.211,0.267,1,3600.0,329.4,260.0,69.3,745.0,329.4,489.3,380.0,300.0,80.0,745.0,380.0,564.5,Vitis vinifera L.; Eucalyptus L'Hér.; Tracheophyta; Magnoliopsida; 
2017,2017-04-05,Lisboa,Lourinhã,Lourinhã,Seixal (Rio Grande),39.2603850004408,-9.32993599997626,Desconhecida,3.0,2017-04-05T18:00,20.3,69,14.4,19.8,0.0,0.0,0.0,0.0,0,1017.2,1016.8,6,0,0,19,0.16,0.75,13.3,21.0,13,22,26.3,21.3,18.3,14.6,13.5,0.166,0.215,0.255,0.247,1,3600.0,167.0,115.6,51.4,570.2,167.0,277.2,247.0,171.0,76.0,570.2,247.0,410.0,Tracheophyta; Acacia Mill.; Magnoliopsida
2017,2017-11-21,Lisboa,Mafra,Sobral da Abelheira,Codeçal,38.9669920000103,-9.30651799996694,NC,115.0,2017-11-21T17:00,16.7,85,14.2,15.9,0.0,0.0,0.0,0.0,1,1018.1,1004.4,23,26,0,0,0.05,0.28,14.8,25.0,183,186,35.6,17.5,15.1,16.0,19.9,0.121,0.197,0.218,0.267,1,2995.12,27.6,15.0,12.7,171.9,24.9,60.1,83.0,45.0,38.0,314.4,83.0,180.6,Pinus pinaster Aiton; Eucalyptus L'Hér.; Magnoliopsida; Tracheophyta; Pinales
2017,2017-11-21,Lisboa,Sintra,Agualva,Alto do Colaride (Colaride),38.7675760000282,-9.28462900002797,NC,192.0,2017-11-21T18:00,15.2,98,14.8,15.1,0.0,0.0,0.0,0.0,1,1018.2,995.3,22,25,0,0,0.01,0.04,11.2,22.1,184,192,26.3,15.0,14.0,15.4,19.2,0.211,0.249,0.233,0.299,0,0.0,0.0,0.0,0.0,0.0,0.0,0.0,2.0,0.0,2.0,0.0,2.0,22.0,Tracheophyta; Magnoliopsida; 
2017,2017-11-22,Lisboa,Lourinhã,Moledo,MOLEDO,39.2845390000608,-9.25617499987284,NC,136.0,2017-11-22T14:00,19.4,60,11.4,16.1,0.0,0.0,0.0,0.0,1,1010.9,995.0,46,0,77,0,0.21,0.9,25.2,36.5,170,171,41.8,16.7,14.5,15.4,19.1,0.063,0.132,0.124,0.205,1,1674.34,209.3,51.4,157.9,115.8,209.3,622.4,224.0,55.0,169.0,115.8,224.0,666.0,Magnoliopsida; Eucalyptus L'Hér.; Tracheophyta; Vitis vinifera L.; Pinales; 
2017,2017-11-22,Lisboa,Loures,Fanhões,FANHÕES (Casal da Boca),38.8783820003933,-9.15064500000742,NC,147.0,2017-11-22T15:00,18.8,66,12.3,16.4,0.0,0.0,0.0,0.0,1,1011.7,994.5,39,1,63,0,0.2,0.73,21.6,31.1,184,186,44.3,17.7,15.0,15.6,20.7,0.085,0.179,0.173,0.026,1,3600.0,240.7,127.3,113.4,366.6,240.7,486.9,278.0,147.0,131.0,366.6,278.0,562.3,Magnoliopsida; Tracheophyta; Eucalyptus L'Hér.; 
2017,2017-11-22,Lisboa,Torres Vedras,Dois Portos,Murteira,39.0430340003967,-9.17148599995507,NC,144.0,2017-11-22T16:00,18.4,69,12.7,15.4,0.0,0.0,0.0,0.0,1,1011.1,994.2,41,0,57,24,0.15,0.65,26.1,40.0,174,177,48.2,17.0,14.9,15.9,20.3,0.122,0.207,0.214,0.258,1,3600.0,129.7,64.5,65.2,311.8,129.7,290.1,175.0,87.0,88.0,311.8,175.0,391.3,Vitis vinifera L.; Eucalyptus L'Hér.; Magnoliopsida; Tracheophyta; 
2017,2017-11-22,Lisboa,Sintra,Almargem do Bispo,Olival do Santissimo (Casal do Bretão),38.8141700002882,-9.2416699997584,NC,266.0,2017-11-22T21:00,15.8,83,12.9,14.2,0.1,0.1,0.0,0.0,51,1012.3,981.1,57,0,45,99,0.02,0.31,17.1,31.6,202,201,41.0,15.2,15.2,15.6,19.3,0.137,0.191,0.201,0.264,0,0.0,0.0,0.0,0.0,0.0,0.0,0.0,0.0,0.0,0.0,0.0,0.0,0.0,Tracheophyta; Magnoliopsida; Pinus pinaster Aiton; Eucalyptus L'Hér.; Vitis vinifera L.; 
2017,2017-11-22,Lisboa,Azambuja,Aveiras de Cima,Casais das comeiras (Casais Penedos),39.1358299999767,-8.88443999999099,NC,89.0,2017-11-22T23:00,16.2,83,13.4,15.1,0.0,0.0,0.0,0.0,3,1012.3,1001.7,87,0,96,99,0.02,0.3,14.8,27.3,181,189,33.1,15.4,15.4,16.3,20.8,0.093,0.181,0.176,0.231,0,0.0,0.0,0.0,0.0,0.0,0.0,0.0,0.0,0.0,0.0,0.0,0.0,0.0,Tracheophyta; Olea europaea L.; Vitis vinifera L.; Magnoliopsida; Pinus pinea L.
2017,2017-11-23,Lisboa,Torres Vedras,Dois Portos,Mouguelas,39.0313879998525,-9.16438700040182,NC,166.0,2017-11-23T11:00,17.2,81,14.0,15.7,0.0,0.0,0.0,0.0,3,1014.9,995.3,88,1,95,100,0.11,0.36,18.9,28.2,141,150,32.4,16.0,15.5,15.9,20.0,0.178,0.206,0.214,0.258,1,0.0,180.2,22.0,158.2,47.7,180.2,646.1,164.0,20.0,144.0,47.7,164.0,588.2,Vitis vinifera L.; Eucalyptus L'Hér.; Magnoliopsida; Tracheophyta; 
2017,2017-11-30,Lisboa,Torres Vedras,Dois Portos,Casal Sao Pedro (Dois Portos),39.0428889995151,-9.18765400012334,NC,97.0,2017-11-30T16:00,11.5,58,3.4,7.3,0.0,0.0,0.0,0.0,0,1020.6,1008.8,0,0,0,0,0.14,0.57,18.0,26.3,358,359,33.1,13.3,12.3,16.0,19.9,0.302,0.269,0.215,0.258,1,3600.0,174.4,129.7,44.7,667.8,174.4,273.2,238.0,177.0,61.0,667.8,238.0,372.8,Vitis vinifera L.; Eucalyptus L'Hér.; Magnoliopsida; Tracheophyta; 
2017,2017-11-30,Lisboa,Torres Vedras,Dois Portos,Dois Portos,39.0428889995151,-9.18765400012334,NC,97.0,2017-11-30T23:00,6.4,75,2.3,3.2,0.0,0.0,0.0,0.0,0,1024.5,1012.4,0,0,0,0,0.01,0.24,10.1,25.2,6,14,18.7,8.1,11.7,15.9,19.9,0.299,0.269,0.215,0.258,0,0.0,0.0,0.0,0.0,0.0,0.0,0.0,0.0,0.0,0.0,0.0,0.0,0.0,Vitis vinifera L.; Eucalyptus L'Hér.; Magnoliopsida; Tracheophyta; 
2017,2017-12-01,Lisboa,Vila Franca de Xira,São João Dos Montes,A-dos-Loucos,38.9398160001967,-9.0177360000213,NC,147.0,2017-12-01T09:00,8.1,67,2.4,3.9,0.0,0.0,0.0,0.0,0,1025.1,1007.0,0,0,0,0,0.06,0.35,17.1,29.5,352,359,33.5,7.7,10.0,15.0,20.2,0.265,0.21,0.171,0.026,1,3248.37,164.5,105.0,59.5,483.2,155.5,305.6,105.0,67.0,38.0,456.6,105.0,195.1,Magnoliopsida; Tracheophyta; Pinus pinaster Aiton; Vitis vinifera L.; Olea europaea L.; Eucalyptus L'Hér.; Pinales; 
2017,2017-12-01,Lisboa,Azambuja,Alcoentre,Casais das Boiças (ALCOENTRE),39.2067940002018,-8.9689839998881,NC,135.0,2017-12-01T12:00,12.7,63,5.8,8.5,0.0,0.0,0.0,0.0,2,1024.8,1008.4,53,58,2,0,0.22,0.55,21.7,28.6,353,354,35.6,10.7,9.7,15.1,19.6,0.271,0.228,0.186,0.242,1,3600.0,477.1,392.9,84.2,818.7,477.1,675.2,459.0,378.0,81.0,818.7,459.0,649.5,Vitis vinifera L.; Tracheophyta; Eucalyptus L'Hér.; Magnoliopsida; Olea europaea L.
2017,2017-12-02,Lisboa,Loures,Fanhões,FANHÕES (Casal da Boca),38.8783820003933,-9.15064500000742,NC,147.0,2017-12-02T13:00,10.5,45,-1.0,6.7,0.0,0.0,0.0,0.0,0,1026.7,1008.7,0,0,0,0,0.24,0.71,10.9,14.0,46,46,24.8,11.1,9.9,14.4,20.2,0.245,0.212,0.171,0.026,1,3600.0,491.1,408.1,83.0,853.5,491.1,672.9,497.0,413.0,84.0,853.5,497.0,681.0,Magnoliopsida; Tracheophyta; Eucalyptus L'Hér.; 
2017,2017-04-06,Lisboa,Sintra,São João das Lampas,Assafora,38.9056139998966,-9.40464200019836,Desconhecida,121.0,2017-04-06T16:00,22.3,38,7.4,20.1,0.0,0.0,0.0,0.0,0,1016.7,1002.6,0,0,0,0,0.44,1.66,14.6,18.9,50,55,27.4,22.1,16.8,14.3,13.3,0.235,0.319,0.37,0.348,1,3600.0,579.3,492.2,87.1,864.6,579.3,777.9,652.0,554.0,98.0,864.6,652.0,875.5,Tracheophyta; Magnoliopsida; Pinus pinaster Aiton; Pinus pinea L.; Vitis vinifera L.; Pinales; Olea europaea L.; 
2017,2017-12-03,Lisboa,Mafra,Enxara do Bispo,São Sebastião (Casal das Pucaricas Novas),39.0046039999856,-9.23672299994363,NC,146.0,2017-12-03T12:00,10.4,53,1.1,5.8,0.0,0.0,0.0,0.0,0,1030.1,1012.2,0,0,0,0,0.22,0.6,18.6,24.5,75,76,35.3,9.8,9.2,14.3,18.8,0.253,0.244,0.218,0.267,1,3600.0,480.2,394.8,85.4,826.0,480.2,672.8,461.0,379.0,82.0,826.0,461.0,645.9,Tracheophyta; Eucalyptus L'Hér.; Vitis vinifera L.; Magnoliopsida
2017,2017-04-06,Lisboa,Torres Vedras,Torres Vedras (São Pedro e São Tiago),Fonte Grada,39.1057500002119,-9.301880999936,Desconhecida,22.0,2017-04-06T15:00,23.1,37,7.6,21.6,0.0,0.0,0.0,0.0,0,1017.2,1014.6,0,0,0,0,0.53,1.78,14.8,18.6,67,68,31.0,22.1,16.8,14.7,13.7,0.235,0.309,0.335,0.3,1,3600.0,737.0,636.3,100.8,904.6,737.0,961.1,790.0,682.0,108.0,904.6,790.0,1030.2,Tracheophyta; Vitis vinifera L.; Eucalyptus L'Hér.; Magnoliopsida
2017,2017-12-03,Lisboa,Mafra,Milharado,Vale da Guarda (Casal do Outeiro),38.9557620000839,-9.25788200007545,NC,188.0,2017-12-03T14:00,11.4,48,0.9,7.0,0.0,0.0,0.0,0.0,0,1029.1,1006.2,0,0,0,0,0.23,0.69,16.1,20.9,70,71,34.9,11.3,9.4,14.0,18.5,0.25,0.244,0.218,0.267,1,3600.0,426.4,351.6,74.8,828.8,426.4,597.1,456.0,376.0,80.0,828.8,456.0,638.6,Eucalyptus L'Hér.; Tracheophyta; Pinus pinaster Aiton
2017,2017-12-03,Lisboa,Alenquer,Abrigada,ABRIGADA,39.1532710001204,-9.02040700011783,NC,74.0,2017-12-03T17:00,9.8,63,3.1,7.0,0.0,0.0,0.0,0.0,0,1029.8,1020.6,0,0,0,0,0.04,0.45,8.2,18.4,41,50,18.7,10.7,10.1,14.4,19.7,0.256,0.262,0.19,0.245,1,2614.21,17.9,10.9,7.0,125.5,14.8,35.8,77.0,47.0,30.0,355.6,77.0,154.1,Magnoliopsida; Eucalyptus L'Hér.; Tracheophyta; Vitis vinifera L.
2017,2017-04-06,Lisboa,Torres Vedras,Ventosa,Figueiras (Forte do Outeiro da Prata),39.0769320000543,-9.30140500002437,Desconhecida,74.0,2017-04-06T14:00,22.2,39,7.6,20.8,0.0,0.0,0.0,0.0,0,1017.7,1009.0,0,0,0,0,0.57,1.63,17.1,21.4,75,77,36.0,21.3,16.1,14.4,13.4,0.237,0.31,0.34,0.3,1,3600.0,848.0,738.6,109.4,926.6,848.0,1089.3,876.0,763.0,113.0,926.6,876.0,1125.3,Vitis vinifera L.; Eucalyptus L'Hér.; Tracheophyta; Magnoliopsida; 
2017,2017-12-04,Lisboa,Mafra,Igreja Nova,Murtal,38.8946159998576,-9.33759700006909,NC,150.0,2017-12-04T12:00,11.1,50,1.1,6.2,0.0,0.0,0.0,0.0,0,1033.2,1014.8,0,0,0,0,0.23,0.66,20.2,26.7,92,92,34.6,9.3,8.5,13.9,18.9,0.235,0.247,0.247,0.307,1,3600.0,487.9,405.6,82.4,850.9,487.9,671.1,468.0,389.0,79.0,850.9,468.0,643.7,Tracheophyta; Magnoliopsida
2017,2017-12-04,Lisboa,Sintra,Agualva,Rua da telheirinha (Agualva-Cacém),38.7699329998758,-9.2941039996677,NC,142.0,2017-12-04T14:00,12.4,49,1.9,8.4,0.0,0.0,0.0,0.0,0,1032.1,1014.7,0,0,0,0,0.23,0.74,14.6,20.8,81,80,35.6,11.1,9.6,13.9,18.5,0.303,0.314,0.24,0.298,1,3600.0,431.4,356.5,74.9,836.7,431.4,600.1,461.0,381.0,80.0,836.7,461.0,641.3,Tracheophyta; Magnoliopsida; 
2017,2017-12-04,Lisboa,Sintra,Almargem do Bispo,Casal do Brejo (Dona Maria),38.8169400000075,-9.25777999983893,NC,281.0,2017-12-04T15:00,11.7,48,0.9,7.7,0.0,0.0,0.0,0.0,0,1032.1,998.0,0,0,0,0,0.19,0.72,13.8,19.8,75,74,32.8,10.8,8.8,13.2,18.2,0.255,0.257,0.201,0.264,1,3600.0,319.0,255.0,64.0,776.2,319.0,462.6,369.0,295.0,74.0,776.2,369.0,535.2,Tracheophyta; Magnoliopsida; Pinus pinaster Aiton; Eucalyptus L'Hér.; Vitis vinifera L.; 
2017,2017-12-04,Lisboa,Mafra,Enxara do Bispo,Enxara dos Cavaleiros (Quinta do Anjo),38.9816700002882,-9.21832999997669,NC,191.0,2017-12-04T15:00,12.5,48,1.7,8.2,0.0,0.0,0.0,0.0,0,1032.1,1008.8,0,0,0,0,0.2,0.76,16.6,22.4,86,86,34.6,11.3,9.1,13.4,18.3,0.237,0.242,0.217,0.267,1,3600.0,316.3,253.2,63.1,774.6,316.3,460.3,366.0,293.0,73.0,774.6,366.0,532.7,Magnoliopsida; Tracheophyta; Pinales; Pinus pinaster Aiton
2017,2017-12-04,Lisboa,Torres Vedras,Dois Portos,Dois Portos,39.0428889995151,-9.18765400012334,NC,97.0,2017-12-04T16:00,12.7,52,3.1,9.3,0.0,0.0,0.0,0.0,0,1032.3,1020.4,0,0,0,0,0.13,0.7,12.0,20.8,81,81,29.2,11.6,9.5,13.9,19.4,0.249,0.264,0.215,0.257,1,3600.0,168.2,125.1,43.1,655.9,168.2,268.5,230.0,171.0,59.0,655.9,230.0,367.1,Vitis vinifera L.; Eucalyptus L'Hér.; Magnoliopsida; Tracheophyta; 
2017,2017-12-04,Lisboa,Odivelas,Ramada,Rua Soalheira (Ramada),38.8014269999663,-9.19444099956089,NC,109.0,2017-12-04T17:00,11.3,52,1.8,7.6,0.0,0.0,0.0,0.0,0,1032.2,1018.8,0,0,0,0,0.08,0.64,12.7,25.8,45,54,25.6,11.2,10.6,14.3,19.3,0.272,0.279,0.217,0.278,1,2718.92,21.7,13.3,8.5,152.0,18.4,42.7,82.0,50.0,32.0,370.9,82.0,161.2,Eucalyptus L'Hér.; Tracheophyta; Magnoliopsida; Olea europaea L.; Pinus pinea L.; 
2017,2017-12-05,Lisboa,Sintra,Sintra (Santa Maria e São Miguel),Quinta da Penha Verde (Monte Santos),38.8058129999373,-9.38789899984996,NC,151.0,2017-12-05T12:00,12.1,56,3.5,8.7,0.0,0.0,0.0,0.0,0,1034.4,1015.9,7,0,0,23,0.22,0.62,12.2,16.4,109,105,28.1,10.2,9.3,13.4,18.2,0.27,0.29,0.252,0.306,1,3600.0,480.8,397.4,83.4,835.6,480.8,669.9,461.0,381.0,80.0,835.6,461.0,642.2,Tracheophyta; Magnoliopsida
2017,2017-12-05,Lisboa,Torres Vedras,Carmões,Rua do Olival (Braçal),39.0460300000509,-9.13803399986691,NC,172.0,2017-12-05T15:00,12.8,55,3.9,9.8,0.0,0.0,0.0,0.0,1,1033.0,1012.0,28,0,0,92,0.18,0.67,10.3,12.9,102,103,21.6,12.1,9.2,13.0,18.8,0.241,0.261,0.213,0.257,1,3600.0,308.2,239.1,69.1,737.9,308.2,456.5,357.0,277.0,80.0,737.9,357.0,528.8,Vitis vinifera L.; Magnoliopsida; Eucalyptus L'Hér.; Tracheophyta; Pinus pinea L.; 
2017,2017-12-05,Lisboa,Arruda Dos Vinhos,Arruda Dos Vinhos,Casal Doutor (ARRUDA),38.9834970000055,-9.07598299980164,NC,96.0,2017-12-05T16:00,12.7,59,4.8,10.4,0.0,0.0,0.0,0.0,1,1033.0,1021.2,23,0,0,76,0.11,0.61,7.3,10.9,101,99,18.0,12.4,10.0,13.6,19.5,0.24,0.264,0.2,0.221,1,3600.0,163.9,114.9,49.0,602.4,163.9,268.6,224.0,157.0,67.0,602.4,224.0,367.1,Tracheophyta; Vitis vinifera L.
2017,2017-12-06,Lisboa,Sintra,São Marcos,Quinta das Estribeiras (São Marcos),38.7545190000534,-9.29612499978807,NC,168.0,2017-12-06T17:00,8.9,79,5.4,6.9,0.0,0.0,0.0,0.0,0,1031.7,1011.0,8,0,11,3,0.03,0.24,6.3,6.3,77,66,9.4,10.7,10.1,13.0,18.1,0.29,0.304,0.239,0.298,1,2734.88,21.5,11.4,10.1,131.1,18.3,44.1,79.0,42.0,37.0,311.4,79.0,162.0,Tracheophyta; Magnoliopsida; 
2017,2017-12-06,Lisboa,Odivelas,Pontinha,Bairro Olival do Pancas (Pontinha),38.7649330001407,-9.2002410000066,NC,87.0,2017-12-06T16:00,11.5,62,4.6,9.6,0.0,0.0,0.0,0.0,1,1031.8,1021.1,25,0,8,66,0.1,0.51,4.3,6.0,66,65,15.5,11.9,10.4,13.9,19.2,0.259,0.273,0.215,0.278,1,3600.0,169.0,119.7,49.2,619.1,169.0,272.5,230.0,163.0,67.0,619.1,230.0,371.0,Pinus pinea L.; Olea europaea L.; Tracheophyta; Magnoliopsida; 
2017,2017-12-07,Lisboa,Arruda Dos Vinhos,Arranhó,A dos Arcos (ARRANHÓ),38.9569070000119,-9.13215700043572,NC,255.0,2017-12-07T13:00,12.3,54,3.2,10.7,0.0,0.0,0.0,0.0,0,1031.6,1000.7,15,0,21,9,0.2,0.66,0.4,0.4,90,270,14.0,10.9,8.0,12.0,18.3,0.227,0.252,0.194,0.221,1,3600.0,417.7,296.9,120.7,634.2,417.7,659.9,422.0,300.0,122.0,634.2,422.0,666.7,Tracheophyta; Magnoliopsida; Olea europaea L.
2017,2017-12-09,Lisboa,Torres Vedras,Turcifal,Casal de Barbas (Fonte de Barbas),39.0205599999428,-9.23667000002331,NC,140.0,2017-12-09T15:00,15.8,83,13.0,13.6,0.2,0.2,0.0,0.0,51,1027.9,1011.1,85,93,0,4,0.13,0.3,21.9,28.8,312,312,38.2,15.4,13.6,13.0,18.1,0.241,0.244,0.212,0.267,1,3600.0,212.7,115.9,96.9,359.7,212.7,454.2,246.0,134.0,112.0,359.7,246.0,525.2,Tracheophyta; Castanea sativa Mill.; Vitis vinifera L.; Magnoliopsida; Pinales; Eucalyptus L'Hér.; 
2017,2017-04-07,Lisboa,Torres Vedras,Torres Vedras (Santa Maria do Castelo e São Miguel),Aldeia Nova (Vala dos Ameais),39.1147200001611,-9.22694000032213,Desconhecida,99.0,2017-04-07T23:00,14.6,64,7.9,12.8,0.0,0.0,0.0,0.0,0,1017.1,1005.2,0,0,0,0,0.03,0.59,8.7,22.1,48,26,18.0,15.3,17.3,14.5,13.2,0.214,0.297,0.333,0.3,0,0.0,0.0,0.0,0.0,0.0,0.0,0.0,0.0,0.0,0.0,0.0,0.0,0.0,Eucalyptus L'Hér.; Vitis vinifera L.; Magnoliopsida; Pinus pinaster Aiton; Tracheophyta
2017,2017-12-13,Lisboa,Sintra,Belas,Estrada do Mirante (Idanha),38.7709799999661,-9.27107900010215,NC,178.0,2017-12-13T22:00,12.2,99,12.0,12.0,0.0,0.0,0.0,0.0,2,1028.1,1006.5,50,56,0,0,0.0,0.02,5.6,13.8,297,298,10.8,10.7,11.4,13.2,17.3,0.351,0.349,0.249,0.298,0,0.0,0.0,0.0,0.0,0.0,0.0,0.0,0.0,0.0,0.0,0.0,0.0,0.0,Pinus pinaster Aiton; Tracheophyta; Pinales; Eucalyptus L'Hér.; Magnoliopsida; 
2017,2017-04-07,Lisboa,Torres Vedras,Turcifal,Qta do Manjapão (Regueira das Hortas do Manjapão),39.0367100000381,-9.24899699952867,Desconhecida,72.0,2017-04-07T21:00,15.4,65,8.9,13.8,0.0,0.0,0.0,0.0,0,1017.1,1008.5,0,0,0,0,0.03,0.61,9.0,23.8,29,18,14.8,17.1,18.1,14.8,13.4,0.214,0.299,0.338,0.3,0,0.0,0.0,0.0,0.0,0.0,0.0,0.0,0.0,0.0,0.0,0.0,0.0,0.0,Tracheophyta; Castanea sativa Mill.; Vitis vinifera L.; Magnoliopsida; Pinales; Eucalyptus L'Hér.; 
2017,2017-12-16,Lisboa,Lisboa,Beato,Azinhaga das Salgadas (Beato),38.7325069999695,-9.11368099954393,NC,56.0,2017-12-16T18:00,10.0,72,5.2,6.6,0.0,0.0,0.0,0.0,0,1025.4,1018.5,0,0,0,0,0.05,0.35,15.5,29.2,356,1,29.2,12.1,12.8,14.2,18.1,0.325,0.323,0.235,0.292,0,0.0,0.0,0.0,0.0,0.0,0.0,0.0,1.0,0.0,1.0,0.0,1.0,13.9,Tracheophyta; Magnoliopsida
2017,2017-12-18,Lisboa,Loures,Fanhões,Reserva (Casal do Quadradinho),38.8955949995253,-9.14843299971687,NC,256.0,2017-12-18T15:00,11.8,49,1.3,8.1,0.0,0.0,0.0,0.0,0,1031.4,1000.3,0,0,0,0,0.19,0.71,12.1,16.2,23,21,25.9,11.0,8.4,11.7,18.2,0.241,0.244,0.169,0.026,1,3600.0,309.9,247.4,62.5,765.8,309.9,456.5,357.0,285.0,72.0,765.8,357.0,525.8,Magnoliopsida; Tracheophyta; Eucalyptus L'Hér.; ; Pinus pinaster Aiton
2017,2017-12-19,Lisboa,Alenquer,Carnota,Santana da Carnota (Casal do Mourão),39.0369400000572,-9.05944000032213,NC,199.0,2017-12-19T13:00,16.6,62,9.2,14.8,0.0,0.0,0.0,0.0,0,1029.0,1005.2,0,0,0,0,0.25,0.72,10.9,13.7,46,45,21.2,12.5,9.1,12.0,17.0,0.266,0.274,0.192,0.242,1,3600.0,452.3,370.8,81.5,810.4,452.3,646.4,455.0,373.0,82.0,810.4,455.0,650.3,Tracheophyta; Vitis vinifera L.; Magnoliopsida
2017,2017-12-20,Lisboa,Torres Vedras,Torres Vedras (Santa Maria do Castelo e São Miguel),sevelheira (Praceta José Gouveia),39.0947119998932,-9.25029600001044,NC,30.0,2017-12-20T18:00,10.8,84,8.2,9.1,0.0,0.0,0.0,0.0,0,1033.3,1029.6,0,0,0,0,0.02,0.21,8.3,19.8,2,2,13.3,11.9,12.0,13.2,17.4,0.297,0.313,0.222,0.273,0,0.0,0.0,0.0,0.0,0.0,0.0,0.0,2.0,0.0,2.0,0.0,2.0,14.9,Tracheophyta; Magnoliopsida; Olea europaea L.; Vitis vinifera L.
2017,2017-12-23,Lisboa,Alenquer,Meca,Catém (Casal do Barro),39.0855449999703,-9.04267100016276,NC,105.0,2017-12-23T15:00,14.8,58,6.5,12.2,0.0,0.0,0.0,0.0,0,1030.3,1017.6,0,0,0,0,0.19,0.71,11.3,14.7,59,59,22.0,13.4,10.8,12.3,17.2,0.238,0.261,0.193,0.242,1,3600.0,307.4,242.9,64.4,747.7,307.4,459.3,353.0,279.0,74.0,747.7,353.0,527.5,Magnoliopsida; Tracheophyta; Vitis vinifera L.
2017,2017-12-23,Lisboa,Sobral de Monte Agraço,Sapataria,Fetelaria,38.9633299997118,-9.17082999997669,NC,297.0,2017-12-23T17:00,11.0,74,6.5,9.0,0.0,0.0,0.0,0.0,0,1030.3,994.3,0,0,0,0,0.04,0.34,7.1,16.3,60,59,19.1,11.7,10.7,11.5,15.7,0.259,0.281,0.215,0.266,1,2922.58,28.8,17.4,11.4,199.5,25.6,57.9,86.0,52.0,34.0,377.9,86.0,173.0,Tracheophyta; Magnoliopsida
2017,2017-04-07,Lisboa,Azambuja,Aveiras de Cima,Vale de Tábuas,39.1584270000458,-8.93023200035095,Desconhecida,49.0,2017-04-07T17:00,25.1,34,8.2,23.2,0.0,0.0,0.0,0.0,0,1015.2,1009.5,0,0,0,0,0.35,2.1,10.0,12.0,334,339,17.3,24.3,18.1,14.8,13.4,0.172,0.273,0.29,0.272,1,3600.0,375.9,307.9,68.0,777.9,375.9,540.6,459.0,376.0,83.0,777.9,459.0,660.1,Tracheophyta; Pinus pinea L.; Eucalyptus L'Hér.; Vitis vinifera L.; Quercus suber L.; Olea europaea L.; Magnoliopsida
2017,2017-12-24,Lisboa,Torres Vedras,Silveira,SILVEIRA (Portelinhas),39.1104490004645,-9.37016800006231,NC,53.0,2017-12-24T22:00,10.0,93,8.9,7.9,0.0,0.0,0.0,,1,1026.9,1020.4,29,19,20,0,0.0,0.09,12.6,25.0,127,137,20.5,10.2,11.3,12.7,16.9,0.275,0.296,0.224,0.272,0,0.0,0.0,0.0,0.0,0.0,0.0,0.0,0.0,0.0,0.0,0.0,0.0,0.0,Tracheophyta; Magnoliopsida; Vitis vinifera L.; Eucalyptus L'Hér.; 
2017,2017-04-07,Lisboa,Alenquer,Aldeia Gavinha,MONTE GIL,39.0817870002323,-9.06226899994744,Desconhecida,155.0,2017-04-07T16:00,24.4,34,7.5,23.2,0.0,0.0,0.0,0.0,0,1015.3,997.4,0,0,0,0,0.44,2.01,7.6,9.3,341,344,17.3,23.7,16.9,14.2,12.9,0.186,0.282,0.3,0.268,1,3600.0,571.7,485.6,86.1,855.1,571.7,775.6,644.0,547.0,97.0,855.1,644.0,873.6,Vitis vinifera L.; Tracheophyta; Magnoliopsida
2017,2017-04-07,Lisboa,Torres Vedras,Silveira,Praia Azul,39.1130660004086,-9.39349399990506,Desconhecida,0.0,2017-04-07T15:00,22.1,60,13.9,22.8,0.0,0.0,0.0,,0,1016.0,1016.0,0,0,0,0,0.48,1.06,12.6,15.5,290,295,27.0,23.8,17.4,15.0,13.8,0.216,0.299,0.333,0.3,1,3600.0,731.6,632.7,98.9,895.5,731.6,964.8,784.0,678.0,106.0,895.5,784.0,1033.9,Tracheophyta; Magnoliopsida; Vitis vinifera L.; Eucalyptus L'Hér.; 
2017,2017-04-07,Lisboa,Alenquer,Abrigada,Casais da Pedreira (Serra de Montejunto),39.1674750000238,-9.04719799995422,Desconhecida,455.0,2017-04-07T15:00,22.4,31,4.5,22.5,0.0,0.0,0.0,0.0,0,1015.6,963.8,0,0,0,0,0.49,1.86,1.1,1.4,198,180,15.5,22.4,14.7,12.3,10.9,0.18,0.278,0.294,0.279,1,3600.0,732.1,635.1,97.0,901.9,732.1,961.6,785.0,681.0,104.0,901.9,785.0,1031.2,Magnoliopsida; Tracheophyta; Eucalyptus L'Hér.
2017,2017-01-14,Lisboa,Sobral de Monte Agraço,Santo Quintino,Casal das Figueiras (Casal de Alqueidão),38.980373000039,-9.14173999998305,Desconhecida,347.0,2017-01-14T15:00,10.4,46,-0.7,6.0,0.0,0.0,0.0,0.0,0,1029.2,987.2,0,0,0,0,0.21,0.68,15.0,19.7,27,28,29.5,10.9,9.0,11.1,13.8,0.307,0.33,0.314,0.292,1,3600.0,376.9,304.5,72.3,807.6,376.9,533.1,422.0,341.0,81.0,807.6,422.0,597.0,Vitis vinifera L.; Tracheophyta; Magnoliopsida; Eucalyptus L'Hér.
2017,2017-04-08,Lisboa,Sintra,Belas,CREL Km1?? lado Esquerdo (Quinta do Porto),38.762621000078,-9.27761299981011,Desconhecida,199.0,2017-04-08T21:00,14.6,63,7.7,12.1,0.0,0.0,0.0,0.0,0,1017.1,993.4,1,0,0,2,0.05,0.61,13.0,23.6,3,12,24.8,16.7,17.5,14.6,12.9,0.265,0.31,0.357,0.339,0,0.0,0.0,0.0,0.0,0.0,0.0,0.0,0.0,0.0,0.0,0.0,0.0,0.0,Pinus pinaster Aiton; Tracheophyta; Pinales; Eucalyptus L'Hér.; Magnoliopsida; 
2017,2017-04-09,Lisboa,Sintra,Agualva,Cacém,38.7653149996863,-9.29745100021362,Desconhecida,122.0,2017-04-09T02:00,13.7,83,10.8,12.5,0.0,0.0,0.0,0.0,1,1016.8,1002.2,20,0,0,67,0.01,0.27,9.7,19.1,88,131,21.6,15.2,17.1,15.1,13.4,0.265,0.309,0.357,0.339,0,0.0,0.0,0.0,0.0,0.0,0.0,0.0,0.0,0.0,0.0,0.0,0.0,0.0,Tracheophyta; Magnoliopsida; 
2017,2017-04-09,Lisboa,Torres Vedras,Matacães,Lapas Pequenas (Ordasqueira),39.0966270001729,-9.22081999990675,NC,81.0,2017-04-09T19:00,16.8,81,13.5,16.7,0.0,0.0,0.0,0.0,1,1016.7,1007.1,28,0,0,92,0.04,0.37,8.4,8.9,317,291,14.0,19.9,18.2,15.0,13.4,0.185,0.282,0.331,0.3,1,1385.5,7.8,2.3,5.5,25.9,6.2,19.6,62.0,18.0,44.0,125.1,62.0,156.6,Tracheophyta; Vitis vinifera L.; Eucalyptus L'Hér.; Magnoliopsida; Pinus pinaster Aiton; Olea europaea L.; 
2017,2017-04-09,Lisboa,Azambuja,Vila Nova da Rainha,A1 S/N lado direito Km33 (A1-S-N Km 34),39.0427799998389,-8.94277999983894,Desconhecida,3.0,2017-04-09T17:00,26.5,27,6.2,23.8,0.0,0.0,0.0,0.0,1,1015.8,1015.5,29,0,0,98,0.37,2.51,12.0,18.1,173,167,32.0,23.4,18.1,15.5,14.2,0.283,0.385,0.415,0.369,1,3600.0,360.4,259.4,101.0,645.5,360.4,548.2,439.0,316.0,123.0,645.5,439.0,667.8,Tracheophyta; Magnoliopsida; Quercus suber L.
