year,date,district,municipality,parish,local,latitude,longitude,cause,elevation,hourly.time,hourly.temperature_2m,hourly.relative_humidity_2m,hourly.dew_point_2m,hourly.apparent_temperature,hourly.precipitation,hourly.rain,hourly.snowfall,hourly.snow_depth,hourly.weather_code,hourly.pressure_msl,hourly.surface_pressure,hourly.cloud_cover,hourly.cloud_cover_low,hourly.cloud_cover_mid,hourly.cloud_cover_high,hourly.et0_fao_evapotranspiration,hourly.vapour_pressure_deficit,hourly.wind_speed_10m,hourly.wind_speed_100m,hourly.wind_direction_10m,hourly.wind_direction_100m,hourly.wind_gusts_10m,hourly.soil_temperature_0_to_7cm,hourly.soil_temperature_7_to_28cm,hourly.soil_temperature_28_to_100cm,hourly.soil_temperature_100_to_255cm,hourly.soil_moisture_0_to_7cm,hourly.soil_moisture_7_to_28cm,hourly.soil_moisture_28_to_100cm,hourly.soil_moisture_100_to_255cm,hourly.is_day,hourly.sunshine_duration,hourly.shortwave_radiation_instant,hourly.direct_radiation_instant,hourly.diffuse_radiation_instant,hourly.direct_normal_irradiance_instant,hourly.global_tilted_irradiance_instant,hourly.terrestrial_radiation_instant,hourly.shortwave_radiation,hourly.direct_radiation,hourly.diffuse_radiation,hourly.direct_normal_irradiance,hourly.global_tilted_irradiance,hourly.terrestrial_radiation,scientificNames
2021,2021-06-28,Lisboa,Alenquer,Cadafais,R 1 DE MAIO (Casais da Pimenta),39.0215159999,-9.01429299990336,Desconhecida,74.0,2021-06-28T12:00,21.8,48,10.3,19.5,0.0,0.0,0.0,0.0,0,1021.4,1012.7,0,0,0,0,0.55,1.35,27.0,34.0,341,342,54.0,26.6,21.9,21.0,17.5,0.086,0.151,0.206,0.226,1,3600.0,918.0,732.4,185.7,769.6,918.0,1259.4,895.0,714.0,181.0,769.6,895.0,1227.8,Magnoliopsida; Olea europaea L.; Vitis vinifera L.; Tracheophyta; Pinus pinaster Aiton
2021,2021-06-29,Lisboa,Alenquer,Cabanas de Torres,Estação Radar nº 3 (Penha da Cruz),39.1701499999894,-9.05070399999619,Desconhecida,586.0,2021-06-29T12:00,17.2,47,5.6,14.7,0.0,0.0,0.0,0.0,0,1020.4,952.8,0,0,0,0,0.5,1.05,22.5,28.1,340,341,58.0,23.2,17.4,17.1,14.1,0.091,0.174,0.248,0.291,1,3600.0,974.6,856.6,118.0,901.1,974.6,1257.9,950.0,835.0,115.0,901.1,950.0,1226.2,Magnoliopsida; Tracheophyta; Eucalyptus L'Hér.
2021,2021-06-30,Lisboa,Torres Vedras,Torres Vedras (São Pedro e São Tiago),TORRES_VEDRAS 111326: @ES DE MADEIRA TORRES (ESCOLA#16452) (Praça Doutor Francisco Sá Carneiro),39.0839800000191,-9.25801000012292,NC,38.0,2021-06-30T12:00,19.9,66,13.3,19.7,0.0,0.0,0.0,0.0,1,1018.5,1014.0,36,40,0,0,0.48,0.8,20.3,24.5,343,346,43.6,23.3,19.4,19.4,17.2,0.134,0.232,0.27,0.334,1,3600.0,905.3,649.7,255.6,683.7,905.3,1257.5,882.0,633.0,249.0,683.7,882.0,1225.2,Tracheophyta; Magnoliopsida; Vitis vinifera L.
2021,2021-06-30,Lisboa,Torres Vedras,Torres Vedras (São Pedro e São Tiago),Escola Secundária Madeira Torres (Torres Vedras),39.0918290000492,-9.25195200006167,NC,32.0,2021-06-30T12:00,19.6,67,13.3,19.2,0.0,0.0,0.0,0.0,1,1018.6,1014.8,46,51,0,0,0.47,0.76,20.7,25.3,347,349,43.2,23.0,19.3,19.3,17.2,0.15,0.25,0.283,0.323,1,3600.0,905.3,669.2,236.1,704.5,905.3,1257.1,882.0,652.0,230.0,704.5,882.0,1224.7,Tracheophyta; Magnoliopsida; Olea europaea L.; Vitis vinifera L.
2021,2021-07-01,Santarém,Cartaxo,Pontével,CASAIS DA LAGOA (Quinta da Caridade),39.1133299997118,-8.83139000044929,Desconhecida,56.0,2021-07-01T14:00,28.6,29,9.1,28.2,0.0,0.0,0.0,0.0,0,1017.3,1010.9,19,0,0,63,0.72,2.77,15.5,19.1,312,313,36.0,32.0,22.1,20.8,17.4,0.102,0.16,0.205,0.229,1,3600.0,920.4,799.6,120.8,872.1,920.4,1213.2,945.0,821.0,124.0,872.1,945.0,1245.6,Eucalyptus L'Hér.; Tracheophyta; Pinus pinaster Aiton
2021,2021-07-01,Lisboa,Loures,Santo Antão do Tojal,ZAMBUJAL (Arneiro),38.8616980001662,-9.14152700000339,NC,37.0,2021-07-01T17:00,25.3,41,11.2,23.2,0.0,0.0,0.0,0.0,0,1017.5,1013.2,0,0,0,0,0.45,1.9,18.4,23.4,321,323,38.2,32.7,24.0,21.4,18.2,0.106,0.174,0.225,0.182,1,3600.0,512.4,429.7,82.8,781.9,512.4,727.1,588.0,493.0,95.0,781.9,588.0,834.3,Tracheophyta; Magnoliopsida; Eucalyptus L'Hér.; Olea europaea L.
2021,2021-07-01,Lisboa,Sintra,Sintra (São Pedro de Penaferrim),R LOURENCO CAIOLA (Bairro da Cadeia do Linhó),38.7573410002391,-9.37209499994914,Desconhecida,154.0,2021-07-01T19:00,17.8,73,12.8,15.9,0.0,0.0,0.0,0.0,0,1018.1,999.9,0,0,0,0,0.14,0.55,19.2,29.6,343,344,41.8,23.0,20.6,18.5,16.4,0.165,0.214,0.252,0.35,1,3600.0,143.1,101.2,41.9,542.0,143.1,247.0,215.0,152.0,63.0,542.0,215.0,371.1,Magnoliopsida; Tracheophyta
2021,2021-07-01,Lisboa,Mafra,Ericeira,ERICEIRA,38.9676259999805,-9.41728900002109,Desconhecida,32.0,2021-07-01T19:00,17.1,86,14.6,16.1,0.0,0.0,0.0,0.0,0,1018.9,1015.1,0,0,0,0,0.1,0.28,17.6,22.5,345,347,33.8,24.4,21.9,19.5,17.5,0.128,0.239,0.27,0.35,1,3600.0,143.1,100.3,42.8,532.1,143.1,249.4,214.0,150.0,64.0,532.1,214.0,373.0,Tracheophyta; Magnoliopsida
2021,2021-07-02,Lisboa,Vila Franca de Xira,São João Dos Montes,Estrada do Bogalhao (Casal da Raposeira),38.9527800001038,-9.04360999955071,NC,150.0,2021-07-02T12:00,27.9,39,12.7,29.9,0.0,0.0,0.0,0.0,0,1018.5,1001.3,0,0,0,0,0.65,2.28,6.7,8.1,286,283,29.9,29.4,21.9,20.3,16.9,0.184,0.27,0.306,0.318,1,3600.0,937.9,816.8,121.1,859.5,937.9,1257.4,914.0,796.0,118.0,859.5,914.0,1225.4,Magnoliopsida; Tracheophyta; Pinus pinaster Aiton; Vitis vinifera L.; Olea europaea L.; Eucalyptus L'Hér.; Pinales; 
2021,2021-07-02,Lisboa,Odivelas,Pontinha,Casal do Rato,38.7819400003221,-9.21139000044929,NC,98.0,2021-07-02T14:00,27.6,43,14.0,28.8,0.0,0.0,0.0,0.0,0,1018.9,1007.6,0,0,0,0,0.67,2.1,14.8,19.5,264,268,36.7,30.2,22.0,19.8,17.2,0.139,0.188,0.239,0.312,1,3600.0,912.3,789.5,122.8,858.1,912.3,1217.3,936.0,810.0,126.0,858.1,936.0,1248.9,Pinus pinea L.; Olea europaea L.; Tracheophyta; Magnoliopsida; 
2021,2021-07-02,Lisboa,Vila Franca de Xira,São João Dos Montes,A-dos-Loucos,38.9398160001967,-9.0177360000213,NC,147.0,2021-07-02T17:00,24.8,50,13.7,23.4,0.0,0.0,0.0,0.0,0,1018.7,1001.7,3,0,0,10,0.42,1.56,18.5,23.9,294,293,41.0,33.5,24.1,20.6,17.3,0.082,0.155,0.205,0.145,1,3600.0,505.6,418.4,87.2,761.2,505.6,727.3,580.0,480.0,100.0,761.2,580.0,834.4,Magnoliopsida; Tracheophyta; Pinus pinaster Aiton; Vitis vinifera L.; Olea europaea L.; Eucalyptus L'Hér.; Pinales; 
2021,2021-07-02,Lisboa,Sintra,Rio de Mouro,R FONTE VELHA 21 (Mercês),38.7912080001831,-9.3276559999254,Desconhecida,153.0,2021-07-02T18:00,21.1,71,15.5,21.1,0.0,0.0,0.0,0.0,0,1018.8,1000.9,1,0,0,2,0.24,0.73,12.9,17.3,306,306,33.8,25.9,21.5,18.6,16.4,0.156,0.21,0.251,0.35,1,3600.0,322.1,252.8,69.2,676.6,322.1,494.4,400.0,314.0,86.0,676.6,400.0,614.1,Tracheophyta; Magnoliopsida; Pinales; 
2021,2021-07-02,Lisboa,Loures,Santo Antão do Tojal,São Julião do Tojal (Fazenda Seca),38.8541700000233,-9.1625,NC,61.0,2021-07-02T23:00,18.9,90,17.2,19.8,0.0,0.0,0.0,0.0,0,1019.3,1012.1,0,0,0,0,0.0,0.22,11.8,19.2,310,310,27.4,23.4,25.4,21.4,18.1,0.101,0.171,0.224,0.182,0,0.0,0.0,0.0,0.0,0.0,0.0,0.0,0.0,0.0,0.0,0.0,0.0,0.0,Tracheophyta; Magnoliopsida
2021,2021-07-02,Lisboa,Cascais,São Domingos de Rana,Rua das Papoilas (Alto do Clérigo),38.7408300002416,-9.355,Desconhecida,118.0,2021-07-02T23:00,17.5,98,17.2,18.5,0.0,0.0,0.0,0.0,2,1019.5,1005.5,66,73,0,0,0.0,0.03,10.7,20.4,315,311,24.1,20.3,21.7,18.9,16.7,0.156,0.21,0.251,0.35,0,0.0,0.0,0.0,0.0,0.0,0.0,0.0,0.0,0.0,0.0,0.0,0.0,0.0,Tracheophyta; Magnoliopsida
2021,2021-07-03,Lisboa,Alenquer,Carregado,ESTRADA DA CENTRAL (Aposento),39.015,-8.95777999983894,Desconhecida,8.0,2021-07-03T14:00,27.3,49,15.6,28.7,0.0,0.0,0.0,0.0,0,1018.8,1017.9,8,9,0,0,0.6,1.86,14.0,17.2,282,280,32.8,29.7,24.1,21.4,17.9,0.188,0.27,0.305,0.318,1,3600.0,811.7,626.6,185.1,682.5,811.7,1214.7,833.0,643.0,190.0,682.5,833.0,1246.5,Tracheophyta; Magnoliopsida
2021,2021-07-03,Lisboa,Vila Franca de Xira,São João Dos Montes,Rua Gen Humberto Delgado (Cotovios),38.955,-9.04277999983893,Desconhecida,163.0,2021-07-03T16:00,24.5,52,14.0,24.0,0.0,0.0,0.0,0.0,0,1018.9,1000.0,18,0,0,60,0.49,1.48,18.5,23.2,297,296,40.0,30.2,23.6,20.4,16.9,0.188,0.27,0.305,0.317,1,3600.0,656.6,534.0,122.5,756.5,656.6,934.0,718.0,584.0,134.0,756.5,718.0,1021.4,Magnoliopsida; Tracheophyta; Pinus pinaster Aiton; Vitis vinifera L.; Olea europaea L.; Eucalyptus L'Hér.; Pinales; 
2021,2021-07-03,Lisboa,Lisboa,Campolide,R JOSE DA FELICIDADE ALVES (Campolide),38.7314239999983,-9.16580400043064,Desconhecida,57.0,2021-07-03T20:00,18.8,78,14.8,18.6,0.0,0.0,0.0,0.0,0,1019.3,1012.5,0,0,0,0,0.05,0.49,12.5,19.7,314,320,27.0,24.2,23.4,20.5,17.6,0.165,0.189,0.242,0.31,1,2160.96,0.3,0.2,0.2,2.0,0.2,0.8,51.0,26.0,25.0,202.9,51.0,121.0,Tracheophyta; Magnoliopsida; Pinales; Eucalyptus L'Hér.
2021,2021-07-04,Lisboa,Cascais,São Domingos de Rana,R CRUZEIRO DO SUL (Miradouro),38.7279319996304,-9.36189000023736,Desconhecida,88.0,2021-07-04T13:00,24.1,53,13.9,24.9,0.0,0.0,0.0,0.0,0,1020.4,1010.1,0,0,0,0,0.61,1.41,16.6,21.0,292,301,40.7,26.7,21.3,19.7,17.3,0.166,0.204,0.25,0.324,1,3600.0,947.7,829.6,118.1,864.6,947.7,1269.6,947.0,829.0,118.0,864.6,947.0,1268.6,Tracheophyta; Magnoliopsida
2021,2021-07-04,Lisboa,Alenquer,Olhalvo,Rua Principal (Casal Perdigoto),39.0962709999084,-9.05321199999915,Desconhecida,132.0,2021-07-04T18:00,22.5,58,13.8,20.8,0.0,0.0,0.0,0.0,0,1019.3,1003.9,0,0,0,0,0.29,1.15,20.0,24.8,293,294,38.2,31.7,24.7,20.8,17.5,0.082,0.16,0.226,0.25,1,3600.0,315.3,245.3,70.0,661.8,315.3,490.4,392.0,305.0,87.0,661.8,392.0,609.8,Vitis vinifera L.; Magnoliopsida; Tracheophyta
2021,2021-07-04,Lisboa,Sintra,São João das Lampas,Santa Susana,38.9112659994761,-9.38168599976434,Desconhecida,150.0,2021-07-04T18:00,19.5,80,16.0,19.3,0.0,0.0,0.0,0.0,0,1020.1,1002.4,12,13,0,0,0.21,0.45,15.3,19.2,294,296,32.0,30.2,23.8,19.8,17.1,0.079,0.194,0.244,0.349,1,3600.0,312.5,236.8,75.7,633.1,312.5,494.9,388.0,294.0,94.0,633.1,388.0,614.4,Tracheophyta; Magnoliopsida; Pinus pinaster Aiton; Pinus pinea L.; Vitis vinifera L.; Pinales; Olea europaea L.; 
2021,2021-07-05,Lisboa,Oeiras,Carnaxide,Rua Carlos Belo Morais (Alto de Barronhos),38.7168770000007,-9.23045999950833,Desconhecida,98.0,2021-07-05T01:00,17.3,94,16.3,18.8,0.0,0.0,0.0,0.0,0,1019.4,1007.7,0,0,0,0,0.0,0.12,4.6,13.6,309,323,11.9,20.5,23.0,20.4,17.4,0.162,0.189,0.242,0.309,0,0.0,0.0,0.0,0.0,0.0,0.0,0.0,0.0,0.0,0.0,0.0,0.0,0.0,Tracheophyta; Magnoliopsida; Pinus pinea L.; Vitis vinifera L.; Eucalyptus L'Hér.; Olea europaea L.; Pinus pinaster Aiton
2021,2021-07-05,Lisboa,Cascais,São Domingos de Rana,Rua Cruzeiro do Sul // Bairro Miradouro (Miradouro),38.7279319996304,-9.36189000023736,Desconhecida,88.0,2021-07-05T01:00,17.6,95,16.8,18.3,0.0,0.0,0.0,0.0,0,1019.4,1008.9,0,0,0,0,0.0,0.11,11.3,21.5,323,325,23.8,20.1,22.1,19.8,17.3,0.162,0.203,0.25,0.324,0,0.0,0.0,0.0,0.0,0.0,0.0,0.0,0.0,0.0,0.0,0.0,0.0,0.0,Tracheophyta; Magnoliopsida
2021,2021-07-05,Lisboa,Cascais,Estoril,R MONTE LEITE (Bairro de santa Rita),38.7066890001297,-9.38858000013563,Desconhecida,24.0,2021-07-05T13:00,22.6,67,16.1,22.9,0.0,0.0,0.0,0.0,2,1018.0,1015.2,53,59,0,0,0.4,0.91,15.3,20.2,279,289,37.1,24.8,21.7,20.2,17.7,0.169,0.204,0.253,0.324,1,3600.0,632.5,228.2,404.3,237.9,632.5,1269.0,632.0,228.0,404.0,237.9,632.0,1268.0,Magnoliopsida; Tracheophyta; Pinus pinaster Aiton
2021,2021-07-05,Lisboa,Arruda Dos Vinhos,Santiago Dos Velhos,Rua São Romão (Casal Novo),38.9480599996779,-9.09610999955071,NC,338.0,2021-07-05T22:00,17.2,93,16.1,17.4,0.0,0.0,0.0,0.0,3,1017.3,977.8,100,100,0,97,0.0,0.13,12.7,19.9,277,276,24.1,19.7,20.8,18.1,15.5,0.121,0.208,0.26,0.335,0,0.0,0.0,0.0,0.0,0.0,0.0,0.0,0.0,0.0,0.0,0.0,0.0,0.0,Magnoliopsida; Tracheophyta; Vitis vinifera L.; Olea europaea L.
2021,2021-07-05,Lisboa,Lourinhã,Moita Dos Ferreiros,SÃO BARTOLOMEU (CASTELHANOS),39.265,-9.24610999955071,Desconhecida,189.0,2021-07-05T23:00,18.3,92,16.9,19.0,0.0,0.0,0.0,0.0,3,1016.8,994.6,100,100,0,90,0.0,0.18,12.2,21.3,256,259,23.0,19.9,21.0,18.5,16.1,0.071,0.138,0.154,0.236,0,0.0,0.0,0.0,0.0,0.0,0.0,0.0,0.0,0.0,0.0,0.0,0.0,0.0,Vitis vinifera L.; Pinus pinea L.; Eucalyptus L'Hér.; Tracheophyta; Magnoliopsida; ; Olea europaea L.
2021,2021-07-06,Lisboa,Loures,Bucelas,Casal das Campas (Moinhos de Vento),38.9038569998741,-9.12103800005383,NC,88.0,2021-07-06T13:00,19.2,63,12.1,17.6,0.0,0.0,0.0,0.0,1,1018.7,1008.3,48,1,54,49,0.19,0.81,15.5,20.2,329,329,33.5,24.9,23.4,21.6,17.9,0.093,0.158,0.208,0.145,1,0.0,214.1,0.0,214.1,0.0,214.1,1266.9,214.0,0.0,214.0,0.0,214.0,1266.2,Magnoliopsida; Tracheophyta; Olea europaea L.; Pinus pinea L.; Pinus pinaster Aiton; Eucalyptus L'Hér.; Vitis vinifera L.; 
2021,2021-07-06,Lisboa,Torres Vedras,A Dos Cunhados,R SANTA RITA 4 (Valongo),39.1679080000189,-9.34642699983385,Desconhecida,98.0,2021-07-06T18:00,18.6,64,11.6,16.6,0.0,0.0,0.0,0.0,1,1018.9,1007.3,45,50,0,0,0.23,0.78,16.7,21.9,327,330,32.0,23.1,21.1,19.4,16.9,0.161,0.24,0.287,0.333,1,3600.0,294.8,200.6,94.3,537.4,294.8,493.9,366.0,249.0,117.0,537.4,366.0,613.1,Eucalyptus L'Hér.; Tracheophyta; Vitis vinifera L.; Magnoliopsida; Pinus pinea L.; 
2021,2021-07-07,Lisboa,Alenquer,Carnota,Canhestro,39.0402580001619,-9.04855500009325,Desconhecida,212.0,2021-07-07T14:00,22.4,43,9.1,20.1,0.0,0.0,0.0,0.0,0,1022.0,997.3,0,0,0,0,0.57,1.55,24.8,31.3,341,341,49.7,29.6,21.6,20.8,17.2,0.084,0.151,0.202,0.225,1,3600.0,873.3,745.6,127.7,813.5,873.3,1212.6,896.0,765.0,131.0,813.5,896.0,1244.2,Vitis vinifera L.; Magnoliopsida; Tracheophyta
2021,2021-07-07,Lisboa,Oeiras,Carnaxide,Rua Cesário Verde (CARNAXIDE),38.7252339998881,-9.24342100037469,Desconhecida,71.0,2021-07-07T15:00,23.1,49,11.9,22.3,0.0,0.0,0.0,0.0,0,1021.9,1013.6,5,6,0,0,0.56,1.44,20.8,27.8,342,343,44.6,27.3,21.6,20.6,17.7,0.165,0.189,0.244,0.309,1,3600.0,837.3,729.3,108.0,875.4,837.3,1102.4,884.0,770.0,114.0,875.4,884.0,1163.8,Tracheophyta; Magnoliopsida; Pinus pinea L.; Vitis vinifera L.; Eucalyptus L'Hér.; Olea europaea L.; Pinus pinaster Aiton
2021,2021-07-07,Lisboa,Cascais,Estoril,ATIBA (Alto dos Gaios),38.7158149994744,-9.38057399961684,Desconhecida,63.0,2021-07-07T15:00,21.9,54,12.1,20.8,0.0,0.0,0.0,0.0,0,1022.3,1014.9,1,1,0,0,0.53,1.22,23.2,30.6,332,336,52.6,25.8,20.8,20.0,17.6,0.167,0.203,0.253,0.324,1,3600.0,840.4,734.2,106.1,880.4,840.4,1103.5,887.0,775.0,112.0,880.4,887.0,1164.8,Tracheophyta; Magnoliopsida; Pinus pinaster Aiton; Pinus pinea L.
2021,2021-07-07,Lisboa,Oeiras,Oeiras e São Julião da Barra,R ALEXANDRE HERCULANO OEIRAS 2780-051_OEIRAS 111014 (Areeiro Velho),38.6846380000644,-9.31797699994511,Desconhecida,22.0,2021-07-07T18:00,19.7,65,12.9,16.8,0.0,0.0,0.0,0.0,0,1022.1,1019.5,0,0,0,0,0.26,0.81,26.2,37.1,339,342,56.2,24.5,21.7,20.3,17.8,0.166,0.203,0.252,0.324,1,3600.0,327.9,260.4,67.5,700.9,327.9,491.6,408.0,324.0,84.0,700.9,408.0,611.6,Pinus pinea L.; Magnoliopsida; Tracheophyta; Vitis vinifera L.; Eucalyptus L'Hér.; Olea europaea L.; Pinus pinaster Aiton
2021,2021-07-07,Lisboa,Sintra,Casal de Cambra,R PORTIMAO 22 CASAL_DE_CAMBRA 2605-845_CASAL_DE_CAMBRA 111115: PRX. (Serra da Helena),38.8040649999513,-9.23926999992795,Desconhecida,233.0,2021-07-07T21:00,15.4,85,12.9,12.9,0.0,0.0,0.0,0.0,0,1023.1,995.3,4,4,0,0,0.03,0.26,23.7,39.9,350,353,51.5,19.2,20.0,18.6,16.1,0.164,0.207,0.255,0.348,0,0.0,0.0,0.0,0.0,0.0,0.0,0.0,0.0,0.0,0.0,0.0,0.0,0.0,Tracheophyta; Magnoliopsida; ; Eucalyptus L'Hér.
2021,2021-07-08,Lisboa,Torres Vedras,Dois Portos,Caixaria,39.0499879995982,-9.19931099997626,Desconhecida,126.0,2021-07-08T12:00,20.9,66,14.2,20.3,0.0,0.0,0.0,0.0,0,1023.7,1008.8,3,3,0,0,0.5,0.85,25.2,30.8,343,346,51.8,25.0,20.0,19.6,17.1,0.121,0.212,0.269,0.332,1,3600.0,959.5,838.3,121.2,886.1,959.5,1251.8,934.0,816.0,118.0,886.1,934.0,1218.5,Vitis vinifera L.; Eucalyptus L'Hér.; Magnoliopsida; Tracheophyta; 
2021,2021-07-08,Lisboa,Loures,Santa Iria de Azoia,VIA N10 (Santa Iria),38.8422870000203,-9.08119199964735,Desconhecida,18.0,2021-07-08T14:00,26.3,43,12.5,25.5,0.0,0.0,0.0,0.0,0,1021.6,1019.5,0,0,0,0,0.67,1.97,23.6,30.8,344,346,50.8,31.5,23.0,22.1,18.7,0.1,0.17,0.225,0.182,1,3600.0,928.9,817.8,111.1,891.5,928.9,1213.8,953.0,839.0,114.0,891.5,953.0,1245.2,Tracheophyta; Magnoliopsida; Olea europaea L.; 
2021,2021-07-08,Lisboa,Cascais,Alcabideche,R SANTAREM (Fontainhas),38.7144239997864,-9.41643900023566,Desconhecida,76.0,2021-07-08T14:00,24.1,49,12.8,23.4,0.0,0.0,0.0,0.0,0,1021.8,1012.9,0,0,0,0,0.61,1.52,23.7,32.2,346,350,57.6,26.2,20.8,19.9,17.5,0.163,0.202,0.252,0.323,1,3600.0,933.2,821.0,112.1,893.5,933.2,1215.8,957.0,842.0,115.0,893.5,957.0,1246.8,Tracheophyta; Eucalyptus L'Hér.; Magnoliopsida; Pinus pinea L.; Pinus pinaster Aiton; Pinales; Vitis vinifera L.; 
2021,2021-07-08,Lisboa,Oeiras,Caxias,Caxias (Reduto Sul),38.7019049999449,-9.26605799992879,Desconhecida,75.0,2021-07-08T15:00,24.1,48,12.3,22.8,0.0,0.0,0.0,0.0,0,1021.4,1012.6,0,0,0,0,0.58,1.57,24.7,33.4,344,349,54.7,26.7,21.0,19.9,17.5,0.162,0.202,0.252,0.323,1,3600.0,842.2,737.1,105.2,884.2,842.2,1103.0,889.0,778.0,111.0,884.2,889.0,1164.2,Pinus pinea L.; Magnoliopsida; Tracheophyta; Vitis vinifera L.; Eucalyptus L'Hér.; Olea europaea L.; Pinus pinaster Aiton; Pinales
2021,2021-07-08,Lisboa,Amadora,Falagueira,R QUINTA DA BOLACHA (Rua da Quinta da Bolacha),38.7628340000576,-9.22519200007121,Desconhecida,125.0,2021-07-08T21:00,16.5,79,12.8,13.1,0.0,0.0,0.0,0.0,0,1021.3,1006.4,0,0,0,0,0.05,0.39,29.3,49.7,341,344,57.6,21.4,22.1,20.2,17.4,0.141,0.186,0.24,0.31,0,0.0,0.0,0.0,0.0,0.0,0.0,0.0,0.0,0.0,0.0,0.0,0.0,0.0,Tracheophyta; 
2021,2021-07-10,Lisboa,Cascais,Alcabideche,Rua Fernando Pessoa (MURCHES),38.7278079997169,-9.43712699996101,Desconhecida,107.0,2021-07-10T14:00,33.6,33,15.0,35.0,0.0,0.0,0.0,0.0,0,1013.7,1001.7,0,0,0,0,0.79,3.49,16.0,21.3,352,5,38.2,32.7,23.0,19.9,17.4,0.161,0.202,0.253,0.323,1,3600.0,923.5,815.2,108.2,888.2,923.5,1214.6,947.0,836.0,111.0,888.2,947.0,1245.5,Tracheophyta; Eucalyptus L'Hér.; Magnoliopsida; Pinus pinea L.; Pinus pinaster Aiton; Pinales; Vitis vinifera L.; 
2021,2021-07-10,Lisboa,Alenquer,Cabanas de Torres,Rua mato grande (Paula),39.1474590004815,-9.07238599989149,Desconhecida,141.0,2021-07-10T15:00,32.9,32,13.8,32.0,0.0,0.0,0.0,0.0,0,1014.0,998.2,0,0,0,0,0.77,3.42,24.2,29.9,349,351,45.4,37.3,24.2,21.1,17.8,0.081,0.159,0.222,0.249,1,3600.0,825.8,721.6,104.2,870.3,825.8,1097.2,872.0,762.0,110.0,870.3,872.0,1158.6,Tracheophyta; Vitis vinifera L.; Magnoliopsida
2021,2021-07-10,Lisboa,Sintra,Mira-sintra,Mira Sintra,38.7841700000233,-9.30351199997796,Desconhecida,161.0,2021-07-10T15:00,32.5,33,14.3,33.0,0.0,0.0,0.0,0.0,0,1013.8,995.8,0,0,0,0,0.74,3.27,18.0,24.5,359,4,42.8,31.3,22.3,19.1,16.7,0.158,0.204,0.255,0.347,1,3600.0,832.8,729.5,103.3,876.3,832.8,1101.6,879.0,770.0,109.0,876.3,879.0,1162.8,Tracheophyta; Magnoliopsida; Pinales; Pinus pinaster Aiton
2021,2021-07-10,Lisboa,Loures,São João da Talha,Rua ALMADA NEGREIROS (A1-S-N Km 5),38.8247829998864,-9.0980650001102,Desconhecida,73.0,2021-07-10T20:00,25.2,42,11.2,21.1,0.0,0.0,0.0,0.0,0,1012.7,1004.3,0,0,0,0,0.25,1.87,30.9,49.0,343,346,55.8,31.5,27.2,22.0,18.5,0.1,0.168,0.223,0.182,1,2052.7,0.0,0.0,0.0,0.0,0.0,0.0,48.0,25.0,23.0,199.0,48.0,113.8,Tracheophyta; Magnoliopsida; Olea europaea L.; 
2021,2021-07-10,Lisboa,Sintra,Rio de Mouro,Rua Joaquim Correia de Freitas (RIO DE MOURO),38.7715299998389,-9.32442000018226,Desconhecida,125.0,2021-07-10T21:00,21.9,49,10.6,18.0,0.0,0.0,0.0,0.0,0,1013.3,998.8,0,0,0,0,0.17,1.35,28.1,49.8,1,5,56.5,25.4,24.0,19.5,17.0,0.155,0.204,0.255,0.347,0,0.0,0.0,0.0,0.0,0.0,0.0,0.0,0.0,0.0,0.0,0.0,0.0,0.0,Tracheophyta; Magnoliopsida; Pinales; 
2021,2021-07-10,Lisboa,Sintra,Rio de Mouro,FRANCOS (A-dos-Francos),38.7600199996101,-9.32838999960158,Desconhecida,110.0,2021-07-10T22:00,21.5,50,10.5,17.4,0.0,0.0,0.0,0.0,0,1013.5,1000.7,0,0,0,0,0.17,1.29,28.8,50.9,1,5,58.0,24.4,24.0,19.6,17.1,0.155,0.204,0.255,0.347,0,0.0,0.0,0.0,0.0,0.0,0.0,0.0,0.0,0.0,0.0,0.0,0.0,0.0,Tracheophyta; Magnoliopsida; Pinales; 
2021,2021-01-19,Lisboa,Cadaval,Cadaval,Casal Lameiras (EN115 (EN115) Km 25),39.2410070000754,-9.10199599994553,Desconhecida,115.0,2021-01-19T20:00,11.0,86,8.8,7.5,0.0,0.0,0.0,0.0,2,1016.7,1002.8,73,47,1,100,0.02,0.18,21.7,35.5,169,173,38.5,9.0,7.6,9.0,14.3,0.284,0.305,0.331,0.287,0,0.0,0.0,0.0,0.0,0.0,0.0,0.0,0.0,0.0,0.0,0.0,0.0,0.0,Magnoliopsida; Eucalyptus L'Hér.; Tracheophyta; Pinales
2021,2021-07-10,Lisboa,Cascais,Alcabideche,RUA SANTAREM 12 (Fontainhas),38.7146159998576,-9.41617700046963,Desconhecida,76.0,2021-07-10T22:00,22.7,44,9.8,18.3,0.0,0.0,0.0,0.0,0,1012.8,1004.0,0,0,0,0,0.2,1.54,29.5,50.9,1,4,58.0,25.9,25.3,20.2,17.6,0.157,0.201,0.253,0.323,0,0.0,0.0,0.0,0.0,0.0,0.0,0.0,0.0,0.0,0.0,0.0,0.0,0.0,Tracheophyta; Eucalyptus L'Hér.; Magnoliopsida; Pinus pinea L.; Pinus pinaster Aiton; Pinales; Vitis vinifera L.; 
2021,2021-07-10,Lisboa,Amadora,Falagueira,Rua das Oliveiras (Falagueira),38.7633350001441,-9.2226379998525,Desconhecida,127.0,2021-07-10T22:00,23.1,43,9.7,19.0,0.0,0.0,0.0,0.0,0,1013.1,998.4,0,0,0,0,0.2,1.62,27.5,48.1,349,354,53.6,26.2,25.5,20.4,17.5,0.14,0.186,0.242,0.31,0,0.0,0.0,0.0,0.0,0.0,0.0,0.0,0.0,0.0,0.0,0.0,0.0,0.0,Tracheophyta; 
2021,2021-07-10,Lisboa,Cadaval,Lamas,Estrada Principal (Ventosa),39.2005199999942,-9.08235399987963,Desconhecida,118.0,2021-07-10T23:00,20.1,61,12.2,17.1,0.0,0.0,0.0,0.0,0,1013.9,1000.1,0,0,0,0,0.11,0.93,25.2,43.7,343,351,59.4,24.0,25.3,21.1,17.8,0.083,0.167,0.237,0.289,0,0.0,0.0,0.0,0.0,0.0,0.0,0.0,0.0,0.0,0.0,0.0,0.0,0.0,Eucalyptus L'Hér.; Magnoliopsida; Tracheophyta; Pinales; Vitis vinifera L.; Olea europaea L.; Pinus pinaster Aiton; Castanea sativa Mill.; 
2021,2021-07-11,Lisboa,Vila Franca de Xira,Vialonga,Rua 29 de Dezembro (Mogos),38.8775,-9.09056000020769,Desconhecida,104.0,2021-07-11T12:00,27.2,46,14.7,26.8,0.0,0.0,0.0,0.0,0,1015.1,1003.2,0,0,0,0,0.65,1.94,24.6,32.1,339,340,58.7,30.8,25.1,21.8,18.0,0.082,0.154,0.204,0.145,1,3600.0,928.7,778.7,150.0,824.1,928.7,1250.4,904.0,758.0,146.0,824.1,904.0,1217.1,Tracheophyta; Magnoliopsida; Pinus pinea L.; Olea europaea L.; Pinus pinaster Aiton; Pinales; 
2021,2021-07-12,Lisboa,Loures,Lousa,Lousa  - Saida AE-8 (Casal da Coitana),38.9076850001017,-9.20774999989404,Desconhecida,246.0,2021-07-12T01:00,14.7,91,13.2,11.8,0.0,0.0,0.0,0.0,2,1020.0,990.7,54,60,0,0,0.01,0.15,26.9,40.9,334,336,49.0,18.5,23.2,20.1,16.9,0.093,0.18,0.25,0.334,0,0.0,0.0,0.0,0.0,0.0,0.0,0.0,0.0,0.0,0.0,0.0,0.0,0.0,Tracheophyta; Magnoliopsida; Pinus pinaster Aiton; Eucalyptus L'Hér.; Pinales; ; Pinus pinea L.
2021,2021-07-12,Lisboa,Loures,Lousa,Lousa (Casal da Coitana),38.9080600002077,-9.20889000044929,Desconhecida,244.0,2021-07-12T08:00,17.1,69,11.4,13.2,0.0,0.0,0.0,0.0,1,1021.4,992.6,30,33,0,0,0.18,0.6,29.7,40.9,341,342,55.1,18.5,21.5,20.2,16.9,0.094,0.18,0.25,0.334,1,3600.0,350.6,235.4,115.2,496.7,350.6,627.1,283.0,190.0,93.0,496.7,283.0,506.2,Tracheophyta; Magnoliopsida; Pinus pinaster Aiton; Eucalyptus L'Hér.; Pinales; ; Pinus pinea L.
2021,2021-07-12,Lisboa,Alenquer,Aldeia Galega da Merceana,RUA 1 MAIO / EN-115 (EN115 (EN115) Km 46),39.0952079995473,-9.11200000021193,Desconhecida,105.0,2021-07-12T10:00,20.2,52,10.1,16.7,0.0,0.0,0.0,0.0,3,1022.3,1009.9,88,98,0,0,0.4,1.13,27.1,35.0,343,343,51.1,23.3,22.5,21.3,17.9,0.082,0.176,0.247,0.307,1,3600.0,699.0,549.1,149.9,701.9,699.0,1035.4,639.0,502.0,137.0,701.9,639.0,946.5,Tracheophyta; Vitis vinifera L.; Magnoliopsida
2021,2021-07-12,Lisboa,Oeiras,Barcarena,R ALFREDO INACIO RAMOS DA SILVA (Caruncho),38.7431279998355,-9.26606900003221,Desconhecida,115.0,2021-07-12T12:00,22.2,46,10.1,20.6,0.0,0.0,0.0,0.0,1,1022.5,1009.0,32,36,0,0,0.58,1.44,23.1,31.3,346,345,52.2,24.8,22.3,21.0,17.7,0.144,0.187,0.242,0.309,1,3600.0,958.8,837.6,121.3,886.7,958.8,1250.1,933.0,815.0,118.0,886.7,933.0,1216.4,Tracheophyta; Magnoliopsida; Pinus pinea L.; Vitis vinifera L.; Eucalyptus L'Hér.; Olea europaea L.; Pinus pinaster Aiton
2021,2021-07-12,Lisboa,Loures,Santo António Dos Cavaleiros,PCTA DUQUE DE LAFOES (Santo António dos Cavaleiros),38.8136099995507,-9.16444000032213,NC,105.0,2021-07-12T13:00,22.2,47,10.5,20.0,0.0,0.0,0.0,0.0,1,1022.9,1010.6,40,45,0,0,0.55,1.4,25.8,35.2,337,338,58.0,25.8,22.3,20.8,17.6,0.12,0.181,0.244,0.322,1,3600.0,866.9,635.7,231.2,666.0,866.9,1263.1,866.0,635.0,231.0,666.0,866.0,1261.8,Tracheophyta; Olea europaea L.; Magnoliopsida; 
2021,2021-07-12,Lisboa,Alenquer,Carregado,RUA SARAMAGO (Casal do Saramago),39.0346600000064,-8.96233199967278,Desconhecida,17.0,2021-07-12T15:00,22.1,50,11.1,18.6,0.0,0.0,0.0,0.0,1,1022.6,1020.6,35,39,0,0,0.44,1.34,28.6,36.6,337,337,54.0,30.2,24.7,22.6,18.7,0.08,0.151,0.198,0.225,1,3600.0,582.3,477.2,105.1,576.3,582.3,1095.9,615.0,504.0,111.0,576.3,615.0,1157.5,Tracheophyta; Vitis vinifera L.; Magnoliopsida
2021,2021-07-12,Lisboa,Alenquer,Abrigada,Quinta da Vassala (IC2 (IC2) Km 51),39.1744870000415,-9.00102700001664,Desconhecida,140.0,2021-07-12T20:00,16.1,81,12.9,13.5,0.0,0.0,0.0,0.0,0,1023.3,1006.5,11,12,0,0,0.05,0.34,24.7,36.2,344,345,67.3,23.5,23.7,21.2,17.8,0.082,0.166,0.235,0.288,1,2041.9,0.0,0.0,0.0,0.0,0.0,0.0,48.0,24.0,24.0,191.7,48.0,113.1,Eucalyptus L'Hér.; Tracheophyta
2021,2021-07-12,Lisboa,Alenquer,Abrigada,Estrada de Abrigada/Cabanas do Chão (Vale de santarém),39.1322630002764,-9.04945700009664,Desconhecida,99.0,2021-07-12T23:00,15.5,85,13.1,12.9,0.0,0.0,0.0,0.0,0,1024.5,1012.6,0,0,0,0,0.03,0.26,24.9,37.3,342,345,42.1,20.0,23.9,21.8,18.2,0.081,0.158,0.22,0.249,0,0.0,0.0,0.0,0.0,0.0,0.0,0.0,0.0,0.0,0.0,0.0,0.0,0.0,Tracheophyta; Vitis vinifera L.; Magnoliopsida; Eucalyptus L'Hér.; Pinus pinea L.
2021,2021-07-13,Lisboa,Alenquer,Abrigada,Cabanas do Chão,39.1422759999169,-9.04455799950494,Desconhecida,91.0,2021-07-13T09:00,19.5,55,10.3,15.6,0.0,0.0,0.0,0.0,0,1023.9,1013.1,0,0,0,0,0.33,1.02,27.9,35.8,353,354,49.7,20.5,21.8,21.8,18.3,0.081,0.158,0.22,0.249,1,3600.0,589.1,481.3,107.7,749.1,589.1,850.4,514.0,420.0,94.0,749.1,514.0,742.0,Magnoliopsida; Eucalyptus L'Hér.; Tracheophyta; Vitis vinifera L.; Olea europaea L.
2021,2021-07-13,Lisboa,Lisboa,Carnide,CARNIDE (Rua Guiomar Torresão),38.7573160001967,-9.19148599995507,NC,84.0,2021-07-13T11:00,23.2,42,9.6,21.0,0.0,0.0,0.0,0.0,0,1023.1,1013.2,0,0,0,0,0.55,1.65,23.4,32.1,3,2,51.5,23.3,21.1,21.1,18.0,0.139,0.185,0.242,0.309,1,3600.0,872.5,755.1,117.4,853.3,872.5,1171.2,825.0,714.0,111.0,853.3,825.0,1107.4,Tracheophyta; Magnoliopsida
