year,date,district,municipality,parish,local,latitude,longitude,cause,elevation,hourly.time,hourly.temperature_2m,hourly.relative_humidity_2m,hourly.dew_point_2m,hourly.apparent_temperature,hourly.precipitation,hourly.rain,hourly.snowfall,hourly.snow_depth,hourly.weather_code,hourly.pressure_msl,hourly.surface_pressure,hourly.cloud_cover,hourly.cloud_cover_low,hourly.cloud_cover_mid,hourly.cloud_cover_high,hourly.et0_fao_evapotranspiration,hourly.vapour_pressure_deficit,hourly.wind_speed_10m,hourly.wind_speed_100m,hourly.wind_direction_10m,hourly.wind_direction_100m,hourly.wind_gusts_10m,hourly.soil_temperature_0_to_7cm,hourly.soil_temperature_7_to_28cm,hourly.soil_temperature_28_to_100cm,hourly.soil_temperature_100_to_255cm,hourly.soil_moisture_0_to_7cm,hourly.soil_moisture_7_to_28cm,hourly.soil_moisture_28_to_100cm,hourly.soil_moisture_100_to_255cm,hourly.is_day,hourly.sunshine_duration,hourly.shortwave_radiation_instant,hourly.direct_radiation_instant,hourly.diffuse_radiation_instant,hourly.direct_normal_irradiance_instant,hourly.global_tilted_irradiance_instant,hourly.terrestrial_radiation_instant,hourly.shortwave_radiation,hourly.direct_radiation,hourly.diffuse_radiation,hourly.direct_normal_irradiance,hourly.global_tilted_irradiance,hourly.terrestrial_radiation,scientificNames
2021,2021-06-17,Viseu,Viseu,São João de Lourosa,R CELAO 51 TEIVAS 3500-883_VISEU 182327: ESTE (EN231 (IC37) Km 4),40.618871999979,-7.91722699999809,Desconhecida,423.0,2021-06-17T03:00,15.5,96,14.8,16.3,0.0,0.0,0.0,0.0,1,1010.8,961.7,38,30,3,29,0.0,0.08,5.8,6.1,176,180,11.9,19.0,22.2,19.7,14.2,0.161,0.213,0.256,0.35,0,0.0,0.0,0.0,0.0,0.0,0.0,0.0,0.0,0.0,0.0,0.0,0.0,0.0,Vitis vinifera L.; Pinus pinaster Aiton; Magnoliopsida; Tracheophyta; Olea europaea L.
2021,2021-07-10,Viseu,Viseu,São Pedro de France,EN229-reta Barraca (Barraca),40.7239350001017,-7.80577199988895,Desconhecida,665.0,2021-07-10T19:00,28.5,38,12.9,27.8,0.0,0.0,0.0,0.0,0,1014.4,941.3,0,0,0,0,0.21,2.4,10.6,18.4,336,343,21.6,31.3,23.7,18.0,14.4,0.099,0.167,0.223,0.337,1,3600.0,136.3,99.6,36.7,571.7,136.3,230.5,208.0,152.0,56.0,571.7,208.0,351.8,Magnoliopsida; Pinus pinaster Aiton; Olea europaea L.; Tracheophyta
2021,2021-07-11,Viseu,Castro Daire,Reriz,RERIZ 3600-598_CASTRO_DAIRE 180327: @JUNTA DE FREGUESIA DE RERIZ (JUNTA_2013#700449) (RERIZ),40.9017650000254,-7.99417000028822,Desconhecida,303.0,2021-07-11T01:00,19.3,83,16.3,20.8,0.0,0.0,0.0,0.0,0,1014.7,979.5,0,0,0,0,0.0,0.39,5.1,4.4,356,351,13.0,22.6,24.4,19.7,16.3,0.108,0.184,0.25,0.352,0,0.0,0.0,0.0,0.0,0.0,0.0,0.0,0.0,0.0,0.0,0.0,0.0,0.0,Pinus pinaster Aiton; Quercus L.; Magnoliopsida; Eucalyptus L'Hér.; Castanea sativa Mill.; Tracheophyta
2021,2021-07-18,Viseu,Viseu,Torredeita,Varzea (Ribeiro do Farreco),40.6355200000604,-8.02735299958123,Desconhecida,419.0,2021-07-18T09:00,24.4,58,15.5,26.1,0.0,0.0,0.0,0.0,0,1018.9,971.3,0,0,0,0,0.33,1.29,1.1,1.4,252,270,12.2,25.0,24.5,20.4,16.0,0.098,0.15,0.217,0.337,1,3600.0,578.8,482.9,95.9,750.5,578.8,852.0,507.0,423.0,84.0,750.5,507.0,746.4,Pinus pinaster Aiton; Tracheophyta; Magnoliopsida; Eucalyptus L'Hér.; Pinus pinea L.
2021,2021-07-21,Viseu,Vila Nova de Paiva,Queiriga,SANTA BÁRBARA DO CARVALHAL,40.8183333333333,-7.71138888888889,Reacendimento,798.0,2021-07-21T16:00,29.2,37,13.2,29.4,0.0,0.0,0.0,0.0,0,1016.4,929.5,0,0,0,0,0.57,2.54,13.1,16.3,238,239,30.6,32.1,23.2,19.7,14.5,0.11,0.171,0.248,0.342,1,3600.0,665.7,581.9,83.8,860.3,665.7,896.0,731.0,639.0,92.0,860.3,731.0,984.0,Eucalyptus L'Hér.; Magnoliopsida; Tracheophyta; Pinus pinaster Aiton; 
2021,2021-07-21,Viseu,Vila Nova de Paiva,Queiriga,SANTA BÁRBARA DO CARVALHAL,40.8183333333333,-7.71138888888889,Reacendimento,798.0,2021-07-21T16:00,29.2,37,13.2,29.4,0.0,0.0,0.0,0.0,0,1016.4,929.5,0,0,0,0,0.57,2.54,13.1,16.3,238,239,30.6,32.1,23.2,19.7,14.5,0.11,0.171,0.248,0.342,1,3600.0,665.7,581.9,83.8,860.3,665.7,896.0,731.0,639.0,92.0,860.3,731.0,984.0,Eucalyptus L'Hér.; Magnoliopsida; Tracheophyta; Pinus pinaster Aiton; 
2021,2021-07-22,Viseu,Sernancelhe,Ferreirim,FERREIRIM (Quinta das Felgueiras),40.9562100002501,-7.47675200038486,Desconhecida,739.0,2021-07-22T15:00,30.3,22,6.2,28.5,0.0,0.0,0.0,0.0,0,1015.4,934.9,10,0,0,35,0.72,3.36,16.8,22.1,227,226,41.4,34.2,25.2,21.0,15.3,0.117,0.137,0.176,0.31,1,3600.0,819.2,727.6,91.5,909.9,819.2,1059.6,868.0,771.0,97.0,909.9,868.0,1122.7,Magnoliopsida; Pinales; Vitis vinifera L.; Castanea sativa Mill.; Tracheophyta; Quercus L.; Pinus pinaster Aiton; Olea europaea L.; 
2021,2021-07-23,Viseu,Viseu,Vila Chã de Sá,VILA CHÃ DE SÁ (Casal de Além),40.6089670001136,-7.96282700008816,Desconhecida,415.0,2021-07-23T22:00,15.7,85,13.1,15.8,0.0,0.0,0.0,0.0,0,1016.9,968.4,0,0,0,0,0.0,0.27,5.8,13.7,330,330,19.4,21.6,23.9,21.8,16.8,0.086,0.137,0.201,0.329,0,0.0,0.0,0.0,0.0,0.0,0.0,0.0,0.0,0.0,0.0,0.0,0.0,0.0,Tracheophyta; Pinus pinaster Aiton; Magnoliopsida; Vitis vinifera L.; Olea europaea L.
2021,2021-07-25,Viseu,Sernancelhe,Fonte Arcada,FREIXINHO 181819 (Esgondinho),40.9590549998813,-7.52073199987411,Desconhecida,639.0,2021-07-25T12:00,20.3,72,15.1,21.4,0.2,0.2,0.0,0.0,51,1015.0,942.7,100,100,35,0,0.43,0.66,10.1,12.7,264,263,26.3,21.7,21.6,21.6,16.2,0.144,0.137,0.176,0.309,1,3600.0,730.9,453.1,277.8,491.4,730.9,1222.3,713.0,442.0,271.0,491.4,713.0,1192.4,Magnoliopsida; Pinus pinaster Aiton; Tracheophyta; Pinales; Castanea sativa Mill.; Olea europaea L.; Quercus L.; Vitis vinifera L.; 
2021,2021-07-26,Viseu,Castro Daire,Castro Daire,VILA POUCA,40.9180430000358,-7.91707900000943,Desconhecida,719.0,2021-07-26T16:00,23.2,59,14.8,23.8,0.0,0.0,0.0,0.0,0,1016.2,936.0,1,1,0,0,0.46,1.15,13.0,17.1,316,316,37.8,27.1,19.8,18.4,14.7,0.149,0.177,0.262,0.352,1,3600.0,650.9,565.3,85.6,841.4,650.9,890.9,715.0,621.0,94.0,841.4,715.0,978.7,Pinus pinaster Aiton; Magnoliopsida; Pinales; Eucalyptus L'Hér.; Tracheophyta
2021,2021-07-28,Viseu,Castro Daire,Castro Daire,FOLGOSA (Quinta da Folgosinha),40.8901570002238,-7.90861700005001,Desconhecida,522.0,2021-07-28T08:00,20.5,60,12.6,20.4,0.0,0.0,0.0,0.0,0,1014.8,955.3,0,0,0,0,0.19,0.96,6.2,9.2,54,51,19.4,18.8,21.1,20.3,16.3,0.114,0.151,0.225,0.339,1,3600.0,394.2,309.6,84.6,672.6,394.2,610.6,317.0,249.0,68.0,672.6,317.0,491.0,Pinus pinaster Aiton; Tracheophyta; Magnoliopsida; Pinales
2021,2021-08-08,Viseu,Mangualde,Fornos de Maceira Dão,FORNOS DE MACEIRA DÃO (Quinta da Tapada),40.6107419999441,-7.81526499960158,Desconhecida,415.0,2021-08-08T22:00,18.1,58,9.8,16.6,0.0,0.0,0.0,0.0,0,1016.4,968.3,0,0,0,0,0.05,0.87,10.0,13.2,232,235,19.1,24.1,24.6,22.1,18.6,0.084,0.153,0.215,0.324,0,0.0,0.0,0.0,0.0,0.0,0.0,0.0,0.0,0.0,0.0,0.0,0.0,0.0,Pinus pinaster Aiton; Tracheophyta; Pinales; Magnoliopsida
2021,2021-08-11,Viseu,Cinfães,Souselo,TRAVANCA (Fernandes),41.0539270000988,-8.23664299991396,Desconhecida,63.0,2021-08-11T02:00,17.7,91,16.1,19.3,0.0,0.0,0.0,0.0,0,1016.8,1009.3,0,0,0,0,0.0,0.19,3.0,1.5,166,166,5.0,19.4,22.8,21.0,18.9,0.128,0.163,0.231,0.331,0,0.0,0.0,0.0,0.0,0.0,0.0,0.0,0.0,0.0,0.0,0.0,0.0,0.0,Tracheophyta; Magnoliopsida; Pinus pinaster Aiton; Vitis vinifera L.; Quercus L.
2021,2021-08-15,Viseu,Viseu,São João de Lourosa,CABANÕES (Cabanões de Baixo),40.6279819997152,-7.91588699976603,Desconhecida,433.0,2021-08-15T14:00,33.9,16,5.0,33.3,0.0,0.0,0.0,0.0,0,1017.1,969.5,0,0,0,0,0.73,4.41,9.3,10.9,257,261,26.3,35.4,25.4,22.4,18.4,0.093,0.153,0.214,0.323,1,3600.0,867.7,763.0,104.7,903.9,867.7,1125.7,895.0,787.0,108.0,903.9,895.0,1161.1,Pinus pinaster Aiton; Tracheophyta; Magnoliopsida; Vitis vinifera L.
2021,2021-08-16,Viseu,Viseu,Vila Chã de Sá,VILA_CHA_DE_SA (Ribeira do Rebordinho),40.6089329995049,-7.94540799988641,Desconhecida,397.0,2021-08-16T12:00,31.0,22,6.6,30.4,0.0,0.0,0.0,0.0,0,1019.7,975.4,0,0,0,0,0.7,3.53,11.2,13.8,21,20,34.2,30.2,24.8,22.8,18.7,0.093,0.152,0.214,0.323,1,3600.0,901.8,790.9,110.9,896.8,901.8,1176.4,878.0,770.0,108.0,896.8,878.0,1145.4,Pinus pinaster Aiton; Tracheophyta; Magnoliopsida; Olea europaea L.
2021,2021-08-16,Viseu,Cinfães,Santiago de Piães,SANTIAGO_DE_PIAES 4690_CINFAES 180412: @JUNTA DE FREGUESIA DE SANTIAGO DE PIAES (JUNTA_2013#703508) (SANTIAGO DE PIÃES),41.0668229999973,-8.15443900002374,Desconhecida,418.0,2021-08-16T14:00,29.9,33,11.9,30.7,0.0,0.0,0.0,0.0,0,1020.5,973.7,0,0,0,0,0.67,2.83,10.9,14.0,314,316,32.4,30.5,22.5,20.2,17.1,0.15,0.152,0.216,0.343,1,3600.0,845.6,743.8,101.8,886.8,845.6,1119.0,872.0,767.0,105.0,886.8,872.0,1153.8,Magnoliopsida; Pinus pinaster Aiton; Quercus L.; Tracheophyta; Eucalyptus L'Hér.; Castanea sativa Mill.; 
2021,2021-08-16,Viseu,Viseu,São Pedro de France,TRAVASSOS (Eira),40.7241629997889,-7.79162000020345,Desconhecida,562.0,2021-08-16T19:00,27.3,32,9.1,25.0,0.0,0.0,0.0,0.0,0,1019.1,956.4,0,0,0,0,0.2,2.48,14.2,24.3,324,328,38.2,31.4,26.1,21.9,17.8,0.099,0.131,0.191,0.314,1,3600.0,49.6,30.6,19.0,351.4,49.6,97.4,115.0,71.0,44.0,419.5,115.0,225.8,Pinus pinaster Aiton; Magnoliopsida
2021,2021-08-17,Viseu,Viseu,Rio de Loba,Póvoa de Sobrinhos (VALE DA SERRA),40.6632619995541,-7.86692500000199,Desconhecida,526.0,2021-08-17T08:00,20.2,41,6.5,16.0,0.0,0.0,0.0,0.0,0,1022.1,961.7,0,0,0,0,0.26,1.39,22.4,30.8,64,64,40.0,21.0,25.3,23.3,18.9,0.066,0.149,0.223,0.328,1,3600.0,342.3,253.5,88.8,610.2,342.3,554.5,266.0,197.0,69.0,610.2,266.0,430.8,Magnoliopsida; Pinus pinaster Aiton; Tracheophyta
2021,2021-08-19,Viseu,Mangualde,Espinho,Estradão de Sta. Luzia (Trou),40.5694269998868,-7.78341800000105,Desconhecida,408.0,2021-08-19T02:00,16.6,74,11.9,17.0,0.0,0.0,0.0,0.0,0,1015.0,967.5,0,0,0,0,0.0,0.5,1.3,4.0,304,207,5.8,21.3,26.5,23.6,19.3,0.083,0.145,0.208,0.32,0,0.0,0.0,0.0,0.0,0.0,0.0,0.0,0.0,0.0,0.0,0.0,0.0,0.0,Eucalyptus L'Hér.; Magnoliopsida; Pinus pinaster Aiton; Tracheophyta; Olea europaea L.
2021,2021-08-20,Viseu,Cinfães,São Cristovão de Nogueira,Sampaio,41.0672979999913,-8.11009300020006,Desconhecida,427.0,2021-08-20T18:00,20.7,62,13.2,19.9,0.0,0.0,0.0,0.0,0,1017.2,968.2,0,0,0,0,0.2,0.92,12.4,16.9,280,281,35.3,27.5,23.1,20.7,17.3,0.132,0.147,0.209,0.341,1,3600.0,212.6,162.9,49.7,643.4,212.6,338.3,291.0,223.0,68.0,643.4,291.0,463.1,Quercus L.; Magnoliopsida; Tracheophyta; Pinus pinaster Aiton
2021,2021-08-21,Viseu,Cinfães,São Cristovão de Nogueira,Sampaio,41.0676419999864,-8.11325199974908,Reacendimento,373.0,2021-08-21T03:00,15.5,91,14.0,16.7,0.0,0.0,0.0,0.0,0,1018.9,975.1,0,0,0,0,0.0,0.16,0.8,2.5,117,352,8.3,17.1,22.4,21.1,17.7,0.131,0.146,0.209,0.341,0,0.0,0.0,0.0,0.0,0.0,0.0,0.0,0.0,0.0,0.0,0.0,0.0,0.0,Quercus L.; Magnoliopsida; Tracheophyta; Pinus pinaster Aiton
2021,2021-08-25,Viseu,Cinfães,São Cristovão de Nogueira,CÁDIZ (Outeiro-Cerdeira),41.055853000217,-8.13202500025431,Reacendimento,613.0,2021-08-25T13:00,28.2,41,13.7,29.5,0.0,0.0,0.0,0.0,1,1012.2,944.7,34,0,15,83,0.59,2.25,8.6,11.0,255,247,28.1,30.7,23.3,20.8,17.1,0.094,0.156,0.238,0.336,1,3600.0,784.6,624.1,160.5,728.6,784.6,1147.0,787.0,626.0,161.0,728.6,787.0,1150.5,Quercus L.; Magnoliopsida; Tracheophyta
2021,2021-08-30,Viseu,Viseu,Farminhão,FARMINHAO 3510-643_FARMINHAO 182336: @JUNTA DE FREGUESIA DE FARMINHAO (JUNTA#91103) (FARMINHÃO),40.6146600002713,-8.0129499997033,Desconhecida,385.0,2021-08-30T15:00,27.3,41,12.8,27.8,0.0,0.0,0.0,0.0,0,1013.0,969.8,0,0,0,0,0.54,2.16,10.5,13.0,276,276,27.0,32.8,24.2,23.4,19.6,0.094,0.138,0.183,0.304,1,3600.0,685.3,592.2,93.1,846.6,685.3,938.8,736.0,636.0,100.0,846.6,736.0,1008.3,Tracheophyta; Eucalyptus L'Hér.; Magnoliopsida; Pinus pinaster Aiton
2021,2021-08-31,Viseu,Castro Daire,Mões,Vale de Azia (Vale da Catarina),40.8808969995711,-7.87044199996524,Desconhecida,501.0,2021-08-31T15:00,28.8,32,10.5,27.9,0.0,0.0,0.0,0.0,1,1013.2,957.7,37,0,15,94,0.48,2.69,9.2,11.5,225,221,25.9,32.0,23.6,22.8,19.1,0.098,0.146,0.198,0.314,1,3600.0,547.1,352.6,194.5,509.0,547.1,930.2,588.0,379.0,209.0,509.0,588.0,999.8,Pinus pinaster Aiton; Castanea sativa Mill.; Magnoliopsida; Tracheophyta
2021,2021-09-01,Viseu,Penedono,Souto,QTA DO BESELGO (Rio Bom),41.0300180000729,-7.36490800009833,Natural,725.0,2021-09-01T03:00,16.5,88,14.5,17.3,0.0,0.0,0.0,0.0,1,1015.4,932.8,34,0,6,100,0.0,0.23,4.7,9.0,351,358,10.8,18.7,22.9,22.1,18.4,0.178,0.162,0.178,0.3,0,0.0,0.0,0.0,0.0,0.0,0.0,0.0,0.0,0.0,0.0,0.0,0.0,0.0,Pinales; Magnoliopsida; Tracheophyta; Pinus pinaster Aiton; Castanea sativa Mill.; Eucalyptus L'Hér.; ; Olea europaea L.
2021,2021-09-01,Viseu,Sernancelhe,Fonte Arcada,FONTE ARCADA (Vale),40.9688410000006,-7.51894000000424,Natural,693.0,2021-09-01T03:00,17.7,84,15.0,18.7,0.0,0.0,0.0,0.0,1,1015.5,936.7,38,0,13,100,0.0,0.33,4.7,12.6,9,13,13.3,19.5,23.7,22.6,18.6,0.148,0.144,0.17,0.296,0,0.0,0.0,0.0,0.0,0.0,0.0,0.0,0.0,0.0,0.0,0.0,0.0,0.0,Magnoliopsida; Pinus pinaster Aiton; Tracheophyta; Pinales; Castanea sativa Mill.; Olea europaea L.; Quercus L.; Vitis vinifera L.; 
2021,2021-09-01,Viseu,Armamar,Coura,ARICERA (Quinta da Sina),41.1053119998508,-7.63849199983809,Natural,535.0,2021-09-01T06:00,16.6,83,13.7,16.9,0.1,0.1,0.0,0.0,51,1015.6,953.9,28,0,29,36,0.0,0.32,6.2,9.6,97,77,17.6,17.7,23.0,22.9,19.2,0.154,0.152,0.172,0.301,1,0.0,0.0,0.0,0.0,0.0,0.0,0.0,0.0,0.0,0.0,0.0,0.0,0.0,Tracheophyta; Magnoliopsida; Olea europaea L.
2021,2021-09-01,Viseu,Armamar,Aricera,GOUJIM (Deveza),41.092345000373,-7.65092299997807,Natural,722.0,2021-09-01T07:00,15.6,88,13.7,15.9,0.5,0.5,0.0,0.0,53,1016.2,933.6,34,0,24,67,0.02,0.21,5.8,10.1,112,96,18.7,16.2,20.0,20.2,16.8,0.205,0.154,0.2,0.326,1,1246.1,77.5,35.6,41.9,191.0,53.2,250.4,37.0,17.0,20.0,131.2,37.0,119.5,Magnoliopsida; Tracheophyta
2021,2021-09-01,Viseu,Moimenta da Beira,Rua,Vide,40.9510929999749,-7.57017299996482,Natural,628.0,2021-09-01T11:00,23.0,60,14.8,24.5,0.2,0.2,0.0,0.0,51,1016.1,945.6,52,19,24,68,0.45,1.13,6.1,7.6,118,121,24.5,24.7,22.8,23.0,19.1,0.15,0.144,0.17,0.296,1,3600.0,719.3,560.1,159.1,714.8,719.3,1052.6,678.0,528.0,150.0,714.8,678.0,992.2,Tracheophyta; Magnoliopsida; Vitis vinifera L.; Olea europaea L.; Castanea sativa Mill.
2021,2021-09-01,Viseu,Castro Daire,Moledo,MOLEDO (Cruz da Pedra),40.8297149997287,-7.87705799950494,Desconhecida,530.0,2021-09-01T16:00,20.3,73,15.3,20.6,2.7,2.7,0.0,0.0,63,1015.7,955.3,74,30,28,100,0.17,0.64,9.9,13.7,289,293,23.8,23.9,22.7,22.2,18.6,0.284,0.146,0.183,0.306,1,944.0,202.6,50.4,152.2,91.5,202.6,740.8,229.0,57.0,172.0,91.5,229.0,837.2,Pinus pinaster Aiton; Magnoliopsida; Tracheophyta
2021,2021-09-01,Viseu,Tarouca,Várzea da Serra,VÁRZEA DA SERRA (Folgosa),40.9989140001933,-7.83956299993727,Natural,976.0,2021-09-01T16:00,16.8,84,14.2,16.8,1.1,1.1,0.0,0.0,55,1016.5,907.2,98,46,44,100,0.16,0.3,9.5,12.7,299,299,37.1,20.6,19.2,18.8,15.5,0.319,0.18,0.246,0.335,1,2298.49,246.1,75.2,170.8,136.6,246.1,739.8,278.0,85.0,193.0,136.6,278.0,835.9,Magnoliopsida; Eucalyptus L'Hér.; Tracheophyta; Castanea sativa Mill.; Pinus pinaster Aiton; Pinales
2021,2021-09-01,Viseu,São Pedro do Sul,Santa Cruz da Trapa,Landeira (Cavada),40.7938080003526,-8.14997699949476,Natural,679.0,2021-09-01T17:00,19.6,75,15.0,20.6,0.0,0.0,0.0,0.0,2,1016.0,939.2,71,22,35,100,0.11,0.58,4.3,5.9,318,317,29.2,23.8,21.8,20.7,17.3,0.138,0.137,0.201,0.322,1,0.0,126.6,20.4,106.2,53.0,126.6,517.9,155.0,25.0,130.0,53.0,155.0,633.9,Magnoliopsida; Pinus pinaster Aiton; Quercus L.; Vitis vinifera L.; Eucalyptus L'Hér.; Acacia Mill.; Tracheophyta; Castanea sativa Mill.; Quercus suber L.; 
2021,2021-09-02,Viseu,Viseu,Fragosela,PRIME 182315: @PRIME (LUGAR#119992) (Prado),40.6453100003137,-7.83833300007714,Natural,346.0,2021-09-02T15:00,24.3,65,17.2,25.7,0.0,0.0,0.0,0.0,0,1016.9,977.4,11,8,7,0,0.4,1.07,9.1,11.4,288,288,22.3,27.8,23.4,24.6,21.3,0.261,0.155,0.213,0.321,1,3600.0,545.4,340.0,205.3,495.9,545.4,921.5,587.0,366.0,221.0,495.9,587.0,991.9,Magnoliopsida; Vitis vinifera L.; Tracheophyta; Pinus pinaster Aiton
2021,2021-09-04,Viseu,Viseu,Fragosela,Prime (Prado),40.6448529995812,-7.83859200000763,Reacendimento,369.0,2021-09-04T14:00,28.2,34,10.7,28.6,0.0,0.0,0.0,0.0,1,1014.1,972.7,28,0,0,93,0.59,2.55,8.7,10.7,232,228,20.5,29.3,22.7,23.9,21.2,0.191,0.157,0.215,0.32,1,3600.0,759.2,621.5,137.8,801.6,759.2,1042.9,788.0,645.0,143.0,801.6,788.0,1082.4,Magnoliopsida; Vitis vinifera L.; Tracheophyta; Pinus pinaster Aiton
2021,2021-09-20,Viseu,Nelas,Vilar Seco,VILAR_SECO 3520_NELAS 180906: @JUNTA DE FREGUESIA DE VILAR SECO (JUNTA_2013#701666) (Quinta do Castelo),40.5601169999441,-7.83722999996609,Desconhecida,446.0,2021-09-20T11:00,21.0,52,10.7,18.3,0.0,0.0,0.0,0.0,0,1021.5,970.2,0,0,0,0,0.43,1.21,24.5,31.9,60,63,49.3,20.4,18.6,20.9,20.9,0.172,0.186,0.179,0.313,1,3600.0,720.7,623.9,96.9,867.2,720.7,976.0,677.0,586.0,91.0,867.2,677.0,916.7,Tracheophyta; Olea europaea L.; Magnoliopsida; Vitis vinifera L.; Pinus pinaster Aiton; Eucalyptus L'Hér.
2021,2021-09-22,Viseu,Oliveira de Frades,Sejães,VIDEIRA (Sequeirô),40.7457970004612,-8.19707200050354,Desconhecida,149.0,2021-09-22T23:00,15.2,68,9.4,13.7,0.0,0.0,0.0,0.0,0,1016.9,999.1,19,0,4,55,0.03,0.55,9.7,16.3,42,45,25.2,16.7,20.0,21.3,21.3,0.175,0.224,0.176,0.302,0,0.0,0.0,0.0,0.0,0.0,0.0,0.0,0.0,0.0,0.0,0.0,0.0,0.0,Eucalyptus L'Hér.; Pinus pinaster Aiton; Magnoliopsida; Tracheophyta; Quercus L.; Olea europaea L.
2021,2021-10-14,Viseu,Lamego,Várzea de Abrunhais,Portela,41.0731549999449,-7.75306699991226,Desconhecida,487.0,2021-10-14T13:00,20.5,46,8.4,19.2,0.0,0.0,0.0,0.0,1,1020.8,964.9,29,0,0,98,0.34,1.31,5.6,6.1,45,50,18.0,19.1,14.5,17.7,19.6,0.183,0.208,0.121,0.302,1,3600.0,521.9,243.2,278.7,381.8,521.9,876.2,530.0,247.0,283.0,381.8,530.0,889.8,Magnoliopsida; Acacia Mill.; Pinales; Olea europaea L.; Vitis vinifera L.; ; Castanea sativa Mill.; Quercus L.; Pinus pinaster Aiton
2021,2021-10-15,Viseu,Oliveira de Frades,Oliveira de Frades,FERREIROS 181009: @FERREIROS (LUGAR_INE#811588) (Travassos),40.7131659995185,-8.19278100013733,Desconhecida,489.0,2021-10-15T19:00,13.7,86,11.4,13.2,0.0,0.0,0.0,0.0,1,1020.2,962.8,28,0,1,91,0.0,0.22,6.7,8.9,286,313,17.6,17.1,16.6,17.1,18.8,0.193,0.246,0.181,0.295,0,0.0,0.0,0.0,0.0,0.0,0.0,0.0,0.0,0.0,0.0,0.0,0.0,0.0,Eucalyptus L'Hér.; Pinus pinaster Aiton; Magnoliopsida; Tracheophyta; Quercus L.; Olea europaea L.; 
2021,2021-11-19,Viseu,Moimenta da Beira,Sarzedo,SARZEDO,41.002635000017,-7.65559299998813,Reacendimento,769.0,2021-11-19T14:00,11.3,63,4.6,8.4,0.0,0.0,0.0,0.0,0,1022.8,933.3,0,0,0,0,0.21,0.49,10.7,14.0,57,61,26.3,10.3,6.5,10.3,15.8,0.239,0.253,0.194,0.297,1,3600.0,415.1,350.3,64.9,835.8,415.1,587.0,448.0,378.0,70.0,835.8,448.0,633.5,Quercus L.; Magnoliopsida; Pinus pinaster Aiton; Castanea sativa Mill.; Tracheophyta
2021,2021-11-20,Viseu,Castro Daire,Ermida,Codeçais,40.9369929999775,-7.9395789999432,Desconhecida,870.0,2021-11-20T11:00,11.0,70,5.7,7.9,0.0,0.0,0.0,0.0,1,1021.1,920.7,30,0,0,100,0.17,0.4,14.1,20.2,84,87,40.0,9.3,8.1,10.5,14.8,0.252,0.277,0.29,0.303,1,3600.0,403.5,289.8,113.7,646.1,403.5,628.4,369.0,265.0,104.0,646.1,369.0,574.7,Quercus L.; Tracheophyta; Magnoliopsida; Pinus pinaster Aiton
2021,2021-11-20,Viseu,Moimenta da Beira,Sarzedo,Beira Valente (SARZEDO),41.0028079999818,-7.65413499991099,Reacendimento,744.0,2021-11-20T23:00,5.6,91,4.3,3.4,0.0,0.0,0.0,0.0,0,1019.2,931.1,5,0,9,0,0.0,0.08,5.8,10.5,173,131,13.7,6.1,8.0,10.2,15.8,0.236,0.248,0.194,0.297,0,0.0,0.0,0.0,0.0,0.0,0.0,0.0,0.0,0.0,0.0,0.0,0.0,0.0,Quercus L.; Magnoliopsida; Pinus pinaster Aiton; Castanea sativa Mill.; Tracheophyta
2021,2021-03-07,Viseu,Castro Daire,Monteiras,MONTEIRAS (Carvalhal Verde),40.9613820001814,-7.83639699988895,Desconhecida,1015.0,2021-03-07T13:00,11.1,54,2.2,8.3,0.1,0.1,0.0,0.0,51,1017.4,901.8,58,31,51,0,0.26,0.61,7.4,9.3,256,257,21.2,10.3,6.6,7.1,7.1,0.366,0.371,0.394,0.419,1,3600.0,510.7,314.4,196.3,454.2,510.7,962.0,510.0,314.0,196.0,454.2,510.0,960.7,Tracheophyta; Pinus pinaster Aiton; Magnoliopsida; Eucalyptus L'Hér.
2021,2021-04-24,Coimbra,Penela,Penela (São Miguel),Tolica,40.0364079999924,-8.35221200002564,Natural,221.0,2021-04-24T16:00,17.6,76,13.3,16.1,0.1,0.1,0.0,0.0,51,1009.2,983.4,52,4,31,98,0.17,0.48,17.5,27.2,161,160,44.3,17.3,15.5,14.5,13.0,0.403,0.388,0.314,0.381,1,0.0,230.8,31.3,199.5,51.8,230.8,817.4,258.0,35.0,223.0,51.8,258.0,913.9,Eucalyptus L'Hér.; Quercus L.; Pinus pinaster Aiton; Olea europaea L.
2021,2021-04-24,Coimbra,Penela,Penela (São Miguel),TOLA 061407: @TOLA (LUGAR#130829) (Tola de Cima),40.0326500002543,-8.35334000004662,Natural,240.0,2021-04-24T16:00,17.5,76,13.2,15.9,0.1,0.1,0.0,0.0,51,1009.2,981.2,52,4,31,98,0.17,0.48,17.5,27.2,161,160,44.3,17.2,15.4,14.4,12.9,0.403,0.388,0.314,0.381,1,0.0,230.8,31.3,199.5,51.8,230.8,817.4,258.0,35.0,223.0,51.8,258.0,913.9,Pinus pinaster Aiton; Eucalyptus L'Hér.; Quercus L.; Olea europaea L.; Magnoliopsida
2021,2021-06-03,Coimbra,Figueira da Foz,Santana,Santana,40.2142359998491,-8.7404390001297,Desconhecida,25.0,2021-06-03T18:00,16.3,61,8.7,12.0,0.0,0.0,0.0,0.0,0,1021.7,1018.7,0,0,0,0,0.23,0.72,27.0,38.6,339,340,53.6,22.1,18.6,17.2,14.9,0.063,0.108,0.144,0.244,1,3600.0,310.8,242.4,68.4,697.1,310.8,462.3,391.0,305.0,86.0,697.1,391.0,581.6,Pinus pinaster Aiton; Eucalyptus L'Hér.; Magnoliopsida
2021,2021-06-12,Coimbra,Lousã,Lousã,Vale Nogueira (Arinto),40.1022929999563,-8.25742900000678,Natural,169.0,2021-06-12T10:00,27.7,41,13.1,26.8,0.0,0.0,0.0,0.0,1,1015.7,996.4,39,0,17,95,0.41,2.21,13.0,18.0,87,90,31.3,25.0,21.0,17.9,14.6,0.041,0.094,0.131,0.235,1,3600.0,519.8,273.5,246.3,340.0,519.8,1066.8,479.0,252.0,227.0,340.0,479.0,983.1,Magnoliopsida; Tracheophyta; Pinus pinaster Aiton; Olea europaea L.
2021,2021-06-12,Coimbra,Pampilhosa da Serra,Unhais-o-velho,Aradas (Roçadas),40.1413899999195,-7.7883300002416,Natural,913.0,2021-06-12T20:00,20.2,61,12.3,20.7,0.0,0.0,0.0,0.0,1,1017.6,915.9,32,0,3,99,0.02,0.93,1.8,1.8,90,127,10.4,21.2,19.5,15.0,10.7,0.167,0.235,0.31,0.372,1,240.27,0.0,0.0,0.0,0.0,0.0,0.0,32.0,9.0,23.0,75.4,32.0,101.9,Magnoliopsida; Pinus pinaster Aiton; Eucalyptus L'Hér.
2021,2021-06-15,Coimbra,Arganil,Cerdeira,Vinho (Portela),40.2638900004493,-7.94527999983893,Natural,284.0,2021-06-15T16:00,29.1,51,17.8,31.1,0.0,0.0,0.0,0.0,1,1012.3,980.4,32,0,16,73,0.39,1.98,5.5,6.4,293,297,25.6,28.8,22.7,18.8,14.5,0.187,0.205,0.278,0.359,1,3600.0,461.4,286.3,175.1,415.1,461.4,914.3,506.0,314.0,192.0,415.1,506.0,1002.7,Pinus pinaster Aiton; Olea europaea L.; Magnoliopsida; Tracheophyta; Eucalyptus L'Hér.; ; Vitis vinifera L.
2021,2021-07-07,Coimbra,Cantanhede,Sanguinheira,Olhos da Fervença (Pinhal do Mano),40.3503770000074,-8.7098810005188,Desconhecida,38.0,2021-07-07T20:00,16.6,84,13.9,15.1,0.0,0.0,0.0,0.0,0,1023.1,1018.5,2,1,0,2,0.04,0.3,19.1,30.9,344,345,42.5,21.5,21.2,19.2,16.6,0.075,0.094,0.107,0.226,1,2245.64,3.7,1.9,1.7,22.3,2.7,8.5,55.0,29.0,26.0,224.7,55.0,126.1,Pinus pinaster Aiton; Tracheophyta; Magnoliopsida; Eucalyptus L'Hér.; Acacia Mill.; 
2021,2021-07-29,Coimbra,Cantanhede,Cadima,R PRINCIPAL 108 OLHOS_DE_FERVENCA 3060-107_CADIMA 060203: PRX. (Olhos da Fervença),40.3493480004205,-8.69375100029839,Desconhecida,37.0,2021-07-29T16:00,21.3,62,13.7,19.6,0.0,0.0,0.0,0.0,0,1016.0,1011.6,0,0,0,0,0.42,0.96,25.0,34.1,332,334,52.6,28.2,22.2,20.3,17.7,0.054,0.07,0.094,0.215,1,3600.0,662.8,567.2,95.6,841.3,662.8,894.5,728.0,623.0,105.0,841.3,728.0,982.6,Eucalyptus L'Hér.; Tracheophyta; Vitis vinifera L.; Pinus pinaster Aiton; Magnoliopsida; Olea europaea L.; 
2021,2021-07-31,Coimbra,Pampilhosa da Serra,Fajão,Subestação Fajão (Fontainhas),40.1325,-7.9125,Desconhecida,902.0,2021-07-31T20:00,11.5,79,7.9,8.0,0.0,0.0,0.0,0.0,0,1019.5,915.9,0,0,0,0,0.04,0.29,20.1,32.1,317,318,51.8,18.9,19.6,18.5,14.8,0.093,0.177,0.26,0.355,0,444.49,0.0,0.0,0.0,0.0,0.0,0.0,24.0,11.0,13.0,108.4,24.0,76.2,Magnoliopsida; Eucalyptus L'Hér.
2021,2021-08-07,Coimbra,Condeixa-a-nova,Ega,Casal do Missa,40.11,-8.58555999994278,Desconhecida,101.0,2021-08-07T16:00,23.3,44,10.2,20.9,0.0,0.0,0.0,0.0,0,1015.0,1003.3,0,0,0,0,0.48,1.62,21.9,28.3,318,320,45.4,31.3,23.1,20.8,18.1,0.054,0.048,0.081,0.199,1,3600.0,630.4,534.4,96.0,819.7,630.4,867.1,696.0,590.0,106.0,819.7,696.0,957.4,Eucalyptus L'Hér.; Pinus pinaster Aiton; Magnoliopsida; Tracheophyta
2021,2021-08-22,Coimbra,Miranda do Corvo,Semide,SEMIDE,40.1596000003815,-8.33548999998305,Desconhecida,191.0,2021-08-22T17:00,27.8,45,14.9,27.8,0.0,0.0,0.0,0.0,0,1017.2,995.4,0,0,0,0,0.37,2.05,11.9,15.4,305,307,31.7,32.3,24.2,21.8,18.9,0.098,0.141,0.204,0.317,1,3600.0,387.6,314.1,73.5,723.9,387.6,580.3,464.0,376.0,88.0,723.9,464.0,694.7,Magnoliopsida; Eucalyptus L'Hér.; Pinus pinaster Aiton; Tracheophyta
2021,2021-08-29,Coimbra,Coimbra,Ameal,AMEAL (Porto do Ameal),40.1979149998559,-8.55168700006273,Reacendimento,5.0,2021-08-29T15:00,25.9,52,15.4,25.9,0.0,0.0,0.0,0.0,1,1015.1,1014.5,36,8,0,95,0.47,1.6,16.4,20.1,296,297,36.0,32.3,23.8,22.0,19.5,0.043,0.049,0.072,0.187,1,3600.0,609.2,427.3,181.9,601.1,609.2,953.6,653.0,458.0,195.0,601.1,653.0,1022.1,Oryza sativa L.; Tracheophyta
2021,2021-09-01,Coimbra,Góis,Cadafaz,Mestras,40.0942419995202,-8.07448099984063,Natural,628.0,2021-09-01T13:00,23.3,56,14.1,24.6,0.0,0.0,0.0,0.0,1,1014.7,944.3,43,12,5,98,0.46,1.26,6.2,7.1,249,246,21.2,23.0,21.4,20.8,17.6,0.311,0.143,0.211,0.328,1,3600.0,679.3,402.4,276.9,477.8,679.3,1131.2,682.0,404.0,278.0,477.8,682.0,1135.8,Eucalyptus L'Hér.; Magnoliopsida; Pinus pinaster Aiton
2021,2021-09-01,Coimbra,Góis,Góis,Povorais (EN2 (EN2) Km 285),40.1049799998601,-8.10663499991099,Natural,651.0,2021-09-01T14:00,21.2,65,14.4,21.5,6.0,6.0,0.0,0.0,63,1015.4,942.0,40,4,13,96,0.38,0.87,9.0,11.8,203,207,26.3,23.5,21.3,20.7,17.5,0.383,0.144,0.211,0.328,1,3600.0,571.2,276.9,294.3,349.4,571.2,1064.7,592.0,287.0,305.0,349.4,592.0,1103.5,Eucalyptus L'Hér.; Magnoliopsida
2021,2021-09-01,Coimbra,Arganil,Secarias,SECARIAS 3300-450_ARGANIL 060116: @JUNTA DE FREGUESIA DE SECARIAS (JUNTA_2013#701534) (ER342 (ER342) Km 97),40.2511100000143,-8.03360999999775,Natural,174.0,2021-09-01T15:00,23.1,68,17.0,23.7,2.4,2.4,0.0,0.0,61,1015.1,995.0,100,67,97,100,0.27,0.9,12.6,16.8,257,261,29.9,28.5,24.1,23.0,19.8,0.124,0.136,0.186,0.303,1,3177.35,341.4,115.4,226.1,165.9,341.4,934.1,367.0,124.0,243.0,165.9,367.0,1004.0,Eucalyptus L'Hér.; Magnoliopsida; Tracheophyta; Pinus pinaster Aiton; Olea europaea L.; 
