2023,2023-08-18,Porto,Baião,Mesquinhata,Rua da Tapadinha (Tapada),41.1368179999457,-8.104988000128,Desconhecida,371.0,2023-08-18T18:00,24.1,64,16.8,23.9,0.0,0.0,0.0,0.0,0,1015.9,973.7,3,0,0,11,0.22,1.09,17.5,24.6,256,252,40.7,29.1,24.3,22.1,18.8,0.094,0.153,0.224,0.319,1,3600.0,209.2,155.3,54.0,588.9,209.2,351.9,283.0,210.0,73.0,588.9,283.0,476.1,Magnoliopsida; Tracheophyta; Eucalyptus L'Hér.
2023,2023-08-18,Lisboa,Azambuja,Alcoentre,Vale Judeus (ZEMANEIRA),39.2286319997576,-8.9683529999521,Desconhecida,141.0,2023-08-18T18:00,26.2,55,16.3,25.7,0.0,0.0,0.0,0.0,1,1015.9,999.7,22,0,0,72,0.27,1.54,18.4,24.1,271,270,34.6,34.8,27.6,24.6,21.6,0.077,0.14,0.173,0.245,1,3600.0,214.7,157.7,57.0,580.3,214.7,362.8,290.0,213.0,77.0,580.3,290.0,490.0,Pinus pinaster Aiton; Tracheophyta; Eucalyptus L'Hér.; Pinales; Pinus pinea L.; Vitis vinifera L.
2023,2023-08-18,Viana do Castelo,Ponte da Barca,Grovelas,Soutelo (Igreja),41.748260000017,-8.43956700007121,Reacendimento,400.0,2023-08-18T19:00,20.5,88,18.5,21.3,0.5,0.5,0.0,0.0,53,1016.0,970.0,97,100,8,8,0.05,0.28,15.8,23.3,207,207,43.2,24.3,22.6,20.9,17.8,0.124,0.169,0.256,0.339,1,2556.32,29.1,11.2,17.9,128.5,29.1,103.0,65.0,25.0,40.0,145.2,65.0,229.8,Vitis vinifera L.; Magnoliopsida; Pinus pinaster Aiton
2023,2023-08-18,Aveiro,Santa Maria da Feira,Feira,Rua Sto André (Santo André),40.9328149996864,-8.55413300010893,Desconhecida,162.0,2023-08-18T19:00,20.7,88,18.6,21.7,0.1,0.1,0.0,0.0,51,1016.3,997.4,97,83,0,75,0.06,0.3,15.0,22.9,204,208,34.6,27.6,24.3,21.8,19.2,0.053,0.064,0.086,0.204,1,3600.0,44.1,21.8,22.3,250.5,44.1,103.1,99.0,49.0,50.0,282.6,99.0,231.5,Eucalyptus L'Hér.; Tracheophyta; Magnoliopsida
2023,2023-08-18,Porto,Felgueiras,Revinhade,Lugar da Boa Vista (Devesa),41.3422180000941,-8.25909299956428,Desconhecida,446.0,2023-08-18T19:00,21.6,77,17.3,21.6,0.0,0.0,0.0,0.0,2,1016.4,965.4,78,67,0,58,0.09,0.6,17.8,26.0,234,233,40.0,26.2,23.4,21.5,18.2,0.101,0.151,0.228,0.32,1,3600.0,36.9,17.8,19.1,204.3,36.9,97.9,85.0,41.0,44.0,242.8,85.0,225.4,Tracheophyta; Pinus pinaster Aiton; Eucalyptus L'Hér.; Magnoliopsida; Vitis vinifera L.
2023,2023-08-18,Faro,Loulé,Almansil,Rua Sacadura Cabral (Areias de Almansil),37.0689500000742,-8.01947000000212,Reacendimento,42.0,2023-08-18T21:00,26.0,57,16.9,26.2,0.0,0.0,0.0,0.0,0,1015.9,1011.0,0,0,0,0,0.1,1.45,15.6,28.3,337,342,30.6,30.3,30.3,28.7,23.5,0.103,0.129,0.136,0.121,0,0.0,0.0,0.0,0.0,0.0,0.0,0.0,0.0,0.0,0.0,0.0,0.0,0.0,Tracheophyta; Magnoliopsida; Pinus pinea L.
2023,2023-08-19,Lisboa,Sintra,Terrugem,Armés (Ribeira de Fervença),38.8494549994998,-9.34950400034587,Desconhecida,114.0,2023-08-19T01:00,20.3,100,20.3,23.8,0.0,0.0,0.0,0.0,3,1017.5,1004.1,90,100,0,0,0.0,0.0,3.8,10.1,253,270,7.9,22.7,24.6,22.6,20.1,0.121,0.165,0.211,0.316,0,0.0,0.0,0.0,0.0,0.0,0.0,0.0,0.0,0.0,0.0,0.0,0.0,0.0,Tracheophyta; Magnoliopsida; Pinus pinaster Aiton; Pinus pinea L.; Vitis vinifera L.; Pinales; Olea europaea L.; 
2023,2023-08-19,Porto,Amarante,Louredo,LOUREDO (Outeiro),41.2541070000331,-8.11643099996779,Reacendimento,282.0,2023-08-19T11:00,27.3,60,19.0,29.0,0.0,0.0,0.0,0.0,3,1018.6,986.6,94,100,7,0,0.38,1.44,11.3,14.8,233,231,27.0,27.2,23.6,22.5,19.3,0.101,0.154,0.227,0.32,1,3600.0,515.4,198.3,317.1,243.2,515.4,1089.0,486.0,187.0,299.0,243.2,486.0,1026.9,Tracheophyta; Magnoliopsida; Eucalyptus L'Hér.; Pinus pinaster Aiton; Vitis vinifera L.; 
2023,2023-08-19,Faro,Albufeira,Albufeira,Estrada de Vale Pedras,37.1019444444444,-8.24527777777778,Desconhecida,68.0,2023-08-19T17:00,33.8,37,17.1,34.2,0.0,0.0,0.0,0.0,1,1015.4,1007.7,20,0,0,68,0.46,3.31,14.2,19.2,261,276,36.0,36.5,29.7,27.9,23.4,0.114,0.13,0.136,0.158,1,3600.0,393.1,308.8,84.3,688.1,393.1,599.3,471.0,370.0,101.0,688.1,471.0,718.1,Magnoliopsida; Tracheophyta; Olea europaea L.
2023,2023-08-19,Porto,Póvoa de Varzim,Laundos,Laundos/Pé do Monte (Igreja),41.4296869998508,-8.72154799991184,NC,64.0,2023-08-19T17:00,20.7,95,19.8,24.0,0.0,0.0,0.0,0.0,3,1019.8,1012.2,92,100,0,7,0.1,0.12,3.4,3.8,328,343,14.0,23.6,22.9,22.1,19.4,0.323,0.167,0.197,0.312,1,0.0,121.5,19.4,102.1,43.2,121.5,600.3,144.0,23.0,121.0,43.2,144.0,711.3,Eucalyptus L'Hér.; Tracheophyta; Pinus pinaster Aiton; Magnoliopsida
2023,2023-08-19,Leiria,Caldas da Rainha,União das Freguesias de Caldas da Rainha - Nossa Senhora do Pópulo. Coto e São Gregório,SÃO GREGÓRIO,39.3343200000127,-9.36775200002723,Desconhecida,0.0,2023-08-19T20:00,22.2,93,20.9,25.3,0.0,0.0,0.0,0.0,3,1019.4,1019.4,90,100,0,0,0.02,0.2,8.2,12.2,308,313,18.0,29.8,26.6,23.5,21.4,0.038,0.061,0.117,0.206,0,0.0,0.0,0.0,0.0,0.0,0.0,0.0,4.0,0.0,4.0,0.0,4.0,40.6,Magnoliopsida
2023,2023-08-19,Porto,Amarante,Telões,Lugar da Granja (Crasto),41.324617000156,-8.11433199988471,Reacendimento,340.0,2023-08-19T21:00,22.3,84,19.6,25.6,0.0,0.0,0.0,0.0,2,1020.7,981.5,67,74,0,0,0.0,0.42,2.5,2.9,278,270,10.8,24.9,24.6,22.2,18.9,0.113,0.146,0.217,0.311,0,0.0,0.0,0.0,0.0,0.0,0.0,0.0,0.0,0.0,0.0,0.0,0.0,0.0,Magnoliopsida; Pinus pinaster Aiton; Tracheophyta; Vitis vinifera L.; Eucalyptus L'Hér.; ; Castanea sativa Mill.
2023,2023-08-20,Lisboa,Sintra,Algueirão-mem Martins,Estrada de Mercês (Algueirão-Mem Martins),38.8002800000045,-9.33222000016107,Desconhecida,181.0,2023-08-20T01:00,21.2,98,20.8,23.9,0.0,0.0,0.0,0.0,3,1019.2,998.1,90,100,0,0,0.0,0.05,10.8,19.7,345,352,20.5,23.4,24.8,22.4,19.9,0.141,0.173,0.217,0.314,0,0.0,0.0,0.0,0.0,0.0,0.0,0.0,0.0,0.0,0.0,0.0,0.0,0.0,Tracheophyta; Magnoliopsida; Pinales; 
2023,2023-08-20,Lisboa,Sintra,Rio de Mouro,JT A ESCOLA PRIMARIA  DAS BANDEIRINHA (Rio de Mouro-Estação),38.7830840004815,-9.32190600024329,Desconhecida,148.0,2023-08-20T03:00,21.1,96,20.5,23.5,0.0,0.0,0.0,0.0,3,1019.0,1001.7,92,100,0,8,0.0,0.09,11.7,20.2,351,355,22.0,23.1,24.8,22.6,20.1,0.141,0.173,0.217,0.314,0,0.0,0.0,0.0,0.0,0.0,0.0,0.0,0.0,0.0,0.0,0.0,0.0,0.0,Tracheophyta; Magnoliopsida; Pinales; 
2023,2023-08-20,Porto,Vila Nova de Gaia,Vila Nova de Gaia (Santa Marinha),Serra do Pilar (Rua do Casino da Ponte),41.1388469998042,-8.60704200002882,Desconhecida,41.0,2023-08-20T08:00,21.1,88,19.0,23.3,0.0,0.0,0.0,0.0,1,1020.6,1015.8,27,30,0,0,0.1,0.3,8.3,12.2,326,341,18.4,21.8,23.0,22.2,19.6,0.127,0.145,0.193,0.321,1,3600.0,222.5,106.7,115.8,266.9,222.5,534.0,171.0,82.0,89.0,266.9,171.0,410.4,Magnoliopsida; Tracheophyta
2023,2023-08-20,Aveiro,Arouca,Moldes,Fuste-Capela de Santa Catarina (Fuste),40.9002029999925,-8.21947200006909,Desconhecida,606.0,2023-08-20T09:00,23.0,71,17.5,25.5,0.0,0.0,0.0,0.0,0,1021.4,952.9,0,0,0,0,0.27,0.81,1.6,2.3,333,342,12.6,23.5,22.8,21.1,17.9,0.124,0.138,0.198,0.328,1,3600.0,493.0,385.5,107.5,670.9,493.0,767.6,422.0,330.0,92.0,670.9,422.0,657.1,Eucalyptus L'Hér.; Magnoliopsida; Pinus pinaster Aiton; Quercus L.; Tracheophyta
2023,2023-08-20,Lisboa,Loures,Lousa,Casais do Forno (Casal do Forno),38.9075320000119,-9.21446599960327,Desconhecida,194.0,2023-08-20T10:00,26.4,59,17.9,27.4,0.0,0.0,0.0,0.0,0,1020.6,998.3,12,1,0,36,0.42,1.4,13.9,17.8,350,352,31.0,26.5,25.0,23.1,20.3,0.108,0.154,0.194,0.301,1,3600.0,655.3,522.2,133.1,728.7,655.3,957.4,591.0,471.0,120.0,728.7,591.0,863.4,Tracheophyta; Magnoliopsida; Pinus pinaster Aiton; Eucalyptus L'Hér.; Pinales; 
2023,2023-08-20,Porto,Paredes,Vandoma,Senhora do Bom Sucesso,41.2075,-8.39027777777778,Desconhecida,394.0,2023-08-20T12:00,28.2,46,15.3,30.8,0.0,0.0,0.0,0.0,0,1020.5,976.1,0,0,0,0,0.59,2.08,6.1,7.1,310,311,19.8,29.2,23.0,21.5,18.3,0.105,0.152,0.22,0.315,1,3600.0,849.9,738.9,111.0,852.3,849.9,1158.2,827.0,719.0,108.0,852.3,827.0,1127.0,Magnoliopsida; Pinus pinaster Aiton; Eucalyptus L'Hér.; Tracheophyta; Vitis vinifera L.
2023,2023-08-20,Porto,Amarante,Louredo,LOUREDO (Santa Cruz),41.2505370000005,-8.12747499995761,Reacendimento,416.0,2023-08-20T13:00,29.8,37,13.7,31.7,0.0,0.0,0.0,0.0,0,1020.2,973.7,0,0,0,0,0.65,2.64,8.1,10.0,291,291,23.4,31.3,23.4,21.7,18.4,0.102,0.155,0.227,0.319,1,3600.0,860.3,750.5,109.8,860.6,860.3,1165.0,862.0,752.0,110.0,860.6,862.0,1167.3,Tracheophyta; Magnoliopsida; Eucalyptus L'Hér.; Pinus pinaster Aiton; Vitis vinifera L.; 
2023,2023-08-20,Porto,Penafiel,Pinheiro,Jugueiros (Várzea),41.1159770001305,-8.29011499987708,Desconhecida,158.0,2023-08-20T15:00,31.1,48,18.7,33.9,0.0,0.0,0.0,0.0,0,1019.4,1001.5,8,0,0,27,0.59,2.35,11.3,13.5,297,299,28.4,34.7,25.8,23.2,20.0,0.103,0.15,0.218,0.316,1,3600.0,712.2,615.7,96.5,835.4,712.2,984.7,760.0,657.0,103.0,835.4,760.0,1050.7,Tracheophyta; Eucalyptus L'Hér.; Magnoliopsida
2023,2023-08-20,Porto,Baião,Campelo,R Camões (Fervenças),41.1659020000034,-8.03142299969991,Desconhecida,547.0,2023-08-20T16:00,29.3,42,15.2,29.9,0.0,0.0,0.0,0.0,0,1019.6,958.9,12,0,0,41,0.49,2.35,10.8,13.7,296,297,30.2,32.6,24.0,21.2,18.0,0.108,0.155,0.228,0.322,1,3600.0,565.9,479.8,86.1,796.9,565.9,804.3,631.0,535.0,96.0,796.9,631.0,896.9,Tracheophyta; Pinus pinaster Aiton; Magnoliopsida; Eucalyptus L'Hér.; Pinales; Quercus L.; Vitis vinifera L.; 
2023,2023-08-20,Leiria,Marinha Grande,Marinha Grande,Picassinos,39.7251819997364,-8.91466199980842,Desconhecida,119.0,2023-08-20T17:00,24.4,60,16.2,24.0,0.0,0.0,0.0,0.0,0,1019.7,1005.9,18,0,0,59,0.34,1.22,17.3,23.0,339,343,38.9,31.8,25.6,22.0,19.4,0.056,0.064,0.086,0.186,1,3600.0,397.8,307.8,90.0,682.6,397.8,602.5,473.0,366.0,107.0,682.6,473.0,716.4,Pinus pinaster Aiton; Tracheophyta; Eucalyptus L'Hér.
2023,2023-08-20,Lisboa,Cascais,Alcabideche,Manique (Bairro das Barrizes),38.7366390000449,-9.37058700005213,Desconhecida,97.0,2023-08-20T17:00,26.8,52,16.1,26.1,0.0,0.0,0.0,0.0,1,1018.8,1007.6,26,0,0,86,0.39,1.7,19.6,28.2,347,350,41.0,31.1,25.9,23.0,20.5,0.136,0.172,0.217,0.314,1,3600.0,414.2,334.2,80.0,729.8,414.2,611.8,492.0,397.0,95.0,729.8,492.0,726.7,Tracheophyta; Eucalyptus L'Hér.; Magnoliopsida; Pinus pinea L.; Pinus pinaster Aiton; Pinales; Vitis vinifera L.; 
2023,2023-08-20,Porto,Amarante,Telões,rua de catatem . Portugal (Lamaceiro),41.3113430002001,-8.1143569999271,Desconhecida,296.0,2023-08-20T17:00,29.6,42,15.2,29.7,0.0,0.0,0.0,0.0,1,1019.3,985.9,29,0,0,96,0.38,2.41,10.7,13.8,310,311,23.4,33.1,25.5,22.6,19.3,0.105,0.148,0.217,0.31,1,3600.0,387.9,312.4,75.6,710.9,387.9,587.1,462.0,372.0,90.0,710.9,462.0,699.1,Magnoliopsida; Pinus pinaster Aiton; Tracheophyta; Vitis vinifera L.; Eucalyptus L'Hér.; 
2023,2023-08-20,Porto,Vila Nova de Gaia,Vila Nova de Gaia (Santa Marinha),Lugar Cabo Simão (Rua do Casino da Ponte),41.1392469999525,-8.60734499984317,Desconhecida,0.0,2023-08-20T17:00,24.5,69,18.4,24.9,0.0,0.0,0.0,0.0,0,1019.8,1019.8,15,0,0,51,0.31,0.96,18.5,26.5,323,329,37.1,29.8,24.6,22.5,19.9,0.125,0.147,0.194,0.321,1,3600.0,389.8,310.7,79.1,697.4,389.8,595.1,463.0,369.0,94.0,697.4,463.0,706.9,Tracheophyta; Magnoliopsida
2023,2023-08-20,Porto,Maia,Barca,Lugar de Mandim (Rua do Vieiro),41.2542919998699,-8.62833200030857,NC,110.0,2023-08-20T18:00,22.6,71,17.0,22.4,0.0,0.0,0.0,0.0,0,1019.8,1006.9,5,0,0,16,0.2,0.81,18.6,30.9,328,335,36.0,28.7,24.4,22.0,19.3,0.128,0.138,0.175,0.318,1,3600.0,205.9,149.8,56.1,572.2,205.9,349.8,279.0,203.0,76.0,572.2,279.0,474.0,Tracheophyta; Eucalyptus L'Hér.; Pinus pinaster Aiton; Magnoliopsida
